segmentnr	original	analyzed	folio	translated
['BO_T02_D1182:253a-24']	ces pa ni gnyis ldan gyi rgyud ni rnal 'byor bla na med pa'i rgyud de /	ces pa ni gnyis ldan gyi rgyud ni rnal 'byor bla na med pa'i rgyud de /	253a	The Tantra of the Union of the Two is the Yoga Tantra of Unsurpassed Meaning.
['BO_T02_D1182:253a-25']	de rnam par dag pa dbang bzhi pa'o //	de rnam par dag pa dbang bzhi pa'o //	253a	Its purification is the fourth initiation.
['BO_T02_D1182:253a-26']	dbang ni zhes pa go sla'o //	dbang ni zhes pa go sla'o //	253a	The initiation is easy to understand.
['BO_T02_D1182:253a-27']	bkrus dang zhes bya ba la sogs pas ni dbang gi don gsungs pa ste /	bkrus dang zhes bya ba la sogs pas ni dbang gi don gsungs pa ste /	253a	The meaning of the initiation is stated by “washing” and so forth.
['BO_T02_D1182:253a-28']	bkrus dang zhes pa ni 'khru bar byed pa ste /	bkrus dang zhes pa ni 'khru bar byed pa ste /	253a	“Washing” is to wash,
['BO_T02_D1182:253a-29']	sems dag par byed pa dbang bskur ba 'dis so //	sems dag par byed pa dbang bskur ba 'dis so //	253a	to purify the mind by this initiation.
['BO_T02_D1182:253a-30']	de yang 'dis nyon mongs pa'i sgrib pa sel bar byed pa'o //	de yang 'dis nyon mongs pa'i sgrib pa sel bar byed pa'o //	253a	Moreover, this removes the obscuration of afflictions.
['BO_T02_D1182:253a-31']	lag pa dag gis yang dga' 'khyud //	lag pa dag gis yang dga' 'khyud //	253a	With the hands, there is a true embrace.
['BO_T02_D1182:253a-32']	ces pa ni yi ge bdun gyi tshig ste /	ces pa ni yi ge bdun gyi tshig ste /	253a	This is the verse of the seven syllables.
['BO_T02_D1182:253a-33']	'khyud pa las mngon sum nyid du lhag par mos pa nyid do //	'khyud pa las mngon sum nyid du lhag par mos pa nyid do //	253a	From the embrace, there is the imagination of the reality of the deity.
['BO_T02_D1182:253a-34']	shin tu bzhin bzangs zhes bya ba la sogs pa la /	shin tu bzhin bzangs zhes bya ba la sogs pa la /	253a	With a very beautiful face, etc.
['BO_T02_D1182:253b-0']	rigs rnam pa lnga'i nang nas de lta bu'i rnam pa can bsten pa nyid ni bsten pa las phun sum tshogs pa dang ldan pa'i byang chub kyi sems nyid rgan po dang srin lag dag gis rdo rje @253b nor bu gzung ste slob ma'i khar ltung bar byed	rigs rnam pa lnga'i nang nas de lta bu'i rnam pa can bsten pa nyid ni bsten pa las phun sum tshogs pa dang ldan pa'i byang chub kyi sems nyid rgan po dang srin lag dag gis rdo rje @253b nor bu gzung ste slob ma'i khar ltung bar byed	253b	From among the five types of families, the one with that aspect is the one to be attended. The perfection of attendance is the enlightenment mind itself. With the ring fingers, one should hold the vajra and the jewel and cause them to fall into the mouth of the disciple.
['BO_T02_D1182:253b-1']	pa ni gsang ba'i dbang zhes bya'o //	pa ni gsang ba'i dbang zhes bya'o //	253b	This is called the secret empowerment.
['BO_T02_D1182:253b-2']	shes rab ces bya ba la sogs pas ni shes rab ye shes kyi dbang bstan to //	shes rab ces bya ba la sogs pas ni shes rab ye shes kyi dbang bstan to //	253b	With wisdom, etc., the wisdom-knowledge empowerment is taught.🔽What is to be said and entrusted?
['BO_T02_D1182:253b-3']	ci brjod cing gtad par bya zhe na gsungs pa /	ci brjod cing gtad par bya zhe na gsungs pa /	253b	It is said:
['BO_T02_D1182:253b-4']	ston pas zhes bya ba la sogs pa'o //	ston pas zhes bya ba la sogs pa'o //	253b	The Teacher, etc.
['BO_T02_D1182:253b-5']	bla mas bstod pa'i tshe gang brjod par bya ba bstan pa'i don du gsungs pa /	bla mas bstod pa'i tshe gang brjod par bya ba bstan pa'i don du gsungs pa /	253b	When the guru praises, he says this for the sake of teaching what is to be expressed.
['BO_T02_D1182:253b-6']	shes nas ni zhes bya ba la sogs pa'o //	shes nas ni zhes bya ba la sogs pa'o //	253b	 Knowing, etc.
['BO_T02_D1182:253b-7']	gnang ba sbyin pa cis she na /	gnang ba sbyin pa cis she na /	253b	 By what is the permission given?
['BO_T02_D1182:253b-8', 'BO_T02_D1182:253b-9']	gsungs pa kun du ru gyis rdo rje 'dzin //🔽zhes pa ste /	gsungs pa kun du ru gyis rdo rje 'dzin // zhes pa ste /	253b	 It is said, Hold the vajra, O Vajradhara!
['BO_T02_D1182:253b-10']	bla mas brjod ces par dgongs so /	bla mas brjod ces par dgongs so /	253b	 The guru is meant by says.
['BO_T02_D1182:253b-11']	kye bcom ldan 'das zhes pa nas bsgral zhing bskyabs pa zhes pa'i mthar thug pa'i gzhung ni gsol ba gdab pa'i don to //	kye bcom ldan 'das zhes pa nas bsgral zhing bskyabs pa zhes pa'i mthar thug pa'i gzhung ni gsol ba gdab pa'i don to //	253b	 The text from O Bhagavān up to liberate and protect is for the sake of supplicating.
['BO_T02_D1182:253b-12']	lhag ma ni go sla'o //	lhag ma ni go sla'o //	253b	 The rest is easy to understand.
['BO_T02_D1182:253b-13']	slob mas mchod pa 'di rnams ni yi ge bdun gyi tshig go //	slob mas mchod pa 'di rnams ni yi ge bdun gyi tshig go //	253b	 These offerings of the disciple are the words of the seven syllables.
['BO_T02_D1182:253b-14']	ston pa zhes bya ba la sogs pa'i tshig gis ni dbang bzhi pa gsungs pa'o //	ston pa zhes bya ba la sogs pa'i tshig gis ni dbang bzhi pa gsungs pa'o //	253b	 With the words teacher, etc., the fourth empowerment is taught.
['BO_T02_D1182:253b-15']	dkyil 'khor 'khor lo la sogs thabs kyis zhes pa la /	dkyil 'khor 'khor lo la sogs thabs kyis zhes pa la /	253b	 The method of the maṇḍalacakra, etc.
['BO_T02_D1182:253b-16']	sogs zhes pa'i sgras ni thabs dang shes rab ston par byed pa'i thabs so //	sogs zhes pa'i sgras ni thabs dang shes rab ston par byed pa'i thabs so //	253b	 The word etc. indicates the method of teaching method and wisdom.
['BO_T02_D1182:253b-17']	da ni rdo rje snying pos 'dri ba gsungs pa /	da ni rdo rje snying pos 'dri ba gsungs pa /	253b	 Now, Vajragarbha speaks the question:
['BO_T02_D1182:253b-18']	des na zhes pa la sogs pa ste /	des na zhes pa la sogs pa ste /	253b	Therefore, etc.
['BO_T02_D1182:253b-19']	bzod pa ni srid mo rnams la bzod par gsol bar bstan pa'i don to //	bzod pa ni srid mo rnams la bzod par gsol bar bstan pa'i don to //	253b	Patience is taught as requesting forbearance from the mothers.
['BO_T02_D1182:253b-20']	bcom ldan 'das bdag ni 'khrul gyur pas //	bcom ldan 'das bdag ni 'khrul gyur pas //	253b	Bhagavat, I have erred.
['BO_T02_D1182:253b-21']	ji ltar rigs par bshad du gsol //	ji ltar rigs par bshad du gsol //	253b	Please explain as is appropriate.
['BO_T02_D1182:253b-22']	zhes pa'i mang po'i tshig ni gus par shes par bya ba nyid do //	zhes pa'i mang po'i tshig ni gus par shes par bya ba nyid do //	253b	The plural word is to be understood as respectful.
['BO_T02_D1182:253b-23']	dkyil ni snying po zhes brjod de //	dkyil ni snying po zhes brjod de //	253b	The center is called the essence.
['BO_T02_D1182:253b-24']	zhes pa ni ji ltar dkyil 'khor gzhan gyi snying po zhes pa'i don to //	zhes pa ni ji ltar dkyil 'khor gzhan gyi snying po zhes pa'i don to //	253b	This is the meaning of the essence of the other maṇḍalas.
['BO_T02_D1182:253b-25']	de bzhin du phung po la sogs pa'i yang dkyil lam snying po ste /	de bzhin du phung po la sogs pa'i yang dkyil lam snying po ste /	253b	In the same way, the aggregates and so on are the center or essence.🔽What is that?
['BO_T02_D1182:253b-26']	cis she na gsungs pa /	cis she na gsungs pa /	253b	It is said:
['BO_T02_D1182:253b-27']	byang chub sems ni bde chen po //	byang chub sems ni bde chen po //	253b	Bodhicitta is great bliss.
['BO_T02_D1182:253b-28']	zhes pa'o // de len par byed pas na zhes pa ni de len cing 'dzin par byed pas na dkyil 'khor te /	zhes pa'o // de len par byed pas na zhes pa ni de len cing 'dzin par byed pas na dkyil 'khor te /	253b	Since it takes that, it is a maṇḍala.
['BO_T02_D1182:253b-29']	snying po len pas na dkyil 'khor zhes dgongs so //	snying po len pas na dkyil 'khor zhes dgongs so //	253b	Since it takes the essence, it is a maṇḍala.
['BO_T02_D1182:253b-30']	de ci zhe na gsungs pa /	de ci zhe na gsungs pa /	253b	What is that? It is said:
['BO_T02_D1182:253b-31']	'dus pa zhes pa ste /	'dus pa zhes pa ste /	253b	The assembly.
['BO_T02_D1182:253b-32']	lha rnams 'dus pa zhes dgongs so //	lha rnams 'dus pa zhes dgongs so //	253b	The assembly of deities is intended.
['BO_T02_D1182:253b-33']	de nyid ji ltar dkyil 'khor yin //	de nyid ji ltar dkyil 'khor yin //	253b	How is that itself a mandala?
['BO_T02_D1182:253b-34']	zhe na gsungs pa /	zhe na gsungs pa /	253b	He says:
['BO_T02_D1182:253b-35']	'khor lo zhes pa la sogs pa ste /	'khor lo zhes pa la sogs pa ste /	253b	The wheel, etc.
['BO_T02_D1182:253b-36']	rgyun gnas ni phung po lnga'o //	rgyun gnas ni phung po lnga'o //	253b	The “continuum” is the five aggregates.
['BO_T02_D1182:253b-37']	khams zhes pa ni sa la sogs pa'o //	khams zhes pa ni sa la sogs pa'o //	253b	The “elements” are earth, etc.
['BO_T02_D1182:253b-38']	aa ksha'i sgra ni dbang po rnams so //	aa ksha'i sgra ni dbang po rnams so //	253b	The term “sense-spheres” is the sense-faculties.
['BO_T02_D1182:254a-0']	yul ni gzugs la @254a * //	yul ni gzugs la @254a * //	254a	The “objects” are form, etc.🔽Thus, the “continuum” is that which is made up of the aggregates, elements, sense-faculties, objects, etc.
['BO_T02_D1182:254a-1']	sogs pa'o // des na rgyun gnas pa phung po dang / khams dang / dbang po dang / yul la sogs par gyur pa gang yin pa de rnams dang / de bzhin du 'dod chags dang / zhes sdang la sogs pa nyon mongs pa de dag go //	sogs pa'o // des na rgyun gnas pa phung po dang / khams dang / dbang po dang / yul la sogs par gyur pa gang yin pa de rnams dang / de bzhin du 'dod chags dang / zhes sdang la sogs pa nyon mongs pa de dag go //	254a	And likewise, the “afflictions” are desire, hatred, etc.
['BO_T02_D1182:254a-2']	rnam par sbyong ba de ni de rnams kyi dri ma gcod par byed pa nyid ni rnam par sbyong ba ste 'khor lo'o //	rnam par sbyong ba de ni de rnams kyi dri ma gcod par byed pa nyid ni rnam par sbyong ba ste 'khor lo'o //	254a	The “purification” is the very cutting off of their stains, which is the wheel.
['BO_T02_D1182:254a-3']	rnam par sbyang ba yang gsungs pa dang / 'chad par 'gyur ba ste /	rnam par sbyang ba yang gsungs pa dang / 'chad par 'gyur ba ste /	254a	Purification is also mentioned and will be mentioned.
['BO_T02_D1182:254a-4']	de la rnam par shes pa'i phung po thams cad nges par rnam par shes pa dag go //	de la rnam par shes pa'i phung po thams cad nges par rnam par shes pa dag go //	254a	Therein, all the aggregates of consciousness are definitely the consciousnesses.
['BO_T02_D1182:254a-5']	des na dkyil 'khor yang yin la 'khor lo yang yin pas dkyil 'khor 'khor lo'o //	des na dkyil 'khor yang yin la 'khor lo yang yin pas dkyil 'khor 'khor lo'o //	254a	Therefore, it is a mandala and also a wheel, so it is a mandala-wheel.
['BO_T02_D1182:254a-6']	de'i don ni 'di yin te /	de'i don ni 'di yin te /	254a	The meaning of this is as follows.
['BO_T02_D1182:254a-7']	lha rnams tshogs pa'i snying po len pa'i dkyil 'khor nyid kyis 'dir tshogs rnam par dag pa nyid kyi dkyil 'khor zhes par thob pa'o //	lha rnams tshogs pa'i snying po len pa'i dkyil 'khor nyid kyis 'dir tshogs rnam par dag pa nyid kyi dkyil 'khor zhes par thob pa'o //	254a	The essence of the gods' assembly is the mandala itself, and here the mandala is obtained as the mandala of the purity of the assembly.
['BO_T02_D1182:254a-8']	'o na bde chen po zhes bya ba'i snying po ji ltar len par byed ce na /	'o na bde chen po zhes bya ba'i snying po ji ltar len par byed ce na /	254a	Well then, how does one take up the essence called great bliss?
['BO_T02_D1182:254a-9']	po la ka kko la sbyor bas /	po la ka kko la sbyor bas /	254a	By the union of po and ka,
['BO_T02_D1182:254a-10']	de yi bde ba shes par 'gyur //	de yi bde ba shes par 'gyur //	254a	one will know its bliss.
['BO_T02_D1182:254a-11']	zhes pa'o // lhag ma ni go sla'o //	zhes pa'o // lhag ma ni go sla'o //	254a	The rest is easy to understand.
['BO_T02_D1182:254a-12']	lha mo thams cad dga' bar 'gyur //	lha mo thams cad dga' bar 'gyur //	254a	All goddesses will be delighted.
['BO_T02_D1182:254a-13']	zhes pa ni rangs par 'gyur pa'o //	zhes pa ni rangs par 'gyur pa'o //	254a	This means they will be pleased.
['BO_T02_D1182:254a-14']	spyod pa'i dus su bza' ba la sogs pa mdor bstan pa'i bshad pa ni /	spyod pa'i dus su bza' ba la sogs pa mdor bstan pa'i bshad pa ni /	254a	The explanation of the brief indication of eating and so forth at the time of conduct is
['BO_T02_D1182:254a-15']	bza' btung zhes bya ba la sogs pa'o //	bza' btung zhes bya ba la sogs pa'o //	254a	eating, drinking, and so forth.
['BO_T02_D1182:254a-16']	dogs pa med pa'i sems kyis zhes pa ni gnyis spangs pa'o //	dogs pa med pa'i sems kyis zhes pa ni gnyis spangs pa'o //	254a	With a fearless mind means free of the two.
['BO_T02_D1182:254a-17']	de skad du yang /	de skad du yang /	254a	And thus:
['BO_T02_D1182:254a-18']	thabs dang shes rab sems kyis ni //	thabs dang shes rab sems kyis ni //	254a	With the mind of method and wisdom,
['BO_T02_D1182:254a-19']	mi bza' cung zad yod  ma yin //	mi bza' cung zad yod  ma yin //	254a	There is not even a little food for humans.
['BO_T02_D1182:254a-20']	rtag tu the tshom bral gyur pas //	rtag tu the tshom bral gyur pas //	254a	Always free from doubt,
['BO_T02_D1182:254a-21']	'dod pa lnga la nyer longs spyod //	'dod pa lnga la nyer longs spyod //	254a	one should enjoy the five desires.
['BO_T02_D1182:254a-22']	ces gsungs so //	ces gsungs so //	254a	It is said:
['BO_T02_D1182:254a-23']	lha 'di rnams la phyag mi bya //	lha 'di rnams la phyag mi bya //	254a	“One should not bow to these gods.”
['BO_T02_D1182:254a-24']	zhes bya ba la sogs pa ni rnal 'byor pa sems bsgom pa la chags pas phyi rol gyi lha la phyag byed pa bkag pa yin la //	zhes bya ba la sogs pa ni rnal 'byor pa sems bsgom pa la chags pas phyi rol gyi lha la phyag byed pa bkag pa yin la //	254a	This and so forth is the prohibition for the yogi who is attached to cultivating the mind to bow to external gods.
['BO_T02_D1182:254a-25']	lhag par mos par tsam la zhugs pa'i rnal 'byor bas ni ma yin te phyag bya'o //	lhag par mos par tsam la zhugs pa'i rnal 'byor bas ni ma yin te phyag bya'o //	254a	But it is not for the yogi who has entered merely the state of resolute intent, for he should bow.🔽It is said with certainty:🔽“One who is initiated into this Hevajra speaks with the language of intent.”
['BO_T02_D1182:254a-26']	dpal dgyes pa'i rdo rje dbang bskur bas dgongs pa'i skad kyis smra'o zhes pas na nges pa gsungs pa ;	dpal dgyes pa'i rdo rje dbang bskur bas dgongs pa'i skad kyis smra'o zhes pas na nges pa gsungs pa ;	254a	It is said:
['BO_T02_D1182:254a-27']	gang zhig dbang bskur dgyes rdor 'dir //	gang zhig dbang bskur dgyes rdor 'dir //	254a	“One who is initiated into this Hevajra…”
['BO_T02_D1182:254a-28']	zhes pa la sogs pa ste /	zhes pa la sogs pa ste /	254a	and so forth.
['BO_T02_D1182:254a-29']	gang dgongs pa'i skad kyis mi smra ba'i dam tshig rig pa de ni nyams par 'gyur zhes par 'brel to //	gang dgongs pa'i skad kyis mi smra ba'i dam tshig rig pa de ni nyams par 'gyur zhes par 'brel to //	254a	The pledge of the awareness that does not speak with the language of intent is impaired.
['BO_T02_D1182:254a-30']	ci zhe na gsungs pa /	ci zhe na gsungs pa /	254a	What is that? It is said:
['BO_T02_D1182:254a-31']	'tshe ba 'dir bdag ces pa la sogs pa ste /	'tshe ba 'dir bdag ces pa la sogs pa ste /	254a	“Here, I will explain the harm…” and so forth.
['BO_T02_D1182:254b-0', 'BO_T02_D1182:254b-1', 'BO_T02_D1182:254b-2']	de yang / char mi 'bab @254b cing char ches pas /🔽byi ba ni tsho chag pa //🔽thog ser 'di drug blo ldan gyis //	de yang / char mi 'bab @254b cing char ches pas / byi ba ni tsho chag pa // thog ser 'di drug blo ldan gyis //	254b	the lack of rain and too much rain🔽are the six calamities of mice.🔽The wise know that these six
['BO_T02_D1182:254b-3']	mtshungs pa nyid du 'tshe bar shes //	mtshungs pa nyid du 'tshe bar shes //	254b	are the same in terms of harm.
['BO_T02_D1182:254b-4']	zhes pa la sogs pa'i mtshan nyid can no //	zhes pa la sogs pa'i mtshan nyid can no //	254b	This is the definition and so forth.
['BO_T02_D1182:254b-5']	dgongs pa'i skad kyi bya ba gsungs pa /	dgongs pa'i skad kyi bya ba gsungs pa /	254b	The activity of the language of intention is stated:
['BO_T02_D1182:254b-6']	rang rig dam tshig rnyed nas //	rang rig dam tshig rnyed nas //	254b	Having attained the pledge of self-awareness,
['BO_T02_D1182:254b-7']	zhes pa'o // gzhan yang 'tshe ba de rnams 'ba' zhig ma yin pa dag gis kyang 'joms so zhes brjod pa'o //	zhes pa'o // gzhan yang 'tshe ba de rnams 'ba' zhig ma yin pa dag gis kyang 'joms so zhes brjod pa'o //	254b	Moreover, it is said that those who are harmed are not only those, but also others.
['BO_T02_D1182:254b-8']	dgongs pa'i skad dang ldan pa'i rnal 'byor ma rnams kyis 'tshe bar byed ces bstan pa'i don du /	dgongs pa'i skad dang ldan pa'i rnal 'byor ma rnams kyis 'tshe bar byed ces bstan pa'i don du /	254b	In order to teach that the yoginīs who possess the language of intention harm,
['BO_T02_D1182:254b-9', 'BO_T02_D1182:254b-10']	de'i tshe na zhes bya ba la sogs pa ste /🔽gnas bzhi las skyes zhes pa ni sprul pa dang / chos dang / longs spyod dang ; bde ba chen po'i 'khor lo rnams su rtsa'i gzugs kyis sam /	de'i tshe na zhes bya ba la sogs pa ste / gnas bzhi las skyes zhes pa ni sprul pa dang / chos dang / longs spyod dang ; bde ba chen po'i 'khor lo rnams su rtsa'i gzugs kyis sam /	254b	[the Bhagavān] declares “at that time” and so forth.
['BO_T02_D1182:254b-11']	byang chub kyis sems kyi gzugs kyis gnas pa'i rnal 'byor ma'o //	byang chub kyis sems kyi gzugs kyis gnas pa'i rnal 'byor ma'o //	254b	“Born from the four places” means the yoginīs who abide in the form of the nāḍīs or in the form of bodhicitta in the emanation, dharma, enjoyment, and great-bliss cakras.
['BO_T02_D1182:254b-12']	rgyud thams cad kyi gleng gzhi dang dgongs pa'i skad gang du ston par byed pa de la yang /	rgyud thams cad kyi gleng gzhi dang dgongs pa'i skad gang du ston par byed pa de la yang /	254b	Also, in regard to that which is taught in the nidāna and the intention of all tantras,
['BO_T02_D1182:254b-13']	rgyud thams cad kyi gleng gzhi dang gsang ba'i skad ces bya ba'i le'u'o //	rgyud thams cad kyi gleng gzhi dang gsang ba'i skad ces bya ba'i le'u'o //	254b	it is the chapter called the nidāna of all tantras and the secret language.
['BO_T02_D1182:254b-14']	de dag ni dgyes pa'i rdo rje'i rnam par 'grel pa las brtag pa gnyis pa'i le'u gsum pa'o /	de dag ni dgyes pa'i rdo rje'i rnam par 'grel pa las brtag pa gnyis pa'i le'u gsum pa'o /	254b	Those are the three chapters of the second section in the commentary on the tantra of Hevajra.
['BO_T02_D1182:254b-15']	// / da ni yang spyod pa'i le'ur glu dang gar la sogs pa mdor bstan pa'i bshad pa dang / rgyu thams cad kyi phyag rgya bsdus pa'i don gyi le'u gsungs pa //	// / da ni yang spyod pa'i le'ur glu dang gar la sogs pa mdor bstan pa'i bshad pa dang / rgyu thams cad kyi phyag rgya bsdus pa'i don gyi le'u gsungs pa //	254b	Now, in the chapter on conduct, the explanation of the brief teaching on song, dance, and so on, and the chapter on the meaning of the collection of all the causes of the seal is stated.
['BO_T02_D1182:254b-16']	de nas zhes bya ba la sogs pa la /	de nas zhes bya ba la sogs pa la /	254b	Then, and so on.
['BO_T02_D1182:254b-17']	de nas zhes pa ni gleng gzhi'i tshig dang // dgongs pa'i skad thos pa'i rjes la'o //	de nas zhes pa ni gleng gzhi'i tshig dang // dgongs pa'i skad thos pa'i rjes la'o //	254b	Then means after hearing the words of the nidāna and the intention.
['BO_T02_D1182:254b-18']	lha dbang bskur ba las gang gsungs pa /	lha dbang bskur ba las gang gsungs pa /	254b	That which is stated from the consecration of the deity
['BO_T02_D1182:254b-19']	zhe sdang la sogs phyag rgya rnams //	zhe sdang la sogs phyag rgya rnams //	254b	is the seals of hatred and so on.
['BO_T02_D1182:254b-20']	zhes pa la /	zhes pa la /	254b	With regard to that,
['BO_T02_D1182:254b-21']	dbang bskur ni dbang bskur nas spyi bor rang gi rigs kyi bdag por gyur pa zhes pa 'dis ston pa ste /	dbang bskur ni dbang bskur nas spyi bor rang gi rigs kyi bdag por gyur pa zhes pa 'dis ston pa ste /	254b	The consecration is indicated by the words “having consecrated, the lord of one’s own family is on the crown of one’s head.”
['BO_T02_D1182:254b-22']	zhe sdang la sogs phyag rgya rnams so //	zhe sdang la sogs phyag rgya rnams so //	254b	The seals are the seals of anger, etc.
['BO_T02_D1182:254b-23']	rnam par dag pa ni rtsa rnams kyi tshogs so //	rnam par dag pa ni rtsa rnams kyi tshogs so //	254b	The purity is the collection of channels.
['BO_T02_D1182:254b-24']	re zhig dang por glu bstan par byas te /	re zhig dang por glu bstan par byas te /	254b	First of all, the song is taught.
['BO_T02_D1182:254b-25']	ko lla ae re tthi zhes bya ba la sogs pa'o //	ko lla ae re tthi zhes bya ba la sogs pa'o //	254b	It is the song beginning with “Kollā iri re tthi.”
['BO_T02_D1182:254b-26']	'dir glu'i sgra ji bzhin pa'i don ni rab tu grub pa nyid yin la /	'dir glu'i sgra ji bzhin pa'i don ni rab tu grub pa nyid yin la /	254b	Here, the literal meaning of the song is well established.
['BO_T02_D1182:254b-27']	sbas pa'i don du shes pa yang //	sbas pa'i don du shes pa yang //	254b	The hidden meaning is also to be understood.
['BO_T02_D1182:254b-28']	ko lla ai re tthi zhes pa ni spyi bo na gnas pa'o //	ko lla ai re tthi zhes pa ni spyi bo na gnas pa'o //	254b	Kollā iri re tthi is located in the crown.
['BO_T02_D1182:254b-29']	bo la can ni thabs te ham yig go //	bo la can ni thabs te ham yig go //	254b	The one with a hole is the method, the letter ha.
['BO_T02_D1182:254b-30']	mu mmu ni re ka kko la zhes pa ni lte bar gnas pa'i ka kko la can te shes rab ae yig go //	mu mmu ni re ka kko la zhes pa ni lte bar gnas pa'i ka kko la can te shes rab ae yig go //	254b	Mummumi re kakkolā is the one with a kakkola located in the navel, the wisdom letter e.
['BO_T02_D1182:254b-31']	de nas yang gsungs pa /	de nas yang gsungs pa /	254b	Then, it is also said:
['BO_T02_D1182:254b-32']	gha na kri pi ta ho b'a dzdza ae zhes pa la /	gha na kri pi ta ho b'a dzdza ae zhes pa la /	254b	Ghanakri pit aho bā jja e.
['BO_T02_D1182:255a-0']	@255a * // kri pi ta ni cang te'u te sgra'i bdag nyid kyis na sngags te cang te'u'i sgra 'dra ba nyid du brjod do //	@255a * // kri pi ta ni cang te'u te sgra'i bdag nyid kyis na sngags te cang te'u'i sgra 'dra ba nyid du brjod do //	255a	kriyā means “drum,” and since it is the nature of sound, it is mantra, which is said to be similar to the sound of a drum.
['BO_T02_D1182:255a-1']	des na gha na kri pi ta ho b'a dzdza ai zhes par sbyar te /	des na gha na kri pi ta ho b'a dzdza ai zhes par sbyar te /	255a	Therefore, it is applied as ghaṇṭā-kriyā-ho-vācayi.
['BO_T02_D1182:255a-2']	rgyun mi 'chad par brjod pa'o //	rgyun mi 'chad par brjod pa'o //	255a	It is expressed without interruption.
['BO_T02_D1182:255a-3']	de'i don ni 'di yin te /	de'i don ni 'di yin te /	255a	The meaning of that is this.
['BO_T02_D1182:255a-4']	aam dang ham zhes pa bris pa'i gzugs lta bu'i sngags rim pa ji lta bar lte ba dang spyi bor las dang nyon mongs pa'i bag chags 'joms pa'i rang bzhin du skad cig rgyun mi 'chad pa sgrogs zhes pa'o //	aam dang ham zhes pa bris pa'i gzugs lta bu'i sngags rim pa ji lta bar lte ba dang spyi bor las dang nyon mongs pa'i bag chags 'joms pa'i rang bzhin du skad cig rgyun mi 'chad pa sgrogs zhes pa'o //	255a	The mantra written as aṃ and haṃ, like the form of a written letter, is proclaimed without interruption in every moment at the navel and the crown of the head, with the nature of destroying the traces of karma and afflictions.
['BO_T02_D1182:255a-5']	k'a ru ne ki aa ai na ro l'a //	k'a ru ne ki aa ai na ro l'a //	255a	Kāruṇikāyānaroli.
['BO_T02_D1182:255a-6']	zhes pa la /	zhes pa la /	255a	In that,
['BO_T02_D1182:255a-7']	k'a ru ne ni bdud rtsi 'dzag pa'o //	k'a ru ne ni bdud rtsi 'dzag pa'o //	255a	kāruṇikā means “dripping nectar.”
['BO_T02_D1182:255a-8']	des na rol ni 'gal bar mi bya ba'o //	des na rol ni 'gal bar mi bya ba'o //	255a	Therefore, rola means “not to be contradicted.”
['BO_T02_D1182:255a-9']	de dag gis 'di skad du bstan pa yin te ;	de dag gis 'di skad du bstan pa yin te ;	255a	Those explain this:
['BO_T02_D1182:255a-10']	lte ba sprul pa'i 'khor lo'i 'dab ma'i lte ba la gnas pa'i aam yig gi thig le'i 'od zer gyis bde ba chen por gnas pa'i ham yig gi thig le bskul ba las gang bdud rtsi'i rnam pa zhu ba de nyid ni skra'i rtse mo brgya stong gi	lte ba sprul pa'i 'khor lo'i 'dab ma'i lte ba la gnas pa'i aam yig gi thig le'i 'od zer gyis bde ba chen por gnas pa'i ham yig gi thig le bskul ba las gang bdud rtsi'i rnam pa zhu ba de nyid ni skra'i rtse mo brgya stong gi	255a	The light rays of the bindu of the letter AṂ located in the center of the petals of the emanation wheel at the navel stimulate the bindu of the letter HAṂ located in the great bliss.
['BO_T02_D1182:255a-11']	cha'i tshad tsam gyis lus thams cad du khyab cing zhugs zhes pa'o //	cha'i tshad tsam gyis lus thams cad du khyab cing zhugs zhes pa'o //	255a	From that, the nectar-like substance, which is the size of one hundred thousandth of the tip of a hair, pervades and enters the entire body.
['BO_T02_D1182:255a-12']	de lta bu'i sbyor ba la goms par byas nas ci byed ce na gsungs pa /	de lta bu'i sbyor ba la goms par byas nas ci byed ce na gsungs pa /	255a	Having become familiar with such a yoga, what is done?🔽It is said:
['BO_T02_D1182:255a-13']	ta him zhes bya ba la sogs pa ste /	ta him zhes bya ba la sogs pa ste /	255a	tahim, etc.
['BO_T02_D1182:255a-14']	ta him ni der sbyor ba las goms par gnas nas so //	ta him ni der sbyor ba las goms par gnas nas so //	255a	Tahim means having become familiar with the yoga there.
