segmentnr	original	analyzed	folio	translated
['BO_T02_D1182:245b-14']	de bzhin du bdag nyid kyang ngo zhes bcom ldan 'das kyis bstan pa'i don du gsungs pa /	de bzhin du bdag nyid kyang ngo zhes bcom ldan 'das kyis bstan pa'i don du gsungs pa /	245b	so too is the nature of the self. This is the meaning of the statement of the Bhagavān.
['BO_T02_D1182:245b-15']	dngos po zhes bya ba la sogs pa ste /	dngos po zhes bya ba la sogs pa ste /	245b	The words entity and so on.
['BO_T02_D1182:245b-16']	dngos po zhes pa ni sgyu ma lta bu'i dngos por dmigs pa'o //	dngos po zhes pa ni sgyu ma lta bu'i dngos por dmigs pa'o //	245b	The word entity refers to the perception of an entity that is like an illusion.
['BO_T02_D1182:245b-17', 'BO_T02_D1182:245b-18']	dngos po med ces pa ni rang bzhin med pa nyid las so ;🔽/ dngos po rtogs phyir sangs rgyas //	dngos po med ces pa ni rang bzhin med pa nyid las so ; / dngos po rtogs phyir sangs rgyas //	245b	The words non-entity refer to the very absence of intrinsic nature.
['BO_T02_D1182:245b-19']	zhes pa ni stong pa la sogs pa'i rang bzhin gyis rtogs pa las so //	zhes pa ni stong pa la sogs pa'i rang bzhin gyis rtogs pa las so //	245b	The words because of realizing entity refer to the realization of emptiness and so on.
['BO_T02_D1182:245b-20']	rmongs pa zhas pa ni shes bya'i sgrib pas g-yogs pa'o //	rmongs pa zhas pa ni shes bya'i sgrib pas g-yogs pa'o //	245b	The words deluded refer to being covered by the obscurations to omniscience.
['BO_T02_D1182:245b-21']	le lo can zhes pa ni gzung ba la sogs par 'dzin pa la 'dug pas snyom las te /	le lo can zhes pa ni gzung ba la sogs par 'dzin pa la 'dug pas snyom las te /	245b	The words the lazy refer to those who are indolent because they are attached to grasping and so on.
['BO_T02_D1182:245b-22']	de dag gi ngo bo'o //	de dag gi ngo bo'o //	245b	That is their nature.
['BO_T02_D1182:245b-23']	des na le los bsnun pa dang // zhes pa dang / des kyang mi shes zhes sngar gyi dang 'brel to //	des na le los bsnun pa dang // zhes pa dang / des kyang mi shes zhes sngar gyi dang 'brel to //	245b	Therefore, the words struck by laziness and they do not know are connected to the previous.
['BO_T02_D1182:245b-24', 'BO_T02_D1182:245b-25']	bde ba can du zhugs zhes pa ni kun gzhi'i rnam par shes pa'i rang bzhin nyid kyis so //🔽rdo rje btsun mo'i bha ga bzang //	bde ba can du zhugs zhes pa ni kun gzhi'i rnam par shes pa'i rang bzhin nyid kyis so // rdo rje btsun mo'i bha ga bzang //	245b	The words entered the Land of Bliss refer to the nature of the ālaya consciousness.
['BO_T02_D1182:245b-26']	zhes pa ni rnam par dag pa 'di nyid las so //	zhes pa ni rnam par dag pa 'di nyid las so //	245b	The words the excellent bhaga of the Vajra Queen refer to this very purity.
['BO_T02_D1182:245b-27']	ae yi rnam pa'i cha byad gzugs //	ae yi rnam pa'i cha byad gzugs //	245b	The form of the aspect of the letter E.
['BO_T02_D1182:245b-28']	zhes pa ni sku la sogs pa'i rang bzhin gyis gru gsum gyi rnam pa nyid do //	zhes pa ni sku la sogs pa'i rang bzhin gyis gru gsum gyi rnam pa nyid do //	245b	This is the form of the triangle by the nature of the body and so forth.
['BO_T02_D1182:245b-29']	sangs rgyas rin chen za ma tog /	sangs rgyas rin chen za ma tog /	245b	The jewel casket of the Buddhas.
['BO_T02_D1182:245b-30']	ces pa ni mchog tu zad pa med pa bde ba chen po'i rang bzhin gyi dga' bas rgyas pa zhes pa ste /	ces pa ni mchog tu zad pa med pa bde ba chen po'i rang bzhin gyi dga' bas rgyas pa zhes pa ste /	245b	This is the expansion of the nature of great bliss, which is supremely inexhaustible.
['BO_T02_D1182:245b-31', 'BO_T02_D1182:246a-0']	rin po che ni rnyed par dka' bas so //🔽sangs rgyas kyang yin @246a * //	rin po che ni rnyed par dka' bas so // sangs rgyas kyang yin @246a * //	245b	It is a jewel because it is difficult to obtain.
['BO_T02_D1182:246a-1']	la rin po che yang yin pas sangs rgyas rin chen no //	la rin po che yang yin pas sangs rgyas rin chen no //	246a	It is a Buddha and it is a jewel, thus it is a Buddha jewel.
['BO_T02_D1182:246a-2']	de rnams kyi za ma tog ni gnas gzhi ste /	de rnams kyi za ma tog ni gnas gzhi ste /	246a	The casket of those is the abode.
['BO_T02_D1182:246a-3']	gang gi phyir ni nam mkha'i dbus kyi gzhal yas khang du ji ltar gnas pa'i he ru ka la sogs pa'i gzugs 'dzin cing gnas par byed pas so //	gang gi phyir ni nam mkha'i dbus kyi gzhal yas khang du ji ltar gnas pa'i he ru ka la sogs pa'i gzugs 'dzin cing gnas par byed pas so //	246a	Because it is the abode of the form of Heruka and so forth, abiding in the celestial mansion in the middle of space.🔽I am the expounder.
['BO_T02_D1182:246a-4']	'chad pa nga zhes pa ni gzhal yas khang der gnas te 'chad do //	'chad pa nga zhes pa ni gzhal yas khang der gnas te 'chad do //	246a	This is the abode in that celestial mansion and the expounding.🔽I am the Dharma.
['BO_T02_D1182:246a-5']	chos kyang nga zhes pa ni gsung rab yan lag dgu ste /	chos kyang nga zhes pa ni gsung rab yan lag dgu ste /	246a	This is the nine branches of scripture.
['BO_T02_D1182:246a-6']	de la mdo sde ni don mnga' po ston par byed pa'o //	de la mdo sde ni don mnga' po ston par byed pa'o //	246a	The Sutras are so called because they teach the meaning of the Lord.
['BO_T02_D1182:246a-7']	dbyangs kyis bsnyad pa ni gang tshig gis don brjod pa'i mthar glus 'jug cing tshigs su bcad pa blangs pas rtogs pa mang du 'phal ba de'o //	dbyangs kyis bsnyad pa ni gang tshig gis don brjod pa'i mthar glus 'jug cing tshigs su bcad pa blangs pas rtogs pa mang du 'phal ba de'o //	246a	The Ge- yas are so called because they are the many songs that are sung at the end of the teaching of the meaning by words, and are the many verses that are taken up.
['BO_T02_D1182:246a-8']	lung du bstan pa ni gang drang ba'i don gyi mdo sde dag las gang du ma 'ongs pa'i don 'byung ba la sogs pa'i sgos lung ston par byed pa de dag go //	lung du bstan pa ni gang drang ba'i don gyi mdo sde dag las gang du ma 'ongs pa'i don 'byung ba la sogs pa'i sgos lung ston par byed pa de dag go //	246a	The Vyakarana are so called because they are the predictions of the future meaning, etc. , in the Sutras of interpretable meaning.
['BO_T02_D1182:246a-9']	tshigs su bcad pa'i sde ni nges pa'i don gyi sde yis brjod pa'i don gsal bar byed pa ste tshigs gnyis la sogs pa nas tshigs su bcad pa drug gi bar du'o //	tshigs su bcad pa'i sde ni nges pa'i don gyi sde yis brjod pa'i don gsal bar byed pa ste tshigs gnyis la sogs pa nas tshigs su bcad pa drug gi bar du'o //	246a	The Gathas are so called because they clarify the meaning expressed by the Sutras of definitive meaning, from two verses up to six.
['BO_T02_D1182:246a-10']	ched du brjod pa'i sde ni 'dul ba'i bsam pas dris pa'i don kun brjod pa ni ming mchog tu gyur pa ming du yid la byas te brjod pa'o //	ched du brjod pa'i sde ni 'dul ba'i bsam pas dris pa'i don kun brjod pa ni ming mchog tu gyur pa ming du yid la byas te brjod pa'o //	246a	The Udana are so called because they are the expressions of the meaning of the questions asked with the intention of the Vinaya, by means of the supreme names that are mentally made into names.
['BO_T02_D1182:246a-11']	gleng gzhi'i sde ni nges par byed pa'i gsung dang / yul dang / dus la sogs pa'i so sor nges par brjod pa'o //	gleng gzhi'i sde ni nges par byed pa'i gsung dang / yul dang / dus la sogs pa'i so sor nges par brjod pa'o //	246a	The Nidana-vagga is the teaching of the ascertainment, and the expression of the ascertainment of the place, time, etc.
['BO_T02_D1182:246a-12']	rtogs pa brjod pa ni rtogs pa 'di dag gis nges par byed pa dag las dpes mthun pa'i don ston pa dag go //	rtogs pa brjod pa ni rtogs pa 'di dag gis nges par byed pa dag las dpes mthun pa'i don ston pa dag go //	246a	The Avadana-vagga is the teaching of the meaning of the parables by the ascertainment of these realizations.
['BO_T02_D1182:246a-13']	de lta bu byung ba'i sde ni sngon gyi byung tshul brjod pa'o //	de lta bu byung ba'i sde ni sngon gyi byung tshul brjod pa'o //	246a	The Itivrttaka-vagga is the expression of the former events.
['BO_T02_D1182:246a-14']	skyes pa rabs kyi sde ni byang chub sems dpa'i spyod pa'i gnas skabs brjod pa dag go //	skyes pa rabs kyi sde ni byang chub sems dpa'i spyod pa'i gnas skabs brjod pa dag go //	246a	The Jataka-vagga is the expression of the state of the Bodhisattva's conduct.
['BO_T02_D1182:246a-15']	shin tu rgyas pa'i sde ni byang chub sems dpa' rnams kyis bdag med pa gnyis brjod pa dang / bden pa rnam pa gnyis rab tu gsal zhing rgyas pa dag go //	shin tu rgyas pa'i sde ni byang chub sems dpa' rnams kyis bdag med pa gnyis brjod pa dang / bden pa rnam pa gnyis rab tu gsal zhing rgyas pa dag go //	246a	The Vaipulya-vagga is the expression of the two kinds of selflessness by the Bodhisattvas, and the elucidation and expansion of the two truths.
['BO_T02_D1182:246a-16']	chos rmad du byung ba'i sde ni cho 'phrul chen po ston pa rnams so //	chos rmad du byung ba'i sde ni cho 'phrul chen po ston pa rnams so //	246a	The Adbhutadharma-vagga is the teaching of the great miracles.
['BO_T02_D1182:246a-17']	gtan la phab pa bstan pa'i sde ni bshad pa rab tu gsang bar byed pa'o //	gtan la phab pa bstan pa'i sde ni bshad pa rab tu gsang bar byed pa'o //	246a	The Upadeśa-vagga is the teaching of the explanation of the secret.
['BO_T02_D1182:246a-18']	de la 'phags pa'i dge 'dun pa la chen gyi sde pa rnams kyi 'dod pa ni gleng gzhi'i sde dang / rtogs pa brjod pa dang / gtan la phab pa'i ming du byas pa'i yan lag gsum mdo sde la sogs pa'i nang du gtogs so zhes pas na 'dir yan lag bcu gnyis sam /	de la 'phags pa'i dge 'dun pa la chen gyi sde pa rnams kyi 'dod pa ni gleng gzhi'i sde dang / rtogs pa brjod pa dang / gtan la phab pa'i ming du byas pa'i yan lag gsum mdo sde la sogs pa'i nang du gtogs so zhes pas na 'dir yan lag bcu gnyis sam /	246a	The meaning of the phrase “the nature of the Dharma body” is as follows.
['BO_T02_D1182:246b-0']	yan @246b lag dgu'i chos te /	yan @246b lag dgu'i chos te /	246b	The nature of the Dharma body is the twelve branches of the scriptures, or the nine branches of the scriptures, which are the three branches called the discourses, the metrical verses, and the solemn utterances, and the nine branches called the discourses, the metrical verses, the declarations, the stanzas, the special sayings, the circumstances, the exploits, the extensive discourses, and the marvelous events.
['BO_T02_D1182:246b-1', 'BO_T02_D1182:246b-2']	de dag tu rtogs pa'i rang bzhin yang nga yin pa ste /🔽chos kyi sku'i rang bzhin zhes pa'i don to //	de dag tu rtogs pa'i rang bzhin yang nga yin pa ste / chos kyi sku'i rang bzhin zhes pa'i don to //	246b	The nature of the Dharma body is also the three vehicles, the vehicle of the disciples, the vehicle of the self-buddhas, and the vehicle of the bodhisattvas.🔽The nature of the Dharma body is also the three liberations, the liberation of emptiness, the liberation of signlessness, and the liberation of wishlessness.🔽The nature of the Dharma body is also the three concentrations, the concentration on emptiness, the concentration on wishlessness, and the concentration on signlessness.
['BO_T02_D1182:246b-3', 'BO_T02_D1182:246b-4', 'BO_T02_D1182:246b-5']	nyam pa dang zhes pa ni de lta bu'i chos nyan pa'o //🔽rang gi tshogs ldan zhes pa ni skal ba dang ldan pa'i 'khor lo bsten pa'o //🔽'dis ni longs spyod rdzogs pa'i sku'i rang bzhin du ston to //	nyam pa dang zhes pa ni de lta bu'i chos nyan pa'o // rang gi tshogs ldan zhes pa ni skal ba dang ldan pa'i 'khor lo bsten pa'o // 'dis ni longs spyod rdzogs pa'i sku'i rang bzhin du ston to //	246b	The nature of the Dharma body is also the four noble truths, the noble truths of suffering, of the origin of suffering, of the cessation of suffering, and of the path to the cessation of suffering.🔽The nature of the Dharma body is also the four formless states, the station of the infinitude of space, the station of the infinitude of consciousness, the station of nothingness, and the station of neither perception nor nonperception.🔽The nature of the Dharma body is also the four immeasurables, the immeasurable of love, the immeasurable of compassion, the immeasurable of joy, and the immeasurable of equanimity.
['BO_T02_D1182:246b-6']	chos la goms pas sgrub pa'i rang bzhin nyid du gsungs pa bsgrub bya zhes pa ste /	chos la goms pas sgrub pa'i rang bzhin nyid du gsungs pa bsgrub bya zhes pa ste /	246b	The nature of the Dharma body is also the four correct abandonings, the correct abandoning of demeritorious and nonvirtuous things that have already arisen, the correct abandoning of demeritorious and nonvirtuous things that have not yet arisen, the correct production of meritorious and virtuous things that have not yet arisen, and the correct increase of meritorious and virtuous things that have already arisen.🔽The nature of the Dharma body is also the four bases of supernormal power, the base of supernormal power that consists of concentration due to desire, the base of supernormal power that consists of concentration due to energy, the base of supernormal power that consists of concentration due to thought, and the base of supernormal power that consists of concentration due to investigation.🔽The nature of the Dharma body is also the five faculties, the faculty of faith, the faculty of energy, the faculty of mindfulness, the faculty of
['BO_T02_D1182:246b-7']	de yang 'gro ba thams cad kyi nye bar 'tsho bar mchog tu gyur pa ni zag pa med pa'i bde ba chen po'i rang bzhin nyid las so //	de yang 'gro ba thams cad kyi nye bar 'tsho bar mchog tu gyur pa ni zag pa med pa'i bde ba chen po'i rang bzhin nyid las so //	246b	Moreover, the supreme means of subsistence for all beings is from the nature of the great bliss that is uncontaminated.
['BO_T02_D1182:246b-8']	'gro ba'i ston pa zhes pa ni sna tshogs su sprul pas 'gro ba rjes su 'dzin pa'o zhes pa 'dis so //	'gro ba'i ston pa zhes pa ni sna tshogs su sprul pas 'gro ba rjes su 'dzin pa'o zhes pa 'dis so //	246b	The “teacher of the world” is the one who cares for beings by means of various emanations. This is what is said.
['BO_T02_D1182:246b-9']	des ni sprul pa'i sku'i rang bzhin du bstan to //	des ni sprul pa'i sku'i rang bzhin du bstan to //	246b	By this, he is shown to be the nature of the emanation body.
['BO_T02_D1182:246b-10']	'jig rten zhes pa ni rigs can dang rigs can ma yin par gnas pa'o //	'jig rten zhes pa ni rigs can dang rigs can ma yin par gnas pa'o //	246b	The “world” is the one who abides in the class and the one who does not abide in the class.
['BO_T02_D1182:246b-11']	'jig rten pa zhes bya ba ni rigs can dang rigs can ma yin pa la sogs pa'i tha snyad kyi lugs so ;	'jig rten pa zhes bya ba ni rigs can dang rigs can ma yin pa la sogs pa'i tha snyad kyi lugs so ;	246b	The “worldly” is the system of conventions such as the one who abides in the class and the one who does not abide in the class.
['BO_T02_D1182:246b-12']	/ yang na 'jig rten ni bskyed pa'i rjes su 'jug cing brten pa'o //	/ yang na 'jig rten ni bskyed pa'i rjes su 'jug cing brten pa'o //	246b	Or, the “world” is the one who follows and relies on the one who gives rise to the world.
['BO_T02_D1182:246b-13']	'jig rten pa ni de'i chos skye ba la sogs pa'i mtshan nyid can no //	'jig rten pa ni de'i chos skye ba la sogs pa'i mtshan nyid can no //	246b	The “worldly” is the one who has the characteristics of the phenomena of that, such as birth.
['BO_T02_D1182:246b-14']	lhan cig skyes dga'i ngo bo nga //	lhan cig skyes dga'i ngo bo nga //	246b	The nature of innate joy.
['BO_T02_D1182:246b-15']	zhes pa ni lhan cig pa nyid spros pa 'di lta bu'i dang tshul can no //	zhes pa ni lhan cig pa nyid spros pa 'di lta bu'i dang tshul can no //	246b	This is the one who has the mode of being of the innate itself, which is the mode of being of the proliferation of the world.
['BO_T02_D1182:246b-16']	de nyid ji lta bu zhe na /	de nyid ji lta bu zhe na /	246b	What is that?🔽It is said:
['BO_T02_D1182:246b-17']	gsungs pa / dga' bral nges par rdzogs pa'o zhes pa'o //	gsungs pa / dga' bral nges par rdzogs pa'o zhes pa'o //	246b	The completion of the separation from joy.
['BO_T02_D1182:246b-18']	rdzogs pa ni g-yeng pa med pa dang / phun sum tshogs pa dang / ji srid gang pa'i mthar thug pa'i bar du'o //	rdzogs pa ni g-yeng pa med pa dang / phun sum tshogs pa dang / ji srid gang pa'i mthar thug pa'i bar du'o //	246b	Completion is the absence of distraction, perfection, and the ultimate limit of the extent of the separation from joy.
['BO_T02_D1182:246b-19']	des na dga' bral las gang zhig rdzogs pa ni lhan cig skyes pa dge bar gyur pa ni nga yin no zhes dgongs so //	des na dga' bral las gang zhig rdzogs pa ni lhan cig skyes pa dge bar gyur pa ni nga yin no zhes dgongs so //	246b	Therefore, the completion of the separation from joy is the innate joy.
['BO_T02_D1182:246b-20']	yang na 'di ltar rdzogs pa'i bar du bkag pa ste /	yang na 'di ltar rdzogs pa'i bar du bkag pa ste /	246b	Or, it is said that the completion is prohibited up to this point.
['BO_T02_D1182:246b-21']	bar ram nang du chud ces brjod do //	bar ram nang du chud ces brjod do //	246b	The middle or the inside is called the completion.
['BO_T02_D1182:246b-22']	glegs bam la lar ni /	glegs bam la lar ni /	246b	In some texts,
['BO_T02_D1182:246b-23']	mchog mtha' dga' bral dang por ni //	mchog mtha' dga' bral dang por ni //	246b	the supreme limit of the separation from joy is first.
['BO_T02_D1182:246b-24']	zhes pa'i tshig go //	zhes pa'i tshig go //	246b	This is the wording.
['BO_T02_D1182:246b-25']	de lta bu'i bshad pas ni rang bzhin ji lta bur byed ce na /	de lta bu'i bshad pas ni rang bzhin ji lta bur byed ce na /	246b	What is the nature of such an explanation?🔽It is said:
['BO_T02_D1182:246b-26']	gsungs pa / dga' bral dang po zhes pa ste /	gsungs pa / dga' bral dang po zhes pa ste /	246b	The separation from joy is first.
['BO_T02_D1182:246b-27']	dga' bral yang yin la dang po yang yin pas dga' bral dang po ste /	dga' bral yang yin la dang po yang yin pas dga' bral dang po ste /	246b	It is the separation from joy and it is first, so it is the separation from joy and first.
['BO_T02_D1182:246b-28']	dga' bral de dang por byas nas lhan cig skyes pa'i rang bzhin ni nga yin no zhes dgongs so //	dga' bral de dang por byas nas lhan cig skyes pa'i rang bzhin ni nga yin no zhes dgongs so //	246b	Having first made that separation from joy, the nature of the connate is mine.
['BO_T02_D1182:246b-29']	dga' bral dang po des cir 'gyur zhe na /	dga' bral dang po des cir 'gyur zhe na /	246b	What is the result of that first separation from joy?
['BO_T02_D1182:246b-30']	gsungs pa / mchog mtha' zhes pa ste mchog dga'i mthar thug pa'o //	gsungs pa / mchog mtha' zhes pa ste mchog dga'i mthar thug pa'o //	246b	It is said: the supreme limit. The supreme limit of supreme joy.
['BO_T02_D1182:247a-0']	gnyis @247a * //	gnyis @247a * //	247a	The second
['BO_T02_D1182:247a-1']	pa'i tshig mthong bas 'dir bya'o zhes pa blang par bya'o //	pa'i tshig mthong bas 'dir bya'o zhes pa blang par bya'o //	247a	word is seen. Here it is to be taken.
['BO_T02_D1182:247a-2']	yang na 'di ltar sbyar bar bya ste /	yang na 'di ltar sbyar bar bya ste /	247a	Or it is to be applied in this way.
['BO_T02_D1182:247a-3']	gang gi rang bzhin nyid ni lhan cig skyes pa'i ye shes so //	gang gi rang bzhin nyid ni lhan cig skyes pa'i ye shes so //	247a	What is its nature? The connate gnosis.
['BO_T02_D1182:247a-4']	ci zhe na gsungs pa /	ci zhe na gsungs pa /	247a	What is that? It is said:
['BO_T02_D1182:247a-5']	mchog mtha' dga' bral dang po zhes pa ste /	mchog mtha' dga' bral dang po zhes pa ste /	247a	the supreme limit, the first separation from joy.
['BO_T02_D1182:247a-6']	dga' bral gyi pha rol du'o //	dga' bral gyi pha rol du'o //	247a	It is beyond separation from joy.
['BO_T02_D1182:247a-7']	mtha' yang mthar gyur pas na mtha' ste dga' bral nyid kyi mtho'o /	mtha' yang mthar gyur pas na mtha' ste dga' bral nyid kyi mtho'o /	247a	The limit is also the limit, the end of separation from joy.
['BO_T02_D1182:247a-8']	ci zhe na gsungs pa /	ci zhe na gsungs pa /	247a	What is that? It is said:
['BO_T02_D1182:247a-9']	dga' bral dang po zhes pa ste /	dga' bral dang po zhes pa ste /	247a	the first separation from joy.
['BO_T02_D1182:247a-10']	gang gi dga' bral dang po can ni lhan cig skyes pa'i ye shes so //	gang gi dga' bral dang po can ni lhan cig skyes pa'i ye shes so //	247a	That which has the first separation from joy is the connate gnosis.
['BO_T02_D1182:247a-11']	glegs bam la lar /	glegs bam la lar /	247a	In some texts,
['BO_T02_D1182:247a-12']	mchog mtha' dga' bral dang po can //	mchog mtha' dga' bral dang po can //	247a	the supreme limit, the first separation from joy.
['BO_T02_D1182:247a-13']	zhes pa'i tshig ste yi ge bcu'i tshig go //	zhes pa'i tshig ste yi ge bcu'i tshig go //	247a	These are the ten-syllabled words.
['BO_T02_D1182:247a-14']	de yang mchog ces pa ni mchog dga'i ye shes so //	de yang mchog ces pa ni mchog dga'i ye shes so //	247a	Moreover, “supreme” is the pristine consciousness of supreme joy.
['BO_T02_D1182:247a-15']	dga' ba zhes pa ni dang por dga' ba'i ye shes so //	dga' ba zhes pa ni dang por dga' ba'i ye shes so //	247a	“Joy” is the pristine consciousness of the joy of the first stage.
['BO_T02_D1182:247a-16']	bral ba zhes pa ni dga' bral gyi ye shes te /	bral ba zhes pa ni dga' bral gyi ye shes te /	247a	“Separation” is the pristine consciousness of the separation from joy.
['BO_T02_D1182:247a-17']	de dag gi rang bzhin ni nga yin no zhes pa ni lhag ma'o //	de dag gi rang bzhin ni nga yin no zhes pa ni lhag ma'o //	247a	“My nature” is the remainder.
['BO_T02_D1182:247a-18']	da ni bdag gi ye shes kyi rang bzhin gsungs pa /	da ni bdag gi ye shes kyi rang bzhin gsungs pa /	247a	Now, my own nature of pristine consciousness is explained:
['BO_T02_D1182:247a-19']	de bzhin zhes bya ba la sogs pa ste /	de bzhin zhes bya ba la sogs pa ste /	247a	Thus, and so on.
['BO_T02_D1182:247a-20']	de bzhin zhes pa ni kun bsdus pa yang nga yin zhes pa ste /	de bzhin zhes pa ni kun bsdus pa yang nga yin zhes pa ste /	247a	“Thus” means “I am the one who includes all.”
['BO_T02_D1182:247a-21']	gang dngos po'i de kho na nyid phul du byung bar shes pa ste ;	gang dngos po'i de kho na nyid phul du byung bar shes pa ste ;	247a	That which is known as the supreme reality of things
['BO_T02_D1182:247a-22']	de rkyen gyis khyad par du shes pa'o //	de rkyen gyis khyad par du shes pa'o //	247a	is known as a special condition.
['BO_T02_D1182:247a-23', 'BO_T02_D1182:247a-24']	ci 'dra zhes gsungs pa /🔽mun pa la ni mar me ltar //	ci 'dra zhes gsungs pa / mun pa la ni mar me ltar //	247a	What is it like?
['BO_T02_D1182:247a-25']	zhes pa ste /	zhes pa ste /	247a	It is like a butter lamp in the darkness.
['BO_T02_D1182:247a-26']	ji ltar mar me'i rang bzhin rab tu gsal bar byed cing mun pa yang sel ba dang / dngos po dag kyang rab tu gsal bar byed do //	ji ltar mar me'i rang bzhin rab tu gsal bar byed cing mun pa yang sel ba dang / dngos po dag kyang rab tu gsal bar byed do //	247a	Just as the nature of a butter lamp illuminates and removes darkness, it also illuminates things.
['BO_T02_D1182:247a-27']	de bzhin du 'phags pa'i spyod yul gyi ye shes kyang rang bzhin gsal zhing shes bya'i sgrib pa'i rab rib sel ba dang / 'phags pa'i spyod yul gyi dngos po dag kyang rang bzhin gyis gsal bar byed do //	de bzhin du 'phags pa'i spyod yul gyi ye shes kyang rang bzhin gsal zhing shes bya'i sgrib pa'i rab rib sel ba dang / 'phags pa'i spyod yul gyi dngos po dag kyang rang bzhin gyis gsal bar byed do //	247a	Likewise, the pristine wisdom that is the domain of the noble ones is naturally luminous and removes the cataracts of the obscurations to be known, and the things that are the domain of the noble ones are also naturally luminous.
['BO_T02_D1182:247a-28']	ston pa sum cu rtsa gnyis mtshan //	ston pa sum cu rtsa gnyis mtshan //	247a	The Teacher has the thirty-two marks.
['BO_T02_D1182:247a-29']	zhes bya ba ni de bzhin gshegs pa rnams kyi phyag dang zhabs kyi mthil la 'khor lo rtsibs stong dang ldan zhing mu khyud can lte ba dang bcas pa rnam pa thams cad yongs su rdzogs pas phyag dang zhabs 'khor lo'i mtshan dang ldan pa'o //	zhes bya ba ni de bzhin gshegs pa rnams kyi phyag dang zhabs kyi mthil la 'khor lo rtsibs stong dang ldan zhing mu khyud can lte ba dang bcas pa rnam pa thams cad yongs su rdzogs pas phyag dang zhabs 'khor lo'i mtshan dang ldan pa'o //	247a	The palms and soles of the Tathāgatas have wheels with a thousand spokes, with hubs and rims, complete in every way, so they have the mark of wheels on their hands and feet.
['BO_T02_D1182:247a-30']	phyag dag gi mthil mnyam zhing sa la reg pa bskum pa ma yin pa nyid do //	phyag dag gi mthil mnyam zhing sa la reg pa bskum pa ma yin pa nyid do //	247a	The palms of their hands are even and touch the ground without bending.
['BO_T02_D1182:247a-31']	zhabs dag kyang legs par gnas pa ni phyag gi mthil bzhin no //	zhabs dag kyang legs par gnas pa ni phyag gi mthil bzhin no //	247a	Their feet are well-placed, like the palms of their hands.
['BO_T02_D1182:247a-32']	ngang pa'i rgyal po ltar phyag dang zhabs kyi sor mo dra bas 'brel pas phyag dang zhabs dra bar 'brel ba'o //	ngang pa'i rgyal po ltar phyag dang zhabs kyi sor mo dra bas 'brel pas phyag dang zhabs dra bar 'brel ba'o //	247a	His hands and feet are connected by a web, like the king of geese.
['BO_T02_D1182:247a-33']	phyag dang zhabs shing bal ltar gzhon zhing mnyen pas phyag zhabs mnyen pa'o //	phyag dang zhabs shing bal ltar gzhon zhing mnyen pas phyag zhabs mnyen pa'o //	247a	His hands and feet are soft and tender, like cotton.
