segmentnr	original	analyzed	translated
['BO_T02_D1851-2:99a-13']	de ltar snang ba 'di dag lha rnams nyid du mthong ba'i lhag mar mos pa 'di ni rdzogs pa'i rim pa'i sbyor ba'o //	de ltar snang ba 'di dag lha rnams nyid du mthong ba'i lhag mar mos pa 'di ni rdzogs pa'i rim pa'i sbyor ba'o //	Seeing these appearances as the deities themselves, this is the application of the stage of completion.
['BO_T02_D1851-2:99a-14']	dogs pa med pa'i sems kyis zhes bya ba ni sangs rgyas rnams nyid de sangs rgyas ma yin pa'i dogs pa mi bya'o //	dogs pa med pa'i sems kyis zhes bya ba ni sangs rgyas rnams nyid de sangs rgyas ma yin pa'i dogs pa mi bya'o //	With a fearless mind means that one should not doubt that the Buddhas are not Buddhas.
['BO_T02_D1851-2:99a-15']	sngags ni rang gi lha'o ;	sngags ni rang gi lha'o ;	The mantra is one's deity.
['BO_T02_D1851-2:99a-16']	/ de 'di la shin tu yod pas na sngags pa ste /	/ de 'di la shin tu yod pas na sngags pa ste /	Since he has that very much, he is a mantrin.
['BO_T02_D1851-2:99a-17']	de'i nga rgyal brtan par gnas pa'o //	de'i nga rgyal brtan par gnas pa'o //	He abides in the firm pride of that.
['BO_T02_D1851-2:99a-18']	seng ge bzhin du rgyu zhes bya ba ni dogs pa med pa'i sems kyis rgyu ba'o //	seng ge bzhin du rgyu zhes bya ba ni dogs pa med pa'i sems kyis rgyu ba'o //	“Roaming like a lion” means roaming with a fearless mind.
['BO_T02_D1851-2:99a-19']	yang zhes bya ba ni gang gi phyir zhes bya ba'i don to //	yang zhes bya ba ni gang gi phyir zhes bya ba'i don to //	“Again” means “because.”
['BO_T02_D1851-2:99a-20']	'di la zhes bya ba ni rnal 'byor 'dir ro //	'di la zhes bya ba ni rnal 'byor 'dir ro //	“In this” means in this yoga.
['BO_T02_D1851-2:99a-21']	mi bya med ces bya ba dang mi bza' yod ma yin zhes bya ba ni /	mi bya med ces bya ba dang mi bza' yod ma yin zhes bya ba ni /	“There is nothing not to be done” and “there is nothing not to be eaten”
['BO_T02_D1851-2:99a-22']	lus kyi las dgag pa med pa'o //	lus kyi las dgag pa med pa'o //	means that there is no prohibition of bodily action.
['BO_T02_D1851-2:99a-23']	smra bar mi bya zhes bya ba ni ngag gi las rnams so //	smra bar mi bya zhes bya ba ni ngag gi las rnams so //	“There is nothing not to be said” means of verbal action.
['BO_T02_D1851-2:99a-24']	mi bsam pa zhes bya ba ni sems de las te /	mi bsam pa zhes bya ba ni sems de las te /	“There is nothing not to be thought” means of mental action.
['BO_T02_D1851-2:99a-25']	sku la sogs pa'i mdzad spyod yin zhes bya ba'o //	sku la sogs pa'i mdzad spyod yin zhes bya ba'o //	This is the conduct of the deeds of body and so on.
['BO_T02_D1851-2:99a-26']	mnyam par ma bzhag ces bya ba ni lhag par mos pa'i sems kyis sbyor ba ste /	mnyam par ma bzhag ces bya ba ni lhag par mos pa'i sems kyis sbyor ba ste /	“Not remaining in equipoise” means engaging with a mind of aspiration,
['BO_T02_D1851-2:99a-27']	ji skad du gsungs pa'i ting nge 'dzin to //	ji skad du gsungs pa'i ting nge 'dzin to //	which is the samādhi as it is taught.
['BO_T02_D1851-2:99a-28']	rtag pa nyid du mnyam par zhog / ces bya ba ni gang gi phyir de nyid kyis gnas pas so //	rtag pa nyid du mnyam par zhog / ces bya ba ni gang gi phyir de nyid kyis gnas pas so //	“Always remain in equipoise” means because of abiding in that.
['BO_T02_D1851-2:99a-29']	sems kun las zhes bya ba ni kha phyir bltas pa'i sems yin du zin kyang ngo //	sems kun las zhes bya ba ni kha phyir bltas pa'i sems yin du zin kyang ngo //	“With the mind in all things” means even if the mind is turned outward.
['BO_T02_D1851-2:99a-30']	gang gis spyod pa zhes bya ba ni /	gang gis spyod pa zhes bya ba ni /	By what is it called “practice”?
['BO_T02_D1851-2:99a-31']	sbyor ba gang gis spyod pa'o //	sbyor ba gang gis spyod pa'o //	By what application is it practiced.
['BO_T02_D1851-2:99a-32']	sems kun la spyod pa ni kun du spyod pa zhes bya bar dgongs so //	sems kun la spyod pa ni kun du spyod pa zhes bya bar dgongs so //	The thought is that the practice of all minds is called “practice of all.”
['BO_T02_D1851-2:99b-0']	kun du spyod pa'i zhor la de'i 'og tu sngags kyi spyod pa dris pa'i lan gsungs pa dbang po zhes bya ba la sogs pa la dbang po rnams dang yul rnams dang bcas pa'i yid kyi rkyen las byung @99b ba gang dang yin pa de ni yid yin	kun du spyod pa'i zhor la de'i 'og tu sngags kyi spyod pa dris pa'i lan gsungs pa dbang po zhes bya ba la sogs pa la dbang po rnams dang yul rnams dang bcas pa'i yid kyi rkyen las byung @99b ba gang dang yin pa de ni yid yin	After the practice, the reply to the question about the practice of mantra is stated, beginning with “the sense faculties,” etc. The mind that arises from the condition of the sense faculties and the objects is the mind.
['BO_T02_D1851-2:99b-1']	te / yid de ni ma na zhes bya bar grags pa'o //	te / yid de ni ma na zhes bya bar grags pa'o //	That mind is known as “manaḥ.”
['BO_T02_D1851-2:99b-2', 'BO_T02_D1851-2:99b-3']	de zhes bya ba'i sgra ni gang dang gang bya ba dag dang 'brel pas de zhes bya ba gnyis su 'gyur bar shes par bya'o //🔽dbang po zhes bya ba ni 'byung ba lnga'i dbang po ste padmar bsdus pa'o //	de zhes bya ba'i sgra ni gang dang gang bya ba dag dang 'brel pas de zhes bya ba gnyis su 'gyur bar shes par bya'o // dbang po zhes bya ba ni 'byung ba lnga'i dbang po ste padmar bsdus pa'o //	The word “that” should be understood as a second “that” in connection with whatever actions.🔽The “sense faculties” are the five sense faculties of the elements, included in the lotus.
['BO_T02_D1851-2:99b-4']	'byung ba las gyur pa'i dbang po lnga ni rdo rjer bsdus pa'o //	'byung ba las gyur pa'i dbang po lnga ni rdo rjer bsdus pa'o //	The five sense faculties derived from the elements are included in the vajra.
['BO_T02_D1851-2:99b-5']	yul rnams zhes bya ba ni gzugs la sogs pa'i yul drug po rnams kyi chos kyi dbyings kyis skyes pa'o //	yul rnams zhes bya ba ni gzugs la sogs pa'i yul drug po rnams kyi chos kyi dbyings kyis skyes pa'o //	The “objects” are the six objects such as form, which are born from the dharmadhātu.
['BO_T02_D1851-2:99b-6']	yid ces bya ba ni rnam par shes pa'i khams bdun yid kyi skye mched du bsdus pa'o //	yid ces bya ba ni rnam par shes pa'i khams bdun yid kyi skye mched du bsdus pa'o //	The “mind” is the seven consciousnesses included in the sense-center of mind.
['BO_T02_D1851-2:99b-7']	de rnams kyi rkyen gyis de rnams la brten te gang dang gang skyes pa'o //	de rnams kyi rkyen gyis de rnams la brten te gang dang gang skyes pa'o //	“By the condition of those” means that they are born in dependence on those.
['BO_T02_D1851-2:99b-8']	ci zhig skye zhe na /	ci zhig skye zhe na /	What is born?
['BO_T02_D1851-2:99b-9']	yid ces bya ba ste yid kyi yul yin pas na yid de sems kyis dmigs pa dang ting nge 'dzin zhes bya ba'i don to //	yid ces bya ba ste yid kyi yul yin pas na yid de sems kyis dmigs pa dang ting nge 'dzin zhes bya ba'i don to //	The “mind” is the object of mind, and it is the object of the mind, and it is the object of samādhi.
['BO_T02_D1851-2:99b-10']	de yang so sor sdud pa la sogs pa yan lag drug dang de'i phyogs gcig gzugs la sogs pa'i zla ba yang ste /	de yang so sor sdud pa la sogs pa yan lag drug dang de'i phyogs gcig gzugs la sogs pa'i zla ba yang ste /	It is also the six limbs such as the retention of the mind, and it is the moon of form and so on.
['BO_T02_D1851-2:99b-11']	de yang de'i yid ma na zhes bya bar bshad pa ni yan lag drug gis bsdus pa'i mnyam par gzhag pa'i shes rab ces bya ba'i don to //	de yang de'i yid ma na zhes bya bar bshad pa ni yan lag drug gis bsdus pa'i mnyam par gzhag pa'i shes rab ces bya ba'i don to //	It is also the mind of that, and it is explained as “the mind of that.” The meaning of the term is “the wisdom of equipoise included in the six limbs.”
['BO_T02_D1851-2:99b-12']	bshad pa ni grags pa ste lhag pa'i don zhes bya ba'i nges pa'i tshig gis de'i ngang tshul can gyi ting nge 'dzin la bya'o //	bshad pa ni grags pa ste lhag pa'i don zhes bya ba'i nges pa'i tshig gis de'i ngang tshul can gyi ting nge 'dzin la bya'o //	The explanation is fame, and the concentration that has that as its mode is called “having the supreme meaning.”
['BO_T02_D1851-2:99b-13']	de bas na yan lag drug la mnyam par bzhag pas bsdus pa'i shes rab ni ma na'o //	de bas na yan lag drug la mnyam par bzhag pas bsdus pa'i shes rab ni ma na'o //	Therefore, the wisdom that is included in the meditative equipoise on the six branches is mantra.
['BO_T02_D1851-2:99b-14']	ma na yang yin la tra yang yin pas na mantra ste /	ma na yang yin la tra yang yin pas na mantra ste /	Because it is both a man and a tra, it is a mantra.
['BO_T02_D1851-2:99b-15']	ma na ni shes pas ma na yin la skyob pas na tra yin no //	ma na ni shes pas ma na yin la skyob pas na tra yin no //	Because it is a man, it is knowledge, and because it is a tra, it is a protector.
['BO_T02_D1851-2:99b-16']	nges pa'i tshig tu'o //	nges pa'i tshig tu'o //	This is the explanation of the term.
['BO_T02_D1851-2:99b-17']	tra ni skyob par byed pa'i phyir //	tra ni skyob par byed pa'i phyir //	Tra is a protector.
['BO_T02_D1851-2:99b-18']	zhes bya ba 'dis ma na ni shes par byed pa'i don zhes bya ba yang don gyis shes par bya ste /	zhes bya ba 'dis ma na ni shes par byed pa'i don zhes bya ba yang don gyis shes par bya ste /	By this, “man is the meaning of knowledge” is also understood by implication.
['BO_T02_D1851-2:99b-19']	ngan 'gro dang srid pa'i sdug bsngal dang theg pa dman pa srung bas na skyob pa ste de byed pa'o //	ngan 'gro dang srid pa'i sdug bsngal dang theg pa dman pa srung bas na skyob pa ste de byed pa'o //	It is a protector because it protects from the suffering of the lower realms and existence and from the lower vehicles. It is that which does that.
['BO_T02_D1851-2:99b-20']	'dir tshigs su bcad pa ni /	'dir tshigs su bcad pa ni /	Here is a verse:
['BO_T02_D1851-2:99b-21']	longs spyod dang ni yan lag rnam pa gang yin blo dang zhig nas gcig bsdus gang yin dang // de las phra mo gsum gyi rin chen dang ni ngag bsdus thig le'i rin chen gzud pa dang / nor bu sogs 'od khyab par spros dang de dbus bsdus pa las skyes dkyil 'khor sngags su gsungs //	longs spyod dang ni yan lag rnam pa gang yin blo dang zhig nas gcig bsdus gang yin dang // de las phra mo gsum gyi rin chen dang ni ngag bsdus thig le'i rin chen gzud pa dang / nor bu sogs 'od khyab par spros dang de dbus bsdus pa las skyes dkyil 'khor sngags su gsungs //	The jewel of the light pervading the jewel and so forth, and the mandala arisen from the collection in the middle of that are taught as the mantra.
['BO_T02_D1851-2:99b-22']	drug po 'di dag rim pa ci rigs cha shas drug tu phye ba'ang yin //	drug po 'di dag rim pa ci rigs cha shas drug tu phye ba'ang yin //	These six are also divided into six parts in the appropriate order.
['BO_T02_D1851-2:99b-23']	'jig rten spyod las spyod las rnam 'grol ba ni phyi rol rnams dang 'dra ba ma yin pa'o //	'jig rten spyod las spyod las rnam 'grol ba ni phyi rol rnams dang 'dra ba ma yin pa'o //	The liberation from worldly conduct is not like the external.
['BO_T02_D1851-2:99b-24']	dam tshig ni bde ba la sogs pa'o //	dam tshig ni bde ba la sogs pa'o //	The pledge is bliss and so forth.
['BO_T02_D1851-2:100a-0']	@100a * // sdom pa ni 'jig pa la sogs pa'o //	@100a * // sdom pa ni 'jig pa la sogs pa'o //	The vow is destruction and so forth.
['BO_T02_D1851-2:100a-1']	bskyod pa ni de dag thams cad nyams su len pa ste /	bskyod pa ni de dag thams cad nyams su len pa ste /	The shaking is the practice of all of those.
['BO_T02_D1851-2:100a-2']	spyod pa zhes bya ba ni lhag ma'o //	spyod pa zhes bya ba ni lhag ma'o //	The conduct is the remainder.
['BO_T02_D1851-2:100a-3']	rdo rje thams cad kyi zhes bya ba ni lus la sogs pa ci rigs pa'o //	rdo rje thams cad kyi zhes bya ba ni lus la sogs pa ci rigs pa'o //	All vajras is the body and so forth, as appropriate.
['BO_T02_D1851-2:100a-4']	de zhes bya ba ni de dag gnyi ga sngags kyi spyod par bshad pa ste brjod pa'o //	de zhes bya ba ni de dag gnyi ga sngags kyi spyod par bshad pa ste brjod pa'o //	The word that refers to both of them, which are explained as the conduct of mantra, that is, are expressed as the conduct of mantra.
['BO_T02_D1851-2:100a-5']	sngags dang lhan cig pa'i spyod pa ni sngags kyi spyod pa zhes bya bar dgongs so //	sngags dang lhan cig pa'i spyod pa ni sngags kyi spyod pa zhes bya bar dgongs so //	The conduct that is together with mantra is intended as the conduct of mantra.
['BO_T02_D1851-2:100a-6']	le'u bcu gsum pa'i rdo rje bzlas pa las bzlas pa nyid do //	le'u bcu gsum pa'i rdo rje bzlas pa las bzlas pa nyid do //	[This is] the recitation itself from the Vajra Recitation chapter.
['BO_T02_D1851-2:100a-7']	de bas na bzlas pa'i don du dris pa bshad par bya ba'i phyir rang rang zhes bya ba la sogs pa smos te /	de bas na bzlas pa'i don du dris pa bshad par bya ba'i phyir rang rang zhes bya ba la sogs pa smos te /	Therefore, in order to explain the question about the meaning of recitation, [the Bhagavān] declares, “each one’s own nature,” and so forth.
['BO_T02_D1851-2:100a-8']	bzlas par bya ba lha'i rnal 'byor byas la rang rang ngo bo zhes bya ba'i de'i sku dang gsung dang thugs 'di dag rnam par spyad pa ste nges par dpyad par bya ba'o //	bzlas par bya ba lha'i rnal 'byor byas la rang rang ngo bo zhes bya ba'i de'i sku dang gsung dang thugs 'di dag rnam par spyad pa ste nges par dpyad par bya ba'o //	Having performed the deity yoga for the recitation, one should analyze, that is, investigate, “this body, speech, and mind of each one’s own nature.”
['BO_T02_D1851-2:100a-9']	snying la yid kyis zhes bya ba ni snying gar son pa yid kyis te /	snying la yid kyis zhes bya ba ni snying gar son pa yid kyis te /	“In the heart with the mind” means in the heart, with the mind.
['BO_T02_D1851-2:100a-10']	mnyam par gzhag pa'i sems kyis zhes bya ba'i don to //	mnyam par gzhag pa'i sems kyis zhes bya ba'i don to //	The meaning is: with a mind in equipoise.
['BO_T02_D1851-2:100a-11']	le'u bcu gsum pa las /	le'u bcu gsum pa las /	From the thirteenth chapter:
['BO_T02_D1851-2:100a-12']	thams cad rigs kyi sngags rnams ni //	thams cad rigs kyi sngags rnams ni //	All the mantras of the families
['BO_T02_D1851-2:100a-13']	sku dang gsung dang thugs su mtshon //	sku dang gsung dang thugs su mtshon //	The body, speech, and mind are illustrated.🔽
['BO_T02_D1851-2:100a-14']	zhes gsungs te /	zhes gsungs te /	It is illustrated as body, speech, and mind.
['BO_T02_D1851-2:100a-15']	dper na rnam par snang mdzad kyi bzlas pa la de bzhin gshegs pa thams cad sku mnyam pa nyid du mngon par rdzogs par byang chub pa ni sku'i de kho na nyid yin la //	dper na rnam par snang mdzad kyi bzlas pa la de bzhin gshegs pa thams cad sku mnyam pa nyid du mngon par rdzogs par byang chub pa ni sku'i de kho na nyid yin la //	For example, in the recitation of Vairocana, the manifest, perfect enlightenment of all the transcendent lords in the equality of body is the reality of body.
['BO_T02_D1851-2:100a-16']	de gsal bar byed pa ni snying ga'i ye shes kyi 'khor lo ste thugs so ;	de gsal bar byed pa ni snying ga'i ye shes kyi 'khor lo ste thugs so ;	The illuminator of that is the wheel of wisdom in the heart, which is mind.
['BO_T02_D1851-2:100a-17']	/ de'i de kho na nyid ni sku de'i dngos po dang dngos po med pa dgag pa ste /	/ de'i de kho na nyid ni sku de'i dngos po dang dngos po med pa dgag pa ste /	The reality of that is the negation of the entity and non-entity of that body.
['BO_T02_D1851-2:100a-18']	lus 'di ni ye shes kyi 'khor lo'i rang bzhin te skye ba med pas lus kyi dngos por yod pa ma yin no //	lus 'di ni ye shes kyi 'khor lo'i rang bzhin te skye ba med pas lus kyi dngos por yod pa ma yin no //	This body is the nature of the wheel of wisdom, and because it is unborn, it does not exist as the entity of a body.
['BO_T02_D1851-2:100a-19']	mi skyed ba yang ma yin te /	mi skyed ba yang ma yin te /	It is not non-arisen,
['BO_T02_D1851-2:100a-20']	ye shes lus kyi rnam par 'byung ba'i phyir ro //	ye shes lus kyi rnam par 'byung ba'i phyir ro //	because it arises in the form of the body of wisdom.
['BO_T02_D1851-2:100a-21']	de'i ngag ni 'khor lo de'i lte bar gnas pa'i rab sngags yin te /	de'i ngag ni 'khor lo de'i lte bar gnas pa'i rab sngags yin te /	Its speech is the supreme mantra that abides in the center of that wheel.
['BO_T02_D1851-2:100a-22']	de'i de kho na nyid ni gdod nas skye ba med pas stong pa nyid kyi rang bzhin gyi yid nyid de zhes bya bas 'khor lo'i don ston par byed pa'o //	de'i de kho na nyid ni gdod nas skye ba med pas stong pa nyid kyi rang bzhin gyi yid nyid de zhes bya bas 'khor lo'i don ston par byed pa'o //	Its reality is the mind itself, which is the nature of emptiness, since it is primordially unborn.
['BO_T02_D1851-2:100a-23']	gsang sngags zlos pa zhes bya ba ni /	gsang sngags zlos pa zhes bya ba ni /	Reciting the mantra means
['BO_T02_D1851-2:100a-24', 'BO_T02_D1851-2:100a-25']	yi ge bzhi'i sngags zlos bzhin pas //🔽zhes bya ba'i don to //	yi ge bzhi'i sngags zlos bzhin pas // zhes bya ba'i don to //	while reciting the mantra of the four syllables.
['BO_T02_D1851-2:100a-26']	phye nas su zhes bya ba ni sna tshogs pa dang bye brag par phye ba yin te /	phye nas su zhes bya ba ni sna tshogs pa dang bye brag par phye ba yin te /	The meaning of having differentiated is having differentiated into various and specific [aspects].
['BO_T02_D1851-2:100a-27']	gsum po ni thun mong pa nyid kyi phyir ro //	gsum po ni thun mong pa nyid kyi phyir ro //	 The three [aspects] are common.
['BO_T02_D1851-2:100a-28']	zlos par byed pas spro zhing bsdu //	zlos par byed pas spro zhing bsdu //	The reciter emanates and gathers.
['BO_T02_D1851-2:100a-29']	zhes bya ba ni spro ba dang bsdu bas bzlas so zhes bya ba'i don to //	zhes bya ba ni spro ba dang bsdu bas bzlas so zhes bya ba'i don to //	The meaning is that one recites through emanation and gathering.
['BO_T02_D1851-2:100b-0']	de la phyi ma nyid kyis spro ba ni bcu gsum pa las dngos su gsungs pas gzhan gnyis kyis bsdu @100b ba ni lhag ma yin no //	de la phyi ma nyid kyis spro ba ni bcu gsum pa las dngos su gsungs pas gzhan gnyis kyis bsdu @100b ba ni lhag ma yin no //	The emanation by the latter is directly stated in the thirteenth [chapter], while the gathering by the other two is implied.
['BO_T02_D1851-2:100b-1']	'dir ni snga ma gnyis kyis bsdus pa dngos su gsungs pas /	'dir ni snga ma gnyis kyis bsdus pa dngos su gsungs pas /	 Here, the gathering by the former two is directly stated,
['BO_T02_D1851-2:100b-2']	phyi ma gnyis kyis spro bar shes par bya ba ni lhag ma'o //	phyi ma gnyis kyis spro bar shes par bya ba ni lhag ma'o //	while the emanation by the latter two is implied.
['BO_T02_D1851-2:100b-3']	bcu gsum pa las /	bcu gsum pa las /	The thirteenth chapter of the Compendium of Principles Tantra states:
['BO_T02_D1851-2:100b-4']	sku gsung thugs dang bdag med las //	sku gsung thugs dang bdag med las //	From the body, speech, mind, and selflessness,
['BO_T02_D1851-2:100b-5', 'BO_T02_D1851-2:100b-6']	ye shes sems kyis spro bar bya //🔽zhes gsungs te /	ye shes sems kyis spro bar bya // zhes gsungs te /	the wisdom mind emanates.
['BO_T02_D1851-2:100b-7']	ye shes ni sna tshogs pa'o ;	ye shes ni sna tshogs pa'o ;	Wisdom is the various.
['BO_T02_D1851-2:100b-8']	/ sems ni h'um ngo //	/ sems ni h'um ngo //	Mind is the syllable hūṃ.
['BO_T02_D1851-2:100b-9']	de dag gi go rims ji bzhin du sku gsung thugs rnams dang bdag med pa las spro zhes bya ba'i don to //	de dag gi go rims ji bzhin du sku gsung thugs rnams dang bdag med pa las spro zhes bya ba'i don to //	In accordance with their order, they emanate from the body, speech, mind, and selflessness.
['BO_T02_D1851-2:100b-10']	bdag med pa ni sna tshogs pa'o //	bdag med pa ni sna tshogs pa'o //	Selflessness is the various.
['BO_T02_D1851-2:100b-11']	rdo rje bzlas pa yang rnam par gnyis te /	rdo rje bzlas pa yang rnam par gnyis te /	Vajra repetition is also twofold:
['BO_T02_D1851-2:100b-12', 'BO_T02_D1851-2:100b-13']	thams cad las spro ba dang gcig las spro ba'o //🔽de la dang po'i dbang du byas te /	thams cad las spro ba dang gcig las spro ba'o // de la dang po'i dbang du byas te /	emanation from all and emanation from one.
['BO_T02_D1851-2:100b-14', 'BO_T02_D1851-2:100b-15']	gsungs pa / sangs rgyas zhes bya ba la sogs pa la sangs rgyas ni sangs rgyas rnams kyi sku dang gsungs dang thugs kyi lus dang bcas pa'o //🔽sna tshogs rdo rje bdag ces pa la sna tshogs pa brjod pa ni /	gsungs pa / sangs rgyas zhes bya ba la sogs pa la sangs rgyas ni sangs rgyas rnams kyi sku dang gsungs dang thugs kyi lus dang bcas pa'o // sna tshogs rdo rje bdag ces pa la sna tshogs pa brjod pa ni /	With regard to that, the first is stated in the lines beginning “buddhas” and so on. Buddhas are the bodies, speech, and minds of the buddhas.
['BO_T02_D1851-2:100b-16']	rdo rje'i bdag nyid kyi rang gi sa bon rnams las spro ba'o //	rdo rje'i bdag nyid kyi rang gi sa bon rnams las spro ba'o //	“The various vajra self” means that the various are the emanations from one’s own seed syllables that have the nature of vajra.
['BO_T02_D1851-2:100b-17']	h'um brjod pa na sna tshogs pa las spros te sna tshogs pa'i bdag nyid du ro mnyam par bya'o //	h'um brjod pa na sna tshogs pa las spros te sna tshogs pa'i bdag nyid du ro mnyam par bya'o //	When the syllable hūṃ is uttered, one should emanate from the various and equalize the taste with the nature of the various.
['BO_T02_D1851-2:100b-18']	ye shes sa bon ni rab sngags te /	ye shes sa bon ni rab sngags te /	The seed of intuition is the supreme mantra,
['BO_T02_D1851-2:100b-19']	don rnams ye shes tsam yin pa'i phyir ro //	don rnams ye shes tsam yin pa'i phyir ro //	because the objects are merely intuition.
['BO_T02_D1851-2:100b-20']	de brjod bzhin pa na bsdu bar bya ba ste /	de brjod bzhin pa na bsdu bar bya ba ste /	When that is uttered, one should gather in,
['BO_T02_D1851-2:100b-21']	'di bdag bdag gi ye shes so //	'di bdag bdag gi ye shes so //	thinking, “This is my intuition.”
['BO_T02_D1851-2:100b-22']	zhes bya ba'i don to //	zhes bya ba'i don to //	This is the meaning.
['BO_T02_D1851-2:100b-23']	de ltar 'di dag gzung ba ma yin pas de dag med na 'dzin pa yang med do zhes bya bar 'grub po //	de ltar 'di dag gzung ba ma yin pas de dag med na 'dzin pa yang med do zhes bya bar 'grub po //	Thus, since these are not grasped, when they do not exist, the grasper also does not exist.
['BO_T02_D1851-2:100b-24']	de lta mod kyi mtshon par bya ba ni yid do snyam na de bzlog pa'i phyir byang chub ces bya ba la sogs pa smos te /	de lta mod kyi mtshon par bya ba ni yid do snyam na de bzlog pa'i phyir byang chub ces bya ba la sogs pa smos te /	If one thinks that the mind is to be illustrated, in order to refute that, he says, “awakening,” and so on.
['BO_T02_D1851-2:100b-25']	byang chub ni mtshan nyid do //	byang chub ni mtshan nyid do //	Awakening is the characteristic.
['BO_T02_D1851-2:100b-26']	de med pa ni bdag med pa'o //	de med pa ni bdag med pa'o //	Its nonexistence is selflessness.
['BO_T02_D1851-2:100b-27']	sa bon ni de gsal bar byed pa'i yi ge aa: ste tha snyad na nam mkha' lta bu'o zhes bya ba'i don to //	sa bon ni de gsal bar byed pa'i yi ge aa: ste tha snyad na nam mkha' lta bu'o zhes bya ba'i don to //	The seed is the syllable aḥ, which illuminates that, and is conventionally like space. This is the meaning.
['BO_T02_D1851-2:100b-28']	des gzung ba ni nges par bya'o //	des gzung ba ni nges par bya'o //	One should ascertain the grasping by that.
['BO_T02_D1851-2:100b-29']	ji ltar zhe na bdag med ces bya ste /	ji ltar zhe na bdag med ces bya ste /	How?
['BO_T02_D1851-2:100b-30']	rnam par brtag par bya ba'i rang bzhin gyis stong par ro //	rnam par brtag par bya ba'i rang bzhin gyis stong par ro //	By the absence of self, that is, by the emptiness of the nature of the imagined.
['BO_T02_D1851-2:100b-31']	gcig las spro ba'i bzlas pa'i dbang du byas te gsungs pa /	gcig las spro ba'i bzlas pa'i dbang du byas te gsungs pa /	The mantra is taught in terms of emanation from the one.
['BO_T02_D1851-2:100b-32']	sna tshogs bya ba sogs pa la sna tshogs bzhin du zhes bya ba ni thams cad pa bzhin du ste /	sna tshogs bya ba sogs pa la sna tshogs bzhin du zhes bya ba ni thams cad pa bzhin du ste /	In the performance of various activities, one should do it in various ways, that is, in every way.
['BO_T02_D1851-2:100b-33', 'BO_T02_D1851-2:101a-0']	ji ltar sngar thams cad las spros pa de bzhin du sna tshogs pa spro bar byed pa po yin te /🔽sna tshogs pa zhes brjod bzhin pas na sna tshogs pa nyid las bye brag rnams spro ba dang h'um brjod bzhin pa na sa bon la bdag nyid ji lta ba bzhin du sku dang gsung dang @101a * //	ji ltar sngar thams cad las spros pa de bzhin du sna tshogs pa spro bar byed pa po yin te / sna tshogs pa zhes brjod bzhin pas na sna tshogs pa nyid las bye brag rnams spro ba dang h'um brjod bzhin pa na sa bon la bdag nyid ji lta ba bzhin du sku dang gsung dang @101a * //	Just as one emanates from everything, so one emanates in various ways.🔽Since one is called “various,” one emanates the various distinctions from the various.
['BO_T02_D1851-2:101a-1']	thugs kyi sprin rnam pa sna tshogs pa'i sprin dang ro mnyam par byas te /	thugs kyi sprin rnam pa sna tshogs pa'i sprin dang ro mnyam par byas te /	While uttering “hūṃ,” one should make oneself equal to the cloud of various forms of body, speech, and mind, which are like the seed.
['BO_T02_D1851-2:101a-2']	rab sngags brjod pas ni bsdu la /	rab sngags brjod pas ni bsdu la /	While uttering the mantra, one should gather them.
['BO_T02_D1851-2:101a-3']	a'a: yis ni bdag med par gzung bar bya'o //	a'a: yis ni bdag med par gzung bar bya'o //	While uttering “aḥ,” one should apprehend the absence of self.
