segmentnr	original	analyzed	translated
['BO_T03_D3805:36a-6']	blo gros chen po 'di dag kyang gcig la gcig gis stong pa nyid pas thams cad kyang smad par byas pa ste /	blo gros chen po 'di dag kyang gcig la gcig gis stong pa nyid pas thams cad kyang smad par byas pa ste /	“Mahāmati, since these are empty of one another, all are to be despised.🔽You should completely abandon them.”
['BO_T03_D3805:36a-7']	de khyod kyis yongs su spang bar bya'o zhes ba dang / 'phags pa klu sgrub kyi kyang /	de khyod kyis yongs su spang bar bya'o zhes ba dang / 'phags pa klu sgrub kyi kyang /	And Ārya Nāgārjuna also says:
['BO_T03_D3805:36a-8']	'di dag thams cad sems tsam zhes zhes //	'di dag thams cad sems tsam zhes zhes //	All these are mind only.
['BO_T03_D3805:36a-9']	gang zhig thub pas bstan pa ni //	gang zhig thub pas bstan pa ni //	What was taught by the Sage🔽Is for the purpose of abandoning
['BO_T03_D3805:36a-10']	byis ba rnams kyi skrag pa ni //	byis ba rnams kyi skrag pa ni //	The fears of the childish.
['BO_T03_D3805:36a-11']	spong ba'i don la de nyid min //	spong ba'i don la de nyid min //	It is not reality.
['BO_T03_D3805:36a-12']	zhes te / 'on kyang mdo dag las sems tsam du bstan pa ni gzhan byed pa po dang spyod pa po'i 'bras sur kun tu brtags pas dgag pa ste /	zhes te / 'on kyang mdo dag las sems tsam du bstan pa ni gzhan byed pa po dang spyod pa po'i 'bras sur kun tu brtags pas dgag pa ste /	Nevertheless, the teaching of mind-only in the scriptures is a refutation of the imagination of another agent and experiencer.
['BO_T03_D3805:36a-13']	sems las ma gtogs pa gzhan byed pa po la sogs pa ni tha snyad du yang ma grub pa'i phyir ro //	sems las ma gtogs pa gzhan byed pa po la sogs pa ni tha snyad du yang ma grub pa'i phyir ro //	Because, even conventionally, there is no other agent, etc., apart from the mind.
['BO_T03_D3805:36a-14']	de ltar na /	de ltar na /	Thus,
['BO_T03_D3805:36a-15', 'BO_T03_D3805:36a-16']	yang phyi rol med par smra ba'i sangs rgyas pa rnams kyis sems can gyi 'jig rten dang / 'di ltar snod kyi 'jig rten sems kho nar byed pa ni shin tu ngo mtshar te /🔽las las skyes pa'i 'gro bar brjod pa'i lus dang las dang sems pa las gang yod pa ni mi na zhes brjod pa ni sems la ni chos thams cad ltos pas gtso bo nyid du bsgrub pa'i phyir te /	yang phyi rol med par smra ba'i sangs rgyas pa rnams kyis sems can gyi 'jig rten dang / 'di ltar snod kyi 'jig rten sems kho nar byed pa ni shin tu ngo mtshar te / las las skyes pa'i 'gro bar brjod pa'i lus dang las dang sems pa las gang yod pa ni mi na zhes brjod pa ni sems la ni chos thams cad ltos pas gtso bo nyid du bsgrub pa'i phyir te /	the assertion of the Buddhists who deny external things that the world of sentient beings and the inanimate world are only mind is most astonishing.🔽Because the mind is the principal thing, since all things are dependent on the mind.
['BO_T03_D3805:36a-17']	chos rnams thams cad kyi sngon du sems 'gro ba'i phyir ro //	chos rnams thams cad kyi sngon du sems 'gro ba'i phyir ro //	The mind precedes all things.
['BO_T03_D3805:36a-18']	de nyid la de kho na nyid can gyi dngos po khas mi len la /	de nyid la de kho na nyid can gyi dngos po khas mi len la /	It is not accepted that the nature of that is a thing.
['BO_T03_D3805:36a-19']	gang yang dngos po med pa yang min te /	gang yang dngos po med pa yang min te /	Nor is it nonexistent,
['BO_T03_D3805:36a-20']	dngos po dang dngos po med pa las log pa'i mtshan nyid can gyi phyir ro //	dngos po dang dngos po med pa las log pa'i mtshan nyid can gyi phyir ro //	because it has a character that is the opposite of thing and nonthing.
['BO_T03_D3805:36a-21']	de'i dngos po ma grub pas yul med pa la dgag pa'i sbyor ba med de /	de'i dngos po ma grub pas yul med pa la dgag pa'i sbyor ba med de /	Since its nature is not established, there is no negation that is applied to a nonexistent object.
['BO_T03_D3805:36a-22']	med pa la dgag bya dang dgag byed kyi 'jug pa med pas de sngon du 'gro ba can gyi de yang mi grub la /	med pa la dgag bya dang dgag byed kyi 'jug pa med pas de sngon du 'gro ba can gyi de yang mi grub la /	Since there is no engagement of negation and negatee in the nonexistent, that which precedes it is not established.
['BO_T03_D3805:36b-0']	dngos po dang dngos po med pa'i rnam par rtog pa dag gis ni rnam par rtog pa rnams thams cad la khyab pa'i phyir khyab byed med pa la khyab @36b bya mi srid pas de kho na nyid du na dngos po dang dngos po med par mchog tu	dngos po dang dngos po med pa'i rnam par rtog pa dag gis ni rnam par rtog pa rnams thams cad la khyab pa'i phyir khyab byed med pa la khyab @36b bya mi srid pas de kho na nyid du na dngos po dang dngos po med par mchog tu	Since the conceptual thoughts of thing and nonthing pervade all conceptual thoughts, the pervaded is not possible without the pervader. Therefore, in reality, since one is free from the extreme grasping at thing and nonthing,
['BO_T03_D3805:36b-1']	'dzin pa dang bral bas /	'dzin pa dang bral bas /	one is free from the extreme of existence and nonexistence.
['BO_T03_D3805:36b-2']	ma brtags na nyams dga' ba'i dngos po 'di rnams la shes rab kyi sbyin gyis brtags na nang dang phyi rol gyi snying po dang bral bas gang du bsgoms pa'i stobs rdzogs pas skyon thams cad bkag nas bdag med pa mthong ba mngon sum du gyur nas de	ma brtags na nyams dga' ba'i dngos po 'di rnams la shes rab kyi sbyin gyis brtags na nang dang phyi rol gyi snying po dang bral bas gang du bsgoms pa'i stobs rdzogs pas skyon thams cad bkag nas bdag med pa mthong ba mngon sum du gyur nas de	Therefore, when the power of meditation is perfected, all faults are stopped, and the direct perception of the vision of selflessness arises.
['BO_T03_D3805:36b-3', 'BO_T03_D3805:36b-4']	dang 'gal ba'i phyir nyon mongs pa'i sgrib pa dang shes bya'i sgrib pa spong bar 'gyur te /🔽'dir 'ching ba med pas sprin dang bral ba'i nyi ma'i 'od zer bzhin du nam mkha'i mtha' klas par rten cing 'brel pa las las 'byung ba'i dngos po don dam par skye ba la sogs pa'i brtags pa dang bral ba'i rgyun mi 'chad pa rnal 'byor pa'i mngon	dang 'gal ba'i phyir nyon mongs pa'i sgrib pa dang shes bya'i sgrib pa spong bar 'gyur te / 'dir 'ching ba med pas sprin dang bral ba'i nyi ma'i 'od zer bzhin du nam mkha'i mtha' klas par rten cing 'brel pa las las 'byung ba'i dngos po don dam par skye ba la sogs pa'i brtags pa dang bral ba'i rgyun mi 'chad pa rnal 'byor pa'i mngon	Because of that, the afflictive obstructions and the obstructions to omniscience are abandoned.
['BO_T03_D3805:36b-5']	sum gyi snying rjes dang shes rab kyi rang bzhin gyi kun rdzob pa'i ye shes kyi snang ba yang dag par skye la /	sum gyi snying rjes dang shes rab kyi rang bzhin gyi kun rdzob pa'i ye shes kyi snang ba yang dag par skye la /	Here, because there are no bonds, like the sun’s rays free from clouds, the yogi’s direct perception of the compassion that arises from dependent origination and the appearance of the conventional pristine consciousness that is the nature of wisdom arise perfectly in the uninterrupted continuum of things that are free from the imputations of ultimate production and so on throughout the limits of space.
['BO_T03_D3805:36b-6']	'di nyid de kho na nyid mthong ba ste /	'di nyid de kho na nyid mthong ba ste /	This is the vision of reality.
['BO_T03_D3805:36b-7']	gang du shes rab kyis brtags pa na chos thams cad mi mthong gi //	gang du shes rab kyis brtags pa na chos thams cad mi mthong gi //	When one examines with wisdom, one does not see any phenomena.
['BO_T03_D3805:36b-8']	gang du yid la byed pa dang / gnyid log pa'am mig btsums pa bzhin gyis ni ma yin no //	gang du yid la byed pa dang / gnyid log pa'am mig btsums pa bzhin gyis ni ma yin no //	This is not like the state of being inattentive, asleep, or with eyes closed.
['BO_T03_D3805:36b-9']	de lta bu'i bag chags ma spangs na /	de lta bu'i bag chags ma spangs na /	If one does not eliminate the residual impressions in this way,
['BO_T03_D3805:36b-10']	'du shes med pa'i snyoms par 'jug pa la sogs pas langs pa nyid na /	'du shes med pa'i snyoms par 'jug pa la sogs pas langs pa nyid na /	then when one rises from the attainment of nonperception, etc.,
['BO_T03_D3805:36b-11']	gzugs la sogs pa la mngon par zhen pa'i rtsa ba can gyi 'dod chags la sogs pa rnams skye bar 'gyur bas rnal 'byor pa grol bar mi 'gyur ro //	gzugs la sogs pa la mngon par zhen pa'i rtsa ba can gyi 'dod chags la sogs pa rnams skye bar 'gyur bas rnal 'byor pa grol bar mi 'gyur ro //	attachment, etc., which have form, etc. as their roots, will be produced, and the yogi will not be liberated.
['BO_T03_D3805:36b-12']	gzugs la sogs pa'i yul gyi the tshom spangs pa med na /	gzugs la sogs pa'i yul gyi the tshom spangs pa med na /	If one does not eliminate doubt about objects such as form,
['BO_T03_D3805:36b-13']	de'i yid la byed pa spong bar mi nus te /	de'i yid la byed pa spong bar mi nus te /	one will not be able to eliminate the attention to them,
['BO_T03_D3805:36b-14']	sreg byed yongs su ma spangs par sreg pa yongs su mi spong ba bzhin no //	sreg byed yongs su ma spangs par sreg pa yongs su mi spong ba bzhin no //	just as one cannot eliminate being burned if one does not eliminate the fire.
['BO_T03_D3805:36b-15']	de'i phyir na ji skad du bshad pa'i mthong ba med pa'i sbyor ba'i shes rab kyi pha rol tu phyin pa bsgoms pas the tshom gyi sa bon dang bral ba nyid kyis gzugs la sogs pa la mngon par zhen pa bsal bar bya'o //	de'i phyir na ji skad du bshad pa'i mthong ba med pa'i sbyor ba'i shes rab kyi pha rol tu phyin pa bsgoms pas the tshom gyi sa bon dang bral ba nyid kyis gzugs la sogs pa la mngon par zhen pa bsal bar bya'o //	Therefore, by cultivating the perfection of wisdom of the application of nonseeing as it has been explained, one should eliminate the clinging to form and so on by being free from the seeds of doubt.
['BO_T03_D3805:36b-16']	de ltar yang dngos po dang dngos po med pa la sogs pa'i tshul gyis dpyad pas the tshom dang ldan pa de dang bral nas gzugs la sogs pa la mngon par zhen pa dang bral bas chos thams cad ngo bo nyid med par rtogs la de nyid shes	de ltar yang dngos po dang dngos po med pa la sogs pa'i tshul gyis dpyad pas the tshom dang ldan pa de dang bral nas gzugs la sogs pa la mngon par zhen pa dang bral bas chos thams cad ngo bo nyid med par rtogs la de nyid shes	Thus, having been free from doubt by analyzing things and nonthings and so on, one should eliminate clinging to form and so on. By being free from clinging, one realizes that all phenomena are essenceless.
['BO_T03_D3805:36b-17']	rab kyi pha rol tu phyin pa zhes snga nas bshad do //	rab kyi pha rol tu phyin pa zhes snga nas bshad do //	That is the perfection of wisdom, as explained earlier.
['BO_T03_D3805:37a-0']	'dir chos thams cad don dam par ngo bo nyid ni sgrib pa thams cad @37a * //	'dir chos thams cad don dam par ngo bo nyid ni sgrib pa thams cad @37a * //	Here, the supreme object is the emptiness of all phenomena, which is the supreme object of meditation.
['BO_T03_D3805:37a-1']	spangs pa dang rnam pa thams cad mkhyen pa nyid rtogs par byed pa lam gyi mchog ste /	spangs pa dang rnam pa thams cad mkhyen pa nyid rtogs par byed pa lam gyi mchog ste /	The supreme path is the perfection of wisdom, which is the supreme path for eliminating all obscurations and realizing omniscience.
['BO_T03_D3805:37a-2']	de nyid kyis na 'dis mngon par 'dod pa thams cad nye bar bsgrubs bas 'phags pa rab 'byor la 'thad pa nye bar bstan pa'o //	de nyid kyis na 'dis mngon par 'dod pa thams cad nye bar bsgrubs bas 'phags pa rab 'byor la 'thad pa nye bar bstan pa'o //	Since that is so, since all that is desired is accomplished by this, it is the proper teaching for the noble Subhūti.
['BO_T03_D3805:37a-3']	sems kyi rang bzhin 'od gsal zhes pa ni rang bzhin ni ngo bo nyid kyis ngo bo nyid med pa nyid la /	sems kyi rang bzhin 'od gsal zhes pa ni rang bzhin ni ngo bo nyid kyis ngo bo nyid med pa nyid la /	The mind is luminous by nature means that the nature is the absence of inherent nature by its very nature.
['BO_T03_D3805:37a-4', 'BO_T03_D3805:37a-5']	'od gsal ba ni de'i ngo bo nyid la glo bur ba'i yang dag pa ma yin pa'i kun tu brtags pa'i mun pa mtha' dag nub pa ste /🔽'dir mngon par zhen pa med pa la sogs pa'i rnam pa dang tha mi dad pa'i kun rdzob kyi ngo bo sems la don dam par ngo bo nyid med pas sems ma mchis zhes pa'i ma yin par dgag pa dang med par dgag pa ste /	'od gsal ba ni de'i ngo bo nyid la glo bur ba'i yang dag pa ma yin pa'i kun tu brtags pa'i mun pa mtha' dag nub pa ste / 'dir mngon par zhen pa med pa la sogs pa'i rnam pa dang tha mi dad pa'i kun rdzob kyi ngo bo sems la don dam par ngo bo nyid med pas sems ma mchis zhes pa'i ma yin par dgag pa dang med par dgag pa ste /	Luminous means that in its nature, all the darkness of adventitious, unreal, imagined obscurations has subsided.🔽Here, the mind, which is the nature of the relative that is not different from the aspects of nonattachment and so on, is said to be nonexistent ultimately because it lacks inherent nature. This is an implicative negation and an existential negation.
['BO_T03_D3805:37a-6']	kun rdzob tu yod pa la don dam par don yod pa min zhes pa nyid tsam la yid rjes su gnas pas phyin ci log bar mthong nas smras pa ni yod dam zhes pa ste ;	kun rdzob tu yod pa la don dam par don yod pa min zhes pa nyid tsam la yid rjes su gnas pas phyin ci log bar mthong nas smras pa ni yod dam zhes pa ste ;	Since the mind is said to exist conventionally and not to exist ultimately, the mind is said to be nonexistent.
['BO_T03_D3805:37a-7']	rigs pas dngos po med pa'i phyir te /	rigs pas dngos po med pa'i phyir te /	Because of the nonexistence of entities by reason.
['BO_T03_D3805:37a-8']	ma yin par dgag pa'i sbyor ba min gyi 'on kyang med par dgag pa la ste /	ma yin par dgag pa'i sbyor ba min gyi 'on kyang med par dgag pa la ste /	It is not a nonaffirming negation, but rather an affirming negation.
['BO_T03_D3805:37a-9']	de la yang yod pa dang med pa tsam du btags pa yang yod pa min zhes pa la dgongs nas gsungs pa ni ci yang zhes pa la sogs pa ste /	de la yang yod pa dang med pa tsam du btags pa yang yod pa min zhes pa la dgongs nas gsungs pa ni ci yang zhes pa la sogs pa ste /	Moreover, the mere designation of existence and nonexistence does not exist.
['BO_T03_D3805:37a-10']	sems ni dngos po tsam la sems med pa ni de'i dngos po'i sems med pa nyid de /	sems ni dngos po tsam la sems med pa ni de'i dngos po'i sems med pa nyid de /	The mind is the mere entity of the mind. The nonexistence of the mind in that entity is the nonexistence of the mind in that entity.
['BO_T03_D3805:37a-11']	de la brjod pa ni med ces pa ste /	de la brjod pa ni med ces pa ste /	The statement about that is “nonexistent.”
['BO_T03_D3805:37a-12']	'di brjod ma thag pa'i gnyi ga'i yod pa nyid dang med pa nyid du mi dmigs pa ste sgrub pa po med pa'i phyir ro //	'di brjod ma thag pa'i gnyi ga'i yod pa nyid dang med pa nyid du mi dmigs pa ste sgrub pa po med pa'i phyir ro //	This is the nonapprehension of the existence and nonexistence of both, which were just mentioned, because the proponent does not exist.
['BO_T03_D3805:37a-13']	med pa ni gnod byed dam pa yod pa'i phyir te /	med pa ni gnod byed dam pa yod pa'i phyir te /	Nonexistence is the supreme refutation because existence is refuted.
['BO_T03_D3805:37a-14']	dngos po dang dngos po med pa gnyi ga las yang dag par 'das pa'i phyir zhes pa de la dgongs nas slar dri zhing rgol ba la sbyor ba'o //	dngos po dang dngos po med pa gnyi ga las yang dag par 'das pa'i phyir zhes pa de la dgongs nas slar dri zhing rgol ba la sbyor ba'o //	Because of the complete transcendence of both entity and nonentity, this is the intention of the statement, “It is not this, not that.”
['BO_T03_D3805:37a-15']	sems med ces pa ni sems dngos po med pa tsam nyid mngon par 'dod pa la dgongs pa'o //	sems med ces pa ni sems dngos po med pa tsam nyid mngon par 'dod pa la dgongs pa'o //	The statement “there is no mind” is intended to indicate the mere non-existence of a substantial mind.
['BO_T03_D3805:37a-16']	yod pa dang med pa'i ngo bos yod pa'i sgro btags pa ni mi rigs pa nyid la /	yod pa dang med pa'i ngo bos yod pa'i sgro btags pa ni mi rigs pa nyid la /	It is unreasonable to superimpose existence on the nature of existence and non-existence.
['BO_T03_D3805:37a-17']	sems chos can gyi yul med pa nyid la dgag pa'i sbyor ba med pas /	sems chos can gyi yul med pa nyid la dgag pa'i sbyor ba med pas /	Since there is no proof of the non-existence of the object of the mind,
['BO_T03_D3805:37a-18']	sems med pa nyid kyang med ces gsungs pa ni ci ltar yang 'di zhes pa la /	sems med pa nyid kyang med ces gsungs pa ni ci ltar yang 'di zhes pa la /	the statement “there is no non-existence of mind” is intended to indicate that this is not so.
['BO_T03_D3805:37a-19']	rnal 'byor pa'i kun rdzob tu so sor rig par 'dod nas gsungs pa ni 'gyur ba med ces pa ste /	rnal 'byor pa'i kun rdzob tu so sor rig par 'dod nas gsungs pa ni 'gyur ba med ces pa ste /	The statement “there is no change” is intended to indicate that the yogi/nī should understand the conventional.
['BO_T03_D3805:37b-0']	rang bzhin gyis 'od gsal ba'i phyir dang / @37b sems 'gyur ba'i 'dod chags la sogs pa rnams kyis ma gos ba'i phyir na 'gyur ba med pa'o //	rang bzhin gyis 'od gsal ba'i phyir dang / @37b sems 'gyur ba'i 'dod chags la sogs pa rnams kyis ma gos ba'i phyir na 'gyur ba med pa'o //	Since it is naturally luminous and is not tainted by the changes of desire and so forth, it is unchanging.
['BO_T03_D3805:37b-1']	spros pa thams cad nye bar zhi zhing rnam par rtog pa thams cad kyi spyod yul ma yin pa'i phyir na rnam par rtog pa med pa'o //	spros pa thams cad nye bar zhi zhing rnam par rtog pa thams cad kyi spyod yul ma yin pa'i phyir na rnam par rtog pa med pa'o //	Since it is the pacification of all elaborations and is not the domain of any conceptualization, it is non-conceptual.
['BO_T03_D3805:37b-2']	de'i phyir sems des kyang slom sems su mi byed de /	de'i phyir sems des kyang slom sems su mi byed de /	Therefore, that mind also does not make assumptions.
['BO_T03_D3805:37b-3']	de'i yang ngo bo nyid stong pa nyid dang rog cig pa'i phyir ro //	de'i yang ngo bo nyid stong pa nyid dang rog cig pa'i phyir ro //	Because its own essence is empty, and is of the same nature as emptiness.
['BO_T03_D3805:37b-4']	de lta yin yang de'i sems rang bzhin gyis 'od gsal zhes dmigs pa de'i yang rlom sems med pa'i rnam pa ste /	de lta yin yang de'i sems rang bzhin gyis 'od gsal zhes dmigs pa de'i yang rlom sems med pa'i rnam pa ste /	Even though that is so, the phrase “that mind is naturally luminous” is a reference to the absence of assumptions about that.🔽The phrase “mind is not mind” is to be understood in the sense that mind is empty of mind.🔽The phrase “form is not form” is to be understood in the sense that form is empty of form.
['BO_T03_D3805:37b-5', 'BO_T03_D3805:37b-6']	ji ltar sems ni sems med pa'i dang / de ltar gzugs la sogs pa rnams la gzugs la sogs pa med ces pa don gyis rtogs te gang du phung po lnga rnams stong pa nyid du mnyam par gsungs la 'dir ni rang bzhin gyi phyir dang mchog tu skyes bu'i don gyi rgyu nyid kyis na gtso🔽bo'i phyir na /	ji ltar sems ni sems med pa'i dang / de ltar gzugs la sogs pa rnams la gzugs la sogs pa med ces pa don gyis rtogs te gang du phung po lnga rnams stong pa nyid du mnyam par gsungs la 'dir ni rang bzhin gyi phyir dang mchog tu skyes bu'i don gyi rgyu nyid kyis na gtso bo'i phyir na /	The five aggregates are said to be the same in being empty.
['BO_T03_D3805:37b-7']	gzugs la sogs pa rnams kyang byang chub sems kyi ngo bo nyid du bsgrub bar mngon par 'dod pa nyid do //	gzugs la sogs pa rnams kyang byang chub sems kyi ngo bo nyid du bsgrub bar mngon par 'dod pa nyid do //	Here, however, form and so on are established as having the essence of bodhicitta, because they are the principal cause of the supreme human goal, because they are the supreme cause of the human goal.
['BO_T03_D3805:37b-8']	drod la sogs pa dbye ba rnams kyi dmigs pa dang rnam pa ste /	drod la sogs pa dbye ba rnams kyi dmigs pa dang rnam pa ste /	The objects and aspects of the divisions of heat and so on are as follows.
['BO_T03_D3805:37b-9']	de dang de'i mi mthun pa'i phyogs ni ldog pa'i dbye bas shes par bya'o //	de dang de'i mi mthun pa'i phyogs ni ldog pa'i dbye bas shes par bya'o //	The opposites of these should be understood through the categories of their reversals.
['BO_T03_D3805:37b-10']	'on kyang mi zhes pa ni gsal ba 'di rnam pa zhes pa'i don to //	'on kyang mi zhes pa ni gsal ba 'di rnam pa zhes pa'i don to //	However, the word “person” means the manifestation of this kind.
['BO_T03_D3805:37b-11']	nyon mongs pa med pa zhes pa'i snyoms par 'jug pa pa gnyis te /	nyon mongs pa med pa zhes pa'i snyoms par 'jug pa pa gnyis te /	The two meditative attainments called “without conflict” are as follows:
['BO_T03_D3805:37b-12']	gcig gis ni pha rol gyi rgyud kyi nyon mongs pa yang mi 'gog ste /	gcig gis ni pha rol gyi rgyud kyi nyon mongs pa yang mi 'gog ste /	One of them does not even stop the conflict of others’ continua.
['BO_T03_D3805:37b-13']	de 'dir gzung bar bya ba ma yin la /	de 'dir gzung bar bya ba ma yin la /	That is not to be taken here.
['BO_T03_D3805:37b-14']	gang du rnam par rtog pa'i nyon mongs pa 'gegs pa pa de 'dir gzung bar bya'o //	gang du rnam par rtog pa'i nyon mongs pa 'gegs pa pa de 'dir gzung bar bya'o //	That which stops the conflict of conceptualization is to be taken here.
['BO_T03_D3805:37b-15']	skabs yin pa'i phyir ro //	skabs yin pa'i phyir ro //	Because it is the context.
['BO_T03_D3805:37b-16']	'dir yang zhes pa ni 'di lta bu'i dmigs pa dang rnam pa khyad par du 'phags pa ni drod chung du nas phyir mi ldog pa'o zhes pa ste /	'dir yang zhes pa ni 'di lta bu'i dmigs pa dang rnam pa khyad par du 'phags pa ni drod chung du nas phyir mi ldog pa'o zhes pa ste /	Here, “also” means that the special object and aspect of this kind are from the lesser heat up to the irreversible.
['BO_T03_D3805:37b-17']	gang zhig dbang po rnon po dang 'bring dang shes rab rtul pos ni rab tu dga' ba dang / mi g-yo ba dag la'o //	gang zhig dbang po rnon po dang 'bring dang shes rab rtul pos ni rab tu dga' ba dang / mi g-yo ba dag la'o //	Those of sharp, medium, and dull faculties are in the Joyous and the Immovable.
['BO_T03_D3805:37b-18']	shes rab kyi pha rol tu phyin pa dang ma bral zhes pa ni des gong nas gong du yang ngo //	shes rab kyi pha rol tu phyin pa dang ma bral zhes pa ni des gong nas gong du yang ngo //	“Not separated from the perfection of wisdom” means that it is not separated from the perfection of wisdom in the future.
['BO_T03_D3805:37b-19']	drod chung ngu'i rang bzhin ni gong gi rnams la yang rdzes su sbyor ba'i phyir bcu gnyis po rnams kyi rgyu nyid kyi khyad par gyi dbang du byas nas bstan bcos su /	drod chung ngu'i rang bzhin ni gong gi rnams la yang rdzes su sbyor ba'i phyir bcu gnyis po rnams kyi rgyu nyid kyi khyad par gyi dbang du byas nas bstan bcos su /	Since the nature of weak heat is also applied to the higher stages, the treatise declares:
['BO_T03_D3805:37b-20']	theg pa gsum char thob pa'i rgyu zhes te /	theg pa gsum char thob pa'i rgyu zhes te /	“The cause of attaining the three vehicles.”
['BO_T03_D3805:37b-21']	byang chub sems dpa' rnams kyi drod la sogs pa ni byang chub rnam pa gsum thob pa'i rgyu ste /	byang chub sems dpa' rnams kyi drod la sogs pa ni byang chub rnam pa gsum thob pa'i rgyu ste /	The heat, etc., of the bodhisattvas are the cause for attaining the three kinds of enlightenment.
['BO_T03_D3805:38a-0']	kha cig phyir mi ldog pa la rigs kyi @38a * //	kha cig phyir mi ldog pa la rigs kyi @38a * //	Some, by the power of their lineage, attain the lesser enlightenment of a śrāvaka,
['BO_T03_D3805:38a-1']	stobs kyis dman pa'i byang chub kyang thob pa'i phyir la /	stobs kyis dman pa'i byang chub kyang thob pa'i phyir la /	because they do not attain the great enlightenment of a buddha.
['BO_T03_D3805:38a-2']	nyan thos dang rang sangs rgyas kyi theg pa can dag gi drod la sogs pa ni bla na med pa'i byang chub gang du yang thob bar mi byed do //	nyan thos dang rang sangs rgyas kyi theg pa can dag gi drod la sogs pa ni bla na med pa'i byang chub gang du yang thob bar mi byed do //	The heat, etc., of those in the śrāvaka and pratyekabuddha vehicles do not cause the attainment of any kind of unsurpassed enlightenment.
['BO_T03_D3805:38a-3']	gang du gsungs pa'i nyan thos kyi sa zhes pa ni 'dir 'byung bar 'gyur zhes pas sa ste /	gang du gsungs pa'i nyan thos kyi sa zhes pa ni 'dir 'byung bar 'gyur zhes pas sa ste /	The “level of the śrāvakas” mentioned in the above verse is the level that will be described below.
['BO_T03_D3805:38a-4']	de de'i rgyu mtshan no //	de de'i rgyu mtshan no //	It is the cause of that.
['BO_T03_D3805:38a-5']	mnyan par bya ba ni gzhung ngo //	mnyan par bya ba ni gzhung ngo //	“To be listened to” refers to the text.
['BO_T03_D3805:38a-6']	gzung bar bya ba ni sems la gzhag par bya ba'o //	gzung bar bya ba ni sems la gzhag par bya ba'o //	“To be taken up” means to be placed in the mind.
['BO_T03_D3805:38a-7']	klag bar bya ba ni rjed pa'i phyir kha ton du bya ba'o //	klag bar bya ba ni rjed pa'i phyir kha ton du bya ba'o //	“To be read” means to be recited in order to memorize it.
['BO_T03_D3805:38a-8']	kun chub bar bya ba ni don to rnam pa thams cad du shes par bya ba'o //	kun chub bar bya ba ni don to rnam pa thams cad du shes par bya ba'o //	“To be mastered” means to be understood in all its aspects.
['BO_T03_D3805:38a-9']	rab tu gdon par bya ba ni gzhan rnams la yang don dang gzhung dag kun tu bsgrags pa'i phyir ro //	rab tu gdon par bya ba ni gzhan rnams la yang don dang gzhung dag kun tu bsgrags pa'i phyir ro //	“To be proclaimed” means to be proclaimed to others in terms of both its meaning and its text.
