segmentnr	original	analyzed	folio	translated
['BO_T16_D4460:301b-17']	bdag nyid kyis ni khas 'ches sun dbyung ngo //	bdag nyid kyis ni khas 'ches sun dbyung ngo //	301b	is refuted by one’s own assertion.
['BO_T16_D4460:301b-18']	zhes bya ba ni rgyu med pa la shes byed 'god par 'dod na ni rgyu la ltos par 'dod la rgyu med par yang khas lan pas rang gi tshig dang 'gal ba ste /	zhes bya ba ni rgyu med pa la shes byed 'god par 'dod na ni rgyu la ltos par 'dod la rgyu med par yang khas lan pas rang gi tshig dang 'gal ba ste /	301b	If one wishes to adduce a proof for causelessness, one asserts dependence on a cause, and one also asserts causelessness. Therefore, one contradicts oneself,
['BO_T16_D4460:301b-19']	rjes su dpag pa tshad ma yin no zhes bya ba'am smra ba thams cad ba rdzun no zhes bya ba lta bur 'gyur te /	rjes su dpag pa tshad ma yin no zhes bya ba'am smra ba thams cad ba rdzun no zhes bya ba lta bur 'gyur te /	301b	just as if one says “inference is a valid means of knowledge,” or “all speech is false.”
['BO_T16_D4460:301b-20']	rgyu la bltos nas 'bras bu 'grub par shugs las khas blangs te de lta ma yin na gzhan la ba ltos par bya ba'i gtan tshigs bstan pa don med par 'gyur ro //	rgyu la bltos nas 'bras bu 'grub par shugs las khas blangs te de lta ma yin na gzhan la ba ltos par bya ba'i gtan tshigs bstan pa don med par 'gyur ro //	301b	The effect is established by implication in dependence on the cause. Otherwise, the statement of the reason because it depends on another would be pointless.
['BO_T16_D4460:302a-0']	dngos su ni dngos po thams @302a * //	dngos su ni dngos po thams @302a * //	302a	In fact,
['BO_T16_D4460:302a-1']	cad rgyu med par dam bcas pas shugs la khas blangs pa dngos su smras pa 'gal bar 'gyur ro //	cad rgyu med par dam bcas pas shugs la khas blangs pa dngos su smras pa 'gal bar 'gyur ro //	302a	the assertion is contradicted by the explicit statement, because all things are asserted to be without cause.🔽If the reason is not stated, then the opponent will not understand, and so one's own assertion will not be established.🔽The statement of this is:
['BO_T16_D4460:302a-2']	gal te rtags mi ston na ni gzhan gyis rtogs par mi 'gyur bas 'dod pa mi 'grub po zhes ston pa ni nga ste gtan tshigs zhes bya ba la sogs pa'o //	gal te rtags mi ston na ni gzhan gyis rtogs par mi 'gyur bas 'dod pa mi 'grub po zhes ston pa ni nga ste gtan tshigs zhes bya ba la sogs pa'o //	302a	If one does not state the reason,🔽the opponent will not understand,🔽and so one's own assertion will not be established.
['BO_T16_D4460:302a-3']	gang zhig ces bya ba ni rgyu med par smra ba'i gang zag go //	gang zhig ces bya ba ni rgyu med par smra ba'i gang zag go //	302a	The word one refers to the person who advocates causelessness.
['BO_T16_D4460:302a-4']	kha cig tu ni rgyu med rkyen med mthong bas zhes bya ba ni snod kyi 'jig rten la sogs pa'o //	kha cig tu ni rgyu med rkyen med mthong bas zhes bya ba ni snod kyi 'jig rten la sogs pa'o //	302a	 In some cases, one sees that there is no cause and no condition refers to the world of the environment, and so on.
['BO_T16_D4460:302a-5', 'BO_T16_D4460:302a-6']	de'i rgyu rkyen sems can gyi thun mong gi las yin pa ma mthong zhing ma shes pas dngos po thams cad rgyu med par smra na du ba me'i rgyu dang bcas par mthong bas mthong ba dang 'gal ba'o //🔽ma mthong ba de nyid du yang med par gzhag par mi nus par ston pa ni /	de'i rgyu rkyen sems can gyi thun mong gi las yin pa ma mthong zhing ma shes pas dngos po thams cad rgyu med par smra na du ba me'i rgyu dang bcas par mthong bas mthong ba dang 'gal ba'o // ma mthong ba de nyid du yang med par gzhag par mi nus par ston pa ni /	302a	If one does not see and does not understand that the cause and condition of that is the common karma of sentient beings, and if one maintains that all things are without cause, then that is contradicted by the fact that one sees that smoke has a cause in fire.🔽The following verse shows that it is impossible to maintain that one does not see what does not exist.
['BO_T16_D4460:302a-7']	gal te gang na zhes bya ba la sogs pa'i tshigs su bcad pa'o //	gal te gang na zhes bya ba la sogs pa'i tshigs su bcad pa'o //	302a	If it were the case that...
['BO_T16_D4460:302a-8', 'BO_T16_D4460:302a-9']	thams cad dbang phyug gis byas na dbang phyug mnyes par bya ba'i phyir mchod pa la sogs pa bya bar mi rigs te de'i byed pa po yang dbang phyug yin pa'i phyir ro zhes ston pa ni /🔽dbang phyug la ni re ba yis //	thams cad dbang phyug gis byas na dbang phyug mnyes par bya ba'i phyir mchod pa la sogs pa bya bar mi rigs te de'i byed pa po yang dbang phyug yin pa'i phyir ro zhes ston pa ni / dbang phyug la ni re ba yis //	302a	If everything were created by God, it would be unreasonable to perform worship, etc. in order to please God, because God would also be the agent of that.🔽The following verse shows that.🔽Why do you worship, etc.
['BO_T16_D4460:302a-10']	ci phyir phyag la sogs pa 'tshal zhes bya ba'o //	ci phyir phyag la sogs pa 'tshal zhes bya ba'o //	302a	in the hope of pleasing God?
['BO_T16_D4460:302a-11']	khyod kyi de ni rang 'byung ste zhes bya ba ni khyod kyi dbang phyug mchod pa de ni dbang phyug rang las byung gi byed pa po gzhan med pa'i phyir gang gis byas pa de'i las yin te thams cad des byas pa'i phyir ro //	khyod kyi de ni rang 'byung ste zhes bya ba ni khyod kyi dbang phyug mchod pa de ni dbang phyug rang las byung gi byed pa po gzhan med pa'i phyir gang gis byas pa de'i las yin te thams cad des byas pa'i phyir ro //	302a	That which is done by him is his action, because everything is done by him.
['BO_T16_D4460:302a-12']	de nyid gsal bar bshad pa ni mchod sbyin khyod kyis gang byas pa de ni dbang phyug gis mi byed pa ma yin te thams cad des byas pa'i phyir ro //	de nyid gsal bar bshad pa ni mchod sbyin khyod kyis gang byas pa de ni dbang phyug gis mi byed pa ma yin te thams cad des byas pa'i phyir ro //	302a	This is clarified: Whatever is done by you, O sacrifice, is not done by I§vara, because everything is done by him.
['BO_T16_D4460:302a-13']	de yang dogs pa gang gis phyir byed na bdag nyid 'byor pa thob par bya ba'i phyir de dbang phyug rang gi bsnyen bkur la sogs pa bsgrub pa'i phyir gang byed pa'i dbang phyug de nyid byed pa po yin pa'i phyir ro //	de yang dogs pa gang gis phyir byed na bdag nyid 'byor pa thob par bya ba'i phyir de dbang phyug rang gi bsnyen bkur la sogs pa bsgrub pa'i phyir gang byed pa'i dbang phyug de nyid byed pa po yin pa'i phyir ro //	302a	And if he does it out of what fear, it is in order to obtain the prosperity of his own self, because he does it in order to accomplish his own worship, etc.
['BO_T16_D4460:302a-14']	de ltar na dbang phyug la byas pa don med dam zhes bya ba'o //	de ltar na dbang phyug la byas pa don med dam zhes bya ba'o //	302a	Thus, it is said, “Is the worship of Iśvara meaningless?”
['BO_T16_D4460:302a-15']	gzhan yang thams cad kyi byed pa po dbang phyug ni skye dgu la gnod pa dang 'brel par byed pas gus pa'i yul du mi rung ngo zhes ston pa ni sdig pa chen po zhes bya ba'i tshigs su bcad pa'o //	gzhan yang thams cad kyi byed pa po dbang phyug ni skye dgu la gnod pa dang 'brel par byed pas gus pa'i yul du mi rung ngo zhes ston pa ni sdig pa chen po zhes bya ba'i tshigs su bcad pa'o //	302a	Moreover, since the creator of everything, God, is related to the harm of living beings, he is not a suitable object of respect. This is taught by the verse “He is a great evildoer.”
['BO_T16_D4460:302a-16']	da yang dbang phyug 'gyur ba ni //	da yang dbang phyug 'gyur ba ni //	302a	Moreover, if God changes,
['BO_T16_D4460:302a-17']	chos sam gzhan las 'gyur grang na //	chos sam gzhan las 'gyur grang na //	302a	is it from a property or from something else?
['BO_T16_D4460:302b-0']	zhes bya ba ni de yang 'gro ba rnams la dbang med pa'i dbang phyug tu 'gyur bar 'dod na @302b dbang phyug nyid kyi rang bzhin chos zhes bya bas 'gro ba rnams bskyed par 'dod nas rkyen gzhan la ltos nas byed par 'gyur zhes phyogs gnyis su brtags	zhes bya ba ni de yang 'gro ba rnams la dbang med pa'i dbang phyug tu 'gyur bar 'dod na @302b dbang phyug nyid kyi rang bzhin chos zhes bya bas 'gro ba rnams bskyed par 'dod nas rkyen gzhan la ltos nas byed par 'gyur zhes phyogs gnyis su brtags	302b	If you assert that God is the powerless creator of living beings, then you must investigate whether God creates living beings from his own nature, called a property, or whether he creates them in dependence on other conditions.
['BO_T16_D4460:302b-1']	pa'o // de la gal te chos las 'gyur na ni de'i snga rol dbang phyug min zhes smos te chos dang mi ldan pa'i tshe skyed par mi nus pas dbang phyug ma yin par gyur la /	pa'o // de la gal te chos las 'gyur na ni de'i snga rol dbang phyug min zhes smos te chos dang mi ldan pa'i tshe skyed par mi nus pas dbang phyug ma yin par gyur la /	302b	If it is from a property, then before that he is not God. Since he is unable to create when he is not endowed with a property, he is not God.
['BO_T16_D4460:302b-2']	gal te dbang phyug de yang chos dang ldan na skyed byed ma tshang ba med par yod pas cig car skye bar 'gyur zhes bya ba ni shugs la rig par bya'o //	gal te dbang phyug de yang chos dang ldan na skyed byed ma tshang ba med par yod pas cig car skye bar 'gyur zhes bya ba ni shugs la rig par bya'o //	302b	If that God is endowed with virtue, since the cause of creation is complete, it would follow that creation would occur simultaneously.
['BO_T16_D4460:302b-3']	phyogs gnyis pa 'gog pa ni /	phyogs gnyis pa 'gog pa ni /	302b	The second position is refuted:
['BO_T16_D4460:302b-4', 'BO_T16_D4460:302b-5']	gang dag gzhan gyis byas 'gyur ba //🔽de ni bran du 'gyur ba //	gang dag gzhan gyis byas 'gyur ba // de ni bran du 'gyur ba //	302b	If he were created by another,🔽he would be a slave.
['BO_T16_D4460:302b-6', 'BO_T16_D4460:302b-7']	de ni bran du 'gyur ba nyid //🔽ces smos te /	de ni bran du 'gyur ba nyid // ces smos te /	302b	He would be a slave.
['BO_T16_D4460:302b-8']	gzhan la bltos pa rang dbang can ma yin pa'i phyir bran dang 'dra'o zhes bya ba'o //	gzhan la bltos pa rang dbang can ma yin pa'i phyir bran dang 'dra'o zhes bya ba'o //	302b	Since he would depend on another, he would not be independent, like a slave.
['BO_T16_D4460:302b-9']	gzhan yang 'bras bu skyed pa rkyen la bltos na de nyid kyang rkyen gzhan la bltos dgos te /	gzhan yang 'bras bu skyed pa rkyen la bltos na de nyid kyang rkyen gzhan la bltos dgos te /	302b	Moreover, if the effect that is created depends on conditions, then those conditions would also have to depend on other conditions.
['BO_T16_D4460:302b-10']	ji ltar dbang po rnam shes skyed pa yul gyi rkyen la bltos pas dbang po nyid rgyu gzhan la bltos pa lta bu'o snyam du bsams pas /	ji ltar dbang po rnam shes skyed pa yul gyi rkyen la bltos pas dbang po nyid rgyu gzhan la bltos pa lta bu'o snyam du bsams pas /	302b	Just as the cause of the arising of the consciousness of the sense faculties depends on the condition of the object, the sense faculties themselves depend on other causes.
['BO_T16_D4460:302b-11']	dbang phyug de ni ci'i phyir //	dbang phyug de ni ci'i phyir //	302b	Therefore, why is that God
['BO_T16_D4460:302b-12', 'BO_T16_D4460:302b-13']	rgyu yis byas par ma gyur kye //🔽zhes smos so //	rgyu yis byas par ma gyur kye //🔽zhes smos so //	302b	not a product of causes?
['BO_T16_D4460:302b-14']	bdag gis bsad kyi sngon gyi las ma yin zhes bya ba ni las kho na ma yin pa ste /	bdag gis bsad kyi sngon gyi las ma yin zhes bya ba ni las kho na ma yin pa ste /	302b	“It is not the case that the prior karma is destroyed by the later karma, but rather that the later karma destroys the effect of the prior karma.”
['BO_T16_D4460:302b-15']	'phral gyi skyes bu'i byed pa yang khas len pa'i phyir ro zhes bya ba'o //	'phral gyi skyes bu'i byed pa yang khas len pa'i phyir ro zhes bya ba'o //	302b	This is not so, because we accept that the present action of the person is the cause of the effect.
['BO_T16_D4460:302b-16']	gal te las dang las kyi rgyu yang 'dod na /	gal te las dang las kyi rgyu yang 'dod na /	302b	If you accept that karma and the cause of karma exist,
['BO_T16_D4460:302b-17']	de lta yin na su yang grol mi 'gyur //	de lta yin na su yang grol mi 'gyur //	302b	then no one would be liberated.
['BO_T16_D4460:302b-18']	gal te las dang las de las yang las gzhan gyi stobs kyis yin pas las 'ba' zhig brgyud par gyur pas su yang grol bar mi 'gyur ro //	gal te las dang las de las yang las gzhan gyi stobs kyis yin pas las 'ba' zhig brgyud par gyur pas su yang grol bar mi 'gyur ro //	302b	If karma and the cause of karma exist, then no one would be liberated, because the continuum of karma would be endless.
['BO_T16_D4460:302b-19']	gal te las snga ma zad par bya ba'i phyir sngon gyi las ma yin pa dka' thub kyi las khas len na thams cad las kyis byas pa ma yin par 'gyur ro //	gal te las snga ma zad par bya ba'i phyir sngon gyi las ma yin pa dka' thub kyi las khas len na thams cad las kyis byas pa ma yin par 'gyur ro //	302b	If you accept that the prior karma is destroyed by the austerity of the later karma, then all karma would not be done.
['BO_T16_D4460:302b-20']	sdug bsngal rgyu yang zhes bya ba ni tshigs su bcad pa gzhan gyi 'dod pa blang ba'o //	sdug bsngal rgyu yang zhes bya ba ni tshigs su bcad pa gzhan gyi 'dod pa blang ba'o //	302b	“The cause of suffering” is the other’s assertion that is accepted.
['BO_T16_D4460:302b-21']	de ltar ma yin par ston pa ni /	de ltar ma yin par ston pa ni /	302b	To show that this is not so, he says:
['BO_T16_D4460:302b-22']	bde dang sdug bsngal de ltar gyur pa'ang med //	bde dang sdug bsngal de ltar gyur pa'ang med //	302b	There is no such transformation of pleasure into suffering.
['BO_T16_D4460:302b-23']	ces bya ba la sogs pa'o//	ces bya ba la sogs pa'o//	302b	and so on.
['BO_T16_D4460:302b-24']	'gro ba 'phya ba dag gis 'jigs nas su //	'gro ba 'phya ba dag gis 'jigs nas su //	302b	But if, fearing the world’s censure,
['BO_T16_D4460:302b-25']	sdig pa spang zhing dge la gnas na ni //	sdig pa spang zhing dge la gnas na ni //	302b	one avoids sin and lives righteously,
['BO_T16_D4460:302b-26']	sdig pa'i 'bras bu gzhan mi 'byung yang gzhan gyi rjes su de dang bstun pa'o snyam na /	sdig pa'i 'bras bu gzhan mi 'byung yang gzhan gyi rjes su de dang bstun pa'o snyam na /	302b	then, although the result of sin does not occur, the result of virtue will occur.
['BO_T16_D4460:302b-27']	gang gi tshig dang mi mthun spyod pa'i tshe //	gang gi tshig dang mi mthun spyod pa'i tshe //	302b	When one’s conduct does not accord with one’s words,
['BO_T16_D4460:302b-28']	'gro ba 'phya ba 'di yang med mi 'gyur //	'gro ba 'phya ba 'di yang med mi 'gyur //	302b	then the world’s censure will not be absent.
['BO_T16_D4460:302b-29']	zhes bya ba ni /	zhes bya ba ni /	302b	This is
['BO_T16_D4460:303a-0']	@303a * // tshig gis tshe rabs gzhan med ces zer la spyod pa'i tshe gzhan yang yod par spyod pas /	@303a * // tshig gis tshe rabs gzhan med ces zer la spyod pa'i tshe gzhan yang yod par spyod pas /	303a	because one says with one’s words that there is no other world, but one’s conduct shows that one believes in another world.
['BO_T16_D4460:303a-1']	'gal bar smras pas gzhan rnams kyi sa dpyas par 'gyur ro //	'gal bar smras pas gzhan rnams kyi sa dpyas par 'gyur ro //	303a	Since one speaks in contradiction, one is censured by others.🔽This is
['BO_T16_D4460:303a-2']	de nyid gsal bar 'chad pa ni //	de nyid gsal bar 'chad pa ni //	303a	explained clearly:
['BO_T16_D4460:303a-3']	'jig rten tshul zhes bya ba la sogs pa'o //	'jig rten tshul zhes bya ba la sogs pa'o //	303a	“The world’s censure” and so on.
['BO_T16_D4460:303a-4']	gang na rig pa'i gzhung ldan 'di 'dra ba /	gang na rig pa'i gzhung ldan 'di 'dra ba /	303a	Where there is a treatise of knowledge,
['BO_T16_D4460:303a-5']	de yi mi rigs 'khrul pa ci 'dra ste //	de yi mi rigs 'khrul pa ci 'dra ste //	303a	there is the world’s censure of one’s errors.🔽This is the
['BO_T16_D4460:303a-6']	zhes bya ba ni 'gal ba 'du ba'o //	zhes bya ba ni 'gal ba 'du ba'o //	303a	contradiction.
['BO_T16_D4460:303a-7']	ae ma'o spyi brtol can gyis zil gnon nas //	ae ma'o spyi brtol can gyis zil gnon nas //	303a	“Alas! The powerful one is overwhelmed by the bold one!”
['BO_T16_D4460:303a-8']	zhes bya ba ni /	zhes bya ba ni /	303a	This is
['BO_T16_D4460:303a-9']	rig pa'i rjes su mi 'jug pa'i gzu lums gyis bden pa khyad par du gsang pa'o //	rig pa'i rjes su mi 'jug pa'i gzu lums gyis bden pa khyad par du gsang pa'o //	303a	The truth is especially secret because of the rashness of those who do not follow the knowledge of the Vedas.
['BO_T16_D4460:303a-10']	gtsug lag ni rgyal rigs kyi chos so //	gtsug lag ni rgyal rigs kyi chos so //	303a	Veda is the religion of the warrior class.
['BO_T16_D4460:303a-11']	der chos min dor bar byas te sdig pa 'phel ba'o //	der chos min dor bar byas te sdig pa 'phel ba'o //	303a	There, unrighteousness is cast off and sin increases.
['BO_T16_D4460:303a-12']	khyed cag dga' bde ni yod mi mthong //	khyed cag dga' bde ni yod mi mthong //	303a	You do not see the happiness and joy that exist.
['BO_T16_D4460:303a-13']	zhes bya ba ni dam bca' ba'o //	zhes bya ba ni dam bca' ba'o //	303a	This is the thesis.
['BO_T16_D4460:303a-14']	'thad pa ni 'gal ba 'du ba ste gtsug zhes pa la sogs pas ston no //	'thad pa ni 'gal ba 'du ba ste gtsug zhes pa la sogs pas ston no //	303a	The argument is the collection of contradictions, shown by the words Veda and so on.
['BO_T16_D4460:303a-15']	rgyu las grub par mthong bzhin zhes bya ba ni rgyu med pa spang ngo //	rgyu las grub par mthong bzhin zhes bya ba ni rgyu med pa spang ngo //	303a	Seen to be established from causes rejects the absence of causes.
['BO_T16_D4460:303a-16']	rang dbang zhes bya ba ni de med pas dbang phyug med par shes pa'o //	rang dbang zhes bya ba ni de med pas dbang phyug med par shes pa'o //	303a	Independent means that since that does not exist, one knows there is no God.
['BO_T16_D4460:303a-17']	'jig rten pha rol shes pas chad pa ma yin pa'o //	'jig rten pha rol shes pas chad pa ma yin pa'o //	303a	Knowing the next world is not nihilism.
['BO_T16_D4460:303a-18']	las ma yin par shugs la gnas pa'o //	las ma yin par shugs la gnas pa'o //	303a	Not karma implicitly states the opposite.
['BO_T16_D4460:303a-19']	dge ba khas len pas rgyal rigs kyi chos spang ba'o //	dge ba khas len pas rgyal rigs kyi chos spang ba'o //	303a	Accepting virtue is rejecting the religion of the warrior class.
['BO_T16_D4460:303a-20']	mi'i bdag po ni bod pa'o //	mi'i bdag po ni bod pa'o //	303a	Lord of men is the king.
['BO_T16_D4460:303a-21']	lta ba bzang ngan nges par ston zhes sbyar te /	lta ba bzang ngan nges par ston zhes sbyar te /	303a	Teaching the right and wrong views is applied.
['BO_T16_D4460:303a-22']	gang gis zhe na /	gang gis zhe na /	303a	By what?
['BO_T16_D4460:303a-23', 'BO_T16_D4460:303a-24']	tshig dang spyod pa rnams kyis so //🔽de yang nam gyi tshe na khyod kyis brtags na ni zhes pa'o //	tshig dang spyod pa rnams kyis so // de yang nam gyi tshe na khyod kyis brtags na ni zhes pa'o //	303a	By words and actions.🔽And when? When you examine.
['BO_T16_D4460:303a-25']	gang gis brtags she na /	gang gis brtags she na /	303a	By what?
['BO_T16_D4460:303a-26']	rigs mthun las ni bsgrub pa'i rgyu dag gis zhes bya ba ste /	rigs mthun las ni bsgrub pa'i rgyu dag gis zhes bya ba ste /	303a	By means of proofs that are similar to it.
['BO_T16_D4460:303a-27']	rig pa ni dpe dang sgrub pa'i rgyu ni gtan tshigs so //	rig pa ni dpe dang sgrub pa'i rgyu ni gtan tshigs so //	303a	Reasoning is the example; the proof is the syllogism.
['BO_T16_D4460:303a-28']	de dang de ni gzhan gyi 'dod pa de dang de'o //	de dang de ni gzhan gyi 'dod pa de dang de'o //	303a	That and that are the other's assertions.🔽And that is the proof that depends on the spiritual master.
['BO_T16_D4460:303a-29']	'thad pa de lta bu de yang dge ba'i bshes gnyen la rag las pa ni skye bo ngan pa'i zhes pa'i rkang pa gnyis so //	'thad pa de lta bu de yang dge ba'i bshes gnyen la rag las pa ni skye bo ngan pa'i zhes pa'i rkang pa gnyis so //	303a	The two lines beginning By relying on evil friends refer to the lack of restraint.🔽 The lack of restraint is the lack of fear of the next world.🔽 The lack of shame is the lack of fear of this world.🔽 The lack of conscience is the lack of fear of either.🔽 The lack of faith is the lack of trust in the law of karma and its effects.🔽 The lack of respect is the lack of awe of the three jewels.🔽 The lack of modesty is the lack of embarrassment in the presence of others.
['BO_T16_D4460:303a-30']	sdig pa'i grogs po nyid bsten pa ni mi sdom par yang zhes bya ba la sogs pa'o //	sdig pa'i grogs po nyid bsten pa ni mi sdom par yang zhes bya ba la sogs pa'o //	303a	 The lack of conscientiousness is the lack of fear of the results of evil actions.🔽 The lack of purity is the lack of faith in the three jewels.🔽 The lack of faith is the lack of trust in the law of karma and its effects.🔽 The lack of respect is the lack of awe of the three jewels.
['BO_T16_D4460:303a-31']	rgyu med par sma ba la sogs pa ni gang zag go //	rgyu med par sma ba la sogs pa ni gang zag go //	303a	 The lack of modesty is the lack of embarrassment in the presence of others.
['BO_T16_D4460:303a-32']	rtsub pos bsgos pa ni lta ba ngan pas sems dbang sgyur ba'o //	rtsub pos bsgos pa ni lta ba ngan pas sems dbang sgyur ba'o //	303a	 The lack of conscientiousness is the lack of fear of the results of evil actions.🔽 The lack of purity is the lack of faith in the three jewels.🔽 The lack of faith is the lack of trust in the law of karma and its effects.🔽 The lack of respect is the lack of awe of the three jewels.
['BO_T16_D4460:303a-33']	de na khyad par mngon pas spyang ki bzhin zhes bya ba la /	de na khyad par mngon pas spyang ki bzhin zhes bya ba la /	303a	 The lack of modesty is the lack of embarrassment in the presence of others.🔽 The lack of conscientiousness is the lack of fear of the results of evil actions.🔽 The lack of purity is the lack of faith in the three jewels.🔽 The lack of faith is the lack of trust in the law of karma and its effects.🔽 The lack of respect is the lack of awe of the three jewels.
['BO_T16_D4460:303a-34']	de na zhes bya ba ni pha rol gyi 'dod pa de na'o //	de na zhes bya ba ni pha rol gyi 'dod pa de na'o //	303a	 The lack of modesty is the lack of embarrassment in the presence of others.🔽 The lack of conscientiousness is the lack of fear of the results of evil actions.🔽 The lack of purity is the lack of faith in the three jewels.🔽 The lack
['BO_T16_D4460:303a-35']	khyad par mngon pa ni dpyad na khyad par du mi bden par rtogs pa ste /	khyad par mngon pa ni dpyad na khyad par du mi bden par rtogs pa ste /	303a	In particular, one should understand that when analyzed, distinctions are not truly existent.🔽For example, it is like the story of the deception, “This is the footprint of a rākṣasa or a wolf.”
['BO_T16_D4460:303b-0']	dper na srin po spyang ki'i rjes yin no zhes bslus pa'i gtam rgyud lta bu ste brtags na phyin ci @303b log par rtogs pa'o //	dper na srin po spyang ki'i rjes yin no zhes bslus pa'i gtam rgyud lta bu ste brtags na phyin ci @303b log par rtogs pa'o //	303b	When examined, one realizes that it is a footprint of a dog.
['BO_T16_D4460:303b-1']	chun pa ni zhing 'chu ba'o //	chun pa ni zhing 'chu ba'o //	303b	A farmer is one who cultivates ten fields.
['BO_T16_D4460:303b-2']	de rnams rgyu dpyas dbul ba ste mar la sogs pa 'bul lo //	de rnams rgyu dpyas dbul ba ste mar la sogs pa 'bul lo //	303b	They are impoverished by the analysis of causes, and offer butter and so on.
['BO_T16_D4460:303b-3']	de rnams shing gi khyad par skyong ba ltar ma bskyangs pa na zhes bya ba'o //	de rnams shing gi khyad par skyong ba ltar ma bskyangs pa na zhes bya ba'o //	303b	They are not protected like the special trees called “protected.”
['BO_T16_D4460:303b-4']	sman rnams ni mar dang sbrang rtsi la sogs pa'o //	sman rnams ni mar dang sbrang rtsi la sogs pa'o //	303b	Medicines are butter, honey, and so on.
['BO_T16_D4460:303b-5']	dbu rmog mi brtson pa ni gzhan gyis pho rnyas pa'o ;	dbu rmog mi brtson pa ni gzhan gyis pho rnyas pa'o ;	303b	Not being diligent in the head turban is being ridiculed by others.
['BO_T16_D4460:303b-6']	/ zhabs tog cher 'bul ba ni cher phan btags pa'o //	/ zhabs tog cher 'bul ba ni cher phan btags pa'o //	303b	Offering great service is greatly benefiting others.
['BO_T16_D4460:303b-7']	bya dga' stsal ba ni bsnyen bkur dang mthun par gzhan la phan gdags pa'o //	bya dga' stsal ba ni bsnyen bkur dang mthun par gzhan la phan gdags pa'o //	303b	Giving rewards is benefiting others in accordance with respect and honor.
['BO_T16_D4460:303b-8']	nan tur ni drag shul gyis tshar bcad pa'o //	nan tur ni drag shul gyis tshar bcad pa'o //	303b	Punishment is destroying with harshness.
['BO_T16_D4460:303b-9']	byang chub chen po'i rabs te nyi shu rtsa gsum mo /	byang chub chen po'i rabs te nyi shu rtsa gsum mo /	303b	This is the twenty-third chapter, on the lineage of great enlightenment.
['BO_T16_D4460:303b-10']	// / khyod kyi phyir ni nga yang sdig can gyur ;	// / khyod kyi phyir ni nga yang sdig can gyur ;	303b	And for your sake I have become a sinner.
['BO_T16_D4460:303b-11']	/ zhes bya ba ni shin tu smad pa'i phyir smras kyi byang chub sems dpa' la ni sdig pa cung zad kyang med do //	/ zhes bya ba ni shin tu smad pa'i phyir smras kyi byang chub sems dpa' la ni sdig pa cung zad kyang med do //	303b	 This is said because of the great contempt, but the Bodhisattva has not the slightest sin.
['BO_T16_D4460:303b-12']	byas pa la drin du gzo ba'i yon tan ni gnyis te /	byas pa la drin du gzo ba'i yon tan ni gnyis te /	303b	The quality of gratitude is twofold:
