segmentnr	original	analyzed	translated
['BO_T11_D4223:279a-20']	gang zhig ldog pa dang gang las ldog pa gnyis po de phan tshun bsten pa yin pas na shing ngam /	gang zhig ldog pa dang gang las ldog pa gnyis po de phan tshun bsten pa yin pas na shing ngam /	Since the object from which it is stopped and that which stops it are mutually dependent, it is like a tree or a wall.
['BO_T11_D4223:279a-21']	shing ma yin pa gcig 'dzin pa'i phyir gzhan sel ba la brdar btags pa mi srid do //	shing ma yin pa gcig 'dzin pa'i phyir gzhan sel ba la brdar btags pa mi srid do //	Because the object that is eliminated and that from which it is eliminated are mutually dependent, it is impossible to designate a convention of other-exclusion in order to apprehend either a tree or a non-tree.
['BO_T11_D4223:279a-22']	shing ma yin pa rtogs pas yul du ma byas par ni de las log pa'i shing nges par nus pa ma yin no //	shing ma yin pa rtogs pas yul du ma byas par ni de las log pa'i shing nges par nus pa ma yin no //	Without the apprehension of a non-tree, it is impossible to ascertain a tree that is the opposite of that non-tree.
['BO_T11_D4223:279a-23']	shing gi shing ma yin pa las ldog pa dang / shing ma yin pa las kyang tha dad pa ni shing ma yin pas stong pa nyid yin no //	shing gi shing ma yin pa las ldog pa dang / shing ma yin pa las kyang tha dad pa ni shing ma yin pas stong pa nyid yin no //	The tree is the opposite of a non-tree and is also different from a non-tree.
['BO_T11_D4223:279a-24']	des na shing ma yin pa rtogs pas yul du ma byas pa na /	des na shing ma yin pa rtogs pas yul du ma byas pa na /	Therefore, when the apprehension of a non-tree does not apprehend its object,
['BO_T11_D4223:279a-25']	gang rnam par gcad pas shing bzung ba shing ma yin pa las ldog pa 'dzin par 'gyur ba 'di gang zhig med pa yin /	gang rnam par gcad pas shing bzung ba shing ma yin pa las ldog pa 'dzin par 'gyur ba 'di gang zhig med pa yin /	what is it that is apprehended as a tree, which is the opposite of a non-tree, by the exclusion of that non-tree?
['BO_T11_D4223:279a-26']	shing ma yin pa las ldog par nges na shing ma yin pa yin pa kho na'o zhen / bzung mod kyi shing ma yin pa bzung bas de shing las ldog par 'dzin par 'gyur ro //	shing ma yin pa las ldog par nges na shing ma yin pa yin pa kho na'o zhen / bzung mod kyi shing ma yin pa bzung bas de shing las ldog par 'dzin par 'gyur ro //	But by apprehending non-tree, it becomes the apprehension of the opposite of tree.
['BO_T11_D4223:279b-0']	gal te shing ma yin pa ldog par mi 'dzin na rnam par rtog pa'i yul yin yang gzhan sel ba ma yin pa'i phyir gzhan sel ba'i @279b yul can nyid nyams so //	gal te shing ma yin pa ldog par mi 'dzin na rnam par rtog pa'i yul yin yang gzhan sel ba ma yin pa'i phyir gzhan sel ba'i @279b yul can nyid nyams so //	If it does not apprehend the opposite of non-tree, then even though it is the object of conceptual cognition, it is not an instance of the exclusion of other, so the claim that it is the object of the exclusion of other is undermined.
['BO_T11_D4223:279b-1']	gal te de las ldog pa kho nas 'dzin to zhe na /	gal te de las ldog pa kho nas 'dzin to zhe na /	If it is argued that it apprehends only the opposite of that,
['BO_T11_D4223:279b-2']	des na da ni shing ma yin pa ni shing las log par gzung bar bya la /	des na da ni shing ma yin pa ni shing las log par gzung bar bya la /	then now the non-tree should be apprehended as the opposite of tree.
['BO_T11_D4223:279b-3']	shing yang shing ma yin las ldog pa yin pa'i phyir shing ma yin par 'dzin pa ni shing 'dzin pa la ltos pa yin la shing yang shing ma yin pa 'dzin pa la ltos par 'gyur ba des na gnyis phan tshun bsten par 'gyur ro //	shing yang shing ma yin las ldog pa yin pa'i phyir shing ma yin par 'dzin pa ni shing 'dzin pa la ltos pa yin la shing yang shing ma yin pa 'dzin pa la ltos par 'gyur ba des na gnyis phan tshun bsten par 'gyur ro //	And since tree is also the opposite of non-tree, the apprehension of non-tree depends on the apprehension of tree, and the apprehension of tree depends on the apprehension of non-tree. Thus the two would mutually rely on each other.
['BO_T11_D4223:279b-4']	des na de ltar rang dbang du gcig kyang 'dzin par mi srid pas na /	des na de ltar rang dbang du gcig kyang 'dzin par mi srid pas na /	Therefore, since it is impossible for such an independent single entity to be apprehended,
['BO_T11_D4223:279b-5']	'dzin pa phan tshun ltos pas gnyi ga 'dzin par mi nus pa'i phyir de la brda mi srid pas na brda yang de rig don can yin pa kho na zhes ci ste brjod /	'dzin pa phan tshun ltos pas gnyi ga 'dzin par mi nus pa'i phyir de la brda mi srid pas na brda yang de rig don can yin pa kho na zhes ci ste brjod /	the mutual dependence of the apprehender and the apprehended means that neither can be apprehended. Therefore, since a sign is impossible, why would you say that a sign is only that which causes the awareness of an object?
['BO_T11_D4223:279b-6']	'on te shing ma yin pa ni gzhan la ldog par 'dzin la shing ni shing ma yin pa las phan tshun bsten pa ma yin no zhe na /	'on te shing ma yin pa ni gzhan la ldog par 'dzin la shing ni shing ma yin pa las phan tshun bsten pa ma yin no zhe na /	But if you say that the non-tree is apprehended as different from the other, and the tree is not mutually dependent with the non-tree,
['BO_T11_D4223:279b-7']	de'i tshe thug pa med par thal te /	de'i tshe thug pa med par thal te /	then it follows that there is an infinite regress.
['BO_T11_D4223:279b-8']	gzhan de 'dzin pa yang gdon mi za ba dang / ldog pa'i yul can yin pas na gzhan dang gzhan 'dzin par rtogs pa la mthar thug pa med pa'i phyir ro //	gzhan de 'dzin pa yang gdon mi za ba dang / ldog pa'i yul can yin pas na gzhan dang gzhan 'dzin par rtogs pa la mthar thug pa med pa'i phyir ro //	This is because the apprehension of that other is also definitely the subject that apprehends the object that is the opposite of that, and there is no end to the realization of the apprehension of other and other.
['BO_T11_D4223:279b-9']	'di nyid bshad pa ni /	'di nyid bshad pa ni /	This is explained as follows:
['BO_T11_D4223:279b-10']	kha cig na re zhes bya ba'o //	kha cig na re zhes bya ba'o //	Some say.
['BO_T11_D4223:279b-11']	da ni gang du rnam par gcad par bya ba med pas /	da ni gang du rnam par gcad par bya ba med pas /	Now, since there is no object of exclusion,
['BO_T11_D4223:279b-12']	rnam par gcad nas rnam par gcod pa'i yul 'dzin pa'i phyir rnam par gcad par bya ba 'dzin par thal ba na /	rnam par gcad nas rnam par gcod pa'i yul 'dzin pa'i phyir rnam par gcad par bya ba 'dzin par thal ba na /	Because the object of exclusion is apprehended by exclusion, it follows that exclusion is apprehended.🔽But exclusion is not like that, which would entail the fault stated above.🔽Thus, since exclusion is accepted in other contexts as well, the question is asked of the opponent:
['BO_T11_D4223:279b-13']	ji skad brjod pa'i nyes ba dang rjes su 'brel par 'gyur ba rnam pa de lta bu ni rnam par gcod pa ma yin no zhes gzhan du yang rnam par gcod pa khas blang ba'i phyir pha rol po la 'dri ba ni de dag gi ni brdar 'dogs	ji skad brjod pa'i nyes ba dang rjes su 'brel par 'gyur ba rnam pa de lta bu ni rnam par gcod pa ma yin no zhes gzhan du yang rnam par gcod pa khas blang ba'i phyir pha rol po la 'dri ba ni de dag gi ni brdar 'dogs	When a convention is🔽established for a universal that is the definition of a tree,🔽is a non-tree excluded or not?
['BO_T11_D4223:279b-14', 'BO_T11_D4223:279b-15']	la zhes bya ba'o //🔽gang gi tshe gzhan sel ba sgra'i don ma yin gyi /	la zhes bya ba'o // gang gi tshe gzhan sel ba sgra'i don ma yin gyi /	The commentary says “those who say that.”
['BO_T11_D4223:279b-16', 'BO_T11_D4223:279b-17']	'on kyang shing nyid kyi mtshan nyid kyi spyi nyid la brdar 'dogs pa de'i tshe yang brdar 'dogs pa de la 'am sgra'i don 'chad pa la shing ma yin pa rnam par gcod dam 'on te ma yin /🔽'grel ba ni gang dag de ltar zhes bya ba'o //	'on kyang shing nyid kyi mtshan nyid kyi spyi nyid la brdar 'dogs pa de'i tshe yang brdar 'dogs pa de la 'am sgra'i don 'chad pa la shing ma yin pa rnam par gcod dam 'on te ma yin /🔽'grel ba ni gang dag de ltar zhes bya ba'o //	When a convention is established for a universal that is the definition of a tree, but exclusion of others is not the meaning of the word, then when a convention is established for that or the meaning of the word tree, is a non-tree excluded or not?
['BO_T11_D4223:279b-18']	rnam par gcod pa khas len pa'i phyogs la rang gis brjod pa'i skyon du thal bar 'gyur ba de'i phyir bshad pa ni /	rnam par gcod pa khas len pa'i phyogs la rang gis brjod pa'i skyon du thal bar 'gyur ba de'i phyir bshad pa ni /	The explanation of the consequence of the error that is stated by the opponent who accepts the exclusion is as follows.
['BO_T11_D4223:279b-19']	gal te rnam gcod ces bya'o //	gal te rnam gcod ces bya'o //	If it is called an exclusion,
['BO_T11_D4223:279b-20']	rnam par gcod pas khas len na ni shing gi rnam par gcod pa shing ma yin pa rtogs pa sngon du 'gro ba can yin la shing ma yin pa yang shing rnam par gcad pa med pa can ni rtogs par mi nus te /	rnam par gcod pas khas len na ni shing gi rnam par gcod pa shing ma yin pa rtogs pa sngon du 'gro ba can yin la shing ma yin pa yang shing rnam par gcad pa med pa can ni rtogs par mi nus te /	if it is accepted by way of exclusion, then the exclusion of a tree is preceded by the apprehension of a non-tree, and a non-tree that is not the exclusion of a tree cannot be apprehended.
['BO_T11_D4223:279b-21']	des na gal te shing ma yin pa rnam par gcad par 'gyur na de dag shing 'dzin pa med par gzung mi nus pa'i phyir phan tshun bsten pa nyid do //	des na gal te shing ma yin pa rnam par gcad par 'gyur na de dag shing 'dzin pa med par gzung mi nus pa'i phyir phan tshun bsten pa nyid do //	Therefore, if a non-tree were to be excluded, since it could not be apprehended without apprehending a tree, they would be mutually dependent.
['BO_T11_D4223:280a-0']	@280a * // de nyid bshad pa ni de'i tshe zhes bya ba ste /	@280a * // de nyid bshad pa ni de'i tshe zhes bya ba ste /	That is explained as follows: at that time,
['BO_T11_D4223:280a-1']	rnam par gcad pa'i tshe'o //	rnam par gcad pa'i tshe'o //	when there is an exclusion,
['BO_T11_D4223:280a-2']	shing dang shing ma yin pa shes par bya ba'i phyir shing dang shing ma yin pa don du gnyer bar nye bar 'gro ba'i phyir ro //	shing dang shing ma yin pa shes par bya ba'i phyir shing dang shing ma yin pa don du gnyer bar nye bar 'gro ba'i phyir ro //	because in order to know a tree and a non-tree, one would have to approach the purpose of seeking a tree and a non-tree.
['BO_T11_D4223:280a-3']	gang zhig shing ngam shing ma yin pa so so rang gis rang bzhin la rnam par rtog pa don du gnyer ba byed pa des de dag gi thun mong ma yin pa'i rang bzhin shes pa ni rnam par gcod pas bsgrub par bya ba yin pa nyid kyis	gang zhig shing ngam shing ma yin pa so so rang gis rang bzhin la rnam par rtog pa don du gnyer ba byed pa des de dag gi thun mong ma yin pa'i rang bzhin shes pa ni rnam par gcod pas bsgrub par bya ba yin pa nyid kyis	Whoever is intent on discerning the individual natures of trees and non-trees, for him the knowledge of their uncommon nature is established by exclusion.
['BO_T11_D4223:280a-4']	rnam par gcad pa khas blangs pa yin te /	rnam par gcad pa khas blangs pa yin te /	Therefore, exclusion is accepted.
['BO_T11_D4223:280a-5']	de ni de'i tshad ma can yin pa'i phyir ro //	de ni de'i tshad ma can yin pa'i phyir ro //	Because that is the valid cognition of that.
['BO_T11_D4223:280a-6']	des na rnam par gcod pa med na 'di gnyis kyi shes pa yod pa yin no //	des na rnam par gcod pa med na 'di gnyis kyi shes pa yod pa yin no //	Therefore, if there is no exclusion, these two cognitions exist.
['BO_T11_D4223:280a-7']	rnam par gcod na yang phan tshun bsten pa'i phyir mi shes par 'gyur ro zhes ston pa ni /	rnam par gcod na yang phan tshun bsten pa'i phyir mi shes par 'gyur ro zhes ston pa ni /	If there is exclusion, they would not be cognized because of mutual dependence.
['BO_T11_D4223:280a-8']	de mi shes pa ni des zhes bya ba'o //	de mi shes pa ni des zhes bya ba'o //	The explanation of that is: “The non-cognition of that is by that.”
['BO_T11_D4223:280a-9']	de ltar rnam par gcod pas khas len na nyes pa mtshungs pa nyid brjod nas rnam par gcod pa ma yin pa'i phyogs kyang spang ba'i phyir bshad pa /	de ltar rnam par gcod pas khas len na nyes pa mtshungs pa nyid brjod nas rnam par gcod pa ma yin pa'i phyogs kyang spang ba'i phyir bshad pa /	Thus, having stated the equivalence of faults when accepting exclusion, in order to abandon the position of non-exclusion, it is said:
['BO_T11_D4223:280a-10']	rnam par gcod pa mi rtogs na yang shing de las gzhan shing ma yin pa la dgod pa ni de las gzhan dgod pa'o //	rnam par gcod pa mi rtogs na yang shing de las gzhan shing ma yin pa la dgod pa ni de las gzhan dgod pa'o //	And even if the exclusion is not understood, the application of the word to what is not a tree, which is other than the tree, is the application to what is other than that.
['BO_T11_D4223:280a-11']	de las gzhan pa la 'god pa'ang de nyid la yongs su ma spangs pa yang yin pa de gang la yod pa ste /	de las gzhan pa la 'god pa'ang de nyid la yongs su ma spangs pa yang yin pa de gang la yod pa ste /	And the application to what is other than that is the non-relinquishment of that.
['BO_T11_D4223:280a-12']	sgra de las tha snyad 'dogs par byed pa rnams shing ma yin pa yongs su spangs nas 'jug par mi 'gyur ro //	sgra de las tha snyad 'dogs par byed pa rnams shing ma yin pa yongs su spangs nas 'jug par mi 'gyur ro //	And that is the word, because those who make conventional expressions do not engage in the relinquishment of what is not a tree.
['BO_T11_D4223:280a-13']	shing ma yin pa la dgod pa na de rtogs pa'i 'bras bu can nyid du rjod par byed pa la sbyor ba'o //	shing ma yin pa la dgod pa na de rtogs pa'i 'bras bu can nyid du rjod par byed pa la sbyor ba'o //	When it is applied to what is not a tree, it is applied to the expression of the result of the understanding of that.
['BO_T11_D4223:280a-14']	shing gi sgra de ni shing ma yin pa dag la ma bkag pa'i phyir de las tha snyad 'dogs par byed pa rnams de yongs su spangs nas 'jug par mi 'gyur ro //	shing gi sgra de ni shing ma yin pa dag la ma bkag pa'i phyir de las tha snyad 'dogs par byed pa rnams de yongs su spangs nas 'jug par mi 'gyur ro //	And that word tree is not applied to what is not a tree because it is not excluded from that.
['BO_T11_D4223:280a-15']	'di la yang rgyu mtshan bshad pa ni brda la shing ma yin de dag la ma gsal ba'i phyir ro //	'di la yang rgyu mtshan bshad pa ni brda la shing ma yin de dag la ma gsal ba'i phyir ro //	And the reason for that is stated: because the word is not clear with regard to what is not a tree.
['BO_T11_D4223:280a-16']	'di skad brjod pa yin te /	'di skad brjod pa yin te /	This is what is said:
['BO_T11_D4223:280a-17']	rnam par gcod pa ma gtogs na shing ma yin pa gsal ba can gyi shing gi bdag nyid thun mong ma yin pa la sgra ma bkod pa des na shing khyer shog ces bya bas shing ma yin pa spangs nas shing nges par rtogs par ji ltar 'gyur	rnam par gcod pa ma gtogs na shing ma yin pa gsal ba can gyi shing gi bdag nyid thun mong ma yin pa la sgra ma bkod pa des na shing khyer shog ces bya bas shing ma yin pa spangs nas shing nges par rtogs par ji ltar 'gyur	If the word tree were not applied to the uncommon nature of a tree that excludes non-tree, then how could the word bring the tree, having excluded non-tree, come to ascertain tree?
['BO_T11_D4223:280a-18']	/ gang zhig gang yongs su spangs nas ma bkod pa de las de yongs su dor ba mi 'thad de /	/ gang zhig gang yongs su spangs nas ma bkod pa de las de yongs su dor ba mi 'thad de /	It is not tenable to exclude something from that to which it is not applied.
['BO_T11_D4223:280a-19']	dper na 'di nyid la shing sha pa la sogs pa'i khyad par bzhin no //	dper na 'di nyid la shing sha pa la sogs pa'i khyad par bzhin no //	For example, it is like the particularities of a śimśapā tree and so on.
['BO_T11_D4223:280a-20']	de bas na rnam par mi gcod pa ni mi 'thad do //	de bas na rnam par mi gcod pa ni mi 'thad do //	Therefore exclusion is untenable.
['BO_T11_D4223:280a-21']	'di nyid bshad pa ni /	'di nyid bshad pa ni /	This is explained as follows:
['BO_T11_D4223:280b-0']	brda'i tshe zhes @280b bya ba'o //	brda'i tshe zhes @280b bya ba'o //	At the time of convention.
['BO_T11_D4223:280b-1']	'dir pha rol po dag rnam par gcod pas stong ba'i sgrub pa khas len pa nyid la nyes pa 'dir 'gyur gyi gang las sgrub pa dang rnam par gcod pa yang yod pa de la ni ma yin te /	'dir pha rol po dag rnam par gcod pas stong ba'i sgrub pa khas len pa nyid la nyes pa 'dir 'gyur gyi gang las sgrub pa dang rnam par gcod pa yang yod pa de la ni ma yin te /	This fault would apply to the opponent who accepts that exclusion is empty of establishment, but not to that from which establishment and exclusion exist.
['BO_T11_D4223:280b-2']	de'i ltar na ni bsgrub pa'i don la phyis rnam par gcod pa yin no //	de'i ltar na ni bsgrub pa'i don la phyis rnam par gcod pa yin no //	In that case, the object of proof is later excluded.
['BO_T11_D4223:280b-3']	des na rang la brten pa'i sgrub pas nges pa'i shing dang shing ma yin pa gnyis shes pa 'di ni shing ma yin zhe'am /	des na rang la brten pa'i sgrub pas nges pa'i shing dang shing ma yin pa gnyis shes pa 'di ni shing ma yin zhe'am /	Therefore, this cognition of a tree and a non-tree, which is ascertained by the proof that depends on itself, is the exclusion of a non-tree in a tree, or the exclusion of a tree in a non-tree.
['BO_T11_D4223:280b-4']	'di ni shing ngo zhes shing la shing ma yin pa rnam par gcod la shing ma yin pa la yang rnam par gcod pa'i phyir te /	'di ni shing ngo zhes shing la shing ma yin pa rnam par gcod la shing ma yin pa la yang rnam par gcod pa'i phyir te /	Because it excludes a non-tree in a tree, and it excludes a tree in a non-tree.
['BO_T11_D4223:280b-5']	des na 'dir rnam par gcod pa yin yang phan tshun bsten pa'i nyes par mi 'gyur ro zhes smra ba ni /	des na 'dir rnam par gcod pa yin yang phan tshun bsten pa'i nyes par mi 'gyur ro zhes smra ba ni /	Therefore, although there is exclusion here, the fault of mutual dependence does not arise.
['BO_T11_D4223:280b-6']	'on te zhes bya ba'o //	'on te zhes bya ba'o //	This is what is said.🔽Here, it is recited as:
['BO_T11_D4223:280b-7']	'dir / gal te mi sgrub gzhan mi dgag / ces 'don /	'dir / gal te mi sgrub gzhan mi dgag / ces 'don /	If there is no proof, there is no exclusion of another.
['BO_T11_D4223:280b-8']	gna' rabs dag gis rmongs pas 'dor ro //	gna' rabs dag gis rmongs pas 'dor ro //	The ancients abandoned it out of confusion.
['BO_T11_D4223:280b-9']	'dir mi 'thad pa ni ma yin te /	'dir mi 'thad pa ni ma yin te /	Here, it is not untenable.
['BO_T11_D4223:280b-10']	rnam par gcod pa'i bdag nyid kyi sgrub pa sel bar smra ba rnams kyis de ltar 'dod pa nyid gzhan gyis spangs pa'i phyir ro //	rnam par gcod pa'i bdag nyid kyi sgrub pa sel bar smra ba rnams kyis de ltar 'dod pa nyid gzhan gyis spangs pa'i phyir ro //	Because those who advocate exclusion as the nature of proof assert it in that way, it is abandoned by others.
['BO_T11_D4223:280b-11']	rnam par gcod pa la ni gnyis rtogs pa yin te /	rnam par gcod pa la ni gnyis rtogs pa yin te /	In the case of exclusion, there is the cognition of two things.
['BO_T11_D4223:280b-12']	dgag pa dang sgrub pa'i phyir ro //	dgag pa dang sgrub pa'i phyir ro //	Because of negation and affirmation.🔽Therefore, exclusion is said to be the activity of negation alone, which is different from affirmation.
['BO_T11_D4223:280b-13', 'BO_T11_D4223:280b-14']	de nyid kyi phyir 'ba' zhig gi dgag pa sgrub pa las gzhan pa'i byed pa can ni rnam par gcod pa yin no zhes brjod de 'di ni shing ma yin pa ma yin no zhes shing ma yin pa bkag nas shing sgrub pa ni rnam par gcod pa'i🔽rang bzhin yin pa'i phyir ro //	de nyid kyi phyir 'ba' zhig gi dgag pa sgrub pa las gzhan pa'i byed pa can ni rnam par gcod pa yin no zhes brjod de 'di ni shing ma yin pa ma yin no zhes shing ma yin pa bkag nas shing sgrub pa ni rnam par gcod pa'i rang bzhin yin pa'i phyir ro //	Because it is the nature of exclusion to affirm a tree by negating the absence of a tree, saying “This is not a non-tree.”
['BO_T11_D4223:280b-15']	des na dgag pa gnyis kyis rnam par gcod pa bkag par 'gyur ba'i phyir /	des na dgag pa gnyis kyis rnam par gcod pa bkag par 'gyur ba'i phyir /	Therefore, by the two negations, exclusion is negated.
['BO_T11_D4223:280b-16']	gal te mi sgrub gzhan mi dgag / ces brjod pa yin no //	gal te mi sgrub gzhan mi dgag / ces brjod pa yin no //	Therefore, it is said: “If one does not affirm, one does not negate anything else.”
['BO_T11_D4223:280b-17']	rnam par gcod pas ni //	rnam par gcod pas ni //	Exclusion
['BO_T11_D4223:280b-18']	ci car gnyis med pa yin te /	ci car gnyis med pa yin te /	is not instantaneous,
['BO_T11_D4223:280b-19']	des na de ltar gyur pa'i 'di gnyis bkag pa yin no //	des na de ltar gyur pa'i 'di gnyis bkag pa yin no //	therefore, these two are negated in this way.
['BO_T11_D4223:280b-20']	de ltar gnyi ga sgrub pa bsal nas rang gi bsam pas sgrub pa dag pa nyid ston pa ni /	de ltar gnyi ga sgrub pa bsal nas rang gi bsam pas sgrub pa dag pa nyid ston pa ni /	Thus, having removed both affirmation and exclusion, in order to show the purity of affirmation by one’s own thought, it is said:
['BO_T11_D4223:280b-21']	mdun gnas gcig cig rab bstan nas //	mdun gnas gcig cig rab bstan nas //	Having shown one thing present in front,
['BO_T11_D4223:280b-22']	zhes pa'o // rnam par gcod pa ma byas shing sgrub pa 'ba' zhig byas te /	zhes pa'o // rnam par gcod pa ma byas shing sgrub pa 'ba' zhig byas te /	Thus, without any exclusion, only affirmation is made.
['BO_T11_D4223:280b-23', 'BO_T11_D4223:280b-24']	brdar byed do zhes bya ba'i tha tshig go //🔽des na / brda la de dag mi sel na //	brdar byed do zhes bya ba'i tha tshig go // des na / brda la de dag mi sel na //	This is what is meant by “the convention is made.”🔽Therefore, since it is said that “if they are not excluded in the convention,”
['BO_T11_D4223:280b-25']	zhes bya bas rnam par mi gcod pa la brjod pa'i skyon gang yin pa de med do zhes smras pas ni gang kho na la brdar byas pa ni tha snyad 'dogs pa'i tshe na yang de kho na rtogs par 'gyur te /	zhes bya bas rnam par mi gcod pa la brjod pa'i skyon gang yin pa de med do zhes smras pas ni gang kho na la brdar byas pa ni tha snyad 'dogs pa'i tshe na yang de kho na rtogs par 'gyur te /	then whatever is the basis of the convention will be understood just as it is when the convention is made.
['BO_T11_D4223:280b-26', 'BO_T11_D4223:281a-0']	de'i phyir rnam par gcod pa dang rnam par mi gcod pa gnyis la yod pa'i nyes pa'o //🔽gang gi tshe gal te gzhan bkag @281a * //	de'i phyir rnam par gcod pa dang rnam par mi gcod pa gnyis la yod pa'i nyes pa'o // gang gi tshe gal te gzhan bkag @281a * //	Therefore, the error that is involved in both exclusion and non-exclusion is not committed.
['BO_T11_D4223:281a-1']	mi sgrub par byed ces 'don pa de'i tshe yang 'di rnam par gcod pa 'gog pa nyid do //	mi sgrub par byed ces 'don pa de'i tshe yang 'di rnam par gcod pa 'gog pa nyid do //	If the reading is “if the other is not affirmed by the negation,” then exclusion is negated.
['BO_T11_D4223:281a-2']	dgag pa sgrub pa'i rang bzhin ni rnam par gcod pa yin pas de spangs te zhes bya ba'i don te /	dgag pa sgrub pa'i rang bzhin ni rnam par gcod pa yin pas de spangs te zhes bya ba'i don te /	Since the nature of negation is exclusion, the meaning of “having abandoned that” is as follows.
['BO_T11_D4223:281a-3']	de nyid kyi phyir 'grel pa spyi dngos por smra ba'i ltar na 'ga' zhig rnam par gcad pas cung zad gcig brjod pa ni ma yin no zhes rnam par gcod pa 'gog pa ni 'dod pa gnyi gar yang rjes su mthun no //	de nyid kyi phyir 'grel pa spyi dngos por smra ba'i ltar na 'ga' zhig rnam par gcad pas cung zad gcig brjod pa ni ma yin no zhes rnam par gcod pa 'gog pa ni 'dod pa gnyi gar yang rjes su mthun no //	Therefore, the refutation of the exclusion in the statement in the Commentary, “according to the proponents of real entities, it is not that something is expressed by the exclusion of some other,” is acceptable to both parties.
['BO_T11_D4223:281a-4']	tha snyad 'dogs pa'i tshe na yang de rtogs par 'gyur te zhes bya ba bshad pa ni /	tha snyad 'dogs pa'i tshe na yang de rtogs par 'gyur te zhes bya ba bshad pa ni /	The statement “it is understood when a convention is designated”
['BO_T11_D4223:281a-5']	'dis brda'i dus na de ltar mthong ba'i zhes bya ba'o //	'dis brda'i dus na de ltar mthong ba'i zhes bya ba'o //	means “it is seen in that way at the time of the convention.”
['BO_T11_D4223:281a-6']	'di dgag pa'i phyir bshad pa mi mtshungs pa ma yin te /	'di dgag pa'i phyir bshad pa mi mtshungs pa ma yin te /	The statement “it is not the same” is made in order to refute this.
['BO_T11_D4223:281a-7', 'BO_T11_D4223:281a-8']	'di ltar sgrub pa la 'ba' zhig pa de la yang mdun du nye bar bstan pa gang yin /🔽'di yang shing yin la gzhan yang yin pa'am /	'di ltar sgrub pa la 'ba' zhig pa de la yang mdun du nye bar bstan pa gang yin / 'di yang shing yin la gzhan yang yin pa'am /	In the case of a mere affirmation, there is the following consequence:🔽“Whatever is shown in front is a tree, and it is also something else,🔽or it is just this and not something else.”
