segmentnr	original	analyzed	translated
['BO_T02_D1851-2:80b-7', 'BO_T02_D1851-2:80b-8']	byang gi rtsibs la aa mri te /🔽dbang ldan gyi rtsibs la h'um phat ;	byang gi rtsibs la aa mri te /🔽dbang ldan gyi rtsibs la h'um phat ;	aṃ rite on the northwestern spoke,🔽and hūṃ phaṭ on the northeastern spoke.
['BO_T02_D1851-2:80b-9']	'khor lo'i lte ba dang de bzhin du yi ge ham gi mgo'i nang du aom dzi na che ge mo raksha ku ru dzik ces bri bar bya ste /	'khor lo'i lte ba dang de bzhin du yi ge ham gi mgo'i nang du aom dzi na che ge mo raksha ku ru dzik ces bri bar bya ste /	In the center of the wheel and likewise in the head of the syllable HAṂ, one should write OṂ Jina so-and-so Rakṣa KURU JIK.
['BO_T02_D1851-2:80b-10']	de ltar 'khor lo de ni sngags kyi yi ge'i tshig rnams kyis brgyan te rab tu gzhag par bya zhes bya ba ni snga ma bzhin no //	de ltar 'khor lo de ni sngags kyi yi ge'i tshig rnams kyis brgyan te rab tu gzhag par bya zhes bya ba ni snga ma bzhin no //	Thus, that wheel is adorned with the syllables of the mantra-words and should be placed, as before.
['BO_T02_D1851-2:80b-11']	sngags dgod pa 'di ni lha thams cad kyi gsang ba gsum gyi gnas ni 'phags pa bdud rtsi thab sbyor te /	sngags dgod pa 'di ni lha thams cad kyi gsang ba gsum gyi gnas ni 'phags pa bdud rtsi thab sbyor te /	This arrangement of the mantra is the abode of the three secrets of all the deities, which is Ārya-Amṛta-Kuṇḍali.
['BO_T02_D1851-2:80b-12']	bsdus pa ni bsgrub par bya ba bsrung ba'i phyir kun nas byung ba'am mngon du phyogs pa'o //	bsdus pa ni bsgrub par bya ba bsrung ba'i phyir kun nas byung ba'am mngon du phyogs pa'o //	The concise form is the arising or the facing of the protection of the one to be accomplished.
['BO_T02_D1851-2:80b-13']	de bas na 'dis ni thams cad du bsrung bar 'gyur ro zhes bya ba'i don to //	de bas na 'dis ni thams cad du bsrung bar 'gyur ro zhes bya ba'i don to //	Therefore, this is the meaning: “By this, one will be protected everywhere.”
['BO_T02_D1851-2:80b-14']	'khor lo rnam pa gnyis po 'di dag ni bsrung ba'i mchog yin no //	'khor lo rnam pa gnyis po 'di dag ni bsrung ba'i mchog yin no //	These two kinds of wheels are the supreme protection.
['BO_T02_D1851-2:80b-15']	bsrung ba'i 'khor lo'o ;	bsrung ba'i 'khor lo'o ;	This is the protection wheel.
['BO_T02_D1851-2:80b-16']	/ aanydza na nyid ni gnas yin te /	/ aanydza na nyid ni gnas yin te /	The abode is the elixir itself.
['BO_T02_D1851-2:80b-17']	dngos grub kyi thabs so //	dngos grub kyi thabs so //	It is the means of accomplishment.
['BO_T02_D1851-2:80b-18']	'di nyid ni rdo rje 'chang dang 'dra ba'i phyir rdo rje yin pa de ltar na rdo rje aanydza na'i gnas nyid do //	'di nyid ni rdo rje 'chang dang 'dra ba'i phyir rdo rje yin pa de ltar na rdo rje aanydza na'i gnas nyid do //	Since this is like Vajradhara, it is a vajra. Thus, it is the site of the vajra-anointment.
['BO_T02_D1851-2:80b-19']	tshil chen ni mar me'i don du'o //	tshil chen ni mar me'i don du'o //	The great fat is for the sake of the lamp.
['BO_T02_D1851-2:80b-20']	khrag dang bshang ba dang zhes bya ba ni lnga po dag gis nye bar mtshon pa'o //	khrag dang bshang ba dang zhes bya ba ni lnga po dag gis nye bar mtshon pa'o //	Blood and excrement, etc., are illustrated by the five.
['BO_T02_D1851-2:80b-21']	kun du bzang po ni aanydza na de nyid do //	kun du bzang po ni aanydza na de nyid do //	Samantabhadra is that very anointment.
['BO_T02_D1851-2:80b-22']	de ston par mdzad pa nyid kyi phyir de skad ces bya'o //	de ston par mdzad pa nyid kyi phyir de skad ces bya'o //	It is so called because it is the bestower of that.
['BO_T02_D1851-2:80b-23']	'dis ni 'di skad du rdo rje aanydza na'i dngos grub kyi ched du bzlas brjod 'bum byas pa mar gyi ngo'i bcu bzhi la phyi'i rig ma dang lhan cig tu 'dod pa'i lha dmar po'i sbyor ba dang ldan pas ji skad du bshad pa'i gnas gang yang rung	'dis ni 'di skad du rdo rje aanydza na'i dngos grub kyi ched du bzlas brjod 'bum byas pa mar gyi ngo'i bcu bzhi la phyi'i rig ma dang lhan cig tu 'dod pa'i lha dmar po'i sbyor ba dang ldan pas ji skad du bshad pa'i gnas gang yang rung	This is what is being said: for the sake of the attainment of the vajra-anointment, one should perform one hundred thousand recitations. On the fourteenth day of the bright half of the month, together with an external knowledge-woman, one should possess the yoga of the red deity. In whatever place has been described, one should perform the anointment with the five ambrosias, etc.,
['BO_T02_D1851-2:80b-24']	bar yid kyis rang gi dkyil 'khor yongs su brtags la de'i dbus su thod pa gsum kha sbub pa'i steng du bdud rtsi lnga dang ldan pa'i chang gis legs par byugs pa'i thod pa kha sbub tu bzhag la /	bar yid kyis rang gi dkyil 'khor yongs su brtags la de'i dbus su thod pa gsum kha sbub pa'i steng du bdud rtsi lnga dang ldan pa'i chang gis legs par byugs pa'i thod pa kha sbub tu bzhag la /	In the middle, having thoroughly imagined one's mandala, in the center of that, one should place an upside-down skull cup, and on top of that, an upside-down skull cup smeared with liquor possessing the five ambrosias.
['BO_T02_D1851-2:80b-25']	de'i 'og tu bdud rtsi lnga cung cad dang ldan pa'i tshil chen po bzhus pas bkang ba'i thod pa bdud rtsi lnga dang bcas pa'i aarga'i shing bal dang padma'i skud pas dkris pa'i sdong bu can du mar me sbar la mtshan phyed kyi dus su thod pa gcig	de'i 'og tu bdud rtsi lnga cung cad dang ldan pa'i tshil chen po bzhus pas bkang ba'i thod pa bdud rtsi lnga dang bcas pa'i aarga'i shing bal dang padma'i skud pas dkris pa'i sdong bu can du mar me sbar la mtshan phyed kyi dus su thod pa gcig	Then, below that, one should place a skull cup filled with melted human fat possessing a little of the five ambrosias, with a wick wrapped in cotton from an argha tree and lotus thread, and light the lamp.
['BO_T02_D1851-2:80b-26']	gi stan la 'dud cing thod pa gnyis la pus mo gnyis bzhag ste /	gi stan la 'dud cing thod pa gnyis la pus mo gnyis bzhag ste /	At midnight, one should sit on the seat of one skull cup, place one's two knees on the two other skull cups,
['BO_T02_D1851-2:80b-27']	snyoms par 'jug pas gnas shing rang gi sngags zlos pas dud pa dbab par bya'o //	snyoms par 'jug pas gnas shing rang gi sngags zlos pas dud pa dbab par bya'o //	and, abiding in union, one should cause smoke to descend by reciting one's mantra.
['BO_T02_D1851-2:81a-0']	de nas @81a * //	de nas @81a * //	Then,
['BO_T02_D1851-2:81a-1']	de dag bsdus la bdud rtsi lnga dang bcas pa'i snum chen po dang sprul la ras sam dar bzang po la thum bur gtums la rig ma'i padmar bcug la de'i sbyor ba dang ldan pas gnas de nyid du dro ba dang du ba dang 'bar ba'i mtshan ma	de dag bsdus la bdud rtsi lnga dang bcas pa'i snum chen po dang sprul la ras sam dar bzang po la thum bur gtums la rig ma'i padmar bcug la de'i sbyor ba dang ldan pas gnas de nyid du dro ba dang du ba dang 'bar ba'i mtshan ma	Having collected them, one should wrap them in a fine cloth or silk together with the five elixirs and the great oil, and place them in the lotus of the knowledge consort.
['BO_T02_D1851-2:81a-2']	shes par bya ste /	shes par bya ste /	One should know the signs of heat, smoke, and flame in that very place through the practice of that.
['BO_T02_D1851-2:81a-3', 'BO_T02_D1851-2:81a-4']	rang gi sngags brgya rtsa brgyad bzla bar bya zhing dro ba de nyid kyis mig bskus na thams cad du skad cig gis 'gro ba dang 'ong bar 'gyur ba dang sa la spyod pa'i sems can thams cad dbang du byed do //🔽du ba 'thul bas ni nam mkha' la 'gro ba dang / nam mkha' la spyod pa'i sems can dbang du byed do //	rang gi sngags brgya rtsa brgyad bzla bar bya zhing dro ba de nyid kyis mig bskus na thams cad du skad cig gis 'gro ba dang 'ong bar 'gyur ba dang sa la spyod pa'i sems can thams cad dbang du byed do // du ba 'thul bas ni nam mkha' la 'gro ba dang / nam mkha' la spyod pa'i sems can dbang du byed do //	One should recite one's mantra one hundred and eight times. If one anoints one's eyes with that heat, one will instantly go and come everywhere, and one will enthrall all beings who move on the earth.🔽By the smoke, one will fly in the sky and enthrall all beings who move in the sky.
['BO_T02_D1851-2:81a-5']	'bar bas ni nam mkha' thams cad du 'gro bar 'gyur ba dang / sems can thams cad dbang du byed do //	'bar bas ni nam mkha' thams cad du 'gro bar 'gyur ba dang / sems can thams cad dbang du byed do //	By the flame, one will go everywhere in the sky and enthrall all beings.
['BO_T02_D1851-2:81a-6']	de ltar na dngos grub rnam pa gsum du 'gyur ro zhes bstan par 'gyur ro //	de ltar na dngos grub rnam pa gsum du 'gyur ro zhes bstan par 'gyur ro //	Thus, there are three kinds of powers.
['BO_T02_D1851-2:81a-7']	rdo rje mig sman no //	rdo rje mig sman no //	The eye salve
['BO_T02_D1851-2:81a-8']	'di man chad ni sgrub pa chen po'i sbyor ba'i gdams ngag yin la de yang sbyor ba 'di la skal ba dang ldan pa rnyed par dka' ba nyid dang / 'bras bu che ba nyid kyis gus pa bskyed nas brjod par bya ba yin no //	'di man chad ni sgrub pa chen po'i sbyor ba'i gdams ngag yin la de yang sbyor ba 'di la skal ba dang ldan pa rnyed par dka' ba nyid dang / 'bras bu che ba nyid kyis gus pa bskyed nas brjod par bya ba yin no //	From here on is the instruction for the application of the great accomplishment. Moreover, it is to be stated with respect, since this application is difficult to obtain, and since it has a great result.
['BO_T02_D1851-2:81a-9']	de la rnyed par dka' ba'i dbang du mdzad nas de nas zhes bya ba la sogs pa gsungs te /	de la rnyed par dka' ba'i dbang du mdzad nas de nas zhes bya ba la sogs pa gsungs te /	With regard to that, in terms of difficulty of obtaining, he says, “Then, ” etc.
['BO_T02_D1851-2:81a-10']	de bzhin gshegs pa thams cad kyi bdag po ni dkyil 'khor pa dang bcas pa'i dkyil 'khor gyi dbang phyug go //	de bzhin gshegs pa thams cad kyi bdag po ni dkyil 'khor pa dang bcas pa'i dkyil 'khor gyi dbang phyug go //	The lord of all the tathāgatas is the lord of the maṇḍala together with the maṇḍala.
['BO_T02_D1851-2:81a-11']	de ston par mdzad pa'i phyir de skad ces bya'o //	de ston par mdzad pa'i phyir de skad ces bya'o //	He is so called because he teaches that.
['BO_T02_D1851-2:81a-12']	ldan zhes bya ba ni myur du de thob pa'i skal ba dang ldan pa zhes bya ba'i don to //	ldan zhes bya ba ni myur du de thob pa'i skal ba dang ldan pa zhes bya ba'i don to //	“Endowed” means having the good fortune to quickly obtain that.
['BO_T02_D1851-2:81a-13']	de bzhin gshegs pa thams cad ni dkyil 'khor gyi dbang phyug go //	de bzhin gshegs pa thams cad ni dkyil 'khor gyi dbang phyug go //	All the tathāgatas are the lords of the maṇḍala.
['BO_T02_D1851-2:81a-14']	de yang dang po'i sbyor ba'i bdag nyid can no //	de yang dang po'i sbyor ba'i bdag nyid can no //	Moreover, the first is the nature of the preliminary stage.
['BO_T02_D1851-2:81a-15']	spyod pa ni de nyid kyis bdag dang gzhan gyi don nan tan du byed pa'i dkyil 'khor gyi rgyal po mchog dang / las kyi rgyal po mchog ste de bzhin gshegs pa thams cad dang lhan cig spyod pa'o //	spyod pa ni de nyid kyis bdag dang gzhan gyi don nan tan du byed pa'i dkyil 'khor gyi rgyal po mchog dang / las kyi rgyal po mchog ste de bzhin gshegs pa thams cad dang lhan cig spyod pa'o //	The practice is the supreme king of mandalas and the supreme king of activities, which are performed by that very [vajra] for the sake of self and other, and which are the practice together with all the tathagatas.
['BO_T02_D1851-2:81a-16']	de nyid ni rdo rje ste rdo rje 'chang ba'o //	de nyid ni rdo rje ste rdo rje 'chang ba'o //	That very [vajra] is the vajra, the bearer of the vajra.
['BO_T02_D1851-2:81a-17']	de ltar na ting nge 'dzin gsum po ni go rims bzhin du rdo rje 'chang gi ngo bo nyid dang / longs spyod rdzogs pa dang sprul pa'i sku gsum yin no //	de ltar na ting nge 'dzin gsum po ni go rims bzhin du rdo rje 'chang gi ngo bo nyid dang / longs spyod rdzogs pa dang sprul pa'i sku gsum yin no //	Thus, the three samadhis are, in order, the three bodies of Vajradhara, the dharmakaya, the sambhogakaya, and the nirmanakaya.
['BO_T02_D1851-2:81a-18']	yang na de nyid ni rdo rje yin te mi zad pa'i rin po che nyid yin pa'i phyir ro //	yang na de nyid ni rdo rje yin te mi zad pa'i rin po che nyid yin pa'i phyir ro //	Or, that very [vajra] is the vajra, because it is the inexhaustible jewel.
['BO_T02_D1851-2:81a-19']	'di ltar de bzhin gshegs pa ni rtag pa'i sku can yin te go rims bzhin du ngo bo nyid kyis rtag pa dang rgyun mi 'jig pas rtag pa dang rgyun gyis rtag pas so //	'di ltar de bzhin gshegs pa ni rtag pa'i sku can yin te go rims bzhin du ngo bo nyid kyis rtag pa dang rgyun mi 'jig pas rtag pa dang rgyun gyis rtag pas so //	Thus, the Tathagata has a permanent body, because he is permanent by nature, permanent by the indestructibility of the continuum, and permanent by the continuity.
['BO_T02_D1851-2:81b-0']	'dir dad pa dang @81b sgom pa gang yin pa de gnyi ga yi ge gsum gyi skal ba dang ldan no zhes bya ba ni dris pa dang po'i lan gyi don yin no //	'dir dad pa dang @81b sgom pa gang yin pa de gnyi ga yi ge gsum gyi skal ba dang ldan no zhes bya ba ni dris pa dang po'i lan gyi don yin no //	Here, both faith and meditation are endowed with the fortune of the three syllables. This is the meaning of the first question and answer.
['BO_T02_D1851-2:81b-1']	zhabs dag la phyag 'tshal ba ni gdams par gsol ba 'debs pa'o //	zhabs dag la phyag 'tshal ba ni gdams par gsol ba 'debs pa'o //	The prostration at the feet is the request for instruction.
['BO_T02_D1851-2:81b-2']	mi gsung bar gyur pa ni gdams pa'i yul ston pa'o //	mi gsung bar gyur pa ni gdams pa'i yul ston pa'o //	The silence is the indication of the object of instruction.
['BO_T02_D1851-2:81b-3']	yi ge gsum po de'i skal ba yod pa 'dis ni skal ba dang ldan pas zhes gsungs pa nyid yin te /	yi ge gsum po de'i skal ba yod pa 'dis ni skal ba dang ldan pas zhes gsungs pa nyid yin te /	This one who is endowed with the fortune of those three syllables is said to be endowed with fortune.
['BO_T02_D1851-2:81b-4']	de rnams kyis rnyed par dka' ba nyid kyang bstan pa'i phyir bcom ldan 'das zhes bya ba la sogs pa gsungs so //	de rnams kyis rnyed par dka' ba nyid kyang bstan pa'i phyir bcom ldan 'das zhes bya ba la sogs pa gsungs so //	In order to demonstrate the difficulty of obtaining them, he says, “Blessed One,” and so on.
['BO_T02_D1851-2:81b-5']	gang gi tshe bskal pa 'das she na /	gang gi tshe bskal pa 'das she na /	When did the eons pass?
['BO_T02_D1851-2:81b-6']	bcom ldan 'das zhes bya ba la sogs pa gsungs te /	bcom ldan 'das zhes bya ba la sogs pa gsungs te /	He says, “Blessed One,” and so on.
['BO_T02_D1851-2:81b-7']	mar me mdzad mya ngan las 'das pa nas 'od srungs mngon par sangs rgyas pa'i bar du ste de gnyi ga'i bar du zhes bya ba'i don to //	mar me mdzad mya ngan las 'das pa nas 'od srungs mngon par sangs rgyas pa'i bar du ste de gnyi ga'i bar du zhes bya ba'i don to //	From the nirvana of Dīpaṃkara until Kāśyapa’s manifest enlightenment, that is, the time between those two.
['BO_T02_D1851-2:81b-8']	ma gsungs so zhes bya ba ni ngas de'i tshe zhes bya ba 'og ma dang sbyar ro //	ma gsungs so zhes bya ba ni ngas de'i tshe zhes bya ba 'og ma dang sbyar ro //	The phrase did not speak is to be connected with the phrase at that time below.
['BO_T02_D1851-2:81b-9']	skal ba med pa zhes bya ba ni de'i dus na zhes gong ma dang sbyar ro //	skal ba med pa zhes bya ba ni de'i dus na zhes gong ma dang sbyar ro //	The phrase lacking good fortune is to be connected with the phrase at that time above.
['BO_T02_D1851-2:81b-10']	gsang ba chen po'i gnas ni rdo rje 'dzin chen po'i gnas so //	gsang ba chen po'i gnas ni rdo rje 'dzin chen po'i gnas so //	The abode of the great secret is the abode of the Great Vajradhara.
['BO_T02_D1851-2:81b-11']	de'i don ni sgrub pa'i thabs de nyid rgyud kyi rgyal po 'di'o //	de'i don ni sgrub pa'i thabs de nyid rgyud kyi rgyal po 'di'o //	The meaning of that is this very method of practice, which is the king of tantras.🔽If it is the case that it was not spoken, then how is the meaning of that established? In order to dispel the doubt of someone who thinks this, it is said, The great result itself was not explained, and so forth. The meaning of that is as follows:🔽The phrase was not explained is to be connected with the phrase at that time above.🔽 The phrase the great result itself is to be connected with the phrase did not speak below.🔽 The phrase the great result itself is to be connected with the phrase did not speak below.
['BO_T02_D1851-2:81b-12']	gal te ma gsungs pa de ltar na yang gzhan ston pa'i phyir de'i tshe de'i don grub par 'gyur ro zhes kha cig dogs pa la de bsal ba'i phyir 'bras bu chen po nyid ma bshad de zhes bya ba la sogs pa gsungs te ma gsungs pa nyid	gal te ma gsungs pa de ltar na yang gzhan ston pa'i phyir de'i tshe de'i don grub par 'gyur ro zhes kha cig dogs pa la de bsal ba'i phyir 'bras bu chen po nyid ma bshad de zhes bya ba la sogs pa gsungs te ma gsungs pa nyid	 The phrase the great result itself is to be connected with the phrase did not speak below.🔽 The phrase the great result itself is to be connected with the phrase did not speak below.🔽 The phrase the great result itself is to be connected with the phrase did not speak below.🔽 The phrase the great result itself is to be connected with the phrase did not speak below.🔽 The phrase the great result itself is to be connected with the phrase did not speak below.🔽 The phrase the great result itself is to be connected with the phrase did not speak below.🔽 The phrase the great result itself is to be connected with the phrase did not speak below.🔽 The phrase the great result itself is to be connected with the phrase did not speak below.🔽 The phrase the great result itself is to be connected with the phrase did not speak below.🔽 The phrase the great result itself is to be connected with the phrase did not speak below.
['BO_T02_D1851-2:81b-13']	yin no // 'on kyang 'di khyad par 'di'i don chen po gzhan las grub pa ma yin pa gang yin pa de ni bcom ldan 'das zhes bya ba la sogs pa gsungs pa la /	yin no // 'on kyang 'di khyad par 'di'i don chen po gzhan las grub pa ma yin pa gang yin pa de ni bcom ldan 'das zhes bya ba la sogs pa gsungs pa la /	 The phrase the great result itself is to be connected with the phrase did not speak below.🔽 The phrase the great result itself is to be connected with the phrase
['BO_T02_D1851-2:81b-14']	skad cig thang cig yud tsam ni dus kyi skad cig ma'o //	skad cig thang cig yud tsam ni dus kyi skad cig ma'o //	A moment, a second, and a period are the moments of time.
['BO_T02_D1851-2:81b-15']	gal te skad cig de nyid dus ji tsam gyis yin zhe na /	gal te skad cig de nyid dus ji tsam gyis yin zhe na /	If one asks, “How much time is there in a moment?”
['BO_T02_D1851-2:81b-16']	gangg'a'i zhes bya ba la sogs pa gsungs pa la /	gangg'a'i zhes bya ba la sogs pa gsungs pa la /	[The root text] declares, “The Ganges,” and so on.
['BO_T02_D1851-2:81b-17', 'BO_T02_D1851-2:81b-18']	gang yin pa zhes bya ba ni byang chub bo //🔽'bad cing ni gang go cha'i brtson 'grus kyis so //	gang yin pa zhes bya ba ni byang chub bo // 'bad cing ni gang go cha'i brtson 'grus kyis so //	“ That” refers to enlightenment.🔽“ Striving” refers to the armor-like effort.
['BO_T02_D1851-2:81b-19']	brtsal ba ni sbyor ba'i brtson 'grus kyis so //	brtsal ba ni sbyor ba'i brtson 'grus kyis so //	“ Seeking” refers to the effort of application.
['BO_T02_D1851-2:81b-20']	de zhes bya ba ni byang chub de'o //	de zhes bya ba ni byang chub de'o //	“ That” refers to that enlightenment.
['BO_T02_D1851-2:81b-21']	tshe 'di nyid la zhes bya ba ni skye ba 'di nyid la'o //	tshe 'di nyid la zhes bya ba ni skye ba 'di nyid la'o //	“ In this very life” refers to this very birth.
['BO_T02_D1851-2:81b-22']	sangs rgyas zhes bya ba'i grangs ni bgrang ba ste ;	sangs rgyas zhes bya ba'i grangs ni bgrang ba ste ;	“ The number of buddhas” refers to the enumeration of buddhas.
['BO_T02_D1851-2:81b-23']	sgrub pas sa bcu'i dbang phyug nyid dang sgrub pa chen pos sa thams cad nyid du'o //	sgrub pas sa bcu'i dbang phyug nyid dang sgrub pa chen pos sa thams cad nyid du'o //	Through practice, [one becomes] the lord of the ten stages, and through great practice, [one becomes] all stages.
['BO_T02_D1851-2:81b-24']	de dag gis zhes bya ba ni gang dag de'i tshe gdul bya rnams kyis so //	de dag gis zhes bya ba ni gang dag de'i tshe gdul bya rnams kyis so //	“ By them” refers to those who are to be trained at that time.
['BO_T02_D1851-2:81b-25']	mi 'gyur ba ni thun mong yin no zhes bya ba ni mi 'gyur ba gsum ni thun mong nyid do //	mi 'gyur ba ni thun mong yin no zhes bya ba ni mi 'gyur ba gsum ni thun mong nyid do //	“ The three invariabilities are common” means that the three invariabilities are common.
['BO_T02_D1851-2:82a-0']	thun mong nyid ni rigs kyi bu zhes bya ba la sogs pa gsungs @82a * //	thun mong nyid ni rigs kyi bu zhes bya ba la sogs pa gsungs @82a * //	The common is stated with son of good family, etc.
['BO_T02_D1851-2:82a-1']	so ; gsang ba'i mi 'gyur ba gsum rnam par dag pa ni ji ltar snang ba bzhin du med pa nyid yin pa de'i phyir de ltar snang ba mthong cing ma mthong ba yin no //	so ; gsang ba'i mi 'gyur ba gsum rnam par dag pa ni ji ltar snang ba bzhin du med pa nyid yin pa de'i phyir de ltar snang ba mthong cing ma mthong ba yin no //	The secret is the purification of the three unchanging realities, because they do not exist as they appear, and so they are seen as they appear and not seen.
['BO_T02_D1851-2:82a-2']	cang mi smra bar gnas par gyur ba ni mi 'gyur ba dmigs su med pa'i phyir ro //	cang mi smra bar gnas par gyur ba ni mi 'gyur ba dmigs su med pa'i phyir ro //	The statement remained silent is because the unchanging is not an object of perception.
['BO_T02_D1851-2:82a-3']	thams cad cang mi smra bar gyur ba ni bshad pa'i skabs dbye ba'i don to //	thams cad cang mi smra bar gyur ba ni bshad pa'i skabs dbye ba'i don to //	The statement all remained silent is for the purpose of opening the occasion for the explanation.
['BO_T02_D1851-2:82a-4']	ston pa'i dbang du mdzad nas de nas zhes bya ba la sogs pa gsungs pa la /	ston pa'i dbang du mdzad nas de nas zhes bya ba la sogs pa gsungs pa la /	With regard to the teacher, it is stated, Then, etc.
['BO_T02_D1851-2:82a-5']	de nas zhes bya ba ni mngon par byang chub pa rnam pa lnga'i 'dod chags chen po'i de ma thag tu'o //	de nas zhes bya ba ni mngon par byang chub pa rnam pa lnga'i 'dod chags chen po'i de ma thag tu'o //	There, then is immediately after the great passion of the five manifest enlightenments.
['BO_T02_D1851-2:82a-6']	de bzhin gshegs pa thams cad ni phyogs bcu nas byon pa rnams so //	de bzhin gshegs pa thams cad ni phyogs bcu nas byon pa rnams so //	The tathagatas are those who have come from the ten directions.
['BO_T02_D1851-2:82a-7']	de bzhin gshegs pa thams cad ni rnam pa lnga las byang chub pa'i rdo rje 'dzin chen po'o //	de bzhin gshegs pa thams cad ni rnam pa lnga las byang chub pa'i rdo rje 'dzin chen po'o //	All the Tathagatas is the great Vajra Holder who is enlightened from the five aspects.
['BO_T02_D1851-2:82a-8']	de'i sku dang gsung dang thugs ni thabs kyi sku ste /	de'i sku dang gsung dang thugs ni thabs kyi sku ste /	His body, speech, and mind are the body of means.
['BO_T02_D1851-2:82a-9']	der de bzhin gshegs pa lngar gyur nas bzhugs pa'o //	der de bzhin gshegs pa lngar gyur nas bzhugs pa'o //	The five Tathagatas abide there, having become that.
['BO_T02_D1851-2:82a-10']	rdo rje'i btsun mo ni rig ma dgu'i gzugs kyis de rnams spros pa'i'o //	rdo rje'i btsun mo ni rig ma dgu'i gzugs kyis de rnams spros pa'i'o //	The Vajra Queen is the emanation of those in the form of the nine knowledge goddesses.
['BO_T02_D1851-2:82a-11']	bha ga ni shes rab kyi sku der de rnams ro gcig tu gyur pa'o //	bha ga ni shes rab kyi sku der de rnams ro gcig tu gyur pa'o //	The bhaga is the body of wisdom. There, they become of one taste.
['BO_T02_D1851-2:82a-12']	lha mo bzhi'i glu'i gzhung rim pa bzhin du sbyar bar bya ste /	lha mo bzhi'i glu'i gzhung rim pa bzhin du sbyar bar bya ste /	The text of the song of the four goddesses should be applied in order.
['BO_T02_D1851-2:82a-13', 'BO_T02_D1851-2:82a-14']	cang mi gsung bar gyur to zhes bshad pa gang yin pa de'i rjes thogs la de nas brtsams te sems can thams cad kun du bzang po kun du bzang po zhes de bzhin gshegs pa thams cad kyi sku dang gsung dang thugs rdo rjes dbang bskur bar gyur🔽to zhes bya ba ni brjod par bya'o //	cang mi gsung bar gyur to zhes bshad pa gang yin pa de'i rjes thogs la de nas brtsams te sems can thams cad kun du bzang po kun du bzang po zhes de bzhin gshegs pa thams cad kyi sku dang gsung dang thugs rdo rjes dbang bskur bar gyur🔽to zhes bya ba ni brjod par bya'o //	After the explanation remained silent, it should be said, Then, beginning with that, all sentient beings became Samantabhadra, Samantabhadra, having been empowered by the body, speech, and mind vajras of all Tathagatas.
['BO_T02_D1851-2:82a-15']	gzhung 'di las ni 'di nyid du bshad par bya ba yin te /	gzhung 'di las ni 'di nyid du bshad par bya ba yin te /	This is to be explained in this scripture.
['BO_T02_D1851-2:82a-16']	de nas zhes bya ba ni snying po'i rdo rje la gnas pa'i de ma thag tu'o //	de nas zhes bya ba ni snying po'i rdo rje la gnas pa'i de ma thag tu'o //	Then, immediately after abiding in the essence-vajra,
['BO_T02_D1851-2:82a-17']	de bzhin gshegs pa thams cad ni dkyil 'khor gyi dbang phyug go //	de bzhin gshegs pa thams cad ni dkyil 'khor gyi dbang phyug go //	all tathāgatas are the lords of the maṇḍala.
['BO_T02_D1851-2:82a-18']	de'i bdag po ni rgyu'o ;	de'i bdag po ni rgyu'o ;	Their lord is the cause.
