segmentnr	original	analyzed	translated
['BO_T03_D3805:13b-7']	chos des ji ltar thos pa'i thos pa dang bsam pa dag gis brtan par gyur pas dran pa'i sa bon 'jog pa'i phyir ro //	chos des ji ltar thos pa'i thos pa dang bsam pa dag gis brtan par gyur pas dran pa'i sa bon 'jog pa'i phyir ro //	because by that Dharma, through listening and reflection as they have heard it, they establish the seed of mindfulness through stability.
['BO_T03_D3805:13b-8']	rgyu mthun pa ni 'dra ba ste mthun pa'o //	rgyu mthun pa ni 'dra ba ste mthun pa'o //	Similarity is sameness.
['BO_T03_D3805:13b-9']	'dis ni de bzhin gshegs pa nyid kyi skyes bu'i byed pa gsungs pa'o //	'dis ni de bzhin gshegs pa nyid kyi skyes bu'i byed pa gsungs pa'o //	This states the human action of the Tathāgatas.
['BO_T03_D3805:13b-10']	de ltar thos pa nyid kyi chos des rang gi ston pa des na'o //	de ltar thos pa nyid kyi chos des rang gi ston pa des na'o //	Thus, by that Dharma of listening, one’s own teacher is not contradicted.
['BO_T03_D3805:13b-11']	'gal bar mi byed ces pa ni nyan thos rnams bdag nyid chen por gsungs so //	'gal bar mi byed ces pa ni nyan thos rnams bdag nyid chen por gsungs so //	“Not contradicting” states the greatness of the Śrāvakas.
['BO_T03_D3805:13b-12']	'di ltar sh'a ri'i bus rnam par rtog pa nyid ni rab 'byor gyis 'dir bstan pas ston pa ma yin zhes kha cig dag gi dogs pa de bzlog pa ste /	'di ltar sh'a ri'i bus rnam par rtog pa nyid ni rab 'byor gyis 'dir bstan pas ston pa ma yin zhes kha cig dag gi dogs pa de bzlog pa ste /	Thus, Shariputra, having taught the non-conceptuality of Subhuti, he removes the doubt of some that the Teacher is not teaching.
['BO_T03_D3805:13b-13']	'dir gang bcom ldan 'das ni thams cad nas thams cad du chos chos thams cad don dam par mthong ba'i mchog tu tshad mar gyur pas rang gis sam nyan thos la sogs pa'i zhal nas ston pa thams cad de nyid las gzhan du med ces gsungs so //	'dir gang bcom ldan 'das ni thams cad nas thams cad du chos chos thams cad don dam par mthong ba'i mchog tu tshad mar gyur pas rang gis sam nyan thos la sogs pa'i zhal nas ston pa thams cad de nyid las gzhan du med ces gsungs so //	Here, the Blessed One, in every way, by the highest authority of seeing all dharmas ultimately, says that all teachings by himself or by Shravakas and others are not other than that.
['BO_T03_D3805:13b-14']	gdams ngag bstan pa 'dod nas nye bar 'jug pa ni de nas zhes pa la sogs pa ste //	gdams ngag bstan pa 'dod nas nye bar 'jug pa ni de nas zhes pa la sogs pa ste //	With the desire to teach the instruction, he engages with Then, the Blessed One said to Subhuti the Elder...
['BO_T03_D3805:13b-15']	de la de ni phyogs bstan pa'o //	de la de ni phyogs bstan pa'o //	There, then indicates the time.
['BO_T03_D3805:13b-16']	tshig bla dgas ni ming ste /	tshig bla dgas ni ming ste /	Designation is name.
['BO_T03_D3805:13b-17']	chos kyi dngos po ni gang du ji ltar med la /	chos kyi dngos po ni gang du ji ltar med la /	The entity of dharma is where and how it does not exist.
['BO_T03_D3805:13b-18']	bdag gi dngos po ni kun rdzob tu yang med ces bya bar dgongs so //	bdag gi dngos po ni kun rdzob tu yang med ces bya bar dgongs so //	The entity of self is also non-existent conventionally, he thinks.
['BO_T03_D3805:13b-19']	chos ni phung po lnga la sogs pa can la /	chos ni phung po lnga la sogs pa can la /	Dharma has the five aggregates and so on.
['BO_T03_D3805:13b-20', 'BO_T03_D3805:14a-0']	yang dag par rjes su ma mthong ba ni don dam par ngo bo nyid med pa'i phyir ro //🔽byang chub sems dpa' ma dmigs pa ni gang zag la bdag med pa'i shes pa la phung po la sogs pa mi dmigs pa ni chos @14a * //	yang dag par rjes su ma mthong ba ni don dam par ngo bo nyid med pa'i phyir ro // byang chub sems dpa' ma dmigs pa ni gang zag la bdag med pa'i shes pa la phung po la sogs pa mi dmigs pa ni chos @14a * //	Not seeing them as real is because ultimately they are essenceless.
['BO_T03_D3805:14a-1']	la bdag med pa'i shes pa ste /	la bdag med pa'i shes pa ste /	The non-apprehension of the bodhisattva is the knowledge of the selflessness of persons. The non-apprehension of the aggregates and so forth is the knowledge of the selflessness of phenomena.🔽Both of these are the perfection of wisdom.
['BO_T03_D3805:14a-2']	de gnyi ga shes rab kyi pha rol tu phyin pa la de yang don dam par ngo bo nyid kyis stong zhes pa ni mi dmigs pa'o //	de gnyi ga shes rab kyi pha rol tu phyin pa la de yang don dam par ngo bo nyid kyis stong zhes pa ni mi dmigs pa'o //	That also is ultimately empty of essence.
['BO_T03_D3805:14a-3']	'di lta bu'i shes rab kyi pha rol tu phyin pa kha cig tu gcig pu zhig tu dben par song nas lung gi don la nges par rtogs pa las skye bar 'gyur ba de ni thos pa las byung ba'o //	'di lta bu'i shes rab kyi pha rol tu phyin pa kha cig tu gcig pu zhig tu dben par song nas lung gi don la nges par rtogs pa las skye bar 'gyur ba de ni thos pa las byung ba'o //	This kind of perfection of wisdom arises from hearing, from going to a solitary place and reflecting on the meaning of the scriptures.
['BO_T03_D3805:14a-4']	de ltar yang the tshom gang du yang med pas rjes su dpag pa la sogs pa stobs kyis skye bar 'gyur ba'i rigs pa de ni bsams pa las byung ba'o //	de ltar yang the tshom gang du yang med pas rjes su dpag pa la sogs pa stobs kyis skye bar 'gyur ba'i rigs pa de ni bsams pa las byung ba'o //	Since there is no doubt in that way, it arises by the power of inference and so forth. That is the perfection of wisdom arisen from contemplation.
['BO_T03_D3805:14a-5']	de dag gis the tshom drungs phyung nas dang du len par byed pa'i ting nge 'dzin thob nas sgom pa ni bsgoms pa las byung ba'o //	de dag gis the tshom drungs phyung nas dang du len par byed pa'i ting nge 'dzin thob nas sgom pa ni bsgoms pa las byung ba'o //	Having uprooted doubt, one attains meditative stabilization that readily accepts those, and then meditates.
['BO_T03_D3805:14a-6']	de la dang po gnyis bstan par 'dod nas gsungs pa ni bdag gi zhes pa la sogs pa ste /	de la dang po gnyis bstan par 'dod nas gsungs pa ni bdag gi zhes pa la sogs pa ste /	The first two of those are taught with the intention of teaching the desire for the selflessness of phenomena and the desire for the selflessness of persons.
['BO_T03_D3805:14a-7']	byang chub sems dpa'i chos ni nang gi bdag nyid can gyi phung po lnga la sogs pa'o //	byang chub sems dpa'i chos ni nang gi bdag nyid can gyi phung po lnga la sogs pa'o //	The phenomena of the bodhisattva are the five aggregates and so forth that are of the nature of the internal self.
['BO_T03_D3805:14a-8']	ma 'tshal ba ni thob pa med pa ste tshad mas gnod pa'i phyir ro //	ma 'tshal ba ni thob pa med pa ste tshad mas gnod pa'i phyir ro //	Not known is not obtained, because it is undermined by valid knowledge.
['BO_T03_D3805:14a-9']	de nyid la gnod pa bstan par 'dod nas gsungs pa ni ma dmigs zhes pa ste /	de nyid la gnod pa bstan par 'dod nas gsungs pa ni ma dmigs zhes pa ste /	The desire to teach the undermining of that is stated with “not observed,”
['BO_T03_D3805:14a-10']	lung las skyes pa'i mi dmigs pas gnod par byed pa yang dag par rjes su ma mthong ba'o //	lung las skyes pa'i mi dmigs pas gnod par byed pa yang dag par rjes su ma mthong ba'o //	because it is undermined by the non-observation that arises from scripture.
['BO_T03_D3805:14a-11']	rjes su dpag pa la sogs pas gnod par byed pa 'dis rjes su ma dmigs zhes pa ni thos pa las byung ba'i shes rab gsungs pa'o //	rjes su dpag pa la sogs pas gnod par byed pa 'dis rjes su ma dmigs zhes pa ni thos pa las byung ba'i shes rab gsungs pa'o //	“Not observed by inference” and so forth teaches the wisdom arisen from hearing, because it is undermined by inference and so forth.
['BO_T03_D3805:14a-12']	yang dag par rjes su ma mthong zhes pa'i rigs pa ni bsam pa'i rang bzhin can no //	yang dag par rjes su ma mthong zhes pa'i rigs pa ni bsam pa'i rang bzhin can no //	The reasoning of “not seeing as real” is of the nature of reflection.
['BO_T03_D3805:14a-13']	rigs pa brjod de gang zhig ni ci yang med pa'o //	rigs pa brjod de gang zhig ni ci yang med pa'o //	The reasoning is stated: “What is there is nothing at all.”
['BO_T03_D3805:14a-14']	gang 'dir zhes pa ni don dam par gang du yang med pa'o //	gang 'dir zhes pa ni don dam par gang du yang med pa'o //	“Here” means in the ultimate, there is nothing at all.
['BO_T03_D3805:14a-15']	kun rdzob tu ni rtog par byed pa la 'doms pas gdams ngag la rjes su 'jug par bstan pa ni rjes su bstan pa'o zhes bya bar dgongs pa'o //	kun rdzob tu ni rtog par byed pa la 'doms pas gdams ngag la rjes su 'jug par bstan pa ni rjes su bstan pa'o zhes bya bar dgongs pa'o //	The teaching of the instruction is the teaching of the instruction for the one who is instructed in the conventional, intending that the one who is instructed is the one who engages in the instruction.
['BO_T03_D3805:14a-16']	rdzogs pa'i zhi gnas la rab tu 'jug par byed pa gang de dang lhan cig tu dpyod pa can gyi shes rab de ni lta ba dang rig pa dang blo dang snang ba dang lhag mthong la /	rdzogs pa'i zhi gnas la rab tu 'jug par byed pa gang de dang lhan cig tu dpyod pa can gyi shes rab de ni lta ba dang rig pa dang blo dang snang ba dang lhag mthong la /	The wisdom that is the analyzer that engages in perfect śamatha is the view, knowledge, mind, appearance, and vipaśyanā.
['BO_T03_D3805:14a-17']	de gnyi ga zung du 'brel ba can ni bsgom pa'i rang bzhin can gyi shes rab ste /	de gnyi ga zung du 'brel ba can ni bsgom pa'i rang bzhin can gyi shes rab ste /	The wisdom that is the nature of meditation is the union of those two.
['BO_T03_D3805:14a-18']	de bstan par 'dod nas gsungs pa ni 'on kyang zhes pa dang gal te zhes pa ni don dam par 'jug pa na gal te'o //	de bstan par 'dod nas gsungs pa ni 'on kyang zhes pa dang gal te zhes pa ni don dam par 'jug pa na gal te'o //	With the desire to teach that, it is said, “However” and “If” are used in the context of engaging in the ultimate.
['BO_T03_D3805:14b-0']	'di ltar zhes pa dang / de bdag gis zhes pa la sogs pas te smra bar byed pa la zhes pa la sogs pa ni da lta ba la nye ba'i phyir ni gsung bar byed pa don gsungs zhes pa la sogs par @14b shes par bya'o //	'di ltar zhes pa dang / de bdag gis zhes pa la sogs pas te smra bar byed pa la zhes pa la sogs pa ni da lta ba la nye ba'i phyir ni gsung bar byed pa don gsungs zhes pa la sogs par @14b shes par bya'o //	Thus and I and so on. One who speaks and so on is understood as one who speaks, one who teaches, and so on, because it is proximate to the present.
['BO_T03_D3805:14b-1']	'di'i rgyas par bshad pa ni bstan par byed pa ni thos pa'i rang bzhin gyi shes rab kyi mtshan nyid kyis so //	'di'i rgyas par bshad pa ni bstan par byed pa ni thos pa'i rang bzhin gyi shes rab kyi mtshan nyid kyis so //	The detailed explanation of this is: One who teaches is by the nature of the wisdom of hearing. 
['BO_T03_D3805:14b-2']	nye bar bstan par byed ces pa ni bsam pa'i rang bzhin gyi shes rab kyi mtshan nyid kyis mngon sum du dpyod par 'gyur ro zhes pa lhag ma'o //	nye bar bstan par byed ces pa ni bsam pa'i rang bzhin gyi shes rab kyi mtshan nyid kyis mngon sum du dpyod par 'gyur ro zhes pa lhag ma'o //	One who demonstrates is by the nature of the wisdom of reflection. One who analyzes is by the nature of the wisdom of meditation. One who makes known is by the nature of the wisdom of realization. One who makes manifest is by the nature of the wisdom of teaching.
['BO_T03_D3805:14b-3']	'dir thar pa 'dod pa rnams ting nge 'dzin gyi yon tan rnams la mngon par yid ches pa'i mtshan nyid la dad pa de las 'dod pa skye bar 'gyur la /	'dir thar pa 'dod pa rnams ting nge 'dzin gyi yon tan rnams la mngon par yid ches pa'i mtshan nyid la dad pa de las 'dod pa skye bar 'gyur la /	Here, for those who desire liberation, desire arises from faith, which has the characteristic of clear conviction in the qualities of samadhi.
['BO_T03_D3805:14b-4']	de'i stobs las brtson 'grus de'i stobs las lus dang sems sbyangs pa nyid do //	de'i stobs las brtson 'grus de'i stobs las lus dang sems sbyangs pa nyid do //	From that, effort arises. From the power of that, there is the purification of body and mind.
['BO_T03_D3805:14b-5']	des le lo rnam par mi 'jug nas dran pas yang dag par dmigs pa la nye bar gnas par 'gyur ro //	des le lo rnam par mi 'jug nas dran pas yang dag par dmigs pa la nye bar gnas par 'gyur ro //	Since he is established in vigilance, he is established in the correct observation of enthusiasm.🔽Since he is established in enthusiasm, he is established in the correct observation of faith.🔽Since he is established in faith, he is established in the correct observation of the mental attention of the Buddha and so on.🔽Since he is established in the mental attention of the Buddha and so on, he is established in the correct observation of the mental attention of the Dharma.🔽Since he is established in the mental attention of the Dharma, he is established in the correct observation of the mental attention of the Saṅgha.🔽Since he is established in the mental attention of the Saṅgha, he is established in the correct observation of the mental attention of the precepts.
['BO_T03_D3805:14b-6']	des shes bzhin la des dga' ba'i dngos po sangs rgyas la sogs pa'i yon tan yid la byas nas des de nyid ji ltar thos pa dang bsam pa'i don de nyid la ting nge 'dzin la dmigs pa'i sems la brnyas pa med nas zhugs par mi 'gyur te	des shes bzhin la des dga' ba'i dngos po sangs rgyas la sogs pa'i yon tan yid la byas nas des de nyid ji ltar thos pa dang bsam pa'i don de nyid la ting nge 'dzin la dmigs pa'i sems la brnyas pa med nas zhugs par mi 'gyur te	Since he is established in the mental attention of the precepts, he is established in the correct observation of the mental attention of the deities.🔽Since he is established in the mental attention of the deities, he is established in the correct observation of the mental attention of the aggregates.
['BO_T03_D3805:14b-7', 'BO_T03_D3805:14b-8']	/ de nyid kyis nges par bcings pa'i phyir ro //🔽kun tu mi zhum pa mi 'gyur ba ni rgyun tu 'jug pas kyang zhum par 'ong bar mi 'gyur te /	/ de nyid kyis nges par bcings pa'i phyir ro // kun tu mi zhum pa mi 'gyur ba ni rgyun tu 'jug pas kyang zhum par 'ong bar mi 'gyur te /	Since he is established in the mental attention of the aggregates, he is established in the correct observation of the mental attention of the elements.🔽Since he is established in the mental attention of the elements, he is established in the correct observation of the mental attention of the sense bases.🔽Since he is established in the mental attention of the sense bases, he is established in the correct observation of the mental attention of dependent origination.🔽Since he is established in the mental attention of dependent origination, he is established in the correct observation of the mental attention of the truths.🔽Since he is established in the mental attention of the truths, he is established in the correct observation of the mental attention of the perfections.🔽Since he is established in the mental attention of the perfections, he is established in the correct observation of the mental attention of the emptinesses.🔽Since he is established in the mental attention of the emptinesses, he is established in the correct observation of the mental attention of the doors of liberation.
['BO_T03_D3805:14b-9', 'BO_T03_D3805:14b-10']	gzhan du 'gro ba bkag pa'i phyir ro //🔽rang bzhin gyis g-yo ba'i phyir rgod nas gzhan du 'gro ba yang myur du shes par byas la yang bsdus na yang mi rgod pa'o //	gzhan du 'gro ba bkag pa'i phyir ro // rang bzhin gyis g-yo ba'i phyir rgod nas gzhan du 'gro ba yang myur du shes par byas la yang bsdus na yang mi rgod pa'o //	Since he is established in the mental attention of the doors of liberation, he is established in the correct observation of the mental attention of the immeasurables.
['BO_T03_D3805:14b-11']	kun tu mi zhum pa ni bstan par 'gyur ba'i sems kyi rang bzhin rigs pa'i phyir na /	kun tu mi zhum pa ni bstan par 'gyur ba'i sems kyi rang bzhin rigs pa'i phyir na /	Since he is established in the mental attention of the immeasurables, he is established in the correct observation of the mental attention of
['BO_T03_D3805:14b-12']	gzhan du rnam par 'phro ba'i gong nas gong du zhib mor byed pa la dub pa med pa'i phyir ro //	gzhan du rnam par 'phro ba'i gong nas gong du zhib mor byed pa la dub pa med pa'i phyir ro //	because he is not wearied by the increasingly subtle analysis of the other aspects.
['BO_T03_D3805:14b-13']	phyir phyogs par mi 'gyur te /	phyir phyogs par mi 'gyur te /	He does not turn away from it,
['BO_T03_D3805:14b-14']	ting nge 'dzin byad pa la yang btang snyoms su gnas pa'i phyir ro //	ting nge 'dzin byad pa la yang btang snyoms su gnas pa'i phyir ro //	because he remains indifferent to the faults of concentration.
['BO_T03_D3805:14b-15']	ji ltar na de nyid la sems dga' bar byed ce na /	ji ltar na de nyid la sems dga' bar byed ce na /	How does he delight his mind in it?
['BO_T03_D3805:14b-16']	ting nge 'dzin rnams kyi yon tan mthong ba'i phyir ro //	ting nge 'dzin rnams kyi yon tan mthong ba'i phyir ro //	Because he sees the virtues of the meditative concentrations.
['BO_T03_D3805:14b-17']	bcom zhing phyir phyogs par mi 'gyur ba ni de la dga' ba dang bde bas rnam par g-yeng bar byed pa can du mi byed pa ste /	bcom zhing phyir phyogs par mi 'gyur ba ni de la dga' ba dang bde bas rnam par g-yeng bar byed pa can du mi byed pa ste /	He does not destroy it or turn away from it, because he does not allow himself to be distracted by delight and pleasure in it.
['BO_T03_D3805:14b-18']	rnam par g-yeng ba'i skyon mthong ba'i phyir te /	rnam par g-yeng ba'i skyon mthong ba'i phyir te /	Because he sees the faults of distraction.
['BO_T03_D3805:14b-19']	skyon ni 'khor ba'i sdug bsngal rnams so //	skyon ni 'khor ba'i sdug bsngal rnams so //	The faults are the sufferings of cyclic existence.
['BO_T03_D3805:14b-20']	mi dngang ba ni brnab sems dang yid mi bde ba la sogs pa ldang bas mi skrag ste /	mi dngang ba ni brnab sems dang yid mi bde ba la sogs pa ldang bas mi skrag ste /	He is not frightened by the arising of covetousness, mental dissatisfaction, etc.
['BO_T03_D3805:14b-21', 'BO_T03_D3805:14b-22']	ji lta zhe na /🔽de nyid bcom ste /	ji lta zhe na / de nyid bcom ste /	How is that?
['BO_T03_D3805:14b-23']	rnam par g-yeng ba'i skyon mthong ba'i phyir ro //	rnam par g-yeng ba'i skyon mthong ba'i phyir ro //	Because he has destroyed them and sees the faults of distraction.
['BO_T03_D3805:14b-24']	kun tu mi skrag ste /	kun tu mi skrag ste /	He is not terrified by them.
['BO_T03_D3805:15a-0', 'BO_T03_D3805:15a-1']	sems rang bzhin gyis skyon med par rang gi ngang gis 'jug pa'i don du 'du byed la 'bad pa des skrag @15a * //🔽par mi byed ces pa'i don to //	sems rang bzhin gyis skyon med par rang gi ngang gis 'jug pa'i don du 'du byed la 'bad pa des skrag @15a * // par mi byed ces pa'i don to //	The meaning is that one should not be afraid of the effort of application in order to enter into the natural purity of mind.
['BO_T03_D3805:15a-2']	kun tu skrag par mi 'gyur ba ni lhun gyis grub par ngang gis 'jug pa nyid kyis sems la skrag pa kun tu 'byung bar mi 'gyur te /	kun tu skrag par mi 'gyur ba ni lhun gyis grub par ngang gis 'jug pa nyid kyis sems la skrag pa kun tu 'byung bar mi 'gyur te /	The absence of fear is the non-occurrence of fear in the mind, due to the very spontaneous and natural engagement.
['BO_T03_D3805:15a-3']	lhun gyis grub pa de nyid ngang gis 'jug pa 'dzin par 'gyur zhes pa'i don to //	lhun gyis grub pa de nyid ngang gis 'jug pa 'dzin par 'gyur zhes pa'i don to //	The meaning is that one should hold to that very spontaneity as the natural engagement.
['BO_T03_D3805:15a-4']	gzhan yang lhun gyis ma grub pa ni sems rnam par g-yeng bar 'gyur ba'i phyir ro //	gzhan yang lhun gyis ma grub pa ni sems rnam par g-yeng bar 'gyur ba'i phyir ro //	Moreover, the absence of spontaneity is due to the distraction of mind.
['BO_T03_D3805:15a-5']	de ltar yang mdo sde rgyan las /	de ltar yang mdo sde rgyan las /	Thus, in the Ornament of the Mahāyāna Sūtras, it says:
['BO_T03_D3805:15a-6']	dmigs pas sems ni nges bcings la //	dmigs pas sems ni nges bcings la //	The mind is bound by the object.
['BO_T03_D3805:15a-7']	de rgyun rnam par g-yeng mi bya //	de rgyun rnam par g-yeng mi bya //	Do not be distracted from its continuity.
['BO_T03_D3805:15a-8']	rnam g-yengs myur du rtogs byas la //	rnam g-yengs myur du rtogs byas la //	Quickly recognize distraction,
['BO_T03_D3805:15a-9']	de yis so sor yang bsdu bya //	de yis so sor yang bsdu bya //	and with that, gather the mind.
['BO_T03_D3805:15a-10']	so sor dag la kun bsdus sems //	so sor dag la kun bsdus sems //	When the mind is gathered in each,
['BO_T03_D3805:15a-11']	gong nas gong du blo ldan gyis //	gong nas gong du blo ldan gyis //	the wise ones,
['BO_T03_D3805:15a-12']	ting 'dzin yon tan mthong gyur pa //	ting 'dzin yon tan mthong gyur pa //	seeing the qualities of samādhi,
['BO_T03_D3805:15a-13']	de yis sems ni dga' byas la //	de yis sems ni dga' byas la //	The mind is gladdened by that,
['BO_T03_D3805:15a-14']	rnam g-yengs skyon ni mthong 'gyur ba //	rnam g-yengs skyon ni mthong 'gyur ba //	and the faults of distraction are seen.
['BO_T03_D3805:15a-15']	de yis dga' yin zhi bar bya /	de yis dga' yin zhi bar bya /	It is gladdened by that, and is pacified.
['BO_T03_D3805:15a-16']	brnab sems yid mi bde la sogs //	brnab sems yid mi bde la sogs //	Covetousness, mental unhappiness, and so on
['BO_T03_D3805:15a-17', 'BO_T03_D3805:15a-18']	langs pa de bzhin zhi bar bya //🔽de yis mngon par 'du byas pa'i //	langs pa de bzhin zhi bar bya // de yis mngon par 'du byas pa'i //	arise, and are pacified in the same way.🔽By that, the mind is brought into being
['BO_T03_D3805:15a-19']	sems kyi ngang du gyur pa nyid //	sems kyi ngang du gyur pa nyid //	in a state of composure.
['BO_T03_D3805:15a-20']	de la goms pa'i rnal 'byor pas //	de la goms pa'i rnal 'byor pas //	The yogi/nī who is accustomed to that
['BO_T03_D3805:15a-21']	des ni mngon 'dus ma byas thob //	des ni mngon 'dus ma byas thob //	attains the non-composing.
['BO_T03_D3805:15a-22']	ces te / de bzhin du zhi gnas rdzogs par gyur pa'o //	ces te / de bzhin du zhi gnas rdzogs par gyur pa'o //	Thus, śamatha is perfected.
['BO_T03_D3805:15a-23']	'di nyid zhes pa ni ji skad du bshad pa'i ting nge 'dzin mthar thug pa'i kun rdzob dang don dam pa'i rnam par dbye ba shes pa'o //	'di nyid zhes pa ni ji skad du bshad pa'i ting nge 'dzin mthar thug pa'i kun rdzob dang don dam pa'i rnam par dbye ba shes pa'o //	“This itself” is the knowledge of the division of the ultimate and the conventional of the culmination of samādhi as it has been explained.
['BO_T03_D3805:15a-24']	'di nyid ces pa ni de'i ting nge 'dzin dang yang dag par rab tu ldan pa'i shes rab bo //	'di nyid ces pa ni de'i ting nge 'dzin dang yang dag par rab tu ldan pa'i shes rab bo //	“This itself” is the wisdom that is perfectly endowed with that samādhi.
['BO_T03_D3805:15a-25']	'di nyid gdams pa ste /	'di nyid gdams pa ste /	This is the instruction,
['BO_T03_D3805:15a-26']	gang dag zhi gnas dang shes rab dag phan tshun yang dag par sbyor ba'i yon tan gyis so //	gang dag zhi gnas dang shes rab dag phan tshun yang dag par sbyor ba'i yon tan gyis so //	by the quality of the mutual correct application of śamatha and wisdom.
['BO_T03_D3805:15a-27']	sems ni chos thams cad ngo bo nyid med pa'i de kho na nyid la de las phyir phyogs pa thams cad ni rnam par g-yengs pa'i zhes brjod la /	sems ni chos thams cad ngo bo nyid med pa'i de kho na nyid la de las phyir phyogs pa thams cad ni rnam par g-yengs pa'i zhes brjod la /	The mind is the reality of the unreality of all things. All that turns away from that is called “distraction.”
['BO_T03_D3805:15a-28']	de kho na nyid gcig tu mthar thug pa ni kun rdzob tu skad cig gis 'jig pa can yin yang mnyam par gzhag pa'o //	de kho na nyid gcig tu mthar thug pa ni kun rdzob tu skad cig gis 'jig pa can yin yang mnyam par gzhag pa'o //	The one ultimate reality is meditative equipoise, even though it is conventionally momentary and perishable.
['BO_T03_D3805:15a-29']	de nyid kyis na zhi gnas dang lhag mthong dag ni 'gal ba med do //	de nyid kyis na zhi gnas dang lhag mthong dag ni 'gal ba med do //	Therefore, serenity and insight are not mutually exclusive.
['BO_T03_D3805:15a-30']	de kho na nyid ma yin pa la dmigs pa las ldog pa'i bdag nyid can gyis sems rtse gcig pa nyid dang yang dag pa'i shes pa dag phan tshun rjes su sbyar nas bskyed pas rab kyi mthar thug pa na ro gcig par 'gyur ro //	de kho na nyid ma yin pa la dmigs pa las ldog pa'i bdag nyid can gyis sems rtse gcig pa nyid dang yang dag pa'i shes pa dag phan tshun rjes su sbyar nas bskyed pas rab kyi mthar thug pa na ro gcig par 'gyur ro //	When the one-pointedness of mind and right knowledge, which have the nature of turning away from the observation of what is not reality, are generated by being mutually applied, they become of one taste at the ultimate limit of perfection.
['BO_T03_D3805:15b-0']	de ltar 'dir zhi gnas dang shes rab kyi rang bzhin gyi kun rdzob dang don dam pa ro gcig @15b pa'i ting nge 'dzin la gnas pa ni 'dir mnyam par mi 'gyur te /	de ltar 'dir zhi gnas dang shes rab kyi rang bzhin gyi kun rdzob dang don dam pa ro gcig @15b pa'i ting nge 'dzin la gnas pa ni 'dir mnyam par mi 'gyur te /	Thus, here, the meditative stabilization of the unity of the conventional and the ultimate, which has the nature of serenity and insight, is not a union.
['BO_T03_D3805:15b-1']	'di nyid 'di'i gdams pa dang rjes su bstan pa'o //	'di nyid 'di'i gdams pa dang rjes su bstan pa'o //	This is the instruction and the teaching for that.
