segmentnr	original	analyzed	translated
['BO_T03_D3805:24b-16']	sngon po ni yul dus nges pas skyes pas 'bras bu gzhan bzhin du ji ltar gzhan las 'byung bar mi 'dod /	sngon po ni yul dus nges pas skyes pas 'bras bu gzhan bzhin du ji ltar gzhan las 'byung bar mi 'dod /	Since blue arises in a specific place and time, why do you not assert that it arises from another, like any other effect?🔽Since blue is seen to arise from another, blue, consciousness does not arise from itself.
['BO_T03_D3805:24b-17']	sngon po ni gzhan las sngon po skye ba mthong ba de'i phyir med pas shes pa ni snang ba med pa'i zhes pa la sogs pa ni 'dod pas rtogs par byas te /	sngon po ni gzhan las sngon po skye ba mthong ba de'i phyir med pas shes pa ni snang ba med pa'i zhes pa la sogs pa ni 'dod pas rtogs par byas te /	Since you assert that consciousness arises from blue, you should understand that consciousness does not arise from that which lacks blue, such as sound.
['BO_T03_D3805:24b-18', 'BO_T03_D3805:24b-19']	ma mthong ba la rjes su 'gro ba dang ldog pa mi rtog pas mi 'grub bo /🔽'dir bde ba la sogs pa can gyi rjes su gzung ba la sogs pa'i bdag nyid can ni rang gi nang du gsal bar byed la /	ma mthong ba la rjes su 'gro ba dang ldog pa mi rtog pas mi 'grub bo / 'dir bde ba la sogs pa can gyi rjes su gzung ba la sogs pa'i bdag nyid can ni rang gi nang du gsal bar byed la /	Since you do not see consciousness arising from that which lacks blue, you cannot establish that consciousness arises from that which lacks blue.🔽Here, the nature of the apprehender of blue and so on is the nature of the experiencer of pleasure and so on.
['BO_T03_D3805:25a-0']	bde ba la sogs pa'i rnam pa nyid la yang sngon po la sogs pa'i rnam pa gnas par rnam @25a * //	bde ba la sogs pa'i rnam pa nyid la yang sngon po la sogs pa'i rnam pa gnas par rnam @25a * //	The aspect of pleasure and so on also has the aspect of blue and so on.
['BO_T03_D3805:25a-1']	par med pa'i shes pas rlom par byed pa'i gnas pa ni don de la ma rig pa'i dbang gis rnam par chad pa'i yul du sngon po la sogs pa'i sgra don gyis gsal ba can du nyams su myong bar 'gyur la /	par med pa'i shes pas rlom par byed pa'i gnas pa ni don de la ma rig pa'i dbang gis rnam par chad pa'i yul du sngon po la sogs pa'i sgra don gyis gsal ba can du nyams su myong bar 'gyur la /	The basis for the conceit of a consciousness without an object is the experience of an object that is cut off by the power of ignorance. It is experienced as being clarified by the meaning of a word such as “blue.”
['BO_T03_D3805:25a-2']	sgra don dam par med pa'i phyir na de la ltos pas 'dir 'dzin pa yang ma yin zhes pas na gnyis su med ces bya zhe na /	sgra don dam par med pa'i phyir na de la ltos pas 'dir 'dzin pa yang ma yin zhes pas na gnyis su med ces bya zhe na /	Since the meaning of the word is ultimately nonexistent, it is not apprehended in dependence on it. Therefore it is said to be nondual.
['BO_T03_D3805:25a-3']	rang rig pa tsam la ni bde ba la sogs pa med la /	rang rig pa tsam la ni bde ba la sogs pa med la /	In mere reflexive awareness, there is no pleasure and so on.
['BO_T03_D3805:25a-4']	gzhan rig pa na ma rig pa mi srid pa'am 'dzin pa med pa'i phyir ji ltar gzhan rig ste /	gzhan rig pa na ma rig pa mi srid pa'am 'dzin pa med pa'i phyir ji ltar gzhan rig ste /	When there is awareness of something other, ignorance is impossible. Since there is no apprehension, how can there be awareness of something other?
['BO_T03_D3805:25a-5']	de yang thams cad du khyad par med pas de srid du dus gcig yin pa'i phyir gzhan gyi rgyud la yod pa'i sngon po la sogs pa'i rig pa tha dad pa'i bdag nyid can gyi dus can rnams 'dir rig par thal bar 'gyur te /	de yang thams cad du khyad par med pas de srid du dus gcig yin pa'i phyir gzhan gyi rgyud la yod pa'i sngon po la sogs pa'i rig pa tha dad pa'i bdag nyid can gyi dus can rnams 'dir rig par thal bar 'gyur te /	Moreover, since that [awareness] is undifferentiated in all respects, it would follow that as long as it exists, it would be simultaneous with the awareness of blue and so on that exists in other mind streams. It would be an awareness that has the nature of being different in terms of time.
['BO_T03_D3805:25a-6']	tshogs pa gcig la yang rag mi las pa'i phyir ro //	tshogs pa gcig la yang rag mi las pa'i phyir ro //	Because it is not dependent on a single collection.🔽According to your assertion, sound is not the effect of the object such as blue,
['BO_T03_D3805:25a-7']	khyod kyi 'dod pas ni sgra don gyi sngon po la sogs par 'bras bur mi 'gyur te /	khyod kyi 'dod pas ni sgra don gyi sngon po la sogs par 'bras bur mi 'gyur te /	because it is not dependent on it.
['BO_T03_D3805:25a-8']	rag mi las pa nyid ces pa ste /	rag mi las pa nyid ces pa ste /	It is not dependent on it.
['BO_T03_D3805:25a-9']	rgyu gcig las byung ba rnams kyang lhan cig tu yod par des rig pa yang min te /	rgyu gcig las byung ba rnams kyang lhan cig tu yod par des rig pa yang min te /	Even though they arise from a single cause, they are not cognized simultaneously by that consciousness,
['BO_T03_D3805:25a-10', 'BO_T03_D3805:25a-11']	dus gcig par rang rang gi ngo bo nges pa nyid kyis rang dang gzhan gyi ngo bo yongs su spangs pa'i phyir ro //🔽gang yang nye bar len pa med pa rnams ni kun rdzob tu yang med pas tshu rol mthong ba'i spyod yul min pa'i rnam pa med pa'i shes par gcig tu bden par 'dod de ji ltar dmigs pa dang rnam pa yongs su ma chad pa'i kun gzhi'i rnam	dus gcig par rang rang gi ngo bo nges pa nyid kyis rang dang gzhan gyi ngo bo yongs su spangs pa'i phyir ro // gang yang nye bar len pa med pa rnams ni kun rdzob tu yang med pas tshu rol mthong ba'i spyod yul min pa'i rnam pa med pa'i shes par gcig tu bden par 'dod de ji ltar dmigs pa dang rnam pa yongs su ma chad pa'i kun gzhi'i rnam	because they are definitely of their own individual natures, and they completely exclude their own and other natures.🔽Also, those that are without appropriation do not exist even conventionally, and therefore they are not the objects of the experience of the world. They are asserted to be consciousnesses that are truly singular and devoid of aspects.
['BO_T03_D3805:25a-12']	par shes pa zhes 'dod la /	par shes pa zhes 'dod la /	Just as the consciousness that is the basis of all experience is asserted to be the consciousness that is the basis of all experience is asserted to be the consciousness that is the basis of all experience is asserted to be the consciousness that is the basis of all experience is asserted to be the consciousness that is the basis of all experience is asserted to be the consciousness that is the basis of all experience is asserted to be the consciousness that is the basis of all experience is asserted to be the consciousness that is the basis of all experience is asserted to be the consciousness that is the basis of all experience is asserted to be the consciousness that is the basis of all experience is asserted to be the consciousness that is the basis of all experience is asserted to be the consciousness that is the basis of all experience is asserted to be the consciousness that is the basis of all experience is asserted to be the consciousness that is the basis of all experience is asserted to be the consciousness that is the basis of all experience is asserted to be the consciousness that is the basis of all experience is asserted to be the consciousness that is the basis of all experience is asserted to be the consciousness that is the basis of all experience is asserted to be the consciousness that is the basis of all experience is asserted to be the consciousness that is the basis of all experience is asserted to be the consciousness that is the basis of all experience is asserted to be the consciousness that is the basis of all experience is asserted to be the consciousness that is the basis of all experience is asserted to be the consciousness that is the basis of all experience is asserted to be the consciousness that is the basis of all experience is asserted to be the consciousness that is the basis of all experience is asserted to be the consciousness that is the basis of all experience is asserted to be the consciousness that is the basis of all experience is asserted to be the consciousness that is the basis of all experience is asserted to be the consciousness
['BO_T03_D3805:25a-13']	de la bden pa'i rang rig pa'i rang gi rgyud la lkog tu gyur pa rjes su dpag pas sgrub ces pa'i rtags ni sgra don gyis sngon po la sogs pa can no zhes pa nye bar dgos pa ni mi rigs so //	de la bden pa'i rang rig pa'i rang gi rgyud la lkog tu gyur pa rjes su dpag pas sgrub ces pa'i rtags ni sgra don gyis sngon po la sogs pa can no zhes pa nye bar dgos pa ni mi rigs so //	In that case, it is not reasonable to say that the self-awareness of reality is hidden in one’s continuum and is established by inference. The reason is that the meaning of the term is that it is the possessor of blue, etc.
['BO_T03_D3805:25a-14']	nye bar len pa'i kun rdzob de kun rdzob tu gang zhig de'i rjes su 'gro ba dang ldog pas rjes su brtags na ma dmigs pa las sa bon dang myu gu lta bu ni mi mkhas pa la mkhas par mngon par rlom pa'i shes pa la /	nye bar len pa'i kun rdzob de kun rdzob tu gang zhig de'i rjes su 'gro ba dang ldog pas rjes su brtags na ma dmigs pa las sa bon dang myu gu lta bu ni mi mkhas pa la mkhas par mngon par rlom pa'i shes pa la /	The appropriated convention is a convention that is imputed by the subsequent conformity and reversal of that which is a convention. That which is not observed in the case of a seed and a sprout is for the sake of the consciousness that is the conceit of expertise for the non-expert.
['BO_T03_D3805:25a-15']	dngos po med pa'i ngo bo'i kun rdzob kyis rang gi ngo bos dngos po med par gyur pa nyid la sa bon du rigs pa'i dngos por med de /	dngos po med pa'i ngo bo'i kun rdzob kyis rang gi ngo bos dngos po med par gyur pa nyid la sa bon du rigs pa'i dngos por med de /	The convention of the nature of non-entityness is the entityness of non-entityness that is the seed of the entityness that is the nature of non-entityness.
['BO_T03_D3805:25a-16']	de'i de 'gal ba'i phyir ro //	de'i de 'gal ba'i phyir ro //	That is because it is contradictory.
['BO_T03_D3805:25a-17', 'BO_T03_D3805:25b-0']	don dam pa'i sa bon ni gang du yang med pas rjes su 'gro ba la sogs pa ma grub pa sgra don gyi sngon por snang ba nyid ces pa la ni gang du 'jug ste /🔽shes pa la @25b sogs pa la mnyam par brten pas bdag smra ba dang 'dra ba nyid do //	don dam pa'i sa bon ni gang du yang med pas rjes su 'gro ba la sogs pa ma grub pa sgra don gyi sngon por snang ba nyid ces pa la ni gang du 'jug ste / shes pa la @25b sogs pa la mnyam par brten pas bdag smra ba dang 'dra ba nyid do //	Since the seed of the ultimate does not exist anywhere, the nonestablishment of the seed of the ultimate is not established.🔽Since the seed of the ultimate does not exist anywhere, the nonestablishment of the seed of the ultimate is not established.🔽Since the seed of the ultimate does not exist anywhere, the nonestablishment of the seed of the ultimate is not established.🔽Since the seed of the ultimate does not exist anywhere, the nonestablishment of the seed of the ultimate is not established.🔽Since the seed of the ultimate does not exist anywhere, the nonestablishment of the seed of the ultimate is not established.🔽Since the seed of the ultimate does not exist anywhere, the nonestablishment of the seed of the ultimate is not established.🔽Since the seed of the ultimate does not exist anywhere, the nonestablishment of the seed of the ultimate is not established.🔽Since the seed of the ultimate does not exist anywhere, the nonestablishment of the seed of the ultimate is not established.🔽Since the seed of the ultimate does not exist anywhere, the nonestablishment of the seed of the ultimate is not established.🔽Since the seed of the ultimate does not exist anywhere, the nonestablishment of the seed of the ultimate is not established.🔽Since the seed of the ultimate does not exist anywhere, the nonestablishment of the seed of the ultimate is not established.🔽Since the seed of the ultimate does not exist anywhere, the nonestablishment of the seed of the ultimate is not established.🔽Since the seed of the ultimate does not exist anywhere, the nonestablishment of the seed of the ultimate is not established.🔽Since the seed of the ultimate does not exist anywhere, the nonestablishment of the seed of the ultimate is not established.🔽Since the seed of the ultimate does not exist anywhere, the nonestablishment of the seed of the ultimate is not established.🔽Since the seed of the ultimate does not exist anywhere, the nonestablishment of the seed of the ultimate is not established.
['BO_T03_D3805:25b-1', 'BO_T03_D3805:25b-2']	khyad par gyi gzhal bya bdag nyid kyis mi gsal yang de gnas pa mi 'gal zhes pa'i gsal ba bdag nyid kyis brjod par mi nus pa la ni sun 'byin pa gzhal bya la ltos pa med do //🔽'di rnams kyis ni gang zhig rtogs pa tsam gyi rjes su 'jug pa'i ngo bo kun gzhi'i rnam par shes pa ni dngos po sngon po zhes pa la sogs pa'i ngo bos rjes su 'jug ste /	khyad par gyi gzhal bya bdag nyid kyis mi gsal yang de gnas pa mi 'gal zhes pa'i gsal ba bdag nyid kyis brjod par mi nus pa la ni sun 'byin pa gzhal bya la ltos pa med do //🔽'di rnams kyis ni gang zhig rtogs pa tsam gyi rjes su 'jug pa'i ngo bo kun gzhi'i rnam par shes pa ni dngos po sngon po zhes pa la sogs pa'i ngo bos rjes su 'jug ste /	Since the seed of the ultimate does not exist anywhere, the nonestablishment of the seed of the ultimate is not established.🔽Since the seed of the ultimate does not exist anywhere, the
['BO_T03_D3805:25b-3']	de'i phyir bag chags la brten pas sngon po la sogs pa'i shes pa skye bar 'gyur la rang gi skad cig la ni de rnams kyang yang kun gzhi'i rnam par shes pa las sngon po la sogs pa'i shes pa de rnams ni med de /	de'i phyir bag chags la brten pas sngon po la sogs pa'i shes pa skye bar 'gyur la rang gi skad cig la ni de rnams kyang yang kun gzhi'i rnam par shes pa las sngon po la sogs pa'i shes pa de rnams ni med de /	Therefore, because they are based on latent propensities, consciousnesses of blue and so on arise, but those latent propensities do not exist in the present moment in the foundation consciousness.
['BO_T03_D3805:25b-4']	bag chags la gnod pa byed na ni sngon po la sogs pa'i dngos po med pa bsgoms par 'gyur bas /	bag chags la gnod pa byed na ni sngon po la sogs pa'i dngos po med pa bsgoms par 'gyur bas /	If they were to harm latent propensities, they would meditate on the nonexistence of things such as blue.🔽Therefore consciousness that is empty of those latent propensities arises and nondual consciousness is actualized.
['BO_T03_D3805:25b-5']	des stong pa'i rnam par shes pa tsam skyes nas gnyis su med pa'i rnam par shes pa mngon sum du byed ces bshad de de la rnam pa med pa'i kun gzhi'i rnam par shes pa dang sngon po la sogs pa'i shes pa'i rnam pa dang bcas pa de	des stong pa'i rnam par shes pa tsam skyes nas gnyis su med pa'i rnam par shes pa mngon sum du byed ces bshad de de la rnam pa med pa'i kun gzhi'i rnam par shes pa dang sngon po la sogs pa'i shes pa'i rnam pa dang bcas pa de	In this system, the foundation consciousness is without aspects and consciousnesses of blue and so on have aspects.
['BO_T03_D3805:25b-6']	nyid dpyad de rnam par shes pa gcig la ni rnam pa dang bcas pa dang / rnam pa med pa zhes pa ni phan tshun 'gal ba de ji ltar 'jug pa yid kyi rnam par shes pa rnams kyi rnam pa dang bcas pa nyid la rnam pa med pa'i kun gzhi'i rnam par shes pa yang de'i ngo bos rjes su 'jug pa yang dpyad	nyid dpyad de rnam par shes pa gcig la ni rnam pa dang bcas pa dang / rnam pa med pa zhes pa ni phan tshun 'gal ba de ji ltar 'jug pa yid kyi rnam par shes pa rnams kyi rnam pa dang bcas pa nyid la rnam pa med pa'i kun gzhi'i rnam par shes pa yang de'i ngo bos rjes su 'jug pa yang dpyad	In the same way, it should be analyzed whether the consciousness that has aspects and the consciousness that lacks aspects are mutually exclusive.
['BO_T03_D3805:25b-7']	par bya ste /	par bya ste /	The consciousness that has aspects and the consciousness that lacks aspects should be analyzed in terms of whether they are the same or different.
['BO_T03_D3805:25b-8']	gcig la gnyis kyi bdag nyid ces pa 'di ni skyes bu nga rgyal can gyi 'khrugs pa'i bshad pa ste /	gcig la gnyis kyi bdag nyid ces pa 'di ni skyes bu nga rgyal can gyi 'khrugs pa'i bshad pa ste /	The statement “one that has two natures” is the confused explanation of a conceited person.
['BO_T03_D3805:25b-9']	de brtag pa la dgos pa med do //	de brtag pa la dgos pa med do //	There is no need to analyze that.
['BO_T03_D3805:25b-10']	gang 'di'i 'dod pas dben pa'i sngon po la sogs pa'i rnam pa'i shes pa nam mkha' bzhin du bsgom par byas na bsgom pa'i stobs rdzogs pa na /	gang 'di'i 'dod pas dben pa'i sngon po la sogs pa'i rnam pa'i shes pa nam mkha' bzhin du bsgom par byas na bsgom pa'i stobs rdzogs pa na /	If one meditates on the consciousness that has the aspect of blue and so on, which is devoid of the object, like space, and if the power of meditation is perfected,
['BO_T03_D3805:25b-11']	de ltar rnam pa med de gang yang gzhan du de nyid nam mkha' bzhin du kun son pa nyid kyis khyab pa zhes 'dod pa ni de gnyi ga yang shin tu 'khrul te /	de ltar rnam pa med de gang yang gzhan du de nyid nam mkha' bzhin du kun son pa nyid kyis khyab pa zhes 'dod pa ni de gnyi ga yang shin tu 'khrul te /	Both of these assertions are utterly mistaken.
['BO_T03_D3805:25b-12']	sngon po'i rnam pa shes pa mi 'grub la /	sngon po'i rnam pa shes pa mi 'grub la /	The aspect of blue is not established as consciousness.
['BO_T03_D3805:25b-13', 'BO_T03_D3805:26a-0']	grub na de'i 'dod pas de nyid don dam pa'i ngo bo nyid la de'i rnam pa bzlog nas bsgoms pas yang dag pa ma yin par 'gyur bas des bskyed pa'i shes pa yang kho na nyid min te /🔽zad par sa dang / rnam shes mtha' yas kyi skye @26a * //	grub na de'i 'dod pas de nyid don dam pa'i ngo bo nyid la de'i rnam pa bzlog nas bsgoms pas yang dag pa ma yin par 'gyur bas des bskyed pa'i shes pa yang kho na nyid min te / zad par sa dang / rnam shes mtha' yas kyi skye @26a * //	If it were established, then by the assertion that it is the ultimate nature, the aspect of that would be averted and meditated on as not real. Therefore the consciousness generated by that is not reality.
['BO_T03_D3805:26a-1']	mched la sogs pa bzhin no //	mched la sogs pa bzhin no //	It is like the bases of infinite space and infinite consciousness.
['BO_T03_D3805:26a-2']	gang du so so'i skye bo'i gnas skabs rnams la tshad mas 'thad pa'i rnam pa med pa'i rnam par shes pa sgra don gyi rnam pa nye bar bsdus nas bsgoms pas gsal bar 'gyur ba na rnam par rtog pa med pa ste /	gang du so so'i skye bo'i gnas skabs rnams la tshad mas 'thad pa'i rnam pa med pa'i rnam par shes pa sgra don gyi rnam pa nye bar bsdus nas bsgoms pas gsal bar 'gyur ba na rnam par rtog pa med pa ste /	When the consciousness of ordinary beings is clarified by meditation that subsumes the aspects of words and meanings, it is nonconceptual.
['BO_T03_D3805:26a-3']	thog ma med pa'i 'khrul pa log pas rnam pa'i 'khor lo mi snang pa'i 'khor lo mi snang nas rnam pa med pa'i shes pa 'ba' zhig gsal ba bcom ldan 'das kyis gzugs kyi sku de'i nang na rjes kyis snang ba'o zhes 'dod pa de yang bcom nas	thog ma med pa'i 'khrul pa log pas rnam pa'i 'khor lo mi snang pa'i 'khor lo mi snang nas rnam pa med pa'i shes pa 'ba' zhig gsal ba bcom ldan 'das kyis gzugs kyi sku de'i nang na rjes kyis snang ba'o zhes 'dod pa de yang bcom nas	The Lord has also refuted the assertion that the appearance of the form body of the Buddha is the appearance of the subsequent consciousness.
['BO_T03_D3805:26a-4']	snang ba med pa la myong ba ni gang du yang ma grub la /	snang ba med pa la myong ba ni gang du yang ma grub la /	There is no experience whatsoever of the nonappearance of the form body of the Buddha.
['BO_T03_D3805:26a-5']	de'i rjes kyi sems dag pa 'jig rten pa'i rnam par rtog pa'i bdag nyid can ni bdag nyid med pas myong ba po med ces pa ste /	de'i rjes kyi sems dag pa 'jig rten pa'i rnam par rtog pa'i bdag nyid can ni bdag nyid med pas myong ba po med ces pa ste /	The subsequent consciousness, which is of the nature of mundane conceptual thought, is devoid of self, and so there is no experiencer.
['BO_T03_D3805:26a-6']	sngar brtsad zin to //	sngar brtsad zin to //	This has already been argued above.
['BO_T03_D3805:26a-7']	'on te yang dag pa'i bden pa'i gzung ba dang 'dzin pa la mngon par zhen nas 'jig rten pa bzhin du rnam par rtog pa'i sgra don sngon po la sogs pa la dmigs pa'i phyir dmigs pa de yang rnam par dpyad zin to //	'on te yang dag pa'i bden pa'i gzung ba dang 'dzin pa la mngon par zhen nas 'jig rten pa bzhin du rnam par rtog pa'i sgra don sngon po la sogs pa la dmigs pa'i phyir dmigs pa de yang rnam par dpyad zin to //	Moreover, the object of observation has already been analyzed, since it is the object of the term, such as blue, that is conceptualized in the world in dependence upon the manifest apprehension of the true reality of apprehendeds and apprehenders.
['BO_T03_D3805:26a-8']	de nas rgyud lam na gzugs kyi sku bcom ldan 'das la so sor snang na /	de nas rgyud lam na gzugs kyi sku bcom ldan 'das la so sor snang na /	Then, if the form body of the Bhagavat appears individually in the channels,
['BO_T03_D3805:26a-9']	so so'i rnam pa nyid kyi sgra don gyi gzugs kyi sku gnyis su sgra don gyi brtags pa'i ngo bo'i skyed pa so sor rtsa ba'i shes pa'i yongs su sgrub pa'i ngo bo yang 'khrul par 'gyur la /	so so'i rnam pa nyid kyi sgra don gyi gzugs kyi sku gnyis su sgra don gyi brtags pa'i ngo bo'i skyed pa so sor rtsa ba'i shes pa'i yongs su sgrub pa'i ngo bo yang 'khrul par 'gyur la /	the individual aspects themselves, the form body of the meaning of the sound, the essence of the imputation of the meaning of the sound, the individual generation, the essence of the complete knowledge of the fundamental consciousness, would also be deluded.
['BO_T03_D3805:26a-10']	des de bzhin gshegs pa yang 'khrul par 'gyur ro //	des de bzhin gshegs pa yang 'khrul par 'gyur ro //	And by that, the Tathagata would also be deluded.
['BO_T03_D3805:26a-11']	de nas bcom ldan 'das la de mi snang na ni bcom ldan 'das kyi smon lam dang gdul bya'i bsod nams kyis gdul bya rnams la longs spyod rdzogs pa dang sprul pa'i sku'i so sor snang bas rnam pa med pa'i rtogs pa ji ltar grub ste /	de nas bcom ldan 'das la de mi snang na ni bcom ldan 'das kyi smon lam dang gdul bya'i bsod nams kyis gdul bya rnams la longs spyod rdzogs pa dang sprul pa'i sku'i so sor snang bas rnam pa med pa'i rtogs pa ji ltar grub ste /	Then, if the Bhagavat does not appear to them, how is the realization of the absence of aspects established for the disciples by the appearance of the enjoyment body and emanation body of the Bhagavat to the disciples through the aspirations of the Bhagavat and the merit of the disciples?
['BO_T03_D3805:26a-12']	gang gi ni smon pa gang ni bcom ldan 'das gang ni gdul bya gang gi gang ni sras rung ba'i bsod nams la ji ltar gzugs kyi sku dag so sor snang bas de ltar thams cad du yang gzugs kyi sku gnyis su snang ba'i mtshan nyid can la	gang gi ni smon pa gang ni bcom ldan 'das gang ni gdul bya gang gi gang ni sras rung ba'i bsod nams la ji ltar gzugs kyi sku dag so sor snang bas de ltar thams cad du yang gzugs kyi sku gnyis su snang ba'i mtshan nyid can la	What is the aspiration? What is the Bhagavān? What is the disciple? What is the suitable son? How is it that the two form bodies appear everywhere in the form of the two form bodies?🔽It would be difficult to avoid contradicting the scriptures that state this.
['BO_T03_D3805:26a-13']	sogs pa gsungs pa'i don med par 'gyur zhes pa'i lung gis 'gal ba yang spang pa dka' la gang yang snang ba med pa'i gsal bar smra ba'i sngon gyi slob dpon rnams kyi 'dod pa dang phyis kyi rnams kyi 'khrul pa brjod par byas /	sogs pa gsungs pa'i don med par 'gyur zhes pa'i lung gis 'gal ba yang spang pa dka' la gang yang snang ba med pa'i gsal bar smra ba'i sngon gyi slob dpon rnams kyi 'dod pa dang phyis kyi rnams kyi 'khrul pa brjod par byas /	The assertion of the earlier masters that appearances are clarity without appearance should be expressed as the error of the later ones.
['BO_T03_D3805:26a-14']	de ni rab tu 'jug par bya ste /	de ni rab tu 'jug par bya ste /	That should be engaged.
['BO_T03_D3805:26a-15']	de nyid ni don dam par yod pa ma yin te /	de nyid ni don dam par yod pa ma yin te /	That is not ultimately existent.
['BO_T03_D3805:26b-0']	rang rig pa'i mngon sum @26b sngon po la sogs pa'i 'dzin pa dag tha dad kyang min la med pa yang yin zhes pa'i 'dod pa ni gnyis kyi bdag nyid can yang med pa nyid de /	rang rig pa'i mngon sum @26b sngon po la sogs pa'i 'dzin pa dag tha dad kyang min la med pa yang yin zhes pa'i 'dod pa ni gnyis kyi bdag nyid can yang med pa nyid de /	The assertion that the apprehensions of blue and so on are not different in reflexive awareness but are nonexistent is also the nonexistence of the nature of duality.
['BO_T03_D3805:26b-1']	de nyid mi rtsod pa dang / sun byung ba yang ni grangs can gyi grub mthar 'gyur ro //	de nyid mi rtsod pa dang / sun byung ba yang ni grangs can gyi grub mthar 'gyur ro //	and it would not be a dispute, and the one who is refuted would be a Sāṃkhya philosopher.
