segmentnr	original	analyzed	translated
['BO_T02_D1851-2:73a-8']	de ma thag pa'i 'bras bu'i gnas skabs skye pa'i phyir ro //	de ma thag pa'i 'bras bu'i gnas skabs skye pa'i phyir ro //	because the state of the effect of immediate succession is produced.
['BO_T02_D1851-2:73a-9']	gang gi tshe snying po mnyam pa nyid med pa de'i tshe de'i bsgom pa don med par 'gyur ro zhes bya bar dgongs so //	gang gi tshe snying po mnyam pa nyid med pa de'i tshe de'i bsgom pa don med par 'gyur ro zhes bya bar dgongs so //	When there is no equality of the essence, then the cultivation of it is pointless, this is the idea.
['BO_T02_D1851-2:73a-10']	de bzhin gshegs pa thams cad kyi bdag po ni chos kyi sku brnyes pa'i phyir ro //	de bzhin gshegs pa thams cad kyi bdag po ni chos kyi sku brnyes pa'i phyir ro //	The Lord of all the Tathagatas is the Dharma Body.
['BO_T02_D1851-2:73a-11']	rdo rje 'dzin pa ni gsang ba gsum brnyes pa'i phyir ro //	rdo rje 'dzin pa ni gsang ba gsum brnyes pa'i phyir ro //	The Vajra Holder is the one who has attained the three secrets.
['BO_T02_D1851-2:73a-12']	de gsal bar mdzad pa la yang de skad ces bya'o //	de gsal bar mdzad pa la yang de skad ces bya'o //	He is so called because he illuminates that.
['BO_T02_D1851-2:73a-13']	rang gi sku dang gsung dang thugs kyi rdo rje snying pos mnyam pa nyid de ni ye shes te de skad ces bya'o //	rang gi sku dang gsung dang thugs kyi rdo rje snying pos mnyam pa nyid de ni ye shes te de skad ces bya'o //	The equality of one's own body, speech, and mind is the vajra, and that is the wisdom.
['BO_T02_D1851-2:73a-14']	de'i rgyud ni rgyun mi 'chad par 'jug pa'o //	de'i rgyud ni rgyun mi 'chad par 'jug pa'o //	The continuum of that is the uninterrupted engagement.
['BO_T02_D1851-2:73a-15']	de nyid ni brtan par gyur pa thob pa'i phyir rdo rje ste de nyid la gnas pa'o //	de nyid ni brtan par gyur pa thob pa'i phyir rdo rje ste de nyid la gnas pa'o //	That itself is the vajra because it is attained as the firm state, and that is the abode.
['BO_T02_D1851-2:73a-16']	rgyud de nyid las yang dag par byung ba zhes bya ba'i don gyis shes par bya'o //	rgyud de nyid las yang dag par byung ba zhes bya ba'i don gyis shes par bya'o //	It should be understood that the meaning of the term is that which arises from that very continuum.
['BO_T02_D1851-2:73a-17']	dngos grub thams cad ni rdo rje 'chang ba'i dngos grub sna tshogs pa'o //	dngos grub thams cad ni rdo rje 'chang ba'i dngos grub sna tshogs pa'o //	All powers are the various powers of Vajradhara.
['BO_T02_D1851-2:73a-18']	rdo rje'i ye shes ni dkyil 'khor pa'i chos rnams so //	rdo rje'i ye shes ni dkyil 'khor pa'i chos rnams so //	Vajra-knowledge is the phenomena of the mandala deities.
['BO_T02_D1851-2:73a-19']	khams gsum ni yongs su dag pa'i sangs rgyas kyi zhing ngo //	khams gsum ni yongs su dag pa'i sangs rgyas kyi zhing ngo //	The three realms are the completely pure buddha-field.
['BO_T02_D1851-2:73a-20']	snying po che ba'i bdag nyid kyis ye shes kyi dbang du mdzad nas de bzhin gshegs pa thams cad kyis zhes bya ba la sogs pa gsungs te /	snying po che ba'i bdag nyid kyis ye shes kyi dbang du mdzad nas de bzhin gshegs pa thams cad kyis zhes bya ba la sogs pa gsungs te /	Having made the knowledge consecration with the greatness of the essence, it is said, “All Ones Gone Thus,” and so forth.
['BO_T02_D1851-2:73a-21']	de bzhin gshegs pa thams cad ni dam tshig chen po'i dkyil 'khor gyi dbang phyug go //	de bzhin gshegs pa thams cad ni dam tshig chen po'i dkyil 'khor gyi dbang phyug go //	All Ones Gone Thus are the lords of the great commitment mandala.
['BO_T02_D1851-2:73a-22']	sku la sogs pa dngos grub ni de nyid kyi dkyil 'khor ba'i chos rnams thob pa'o //	sku la sogs pa dngos grub ni de nyid kyi dkyil 'khor ba'i chos rnams thob pa'o //	The powers of body and so forth are the attainment of the phenomena of that very mandala.
['BO_T02_D1851-2:73a-23']	khams gsum pa thams cad ni dam tshig gi dkyil 'khor chen po'o //	khams gsum pa thams cad ni dam tshig gi dkyil 'khor chen po'o //	All three realms are the great commitment mandala.
['BO_T02_D1851-2:73a-24']	gang na gnas zhes bya ba ni ji de lta nyid kyi padma'am ji zhu ba'i snying po la yin /	gang na gnas zhes bya ba ni ji de lta nyid kyi padma'am ji zhu ba'i snying po la yin /	Where does it abide? Is it in the lotus of just that way or in the essence of the question?
['BO_T02_D1851-2:73a-25']	gal te snying po la ma yin na de'i tshe snying po'i rgyu mthun pa'i snying po mnyam pa nyid kyi ye shes la yang dngos grub dang / rdo rje ye shes dang khams gsum pa mi gnas pa de bas na /	gal te snying po la ma yin na de'i tshe snying po'i rgyu mthun pa'i snying po mnyam pa nyid kyi ye shes la yang dngos grub dang / rdo rje ye shes dang khams gsum pa mi gnas pa de bas na /	If it is not in the essence, then at that time, the essence is the natural outflow of the essence, and the power is in the gnosis of equality, and the vajra gnosis does not abide in the three realms.
['BO_T02_D1851-2:73a-26']	dngos grub de gang la 'gyur zhes bsams pa'o //	dngos grub de gang la 'gyur zhes bsams pa'o //	Therefore, what is the power?
['BO_T02_D1851-2:73a-27', 'BO_T02_D1851-2:73b-0']	de bzhin gshegs pa thams cad ni dkyil 'khor gyi bdag po'o //🔽rdo rje ni @73b dkyil 'khor pa rnams so //	de bzhin gshegs pa thams cad ni dkyil 'khor gyi bdag po'o // rdo rje ni @73b dkyil 'khor pa rnams so //	All the Tathagatas are the lords of the mandala.🔽The vajra is the mandala deities.
['BO_T02_D1851-2:73b-1']	ye shes ni rten gyi dkyil 'khor ro //	ye shes ni rten gyi dkyil 'khor ro //	The gnosis is the mandala of the support.
['BO_T02_D1851-2:73b-2']	de rnams kyi bdag po ni sdud par mdzad pa'o //	de rnams kyi bdag po ni sdud par mdzad pa'o //	The lord of those is the one who gathers them.
['BO_T02_D1851-2:73b-3']	de ston par mdzad pa la de skad ces bya'o //	de ston par mdzad pa la de skad ces bya'o //	The one who teaches that is called that.
['BO_T02_D1851-2:73b-4']	nam mkha' ni snying po de nyid de de la gnas pa ni de nyid du zhu ba'i phyir ro //	nam mkha' ni snying po de nyid de de la gnas pa ni de nyid du zhu ba'i phyir ro //	Space is that essence, and abiding in that is dissolving into that.
['BO_T02_D1851-2:73b-5']	gang na gnas zhes bya ba ci de yab yum la gnas sam /	gang na gnas zhes bya ba ci de yab yum la gnas sam /	Where does it abide? Does it abide in the father and mother?
['BO_T02_D1851-2:73b-6']	ci de dag nyid la thim par 'gyur grang na /	ci de dag nyid la thim par 'gyur grang na /	Or does it dissolve into them?
['BO_T02_D1851-2:73b-7']	phyogs dang po ltar na ni sgrib pa med par mi 'gyur ro zhes bsam pa la'o //	phyogs dang po ltar na ni sgrib pa med par mi 'gyur ro zhes bsam pa la'o //	In the first case, it would not be without obscuration.
['BO_T02_D1851-2:73b-8']	rdo rje ni sngar bsdus pa thams cad de rig pa dang bcas pa'i mchog dang pos sam /	rdo rje ni sngar bsdus pa thams cad de rig pa dang bcas pa'i mchog dang pos sam /	The vajra is all that was gathered before, the supreme with awareness, by the first,
['BO_T02_D1851-2:73b-9']	de rnams bsdus nas 'dzin par mdzad pa'i phyir rdo rje 'chang ba ste /	de rnams bsdus nas 'dzin par mdzad pa'i phyir rdo rje 'chang ba ste /	or having gathered those, it is the holder of the vajra, because it holds them.
['BO_T02_D1851-2:73b-10']	sgrib pa med cing dag pa'i nam mkha'i dbyings so //	sgrib pa med cing dag pa'i nam mkha'i dbyings so //	It is the realm of space, without obscuration and pure.
['BO_T02_D1851-2:73b-11']	de ston par mdzad pa'i bcom ldan 'das la yang de skad ces bya'o //	de ston par mdzad pa'i bcom ldan 'das la yang de skad ces bya'o //	The Bhagavān who teaches that is also called that.
['BO_T02_D1851-2:73b-12']	gang na yang ma yin no zhes bya ba ni de dag kyang de nyid du zhu ba'i phyir ro //	gang na yang ma yin no zhes bya ba ni de dag kyang de nyid du zhu ba'i phyir ro //	It is not anywhere, because they ask about that very thing.
['BO_T02_D1851-2:73b-13']	ngo mtshar ni mnyam pa nyid kyi rdo rje la'o //	ngo mtshar ni mnyam pa nyid kyi rdo rje la'o //	The wonder is in the vajra of equality.
['BO_T02_D1851-2:73b-14']	rmad du gyur pa ni snying po rdo rje la'o //	rmad du gyur pa ni snying po rdo rje la'o //	The marvel is in the essence vajra.
['BO_T02_D1851-2:73b-15']	de nyid kyis ni ae ma'o rdo rje ae ma'o rdo rje zhes bya ba gsungs so //	de nyid kyis ni ae ma'o rdo rje ae ma'o rdo rje zhes bya ba gsungs so //	By that very thing, he says, “Amazing vajra! Amazing vajra!”
['BO_T02_D1851-2:73b-16']	rdo rje'i zhes pa ni rdo rje 'chang ba'i'o //	rdo rje'i zhes pa ni rdo rje 'chang ba'i'o //	The vajra is of the vajra holder.
['BO_T02_D1851-2:73b-17']	bstan pa 'di dag gang yin pa de yang ngo mtshar to //	bstan pa 'di dag gang yin pa de yang ngo mtshar to //	That which is taught here is also amazing.
['BO_T02_D1851-2:73b-18']	ci'i phyir zhe na gang du zhes bya ba la sogs pa gsungs pa la /	ci'i phyir zhe na gang du zhes bya ba la sogs pa gsungs pa la /	Why? He declares, “wherever, etc.”
['BO_T02_D1851-2:73b-19']	gang du zhes bya ba ni snying po dang rdo rje mnyam pa nyid rdo rje gang la'o //	gang du zhes bya ba ni snying po dang rdo rje mnyam pa nyid rdo rje gang la'o //	“ Wherever” is in the sameness of the essence and the vajra.
['BO_T02_D1851-2:73b-20']	lus dang ngag dang sems med ces bya ba ni go rims bzhin du lus la sogs pa ni rnam par rtog pa med pa'i phyir dang rnam par rtog pa dmigs su med pa'i phyir ro //	lus dang ngag dang sems med ces bya ba ni go rims bzhin du lus la sogs pa ni rnam par rtog pa med pa'i phyir dang rnam par rtog pa dmigs su med pa'i phyir ro //	“ Without body, speech, and mind” is, respectively, because the body, etc. are non-conceptual and the concepts are unobservable.
['BO_T02_D1851-2:73b-21']	de ru gzugs ni rnam par bsgom pa ni sku dang gsung dang thugs su snang bar te /	de ru gzugs ni rnam par bsgom pa ni sku dang gsung dang thugs su snang bar te /	“ There, the form is meditated” is the appearance as body, speech, and mind.
['BO_T02_D1851-2:73b-22']	rim bzhin du de kho na nyid ro gcig pa dang lus dang ngag dang sems su snang bas so //	rim bzhin du de kho na nyid ro gcig pa dang lus dang ngag dang sems su snang bas so //	In order, it is the sameness of reality and the appearance as body, speech, and mind.
['BO_T02_D1851-2:73b-23']	rig pa'i skyes bu bsgom pa'i dbang du mdzad nas /	rig pa'i skyes bu bsgom pa'i dbang du mdzad nas /	With regard to the meditation of the person of the knowledge,
['BO_T02_D1851-2:73b-24']	de nas zhes bya ba la sogs pa gsungs te /	de nas zhes bya ba la sogs pa gsungs te /	he declares, “then, etc.”
['BO_T02_D1851-2:73b-25']	yi ge gsum brnyes pa'i phyir rdo rje gsum yang de yin la mchog chen po yang yin pas na'o //	yi ge gsum brnyes pa'i phyir rdo rje gsum yang de yin la mchog chen po yang yin pas na'o //	It is the three vajras because it is the attainment of the three syllables, and it is the great supreme because it is the supreme of all.
['BO_T02_D1851-2:73b-26']	dam pa nyid yin pa'i phyir mchog ni byang chub sems dpa' rnams so //	dam pa nyid yin pa'i phyir mchog ni byang chub sems dpa' rnams so //	The best are the bodhisattvas, because they are excellent.
['BO_T02_D1851-2:73b-27']	shin tu dam pa nyid yin pa'i phyir mchog chen ni sangs rgyas rnams so //	shin tu dam pa nyid yin pa'i phyir mchog chen ni sangs rgyas rnams so //	The great best are the buddhas, because they are extremely excellent.
['BO_T02_D1851-2:73b-28']	de rnams kyi mchog ni tshogs so //	de rnams kyi mchog ni tshogs so //	The best of those is the assembly.🔽The three vajras of those are the three secrets.🔽The supreme lord of those is the supreme emanation.
['BO_T02_D1851-2:73b-29']	de rnams kyi rdo rje gsum ni gsang ba gsum mo //	de rnams kyi rdo rje gsum ni gsang ba gsum mo //	The power of the three vajras is the power of the three secrets.
['BO_T02_D1851-2:73b-30']	de rnams kyi dbang phyug mchog ni 'byin pa'i mchog go //	de rnams kyi dbang phyug mchog ni 'byin pa'i mchog go //	The supreme lord of those is the supreme emanation.
['BO_T02_D1851-2:73b-31']	rig pa'i skyes bu bsgom pa'i dngos grub ni dngos grub kyi thabs yin pa'i phyir ro //	rig pa'i skyes bu bsgom pa'i dngos grub ni dngos grub kyi thabs yin pa'i phyir ro //	The power of the three vajras is the power of the three secrets.
['BO_T02_D1851-2:74a-0']	nam mkha' @74a * //	nam mkha' @74a * //	The supreme lord of those is the supreme emanation.🔽The power of the three vajras is the power of the three secrets.
['BO_T02_D1851-2:74a-1']	dbyings ni chos 'byung ba'o //	dbyings ni chos 'byung ba'o //	The supreme lord of those is the supreme emanation.
['BO_T02_D1851-2:74a-2']	de la rdo rje ni gzhal yas khang ngo //	de la rdo rje ni gzhal yas khang ngo //	The power of the three vajras is the power of the three secrets.
['BO_T02_D1851-2:74a-3', 'BO_T02_D1851-2:74a-4']	de'i dbus na gnas pa ni dbus ma'i gdan la gnas pa'o //🔽sangs rgyas ni mngon par byang chub pa rnam pa lnga dang ldan pa'i mchog dang po'o //	de'i dbus na gnas pa ni dbus ma'i gdan la gnas pa'o // sangs rgyas ni mngon par byang chub pa rnam pa lnga dang ldan pa'i mchog dang po'o //	The supreme lord of those is the supreme emanation.🔽The power of the three vajras is the power of the three secrets.
['BO_T02_D1851-2:74a-5']	de'i dkyil 'khor ni snying po bsdus pa ste /	de'i dkyil 'khor ni snying po bsdus pa ste /	The supreme lord of those is the supreme emanation.🔽The power of the three vajras is the power of the three secrets.🔽The supreme lord of those is the supreme emanation.🔽The power of the three vajras is the power of the three secrets.🔽The supreme lord of those is the supreme emanation.🔽The power of the three vajras is the power of the three secrets.🔽The supreme lord of those is the supreme emanation.🔽The power of the three vajras is the power of the three secrets.🔽The supreme lord of those is the supreme emanation.🔽The power of the three vajras is the power of the three secrets.🔽The supreme lord of those is the supreme emanation.🔽The power of the three vajras is the power of the three secrets.🔽The supreme lord of those is the supreme emanation.🔽The power of the three vajras is the power of the three secrets.🔽The supreme lord of those is the supreme emanation.🔽The power of the three vajras is the power of the three secrets.🔽The supreme lord of those is the supreme emanation.🔽The power of the three vajras is the power of the three secrets.🔽The supreme lord of those is the supreme emanation.🔽The power of the three vajras is the power of the three secrets.🔽The supreme lord of those is the supreme emanation.🔽The power of the three vajras is the power of the three secrets.🔽The supreme lord of those is the supreme emanation.
['BO_T02_D1851-2:74a-6']	'dod chags chen po'i tshul la sogs pa'i cho ga las grub pa'i sgrib pa med cing dag pa'i nam mkha'i dbyings so //	'dod chags chen po'i tshul la sogs pa'i cho ga las grub pa'i sgrib pa med cing dag pa'i nam mkha'i dbyings so //	In the realm of space, which is pure and free from obscurations, by the rite of the method of great passion, and so on.
['BO_T02_D1851-2:74a-7']	bsgom par bya zhes bya ba ni glu bzhis bskul ba la sogs pa'i rim gyis so //	bsgom par bya zhes bya ba ni glu bzhis bskul ba la sogs pa'i rim gyis so //	“One should meditate” means by the process of the four songs, and so on.
['BO_T02_D1851-2:74a-8']	rdo rje'i sku ni zhes bya ba ni rnam par snang mdzad do //	rdo rje'i sku ni zhes bya ba ni rnam par snang mdzad do //	“Vajra body” is Vairocana.
['BO_T02_D1851-2:74a-9']	rdo rje zhes bya ba ni mi bskyod pa'o //	rdo rje zhes bya ba ni mi bskyod pa'o //	“Vajra” is Akṣobhya.
['BO_T02_D1851-2:74a-10']	sku gsum las byung ba zhes bya ba ni sku rdo rje la sogs pa'i sku gsum gyis byin gyis brlabs pa'o //	sku gsum las byung ba zhes bya ba ni sku rdo rje la sogs pa'i sku gsum gyis byin gyis brlabs pa'o //	“Arisen from the three bodies” is blessed by the three bodies, such as Vajra Body, and so on.
['BO_T02_D1851-2:74a-11']	rnam par 'phro ba ni 'od zer lnga spros pa'i phyir ro //	rnam par 'phro ba ni 'od zer lnga spros pa'i phyir ro //	“Radiating” is emitting the five lights.
['BO_T02_D1851-2:74a-12']	spyir bor rdo rje dang phyag tu 'khor lo 'dzin par mdzad pas ni rdo rje 'khor lo 'dzin to //	spyir bor rdo rje dang phyag tu 'khor lo 'dzin par mdzad pas ni rdo rje 'khor lo 'dzin to //	“Holding the vajra wheel” is holding the vajra and the wheel in the hand.
['BO_T02_D1851-2:74a-13']	thams cad 'di ni zhes bya ba ni mthun par bsgres pa ste /	thams cad 'di ni zhes bya ba ni mthun par bsgres pa ste /	“All of this” is a general summary.
['BO_T02_D1851-2:74a-14']	bud med dang skyes pa'i rnam pa dang ldan pa'i bdag nyid can la 'dir phyag rgya chen po blta bar bya'o //	bud med dang skyes pa'i rnam pa dang ldan pa'i bdag nyid can la 'dir phyag rgya chen po blta bar bya'o //	Here, the great seal should be seen as having the nature of the form of a woman or a man.
['BO_T02_D1851-2:74a-15']	de nyid kyi phyir rig pa'i skyes bu rdo rje gsang bas zhes bya ba gsungs te /	de nyid kyi phyir rig pa'i skyes bu rdo rje gsang bas zhes bya ba gsungs te /	Vajra-secret-person-of-knowledge.
['BO_T02_D1851-2:74a-16']	rig ma dang yang dag par ldan pa'i skyes bu ni rig pa'i skyes bu'o //	rig ma dang yang dag par ldan pa'i skyes bu ni rig pa'i skyes bu'o //	The person who is endowed with the knowledge consort is the person of knowledge.
['BO_T02_D1851-2:74a-17']	de'i rdo rje ste 'khor los sgyur ba'i spyi bo dang gsang ba ni gnas ji lta ba bzhin du gsum mo //	de'i rdo rje ste 'khor los sgyur ba'i spyi bo dang gsang ba ni gnas ji lta ba bzhin du gsum mo //	His vajra, the crown and secret of the universal monarch, are the three places just as they are.
['BO_T02_D1851-2:74a-18']	de ston par mdzad pa la de skad ces bya'o //	de ston par mdzad pa la de skad ces bya'o //	He is so called because he teaches that.
['BO_T02_D1851-2:74a-19']	dbyings gyur pa zhes bya ba ni khams gsum gyi lha mo bzhi las rigs kyi dbye bas gcig go //	dbyings gyur pa zhes bya ba ni khams gsum gyi lha mo bzhi las rigs kyi dbye bas gcig go //	The transformation of the realm is one of the four goddesses of the three realms, divided by type.
['BO_T02_D1851-2:74a-20']	mnyes par byed pa zhes bya ba ni mdun du bskyed nas cho ga ji lta ba bzhin du sbyar bas so //	mnyes par byed pa zhes bya ba ni mdun du bskyed nas cho ga ji lta ba bzhin du sbyar bas so //	The pleasing is the one generated in front, by the union with her just as the rite prescribes.
['BO_T02_D1851-2:74a-21']	rdo rje sku ni gsum gyis mtshan //	rdo rje sku ni gsum gyis mtshan //	The vajra body is marked by the three.
['BO_T02_D1851-2:74a-22']	zhes bya ba ni rdo rje dang sku gsum gyi gnas ji lta ba bzhin du mtshan pa'o //	zhes bya ba ni rdo rje dang sku gsum gyi gnas ji lta ba bzhin du mtshan pa'o //	The vajra and the three bodies are marked just as they are in the places.
['BO_T02_D1851-2:74a-23']	char 'bebs pas na khyu mchog ste /	char 'bebs pas na khyu mchog ste /	The bull is the rain-maker,
['BO_T02_D1851-2:74a-24']	bde ba chen pos bdag dang gzhan la dbang bskur bar mdzad pa'i phyir ro //	bde ba chen pos bdag dang gzhan la dbang bskur bar mdzad pa'i phyir ro //	because he bestows the consecration of great bliss on himself and others.
['BO_T02_D1851-2:74a-25']	byang chub ni bsnyen pa'i 'bras bu'o //	byang chub ni bsnyen pa'i 'bras bu'o //	Enlightenment is the result of the approach.
['BO_T02_D1851-2:74a-26']	sems dpa' ni nye bar bsgrubs pa'i 'bras bu ste /	sems dpa' ni nye bar bsgrubs pa'i 'bras bu ste /	The hero is the result of the near accomplishment.
['BO_T02_D1851-2:74a-27']	de dag dang ldan pas na byang chub sems dpa'o //	de dag dang ldan pas na byang chub sems dpa'o //	He is a bodhisattva because he is endowed with them.
['BO_T02_D1851-2:74a-28']	grags chen rnams ni rig pa'i brtul zhugs legs par spyad pas so //	grags chen rnams ni rig pa'i brtul zhugs legs par spyad pas so //	The great fame is due to the good practice of the knowledge observance.
['BO_T02_D1851-2:74a-29', 'BO_T02_D1851-2:74a-30', 'BO_T02_D1851-2:74a-31']	zhag bdun gyis gzi chen po zhes bya ba ni rgyu'i nus pa shin tu phul du byung bas so //🔽de bas rgyu'i stobs chung bas zla ba phyed na'o //🔽de bas kyang chung bas ni zla ba phyed na'o //	zhag bdun gyis gzi chen po zhes bya ba ni rgyu'i nus pa shin tu phul du byung bas so // de bas rgyu'i stobs chung bas zla ba phyed na'o // de bas kyang chung bas ni zla ba phyed na'o //	In seven days, the great splendor is due to the extremely excellent power of the cause.🔽In a fortnight, it is due to the lesser power of the cause.🔽In a fortnight, it is due to the lesser power of the cause.
['BO_T02_D1851-2:74a-32']	de bas kyang shin tu chung bas ni phyed dang gnyis kyis te /	de bas kyang shin tu chung bas ni phyed dang gnyis kyis te /	In a fortnight and a half, it is due to the extremely lesser power of the cause.
['BO_T02_D1851-2:74a-33']	de bzhin 'grub pa'o //	de bzhin 'grub pa'o //	Thus, there is accomplishment.
['BO_T02_D1851-2:74b-0']	@74b sku gsum dngos grub ni 'dod pa'i thar pa'o //	@74b sku gsum dngos grub ni 'dod pa'i thar pa'o //	The accomplishment of the three bodies is the liberation of desire.
['BO_T02_D1851-2:74b-1']	sku dang gsung dang thugs ni sku rdo rje la sogs pa'o //	sku dang gsung dang thugs ni sku rdo rje la sogs pa'o //	The body, speech, and mind are the vajra body and so forth.
['BO_T02_D1851-2:74b-2']	rdo rje ni ye shes sems dpa'o //	rdo rje ni ye shes sems dpa'o //	The vajra is the awareness being.
['BO_T02_D1851-2:74b-3']	de rnams bsdus pa ni gnas ji lta ba bzhin du bzhi char yang bkod pa'o //	de rnams bsdus pa ni gnas ji lta ba bzhin du bzhi char yang bkod pa'o //	Their gathering is the arrangement of all four in their respective places.
['BO_T02_D1851-2:74b-4']	gsang ba'i thugs ka'i zla ba dang mtshan ma'o //	gsang ba'i thugs ka'i zla ba dang mtshan ma'o //	The secret heart is the moon and the sign.
['BO_T02_D1851-2:74b-5']	gsang chen ni mtshan ma'i lte ba'i zla ba la sa bon no //	gsang chen ni mtshan ma'i lte ba'i zla ba la sa bon no //	The great secret is the seed in the moon in the center of the sign.
['BO_T02_D1851-2:74b-6']	de gsal bar byed pa'i gzhung la yang de skad ces bya'o //	de gsal bar byed pa'i gzhung la yang de skad ces bya'o //	The text that elucidates that is called that.
['BO_T02_D1851-2:74b-7']	sku gsung thugs ni sems dpa' gsum gyis brlabs pa'o //	sku gsung thugs ni sems dpa' gsum gyis brlabs pa'o //	The body, speech, and mind are consecrated by the three beings.
['BO_T02_D1851-2:74b-8']	de rnams kyi dam tshig ni thugs su chud pa ste /	de rnams kyi dam tshig ni thugs su chud pa ste /	Their commitments are the realizations.
['BO_T02_D1851-2:74b-9']	'di rnams kyi so so'i rang gi thugs ka'i sa bon no //	'di rnams kyi so so'i rang gi thugs ka'i sa bon no //	These are the individual seed syllables in their hearts.
['BO_T02_D1851-2:74b-10']	sku gsum ni mi phyed pa nyid kyi phyir phyag rgya chen po ste /	sku gsum ni mi phyed pa nyid kyi phyir phyag rgya chen po ste /	The three bodies are the great seal because of their indivisibility.
['BO_T02_D1851-2:74b-11']	ye shes sems dpa'o //	ye shes sems dpa'o //	It is the wisdom being.
['BO_T02_D1851-2:74b-12']	de'i don ni rang gi sa bon no //	de'i don ni rang gi sa bon no //	Its meaning is the seed syllable.
['BO_T02_D1851-2:74b-13']	de'i bstan pa ni 'byin pa po ste /	de'i bstan pa ni 'byin pa po ste /	Its teaching is the emanator.
['BO_T02_D1851-2:74b-14']	de nyid kyi ngos gsum du de nyid las dbye ba gsum gyi sngags spros pa'o //	de nyid kyi ngos gsum du de nyid las dbye ba gsum gyi sngags spros pa'o //	On its three sides, the three divisions of the mantra are emanated from it.
['BO_T02_D1851-2:74b-15']	thams cad ces pa ni sngags bdun po de dag bsgom pa'o //	thams cad ces pa ni sngags bdun po de dag bsgom pa'o //	All means the meditation on those seven mantras.
['BO_T02_D1851-2:74b-16']	cho ga bzhin zhes pa ni so so'i gdan gyi mtshan ma rnams kyi nang du gnas pa'i gdan rnams la'o //	cho ga bzhin zhes pa ni so so'i gdan gyi mtshan ma rnams kyi nang du gnas pa'i gdan rnams la'o //	According to the rite means on the seats situated in the signs of their individual seats.
['BO_T02_D1851-2:74b-17']	'bras bu ni skad cig gis zhes bya ba gsungs te //	'bras bu ni skad cig gis zhes bya ba gsungs te //	The result is stated in the words “in an instant.”
['BO_T02_D1851-2:74b-18']	dus kyi skad cig gis zhes bya ba'i don to //	dus kyi skad cig gis zhes bya ba'i don to //	The meaning is “in a moment of time.”
['BO_T02_D1851-2:74b-19']	sangs rgyas zhes bya ba ni sa bcu'i dbang phyug nyid do //	sangs rgyas zhes bya ba ni sa bcu'i dbang phyug nyid do //	“ Buddhahood” is the state of being a lord of the tenth stage.
['BO_T02_D1851-2:74b-20']	sgrub pa'i cho ga lhag ma rnams dang brtul zhugs dang dbang bskur ba'i spros pa rnams ni bco lnga pa las gsungs so //	sgrub pa'i cho ga lhag ma rnams dang brtul zhugs dang dbang bskur ba'i spros pa rnams ni bco lnga pa las gsungs so //	The remaining rites of practice, the observances, and the elaborations of consecration are taught in the fifteenth chapter.
['BO_T02_D1851-2:74b-21']	de de ltar na yan lag drug pa'i rig pa'i skyes bu bsgom pa ni bskyed pa dang byin gyis brlabs pa dang / dbang bskur ba dang brtul zhugs dang / gsang ba dang gsang chen dang sdom pa zhes bya ba yan lag drug go //	de de ltar na yan lag drug pa'i rig pa'i skyes bu bsgom pa ni bskyed pa dang byin gyis brlabs pa dang / dbang bskur ba dang brtul zhugs dang / gsang ba dang gsang chen dang sdom pa zhes bya ba yan lag drug go //	Thus, the cultivation of the person of knowledge with six limbs is the six limbs called creation, consecration, consecration, observance, secret, great secret, and vow.
