segmentnr	original	analyzed	translated
['BO_T02_D1851-2:90a-1']	de 'byung gnas te thog ma'i rgyu zhes bya ba'i don to //	de 'byung gnas te thog ma'i rgyu zhes bya ba'i don to //	The source is the initial cause.
['BO_T02_D1851-2:90a-2']	byang chub kyi rgyu dang po gang yin zhe na /	byang chub kyi rgyu dang po gang yin zhe na /	What is the first cause of enlightenment?
['BO_T02_D1851-2:90a-3']	thog ma dang tha ma med pa chos kyi dbyings 'di ni byang chub kyi sems so //	thog ma dang tha ma med pa chos kyi dbyings 'di ni byang chub kyi sems so //	This basic element, the expanse of reality, which is without beginning or end, is the mind of enlightenment.
['BO_T02_D1851-2:90a-4']	de bzhin spang med 'bras bu ste bag chags dang bcas pa'i sgrib pa thams cad spangs pa'i phyir rang gi rang bzhin du gnas pa'i chos kyi dbyings kyi 'bras bu de ni spang du med pa yin te /	de bzhin spang med 'bras bu ste bag chags dang bcas pa'i sgrib pa thams cad spangs pa'i phyir rang gi rang bzhin du gnas pa'i chos kyi dbyings kyi 'bras bu de ni spang du med pa yin te /	Similarly, there is no result to be eliminated, because the result of the expanse of reality, which is the natural state of things, is not to be eliminated, since all obscurations, together with their instincts, are eliminated.
['BO_T02_D1851-2:90a-5']	spang bar bya ba'i sgrib pa de'i tshe shin tu med pa'i phyir ro //	spang bar bya ba'i sgrib pa de'i tshe shin tu med pa'i phyir ro //	At that time, the obscurations to be eliminated do not exist at all.
['BO_T02_D1851-2:90a-6']	gzhi ni thabs zhes bya ba ste /	gzhi ni thabs zhes bya ba ste /	The basis is called the method.
['BO_T02_D1851-2:90a-7']	rang bzhin las rgyu gzhan ni thabs yin no //	rang bzhin las rgyu gzhan ni thabs yin no //	The cause, which is other than the nature, is the method.
['BO_T02_D1851-2:90a-8']	de ni gzhi yin te de la gnas pa'i rnal 'byor pas 'bras bu thob pa'i phyir ro //	de ni gzhi yin te de la gnas pa'i rnal 'byor pas 'bras bu thob pa'i phyir ro //	That is the basis, because the yogin who is established in that attains the result.
['BO_T02_D1851-2:90a-9']	gsum gyis rgyud kyi don bsdus te /	gsum gyis rgyud kyi don bsdus te /	The meaning of the tantra is summarized in three ways.
['BO_T02_D1851-2:90a-10']	rgyu dang 'bras bu thabs kyi rgyud gsum nyid kyis rgyud kyi don ma lus par bsdus pa yin no //	rgyu dang 'bras bu thabs kyi rgyud gsum nyid kyis rgyud kyi don ma lus par bsdus pa yin no //	The meaning of the tantra is summarized in its entirety in the three tantras of cause, result, and method.
['BO_T02_D1851-2:90a-11']	thabs ni sngags dang phyag rgya la sogs pa'i dbye bas rgyun dang ldan pa'i phyir thabs kyi rgyud du rigs pa ma yin nam /	thabs ni sngags dang phyag rgya la sogs pa'i dbye bas rgyun dang ldan pa'i phyir thabs kyi rgyud du rigs pa ma yin nam /	Since the method is divided into mantra, mudra, and so on, is it not logical that it is a tantra of method?
['BO_T02_D1851-2:90a-12']	rgyu ni chos kyi dbyings nyid yin la de yang gcig nyid yin pa de ltar na /	rgyu ni chos kyi dbyings nyid yin la de yang gcig nyid yin pa de ltar na /	The cause is the dharmadhatu itself, and that is one.🔽Since there is no continuum, it is not logical that it is a tantra of cause.
['BO_T02_D1851-2:90a-13']	rgyun med pa'i phyir rgyu'i rgyud rigs pa ma yin la de nyid kyi phyir 'bras bu'i rgyud kyang rigs pa ma yin no zhe na /	rgyun med pa'i phyir rgyu'i rgyud rigs pa ma yin la de nyid kyi phyir 'bras bu'i rgyud kyang rigs pa ma yin no zhe na /	Since that is so, it is also not logical that it is a tantra of result.
['BO_T02_D1851-2:90a-14']	'dir rigs ni zhes bya ba la sogs pa gsungs pa la rigs kyi sgra ni thams cad la sbyar bar bya ste /	'dir rigs ni zhes bya ba la sogs pa gsungs pa la rigs kyi sgra ni thams cad la sbyar bar bya ste /	Here, the term “tantra” is applied to all, as stated in the following:
['BO_T02_D1851-2:90a-15']	rigs dang rus dang rgyud dang sa bon dang rgyud dang khams dang bla ma dang thog ma dang 'byung gnas dang rang bzhin zhes bya ba ni rnam grangs yin no //	rigs dang rus dang rgyud dang sa bon dang rgyud dang khams dang bla ma dang thog ma dang 'byung gnas dang rang bzhin zhes bya ba ni rnam grangs yin no //	“Tantra,” “family,” “lineage,” “seed,” “continuum,” “element,” “guru,” “beginning,” “source,” and “nature” are synonyms.
['BO_T02_D1851-2:90a-16']	rigs lnga ni gti mug dang zhe sdang dang nga rgyal dang 'dod chags dang phrag dog ces bya ba rigs lnga po dag go //	rigs lnga ni gti mug dang zhe sdang dang nga rgyal dang 'dod chags dang phrag dog ces bya ba rigs lnga po dag go //	The five families are the five families of delusion, hatred, pride, desire, and jealousy.
['BO_T02_D1851-2:90a-17']	rigs gsum dag ni gti mug dang zhe sdang dang 'dod chags zhes bya ba rigs gsum po dag go //	rigs gsum dag ni gti mug dang zhe sdang dang 'dod chags zhes bya ba rigs gsum po dag go //	The three lineages are called the lineages of delusion, hatred, and desire.
['BO_T02_D1851-2:90a-18']	ngo bo nyid gcig rigs ni rang bzhin ngo bo nyid de rang bzhin ro gcig tu 'jug pa de ni rigs gcig ces bya ba'i don to //	ngo bo nyid gcig rigs ni rang bzhin ngo bo nyid de rang bzhin ro gcig tu 'jug pa de ni rigs gcig ces bya ba'i don to //	The single nature is the lineage of the nature, which is the single taste of the nature. That is the meaning of the single lineage.
['BO_T02_D1851-2:90a-19']	rigs brgya zhes bya ba ni rigs mtha' yas pa yin te /	rigs brgya zhes bya ba ni rigs mtha' yas pa yin te /	The hundred lineages are the infinite lineages,
['BO_T02_D1851-2:90a-20']	sangs rgyas kyi chos rnams ni re re zhing rab tu mtha' yas pa nyid kyi phyir ro //	sangs rgyas kyi chos rnams ni re re zhing rab tu mtha' yas pa nyid kyi phyir ro //	because each of the qualities of a buddha is infinite.
['BO_T02_D1851-2:90a-21', 'BO_T02_D1851-2:90a-22']	rigs kyi rab tu dbye ba gsungs pa de ni zhes gsungs pa'o //🔽byang chub rdo rje ni rnam par dag pa'i mthar thug pa na byang chub kyang de yin la /	rigs kyi rab tu dbye ba gsungs pa de ni zhes gsungs pa'o // byang chub rdo rje ni rnam par dag pa'i mthar thug pa na byang chub kyang de yin la /	The statement of the division of the lineages is as follows.🔽Enlightenment-vajra is the ultimate purity, and it is enlightenment because it is the nature of the mind of enlightenment.
['BO_T02_D1851-2:90a-23']	byang chub kyi sems kyi rang bzhin nyid yin pa'i phyir rdo rje yang yin pas na byang chub dro rje ste de nyid ni chos kyi dbyings so //	byang chub kyi sems kyi rang bzhin nyid yin pa'i phyir rdo rje yang yin pas na byang chub dro rje ste de nyid ni chos kyi dbyings so //	Therefore, it is the vajra of enlightenment. That is the dharmadhatu.
['BO_T02_D1851-2:90b-0']	de ni khyad @90b par de dang bcas par gsungs pa ste /	de ni khyad @90b par de dang bcas par gsungs pa ste /	That is stated with that distinction.
['BO_T02_D1851-2:90b-1']	rigs lnga la sogs pa gsungs pa'o //	rigs lnga la sogs pa gsungs pa'o //	are taught.
['BO_T02_D1851-2:90b-2']	de'i phyir yang de ni bla ma'i rgyud du 'dod do //	de'i phyir yang de ni bla ma'i rgyud du 'dod do //	Therefore, it is also accepted as the Utterance of the Guru.
['BO_T02_D1851-2:90b-3']	de'i khyad par de dag bcas par gsungs pa de ni rgyu'i rgyun gyi rang bzhin can nyid yin pa'i phyir rgyud bla ma ste rgyu'i rgyud ces bya ba'i don to //	de'i khyad par de dag bcas par gsungs pa de ni rgyu'i rgyun gyi rang bzhin can nyid yin pa'i phyir rgyud bla ma ste rgyu'i rgyud ces bya ba'i don to //	Since it teaches the special qualities of that, it is the Utterance of the Guru, because it has the nature of the stream of the cause. The meaning of the word is the Utterance of the Cause.
['BO_T02_D1851-2:90b-4']	de skad du yang dpal mchog dang po la sogs pa las /	de skad du yang dpal mchog dang po la sogs pa las /	Thus, in the Shri-Paramodaya, etc., it is said:
['BO_T02_D1851-2:90b-5']	rgyud ni rgyun zhes bya bar bshad //	rgyud ni rgyun zhes bya bar bshad //	The stream is explained as the Utterance.
['BO_T02_D1851-2:90b-6']	bla ma nyid ni thog mar brjod //	bla ma nyid ni thog mar brjod //	The Guru is first mentioned.
['BO_T02_D1851-2:90b-7']	de nyid gsang ba gsang chen ni //	de nyid gsang ba gsang chen ni //	That very secret, the great secret,
['BO_T02_D1851-2:90b-8', 'BO_T02_D1851-2:90b-9']	bla ma'i rgyud ni yin par 'dod //🔽ces gsungs so //	bla ma'i rgyud ni yin par 'dod // ces gsungs so //	is accepted as the Utterance of the Guru.
['BO_T02_D1851-2:90b-10']	ji ltar 'phags pa'i rigs gcig la nyan thos la sogs pa'i dbye bas rnam pa gsum du byed par 'gyur ba de bzhin du byang chub sems dpa'i rigs gcig la rigs lnga la sogs pa'i dbye bas so //	ji ltar 'phags pa'i rigs gcig la nyan thos la sogs pa'i dbye bas rnam pa gsum du byed par 'gyur ba de bzhin du byang chub sems dpa'i rigs gcig la rigs lnga la sogs pa'i dbye bas so //	Just as the one lineage of the Aryas is made threefold by the divisions of the Sravakas, etc., so the one lineage of the Bodhisattvas is made fivefold, etc. by the divisions of the five families, etc.
['BO_T02_D1851-2:90b-11']	de skad du yang /	de skad du yang /	Thus it is said:
['BO_T02_D1851-2:90b-12']	chos kyi dbyings la dbyer med phyir //	chos kyi dbyings la dbyer med phyir //	Because there is no division in the Dharmadhatu,
['BO_T02_D1851-2:90b-13', 'BO_T02_D1851-2:90b-14']	rigs ni tha dad rung ma yin //🔽brten pa'i chos kyi bye brag gis //	rigs ni tha dad rung ma yin // brten pa'i chos kyi bye brag gis //	The families are not definitely fixed.🔽The divisions of the families
['BO_T02_D1851-2:90b-15', 'BO_T02_D1851-2:90b-16']	de yi dbye ba rab tu brjod //🔽ces gsungs so ;	de yi dbye ba rab tu brjod // ces gsungs so ;	are declared according to the distinctions of the supported doctrine.
['BO_T02_D1851-2:90b-17']	/ gti mug gtso bor gyur pa'i byang chub sems dpa'i chos rnams kyi gnas su gyur pa'i rigs ni gti mug gi rigs so //	/ gti mug gtso bor gyur pa'i byang chub sems dpa'i chos rnams kyi gnas su gyur pa'i rigs ni gti mug gi rigs so //	The family of the bodhisattva whose principal element is delusion is the family of delusion.
['BO_T02_D1851-2:90b-18']	zhe sdang gtso bor gyur pa rnams kyi ni zhe sdang gi rigs te /	zhe sdang gtso bor gyur pa rnams kyi ni zhe sdang gi rigs te /	The family of the bodhisattva whose principal element is hatred is the family of hatred.
['BO_T02_D1851-2:90b-19']	de bzhin du gzhan dag la yang sbyar bar bya'o //	de bzhin du gzhan dag la yang sbyar bar bya'o //	The same should be applied to the others.
['BO_T02_D1851-2:90b-20']	rgyu'i rgyud nyid rnam par dag pa'i mthar thug pa yang 'bras bu'i rgyud yin no zhes bya ba de yang mi rigs pa ma yin no //	rgyu'i rgyud nyid rnam par dag pa'i mthar thug pa yang 'bras bu'i rgyud yin no zhes bya ba de yang mi rigs pa ma yin no //	It is not unreasonable to say that the causal continuum itself, at the stage of its culmination in purification, is the resultant continuum.
['BO_T02_D1851-2:90b-21']	rgyud kyi don zhus nas rgyu'i rgyud kyang gsungs la /	rgyud kyi don zhus nas rgyu'i rgyud kyang gsungs la /	Having asked about the meaning of continuum, he also asks about the causal continuum.
['BO_T02_D1851-2:90b-22', 'BO_T02_D1851-2:90b-23']	de yang rigs lnga la sogs pa yin no zhes nges par mdzad nas tshigs su bcad pa nyis kyi de kho na nyid ni rnam pa du /🔽rigs kyi gsang ba ni rnam pa du /	de yang rigs lnga la sogs pa yin no zhes nges par mdzad nas tshigs su bcad pa nyis kyi de kho na nyid ni rnam pa du / rigs kyi gsang ba ni rnam pa du /	Having determined that the causal continuum is the five families, etc., he asks about the reality of the families, the secrets of the families, and the great secrets of the families.🔽How many kinds of reality are there?🔽How many kinds of secrets of the families are there?
['BO_T02_D1851-2:90b-24']	rigs kyi gsang chen ni gang lags /	rigs kyi gsang chen ni gang lags /	What is the great secret of the families?
['BO_T02_D1851-2:90b-25']	rigs kyi dam pa ni rnam pa du zhig mchis zhes 'dri ba'i zhu ba bzhi bo byas pa de la de nyid ces bya ba la sogs pa gsungs te /	rigs kyi dam pa ni rnam pa du zhig mchis zhes 'dri ba'i zhu ba bzhi bo byas pa de la de nyid ces bya ba la sogs pa gsungs te /	The reply to that is: “That itself, etc. ”
['BO_T02_D1851-2:90b-26']	de nyid rnam pa lnga gang yin pa de rgyud thams cad kyis bsdus pa phra ba nyid yin pa'i phyir ro //	de nyid rnam pa lnga gang yin pa de rgyud thams cad kyis bsdus pa phra ba nyid yin pa'i phyir ro //	That itself, which is fivefold, is subtle because it is included in all tantras.
['BO_T02_D1851-2:90b-27']	gsang ba rnam gsum ni de shin tu phra ba nyid yin pa'i phyir ro //	gsang ba rnam gsum ni de shin tu phra ba nyid yin pa'i phyir ro //	The three secrets are very subtle.
['BO_T02_D1851-2:90b-28']	lha rnams kyi bdag po lhag pa'i lha'i rang bzhin ni bcom ldan 'das so //	lha rnams kyi bdag po lhag pa'i lha'i rang bzhin ni bcom ldan 'das so //	The Lord of gods, the supreme god, is the Bhagavān.
['BO_T02_D1851-2:90b-29']	de ni gsang chen te shin tu rab tu phra ba nyid kyi phyir ro //	de ni gsang chen te shin tu rab tu phra ba nyid kyi phyir ro //	That is the great secret, because it is extremely subtle.
['BO_T02_D1851-2:90b-30']	rigs rnam pa brgya ni rigs kyi rang bzhin sna tshogs pa'o //	rigs rnam pa brgya ni rigs kyi rang bzhin sna tshogs pa'o //	The hundred kinds of lineages are the various natures of the lineages.
['BO_T02_D1851-2:90b-31']	de ni dam pa ste mtha' yas pa nyid kyi phyir ro //	de ni dam pa ste mtha' yas pa nyid kyi phyir ro //	That is the supreme, because it is infinite.
['BO_T02_D1851-2:91a-0']	de de ltar na dri ba'i zhu ba dgu po dang lan gyi @91a * //	de de ltar na dri ba'i zhu ba dgu po dang lan gyi @91a * //	Thus, the nine questions and the replies
['BO_T02_D1851-2:91a-1']	rnal 'byor gyi rgyud gsang ba 'dus pa yin no zhes bya ba'i spyi'i don yang dag par phye ba yin no //	rnal 'byor gyi rgyud gsang ba 'dus pa yin no zhes bya ba'i spyi'i don yang dag par phye ba yin no //	are the general meaning of the Guhyasamāja Yoga Tantra.
['BO_T02_D1851-2:91a-2']	gzhung gzhan ni yan lag gi don ji ltar sbas pa rnams rab tu dbye ba'i phyir ro //	gzhung gzhan ni yan lag gi don ji ltar sbas pa rnams rab tu dbye ba'i phyir ro //	The other texts are for the purpose of fully distinguishing the hidden meanings of the branches.
['BO_T02_D1851-2:91a-3', 'BO_T02_D1851-2:91a-4']	de la dang por le'u dang po la sbas pa'i tshig gi don rnams zhus pa ni /🔽byang chub sems zhes ci la bgyi //	de la dang por le'u dang po la sbas pa'i tshig gi don rnams zhus pa ni / byang chub sems zhes ci la bgyi //	Therein, first, the hidden meanings of the words in the first chapter are asked about,
['BO_T02_D1851-2:91a-5']	zhes bya ba la brtsams te /	zhes bya ba la brtsams te /	beginning with “What is called the thought of awakening?”
['BO_T02_D1851-2:91a-6']	de bzhin bighan'anta kri ta ci zhes bya ba'i bar du'o //	de bzhin bighan'anta kri ta ci zhes bya ba'i bar du'o //	and ending with “What is called the difficult to conquer?”
['BO_T02_D1851-2:91a-7']	de la byang chub kyi sems kyi don ni thog ma tha ma zhes bya ba la sogs pa gsungs te /	de la byang chub kyi sems kyi don ni thog ma tha ma zhes bya ba la sogs pa gsungs te /	Therein, the meaning of the thought of awakening is stated with “Without beginning or end,” and so on.
['BO_T02_D1851-2:91a-8']	thog ma ni skye ba yin la tha ma ni 'jig pa yin no //	thog ma ni skye ba yin la tha ma ni 'jig pa yin no //	The beginning is birth and the end is destruction.
['BO_T02_D1851-2:91a-9']	de dag med pa'i phyir thog ma dang tha ma med pa ste /	de dag med pa'i phyir thog ma dang tha ma med pa ste /	Because they do not exist, it is without beginning or end.
['BO_T02_D1851-2:91a-10']	chos kyi dbyings sems kyi rang bzhin yin la de nyid ni byang chub kyi sems yin no //	chos kyi dbyings sems kyi rang bzhin yin la de nyid ni byang chub kyi sems yin no //	The basic element of phenomena is the nature of mind, and that itself is the thought of awakening.
['BO_T02_D1851-2:91a-11']	de'i phyir rdo rje 'chang gi don gyis na thog ma dang tha ma med pa'o //	de'i phyir rdo rje 'chang gi don gyis na thog ma dang tha ma med pa'o //	Therefore, because of the meaning of Vajradhara, it is without beginning or end.
['BO_T02_D1851-2:91a-12']	sems la ma gtogs pa'i don du rtog pa thams cad nye bar zhi ba'i phyir rnam par snang mdzad kyi don gyis na zhi ba'o //	sems la ma gtogs pa'i don du rtog pa thams cad nye bar zhi ba'i phyir rnam par snang mdzad kyi don gyis na zhi ba'o //	It is peace, in the sense of Vairocana, because all conceptual thoughts are completely pacified, except for the mind.
['BO_T02_D1851-2:91a-13']	chos dang chos nyid kyi rgyu mtshan rnams nub pa'i phyir mi bskyod pa'i don gyis dngos dang dngos min zad pa'o //	chos dang chos nyid kyi rgyu mtshan rnams nub pa'i phyir mi bskyod pa'i don gyis dngos dang dngos min zad pa'o //	It is the exhaustion of entity and non-entity, in the sense of Akṣobhya, because the signs of phenomena and reality have subsided.
['BO_T02_D1851-2:91a-14']	chos kyi dbyings tsam gyi bdag nyid dang sangs rgyas thams cad dbyer med par mthong ba'i phyir rin chen 'byung ldan gyi don gyis na khyab bdag ste thams cad du 'gro ba'o //	chos kyi dbyings tsam gyi bdag nyid dang sangs rgyas thams cad dbyer med par mthong ba'i phyir rin chen 'byung ldan gyi don gyis na khyab bdag ste thams cad du 'gro ba'o //	It is the all-pervading lord, in the sense of Ratnasaṃbhava, because it is the nature of the mere expanse of reality and is seen as inseparable from all buddhas.
['BO_T02_D1851-2:91a-15']	mtshan gzhi dang mtshan nyid la dga' ba rnams rnam pa thams cad du stong pa nyid du yongs su gcod pa'i phyir 'od dpag tu med pa'i don gyis na stong pa nyid mi phyed pa'o //	mtshan gzhi dang mtshan nyid la dga' ba rnams rnam pa thams cad du stong pa nyid du yongs su gcod pa'i phyir 'od dpag tu med pa'i don gyis na stong pa nyid mi phyed pa'o //	It is indivisible emptiness, in the sense of Amitābha, because it is the complete determination of emptiness in every way for those who delight in the basis of characteristics and characteristics.
['BO_T02_D1851-2:91a-16']	sna tshogs kyi don mdzad pa'i phyir don yod par grub pa'i don gyis na snying rje mi phyed pa'o //	sna tshogs kyi don mdzad pa'i phyir don yod par grub pa'i don gyis na snying rje mi phyed pa'o //	It is indivisible compassion, in the sense of Amoghasiddhi, because it performs various benefits.
['BO_T02_D1851-2:91a-17']	byang chub kyi sems kyi don 'di yang le'u dang por sangs rgyas lnga rnams chos nyid dang lhan cig thugs kar zhugs pa dang de zhu ba dang dkyil 'khor du zhu ba dang / longs spyod pa po dang / longs spyod par bya ba dang /	byang chub kyi sems kyi don 'di yang le'u dang por sangs rgyas lnga rnams chos nyid dang lhan cig thugs kar zhugs pa dang de zhu ba dang dkyil 'khor du zhu ba dang / longs spyod pa po dang / longs spyod par bya ba dang /	This meaning of the Thought of Enlightenment should be understood as follows: In the first chapter, the five Buddhas enter into the reality along with the mind, and that melting, and the melting in the mandala, and the enjoyer, and the enjoyed, and
['BO_T02_D1851-2:91a-18']	longs spyod zhu ba dang 'od zer spros pas sna tshogs dbang bskur bar shes par bya'o //	longs spyod zhu ba dang 'od zer spros pas sna tshogs dbang bskur bar shes par bya'o //	the melting of the enjoyment, and the emission of light rays, and the various initiations.
['BO_T02_D1851-2:91a-19']	byang chub kyi sems de nyid las rig pa'i skyes bu 'byung bar gsungs pa yin no //	byang chub kyi sems de nyid las rig pa'i skyes bu 'byung bar gsungs pa yin no //	It is said that the Person of Awareness arises from that very Thought of Enlightenment.
['BO_T02_D1851-2:91a-20']	de'i phyir de zhus pa'i de ma thag tu lan sku zhes bya ba la sogs pa gsungs so //	de'i phyir de zhus pa'i de ma thag tu lan sku zhes bya ba la sogs pa gsungs so //	Therefore, immediately after that question, the answer is stated, “The Body, etc.”
['BO_T02_D1851-2:91a-21']	tshigs bcad phyed phyi mas ni nges tshig bstan te /	tshigs bcad phyed phyi mas ni nges tshig bstan te /	The latter half of the verse teaches the derivation of the term.
['BO_T02_D1851-2:91a-22']	lhan cig ces pa ni gsum pa'o //	lhan cig ces pa ni gsum pa'o //	“Together” is the third.
['BO_T02_D1851-2:91b-0']	rig par ldan pa zhes pa @91b ni don gyis na skyes bu la bya'o //	rig par ldan pa zhes pa @91b ni don gyis na skyes bu la bya'o //	“Endowed with Awareness” is to be understood by implication as referring to the Person.
['BO_T02_D1851-2:91b-1']	rig pa dang lhan cig pa'i skyes bu ni rig pa'i skyes bu ste /	rig pa dang lhan cig pa'i skyes bu ni rig pa'i skyes bu ste /	The Person who is together with Awareness is the Person of Awareness.
['BO_T02_D1851-2:91b-2']	bar gyi tshig mi mngon pa'o //	bar gyi tshig mi mngon pa'o //	The middle word is elided.
['BO_T02_D1851-2:91b-3']	phyed snga ma ni 'di'i rig pa ste /	phyed snga ma ni 'di'i rig pa ste /	The first half is its knowledge,
['BO_T02_D1851-2:91b-4']	mi phyed pa ni 'dir byang chub kyi sems su thams cad zhu bar gyur pa gang yin pa'o //	mi phyed pa ni 'dir byang chub kyi sems su thams cad zhu bar gyur pa gang yin pa'o //	and the indivisible is that which is all melted into the enlightenment spirit here.
['BO_T02_D1851-2:91b-5']	gang gis mi phyed ce na /	gang gis mi phyed ce na /	By what is it indivisible?
['BO_T02_D1851-2:91b-6']	sku gsung thugs kyi rdo rje yis te /	sku gsung thugs kyi rdo rje yis te /	By the vajra of body, speech, and mind.
['BO_T02_D1851-2:91b-7']	rdo rje ni de bzhin nyid do //	rdo rje ni de bzhin nyid do //	Vajra is thusness.
['BO_T02_D1851-2:91b-8']	sangs rgyas rnams kyi sku gsungs thugs dang de bzhin nyid ces zlas phye la zhu bar mi phyed pa'o zhes bsdu ba'o //	sangs rgyas rnams kyi sku gsungs thugs dang de bzhin nyid ces zlas phye la zhu bar mi phyed pa'o zhes bsdu ba'o //	The analysis of the Buddha’s body, speech, and mind and of thusness is indivisible in the melting.
['BO_T02_D1851-2:91b-9']	phye ba'i ngo bos zhes pa ni de dag nyid phye ba'i rigs pas rig pa dang skyes bur phye bas te /	phye ba'i ngo bos zhes pa ni de dag nyid phye ba'i rigs pas rig pa dang skyes bur phye bas te /	The analysis of the nature is by the analysis of those very things by the reasoning of analysis into knowledge and person.
['BO_T02_D1851-2:91b-10']	sangs rgyas rnams kyis de bzhin nyid ni rig pa ste /	sangs rgyas rnams kyis de bzhin nyid ni rig pa ste /	The thusness of the Buddhas is knowledge.
['BO_T02_D1851-2:91b-11']	de yang rig bya'i cha'o //	de yang rig bya'i cha'o //	And that is the portion to be known.
['BO_T02_D1851-2:91b-12']	rig pa po'i cha ni skyes bu'o //	rig pa po'i cha ni skyes bu'o //	The portion of the knower is the person.
['BO_T02_D1851-2:91b-13']	de sku gsungs thugs phye ba las ni gnyi ga'i zhal gsum mo //	de sku gsungs thugs phye ba las ni gnyi ga'i zhal gsum mo //	From the analysis of body, speech, and mind, there are the three faces of both.
['BO_T02_D1851-2:91b-14']	mi phyed par ni don dam par te des na de dang ldan pa'o //	mi phyed par ni don dam par te des na de dang ldan pa'o //	Indivisibly is ultimately, and thus it is endowed with that.
['BO_T02_D1851-2:91b-15']	rig pa'i skyes bu de nyid kyis dkyil 'khor phyung ba yin no //	rig pa'i skyes bu de nyid kyis dkyil 'khor phyung ba yin no //	The person of knowledge himself has extracted the mandala.
['BO_T02_D1851-2:91b-16']	de la sngags bcu gsum dang rigs lnga btsun mo'i phun sum tshogs pa zhes bya ba'i sdom pa gnyis kyi dbang du mdzad nas 'dri ba'i zhu ba nyi shu rtsa drug byas pa yin no //	de la sngags bcu gsum dang rigs lnga btsun mo'i phun sum tshogs pa zhes bya ba'i sdom pa gnyis kyi dbang du mdzad nas 'dri ba'i zhu ba nyi shu rtsa drug byas pa yin no //	With respect to that, having taken up the two vows called the thirteen mantras and the perfection of the five families' queens, the twenty-six questions are asked.
['BO_T02_D1851-2:91b-17']	de la ci zhes bya ba'i sgra bco lnga ni 'dri ba bco lnga dang / rigs 'dir de bzhin gang zhig lags //	de la ci zhes bya ba'i sgra bco lnga ni 'dri ba bco lnga dang / rigs 'dir de bzhin gang zhig lags //	Therein, the fifteen words what are the fifteen questions, and what is that in this family?
['BO_T02_D1851-2:91b-18']	zhes bya ba gcig nyid kyis bcu gcig go //	zhes bya ba gcig nyid kyis bcu gcig go //	is one, making sixteen.
['BO_T02_D1851-2:91b-19']	rigs zhes bya ba la sogs pa'i sgras sdom gyi tshigs su bcad pa la gang zhig lags zhes pa ni thun mong du sgra gcig yin gyi bye brag tu na bcu gcig go //	rigs zhes bya ba la sogs pa'i sgras sdom gyi tshigs su bcad pa la gang zhig lags zhes pa ni thun mong du sgra gcig yin gyi bye brag tu na bcu gcig go //	Family and so on are the words of the summary verse. What is that? is a single word in common, but if distinguished, there are eleven.
['BO_T02_D1851-2:91b-20']	don gyi rigs ni ci /	don gyi rigs ni ci /	What is the meaning of family?
['BO_T02_D1851-2:91b-21']	zhe sdang ni gang /	zhe sdang ni gang /	What is hatred?
['BO_T02_D1851-2:91b-22']	gti mug ni gang /	gti mug ni gang /	What is ignorance?
['BO_T02_D1851-2:91b-23']	'dod chags ni gang /	'dod chags ni gang /	What is desire?
['BO_T02_D1851-2:91b-24']	yid bzhin gyi nor bu ni gang /	yid bzhin gyi nor bu ni gang /	What is the wish-fulfilling gem?
['BO_T02_D1851-2:91b-25']	dam tshig ces pa ni gang /	dam tshig ces pa ni gang /	What is the vow?
['BO_T02_D1851-2:91b-26']	nga rgyal ni gang /	nga rgyal ni gang /	What is pride?
['BO_T02_D1851-2:91b-27']	dregs pa'i don ni gang /	dregs pa'i don ni gang /	What is the meaning of “arrogance”?
['BO_T02_D1851-2:91b-28']	phrag dog ni gang /	phrag dog ni gang /	What is “envy”?
['BO_T02_D1851-2:91b-29']	thar pa ni gang /	thar pa ni gang /	What is “liberation”?
['BO_T02_D1851-2:91b-30']	'dod pa ni gang zhes bya ba 'di yin no //	'dod pa ni gang zhes bya ba 'di yin no //	What is “desire”?
