segmentnr	original	analyzed	translated
['BO_T03_D3805:1b-0']	@1b # // rgya gar skad du /	@1b # // rgya gar skad du /	In Sanskrit:
['BO_T03_D3805:1b-1']	a'arya aashta sa ha sri ka pradzny'a p'a ra mi t'a ma rma koo mi ta n'a ma /	a'arya aashta sa ha sri ka pradzny'a p'a ra mi t'a ma rma koo mi ta n'a ma /	Arya-Astasahasrika-prajnaparamita-marma-komayati-nama
['BO_T03_D3805:1b-2']	bod skad du /	bod skad du /	In Tibetan:
['BO_T03_D3805:1b-3']	'phags pa shes rab kyi pha rol tu phyin pa brgyad stong pa'i 'grel pa gnad kyi zla ba'i 'od ces bya ba /	'phags pa shes rab kyi pha rol tu phyin pa brgyad stong pa'i 'grel pa gnad kyi zla ba'i 'od ces bya ba /	The Commentary on the Perfection of Wisdom in Eight Thousand Lines called the Light of the Moon of Essential Points
['BO_T03_D3805:1b-4']	bcom ldan 'das mi pham mgon po la phyag 'tshal lo //	bcom ldan 'das mi pham mgon po la phyag 'tshal lo //	Homage to the Blessed, Invincible Protector.
['BO_T03_D3805:1b-5']	gang zhig 'od zer snying gi mun las rgyal nas spros med lnga po phung por gyur pa ste //	gang zhig 'od zer snying gi mun las rgyal nas spros med lnga po phung por gyur pa ste //	He who, having conquered the darkness of the heart with light rays, became the aggregate of the five unelaborate ones,
['BO_T03_D3805:1b-6']	gang la shar na sems kyi rtog pa'i rnyog pa bsal bar gyur nas sa la longs spyod pa //	gang la shar na sems kyi rtog pa'i rnyog pa bsal bar gyur nas sa la longs spyod pa //	When he arose, having cleared away the turbidity of mental concepts and enjoyed the earth,
['BO_T03_D3805:1b-7']	de yis rdzogs pa'i byang chub bde ba 'gro la bskyed phyir bsam mi khyab pa'i sku sprul pa'i //	de yis rdzogs pa'i byang chub bde ba 'gro la bskyed phyir bsam mi khyab pa'i sku sprul pa'i //	He emanated an inconceivable body in order to generate the bliss of perfect enlightenment in beings.
['BO_T03_D3805:1b-8']	shes rab pha rol phyin pa srid par 'khyams pa 'jig byed de la gus par phyag 'tshal nas //	shes rab pha rol phyin pa srid par 'khyams pa 'jig byed de la gus par phyag 'tshal nas //	I respectfully pay homage to the Perfection of Wisdom, the destroyer of wandering in existence,
['BO_T03_D3805:1b-9']	yid kyi dri ma bshig cing lta ba ngan pa 'joms byed la //	yid kyi dri ma bshig cing lta ba ngan pa 'joms byed la //	Destroying mental stains and conquering wrong views,
['BO_T03_D3805:1b-10']	skye ba'i rnyog pa'i yal ga ma lus nges par drung 'byin la //	skye ba'i rnyog pa'i yal ga ma lus nges par drung 'byin la //	And uproot the branches of the mire of birth.
['BO_T03_D3805:1b-11']	che mchog rtog med rdzogs sangs sa na gnyis med lam gnyen gyi //	che mchog rtog med rdzogs sangs sa na gnyis med lam gnyen gyi //	The supreme great one, the perfect Buddha, on the path of non-conceptuality,
['BO_T03_D3805:1b-12']	'od zer brtse bas brlan char ji lta bur na ston pa yi //	'od zer brtse bas brlan char ji lta bur na ston pa yi //	With the rain of loving rays, how can he not teach?
['BO_T03_D3805:1b-13']	gang yang 'phags pa mi pham bstan bcos de nyid bral ba'i gzhung gis kun tu tshim min pas //	gang yang 'phags pa mi pham bstan bcos de nyid bral ba'i gzhung gis kun tu tshim min pas //	Those who are not satisfied by the treatise of the noble Ajita, which is free from suchness,
['BO_T03_D3805:2a-0', 'BO_T03_D3805:2a-1']	@2a * // yum gyi gnad las phyir phyogs log pa'i lam gyis skye bo phal che yun rings 'khyams gyur pas //🔽de phyir nang gi mun pas khyab pa'i rgyun gyis 'phrog byed bstan bcos snying po la reg pa'i //	@2a * // yum gyi gnad las phyir phyogs log pa'i lam gyis skye bo phal che yun rings 'khyams gyur pas // de phyir nang gi mun pas khyab pa'i rgyun gyis 'phrog byed bstan bcos snying po la reg pa'i //	The great beings who have turned away from the vital points of the mother, wander for a long time on the wrong path.🔽Therefore, I, who have reached the essence of the treatise that removes the darkness of the inner continuum,
['BO_T03_D3805:2a-2']	legs gsungs sbyangs pa'i bdud rtsi'i gter ldan bdag gis de gnad yang dag gsal byed zla 'od spro //	legs gsungs sbyangs pa'i bdud rtsi'i gter ldan bdag gis de gnad yang dag gsal byed zla 'od spro //	Will spread the moonlight that illuminates the vital points of the well-spoken nectar treasure of training.
['BO_T03_D3805:2a-3']	'dir nges par bcom ldan 'das kyis bskal pa rab 'byam mang po dpag tu med cing rnam pa sna tshogs pa'i byang chub sems dpa'i spyod pa phan tshun du spyod pa rnams dang / shes rab kyi pha rol tu phyin pa bsgoms pa dag gis kun tu rtog pa'i dra ba mtha' dag skye ba'i rgyun drungs phyung nas mu med pa'i phyogs thams cad kyi khams gsum pa rnams kyi srog chags dpag tu med pa rnams kyi so so'i sems skad cig	'dir nges par bcom ldan 'das kyis bskal pa rab 'byam mang po dpag tu med cing rnam pa sna tshogs pa'i byang chub sems dpa'i spyod pa phan tshun du spyod pa rnams dang / shes rab kyi pha rol tu phyin pa bsgoms pa dag gis kun tu rtog pa'i dra ba mtha' dag skye ba'i rgyun drungs phyung nas mu med pa'i phyogs thams cad kyi khams gsum pa rnams kyi srog chags dpag tu med pa rnams kyi so so'i sems skad cig	saw the individual minds of countless sentient beings in all the limitless directions of the three realms.
['BO_T03_D3805:2a-4']	la gzigs nas mchog tu brtse ba chen po'i gzhan gyi dbang gi ji lta ba bzhin rtogs pa de nyid bcom ldan 'das kyis sems can gyis rtogs par bzhed nas bstan pa ji lta ba de lta bur sdud pa pos bsdus pa ni /	la gzigs nas mchog tu brtse ba chen po'i gzhan gyi dbang gi ji lta ba bzhin rtogs pa de nyid bcom ldan 'das kyis sems can gyis rtogs par bzhed nas bstan pa ji lta ba de lta bur sdud pa pos bsdus pa ni /	The Bhagavān, wishing for sentient beings to realize that which is realized through the power of supreme great compassion, taught it. The compiler compiled it in that way.
['BO_T03_D3805:2b-0']	'di skad bdag gis thos zhes bya ba la sogs pa dang / mngon par bstod do zhes bya ba'i bar gyis te 'di nyid du zhes pa la sogs pa dang / de la bcom ldan 'das kyis bka' stsal pa zhes pa la sogs pa ni sdud pa po'i rang bzo ma yin pas bcom ldan 'das kyi @2b bka' nyid du bshed de /	'di skad bdag gis thos zhes bya ba la sogs pa dang / mngon par bstod do zhes bya ba'i bar gyis te 'di nyid du zhes pa la sogs pa dang / de la bcom ldan 'das kyis bka' stsal pa zhes pa la sogs pa ni sdud pa po'i rang bzo ma yin pas bcom ldan 'das kyi @2b bka' nyid du bshed de /	The passage beginning Thus have I heard and ending with I praise is not the invention of the compiler, but is the word of the Bhagavat himself, as is shown by the passage beginning right here and ending with the Bhagavat said.
['BO_T03_D3805:2b-1']	chos yang dag par sdud pa'i mdo las gsungs pa /	chos yang dag par sdud pa'i mdo las gsungs pa /	The Dharmasamgiti-sutra says,
['BO_T03_D3805:2b-2']	'di skad bdag gis thos zhes byas nas chos bsdu bar bya'o //	'di skad bdag gis thos zhes byas nas chos bsdu bar bya'o //	Having said Thus have I heard, one should collect the Dharma.
['BO_T03_D3805:2b-3']	de bzhin du 'bral ba dang go rims kyis bshad do zhes pa la sogs pa ste //	de bzhin du 'bral ba dang go rims kyis bshad do zhes pa la sogs pa ste //	Similarly, it is explained by the order of the words separation and so on.
['BO_T03_D3805:2b-4']	'di sdud pa po ni lcang lo can na bzhugs pa'i byang chub sems dpa' chen pos bcu'i dbang phyug phyag na rdo rje ste /	'di sdud pa po ni lcang lo can na bzhugs pa'i byang chub sems dpa' chen pos bcu'i dbang phyug phyag na rdo rje ste /	The compiler is the great bodhisattva Vajrapani, lord of the tenth stage, who resides in the Alakavati paradise.
['BO_T03_D3805:2b-5']	de yang bskal pa bzang po'i de bzhin gshegs pa rnams kyi gzugs kyi sku dang chos kyi sku srung bar dbang bskur nas rting la rjes su gshegs zhes de bzhin gshegs pa'i gsang ba bstan pa'i mdo las bshad pa dang / phyag na rdo rje dbang bskur ba'i mdo las bstan pa so sor gtad pas so //	de yang bskal pa bzang po'i de bzhin gshegs pa rnams kyi gzugs kyi sku dang chos kyi sku srung bar dbang bskur nas rting la rjes su gshegs zhes de bzhin gshegs pa'i gsang ba bstan pa'i mdo las bshad pa dang / phyag na rdo rje dbang bskur ba'i mdo las bstan pa so sor gtad pas so //	And it is explained in the Vajrapāṇi Abhisaṃbodhi Sūtra that the Tathāgatas entrust the teachings to the bodhisattvas.
['BO_T03_D3805:2b-6']	gang yang 'phags pa kun dga' bo la yongs su gtad pa de ni nyan thos rnams kyis kyang 'jig rten pa la spyod par byed pa'i don du yin gyi //	gang yang 'phags pa kun dga' bo la yongs su gtad pa de ni nyan thos rnams kyis kyang 'jig rten pa la spyod par byed pa'i don du yin gyi //	As for the entrustment to Ārya Ānanda, that was for the purpose of the hearers engaging in worldly conduct.
['BO_T03_D3805:2b-7']	chos sdud pa'i don du ni ma yin no //	chos sdud pa'i don du ni ma yin no //	It was not for the purpose of gathering the teachings.
['BO_T03_D3805:2b-8']	'dir bcom ldan 'das kyis yongs su mya ngan las 'das pa bstan pa dang / 'phags pa phyag na rdo rjes 'jig rten thams cad rjes su gzung ba'i phyir shes rab kyi pha rol tu phyin pa bsdu bar 'dod nas /	'dir bcom ldan 'das kyis yongs su mya ngan las 'das pa bstan pa dang / 'phags pa phyag na rdo rjes 'jig rten thams cad rjes su gzung ba'i phyir shes rab kyi pha rol tu phyin pa bsdu bar 'dod nas /	Here, the Bhagavān taught final nirvāṇa, and Ārya Vajrapāṇi, desiring to gather the perfection of wisdom in order to care for all worlds,
['BO_T03_D3805:2b-9']	'phags pa byams pa la sogs pa'i byang chub sems dpa' sems dpa' chen po'i tshogs rnams la 'di skad ces pa la sogs pa gsungs te /	'phags pa byams pa la sogs pa'i byang chub sems dpa' sems dpa' chen po'i tshogs rnams la 'di skad ces pa la sogs pa gsungs te /	To the assembly of bodhisattva mahāsattvas such as the noble Maitreya, he said, Thus have I heard, and so on.
['BO_T03_D3805:2b-10']	ji lta ba bzhin du ston pa po las thos pa cig kyang rjes su brjod cing de bzhin du yang las gzhan yang nyan par byed do zhes pa ni sdud pa por brjod do //	ji lta ba bzhin du ston pa po las thos pa cig kyang rjes su brjod cing de bzhin du yang las gzhan yang nyan par byed do zhes pa ni sdud pa por brjod do //	Having heard it from the teacher just as it is, he also repeats it and listens to it in the same way. This is stated as the compiler.
['BO_T03_D3805:2b-11']	bsdus pa'i rjes la dus der gnas pa nyid na /	bsdus pa'i rjes la dus der gnas pa nyid na /	After the compilation, at that time, he abides in the essence of the Dharma.
['BO_T03_D3805:2b-12']	mchog tu zab cing rjes su rtogs par dka' la rtogs par mi nus zhes pas thugs rjes de rtogs pa'i don du 'phags pa byams pas mngon par rtogs pa'i rgyan gyi tshig le 'ur byas pa'i bstan bcos kyis gsal bar mdzad kyi /	mchog tu zab cing rjes su rtogs par dka' la rtogs par mi nus zhes pas thugs rjes de rtogs pa'i don du 'phags pa byams pas mngon par rtogs pa'i rgyan gyi tshig le 'ur byas pa'i bstan bcos kyis gsal bar mdzad kyi /	Supremely profound, difficult to realize, and impossible to comprehend - with compassion, in order to realize that, the noble Maitreya clarified it with the treatise composed in verses of the Ornament of Clear Realization.
['BO_T03_D3805:2b-13']	'phags pa thogs med kyis byas nas dus phyis byas zhes pa ni seng ge bzang po la sogs pa rnams kyi 'khrul pa ste /	'phags pa thogs med kyis byas nas dus phyis byas zhes pa ni seng ge bzang po la sogs pa rnams kyi 'khrul pa ste /	It is a mistake for Haribhadra and others to say, Having been composed by the noble Asanga, it was composed later.
['BO_T03_D3805:2b-14']	sngon du byas pa la ma bshad ces pa ni gzhan dag gi'o //	sngon du byas pa la ma bshad ces pa ni gzhan dag gi'o //	The phrase “not explained previously” refers to the other commentaries.
['BO_T03_D3805:2b-15']	de la shes rab kyi pha rol tu phyin pa bcom ldan 'das kyis rnam par 'byed par 'dod nas /	de la shes rab kyi pha rol tu phyin pa bcom ldan 'das kyis rnam par 'byed par 'dod nas /	The Bhagavān, wishing to analyze the perfection of wisdom,
['BO_T03_D3805:3a-0']	mchog tu bla ma rnams kyi yang bla na med pa ni bla ma yin pa'i phyir dang / rab tu dang bas phyag 'tshal ba shin tu don che ba'i phyir dang / rnam par bshad par bya ba'i mdo sde rin po che brjod @3a * //	mchog tu bla ma rnams kyi yang bla na med pa ni bla ma yin pa'i phyir dang / rab tu dang bas phyag 'tshal ba shin tu don che ba'i phyir dang / rnam par bshad par bya ba'i mdo sde rin po che brjod @3a * //	first paid homage to the guru of the gurus, the unsurpassed guru, because he is the guru, and because the homage of one who has faith is of great significance, and because he is the one who should speak the precious sūtra that is to be explained.
['BO_T03_D3805:3a-1']	par bya ba'i phyir na de nyid la dang po phyag 'tshal ba ni /	par bya ba'i phyir na de nyid la dang po phyag 'tshal ba ni /	The homage is as follows:🔽The one who guides those śrāvakas who seek peace through complete knowledge,
['BO_T03_D3805:3a-2']	nyan thos zhi ba tshol rnams kun shes nyid kyis nyer zhir khrid mdzad gang yin dang // 'gro la phan par byed rnams lam shes nyid kyis 'jig rten don sgrub mdzad pa gang //	nyan thos zhi ba tshol rnams kun shes nyid kyis nyer zhir khrid mdzad gang yin dang // 'gro la phan par byed rnams lam shes nyid kyis 'jig rten don sgrub mdzad pa gang //	and the one who accomplishes the aims of the world through path knowledge for those who benefit beings,
['BO_T03_D3805:3a-3']	gang dang yang dag ldan pas thub rnams sna tshogs rnam pa 'di dag kun gsung ba'i //	gang dang yang dag ldan pas thub rnams sna tshogs rnam pa 'di dag kun gsung ba'i //	the one endowed with which the sages speak all these various aspects,
['BO_T03_D3805:3a-4']	nyan thos byang chub sems dpa'i tshogs bcas sangs rgyas kyi yum de la phyag 'tshal lo //	nyan thos byang chub sems dpa'i tshogs bcas sangs rgyas kyi yum de la phyag 'tshal lo //	I pay homage to that mother of the buddhas, together with the hosts of śrāvakas and bodhisattvas.
['BO_T03_D3805:3a-5']	ci ste nye bar zhi ba ni mya ngan las 'das pa ste /	ci ste nye bar zhi ba ni mya ngan las 'das pa ste /	If one asks why, it is because nirvāṇa is peace.
['BO_T03_D3805:3a-6']	thar bar 'tshal ba'i nyan thos rnams dang rang sangs rgyas rnams kyang bsdu ste /	thar bar 'tshal ba'i nyan thos rnams dang rang sangs rgyas rnams kyang bsdu ste /	The śrāvakas and pratyekabuddhas who seek liberation are included,
['BO_T03_D3805:3a-7']	de dag gi theg pa las khyad par chung ba'i phyir na rim pa gcig tu bstan pa'i phyir ro //	de dag gi theg pa las khyad par chung ba'i phyir na rim pa gcig tu bstan pa'i phyir ro //	because their vehicles are of little distinction, and they are taught in one sequence.
['BO_T03_D3805:3a-8']	'gro la phan par byed pa nyid ni byang chub sems dpa' rnams kyi'o //	'gro la phan par byed pa nyid ni byang chub sems dpa' rnams kyi'o //	The benefit of beings is the bodhisattvas’.
['BO_T03_D3805:3a-9']	rnam pa 'di dag sna tshogs zhes pa ni thub pa'i rnam pa thams cad kyi chos so //	rnam pa 'di dag sna tshogs zhes pa ni thub pa'i rnam pa thams cad kyi chos so //	These various aspects are the dharmas of the Sage in all their aspects.
['BO_T03_D3805:3a-10']	gang dang ldan pas rnam pa 'di dag kun gsung zhes pa 'dis ni rnam pa thams cad mkhyen pa nyid kyi ngo bo shes rab kyi pha rol tu phyin par gsal bar byas la /	gang dang ldan pas rnam pa 'di dag kun gsung zhes pa 'dis ni rnam pa thams cad mkhyen pa nyid kyi ngo bo shes rab kyi pha rol tu phyin par gsal bar byas la /	By this statement, “Endowed with which, he speaks of all these aspects,” the perfection of wisdom, which is the essence of omniscience, is clarified.
['BO_T03_D3805:3a-11']	shes rab kyi pha rol tu phyin pa nyid ni rnam pa gsum ste /	shes rab kyi pha rol tu phyin pa nyid ni rnam pa gsum ste /	The perfection of wisdom itself is threefold:
['BO_T03_D3805:3a-12']	gang phung po lnga rnams mi rtag par rnam par shes pa'i slob ma dang bse ru dag dang / gang yang slob ma dang bse ru de rnams kyi dang / byang chub sems dpa'i lam gyi rnam pa rnams shes pa'i byang chub sems dpa' rnams dang /	gang phung po lnga rnams mi rtag par rnam par shes pa'i slob ma dang bse ru dag dang / gang yang slob ma dang bse ru de rnams kyi dang / byang chub sems dpa'i lam gyi rnam pa rnams shes pa'i byang chub sems dpa' rnams dang /	The disciples and rhinoceroses who know that the five aggregates are impermanent, and also the disciples and rhinoceroses, and the bodhisattvas who know the aspects of the bodhisattva path,
['BO_T03_D3805:3a-13']	gang yang de rnams kyis rtogs pa'i rnam pa de rnams mkhyen pa'i rnam pa thams cad mkhyen pa nyid ni sangs rgyas rnams te /	gang yang de rnams kyis rtogs pa'i rnam pa de rnams mkhyen pa'i rnam pa thams cad mkhyen pa nyid ni sangs rgyas rnams te /	and also the knowledge of the aspects that they realize, the knowledge of all aspects, is the buddhas.
['BO_T03_D3805:3a-14']	de'i shes rab kyi pha rol tu phyin pa la'o //	de'i shes rab kyi pha rol tu phyin pa la'o //	It is in their perfection of wisdom.
['BO_T03_D3805:3a-15']	sangs rgyas kyi zhes pa ni bskyed pa nyid la gcig pa'i tshig go //	sangs rgyas kyi zhes pa ni bskyed pa nyid la gcig pa'i tshig go //	The buddhas, who are the producers, are the single entity.
['BO_T03_D3805:3a-16']	nyan thos dang byang chub sems dpa'i tshogs dang bcas pa'i sangs rgyas rnams kyi yum ste /	nyan thos dang byang chub sems dpa'i tshogs dang bcas pa'i sangs rgyas rnams kyi yum ste /	The buddhas together with the assemblies of disciples and bodhisattvas are the mothers,
['BO_T03_D3805:3a-17']	ji skad du bshad pa'i don chen po thob par byed pas so //	ji skad du bshad pa'i don chen po thob par byed pas so //	because they cause the attainment of the great meaning that is explained.
['BO_T03_D3805:3a-18']	de thob nas kyang zag pa med pa'i phung po lnga'i bdag nyid can du bdag gis dngos po bskyed pa dang rgyas par byed do //	de thob nas kyang zag pa med pa'i phung po lnga'i bdag nyid can du bdag gis dngos po bskyed pa dang rgyas par byed do //	Having attained that, I generate and expand the entities that have the nature of the five undefiled aggregates.
['BO_T03_D3805:3a-19']	de bas na yul 'dzin pa por rtogs par bya'o //	de bas na yul 'dzin pa por rtogs par bya'o //	Therefore, it should be understood as the apprehender of objects.
['BO_T03_D3805:3a-20']	de ltar kun mkhyen pa gsum gyis mngon par rtogs pa gzhan lnga po rnams bsdus pa'i brgyad car gyi shes rab kyi pha rol tu phyin pa lnga yang zhes bya ste /	de ltar kun mkhyen pa gsum gyis mngon par rtogs pa gzhan lnga po rnams bsdus pa'i brgyad car gyi shes rab kyi pha rol tu phyin pa lnga yang zhes bya ste /	Thus, the five other realizations are included in the three omnisciences. The perfection of wisdom of all eight is called the five.
['BO_T03_D3805:3b-0']	de nyid chung ngu dang 'bring dang chen @3b po'i rtogs pa pa'i dbye ba la dgongs nas /	de nyid chung ngu dang 'bring dang chen @3b po'i rtogs pa pa'i dbye ba la dgongs nas /	With the intention of dividing them into small, medium, and great realizations,
['BO_T03_D3805:3b-1']	kun mkhyen pa gsum gyi sgo nas phyag 'tshal nas /	kun mkhyen pa gsum gyi sgo nas phyag 'tshal nas /	having paid homage through the three omnisciences,
['BO_T03_D3805:3b-2']	gzhan gdul bya 'jug pa'i yan lag brjod par bya ba la sogs pa brjod par 'dod pas gsungs pa ni /	gzhan gdul bya 'jug pa'i yan lag brjod par bya ba la sogs pa brjod par 'dod pas gsungs pa ni /	the one who wishes to speak about the other limbs for engaging the disciples, such as the topic, and so on, says:
['BO_T03_D3805:3b-3']	rnam pa thams cad mkhyen nyid lam //	rnam pa thams cad mkhyen nyid lam //	The path of omniscience in all aspects
['BO_T03_D3805:3b-4']	ston pas 'dir ni bshad pa gang //	ston pas 'dir ni bshad pa gang //	is taught here by the Teacher.
['BO_T03_D3805:3b-5']	blo dang ldan pas mthong 'gyur gyi //	blo dang ldan pas mthong 'gyur gyi //	The wise will see it,
['BO_T03_D3805:3b-6']	gzhan gyis myong ba ma yin zhes //	gzhan gyis myong ba ma yin zhes //	but not by others.
['BO_T03_D3805:3b-7']	chos spyod bcu yi bdag nyid can //	chos spyod bcu yi bdag nyid can //	The nature of the ten Dharma activities.
['BO_T03_D3805:3b-8']	mdo don dran pa la bzhag nas //	mdo don dran pa la bzhag nas //	Having set the meaning of the sutra in memory,
['BO_T03_D3805:3b-9']	bde blag tu ni rtogs 'gyur ba //	bde blag tu ni rtogs 'gyur ba //	it will be easily understood.
['BO_T03_D3805:3b-10']	zhes bya rtsom pa'i dgos pa'o //	zhes bya rtsom pa'i dgos pa'o //	This is the purpose of composition.
['BO_T03_D3805:3b-11']	zhes te / bgrod par bya bas lam zhes pa ste /	zhes te / bgrod par bya bas lam zhes pa ste /	The path is so called because it is to be traversed.
['BO_T03_D3805:3b-12']	gtso bo ni rnam pa thams cad mkhyen pa nyid 'bras bu sangs rgyas rnams kyi chos kyi sku ste /	gtso bo ni rnam pa thams cad mkhyen pa nyid 'bras bu sangs rgyas rnams kyi chos kyi sku ste /	The principal one is the omniscience of the buddhas, the fruition dharmakaya.
['BO_T03_D3805:3b-13', 'BO_T03_D3805:3b-14']	ji skad du mdo sde rgyan las /🔽sgrib pa thams cad spangs pa yi //	ji skad du mdo sde rgyan las / sgrib pa thams cad spangs pa yi //	As the Ornament of the Sutras teaches:🔽Having abandoned all obscurations,
['BO_T03_D3805:3b-15']	rnam pa thams cad mkhyen thob pa'i //	rnam pa thams cad mkhyen thob pa'i //	attaining omniscience,
['BO_T03_D3805:3b-16']	rin chen sgrom phye lta bu la //	rin chen sgrom phye lta bu la //	like opening a precious chest,
['BO_T03_D3805:3b-17']	sangs rgyas nyid du yang dag brjod //	sangs rgyas nyid du yang dag brjod //	it is rightly called buddhahood.
['BO_T03_D3805:3b-18']	ces so // 'dis bgrod par byed ces pas na lam rnams sangs rgyas nyid kyi rgyu phal pa'i rnam pa thams cad mkhyen pa nyid de khongs su ji ltar rigs par mngon par rtogs pa drug 'dus pa'o //	ces so // 'dis bgrod par byed ces pas na lam rnams sangs rgyas nyid kyi rgyu phal pa'i rnam pa thams cad mkhyen pa nyid de khongs su ji ltar rigs par mngon par rtogs pa drug 'dus pa'o //	Since it is what causes one to traverse, the paths are the causes of buddhahood, the omniscience of all aspects. The six realizations are included in that.
['BO_T03_D3805:3b-19']	de ltar rgyu dang 'bras bu'i bdag nyid can gyi mngon par rtogs pa brgyad kyi ngo bo'i lam shes rab kyi pha rol tu phyin pa'i mdo sde rin po che rjod par byed pa'i brjod par bya ba de byang chub sems dpa' ma yin pa rnams kyis khong	de ltar rgyu dang 'bras bu'i bdag nyid can gyi mngon par rtogs pa brgyad kyi ngo bo'i lam shes rab kyi pha rol tu phyin pa'i mdo sde rin po che rjod par byed pa'i brjod par bya ba de byang chub sems dpa' ma yin pa rnams kyis khong	Thus, the subject matter that expresses the precious sutra of the perfection of wisdom, the path whose nature is the eight realizations that have the nature of cause and effect, is not comprehended by those who are not bodhisattvas.
['BO_T03_D3805:3b-20']	du mi chud pas na blo dang ldan pa ni byang chub sems dpa' rnams so //	du mi chud pas na blo dang ldan pa ni byang chub sems dpa' rnams so //	Therefore, the wise are bodhisattvas.
['BO_T03_D3805:3b-21']	mngon sum du byed par 'gyur zhes pa ni dgos pa'i yang dgos pa'o //	mngon sum du byed par 'gyur zhes pa ni dgos pa'i yang dgos pa'o //	The phrase “they will actualize” is the ultimate purpose.
['BO_T03_D3805:3b-22']	de yang mdo'i don ji skad du bshad pa'i brjod par bya ba thos pa nyid bsam pas dran pa la bzhag cing /	de yang mdo'i don ji skad du bshad pa'i brjod par bya ba thos pa nyid bsam pas dran pa la bzhag cing /	Moreover, the subject matter explained in the sutra is heard and then placed in the memory through reflection.
['BO_T03_D3805:3b-23']	chos ni sems bskyed pa dang gdams ngag la sogs pa rnam pa bcu'i khongs su gtogs pa'i mngon par rtogs pa brgyad rab tu phye ba de'i spyod pa spyad pa rnams kyis bde blag tu rjes su gnas par 'gyur zhes brjod par bya ba thob pa byed pa'i	chos ni sems bskyed pa dang gdams ngag la sogs pa rnam pa bcu'i khongs su gtogs pa'i mngon par rtogs pa brgyad rab tu phye ba de'i spyod pa spyad pa rnams kyis bde blag tu rjes su gnas par 'gyur zhes brjod par bya ba thob pa byed pa'i	The Dharma is the eight realizations that belong to the ten categories such as the generation of the mind and the instructions, and the practice of the conduct of those who have opened up that Dharma.🔽The method of abiding in the means of attaining the statement that is to be made is
['BO_T03_D3805:3b-24']	thabs la rjes su gnas pa ni mdo brtsam pa'i dgos pa'o //	thabs la rjes su gnas pa ni mdo brtsam pa'i dgos pa'o //	the purpose of composing the sūtra.
['BO_T03_D3805:3b-25']	'brel pa ni brjod par bya ba dang rjod par byed pa'i dngos po'i mtshan nyid dang / bsgrub par bya ba dang sgrub par byed pa'i dngos po'i mtshan nyid de go sla ba kho na'o //	'brel pa ni brjod par bya ba dang rjod par byed pa'i dngos po'i mtshan nyid dang / bsgrub par bya ba dang sgrub par byed pa'i dngos po'i mtshan nyid de go sla ba kho na'o //	The connection is the definition of the thing to be expressed and the expresser, and the definition of the thing to be established and the means of establishment, which are easy to understand.
['BO_T03_D3805:3b-26', 'BO_T03_D3805:4a-0']	'di skad ces bya ba ni ji lta ba bzhin du bsdu bar bya zhes pa ste /🔽gleng @4a * //	'di skad ces bya ba ni ji lta ba bzhin du bsdu bar bya zhes pa ste / gleng @4a * //	This is called just as it is to be summarized.
['BO_T03_D3805:4a-1']	gzhi'i go skabs yin gyi nye bar bsdu ba ni ma yin te /	gzhi'i go skabs yin gyi nye bar bsdu ba ni ma yin te /	This is the context of the nidāna, not the summary,
['BO_T03_D3805:4a-2']	mdo sde'i lus nyid 'di skad du'o //	mdo sde'i lus nyid 'di skad du'o //	because the body of the sūtra is like this.
['BO_T03_D3805:4a-3']	bdag gis ni mngon sum du thos pa ste /	bdag gis ni mngon sum du thos pa ste /	I have heard directly. 
