segmentnr	original	analyzed	folio	translated
['BO_T16_D4460:294a-12']	de rnams kyi mche ba dang ldan pa'i dbung gi gnod pa lha ma yin rnams kyis lto ba zed cing sron pa zhes bya ba'i tha tshig go //	de rnams kyi mche ba dang ldan pa'i dbung gi gnod pa lha ma yin rnams kyis lto ba zed cing sron pa zhes bya ba'i tha tshig go //	294a	 The demigods open their bellies and bear the harm of the tusks of those elephants.
['BO_T16_D4460:294a-13']	lha'i phun sum tshogs pa nyid ston pa ni /	lha'i phun sum tshogs pa nyid ston pa ni /	294a	The excellence of the gods is shown:
['BO_T16_D4460:294a-14']	skal ba che bas bde ba thob pa'i dpal de ni zhes bya ba ste /	skal ba che bas bde ba thob pa'i dpal de ni zhes bya ba ste /	294a	The glory of obtaining happiness through great fortune
['BO_T16_D4460:294a-15']	dge ba'i rtsa ba du ma bsags pas legs par 'thob pa'i lus dang longs spyod phun sum tshogs pa'o //	dge ba'i rtsa ba du ma bsags pas legs par 'thob pa'i lus dang longs spyod phun sum tshogs pa'o //	294a	is the excellence of body and resources well obtained through accumulating many roots of virtue.
['BO_T16_D4460:294a-16']	de'i snying dregs pa'i dri ma can du byed pa ni lha ma yin gyi snying dregs pa ni de la phrag dog gi dri mar byas shing lhag par 'khrug pa'o //	de'i snying dregs pa'i dri ma can du byed pa ni lha ma yin gyi snying dregs pa ni de la phrag dog gi dri mar byas shing lhag par 'khrug pa'o //	294a	The heart of the asura is made to be stained by pride, since the pride of the asura is a stain of jealousy and is especially agitated.
['BO_T16_D4460:294a-17']	chos kyi bdag nyid yin zhes bya ba ni rgyal po'o //	chos kyi bdag nyid yin zhes bya ba ni rgyal po'o //	294a	The one who is of the nature of Dharma is the king.
['BO_T16_D4460:294a-18']	rgyal po de la lha ma yin nang rtsod pa de rol pa ni bde bar gnas pa'o //	rgyal po de la lha ma yin nang rtsod pa de rol pa ni bde bar gnas pa'o //	294a	The asura who is in conflict with that king is the one who is well situated.
['BO_T16_D4460:294a-19', 'BO_T16_D4460:294b-0']	de'i gegs su gyur par mthong ba dang yid byung ba ni skyo ba'o //🔽'gro ba lha dang de'i phyogs su gtogs pa lha ma yin gyi gnod pas 'jigs par mthong nas gzhi brjid can gyi byang chub sems dpa'i snying rje'i stobs kyi tshul bzhin @294b te legs par bzlog par rigs pas na lha'i dbang po'i snying ni dmag drangs kyi phyogs	de'i gegs su gyur par mthong ba dang yid byung ba ni skyo ba'o // 'gro ba lha dang de'i phyogs su gtogs pa lha ma yin gyi gnod pas 'jigs par mthong nas gzhi brjid can gyi byang chub sems dpa'i snying rje'i stobs kyi tshul bzhin @294b te legs par bzlog par rigs pas na lha'i dbang po'i snying ni dmag drangs kyi phyogs	294a	Seeing that as an obstacle, he is disgusted, which is the weariness.🔽Seeing that the world, the gods and those belonging to their faction, are in danger from the harm of the asura, it is proper that the bodhisattva, who is the one with the power of compassion, should properly ward them off with the method of his great power.
['BO_T16_D4460:294b-1']	la g-yel bar gyur te de bzlog dgos pa'i phyir ro //	la g-yel bar gyur te de bzlog dgos pa'i phyir ro //	294b	Therefore, the heart of the lord of the gods, who is the one who leads the army, is distracted from the side of the asura and needs to be turned back.
['BO_T16_D4460:294b-2']	shing rta dam pa'i steng du 'dug nas zhes sbyar ro //	shing rta dam pa'i steng du 'dug nas zhes sbyar ro //	294b	Having mounted the excellent chariot, one should apply.
['BO_T16_D4460:294b-3']	rgya mtsho'i 'gram ni rol mtsho'i 'gram mo //	rgya mtsho'i 'gram ni rol mtsho'i 'gram mo //	294b	The ocean shore is the shore of the pleasure ocean.
['BO_T16_D4460:294b-4']	lha rnams dga' ba'i 'khor gyi nang du song zhes bya ba ni 'khor rnams grong khyer lta na sdug gi nang du song ba'o //	lha rnams dga' ba'i 'khor gyi nang du song zhes bya ba ni 'khor rnams grong khyer lta na sdug gi nang du song ba'o //	294b	Having gone into the midst of the assembly of the gods who are delighted means that the assembly has gone into the midst of the city of Sudarśana.
['BO_T16_D4460:294b-5']	de nyid zhes bya ba ni snying rje'i rgyur bdag nyid kyi srog lam chags pa'i spyod pa de nyid kyis zhes bya ba ste des tsho 'di la phan pa thob pa'o //	de nyid zhes bya ba ni snying rje'i rgyur bdag nyid kyi srog lam chags pa'i spyod pa de nyid kyis zhes bya ba ste des tsho 'di la phan pa thob pa'o //	294b	That itself is the cause of compassion means that very conduct of giving away one’s own life is the cause of compassion. By that, one obtains benefit in this life.
['BO_T16_D4460:294b-6']	de bas gsungs pa zhes bya ba ni lung las so //	de bas gsungs pa zhes bya ba ni lung las so //	294b	Therefore, it is said means in the scriptures.
['BO_T16_D4460:294b-7']	rgya mtsho dus bzhin zhes bya ba rgya mtsho'i rlabs zhag bdun gyi dus las mi yol ba lta bu'o zhes bya ba'o //	rgya mtsho dus bzhin zhes bya ba rgya mtsho'i rlabs zhag bdun gyi dus las mi yol ba lta bu'o zhes bya ba'o //	294b	Like the ocean in time means like the waves of the ocean, which do not go beyond the time of seven days.
['BO_T16_D4460:294b-8']	brgya byin gyi rabs te bcu gcig pa'o /	brgya byin gyi rabs te bcu gcig pa'o /	294b	This is the eleventh chapter on Śakra.
['BO_T16_D4460:294b-9']	// / thos pa ldob pa ni myur du 'dzin pa'o //	// / thos pa ldob pa ni myur du 'dzin pa'o //	294b	Swift retention is quickly grasping what is heard.
['BO_T16_D4460:294b-10']	'dzin gsal ni gsal bar 'dzin pa'o //	'dzin gsal ni gsal bar 'dzin pa'o //	294b	Clear retention is clearly grasping it.
['BO_T16_D4460:294b-11']	de dag gis ni shes rab myur ba dang gsal bar 'jug pas dbang po rno bar bstan to //	de dag gis ni shes rab myur ba dang gsal bar 'jug pas dbang po rno bar bstan to //	294b	By these, it is shown that one has sharp faculties due to engaging in swift and clear wisdom.
['BO_T16_D4460:294b-12']	rang gi rigs bzang por grags pa dang bla ma la gus shing dbang po dul ba dang lang tsho dang ldan yang rgyags pa spangs pas zhi ba'o //	rang gi rigs bzang por grags pa dang bla ma la gus shing dbang po dul ba dang lang tsho dang ldan yang rgyags pa spangs pas zhi ba'o //	294b	It is peaceful because, although one is well known for one's good family, one is devoted to the guru and one's faculties are subdued, and although one is in one's prime, one has abandoned pride.
['BO_T16_D4460:294b-13']	chos bzang ba ni dkar po'i chos la legs par gnas pa ste tshul khrims yang dag par blangs pa'o //	chos bzang ba ni dkar po'i chos la legs par gnas pa ste tshul khrims yang dag par blangs pa'o //	294b	It is good in terms of Dharma because one is well established in the bright dharmas, that is, one has taken up morality.
['BO_T16_D4460:294b-14']	ji ltar sngags kyi khyad par dang ldan pa'i mthus sbrul gdug pa'am 'byung po la sogs pa la dbang byed pa ltar /	ji ltar sngags kyi khyad par dang ldan pa'i mthus sbrul gdug pa'am 'byung po la sogs pa la dbang byed pa ltar /	294b	Just as one has power over a poisonous snake or a spirit, etc. through the power of a special mantra,
['BO_T16_D4460:294b-15']	gnyen po stobs che bas rang gi sems la dbang byed pa ni yon tan dbang du byed pa'i sngags de rdzas dang 'dra ba'i byams pa la sogs pa goms pa'o //	gnyen po stobs che bas rang gi sems la dbang byed pa ni yon tan dbang du byed pa'i sngags de rdzas dang 'dra ba'i byams pa la sogs pa goms pa'o //	294b	one has power over one's own mind through the power of the antidotes, and this is the mantra that controls the good qualities. It is the cultivation of love, etc. which is like a substance.
['BO_T16_D4460:294b-16']	de rtag tu ma nyams zhe sdang mthu dang ldan pas zhe sdang 'khrug pa'i rgyu gnod pa byung yang de la rang gi sems dbang du byed cing khong khro ba'i dbang du mi 'gyur na tha mal ba'i sems nyon mongs pa'i rkyen shas chen po med na lta	de rtag tu ma nyams zhe sdang mthu dang ldan pas zhe sdang 'khrug pa'i rgyu gnod pa byung yang de la rang gi sems dbang du byed cing khong khro ba'i dbang du mi 'gyur na tha mal ba'i sems nyon mongs pa'i rkyen shas chen po med na lta	294b	Since he is always free of that, and since he is powerful in his freedom from hatred, he is not affected by anger even when he is harmed, the cause of the disturbance of hatred.
['BO_T16_D4460:294b-17']	ci smos te shin tu rang gi sems la dbang yod pa'o //	ci smos te shin tu rang gi sems la dbang yod pa'o //	294b	He is in control of his own mind, and so he is not affected by anger.
['BO_T16_D4460:294b-18']	dbul ba 'bras bu re ba med //	dbul ba 'bras bu re ba med //	294b	He has no hope for the fruits of poverty.
['BO_T16_D4460:294b-19']	ces bya ba ni tshe 'di la yang zong gis bsgrubs pa'i nor gyi 'bras bu'am zhing la sogs pas bsgrubs pa'i 'bru'i khyad par la re ba med pa'o //	ces bya ba ni tshe 'di la yang zong gis bsgrubs pa'i nor gyi 'bras bu'am zhing la sogs pas bsgrubs pa'i 'bru'i khyad par la re ba med pa'o //	294b	He has no hope for the fruits of wealth, which are acquired through commerce, or for the fruits of grains, which are acquired through farming.
['BO_T16_D4460:294b-20']	bdag gis mi la'ang smrar med pa ni bdag dbul bas gzhan gyi re ltos kyi sar ma gyur pas zhum par gnas pa'o //	bdag gis mi la'ang smrar med pa ni bdag dbul bas gzhan gyi re ltos kyi sar ma gyur pas zhum par gnas pa'o //	294b	He is not a source of hope for others, because he is poor.
['BO_T16_D4460:295a-0', 'BO_T16_D4460:295a-1']	dga' ston chen na'ang dga' mi @295a * //🔽myong ba ni /	dga' ston chen na'ang dga' mi @295a * //🔽myong ba ni /	295a	He does not rejoice in great festivities.
['BO_T16_D4460:295a-2']	dbul bas bdag la dga' ston byar med pa dang / ka zhan gyis kyang mi ster ba dang / byin yang bdag la kha len med pas zhum zhum por 'dug pa'o //	dbul bas bdag la dga' ston byar med pa dang / ka zhan gyis kyang mi ster ba dang / byin yang bdag la kha len med pas zhum zhum por 'dug pa'o //	295a	One is dispirited because of poverty, thinking I have no means of celebrating a festival, or because of weakness, thinking I am not given to others, or because of being given to others, thinking I am not my own master.🔽One is dispirited because of being praised for giving, thinking I am not praised for not giving, or because of being praised for not giving, thinking I am not praised for giving, or because of being praised for both, thinking I am not praised for neither.🔽One is dispirited because of being praised for both, thinking I am not praised for neither, or because of being praised for neither, thinking I am not praised for both.
['BO_T16_D4460:295a-3', 'BO_T16_D4460:295a-4']	sbyin pa'i gtam yang zhen pa ni bdag nyid sbyin pa byar med bar bsngags pa brjod kyang kha gsag lta bur mngon pa'o //🔽de rnams kyis sma bab pa lta bu yin la yo byang chung du 'tsho ba yang sdug bsngal dang bcas pas nyon mongs ngal ba'i gzhi zhes pa'o //	sbyin pa'i gtam yang zhen pa ni bdag nyid sbyin pa byar med bar bsngags pa brjod kyang kha gsag lta bur mngon pa'o // de rnams kyis sma bab pa lta bu yin la yo byang chung du 'tsho ba yang sdug bsngal dang bcas pas nyon mongs ngal ba'i gzhi zhes pa'o //	295a	 One is dispirited because of being praised for neither, thinking I am not praised for both, or because of being praised for both, thinking I am not praised for neither.🔽 One is dispirited because of being praised for both, thinking I am not praised for neither, or because of being praised for neither, thinking I am not praised for both.🔽 One is dispirited because of being praised for neither, thinking I am not praised for both, or because of being praised for both, thinking I am not praised for neither.🔽 One is dispirited because of being praised for both, thinking I am not praised for neither, or because of being praised for neither, thinking I am not praised for both.🔽 One is dispirited because of being praised for neither, thinking I am not praised for both, or because of being praised for both, thinking I am not praised for neither.
['BO_T16_D4460:295a-5']	ngo tsha shes pa'i bsngags pa dang ldan pa'i mdo sde la sbyar bar bya ba ni mdo sde'i don yang 'dis gsal bar bsgrub ba'am 'di yang mdo sde dang mthun pa yin no zhes bstan pa yin no //	ngo tsha shes pa'i bsngags pa dang ldan pa'i mdo sde la sbyar bar bya ba ni mdo sde'i don yang 'dis gsal bar bsgrub ba'am 'di yang mdo sde dang mthun pa yin no zhes bstan pa yin no //	295a	 One is dispirited because of being praised for both, thinking I am not praised for neither, or because of being praised for neither, thinking I am not praised for both.🔽 One is dispirited because of being praised for neither, thinking I am not praised for both, or because of being praised for both, thinking I am not praised for neither.🔽 One is dispirited because of being praised for both, thinking I am not praised for neither, or because of being praised for neither, thinking I am not praised for
['BO_T16_D4460:295a-6']	'jig rten lha dbang byed pa ni gzhan gyi dpyas pas 'jigs nas sdig pa la 'dzem pa ste khrel yod pa yin la de'i dbang du byas pa'i mdo sde yang de dang mthun no zhes bya ba'o //	'jig rten lha dbang byed pa ni gzhan gyi dpyas pas 'jigs nas sdig pa la 'dzem pa ste khrel yod pa yin la de'i dbang du byas pa'i mdo sde yang de dang mthun no zhes bya ba'o //	295a	The world is ruled by the gods, and so, fearing the reproach of others, one should avoid sin. The sutra is in agreement with this.
['BO_T16_D4460:295a-7']	bram ze'i rabs te bcu gnyis pa'o /	bram ze'i rabs te bcu gnyis pa'o /	295a	The Brahmana's Lineage is the twelfth chapter.
['BO_T16_D4460:295a-8']	// / khyim na gnyi gas yang zhes bya ba ni pha ma'i khyim dang khyim thab kyi khyim mo //	// / khyim na gnyi gas yang zhes bya ba ni pha ma'i khyim dang khyim thab kyi khyim mo //	295a	Both in the house of the parents and in the house of the husband.
['BO_T16_D4460:295a-9']	'di ci ku mu ta yin nam zhes bya ba ni lha mo'i khyad par zhig go //	'di ci ku mu ta yin nam zhes bya ba ni lha mo'i khyad par zhig go //	295a	Is this a kumuda? is a particular goddess.
['BO_T16_D4460:295a-10']	khyim 'di lha yin zhes bya ba ni khyim 'di lha mo'i yin nam zhes bya ba'o //	khyim 'di lha yin zhes bya ba ni khyim 'di lha mo'i yin nam zhes bya ba'o //	295a	This house is divine means Is this house of the goddess?
['BO_T16_D4460:295a-11']	de yi lus bzangs bcas shing 'greng dang lta ba la /	de yi lus bzangs bcas shing 'greng dang lta ba la /	295a	When she stands with her excellent body, and when she looks,
['BO_T16_D4460:295a-12']	chags pas cha cig yid du gyur cig 'dug pa'i tshe //	chags pas cha cig yid du gyur cig 'dug pa'i tshe //	295a	with passion, at one part of her body, at that time,
['BO_T16_D4460:295a-13']	zhes bya ba ni sngar lam du myos byed ma dang phrad pa'i ste'o //	zhes bya ba ni sngar lam du myos byed ma dang phrad pa'i ste'o //	295a	it is said that she is like the one met on the road by Madhu.
['BO_T16_D4460:295a-14']	don sgrub go rims sbyin pa'i chab tshod sgra grags pa'i //	don sgrub go rims sbyin pa'i chab tshod sgra grags pa'i //	295a	The sound of the bell of the gift of the sequence of the accomplishment of the goal,
['BO_T16_D4460:295a-15']	chab tshod zhes bya ba ni bgrod pa'i gnas su 'gro bar don sgrub cing rim gyis 'gro bar spron pa'i chu tshod kyi tshad 'dzin pa'i rnga rdung ba'i sgra grag pa dang dung 'bud pa'i sgra grag pas 'gro dgos shing rta khrid pa de'i cho /	chab tshod zhes bya ba ni bgrod pa'i gnas su 'gro bar don sgrub cing rim gyis 'gro bar spron pa'i chu tshod kyi tshad 'dzin pa'i rnga rdung ba'i sgra grag pa dang dung 'bud pa'i sgra grag pas 'gro dgos shing rta khrid pa de'i cho /	295a	The “time of departure” is the time when the sound of the drum is heard to announce the time for the daily work, and the sound of the conch is heard to announce the time for the gradual departure to the place of work.
['BO_T16_D4460:295a-16']	nga'i sems la zhes sdang ldang ste /	nga'i sems la zhes sdang ldang ste /	295a	“My mind” is the mind of anger.
['BO_T16_D4460:295a-17']	ma rangs par gyur te /	ma rangs par gyur te /	295a	“Displeased” is the state of not being satisfied.
['BO_T16_D4460:295a-18']	yul 'das kyang myos byed pa la ltar yod na dga'o zhes bya ba'o //	yul 'das kyang myos byed pa la ltar yod na dga'o zhes bya ba'o //	295a	“I would be happy if the intoxicating liquor were present” means that even though the country is passed, one is happy if the intoxicating liquor is present.
['BO_T16_D4460:295a-19']	chos spyad pa las bya ba ni sngon dge ba byas pa las so //	chos spyad pa las bya ba ni sngon dge ba byas pa las so //	295a	“From the practice of Dharma” means from the practice of virtue in the past.
['BO_T16_D4460:295a-20']	dpal thob pa ni lus dang longs spyod kyi 'byor pa thob pa'o //	dpal thob pa ni lus dang longs spyod kyi 'byor pa thob pa'o //	295a	“Obtaining glory” means obtaining the wealth of body and possessions.
['BO_T16_D4460:295a-21']	de nyid la yang gnod pa byed pa ni tshe gzhan du de nyams pa'i rgyu sdig ba brten pa'o //	de nyid la yang gnod pa byed pa ni tshe gzhan du de nyams pa'i rgyu sdig ba brten pa'o //	295a	“Causing harm to that very thing” means relying on the cause of the destruction of that very thing in another life, which is non-virtue.
['BO_T16_D4460:295a-22']	des na gzhan du yang //	des na gzhan du yang //	295a	Therefore, in another life as well,
['BO_T16_D4460:295b-0']	ji ltar khyod la rtag tu sku 'phongs pa bzhin du chos 'phongs par mdzod @295b ces gsungs pa'o //	ji ltar khyod la rtag tu sku 'phongs pa bzhin du chos 'phongs par mdzod @295b ces gsungs pa'o //	295b	just as you are always deprived of the body, so be deprived of the Dharma.
['BO_T16_D4460:295b-1']	'di dang pha rol sreg par 'gyur //	'di dang pha rol sreg par 'gyur //	295b	He will be burned in this life and the next.
['BO_T16_D4460:295b-2']	zhes bya ba ni 'dir ni rgyal po'i chad pas yin no //	zhes bya ba ni 'dir ni rgyal po'i chad pas yin no //	295b	Here, he is burned by the king’s punishment.
['BO_T16_D4460:295b-3']	pha rol tu ni nyes pa med pa'i bud med bor zhing smad pa'i las la sbyar ba'i phyir ro //	pha rol tu ni nyes pa med pa'i bud med bor zhing smad pa'i las la sbyar ba'i phyir ro //	295b	In the next life, he is burned by the sin of abandoning a blameless woman and engaging in the action of defiling her.
['BO_T16_D4460:295b-4']	dus tshigs mchod pa'i yon tan ni shing gi 'bras bu smin pa'i dus su 'bras bu de 'bul ba la sogs pa'o //	dus tshigs mchod pa'i yon tan ni shing gi 'bras bu smin pa'i dus su 'bras bu de 'bul ba la sogs pa'o //	295b	The quality of worship at the right time is the offering of fruit when the fruit of the tree ripens, and so on.
['BO_T16_D4460:295b-5']	lha dang dpal gyis rab tu spangs par 'gyur //	lha dang dpal gyis rab tu spangs par 'gyur //	295b	He will be abandoned by the gods and by glory.
['BO_T16_D4460:295b-6']	zhes bya ba ni lhas kyang mi srung la dge ba'i 'bras bu yang thag ring ba'o //	zhes bya ba ni lhas kyang mi srung la dge ba'i 'bras bu yang thag ring ba'o //	295b	The gods will not protect him, and the fruits of virtue will be far away.
['BO_T16_D4460:295b-7']	khyod ni de ltar zhi gyur pa //	khyod ni de ltar zhi gyur pa //	295b	You have become like that, tranquil,
['BO_T16_D4460:295b-8']	zhes bya ba ni dbang po'i sgo bsdams pa'o //	zhes bya ba ni dbang po'i sgo bsdams pa'o //	295b	means that he has restrained the doors of his senses.
['BO_T16_D4460:295b-9']	de la ngo mtshar che mi 'gyur //	de la ngo mtshar che mi 'gyur //	295b	There is nothing amazing about that.
['BO_T16_D4460:295b-10']	zhes bya ba mkhas pa'i skye bos brtags na de la ngo mtshar med de yon tan la goms pa'i phyir ro zhes bya ba'i tha tshig go //	zhes bya ba mkhas pa'i skye bos brtags na de la ngo mtshar med de yon tan la goms pa'i phyir ro zhes bya ba'i tha tshig go //	295b	When examined by the wise, there is nothing amazing about that, because he is accustomed to virtue.
['BO_T16_D4460:295b-11']	myos byed ma'i rabs te bcu gsum pa'o /	myos byed ma'i rabs te bcu gsum pa'o /	295b	This is the thirteenth chapter, called “On Intoxication.”
['BO_T16_D4460:295b-12']	// / bdag cag yul ni gnyi ga las //	// / bdag cag yul ni gnyi ga las //	295b	Both of us, he said, are from the same country.
['BO_T16_D4460:295b-13', 'BO_T16_D4460:295b-14']	zhes bya ba ni rang gi yul dang rin po che blang ba'i gnas las so //🔽aan da rnyil gyi mdog ni mthil ka'o //	zhes bya ba ni rang gi yul dang rin po che blang ba'i gnas las so // aan da rnyil gyi mdog ni mthil ka'o //	295b	 He meant that they were from the same country and from the same place where jewels were obtained.🔽 The soles of her feet were the color of sapphires.
['BO_T16_D4460:295b-15']	margad ni ljang gu'o //	margad ni ljang gu'o //	295b	Her ankles were the color of emeralds.
['BO_T16_D4460:295b-16']	lha mo nyid la zhes bya ba ni tsan dhi ste dbu au ma la'o //	lha mo nyid la zhes bya ba ni tsan dhi ste dbu au ma la'o //	295b	The goddess herself, he said, is Canda, the head of Uma.
['BO_T16_D4460:295b-17']	legs par pha rol tu phyin pa'i rabs te bcu bzhi pa'o /	legs par pha rol tu phyin pa'i rabs te bcu bzhi pa'o /	295b	This is the fourteenth chapter.
['BO_T16_D4460:295b-18']	// / dge dang mi dge las rnams goms byas nas //	// / dge dang mi dge las rnams goms byas nas //	295b	When people have cultivated good and bad actions,
['BO_T16_D4460:295b-19']	mi rnams la ni 'dris pa nyid du 'gyur //	mi rnams la ni 'dris pa nyid du 'gyur //	295b	they become familiar with them.
['BO_T16_D4460:295b-20']	zhes bya ba ni mi rnams la tshe de la goms na tshe de la spyod pa tsam mthong la /	zhes bya ba ni mi rnams la tshe de la goms na tshe de la spyod pa tsam mthong la /	295b	When people cultivate them in this life, they merely see them practiced in this life.
['BO_T16_D4460:295b-21']	byang chub sems dpa' nyar gyur pas tshe de lam bsgoms kyang tshe rabs gzhan la goms pas tshe 'di la rmi lam bzhin du sngon gyi stobs kyis spyod do zhes bya ba'o //	byang chub sems dpa' nyar gyur pas tshe de lam bsgoms kyang tshe rabs gzhan la goms pas tshe 'di la rmi lam bzhin du sngon gyi stobs kyis spyod do zhes bya ba'o //	295b	But when a bodhisattva cultivates them in this life, he practices them in other lives as well, like a dream, by the power of his former cultivation.
['BO_T16_D4460:295b-22']	nya'i rabs te bco lnga pa'o /	nya'i rabs te bco lnga pa'o /	295b	This is the fifteenth chapter, the Chapter on the Fish.
['BO_T16_D4460:295b-23']	// / cho ga'i zas za zhes bya ba ni dka' thub byed pa'i mi dag 'bras kyi gzegs mas 'tsho bar byed pa la sogs pa'o //	// / cho ga'i zas za zhes bya ba ni dka' thub byed pa'i mi dag 'bras kyi gzegs mas 'tsho bar byed pa la sogs pa'o //	295b	The food of rites is the food of those who practice austerities, such as living on grain dust.
['BO_T16_D4460:295b-24', 'BO_T16_D4460:295b-25']	ngo tsha med par legs par 'tsho ba ni 'phral nyon mi mongs par skyid pa'o //🔽'tsho ba shin tu nyon mongs ldan //	ngo tsha med par legs par 'tsho ba ni 'phral nyon mi mongs par skyid pa'o // 'tsho ba shin tu nyon mongs ldan //	295b	Living without shame is living happily without being troubled by the afflictions.
['BO_T16_D4460:295b-26', 'BO_T16_D4460:295b-27']	zhes bya ni nyon mongs pas gos shing sdig pa dang 'brel pa'o //🔽bdag gi rkang pa ming don med cing 'dab ma med //	zhes bya ni nyon mongs pas gos shing sdig pa dang 'brel pa'o // bdag gi rkang pa ming don med cing 'dab ma med //	295b	The line and is full of the afflictions of livelihood means that one is covered by the afflictions and is connected with sin.
['BO_T16_D4460:295b-28']	zhes bya ba ni rkang pa yongs sum rdzogs shing 'dab ma yongs su ma rdzogs pas ming gi don legs par mi gnas pa'o //	zhes bya ba ni rkang pa yongs sum rdzogs shing 'dab ma yongs su ma rdzogs pas ming gi don legs par mi gnas pa'o //	295b	The line my feet are without name and without leaves means that because the feet are incomplete and the leaves are incomplete, the meaning of the name is not well established.
['BO_T16_D4460:296a-0', 'BO_T16_D4460:296a-1']	'gro na byar rung ba ni sbyin sreg gi rdzas te 'bras chan dang zho @296a * //🔽la sogs pa'o //	'gro na byar rung ba ni sbyin sreg gi rdzas te 'bras chan dang zho @296a * //🔽la sogs pa'o //	296a	The fit for going is the material for the fire offering, such as rice and curd.
['BO_T16_D4460:296a-2', 'BO_T16_D4460:296a-3']	rgya mtsho'i rlabs dus las mi yol zhing skye bo brten pa yang bslab pa legs par mi 'da' ba bzhin bden pa goms pa'i ngag las ni me yang mi 'da' bas bden pa la goms par bya'o zhes ston pa ni de ci'i phyir zhes bya ba la sogs🔽pas ston to //	rgya mtsho'i rlabs dus las mi yol zhing skye bo brten pa yang bslab pa legs par mi 'da' ba bzhin bden pa goms pa'i ngag las ni me yang mi 'da' bas bden pa la goms par bya'o zhes ston pa ni de ci'i phyir zhes bya ba la sogs pas ston to //	296a	This is taught by Why is that? and so forth.
['BO_T16_D4460:296a-4']	sreg pa'i rabs te bcu drug pa'o /	sreg pa'i rabs te bcu drug pa'o /	296a	This is the sixteenth chapter on the lineage of burning.
['BO_T16_D4460:296a-5']	// /'jig rten yongs kyis phal cher dpal ldan na //	// /'jig rten yongs kyis phal cher dpal ldan na //	296a	In the world, most people are like the glorious sun.
['BO_T16_D4460:296a-6']	zhes bya ba'o //	zhes bya ba'o //	296a	This is what it says.
['BO_T16_D4460:296a-7']	dpal gyi rang bzhin shes pa ni 'byor pa la bag yod par bya ba shes pa'o //	dpal gyi rang bzhin shes pa ni 'byor pa la bag yod par bya ba shes pa'o //	296a	Knowing the nature of glory is knowing how to be careful with wealth.
['BO_T16_D4460:296a-8']	gzi brjid kyis gzhan zil gyis gnon pas gzi chen nyi ma 'char 'dra'o //	gzi brjid kyis gzhan zil gyis gnon pas gzi chen nyi ma 'char 'dra'o //	296a	With great splendor, outshining others, like the rising sun.
