segmentnr	original	folio	stemmed
BO_K12_D0667_H0634:188b-0	@188b rgya gar skad du /	188b	rgya gar skad du 
BO_K12_D0667_H0634:188b-1	shr'i ma h'a k'a la tantra /	188b	shr ma ha ka la tantra 
BO_K12_D0667_H0634:188b-2	bod skad du /	188b	bod skad du 
BO_K12_D0667_H0634:188b-3	dpal nag po chen po'i rgyud /	188b	dpal nag po chen po brgyud 
BO_K12_D0667_H0634:189a-0	dbang gi rta mchog sku la phyag @189a *//	189a	dbang gi rta mchog sku la phyag 
BO_K12_D0667_H0634:189a-1	'tshal lo // 'di skad bdag gis thos pa dus gcig na /	189a	tshal lo di skad bdag gis thos ba dus gcig na 
BO_K12_D0667_H0634:189a-2	shar lho'i dur khrod chen po ha ha drag tu dgod pa'i gnas shing tsandan gyi nags tshal rab tu dga' ba'i ming zhes bya ba mi ma yin pho mo mang po 'dus pa'i pho brang du dpal nag po chen po zhes bya ba bi n'a ya ka la	189a	char lho dur khrod chen po ha ha drag tu god ba gnas shing tsandan gyi nags tshal rab tu dga ba ming zhes byed ba mi ma yin pho mo mang po du ba pho brang du dpal nag po chen po zhes byed ba bi na ya ka la 
BO_K12_D0667_H0634:189a-3	sogs te 'khor gdug pa can rnams kyi dbus na skye 'gro sems can rnams kyi srog dbugs la dbang byed pa'i nag po chen po zhes bya ba zhig yod de /	189a	sogs te khor gdug ba can rnams kyi dbus na skye gro sems can rnams kyi srog dbugs la dbang byed ba nag po chen po zhes byed ba jig yod de 
BO_K12_D0667_H0634:189a-4	de'i tshe de'i dus na nub phyogs kyi 'jig rten gyi khams na mthar byed rta'i rgyal po zhes bya ba rgyal po chen po bzhi la sogs pa'i 'khor byis bskor te dregs pa can 'dul ba'i ting nge 'dzin la snyoms par zhugs nas lcags kyu'i phyag rgya bcas	189a	de tshe de dus na nub phyogs kyi jig rten gyi khams na mthar byed rta rgyal po zhes byed ba rgyal po chen po bzhi la sogs ba khor byis skor te dregs ba can dul ba ting nge dzin la snyom ba jug nas lcags kyu phyag rgya cha 
BO_K12_D0667_H0634:189a-5	nas aom badzra kro dha ha ya gri ba h'um hu lu hu lu h'um bam zhes brjod pas /	189a	nas aom badzra kro dha ha ya gri ba hum hu lu hu lu hum bam zhes rjod ba 
BO_K12_D0667_H0634:189a-6	dur khrod ha ha drag tu dgod pa'i gnas nas nag po rang dbang med par mthar byed rta'i rgyal po'i mngon du byung ste las ci bya zer zhing rang rtags srog gi snying po 'di mdongs gsol du phul ba /	189a	dur khrod ha ha drag tu god ba gnas nas nag po rang dbang med ba mthar byed rta rgyal po mngon du byung ste las ci byed zer zhing rang rtags srog gi snying po di mdongs gsol du bul ba 
BO_K12_D0667_H0634:189a-7	aom badzra ma h'a k'a la kshim kshe tra bighna'm bi n'a ya ka h'um h'um phat ces phul lo //	189a	aom badzra ma ha ka la kshim kshe tra bighnam bi na ya ka hum hum phat ces bul lo 
BO_K12_D0667_H0634:189a-8	dpal nag po chen po'i rgyud las /	189a	dpal nag po chen po brgyud las 
BO_K12_D0667_H0634:189a-9	gleng gzhi'i le'u ste dang po'o ////	189a	gleng gzhi leu ste dang po 
BO_K12_D0667_H0634:189b-0	de nas rgyal po mig mi bzang gis mthar @189b byed rta'i rgyal po la 'di skad ces gsol to //	189b	de nas rgyal po mig mi bzang gis mthar byed rta rgyal po la di skad ces gsol to 
BO_K12_D0667_H0634:189b-1	ae ma padma khros pa'i bdag /	189b	ae ma padma khro ba bdag 
BO_K12_D0667_H0634:189b-2	nag po chen po drag shul can //	189b	nag po chen po drag shul can 
BO_K12_D0667_H0634:189b-3	gsang ba'i sgrub pa bshad du gsol //	189b	gsang ba sgrub ba chad du gsol 
BO_K12_D0667_H0634:189b-4	mgon po bsgrub par bya ba gang //	189b	mgon po sgrub ba byed ba gang 
BO_K12_D0667_H0634:189b-5	gsad cing lus srog dbye ba dang // ma grub shi sa bstan pa dang // mgon po'i rtags dang ser ba rnams //	189b	gsad cing lus srog byed ba dang ma grub chi sa ston ba dang mgon po rtags dang ser ba rnams 
BO_K12_D0667_H0634:189b-6	rta mchog chen pos bdag la stsol //	189b	rta mchog chen pos bdag la stsol 
BO_K12_D0667_H0634:189b-7	ces zhus pas /	189b	ces zhus ba 
BO_K12_D0667_H0634:189b-8	de nas padma khros pa yis //	189b	de nas padma khro ba yis 
BO_K12_D0667_H0634:189b-9	nag po'i sgrub thabs ched du brjod //	189b	nag po sgrub thabs ched du rjod 
BO_K12_D0667_H0634:189b-10	dam tshig ldan pa'i sngags pa yis //	189b	dam tshig ldan ba sngags ba yis 
BO_K12_D0667_H0634:189b-11	sangs rgyas bstan pa bsrung slad du //	189b	sangs rgya ston ba bsrung slad du 
BO_K12_D0667_H0634:189b-12	gza' skar tshes grangs shis pa la //	189b	gza skar tshes grangs shis ba la 
BO_K12_D0667_H0634:189b-13	dur khrod la sogs shing gcig tu //	189b	dur khrod la sogs shing gcig tu 
BO_K12_D0667_H0634:189b-14	bsod nams tshogs ni bsags byas la //	189b	bsod nams tshogs ni bsags byed la 
BO_K12_D0667_H0634:189b-15	nag po chen po bsgrub par bya //	189b	nag po chen po sgrub ba byed 
BO_K12_D0667_H0634:189b-16	phung sa'am sa nag dag la ni; ;stegs bu gru bzhi byas nas ni //	189b	phung sa sa nag dag la ni; ;stegs bu gru bzhi byed nas ni 
BO_K12_D0667_H0634:189b-17	dri spos khrag gis chag chag bya //	189b	dri spros khrag gis chag chag byed 
BO_K12_D0667_H0634:189b-18	dbus su gru gsum zla kham ldan //	189b	dbus su gru gsum zla kham ldan 
BO_K12_D0667_H0634:189b-19	phyi rol padma 'dab brgyad bri //	189b	phyi rol padma dab brgyad bri 
BO_K12_D0667_H0634:189b-20	de dbus thod chen nang du ni //	189b	de dbus thod chen nang du ni 
BO_K12_D0667_H0634:189b-21	sha lnga snying snas brgyan pa yi //	189b	sha lnga snying snas rgyan ba yi 
BO_K12_D0667_H0634:189b-22	gtor ma bshos bu khru gang tshad //	189b	thor ma bshos bu khru gang tshad 
BO_K12_D0667_H0634:189b-23	de la mda' gzugs dmar nag dar //	189b	de la mda gzugs dmar nag dar 
BO_K12_D0667_H0634:189b-24	gri snying tsa ka li yang gzugs //	189b	gri snying tsa ka li yang gzugs 
BO_K12_D0667_H0634:189b-25	de nyid mgon po'i rten du gzhag /	189b	de nyid mgon po rten du jog 
BO_K12_D0667_H0634:189b-26	d'a ma ru yi pags pa'i nang //	189b	da ma ru yi pags ba nang 
BO_K12_D0667_H0634:189b-27	mgon po'i srog sngags bri bar bya //	189b	mgon po srog sngags bri ba byed 
BO_K12_D0667_H0634:189b-28	ldo yi nang du bla rdos dril //	189b	ldo yi nang du bla rdos dril 
BO_K12_D0667_H0634:189b-29	spos dang rgyun gtor gtang bar bya //	189b	spros dang rgyun thor gtong ba byed 
BO_K12_D0667_H0634:189b-30	dkon mchog spyi la mchod pa bsham //	189b	dkon(d) mchog spyi la mchod ba bsham 
BO_K12_D0667_H0634:190a-0	de nas padmar bdag bsgoms @190a *//	190a	de nas padmar bdag sgom 
BO_K12_D0667_H0634:190a-1	la; ;thugs ka'i hr'i las 'od 'phros pas //	190a	la; ;thugs ka hr las d phro ba 
BO_K12_D0667_H0634:190a-2	bla ma sangs rgyas la sogs pa //	190a	bla ma sangs rgya la sogs ba 
BO_K12_D0667_H0634:190a-3	rang gi mdun du bsam byas la //	190a	rang gi mdun du bsam byed la 
BO_K12_D0667_H0634:190a-4	mchod pa rnams lnga dbul bar bya //	190a	mchod ba rnams lnga bul ba byed 
BO_K12_D0667_H0634:190a-5	rnam dag bdun gyi 'og tu ni //	190a	rnam dag bdun gyi g tu ni 
BO_K12_D0667_H0634:190a-6	tshad med bzhi po bsgom par bya //	190a	tshad med bzhi po bsgom ba byed 
BO_K12_D0667_H0634:190a-7	btang snyoms la sogs pam ram tri //	190a	gtong snyom la sogs pam ram tri 
BO_K12_D0667_H0634:190a-8	pad steng yi ge h'um las ni //	190a	pad steng yi ge hum las ni 
BO_K12_D0667_H0634:190a-9	nag po zhal gcig phyag drug pa //	190a	nag po zhal gcig phyag drug ba 
BO_K12_D0667_H0634:190a-10	gri gug phreng ba d'a ma ru //	190a	gri gug phreng ba da ma ru 
BO_K12_D0667_H0634:190a-11	thod pa mdung dang zhags pa bsnams //	190a	thod ba mdung dang zhags ba snom 
BO_K12_D0667_H0634:190a-12	g-yas g-yon rim pas bsnams pa'o //	190a	g-yas g-yon rim ba snom ba 
BO_K12_D0667_H0634:190a-13	sbrul dang rin chen rgyan gyis brgyan; ;sku smad ba ti khra bo gsol //	190a	sbrul dang rin chen rgyan gyis brgyan; ;sku smad ba ti khra bo gsol 
BO_K12_D0667_H0634:190a-14	stag lpags zhing gi sham thabs can //	190a	stag lpags zhing gi sham thabs can 
BO_K12_D0667_H0634:190a-15	gtum po spyan gsum mche ba gtsigs //	190a	thum po spyan gsum mche ba gtsigs 
BO_K12_D0667_H0634:190a-16	dpral bar dri yi thig les brgyan //	190a	dpral ba dri yi thig les rgyan 
BO_K12_D0667_H0634:190a-17	spyi gtsug mi bskyod sprul sku brtan //	190a	spyi gtsug mi skyod sprul sku brtan 
BO_K12_D0667_H0634:190a-18	de ltar bdag mdun gsal bsgoms nas //	190a	de ltar bdag mdun gsal sgom nas 
BO_K12_D0667_H0634:190a-19	spyan drangs mchod dang bzlas par bya //	190a	spyan drangs mchod dang bzlas ba byed 
BO_K12_D0667_H0634:190a-20	gtor ma p'u dza la sogs pas //	190a	thor ma pu dza la sogs ba 
BO_K12_D0667_H0634:190a-21	nag po che la sbyin par bya //	190a	nag po che la sbyin ba byed 
BO_K12_D0667_H0634:190a-22	mgon po'i thugs ka'i h'um las ni //	190a	mgon po thugs ka hum las ni 
BO_K12_D0667_H0634:190a-23	srog gi yi ge g-yas nas bskor //	190a	srog gi yi ge g-yas nas skor 
BO_K12_D0667_H0634:190a-24	khor yug dag gis bzla bar bya //	190a	khor yug dag gis bzla ba byed 
BO_K12_D0667_H0634:190a-25	aom badzra ma h'a ka la kshim kshe tra bighn'am bi n'a ya ka h'um h'um phata /	190a	aom badzra ma ha ka la kshim kshe tra bighn bi na ya ka hum hum phata 
BO_K12_D0667_H0634:190a-26	de skad ces ni rab brjod pas //	190a	de skad ces ni rab rjod ba 
BO_K12_D0667_H0634:190a-27	nag po grub pa'i rtags rnams 'byung //	190a	nag po grub ba rtags rnams byung 
BO_K12_D0667_H0634:190a-28	dpal nag po chen po'i rgyud las /	190a	dpal nag po chen po brgyud las 
BO_K12_D0667_H0634:190b-0	bsnyen cing sgrub pa'i le'u ste @190b gnyis pa'o ////	190b	snyen cing sgrub ba leu ste gnyis ba 
BO_K12_D0667_H0634:190b-1	de nas yang dag bshad bya ba //	190b	de nas yang dag chad byed ba 
BO_K12_D0667_H0634:190b-2	sangs rgyas bstan pa bshig pa dang // rnal 'byor bar chad byed pa rnams //	190b	sangs rgya ston ba jig ba dang rnal byor ba chad byed ba rnams 
BO_K12_D0667_H0634:190b-3	nag pa chen pos bsgral 'dod na //	190b	nag ba chen pos bsgral dod na 
BO_K12_D0667_H0634:190b-4	stegs bu gru bzhi byas nas kyang //	190b	stegs bu gru bzhi byed nas kyang 
BO_K12_D0667_H0634:190b-5	drag po ae yi nang du ni //	190b	drag po ae yi nang du ni 
BO_K12_D0667_H0634:190b-6	pho mo rabs chad thod pa'i nang //	190b	pho mo rabs chad thod ba nang 
BO_K12_D0667_H0634:190b-7	gzugs ni sbra tshil dag la bya //	190b	gzugs ni sbra tshil dag la byed 
BO_K12_D0667_H0634:190b-8	ming rus dag ni bkod nas kyang //	190b	ming rus dag ni bkod nas kyang 
BO_K12_D0667_H0634:190b-9	bsad dang na ba skabs dang sbyar //	190b	bsad dang na ba skabs dang sbyor 
BO_K12_D0667_H0634:190b-10	mgon po'i sku dang dam rdzas rnams //	190b	mgon po sku dang dam rdzas rnams 
BO_K12_D0667_H0634:190b-11	kha dang kha la dgod par bya //	190b	kha dang kha la god ba byed 
BO_K12_D0667_H0634:190b-12	phag thod nang du thun rdzas blugs //	190b	phag thod nang du thun rdzas blugs 
BO_K12_D0667_H0634:190b-13	rtag gtor rgyun gtor g-yas dang g-yon //	190b	rtag thor rgyun thor g-yas dang g-yon 
BO_K12_D0667_H0634:190b-14	gsang sngags 'di yis gsad par bya //	190b	gsang sngags di yis gsad ba byed 
BO_K12_D0667_H0634:190b-15	aom badzra ma h'a ka la kashim kshe tra bighn'am bi n'a ya ka h'um h'um phat/	190b	aom badzra ma ha ka la kashim kshe tra bighn bi na ya ka hum hum 
BO_K12_D0667_H0634:190b-16	aom ma h'a k'a l'a ya sh'a sa na au pa ha ri ni ae sha aa pa shtsi ma ka lo aa yam ai dam ratna tra ya aa pa ka ri nam ya di pra ti dzny'a sma ra si ta d'a ai dam du shtam kha kha kh'a	190b	aom ma ha ka la ya sha sa na au ba ha ri ni ae sha aa ba shtsi ma ka lo aa yam ai dam ratna tra ya aa ba ka ri nam ya di pra ti dznya sma ra si ta da ai dam du shtam kha kha kha 
BO_K12_D0667_H0634:190b-17	hi kh'a hi /	190b	hi kha hi 
BO_K12_D0667_H0634:190b-18	m'a ra m'a ra /	190b	ma ra ma ra 
BO_K12_D0667_H0634:190b-19	grihna grihna / bandha bandha /	190b	grihna grihna bandha bandha 
BO_K12_D0667_H0634:190b-20	ha na ha na /	190b	ha na ha na 
BO_K12_D0667_H0634:190b-21	da ha da ha /	190b	da ha da ha 
BO_K12_D0667_H0634:190b-22	pa tsa pa tsa /	190b	ba tsa ba tsa 
BO_K12_D0667_H0634:190b-23	de na me ke na dgra bo m'a ra ya h'um h'um phat phat/	190b	de na me ke na dgra bo ma ra ya hum hum phat 
BO_K12_D0667_H0634:190b-24	h'um bi n'a ya ka bi la sa tram bi hri h'um dza si ma bu bi n'a ya ka aa mu ka pri srog hur thums dza m'a ra ya rbad /	190b	hum bi na ya ka bi la sa tram bi hri hum dza si ma bu bi na ya ka aa mu ka pri srog hur thums dza ma ra ya rbod 
BO_K12_D0667_H0634:190b-25	drag sngags bzlas shing thun gyis brab //	190b	drag sngags bzlas shing thun gyis brab 
BO_K12_D0667_H0634:190b-26	zhag bdun bar du smra mi bya //	190b	zhag bdun ba du smra mi byed 
BO_K12_D0667_H0634:190b-27	de la rtags rnams rdzogs par 'gyur //	190b	de la rtags rnams rdzogs ba gyur 
BO_K12_D0667_H0634:190b-28	dpal nag po chen po'i rgyud las /	190b	dpal nag po chen po brgyud las 
BO_K12_D0667_H0634:190b-29	lus srog dbye ba'i le'u ste gsum pa'o ////	190b	lus srog byed ba leu ste gsum ba 
BO_K12_D0667_H0634:191a-0	de nas yang dag @191a *//	191a	de nas yang dag 
BO_K12_D0667_H0634:191a-1	bshad bya ba //	191a	chad byed ba 
BO_K12_D0667_H0634:191a-2	las mtha' sbyin sreg dag gis brtul //	191a	las mtha sbyin sreg dag gis brtul 
BO_K12_D0667_H0634:191a-3	gru gsum dbus su gdug pa'i shing //	191a	gru gsum dbus su gdug ba shing 
BO_K12_D0667_H0634:191a-4	dbus su nag po 'khor bcas bskyed; ;lingga gtor ma dam rdzas rnams //	191a	dbus su nag po khor cha bskyed; ;lingga thor ma dam rdzas rnams 
BO_K12_D0667_H0634:191a-5	nag po'i zhal du dbul bar bya //	191a	nag po zhal du bul ba byed 
BO_K12_D0667_H0634:191a-6	sngags 'di bzlas shing bsreg par bya //	191a	sngags di bzlas shing bsreg ba byed 
BO_K12_D0667_H0634:191a-7	aagni dzva la ram las rdzogs //	191a	aagni dzva la ram las rdzogs 
BO_K12_D0667_H0634:191a-8	thal ba rlung dmar dag la bskur //	191a	thal ba rlung dmar dag la skur 
BO_K12_D0667_H0634:191a-9	aa mu ka ni myur du rlog /	191a	aa mu ka ni myur du rlog 
BO_K12_D0667_H0634:191a-10	dpal nag po chen po'i rgyud las /	191a	dpal nag po chen po brgyud las 
BO_K12_D0667_H0634:191a-11	mtha' brtul ba'i le'u ste bzhi pa'o ////	191a	mtha brtul ba leu ste bzhi ba 
BO_K12_D0667_H0634:191a-12	de nas yang dag bshad bya ba //	191a	de nas yang dag chad byed ba 
BO_K12_D0667_H0634:191a-13	de ltar bsgrubs kyang ma grub na //	191a	de ltar sgrub kyang ma grub na 
BO_K12_D0667_H0634:191a-14	gcig dang gnyis la nan tan bskyed //	191a	gcig dang gnyis la nan tan skyed 
BO_K12_D0667_H0634:191a-15	de ltar byas kyang ma grub na //	191a	de ltar byed kyang ma grub na 
BO_K12_D0667_H0634:191a-16	sa gsum khrag gsum dug gsum la; ;khru gang pa yi gzugs kyi tshad //	191a	sa gsum khrag gsum dug gsum la; ;khru gang ba yi gzugs kyi tshad 
BO_K12_D0667_H0634:191a-17	gru gsum dbus su nag po'i gzugs //	191a	gru gsum dbus su nag po gzugs 
BO_K12_D0667_H0634:191a-18	spyi tshar dag tu lding du gzhug /	191a	spyi tshar dag tu lding du jug 
BO_K12_D0667_H0634:191a-19	bris sku dam rdzas bla rdo rnams //	191a	bri sku dam rdzas bla rdo rnams 
BO_K12_D0667_H0634:191a-20	rang gi gru gsum mal gyi 'og /	191a	rang gi gru gsum mal gyi g 
BO_K12_D0667_H0634:191a-21	dug dang tsher mas steng nas dgab //	191a	dug dang tsher mas steng nas gebs 
BO_K12_D0667_H0634:191a-22	thun rdzas brab cing sngags 'di bzlas //	191a	thun rdzas brab cing sngags di bzlas 
BO_K12_D0667_H0634:191a-23	aom badzra kro dha ha ya gri ba h'um hu lu hu lu h'um phat/	191a	aom badzra kro dha ha ya gri ba hum hu lu hu lu hum 
BO_K12_D0667_H0634:191a-24	phat h'um h'um ka ya n'a bi gh'am bi kra kshe kshim la k'a  h'a ma badzra aom//	191a	phat hum hum ka ya na bi gh bi kra kshe kshim la ka ha ma badzra 
BO_K12_D0667_H0634:191a-25	de skad brjod cing thun gyis brab //	191a	de skad rjod cing thun gyis brab 
BO_K12_D0667_H0634:191a-26	de la rtags rnams rdzogs pa dang // de nas gso ba'i cho ga bya //	191a	de la rtags rnams rdzogs ba dang de nas gso ba cho ga byed 
BO_K12_D0667_H0634:191a-27	bris sku bla rdo dam rdzas rnams //	191a	bri sku bla rdo dam rdzas rnams 
BO_K12_D0667_H0634:191b-0	spos @191b chus bkru zhing sngags 'di bzlas //	191b	spros chus khrud zhing sngags di bzlas 
BO_K12_D0667_H0634:191b-1	aom badzra ma h'a ka la kshim kshe tra bighn'i bi n'a ya ka h'um h'um phat sos sos sv'a h'a /	191b	aom badzra ma ha ka la kshim kshe tra bighn bi na ya ka hum hum phat sos sos sva ha 
BO_K12_D0667_H0634:191b-2	de skad byas la gnas su ni //	191b	de skad byed la gnas su ni 
BO_K12_D0667_H0634:191b-3	mgon po'i gzugs kyang spos chus bkru //	191b	mgon po gzugs kyang spros chus khrud 
BO_K12_D0667_H0634:191b-4	gru gsum dbus su blangs byas la //	191b	gru gsum dbus su blangs byed la 
BO_K12_D0667_H0634:191b-5	dgra bo'i ming rus snying gar gzhug /	191b	dgra bo ming rus snying gar jug 
BO_K12_D0667_H0634:191b-6	zhag bdun bsgrubs la dgra la bskyal //	191b	zhag bdun sgrub la dgra la skyel 
BO_K12_D0667_H0634:191b-7	aa mu ka ni myur du brlag //	191b	aa mu ka ni myur du brlag 
BO_K12_D0667_H0634:191b-8	dpal mgon bo nag po'i rgyud las /	191b	dpal mgon bo nag po brgyud las 
BO_K12_D0667_H0634:191b-9	ma grub na spogs pa'i cho ga dang gso ba'i le'u ste lnga pa'o ////	191b	ma grub na spogs ba cho ga dang gso ba leu ste lnga ba 
BO_K12_D0667_H0634:191b-10	de nas yang dag bshad bya ba //	191b	de nas yang dag chad byed ba 
BO_K12_D0667_H0634:191b-11	bya nag 'phur zhing lding ba dang // mon pa aa tsa ra dang ni //	191b	byed nag phur zhing lding ba dang mon ba aa tsa ra dang ni 
BO_K12_D0667_H0634:191b-12	dge bshes bandhe slob dpon dang // 'od dang sgra dang khang pa 'tsheg /	191b	dge bshes bandhe slob dpon dang d dang sgra dang khang ba tsheg 
BO_K12_D0667_H0634:191b-13	mgon po'i sku dag dngos su mthong //	191b	mgon po sku dag dngos su mthong 
BO_K12_D0667_H0634:191b-14	dgra la dmag drangs sems can bsad //	191b	dgra la dmag drangs sems can bsad 
BO_K12_D0667_H0634:191b-15	mi nag dag la snying stobs dang // mdze bo dang ni sprang po dang // bya nag thang la lhung ba 'byung //	191b	mi nag dag la snying stobs dang mdze bo dang ni sprang po dang byed nag thang la lhung ba byung 
BO_K12_D0667_H0634:191b-16	dpal mgon po nag po'i rgyud las /	191b	dpal mgon po nag po brgyud las 
BO_K12_D0667_H0634:191b-17	rtags kyi rim ba'i le'u ste drug pa'o ////	191b	rtags kyi rim ba leu ste drug ba 
BO_K12_D0667_H0634:191b-18	de nas yang dag bshad bya ba //	191b	de nas yang dag chad byed ba 
BO_K12_D0667_H0634:191b-19	ser ba dbab pa'i las bya na //	191b	ser ba bebs ba las byed na 
BO_K12_D0667_H0634:191b-20	mon nam mdze can thod pa ru //	191b	mon nam mdze can thod ba ru 
BO_K12_D0667_H0634:191b-21	'khor lo rtsibs bzhi bris nas kyang //	191b	khor lo rtsibs bzhi bri nas kyang 
BO_K12_D0667_H0634:191b-22	rigs lnga klu yi sa bon dgod //	191b	rigs lnga klu yi sa bon god 
BO_K12_D0667_H0634:191b-23	rtsibs mchan ser srung ming rus dang // yul du phob ces bya ba bri //	191b	rtsibs mchan ser srung ming rus dang yul du phob ces byed ba bri 
BO_K12_D0667_H0634:191b-24	de mthar 'khor lo rtsibs dgu la //	191b	de mthar khor lo rtsibs dgu la 
BO_K12_D0667_H0634:192a-0	dregs @192a *// pa'i sngags dag bri bar bya //	192a	dregs ba sngags dag bri ba byed 
BO_K12_D0667_H0634:192a-1	rgyab tu gang yin yul ming dang // rlung gi snying po bri bar bya //	192a	rgyab tu gang yin yul ming dang rlung gi snying po bri ba byed 
BO_K12_D0667_H0634:192a-2	bdag nyid padma khros par bsgom //	192a	bdag nyid padma khro ba bsgom 
BO_K12_D0667_H0634:192a-3	gsang sngags 'di yis gnad la bor //	192a	gsang sngags di yis gnad la bor 
BO_K12_D0667_H0634:192a-4	aom badzra ma h'a k'a la kshi kshe tra bi ghn'am bi n'a ya ka h'um h'um phat/	192a	aom badzra ma ha ka la kshi kshe tra bi ghn bi na ya ka hum hum 
BO_K12_D0667_H0634:192a-5	n'a ga snying gzer /	192a	na ga snying gzer 
BO_K12_D0667_H0634:192a-6	phu hur thums dza khrom shar hril bhyo //	192a	phu hur thums dza khrom char hril bhyo 
BO_K12_D0667_H0634:192a-7	de skad ces ni rab brjod la //	192a	de skad ces ni rab rjod la 
BO_K12_D0667_H0634:192a-8	nyungs kar nyungs nag ske tshe dang // khrag dang dug gis thod par brab //	192a	nyungs kar nyungs nag ske tshe dang khrag dang dug gis thod ba brab 
BO_K12_D0667_H0634:192a-9	lo 'bras rlung khyer rtags byung na //	192a	lo bras rlung khyer rtags byung na 
BO_K12_D0667_H0634:192a-10	dgra yi yul du dbab par bya //	192a	dgra yi yul du bebs ba byed 
BO_K12_D0667_H0634:192a-11	gal te 'jig rten phung ba'o /	192a	gal te jig rten phung ba 
BO_K12_D0667_H0634:192a-12	dpal mgon po nag po'i rgyud las /	192a	dpal mgon po nag po brgyud las 
BO_K12_D0667_H0634:192a-13	ser ba dbab pa'i le'u ste bdun pa'o ////	192a	ser ba bebs ba leu ste bdun ba 
BO_K12_D0667_H0634:192a-14	de nas yang dag nges gsungs pa //	192a	de nas yang dag nges gsungs ba 
BO_K12_D0667_H0634:192a-15	ae ma 'khor 'dus ngo mtshar can //	192a	ae ma khor du ngo mtshar can 
BO_K12_D0667_H0634:192a-16	ma 'ongs dam can sgrub byed na //	192a	ma ngs dam can sgrub byed na 
BO_K12_D0667_H0634:192a-17	dam tshig la gnas sdom pa gzung //	192a	dam tshig la gnas sdom ba gzung 
BO_K12_D0667_H0634:192a-18	gtor ma dag la brtson par bya //	192a	thor ma dag la brtson ba byed 
BO_K12_D0667_H0634:192a-19	dam rdzas bla rdo lus la bsrel //	192a	dam rdzas bla rdo lus la bsrel 
BO_K12_D0667_H0634:192a-20	zhes gsungs pas rgyal po mig mi bzang la sogs pa'i 'khor rnams yid rangs nas nag po chen pos bstan pa srung bar khas blangs nas mi snang bar gyur to; ;dpal nag po chen po'i rgyud las /	192a	zhes gsungs ba rgyal po mig mi bzang la sogs ba khor rnams yid rangs nas nag po chen pos ston ba srung ba khas blangs nas mi snang ba gyur to; ;dpal nag po chen po brgyud las 
BO_K12_D0667_H0634:192a-21	le'u brgyad pa rdzogs so ////	192a	leu brgyad ba rdzogs so 
BO_K12_D0667_H0634:192b-0	rgya gar gyi mkhan po aa mo gha badzra dang / bod kyi lo ts'a ba phur bu @192b 'od kyis bsgyur ba'o ////	192b	rgya gar gyi mkhan po aa mo gha badzra dang bod kyi lo tsa ba phur bu d kyis sgyur ba 
