segmentnr	original	folio	stemmed
BO_NG_0432:0	#// dpal kun tu bzang po la phyag 'tshal lo //	0	dpal kun tu bzang po la phyag tshal lo 
BO_NG_0432:1	'di skad bshad pa'i dus gcig na //	0	di skad chad ba dus gcig na 
BO_NG_0432:2	rang byung ji bzhin bde chen po //	0	rang byung ji bzhin bde chen po 
BO_NG_0432:3	zab mo rang rig bsam mi khyab //	0	zab mo rang rig bsam mi khyab 
BO_NG_0432:4	ma bcos gsang ba rdzogs pa'i bdag / lhun grub ngang la bzhugs par gyur //	0	ma chos gsang ba rdzogs ba bdag lhun grub ngang la bzhugs ba gyur 
BO_NG_0432:5	sangs rgyas sems can thams cad dang *// snang srid rjes lta mtha' yas pa //	0	sangs rgya sems can thams cad dang snang srid rjes lta mtha yas ba 
BO_NG_0432:6	dus gsum 'byed med gcig pa'i phyir //	0	dus gsum byed med gcig ba phyir 
BO_NG_0432:7	thig le rdzogs par 'dus te gnas //	0	thig le rdzogs ba du te gnas 
BO_NG_0432:8	de tshe sems dpa' rdo rje yis //	0	de tshe sems dpa rdo rje yis 
BO_NG_0432:9	rab tu gsal la mi g.yo bas //	0	rab tu gsal la mi g.yo ba 
BO_NG_0432:10	mi rtsol ji bzhin 'dun pa las //	1	mi rtsol ji bzhin dun ba las 
BO_NG_0432:11	bsam gyis mi khyab dgongs par zhus //	1	bsam gyis mi khyab dgongs ba zhus 
BO_NG_0432:12	bde chen rig pa'i rgyal po nyid //	1	bde chen rig ba rgyal po nyid 
BO_NG_0432:13	ji bzhin ma bcos dgongs pa'i brdas //	1	ji bzhin ma chos dgongs ba brda 
BO_NG_0432:14	skal ldan don du gtan la phab //	1	skal ldan don du gtan la bebs 
BO_NG_0432:15	'da' med bde chen dam la gnas //	1	da med bde chen dam la gnas 
BO_NG_0432:9-0	dang 19@#// por rna rgyud gdams pa'i lung *//	9	dang por rna brgyud doms ba lung 
BO_NG_0432:9-1	rin chen gus pas nod par bya //	9	rin chen gus ba nod ba byed 
BO_NG_0432:9-2	rin chen 'od kyi bstan pa'am //	9	rin chen d kyi ston ba 
BO_NG_0432:9-3	rtsi bcud bung bas bzhibs pa ltar //	9	rtsi bcud bung ba jib ba ltar 
BO_NG_0432:9-4	ma lus snying po thugs chud nas //	9	ma lus snying po thugs chud nas 
BO_NG_0432:9-5	de nas so bzhag nyams pa med //	9	de nas so jog nyams ba med 
BO_NG_0432:9-6	don mthong rig pa cha sbyangs pas //	9	don mthong rig ba cha sbyong ba 
BO_NG_0432:9-7	snang gsum rdzogs chen rgyas btab la //	9	snang gsum rdzogs chen rgya debs la 
BO_NG_0432:9-8	thig le rdzogs par gnas par bya //	9	thig le rdzogs ba gnas ba byed 
BO_NG_0432:9-9	rang sems nges ba'i don rtogs pas //	9	rang sems nges ba don rtogs ba 
BO_NG_0432:9-10	nges par don la 'da' med pa'o //	9	nges ba don la da med ba 
BO_NG_0432:9-11	gdams pa'i rnam grangs ci bstan pa //	9	doms ba rnam grangs ci ston ba 
BO_NG_0432:9-12	kun gyi nges don ston pa yin //	9	kun gyi nges don ston ba yin 
BO_NG_0432:9-13	bla ma'i gdam ngag lung med cing *//	9	bla ma gdam ngag lung med cing 
BO_NG_0432:9-14	rna brgyud dgongs pa mi ldan pas //	9	rna brgyud dgongs ba mi ldan ba 
BO_NG_0432:9-15	gang bstan log ba'i khams su 'gyur //	9	gang ston log ba khams su gyur 
BO_NG_0432:9-16	de bas gdams ngag thob par bya //	9	de ba doms ngag thob ba byed 
BO_NG_0432:9-17	nges par thob par shes pa yis //	9	nges ba thob ba shes ba yis 
BO_NG_0432:9-18	de dag don las mi 'da' yang //	9	de dag don las mi da yang 
BO_NG_0432:9-19	rin chen gling la bgrod pa'am //	9	rin chen gling la bgrod ba 
BO_NG_0432:9-20	mun pa 'od dang phrad pa ltar //	9	mun ba d dang phrad ba ltar 
BO_NG_0432:9-21	gzhi gcig stobs kyis khyad par 'phags //	9	gzhi gcig stobs kyis khyad ba phag 
BO_NG_0432:9-22	du bzhi thog ma dang po nas //	9	du bzhi thogs ma dang po nas 
BO_NG_0432:9-23	'khrul bcad brtags pa rnam par bzlog //	9	khrul gcod rtog ba rnam ba bzlog 
BO_NG_0432:9-24	dbang po goms pa che chung gis //	9	dbang po goms ba che chung gis 
BO_NG_0432:9-25	mi gnas pa dang cung zad gnas //	9	mi gnas ba dang cung zad gnas 
BO_NG_0432:9-26	yun rings dal bas 'bab chu 'dra //	9	yun dring dal ba bab chu dra 
BO_NG_0432:9-27	de la ye shes ma btsal na //	9	de la ye shes ma btsal na 
BO_NG_0432:9-28	bar chad med pa'i brtson 'grus kyis //	9	ba chad med ba brtson grus kyis 
BO_NG_0432:9-29	'bab chu lta bur gnas gyur na //	9	bab chu lta bur gnas gyur na 
BO_NG_0432:9-30	rgya mtsho lta bur mi g.yo ba //	9	rgya mtsho lta bur mi g.yo ba 
BO_NG_0432:9-31	mkha' gsal 'od kyis brdal ba ltar //	9	mkha gsal d kyis rdal ba ltar 
BO_NG_0432:9-32	dus 'tshams med par gnas par 'gyur //	9	dus tshams med ba gnas ba gyur 
BO_NG_0432:9-33	dus gcig 'jug pas rnal 'byor pas //	9	dus gcig jug ba rnal byor ba 
BO_NG_0432:9-34	man ngag nges pa'i lung thob nas //	9	man ngag nges ba lung thob nas 
BO_NG_0432:9-35	rgya mtsho 'od kyis phog pa'am //	9	rgya mtsho d kyis bogs ba 
BO_NG_0432:9-36	mkha' la nyi 'od 'bar ba ltar //	9	mkha la nyi d bar ba ltar 
BO_NG_0432:9-37	de ma thag par lhun gyis grub //	9	de ma thag ba lhun gyis grub 
BO_NG_0432:9-38	thag gu sbrul mthong sel ba ltar //	9	thag gu sbrul mthong sel ba ltar 
BO_NG_0432:9-39	nges pa thob pas dbugs chen phyin //	9	nges ba thob ba dbugs chen phyin 
BO_NG_0432:9-40	ma btsal lhun bzhag rnal 'byor pas //	9	ma btsal lhun jog rnal byor ba 
BO_NG_0432:9-41	thun dang mnyam gzhag rtsir med pas //	9	thun dang mnyam jog rtsir med ba 
BO_NG_0432:9-42	dus gcig mi g.yo rnal 'byor thob //	9	dus gcig mi g.yo rnal byor thob 
BO_NG_0432:9-43	'on kyang ma yengs gzhi gcig la //	9	n kyang ma yengs gzhi gcig la 
BO_NG_0432:9-44	rnam pa'i bye brag cir 'gyur ba //	9	rnam ba bye brag cir gyur ba 
BO_NG_0432:9-45	ye shes srog gsum 'gyur ba med //	9	ye shes srog gsum gyur ba med 
BO_NG_0432:9-46	mtshan ma chu dang rlabs bzhin nam //	9	mtshan ma chu dang rlabs bzhin nam 
BO_NG_0432:9-47	bcud dang snying po rnam pa'am //	9	bcud dang snying po rnam ba 
BO_NG_0432:9-48	mkha' yi cho 'phrul ji lta bar //	9	mkha yi cho phrul ji lta ba 
BO_NG_0432:9-49	ma btsal rang bzhin g.yo mi 'gyur //	9	ma btsal rang bzhin g.yo mi gyur 
BO_NG_0432:9-50	gang dag thugs rje'i ngang yin pas //	9	gang dag thugs rje ngang yin ba 
BO_NG_0432:9-51	gang la dga' ba'i don ched du //	9	gang la dga ba don ched du 
BO_NG_0432:9-52	ye shes mtshon sgor ma gyur pa //	9	ye shes mtshon sgor ma gyur ba 
BO_NG_0432:9-53	cung zad tsam yang yod ma yin //	9	cung zad tsam yang yod ma yin 
BO_NG_0432:9-54	kun kyang ye shes nyid rtogs pas //	9	kun kyang ye shes nyid rtogs ba 
BO_NG_0432:9-55	lcags la thabs kyis mdzad pa ltar //	9	lcags la thabs kyis mdzad ba ltar 
BO_NG_0432:9-56	man ngag thabs kyis pha rol phyin //	9	man ngag thabs kyis pha rol phyin 
BO_NG_0432:9-57	gang yang g.yang sa lam du bde //	9	gang yang g.yang sa lam du bde 
BO_NG_0432:9-58	bde sdug gang yang mi 'dor na //	9	bde sdug gang yang mi dor na 
BO_NG_0432:9-59	de dag len par ga la yin //	9	de dag len ba ga la yin 
BO_NG_0432:9-60	dang po rang bzhin bstan pa ste //	9	dang po rang bzhin ston ba ste 
BO_NG_0432:9-61	gnyis pa rig pas phrad pa yin //	9	gnyis ba rig ba phrad ba yin 
BO_NG_0432:9-62	gsum pa gzungs dang ldan pa ste //	9	gsum ba gzungs dang ldan ba ste 
BO_NG_0432:9-63	bzhi pa gtang snyoms chen po yin //	9	bzhi ba gtong snyom chen po yin 
BO_NG_0432:9-64	lnga pa 'bab chu lta bu ste //	9	lnga ba bab chu lta bu ste 
BO_NG_0432:9-65	drug pa mkha' la nyi shar bzhin //	9	drug ba mkha la nyi char bzhin 
BO_NG_0432:9-66	mi 'da' 'byed pa med pa'o //	9	mi da byed ba med ba 
BO_NG_0432:9-67	bdun pa rin chen gling phyin te //	9	bdun ba rin chen gling phyin te 
BO_NG_0432:9-68	brgyad pa rin chen lhun @#//	9	brgyad ba rin chen lhun 
BO_NG_0432:9-69	rdzogs sam // nyi ma'i 'od dang snying po ltar //	9	rdzogs sam nyi ma d dang snying po ltar 
BO_NG_0432:9-70	bdag gzhan don kun rdzogs par gnas //	9	bdag gzhan don kun rdzogs ba gnas 
BO_NG_0432:9-71	rin chen gzhi la 'gyur med kyang *//	9	rin chen gzhi la gyur med kyang 
BO_NG_0432:9-72	dbang po shes rab goms tshul gyis //	9	dbang po shes rab goms tshul gyis 
BO_NG_0432:9-73	rin chen sel dang bral ba ltar //	9	rin chen sel dang bral ba ltar 
BO_NG_0432:9-74	goms pa'i shugs kyis grub pa yin //	9	goms ba shugs kyis grub ba yin 
BO_NG_0432:9-75	dang por mos dang ldan pa ste //	9	dang por mos dang ldan ba ste 
BO_NG_0432:9-76	gnyis par mi g.yo rtse gcig pa //	9	gnyis ba mi g.yo rtse gcig ba 
BO_NG_0432:9-77	gsum pa 'brel bas bar chad med //	9	gsum ba brel ba ba chad med 
BO_NG_0432:9-78	bzhi pa rang yang lhug pa yin //	9	bzhi ba rang yang lhug ba yin 
BO_NG_0432:9-79	lnga pa gang yang 'brel med spyad //	9	lnga ba gang yang brel med spyod 
BO_NG_0432:9-80	drug pa glang po dogs med nyid //	9	drug ba glang po dogs med nyid 
BO_NG_0432:9-81	srog ldan nyam nga re dogs med //	9	srog ldan nyam nga re dogs med 
BO_NG_0432:9-82	bdun pa thams cad dag pa'i phyir //	9	bdun ba thams cad dag ba phyir 
BO_NG_0432:9-83	bya dang mi bya cung zad med //	9	byed dang mi byed cung zad med 
BO_NG_0432:9-84	brgyad pa lhun rdzogs spyod pa ste //	9	brgyad ba lhun rdzogs spyod ba ste 
BO_NG_0432:9-85	srog ldan ji bzhin rnal 'byor pas //	9	srog ldan ji bzhin rnal byor ba 
BO_NG_0432:9-86	thabs ldan rig stobs khyad par du //	9	thabs ldan rig stobs khyad ba du 
BO_NG_0432:9-87	gang gyur ma yengs spyad par bya //	9	gang gyur ma yengs spyod ba byed 
BO_NG_0432:9-88	mi 'gyur bral na rang bzhin btang *//	9	mi gyur bral na rang bzhin gtong 
BO_NG_0432:9-89	nges bral rtsol tha mal sems //	9	nges bral rtsol tha mal sems 
BO_NG_0432:9-90	ngos can mthar 'dzin log sred can //	9	ngos can mthar dzin log sred can 
BO_NG_0432:9-91	ched byas rtsol dang grub pa dang *// zin chags blang dor dgag sgrub dang *// zhen dang 'gog dang phyal ba dang *// btang snyoms yod dang med pa dag / mi dor rgyu med rang bzhin btang *//	9	ched byed rtsol dang grub ba dang zin chags blang dor gog sgrub dang zhen dang gog dang phyal ba dang gtong snyom yod dang med ba dag mi dor rgyu med rang bzhin gtong 
BO_NG_0432:9-92	thogs chags med pa'i ye shes kyis //	9	thogs chags med ba ye shes kyis 
BO_NG_0432:9-93	phyogs bral ye shes chen pos rgyas //	9	phyogs bral ye shes chen pos rgya 
BO_NG_0432:9-94	rig pa rdzogs pa gting dpag med //	9	rig ba rdzogs ba gting dpog med 
BO_NG_0432:9-95	myong ba bde ba'i rang bzhin te //	9	myong ba bde ba rang bzhin te 
BO_NG_0432:9-96	rtog spyod rgyu ba bral ba yis //	9	rtogs spyod rgyu ba bral ba yis 
BO_NG_0432:9-97	bsam med dran med sal le ba //	9	bsam med dran med sal le ba 
BO_NG_0432:9-98	ting 'dzin shes rab rdzogs pa ste //	9	ting dzin shes rab rdzogs ba ste 
BO_NG_0432:9-99	lhag pa'i slab pa kun rdzogs pa'o //	9	lhag ba slab ba kun rdzogs ba 
BO_NG_0432:9-100	nam mkha' rdo rje 'gro 'dul thabs //	9	nam mkha rdo rje gro dul thabs 
BO_NG_0432:9-101	ji snyed spyod pa mdor bsdus pa //	9	ji snyed spyod ba mdor sdud ba 
BO_NG_0432:9-102	dang po nas gzung mthar thug bar //	9	dang po nas gzung mthar thug ba 
BO_NG_0432:9-103	khyab pas dgongs pas spyod pa yin //	9	khyab ba dgongs ba spyod ba yin 
BO_NG_0432:9-104	ji snyed rgyal ba thams cad kyi //	9	ji snyed rgyal ba thams cad kyi 
BO_NG_0432:9-105	sku gsung thugs kyi ngo bo ni //	9	sku gsung thugs kyi ngo bo ni 
BO_NG_0432:9-106	bde chen rig pa'i ye shes te //	9	bde chen rig ba ye shes te 
BO_NG_0432:9-107	ma lus mkha' ltar khyab pa yin //	9	ma lus mkha ltar khyab ba yin 
BO_NG_0432:9-108	'di dag nges par thugs phrad du //	9	di dag nges ba thugs phrad du 
BO_NG_0432:9-109	nges par bstan gyis shes par gyis //	9	nges ba ston gyis shes ba gyis 
BO_NG_0432:9-110	de dag rtogs goms de phyin chad //	9	de dag rtogs goms de phyin chad 
BO_NG_0432:9-111	bul po gter dang phrad pa ltar //	9	bul po gter dang phrad ba ltar 
BO_NG_0432:9-112	bde bar gnas nas bcings par grol /	9	bde ba gnas nas ching ba grol 
BO_NG_0432:9-113	khyung phrug spubs dang bral ba'am //	9	khyung phrug spub dang bral ba 
BO_NG_0432:9-114	seng ge dong thag bkrol ba ltar //	9	seng ge dong thag grol ba ltar 
BO_NG_0432:9-115	nyi 'od sprin dang bral ba ltar //	9	nyi d sprin dang bral ba ltar 
BO_NG_0432:9-116	phyin chad stobs dang ldan pa yin //	9	phyin chad stobs dang ldan ba yin 
BO_NG_0432:9-117	'dod pa'i dngos po gang mthong tshor //	9	dod ba dngos po gang mthong tshor 
BO_NG_0432:9-118	bde chen rdzogs pa'i ngo bor gnas //	9	bde chen rdzogs ba ngo bor gnas 
BO_NG_0432:9-119	'di dag ye shes rdzogs pa'i phyir //	9	di dag ye shes rdzogs ba phyir 
BO_NG_0432:9-120	ma nyams rig pa'i ngang las spyod //	9	ma nyams rig ba ngang las spyod 
BO_NG_0432:9-121	shes rab ma lus gcig la rdzogs //	9	shes rab ma lus gcig la rdzogs 
BO_NG_0432:9-122	gcig po rig pas ngos bzung na //	9	gcig po rig ba ngos bzung na 
BO_NG_0432:9-123	theg pa'i rnam grangs ma lus pa //	9	theg ba rnam grangs ma lus ba 
BO_NG_0432:9-124	dus gcig rdzogs par rtogs gyur nas //	9	dus gcig rdzogs ba rtogs gyur nas 
BO_NG_0432:9-125	ma yengs gzhag pas grol ba yin //	9	ma yengs jog ba grol ba yin 
BO_NG_0432:9-126	'dul ba'i dus na bsams pa bzhin //	9	dul ba dus na bsams ba bzhin 
BO_NG_0432:9-127	thugs rje 'gro 'ong med par bdal //	9	thugs rje gro ng med ba gdal 
BO_NG_0432:9-128	dngos grub thogs med lhun rdzogs kyis //	9	dngos grub thogs med lhun rdzogs kyis 
BO_NG_0432:9-129	zhes bcom ldan 'das bde ba chen po rig pa'i rgyal po rdo rje sems dpas gsungs nas de bzhin nyid du gnas par gyur to //	9	zhes joms ldan da bde ba chen po rig ba rgyal po rdo rje sems dpas gsungs nas de bzhin nyid du gnas ba gyur to 
BO_NG_0432:9-130	man ngag @#// rig pa klong rdzogs kyi rgyud rdzogs so ///	9	man ngag rig ba klong rdzogs kyi brgyud rdzogs so 
BO_NG_0432:9-131	/ dge slong bai ro tsa na la //	9	dge slong bai ro tsa na la 
BO_NG_0432:9-132	rdo rje sems dpa'i thugs kyi gter //	9	rdo rje sems dpa thugs kyi gter 
BO_NG_0432:9-133	mkhas pa'i gdams ngag brgyud pa 'di //	9	mkhas ba doms ngag brgyud ba di 
BO_NG_0432:9-134	rdo rje yang dag rtsal la sogs //	9	rdo rje yang dag rtsal la sogs 
BO_NG_0432:9-135	skal ldan re las ma gtogs pa //	9	skal ldan re las ma gtogs ba 
BO_NG_0432:9-136	gcig la mi snub gnyis la mi spel te //	9	gcig la mi snub gnyis la mi spel te 
BO_NG_0432:9-137	thugs kyi gter du bcang zhing sems la bslan ///	9	thugs kyi gter du chang zhing sems la bslan 
