segmentnr	original	stemmed
BO_T11_D4266:124a-17	de ni med par 'grub mi 'gyur //	de ni med ba grub mi gyur 
BO_T11_D4266:124a-18	sngar bshad pa yi rim pa yis //	sngar chad ba yi rim ba yis 
BO_T11_D4266:124a-19	rig byed byed pa po bsgrubs pas //	rig byed byed ba po sgrub ba 
BO_T11_D4266:124a-20	khyed kyis dbang 'das mthong ba yis //	khyed kyis dbang da mthong ba yis 
BO_T11_D4266:124a-21	gdon mi za bar khas blang dgos //	don mi za ba khas blang dgos 
BO_T11_D4266:124a-22	des na shes rab can skyes bus //	des na shes rab can skye bud 
BO_T11_D4266:124a-23	don phra rnams mthong nus pa yin //	don phra rnams mthong nus ba yin 
BO_T11_D4266:124a-24	rang gi rigs can spangs nas kyang //	rang gi rigs can spong nas kyang 
BO_T11_D4266:124a-25	mi gzhan zil gyis gnon pa yin //	mi gzhan zil gyis gnon ba yin 
BO_T11_D4266:124a-26	ji ltar 'gro dang sbyor sogs pa'i //	ji ltar gro dang sbyor sogs ba 
BO_T11_D4266:124a-27	khyad par gyis ni sna tshogs pa'i //	khyad ba gyis ni sna tshogs ba 
BO_T11_D4266:124a-28	nus pa rang yul khyad can 'gyur //	nus ba rang yul khyad can gyur 
BO_T11_D4266:124a-29	de bzhin yid kyang 'gyur ba yin //	de bzhin yid kyang gyur ba yin 
BO_T11_D4266:124a-30	'di ltar bya rgod rnams kyis ni //	di ltar byed rgod rnams kyis ni 
BO_T11_D4266:124a-31	gzugs ni shin tu ring nas mthong //	gzugs ni shin tu ring nas mthong 
BO_T11_D4266:124a-32	grub pa'i mig sman sogs rnams kyis //	grub ba mig sman sogs rnams kyis 
BO_T11_D4266:124a-33	de bzhin bsgribs pa'i gter sogs kyang //	de bzhin sgrib ba gter sogs kyang 
BO_T11_D4266:124a-34	de ltar 'gro ba'i khyad par gyis //	de ltar gro ba khyad ba gyis 
BO_T11_D4266:124a-35	lta la sogs pa rnams kyis ni //	lta la sogs ba rnams kyis ni 
BO_T11_D4266:124a-36	phra dang bsgribs sogs mthong yin te //	phra dang sgrib sogs mthong yin te 
BO_T11_D4266:124a-37	rang gi rig pa rjes mthun phyir //	rang gi rig ba rjes mthun phyir 
BO_T11_D4266:124a-38	rnal 'byor goms pa'i khyad par gyis //	rnal byor goms ba khyad ba gyis 
BO_T11_D4266:124a-39	rnal 'byor rnams kyi yod shes ni //	rnal byor rnams kyi yod shes ni 
BO_T11_D4266:124a-40	de ltar phul byung dngos 'gyur bas //	de ltar bul byung dngos gyur ba 
BO_T11_D4266:124a-41	'dir ni gnod pa can yod min //	dir ni gnod ba can yod min 
BO_T11_D4266:124a-42	gal te 'gro dang sbyor sogs ni //	gal te gro dang sbyor sogs ni 
BO_T11_D4266:124a-43	med pas shes la khyad spong na //	med ba shes la khyad spong na 
BO_T11_D4266:124a-44	de tshe khyed kyis de rigs yin //	de tshe khyed kyis de rigs yin 
BO_T11_D4266:124a-45	rgyu med pas ni 'bras med phyir //	rgyu med ba ni bras med phyir 
BO_T11_D4266:124a-46	ji ltar bstan bcos gzhan shes pas //	ji ltar ston chos gzhan shes ba 
BO_T11_D4266:124a-47	de tsam gyis ni shes 'gyur min //	de tsam gyis ni shes gyur min 
BO_T11_D4266:124a-48	de'i rgyu phyi ma phyi ma ni //	de rgyu phyi ma phyi ma ni 
BO_T11_D4266:124a-49	med pas phul byung yang de bzhin //	med ba bul byung yang de bzhin 
BO_T11_D4266:124a-50	phyogs gcig rnam par shes pas na //	phyogs gcig rnam ba shes ba na 
BO_T11_D4266:124a-51	kun mkhyen yod par smra ba yin //	kun mkhyen yod ba smra ba yin 
BO_T11_D4266:124a-52	gang gis rigs byed sogs shes par //	gang gis rigs byed sogs shes ba 
BO_T11_D4266:124b-0	@124b mtho ris sogs ni mngon sum 'gyur //	mtho ris sogs ni mngon sum gyur 
BO_T11_D4266:124b-1	'on kyang shes rab brtse sogs ni //	n kyang shes rab brtse sogs ni 
BO_T11_D4266:124b-2	goms pas 'phel bar mthong ba'i phyir //	goms ba phel ba mthong ba phyir 
BO_T11_D4266:124b-3	de ni 'phel bar 'gyur bas na //	de ni phel ba gyur ba na 
BO_T11_D4266:124b-4	phul byung gzhan yang rtogs par 'gyur //	bul byung gzhan yang rtogs ba gyur 
BO_T11_D4266:124b-5	yid kyi yon tan nyid kyis ni //	yid kyi yon tan nyid kyis ni 
BO_T11_D4266:124b-6	de dag rab kyi mthar thug yin //	de dag rab kyi mthar thug yin 
BO_T11_D4266:124b-7	mi smod bzhin de yang goms pas //	mi smod bzhin de yang goms ba 
BO_T11_D4266:124b-8	ma lus don rtogs phyir mthar thug / chos kun rtogs pa'i ngo bo ni //	ma lus don rtogs phyir mthar thug chos kun rtogs ba ngo bo ni 
BO_T11_D4266:124b-9	shes rab mtshan nyid kyis ni gnas //	shes rab mtshan nyid kyis ni gnas 
BO_T11_D4266:124b-10	gcig ni yongs su ma shes na //	gcig ni yongs su ma shes na 
BO_T11_D4266:124b-11	de nyid rdzogs par mi 'gyur ro //	de nyid rdzogs ba mi gyur ro 
BO_T11_D4266:124b-12	gang dag rigs mthun snga ma yi //	gang dag rigs mthun snga ma yi 
BO_T11_D4266:124b-13	sa bon las ni 'byung 'gyur ba //	sa bon las ni byung gyur ba 
BO_T11_D4266:124b-14	'dus byas 'phel ba'i bye brag gis //	du byed phel ba bye brag gis 
BO_T11_D4266:124b-15	de dag 'phel ba'i chos ldan par //	de dag phel ba chos ldan ba 
BO_T11_D4266:124b-16	srid pa yin te 'bru sogs bzhin //	srid ba yin te bru sogs bzhin 
BO_T11_D4266:124b-17	brtse ba dang ni blo dag kyang //	brtse ba dang ni blo dag kyang 
BO_T11_D4266:124b-18	ji skad bshad pa'i chos ldan yin //	ji skad chad ba chos ldan yin 
BO_T11_D4266:124b-19	'phel bas kun mkhyen nyid du 'gyur //	phel ba kun mkhyen nyid du gyur 
BO_T11_D4266:124b-20	gang dag gnyen po nyer gnas na //	gang dag gnyen po nyer gnas na 
BO_T11_D4266:124b-21	'grib pa'i chos dang gang ldan pa ;	grib ba chos dang gang ldan ba 
BO_T11_D4266:124b-22	/ de dag shin tu 'grib pa srid //	de dag shin tu grib ba srid 
BO_T11_D4266:124b-23	gser gyi dri ma la sogs bzhin //	gser gyi dri ma la sogs bzhin 
BO_T11_D4266:124b-24	de ltar nyon mongs pa dang ni //	de ltar nyon mongs ba dang ni 
BO_T11_D4266:124b-25	shes bya'i sgrib sogs 'di dag ni //	shes byed sgrib sogs di dag ni 
BO_T11_D4266:124b-26	ji skad bshad pa'i chos ldan yin //	ji skad chad ba chos ldan yin 
BO_T11_D4266:124b-27	de med dri med blo 'byung 'gyur //	de med dri med blo byung gyur 
BO_T11_D4266:124b-28	yang na ji skad bshad chos ldan //	yang na ji skad chad chos ldan 
BO_T11_D4266:124b-29	de dag shin tu rtsa 'byin la //	de dag shin tu rtsa byin la 
BO_T11_D4266:124b-30	dri ma med pa'i nus yod pa'i //	dri ma med ba nus yod ba 
BO_T11_D4266:124b-31	de bzhin gnyen po srid pa yin //	de bzhin gnyen po srid ba yin 
BO_T11_D4266:124b-32	de nyid lta ba'i gegs nyid phyir //	de nyid lta ba gegs nyid phyir 
BO_T11_D4266:124b-33	la lar shin tu 'grib pa can //	la lar shin tu grib ba can 
BO_T11_D4266:124b-34	phyi rol nyid kyis mun pa bzhin //	phyi rol nyid kyis mun ba bzhin 
BO_T11_D4266:124b-35	nang gi yang ni rtogs par 'gyur //	nang gi yang ni rtogs ba gyur 
BO_T11_D4266:124b-36	de ni 'grib par 'gyur ba dang / thogs med ye shes chen po ni //	de ni grib ba gyur ba dang thogs med ye shes chen po ni 
BO_T11_D4266:124b-37	shes bya thams cad kyi tshogs la //	shes byed thams cad kyi tshogs la 
BO_T11_D4266:124b-38	rang dbang gis ni 'jug par 'gyur //	rang dbang gis ni jug ba gyur 
BO_T11_D4266:124b-39	gang dag brtan pa'i rten gnas pa //	gang dag brtan ba rten gnas ba 
BO_T11_D4266:124b-40	ci zhig gis ni khyad par byas //	ci jig gis ni khyad ba byed 
BO_T11_D4266:124b-41	gnod can med na de dngos ni //	gnod can med na de dngos ni 
BO_T11_D4266:124b-42	thob phyir slar 'bad ltos pa min //	thob phyir slar bad ltos ba min 
BO_T11_D4266:124b-43	de dag 'dus byas 'phel ba yi //	de dag du byed phel ba yi 
BO_T11_D4266:124b-44	dbye bas gsal ba'i rab kyi mthar//	byed ba gsal ba rab kyi 
BO_T11_D4266:124b-45	'jug par 'gyur ba srid pa yin //	jug ba gyur ba srid ba yin 
BO_T11_D4266:124b-46	gser gyi rnam par dag pa yin //	gser gyi rnam ba dag ba yin 
BO_T11_D4266:124b-47	blo dang brtse ba la sogs pa //	blo dang brtse ba la sogs ba 
BO_T11_D4266:124b-48	'di dag ji skad bshad chos ldan //	di dag ji skad chad chos ldan 
BO_T11_D4266:124b-49	de dag rab kyi mthar phyin pa //	de dag rab kyi mthar phyin ba 
BO_T11_D4266:124b-50	'od gsal kun mkhyen nyid 'byung 'gyur //	d gsal kun mkhyen nyid byung gyur 
BO_T11_D4266:124b-51	mchongs dang chu yi dro ba yis //	mchong dang chu yi dro ba yis 
BO_T11_D4266:125a-0	'dir ni 'khrul pa nyid yod @125a * //	dir ni khrul ba nyid yod 
BO_T11_D4266:125a-1	min // mchongs pa mchongs pa'i rgyus byung min //	min mchong ba mchong ba rgyus byung min 
BO_T11_D4266:125a-2	stobs dang 'bad pa las mchongs 'byung //	stobs dang bad ba las mchong byung 
BO_T11_D4266:125a-3	yang na mchongs pa la yang ni //	yang na mchong ba la yang ni 
BO_T11_D4266:125a-4	rang rgyud ting 'dzin las byung ba'i //	rang brgyud ting dzin las byung ba 
BO_T11_D4266:125a-5	khyad par gyis ni rab kyi mthar //	khyad ba gyis ni rab kyi mthar 
BO_T11_D4266:125a-6	phyin pa nyid du 'dod pa yin //	phyin ba nyid du dod ba yin 
BO_T11_D4266:125a-7	yid mgyogs rdzu 'phrul zhes bya ba //	yid mgyog rdzu phrul zhes byed ba 
BO_T11_D4266:125a-8	mchog gyur de ltar grags pa yin //	mchog gyur de ltar grags ba yin 
BO_T11_D4266:125a-9	gang zhig dgos pa tsam gyis ni //	gang jig dgos ba tsam gyis ni 
BO_T11_D4266:125a-10	gtso bo ring du gshegs par mdzad //	gtso bo ring du gshegs ba mdzad 
BO_T11_D4266:125a-11	ma mthong ba tsam gyis kyang ni //	ma mthong ba tsam gyis kyang ni 
BO_T11_D4266:125a-12	de med par ni grub pa min //	de med ba ni grub ba min 
BO_T11_D4266:125a-13	'dir ni gzhan gyis gnod pa can //	dir ni gzhan gyis gnod ba can 
BO_T11_D4266:125a-14	cung zad smra bar nus ma yin //	cung zad smra ba nus ma yin 
BO_T11_D4266:125a-15	dang ba'i rgyal po phrug gu ni ;	dang ba rgyal po phrug gu ni 
BO_T11_D4266:125a-16	/ tshang nas byung bar mi nus kyi //	tshang nas byung ba mi nus kyi 
BO_T11_D4266:125a-17	goms pa yi ni khyad par gyis //	goms ba yi ni khyad ba gyis 
BO_T11_D4266:125a-18	rgya mtsho yi ni pha mthar phyin //	rgya mtsho yi ni pha mthar phyin 
BO_T11_D4266:125a-19	rten gyi khyad par goms pa yis //	rten gyi khyad ba goms ba yis 
BO_T11_D4266:125a-20	dbye bas 'di ni ji bzhin 'gro //	byed ba di ni ji bzhin gro 
BO_T11_D4266:125a-21	de lta de lta bu las ni //	de lta de lta bu las ni 
BO_T11_D4266:125a-22	ci phyir lhag pa can srid min //	ci phyir lhag ba can srid min 
BO_T11_D4266:125a-23	byang chub sems dpa'i gnas skabs na //	byang chub sems dpa gnas skabs na 
BO_T11_D4266:125a-24	de 'dra'i 'gro ba thob pa min //	de dra gro ba thob ba min 
BO_T11_D4266:125a-25	ting nge 'dzin ni khyad par can //	ting nge dzin ni khyad ba can 
BO_T11_D4266:125a-26	thob na thub pas spyod pa can //	thob na thub ba spyod ba can 
BO_T11_D4266:125a-27	khru bcu'i bar du nam mkha' la //	khru chu ba du nam mkha la 
BO_T11_D4266:125a-28	gang zhig mchongs nas 'gro ba yin //	gang jig mchong nas gro ba yin 
BO_T11_D4266:125a-29	de la rgyu las de 'dra yi //	de la rgyu las de dra yi 
BO_T11_D4266:125a-30	ring du 'gro ba'i nus pa'ang yod //	ring du gro ba nus ba yod 
BO_T11_D4266:125a-31	chu ni dro bar byed pa na //	chu ni dro ba byed ba na 
BO_T11_D4266:125a-32	chu ni zad par 'gyur ba yin //	chu ni zad ba gyur ba yin 
BO_T11_D4266:125a-33	des na mi brtan rten can de //	des na mi brtan rten can de 
BO_T11_D4266:125a-34	gang zhig gang du khyad can 'gyur //	gang jig gang du khyad can gyur 
BO_T11_D4266:125a-35	yid las byung yon tan rnams la //	yid las byung yon tan rnams la 
BO_T11_D4266:125a-36	sems ni rgyu ni rten yin te //	sems ni rgyu ni rten yin te 
BO_T11_D4266:125a-37	de ni rten 'brel pas 'jug pa //	de ni rten brel ba jug ba 
BO_T11_D4266:125a-38	nam yang ldog par mi 'gyur ro //	nam yang ldog ba mi gyur ro 
BO_T11_D4266:125a-39	ji srid ji srid yon tan goms //	ji srid ji srid yon tan goms 
BO_T11_D4266:125a-40	mngon du phyogs nas gnas pa yin //	mngon du phyogs nas gnas ba yin 
BO_T11_D4266:125a-41	de srid shin tu 'od gsal ba //	de srid shin tu d gsal ba 
BO_T11_D4266:125a-42	de ni shin tu gnas pa nyid //	de ni shin tu gnas ba nyid 
BO_T11_D4266:125a-43	gang phyir dri ma glo bur 'dod //	gang phyir dri ma glo bur dod 
BO_T11_D4266:125a-44	de nyid mthong ba'i bdag nyid can //	de nyid mthong ba bdag nyid can 
BO_T11_D4266:125a-45	'od gsal ba yi sems 'di ni //	d gsal ba yi sems di ni 
BO_T11_D4266:125a-46	rang bzhin nyid kyis gnas pa yin //	rang bzhin nyid kyis gnas ba yin 
BO_T11_D4266:125a-47	gal te sems ni gzhan gyis ni //	gal te sems ni gzhan gyis ni 
BO_T11_D4266:125a-48	rtog pa'i bdag nyid nges srid na //	rtogs ba bdag nyid nges srid na 
BO_T11_D4266:125a-49	de tshe dmigs pa ma grub phyir //	de tshe dmigs ba ma grub phyir 
BO_T11_D4266:125a-50	don la 'jug pa mi srid do //	don la jug ba mi srid do 
BO_T11_D4266:125a-51	de phyir gsal bar byed pa'i phyir //	de phyir gsal ba byed ba phyir 
BO_T11_D4266:125a-52	rang rig bdag nyid sems la yod //	rang rig bdag nyid sems la yod 
BO_T11_D4266:125a-53	sgro btags med pa'i ngo bo can //	sgro dogs med ba ngo bo can 
BO_T11_D4266:125a-54	rang rig pa 'di gnas pa yin //	rang rig ba di gnas ba yin 
BO_T11_D4266:125a-55	des na lam bdag nyid 'gyur na //	des na lam bdag nyid gyur na 
BO_T11_D4266:125a-56	'dod chags gti mug gi skyon gyis //	dod chags gti mug gi skyon gyis 
BO_T11_D4266:125b-0	sems ni zil gyis @125b gnon pa min //	sems ni zil gyis gnon ba min 
BO_T11_D4266:125b-1	de ni sngar yang stobs chung yin //	de ni sngar yang stobs chung yin 
BO_T11_D4266:125b-2	skyon kun 'jig rten byed pa can //	skyon kun jig rten byed ba can 
BO_T11_D4266:125b-3	lam gyi bdag nyid du 'gyur na //	lam gyi bdag nyid du gyur na 
BO_T11_D4266:125b-4	'bad pa med na spong mi 'gyur //	bad ba med na spong mi gyur 
BO_T11_D4266:125b-5	yon tan mthong bas 'bad pa med //	yon tan mthong ba bad ba med 
BO_T11_D4266:125b-6	des na dri med mi g-yo ba'i //	des na dri med mi g-yo ba 
BO_T11_D4266:125b-7	yon tan tshogs kyis brgyan ba can //	yon tan tshogs kyis rgyan ba can 
BO_T11_D4266:125b-8	skyon gyi rlung gis bskyod bdag min //	skyon gyi rlung gis skyod bdag min 
BO_T11_D4266:125b-9	rgyal ba kun mkhyen rtogs par 'gyur //	rgyal ba kun mkhyen rtogs ba gyur 
BO_T11_D4266:125b-10	gzhan yang gang dang gang bsgoms pa //	gzhan yang gang dang gang sgom ba 
BO_T11_D4266:125b-11	bsgoms pa yongs su rdzogs pa na //	sgom ba yongs su rdzogs ba na 
BO_T11_D4266:125b-12	de dang de dag gsal snang 'gyur //	de dang de dag gsal snang gyur 
BO_T11_D4266:125b-13	'dod pa la sogs pa'i yul bzhin //	dod ba la sogs ba yul bzhin 
BO_T11_D4266:125b-14	chos rnams kun yang dus ring du //	chos rnams kun yang dus ring du 
BO_T11_D4266:125b-15	rnam pa du mas bsgom bya min //	rnam ba du mas bsgom byed min 
BO_T11_D4266:125b-16	bdag nyid chen pos stong pa dang // bdag med sogs te dngos nyid can //	bdag nyid chen pos stong ba dang bdag med sogs te dngos nyid can 
BO_T11_D4266:125b-17	stong dang bdag med sogs ngo bo //	stong dang bdag med sogs ngo bo 
BO_T11_D4266:125b-18	yang dag nyid du bsgrubs zin to //	yang dag nyid du sgrub zin to 
BO_T11_D4266:125b-19	des na yang dag don bsgoms las //	des na yang dag don sgom las 
BO_T11_D4266:125b-20	byung phyir yid de tshad ma yin //	byung phyir yid de tshad ma yin 
BO_T11_D4266:125b-21	gsal bar snang phyir mngon sum dang // dngos dang 'brel phyir tshad ma yin //	gsal ba snang phyir mngon sum dang dngos dang brel phyir tshad ma yin 
BO_T11_D4266:125b-22	mig sogs rten las byung ba yi //	mig sogs rten las byung ba yi 
BO_T11_D4266:125b-23	sngo sogs so sor snang ba bzhin //	sngo sogs so sor snang ba bzhin 
BO_T11_D4266:125b-24	des na rnam shes gcig la ni //	des na rnam shes gcig la ni 
BO_T11_D4266:125b-25	chos rnams dag ni thams cad kyang //	chos rnams dag ni thams cad kyang 
BO_T11_D4266:125b-26	cig car gsal bar snang srid pas //	cig car gsal ba snang srid ba 
BO_T11_D4266:125b-27	de lta bu ni rtogs par gyis //	de lta bu ni rtogs ba gyis 
BO_T11_D4266:125b-28	'di ltar bsgom bzhin pa nyid phyir //	di ltar bsgom bzhin ba nyid phyir 
BO_T11_D4266:125b-29	bud med bu dang tshom rkun bzhin //	bud med bu dang tshom rkun bzhin 
BO_T11_D4266:125b-30	'dod pa tsam gyis mngon phyogs pas //	dod ba tsam gyis mngon phyogs ba 
BO_T11_D4266:125b-31	bsgom pa rnyed par dka' ba yin //	bsgom ba rnyed ba dka ba yin 
BO_T11_D4266:125b-32	sgom pa'i rab mtho blo gcig la //	sgom ba rab mtho blo gcig la 
BO_T11_D4266:125b-33	chom rkun gsal bar snang ba yin //	chom rkun gsal ba snang ba yin 
BO_T11_D4266:125b-34	dngos po yod sogs gtan tshigs phyir //	dngos po yod sogs gtan tshigs phyir 
BO_T11_D4266:125b-35	bud med la sogs lta bu'o //	bud med la sogs lta bu 
BO_T11_D4266:125b-36	gang la 'di ltar dngos nyid dang // yod dang skye sogs mtshan nyid can //	gang la di ltar dngos nyid dang yod dang skye sogs mtshan nyid can 
BO_T11_D4266:125b-37	nges byed gtan tshigs nus can yod //	nges byed gtan tshigs nus can yod 
BO_T11_D4266:125b-38	de ni su zhig sgrub byed min //	de ni su jig sgrub byed min 
BO_T11_D4266:125b-39	shes bya ma lus pa yi tshogs //	shes byed ma lus ba yi tshogs 
BO_T11_D4266:125b-40	shes pa'i skad cig gcig khyab mdzad //	shes ba skad cig gcig khyab mdzad 
BO_T11_D4266:125b-41	lha dang lha min gtsug nor bur //	lha dang lha min gtsug nor bur 
BO_T11_D4266:125b-42	gyur pa'i kun mkhyen 'di grub 'gyur //	gyur ba kun mkhyen di grub gyur 
BO_T11_D4266:125b-43	tshig ma ltos par 'ga' zhig gis //	tshig ma ltos ba ga jig gis 
BO_T11_D4266:125b-44	chos sogs de dag ltos yin te //	chos sogs de dag ltos yin te 
BO_T11_D4266:125b-45	bden bdag nyid kyis stong nyid phyir //	bden bdag nyid kyis stong nyid phyir 
BO_T11_D4266:125b-46	gser la sogs pa rnam dag bzhin //	gser la sogs ba rnam dag bzhin 
BO_T11_D4266:125b-47	rig byed skyes bus byas nyid du //	rig byed skye bud byed nyid du 
BO_T11_D4266:125b-48	grub phyir grub pa la sgrub min //	grub phyir grub ba la sgrub min 
BO_T11_D4266:125b-49	mi shes pa yi stes dbang gis //	mi shes ba yi stes dbang gis 
BO_T11_D4266:126a-0	bden @126a * //	bden 
BO_T11_D4266:126a-1	pa'i nyer bstan yod ma yin //	ba nyer ston yod ma yin 
BO_T11_D4266:126a-2	phyag rgya dkyil 'khor sngags rnams kyis //	phyag rgya dkyil khor sngags rnams kyis 
BO_T11_D4266:126a-3	sha za mkha' 'gro las thar dang // dug la sogs pa sel ba yi //	sha za mkha gro las thar dang dug la sogs ba sel ba yi 
BO_T11_D4266:126a-4	nus pa dbang 'das gang yin pa //	nus ba dbang da gang yin ba 
BO_T11_D4266:126a-5	thub dang mkha' lding sogs dbang gis //	thub dang mkha lding sogs dbang gis 
BO_T11_D4266:126a-6	thos dang rjes dpag ma yin pa'i //	thos dang rjes dpog ma yin ba 
BO_T11_D4266:126a-7	dri med dngos su mi mkhyen na //	dri med dngos su mi mkhyen na 
BO_T11_D4266:126a-8	de dag ji ltar gsungs pa yin //	de dag ji ltar gsungs ba yin 
BO_T11_D4266:126a-9	rjes su dpag pas kyang mkhyen min //	rjes su dpog ba kyang mkhyen min 
BO_T11_D4266:126a-10	der ni sngar ma mthong ba'i phyir //	der ni sngar ma mthong ba phyir 
BO_T11_D4266:126a-11	de dang rtags kyi 'brel ba yi //	de dang rtags kyi brel ba yi 
BO_T11_D4266:126a-12	mthong ba mi 'thad par 'gyur ro //	mthong ba mi thad ba gyur ro 
BO_T11_D4266:126a-13	gzhan la gsan nas gsungs min te //	gzhan la gsan nas gsungs min te 
BO_T11_D4266:126a-14	brgal zhing brtag pa mtshungs pa'i phyir //	rgol zhing rtog ba mtshungs ba phyir 
BO_T11_D4266:126a-15	stes dbang mi slu'i ngo bo ni //	stes dbang mi slu ngo bo ni 
BO_T11_D4266:126a-16	de 'dra gsungs pa ma yin no //	de dra gsungs ba ma yin no 
BO_T11_D4266:126a-17	de ltar chos bstan 'di lhur mdzad //	de ltar chos ston di lhur mdzad 
BO_T11_D4266:126a-18	rgyu mtshan gzhan du brtags pa min //	rgyu mtshan gzhan du rtog ba min 
BO_T11_D4266:126a-19	gang phyir don gzhan 'jug byed la //	gang phyir don gzhan jug byed la 
BO_T11_D4266:126a-20	stes dbang de dogs skye bar 'gyur //	stes dbang de dogs skye ba gyur 
BO_T11_D4266:126a-21	skom pas gdungs pa'i bsam pa can //	skom ba gdung ba bsam ba can 
BO_T11_D4266:126a-22	'bab chur nye bar 'gro ba na //	bab chur(d) nye ba gro ba na 
BO_T11_D4266:126a-23	ji ltar byi ru rnyed pa ltar //	ji ltar byi ru rnyed ba ltar 
BO_T11_D4266:126a-24	der ni stes dbang yod par rigs //	der ni stes dbang yod ba rigs 
BO_T11_D4266:126a-25	g-yeng ba'i sems ldan rmongs rnams kyis //	g-yeng ba sems ldan rmongs rnams kyis 
BO_T11_D4266:126a-26	res 'ga' ba yi rim can 'di //	res ga ba yi rim can di 
BO_T11_D4266:126a-27	khyad par 'bras bu sgrub byed pa //	khyad ba bras bu sgrub byed ba 
BO_T11_D4266:126a-28	de smra nus pa ma yin no //	de smra nus ba ma yin no 
BO_T11_D4266:126a-29	ma thos rjes dpag ma byas pa'i //	ma thos rjes dpog ma byed ba 
BO_T11_D4266:126a-30	bden pa'i don ni lhur smra gang //	bden ba don ni lhur smra gang 
BO_T11_D4266:126a-31	de ni sngon shul phyis de'i dngos //	de ni sngon shul byid de dngos 
BO_T11_D4266:126a-32	shes shing de 'dra ston byed yin //	shes shing de dra ston byed yin 
BO_T11_D4266:126a-33	gzhan gyis mngon sum gyis mthong ba'i //	gzhan gyis mngon sum gyis mthong ba 
BO_T11_D4266:126a-34	chu sogs ston par byed pa bzhin //	chu sogs ston ba byed ba bzhin 
BO_T11_D4266:126a-35	ma thos rjes dpag ma byas pa'i //	ma thos rjes dpog ma byed ba 
BO_T11_D4266:126a-36	dbyen don dbang po las 'das pa'o //	dbyen don dbang po las da ba 
BO_T11_D4266:126a-37	gzhan gyis mi rtogs nus can yang //	gzhan gyis mi rtogs nus can yang 
BO_T11_D4266:126a-38	des pa yi ni phyag rgya dang // dkyil 'khor rtog sogs mtshan nyid can //	des ba yi ni phyag rgya dang dkyil khor rtogs sogs mtshan nyid can 
BO_T11_D4266:126a-39	de lhur len thub mchog gis gsungs //	de lhur len thub mchog gis gsungs 
BO_T11_D4266:126a-40	de phyir phul byung shes pa ni //	de phyir bul byung shes ba ni 
BO_T11_D4266:126a-41	thabs kyi stobs las byung rnams kyis //	thabs kyi stobs las byung rnams kyis 
BO_T11_D4266:126a-42	gang zhig dbang 'das thams cad nyid //	gang jig dbang da thams cad nyid 
BO_T11_D4266:126a-43	des ni lhag par shes byed nus //	des ni lhag ba shes byed nus 
BO_T11_D4266:126a-44	khang khyim gcig la gnas pa yi //	khang khyim gcig la gnas ba yi 
BO_T11_D4266:126a-45	mngon sum gang zhig zhugs par gyur //	mngon sum gang jig jug ba gyur 
BO_T11_D4266:126a-46	de nyid du ni de mthong nus //	de nyid du ni de mthong nus 
BO_T11_D4266:126a-47	khang khyim gzhan la ma yin no //	khang khyim gzhan la ma yin no 
BO_T11_D4266:126a-48	sems can thams cad la gnas pa'i //	sems can thams cad la gnas ba 
BO_T11_D4266:126a-49	nus pa'i nyams myong yod pa na //	nus ba nyams myong yod ba na 
BO_T11_D4266:126a-50	khyed kyis de ltar nges nyid rigs //	khyed kyis de ltar nges nyid rigs 
BO_T11_D4266:126b-0	@126b gzhan du rgyu mtshan ci zhig yod //	gzhan du rgyu mtshan ci jig yod 
BO_T11_D4266:126b-1	skyes bu nyid sogs gtan tshigs kyis //	skye bu nyid sogs gtan tshigs kyis 
BO_T11_D4266:126b-2	nus pa med par nges byed na //	nus ba med ba nges byed na 
BO_T11_D4266:126b-3	bdag nyid dpe ru byas pa yis //	bdag nyid dpe ru byed ba yis 
BO_T11_D4266:126b-4	ha cang thal bar 'gyur ba yin //	ha cang thal ba gyur ba yin 
BO_T11_D4266:126b-5	de ltar khyed kyis rmongs pa nyid //	de ltar khyed kyis rmongs ba nyid 
BO_T11_D4266:126b-6	nges par byas bas mkhas pa kun //	nges ba byed ba mkhas ba kun 
BO_T11_D4266:126b-7	khyod nyid dpe ru byas pa yis //	khyod nyid dpe ru byed ba yis 
BO_T11_D4266:126b-8	rmongs pa'i blo can thal bar 'gyur //	rmongs ba blo can thal ba gyur 
BO_T11_D4266:126b-9	skyes bu gcig 'ga' zhig kyang ni //	skye bu gcig ga jig kyang ni 
BO_T11_D4266:126b-10	mthar thug shes pa yod pa min //	mthar thug shes ba yod ba min 
BO_T11_D4266:126b-11	de ltar 'di yang dag tsam ni //	de ltar di yang dag tsam ni 
BO_T11_D4266:126b-12	rgyu mtshan med par smras pa yin //	rgyu mtshan med ba smras ba yin 
BO_T11_D4266:126b-13	yang na rang mtshungs sems can rnams //	yang na rang mtshungs sems can rnams 
BO_T11_D4266:126b-14	rnam dag blo ni mi rmongs pa'i //	rnam dag blo ni mi rmongs ba 
BO_T11_D4266:126b-15	dbang du byas nas de ltar ngag / rgyal ba'i dus 'dab kyis ni smras //	dbang du byed nas de ltar ngag rgyal ba dus dab kyis ni smras 
BO_T11_D4266:126b-16	thams cad mkhyen pa srid pa yi //	thams cad mkhyen ba srid ba yi 
BO_T11_D4266:126b-17	tshad ma rgyas par bstan pa yin //	tshad ma rgya ba ston ba yin 
BO_T11_D4266:126b-18	gzhan gyis de la gnod pa can //	gzhan gyis de la gnod ba can 
BO_T11_D4266:126b-19	smra ba sngar yang smras zin to //	smra ba sngar yang smras zin to 
BO_T11_D4266:126b-20	de yi srid pa bsgrub pa ni //	de yi srid ba sgrub ba ni 
BO_T11_D4266:126b-21	gzhan ni smra bar ma byas na //	gzhan ni smra ba ma byed na 
BO_T11_D4266:126b-22	gnod pa can btsal ba tsam gyis //	gnod ba can btsal ba tsam gyis 
BO_T11_D4266:126b-23	de ni srid par rtogs par 'gyur //	de ni srid ba rtogs ba gyur 
BO_T11_D4266:126b-24	'di ltar gnod pa can mthong na //	di ltar gnod ba can mthong na 
BO_T11_D4266:126b-25	sgrub byed rab gsal ma byas kyang //	sgrub byed rab gsal ma byed kyang 
BO_T11_D4266:126b-26	the tshom skye bar 'gyur ba des //	the tshom skye ba gyur ba des 
BO_T11_D4266:126b-27	de ni srid par 'gyur ba na //	de ni srid ba gyur ba na 
BO_T11_D4266:126b-28	rig byed kho na rang dbang gis //	rig byed kho na rang dbang gis 
BO_T11_D4266:126b-29	chos ni mtshon zhes nges pa 'di //	chos ni mtshon zhes nges ba di 
BO_T11_D4266:126b-30	khyed kyis nges par grub 'gyur min //	khyed kyis nges ba grub gyur min 
BO_T11_D4266:126b-31	rnal 'byor pa rnams ma 'ongs pa'i //	rnal byor ba rnams ma ngs ba 
BO_T11_D4266:126b-32	shes bya la ni mngon sum gyis //	shes byed la ni mngon sum gyis 
BO_T11_D4266:126b-33	nus pa ji ltar yod de ni //	nus ba ji ltar yod de ni 
BO_T11_D4266:126b-34	dus gsum brtag pa las bshad zin //	dus gsum rtog ba las chad zin 
BO_T11_D4266:126b-35	yang na rnal 'byor nus byung ba'i //	yang na rnal byor nus byung ba 
BO_T11_D4266:126b-36	'das dang ma 'ongs ltar gsal ba //	da dang ma ngs ltar gsal ba 
BO_T11_D4266:126b-37	rtags dang lung la ma ltos pa'i //	rtags dang lung la ma ltos ba 
BO_T11_D4266:126b-38	yid ni rnal 'byor pa la yod //	yid ni rnal byor ba la yod 
BO_T11_D4266:126b-39	rang bdag snang ba rigs pa'i phyir //	rang bdag snang ba rigs ba phyir 
BO_T11_D4266:126b-40	de ni rang mtshan spyod yul can //	de ni rang mtshan spyod yul can 
BO_T11_D4266:126b-41	gsal bar snang ba mi slu'i phyir //	gsal ba snang ba mi slu phyir 
BO_T11_D4266:126b-42	de yang mngon sum 'dod pa yin //	de yang mngon sum dod ba yin 
BO_T11_D4266:126b-43	de phyir dbang 'das don rnams ni //	de phyir dbang da don rnams ni 
BO_T11_D4266:126b-44	dngos su mthong ba nyid yod yin //	dngos su mthong ba nyid yod yin 
BO_T11_D4266:126b-45	rtag pa'i tshig ni med pa'i phyir //	rtag ba tshig ni med ba phyir 
BO_T11_D4266:126b-46	des ni cung zad mthong ba min //	des ni cung zad mthong ba min 
