segmentnr	original	folio	stemmed
BO_T04_D3875b:118b-20	gal te dbyug pa la sogs pa 'phen mkhan ni yod pa kho na yin la /	118b	gal te dbyug ba la sogs ba phen mkhan ni yod ba kho na yin la 
BO_T04_D3875b:118b-21	de sems can gyi nyes pa yin no snyam du dogs pa la /	118b	de sems can gyi nyes ba yin no snyam du dogs ba la 
BO_T04_D3875b:118b-22	dbyug pa la sogs pa zhes bya ba smos so //	118b	dbyug ba la sogs ba zhes byed ba smos so 
BO_T04_D3875b:118b-23	gzhan yang bdag gis sngon chad ces bya ba la sogs par sbyar ro //	118b	gzhan yang bdag gis sngon chad ces byed ba la sogs ba sbyor ro 
BO_T04_D3875b:118b-24	gal te gzhan gyis mtshon phyung bas sdug bsngal gyi rgyu yin pas khro ba byed na de'i tshe bdag nyid la khro ba'i rigs te /	118b	gal te gzhan gyis mtshon byin ba sdug sngal gyi rgyu yin ba khro ba byed na de tshe bdag nyid la khro ba rigs te 
BO_T04_D3875b:118b-25	bdag gis kyang sdug bsngal gyi rgyu lus phyung ba'i phyir ro zhes bstan pa'i phyir /	118b	bdag gis kyang sdug sngal gyi rgyu lus byin ba phyir ro zhes ston ba phyir 
BO_T04_D3875b:118b-26	de'i mtshon zhes bya ba la sogs pa smos te /	118b	de mtshon zhes byed ba la sogs ba smos te 
BO_T04_D3875b:118b-27	sngar bstan pa de nyid gsal bar bya ba'i phyir shu ba zhes smos te /	118b	sngar ston ba de nyid gsal ba byed ba phyir shu ba zhes smos te 
BO_T04_D3875b:118b-28	reg tu mi bzod pa sten tsha che ba 'am bsran par dka' ba'o //	118b	reg tu mi bzod ba sten tsha che ba mang bsran ba dka ba 
BO_T04_D3875b:118b-29	sred pa'i mun pas non pas rig pas mthong du ma ster ba ni sred ldongs so //	118b	sred ba mun ba non ba rig ba mthong du ma ster ba ni sred ldong so 
BO_T04_D3875b:118b-30	bzung bar gyur pa ni khas blangs pa byas pa'o //	118b	bzung ba gyur ba ni khas blangs ba byed ba 
BO_T04_D3875b:118b-31	de la ste lus la'o //	118b	de la ste lus la 
BO_T04_D3875b:118b-32	su la ste gang la khro bar bya ba'o //	118b	su la ste gang la khro ba byed ba 
BO_T04_D3875b:118b-33	ji ltar na sred pa'i mun pas non par 'gyur snyam pa la /	118b	ji ltar na sred ba mun ba non ba gyur snyam ba la 
BO_T04_D3875b:118b-34	byis pa zhes smos te /	118b	byis ba zhes smos te 
BO_T04_D3875b:118b-35	byis pa ni rmongs pa'o //	118b	byis ba ni rmongs ba 
BO_T04_D3875b:118b-36	sdug bsngal na ni tsha'o //	118b	sdug sngal na ni tsha 
BO_T04_D3875b:118b-37	rgyu zhes pa ni lus pa nyid do //	118b	rgyu zhes ba ni lus ba nyid do 
BO_T04_D3875b:119a-0	rang gi nyes @119a * //	119a	rang gi nyes 
BO_T04_D3875b:119a-1	pas gnod ces pa'i rnam smin dpe dang bcas par bstan pa'i phyir /	119a	ba gnod ces ba rnam smin dpe dang cha ba ston ba phyir 
BO_T04_D3875b:119a-2	dper na zhes smos te /	119a	dper na zhes smos te 
BO_T04_D3875b:119a-3	'di zhes pa ni da ltar gyi sdug bsngal 'di'o //	119a	di zhes ba ni da ltar gyi sdug sngal di 
BO_T04_D3875b:119a-4	gang bdag gis byas pa'i las kyis bskul nas sems can dmyal bar btang bas na de dag brlag pa ste lung bar byas pa'o //	119a	gang bdag gis byed ba las kyis skul nas sems can dmyal ba gtong ba na de dag brlag ba ste lung ba byed ba 
BO_T04_D3875b:119a-5	ma brlag gam zhes bya ba ni rang gi sems la bos te /	119a	ma brlag gam zhes byed ba ni rang gi sems la bod te 
BO_T04_D3875b:119a-6	gdams pa'i tshig go //	119a	doms ba tshig go 
BO_T04_D3875b:119a-7	de lta na gnod pa byed mkhan dmyal bar 'gro bar rigs so snyam pa la /	119a	de lta na gnod ba byed mkhan dmyal ba gro ba rigs so snyam ba la 
BO_T04_D3875b:119a-8	bdag la bsam pa'i zhes te /	119a	bdag la bsam ba zhes te 
BO_T04_D3875b:119a-9	gal te thabs la mkhas pa gang yang rung ba cig gis bdag dmyal bar ma song na de'i de dag la gnod pa byas par 'gyur bar ni cung zad kyang med kyi /	119a	gal te thabs la mkhas ba gang yang rung ba cig gis bdag dmyal ba ma gro na de de dag la gnod ba byed ba gyur ba ni cung zad kyang med kyi 
BO_T04_D3875b:119a-10	bdag nyid kyi bsam pa'i yon tan bdag nyid bsrung bar 'gyur ba 'ba' zhig tu zad do //	119a	bdag nyid kyi bsam ba yon tan bdag nyid bsrung ba gyur ba ba jig tu zad do 
BO_T04_D3875b:119a-11	lan du gnod par byas pa ni de dag la gnod pa'o //	119a	lan du gnod ba byed ba ni de dag la gnod ba 
BO_T04_D3875b:119a-12	spyod pa ni gzhan rjes su bskyang ba'o //	119a	spyod ba ni gzhan rjes su skyong ba 
BO_T04_D3875b:119a-13	nyams pa ni zhig pa'o //	119a	nyams ba ni jig ba 
BO_T04_D3875b:119a-14	zhig par 'gyur ba ni dmyal ba la sogs par 'gro ba'o //	119a	jig ba gyur ba ni dmyal ba la sogs ba gro ba 
BO_T04_D3875b:119a-15	dka' thub ces bya ba ni rjes su brtse ba'i tshig ste /	119a	dka thub ces byed ba ni rjes su brtse ba tshig ste 
BO_T04_D3875b:119a-16	phyis de dag gdon pa'i thabs bsam par bya'o zhes dgongs pa'o //	119a	byid de dag don ba thabs bsam ba byed zhes dgongs ba 
BO_T04_D3875b:119a-17	gzhan yang dbyug pa la sogs pa bsnun pas yid dam yang na lus la gnod grang na /	119a	gzhan yang dbyug ba la sogs ba snun ba yid dam yang na lus la gnod grang na 
BO_T04_D3875b:119a-18	de la re zhig yid la ni gnod pa ma yin te /	119a	de la re jig yid la ni gnod ba ma yin te 
BO_T04_D3875b:119a-19	lus can ma yin pa'i phyir ro ;	119a	lus can ma yin ba phyir ro 
BO_T04_D3875b:119a-20	/ de nyid rtog pas byas par rig par bya'o zhes bstan pa'i phyir /	119a	de nyid rtogs ba byed ba rig ba byed zhes ston ba phyir 
BO_T04_D3875b:119a-21	lus la zhes smos te /	119a	lus la zhes smos te 
BO_T04_D3875b:119a-22	lus la mngon par zhen pa'i phyir lus sdug bsngal bas yid la gnod par 'gyur ba 'am yang na lus su mngon par zhen pa'i phyir lus nyid yin pas na lus la gces pas gnod par 'gyur gyi brdeg par mi nus so //	119a	lus la mngon ba zhen ba phyir lus sdug sngal ba yid la gnod ba gyur ba mang yang na lus su mngon ba zhen ba phyir lus nyid yin ba na lus la gces ba gnod ba gyur gyi brdeg ba mi nus so 
BO_T04_D3875b:119a-23	lus bems po yin pa'i phyir brnyas pa la sogs pas gnod par mi 'gyur ro zhes bstan pa'i phyir /	119a	lus bems po yin ba phyir brnyas ba la sogs ba gnod ba mi gyur ro zhes ston ba phyir 
BO_T04_D3875b:119a-24	brnyas dang zhes smos te /	119a	brnyas dang zhes smos te 
BO_T04_D3875b:119a-25	de yis zhes pa ni brnyas pa la sogs pa'i tshogs 'dus pa des lus la gnod par mi 'gyur ba'o //	119a	de yis zhes ba ni brnyas ba la sogs ba tshogs du ba des lus la gnod ba mi gyur ba 
BO_T04_D3875b:119a-26	yang na de dag nyid rgyu yin pas na tshogs so //	119a	yang na de dag nyid rgyu yin ba na tshogs so 
BO_T04_D3875b:119a-27	brnyas pa la sogs pa byas pas bdag la ma dad par 'gyur bas de la khro ba'i rigs so snyam pa la /	119a	brnyas ba la sogs ba byed ba bdag la ma dad ba gyur ba de la khro ba rigs so snyam ba la 
BO_T04_D3875b:119a-28	gzhan dag ces smos te /	119a	gzhan dag ces smos te 
BO_T04_D3875b:119a-29	mi dga' ba ni ma dad pa'o //	119a	mi dga ba ni ma dad ba 
BO_T04_D3875b:119a-30	'dir zhes pa ni tshe 'di ru'o //	119a	dir zhes ba ni tshe di ru 
BO_T04_D3875b:119a-31	'dir zhes pa ni nyams par 'gyur ba'o //	119a	dir zhes ba ni nyams ba gyur ba 
BO_T04_D3875b:119b-0	sdig pa ni @119b brnyas pa la sogs pa byas pas khro ba'i sdig pa gang yin pa de 'ba' zhig go //	119b	sdig ba ni brnyas ba la sogs ba byed ba khro ba sdig ba gang yin ba de ba jig go 
BO_T04_D3875b:119b-1	brtan pa ni longs ma spyad pa'i 'bras bu de ma nyams pa'i phyir ro //	119b	brtan ba ni longs ma spyod ba bras bu de ma nyams ba phyir ro 
BO_T04_D3875b:119b-2	gnas pa ni de 'ba' zhig brtan par gnas pa'o //	119b	gnas ba ni de ba jig brtan ba gnas ba 
BO_T04_D3875b:119b-3	'dir 'di yang bsam par bya'o zhes bstan pa'i phyir /	119b	dir di yang bsam ba byed zhes ston ba phyir 
BO_T04_D3875b:119b-4	bdag nyid ces smos te /	119b	bdag nyid ces smos te 
BO_T04_D3875b:119b-5	bla'i zhes pa ni tshod yod kyi zhes bya ba'o //	119b	bla zhes ba ni tshod yod kyi zhes byed ba 
BO_T04_D3875b:119b-6	log 'tsho zhes pa ni 'dod pa can du gyur pa'i nor btsal ba'o //	119b	log tsho zhes ba ni dod ba can du gyur ba nor btsal ba 
BO_T04_D3875b:119b-7	de bzhin du rmi lam mo zhes bya ba la sogs pa la /	119b	de bzhin du rmi lam mo zhes byed ba la sogs ba la 
BO_T04_D3875b:119b-8	bde ba zhes pa ni rmi lam nyid kyi'o //	119b	bde ba zhes ba ni rmi lam nyid kyi 
BO_T04_D3875b:119b-9	de'i phyir log 'tshos yun ring du gnas kyang ngan 'gror skye ba 'ba' zhig las gzhan ni khyad par cung zad kyang med do //	119b	de phyir log tshos yun ring du gnas kyang ngan gror skye ba ba jig las gzhan ni khyad ba cung zad kyang med do 
BO_T04_D3875b:119b-10	'di ltar rnyed pa mang po zhes bya ba la sogs pa la /	119b	di ltar rnyed ba mang po zhes byed ba la sogs ba la 
BO_T04_D3875b:119b-11	lag pa stong pa zhes bya ba ni nor med pa'o //	119b	lag ba stong ba zhes byed ba ni nor med ba 
BO_T04_D3875b:119b-12	'gro zhes pa ni 'jig rten pha rol du'o //	119b	gro zhes ba ni jig rten pha rol du 
BO_T04_D3875b:119b-13	gal te rnyed pa dang ldan na bsod nams byas la sdig pa zad par bya'o zhes rtsod pa bslang ba'i don du /	119b	gal te rnyed ba dang ldan na bsod nams byed la sdig ba zad ba byed zhes rtsod ba bslang ba don du 
BO_T04_D3875b:119b-14	gal te rnyed pas zhes gsungs so ;	119b	gal te rnyed ba zhes gsungs so 
BO_T04_D3875b:119b-15	/ rnyed pa'i don du zhes pas ni lan gsungs te /	119b	rnyed ba don du zhes ba ni lan gsungs te 
BO_T04_D3875b:119b-16	khyod ni rnyed pa'i don du khros par gyur na phyin ci log nyid du ci'i phyir mi 'gyur /	119b	khyod ni rnyed ba don du khro ba gyur na phyin ci log nyid du ci phyir mi gyur 
BO_T04_D3875b:119b-17	gal te bsod nams kyis ci dgos /	119b	gal te bsod nams kyis ci dgos 
BO_T04_D3875b:119b-18	re zhig rnyed pas ni yun ring du bde bar 'tsho'o snyam pa la /	119b	re jig rnyed ba ni yun ring du bde ba tsho snyam ba la 
BO_T04_D3875b:119b-19	gang gi don du zhes smos te /	119b	gang gi don du zhes smos te 
BO_T04_D3875b:119b-20	gang gi don te dge ba'i don du'o //	119b	gang gi don te dge ba don du 
BO_T04_D3875b:119b-21	sdig pa zhes bya ba ni mi dge ba'o //	119b	sdig ba zhes byed ba ni mi dge ba 
BO_T04_D3875b:119b-22	gal te gzhan yang mi snyan par sgrogs pa yin pas de la zhe sdang byed pa'i lta na gzhan la mi snyan par sgrogs pa la yang khyod ci'i phyir khro bar mi byed /	119b	gal te gzhan yang mi snyan ba sgrogs ba yin ba de la zhe sdang byed ba lta na gzhan la mi snyan ba sgrogs ba la yang khyod ci phyir khro ba mi byed 
BO_T04_D3875b:119b-23	bdag la mi snyan par sgrogs pa mi snyan pa yin pa bzhin du gzhan la mi snyan par sgrogs pa yang mi snyan pa yin pas /	119b	bdag la mi snyan ba sgrogs ba mi snyan ba yin ba bzhin du gzhan la mi snyan ba sgrogs ba yang mi snyan ba yin ba 
BO_T04_D3875b:119b-24	de'i phyir de la yang khro bar rigs so //	119b	de phyir de la yang khro ba rigs so 
BO_T04_D3875b:119b-25	gal te 'di snyam du de la brten pa'i ma dad pa dang mi snyan par smras pa la sogs pa gzhan la rag las pa yin pa de dag la ni bzod pa nyid do snyam du sems na /	119b	gal te di snyam du de la rten ba ma dad ba dang mi snyan ba smras ba la sogs ba gzhan la rag las ba yin ba de dag la ni bzod ba nyid do snyam du sems na 
BO_T04_D3875b:119b-26	nyon mongs pa'i mtshan nyid gzhan la rag las pa yin pa'i phyir rang la mi snyan par smra ba la yang khyod kyis bzod par rigs pa nyid de /	119b	nyon mongs ba mtshan nyid gzhan la rag las ba yin ba phyir rang la mi snyan ba smra ba la yang khyod kyis bzod ba rigs ba nyid de 
BO_T04_D3875b:119b-27	bzod pa'i rgyu ma dad pa gzhan la rag las pa gnyis ka la yang mtshungs pa'i phyir ro //	119b	bzod ba rgyu ma dad ba gzhan la rag las ba gnyis ka la yang mtshungs ba phyir ro 
BO_T04_D3875b:119b-28	de ltan sku gzugs la sogs pa la gnod pa byed pa rnams la khro bar rigs so snyam pa la /	119b	de ltan sku gzugs la sogs ba la gnod ba byed ba rnams la khro ba rigs so snyam ba la 
BO_T04_D3875b:119b-29	sku gzugs zhes bya ba la sogs pa smos te /	119b	sku gzugs zhes byed ba la sogs ba smos te 
BO_T04_D3875b:120a-0	mchod rten @120a * //	120a	mchod rten 
BO_T04_D3875b:120a-1	ni mchod rten nyid do //	120a	ni mchod rten nyid do 
BO_T04_D3875b:120a-2	'khyal pa ni tshul dang mi mthun pa rjes su brjod pa'o //	120a	khyal ba ni tshul dang mi mthun ba rjes su rjod ba 
BO_T04_D3875b:120a-3	'jig par byed pa ni nyams par byed pa'o //	120a	jig ba byed ba ni nyams ba byed ba 
BO_T04_D3875b:120a-4	gnyen ni 'brel pa'o //	120a	gnyen ni brel ba 
BO_T04_D3875b:120a-5	rkyen dgal 'gyur ba zhes pa ni 'di lta bu'i rkyen las 'byung ba'o zhes rnam par dpyad pa'o //	120a	rkyen gel gyur ba zhes ba ni di lta bu rkyen las byung ba zhes rnam ba dpyod ba 
BO_T04_D3875b:120a-6	'di ltar bsams la yang sems can rnams la zhe sdang bar mi bya'o zhes bstan pa'i phyir /	120a	di ltar bsams la yang sems can rnams la zhe sdang ba mi byed zhes ston ba phyir 
BO_T04_D3875b:120a-7	lus can rnams la zhes smos te sems yod pa ni sems can no //	120a	lus can rnams la zhes smos te sems yod ba ni sems can no 
BO_T04_D3875b:120a-8	sems med pa ni dbyug pa la sogs pa'o //	120a	sems med ba ni dbyug ba la sogs ba 
BO_T04_D3875b:120a-9	gnod pa byas pa ni gnod pa de skyed pa'o //	120a	gnod ba byed ba ni gnod ba de skyed ba 
BO_T04_D3875b:120a-10	ci ste zhes pa ni gnod par byed pa de dag gnyis las sems yod kho na bkar te ma khro cig ces bya ba'o //	120a	ci ste zhes ba ni gnod ba byed ba de dag gnyis las sems yod kho na bkar te ma khro cig ces byed ba 
BO_T04_D3875b:120a-11	da ni de dag gnyis ka'i nyes pa thun mong du sun dbyung ba'i phyir /	120a	da ni de dag gnyis ka nyes ba thun mong du sun byin ba phyir 
BO_T04_D3875b:120a-12	la la rmongs pa zhes smos te /	120a	la la rmongs ba zhes smos te 
BO_T04_D3875b:120a-13	rmongs pa ste ma shes pas nyes pa byed pa ni bdag nyid skyon can byed pa'o //	120a	rmongs ba ste ma shes ba nyes ba byed ba ni bdag nyid skyon can byed ba 
BO_T04_D3875b:120a-14	gzhan yang gang gis zhes bya ba la sogs pa la /	120a	gzhan yang gang gis zhes byed ba la sogs ba la 
BO_T04_D3875b:120a-15	de zhes pa ni de lta bu'i las de byas pa'o //	120a	de zhes ba ni de lta bu las de byed ba 
BO_T04_D3875b:120a-16	de lta ma yin na las byas pa'i 'bras bu bdag gis bsal bar ga la nus zhes bya ba'o //	120a	de lta ma yin na las byed ba bras bu bdag gis bsal ba ga la nus zhes byed ba 
BO_T04_D3875b:120a-17	de ltar zhes bya ba la sogs pa ni go sla'o //	120a	de ltar zhes byed ba la sogs ba ni go sla 
BO_T04_D3875b:120a-18	ji lta bur 'bad par bya snyam pa la /	120a	ji lta bur bad ba byed snyam ba la 
BO_T04_D3875b:120a-19	dper na khyim tshig pa zhes bya ba la sogs pa smos te /	120a	dper na khyim tshig ba zhes byed ba la sogs ba smos te 
BO_T04_D3875b:120a-20	mched pa zhes pa ni khyad par du 'gyur pa'i las su byed pa'o //	120a	mched ba zhes ba ni khyad ba du gyur ba las su byed ba 
BO_T04_D3875b:120a-21	de ni zhes pa ni rtsva la sogs pa'o //	120a	de ni zhes ba ni rtsva la sogs ba 
BO_T04_D3875b:120a-22	gang la sems chags pa ni kun du zhen par gyur pa'o //	120a	gang la sems chags ba ni kun du zhen ba gyur ba 
BO_T04_D3875b:120a-23	me mched ba ni gdung bar byed pa'o //	120a	me mched ba ni gdung ba byed ba 
BO_T04_D3875b:120a-24	bsod nams ni rang gi lus so //	120a	bsod nams ni rang gi lus so 
BO_T04_D3875b:120a-25	tshig pa ni de yongs su nyams par byed pa'o //	120a	tshig ba ni de yongs su nyams ba byed ba 
BO_T04_D3875b:120a-26	dor zhes pa ni las su byas pa'o //	120a	dor zhes ba ni las su byed ba 
BO_T04_D3875b:120a-27	gzhan yang 'di ltar mi'i sdug bsngal bag tsam gyis dmyal ba'i las kyi 'bras bu bral bar byed pa 'di ni rnyed pa dam pa'o zhes bstan pa'i phyir /	120a	gzhan yang di ltar mi sdug sngal bag tsam gyis dmyal ba las kyi bras bu bral ba byed ba di ni rnyed ba dam ba zhes ston ba phyir 
BO_T04_D3875b:120a-28	gsad bya'i btags mi zhig ces smos so //	120a	gsad byed dogs mi jig ces smos so 
BO_T04_D3875b:120a-29	kho bos ni sdug bsngal bag tsam yang bsran par mi nus so snyam pa la /	120a	kho bod ni sdug sngal bag tsam yang bsran ba mi nus so snyam ba la 
BO_T04_D3875b:120a-30	da lta'i sdug bsngal zhes bya ba la sogs pa smos te /	120a	da lta sdug sngal zhes byed ba la sogs ba smos te 
BO_T04_D3875b:120a-31	'di tsam zhes pa ni chung ngu 'di tsam mo //	120a	di tsam zhes ba ni chung ngu di tsam mo 
BO_T04_D3875b:120a-32	khro ba ci ste zhes pa ni dmyal ba'i rgyu khong khro ba ci ste mi bzlog ces pa'o //	120a	khro ba ci ste zhes ba ni dmyal ba rgyu khong khro ba ci ste mi bzlog ces ba 
BO_T04_D3875b:120a-33	'di lta bur zhes pa ni 'bras bu med pa nyid du'o //	120a	di lta bur zhes ba ni bras bu med ba nyid du 
BO_T04_D3875b:120a-34	myong bar gyur yang zhes pa ni bsreg pa dang bcad pa la sogs pa'i rgyus mnar bar gyur pa'o //	120a	myong ba gyur yang zhes ba ni bsreg ba dang gcod ba la sogs ba rgyus mnar ba gyur ba 
BO_T04_D3875b:120a-35	'di ni zhes bya ba ni spyod pa la sogs pa'o //	120a	di ni zhes byed ba ni spyod ba la sogs ba 
BO_T04_D3875b:120b-0	de @120b tsam zhes pa ni dmyal ba la sogs pa tsam mo //	120b	de tsam zhes ba ni dmyal ba la sogs ba tsam mo 
BO_T04_D3875b:120b-1	don chen ni sangs rgyas nyid du'o //	120b	don chen ni sangs rgya nyid du 
BO_T04_D3875b:120b-2	de'i phyir spyod pa la sogs pa'i sdug bsngal la dga' ba kho nar rigs so //	120b	de phyir spyod ba la sogs ba sdug sngal la dga ba kho nar rigs so 
BO_T04_D3875b:120b-3	gzhan gyi yon tan brjod pa thos pa la phrag dog gi dri ma bkru ba bstan pa'i phyir /	120b	gzhan gyi yon tan rjod ba thos ba la phrag dog gi dri ma khrud ba ston ba phyir 
BO_T04_D3875b:120b-4	gzhan gyis zhes bya ba la sogs pa smos te kyi yid khyod kyis kyang yon tan lhag tu bstod nas dga' ba nyams su myong ba ci'i phyir mi byed /	120b	gzhan gyis zhes byed ba la sogs ba smos te kyi yid khyod kyis kyang yon tan lhag tu bstod nas dga ba nyams su myong ba ci phyir mi byed 
BO_T04_D3875b:120b-5	'di zhes pa ni skyes pa 'di'i bde ba dang dga' ba'o //	120b	di zhes ba ni skye ba di bde ba dang dga ba 
BO_T04_D3875b:120b-6	bde ba 'byung ba ni 'di las gzhan gyi bde ba 'byung ba'o //	120b	bde ba byung ba ni di las gzhan gyi bde ba byung ba 
BO_T04_D3875b:120b-7	kha na ma tho ba med pa ni tshe 'dir ro //	120b	kha na ma tho ba med ba ni tshe dir ro 
BO_T04_D3875b:120b-8	yon tan dang ldan pa ni sangs rgyas la sogs pa'o //	120b	yon tan dang ldan ba ni sangs rgya la sogs ba 
BO_T04_D3875b:120b-9	de kho na nyid la bstod pas bdag la bde ba skye ba'o //	120b	de kho na nyid la bstod ba bdag la bde ba skye ba 
BO_T04_D3875b:120b-10	gzhan gyi yon tan la zhes sdang bas bdag bde ba mi 'dod pa ni dga' ba mi 'dod pa'o //	120b	gzhan gyi yon tan la zhes sdang ba bdag bde ba mi dod ba ni dga ba mi dod ba 
BO_T04_D3875b:120b-11	de lta na de'i tshe gla rngan la sogs pa byin pas kyang de kho na dga' bar 'gyur bas na /	120b	de lta na de tshe gla rngan la sogs ba byin ba kyang de kho na dga ba gyur ba na 
BO_T04_D3875b:120b-12	'dir de las kyang khyod ldog par 'gyur ro //	120b	dir de las kyang khyod ldog ba gyur ro 
BO_T04_D3875b:120b-13	las byed pa med pa las ni mthong ba nyams par 'gyur ro //	120b	las byed ba med ba las ni mthong ba nyams ba gyur ro 
BO_T04_D3875b:120b-14	las byed pa la gla rngan ma byin pa'i sdig pas ni ma mthong ba yang nyams par 'gyur ro //	120b	las byed ba la gla rngan ma byin ba sdig ba ni ma mthong ba yang nyams ba gyur ro 
BO_T04_D3875b:120b-15	gzhan yang khyod kyi yon tan gzhan gyis bsgrags pa de'i tshe gzhan gyi yon tan sgrogs mkhas pa la bde ba 'dod par byed dam pa'o //	120b	gzhan yang khyod kyi yon tan gzhan gyis sgrog ba de tshe gzhan gyi yon tan sgrogs mkhas ba la bde ba dod ba byed dam ba 
BO_T04_D3875b:120b-16	gzhan gyi yon tan ni dgra'i yon tan no //	120b	gzhan gyi yon tan ni dgra yon tan no 
BO_T04_D3875b:120b-17	gzhan gyi yon tan phun sum tshogs pa la mi bzod pa bzlog pa'i phyir /	120b	gzhan gyi yon tan phun sum tshogs ba la mi bzod ba bzlog ba phyir 
BO_T04_D3875b:120b-18	sems can zhes bya ba la sogs pa smos so //	120b	sems can zhes byed ba la sogs ba smos so 
BO_T04_D3875b:120b-19	sangs rgyas nyid du dam bcas kyi de las gzhan gyi bde ba sbyin par byed par khas blangs pa med pas mi bzod pa byas kyang mi 'gal zhes gal te rgol ba la /	120b	sangs rgya nyid du dam cha kyi de las gzhan gyi bde ba sbyin ba byed ba khas blangs ba med ba mi bzod ba byed kyang mi gal zhes gal te rgol ba la 
BO_T04_D3875b:120b-20	bsnyen bkur zhes smos te /	120b	snyen bkur zhes smos te 
BO_T04_D3875b:120b-21	ngan don tsam la yang mi bzod cing khro bar byed na de la byang chub kyi sems lta ga la srid ces pa'o //	120b	ngan don tsam la yang mi bzod cing khro ba byed na de la byang chub kyi sems lta ga la srid ces ba 
BO_T04_D3875b:120b-22	rnam grangs gzhan gyi sgo nas gdams par bzhed nas gal te zhes smos te /	120b	rnam grangs gzhan gyi sgo nas doms ba bzhed nas gal te zhes smos te 
BO_T04_D3875b:120b-23	des zhes pa ni gzhan gyis so //	120b	des zhes ba ni gzhan gyis so 
BO_T04_D3875b:120b-24	de zhes pa ni rdzas so ;	120b	de zhes ba ni rdzas so 
BO_T04_D3875b:120b-25	/ med ces pa ni khyod kyis mi thob pa'o //	120b	med ces ba ni khyod kyis mi thob ba 
BO_T04_D3875b:120b-26	ci bya zhes pa ni byin pa 'am ma byin yang rung gal ci che ba'o //	120b	ci byed zhes ba ni byin ba mang ma byin yang rung gal ci che ba 
BO_T04_D3875b:120b-27	dad pa ni ster mkhan gyi dad pa'o //	120b	dad ba ni ster mkhan gyi dad ba 
BO_T04_D3875b:120b-28	rang gi yon tan yang ngo //	120b	rang gi yon tan yang ngo 
BO_T04_D3875b:120b-29	ci'i phyir 'dor zhes pa ni 'bras bu cung zad kyang ma byin cig ces ci nas 'gegs par byed ces pa'o //	120b	ci phyir dor zhes ba ni bras bu cung zad kyang ma byin cig ces ci nas gegs ba byed ces ba 
BO_T04_D3875b:121a-0	gzhan gyi @121a * //	121a	gzhan gyi 
BO_T04_D3875b:121a-1	rnyed pa las byung ba'i bar mi 'dod pa bkag nas /	121a	rnyed ba las byung ba ba mi dod ba gog nas 
BO_T04_D3875b:121a-2	da ni mi 'dod pa las byung ba'i dga' ba dgag pa'i phyir /	121a	da ni mi dod ba las byung ba dga ba gog ba phyir 
BO_T04_D3875b:121a-3	gal te dgra zhig ces smos te /	121a	gal te dgra jig ces smos te 
BO_T04_D3875b:121a-4	ci zhig yod ces pa ni de la cung zad cig kyang gnod par mi 'gyur zhes bya ba'i don to //	121a	ci jig yod ces ba ni de la cung zad cig kyang gnod ba mi gyur zhes byed ba don to 
BO_T04_D3875b:121a-5	gal te bdag gis bsngags par ma byas pa nyid kyis de la mi 'dod pa skye bar 'gyur ro snyam pa la /	121a	gal te bdag gis bsngags ba ma byed ba nyid kyis de la mi dod ba skye ba gyur ro snyam ba la 
BO_T04_D3875b:121a-6	khyod kyis zhes smos te /	121a	khyod kyis zhes smos te 
BO_T04_D3875b:121a-7	rgyur mi 'gyur zhes pa ni sngon gyi las med par zhes bya'o //	121a	rgyur mi gyur zhes ba ni sngon gyi las med ba zhes byed 
BO_T04_D3875b:121a-8	ci ste khyod kyi 'dod pa kho nas gzhan gyi sdug bsngal de'i rgyur grub pa de lta na'ang gzhan gyi sdug bsngal de la khyod dgar ci yod de /	121a	ci ste khyod kyi dod ba kho nas gzhan gyi sdug sngal de rgyur grub ba de lta na gzhan gyi sdug sngal de la khyod dgar ci yod de 
BO_T04_D3875b:121a-9	'bras bu med pa nyid do zhes bya ba'i don to //	121a	bras bu med ba nyid do zhes byed ba don to 
BO_T04_D3875b:121a-10	'tsheng ba ni dgos pa'o //	121a	tsheng ba ni dgos ba 
BO_T04_D3875b:121a-11	de las ma gtogs pa'i phung ba med pa ni 'di nyid 'bras bu med par phung ba nyid do zhes bya ba'o //	121a	de las ma gtogs ba phung ba med ba ni di nyid bras bu med ba phung ba nyid do zhes byed ba 
BO_T04_D3875b:121a-12	ci'i phyir na 'di phung ba yin snyam pa la /	121a	ci phyir na di phung ba yin snyam ba la 
BO_T04_D3875b:121a-13	nyon mongs zhes smos te /	121a	nyon mongs zhes smos te 
BO_T04_D3875b:121a-14	nyon mongs pa nyid mchil ba 'debs par byed pas nya pa'o //	121a	nyon mongs ba nyid mchil ba debs ba byed ba nya ba 
BO_T04_D3875b:121a-15	mchil ba dang 'dra bas na mchil ba ste /	121a	mchil ba dang dra ba na mchil ba ste 
BO_T04_D3875b:121a-16	nya gzung bar bya ba'i don du sha dang bcas pa'i lcags kyu'o //	121a	nya gzung ba byed ba don du sha dang cha ba lcags kyu 
BO_T04_D3875b:121a-17	mi bzad ces pa ni shin tu gzer ba'o //	121a	mi bzad ces ba ni shin tu gzer ba 
BO_T04_D3875b:121a-18	gang nya pa dang 'dra ba'i nyon mongs pa des bsod nams kyi chu bo nas nya dang 'dra ba khyod bzung nas kha chung la gsus pa che ba'i bum par bcug cing 'tshed par 'gyur ba'o //	121a	gang nya ba dang dra ba nyon mongs ba des bsod nams kyi chu bo nas nya dang dra ba khyod bzung nas kha chung la gsus ba che ba bum ba jug cing tshed ba gyur ba 
BO_T04_D3875b:121a-19	bstod pa la sogs pa la yang khengs par mi bya'o zhes gdams pa'i phyir /	121a	bstod ba la sogs ba la yang kheng ba mi byed zhes doms ba phyir 
BO_T04_D3875b:121a-20	bstod dang zhes bya ba la sogs pa smos te /	121a	bstod dang zhes byed ba la sogs ba smos te 
BO_T04_D3875b:121a-21	skyes bu rnams kyi don du gnyer bar 'dod pa'i rnam pa ni lnga ste /	121a	skye bu rnams kyi don du gnyer ba dod ba rnam ba ni lnga ste 
BO_T04_D3875b:121a-22	bsod nams dang / tshe dang / stobs dang / nad med pa dang / lus bde ba rnams so //	121a	bsod nams dang tshe dang stobs dang nad med ba dang lus bde ba rnams so 
BO_T04_D3875b:121a-23	bstod pa ni yon tan brjod pa'o //	121a	bstod ba ni yon tan rjod ba 
BO_T04_D3875b:121a-24	stobs ni lus las byung ba'o //	121a	stobs ni lus las byung ba 
BO_T04_D3875b:121a-25	shes gyur ni mkhas par gyur na'o //	121a	shes gyur ni mkhas ba gyur na 
BO_T04_D3875b:121a-26	de la zhes pa ni rnam pa lngar brjod pa la'o //	121a	de la zhes ba ni rnam ba lngar rjod ba la 
BO_T04_D3875b:121a-27	ci ste yid kyang bde bar bya ru yod pa ma yin nam de ji ltar nges par gzung bar bya snyam du dogs pa la /	121a	ci ste yid kyang bde ba byed ru yod ba ma yin nam de ji ltar nges ba gzung ba byed snyam du dogs ba la 
BO_T04_D3875b:121a-28	yid bde zhes smos te /	121a	yid bde zhes smos te 
BO_T04_D3875b:121a-29	gzhan yang bstod pa la sogs pa ni slu byed nyid do zhes bstan pa'i phyir /	121a	gzhan yang bstod ba la sogs ba ni slu byed nyid do zhes ston ba phyir 
BO_T04_D3875b:121a-30	grags pa'i zhes smos te /	121a	grags ba zhes smos te 
BO_T04_D3875b:121a-31	tshig 'bru ni bstod pa'i tshig rnams so //	121a	tshig bru ni bstod ba tshig rnams so 
BO_T04_D3875b:121a-32	bde ba ni grags pa la sogs pa'i bde ba'o //	121a	bde ba ni grags ba la sogs ba bde ba 
BO_T04_D3875b:121b-0	yang brtag pa gzhan gyi sgo nas 'di dag rnams ni byis pa'i chos nyid du bstan pa'i @121b phyir ;	121b	yang rtog ba gzhan gyi sgo nas di dag rnams ni byis ba chos nyid du ston ba phyir 
