segmentnr	original	stemmed
BO_T02_D2627:270b-16	mngon sum pa'i rgyu ye shes te de'i sgra yang snga ma bzhin no //	mngon sum ba rgyu ye shes te de sgra yang snga ma bzhin no 
BO_T02_D2627:270b-17	gtso bo ni rig pa'o //	gtso bo ni rig ba 
BO_T02_D2627:270b-18	aom grum sv'a h'a snying po yang dag par bskul ba'o zhes bya ba ni thugs rjes thugs yang dag par bskul ba'i rig pa'o //	aom grum sva ha snying po yang dag ba skul ba zhes byed ba ni thugs rjes thugs yang dag ba skul ba rig ba 
BO_T02_D2627:270b-19	de'i sgra yang snga ma bzhin te /	de sgra yang snga ma bzhin te 
BO_T02_D2627:270b-20	khro bo'i rig pa'o //	khro bo rig ba 
BO_T02_D2627:270b-21	aom tram sv'a h'a snying po dam ba'o zhes bya ba ni mnyam pa nyid kyi ye shes te sgral yang de bzhin no //	aom tram sva ha snying po dam ba zhes byed ba ni mnyam ba nyid kyi ye shes te sgral yang de bzhin no 
BO_T02_D2627:270b-22	nam mkha'i snying po'i rig pa'o //	nam mkha snying po rig ba 
BO_T02_D2627:270b-23	aom hri sv'am h'a /	aom hri sv ha 
BO_T02_D2627:270b-24	gsang ba'i snying po'o zhes bya ba ni so sor kun du rtog pa'i ye shes te spyan ras gzigs kyi rig pa'o //	gsang ba snying po zhes byed ba ni so sor kun du rtogs ba ye shes te spyan ras gzigs kyi rig ba 
BO_T02_D2627:270b-25	'di dag gis ni dkyil 'khor rgyal po mchog gi ting nge 'dzin bstan to ;	di dag gis ni dkyil khor rgyal po mchog gi ting nge dzin ston to 
BO_T02_D2627:270b-26	/ snga ma bzhin du bsgom par bya'o zhes bya ba'i don to //	snga ma bzhin du bsgom ba byed zhes byed ba don to 
BO_T02_D2627:270b-27	las kyi rgyal po mchog gi ting nge 'dzin ni snga ma bzhin du shes par bya'o //	las kyi rgyal po mchog gi ting nge dzin ni snga ma bzhin du shes ba byed 
BO_T02_D2627:270b-28	de nas de dag gi dkyil 'khor bstan te zhes bya ba la sogs pas slob dpon gyi las bstan te snga ma bzhin du bsnyen pa la sogs pa sngon du 'gro bas phyi'i dkyil 'khor bris te /	de nas de dag gi dkyil khor ston te zhes byed ba la sogs ba slob dpon gyi las ston te snga ma bzhin du snyen ba la sogs ba sngon du gro ba phyi dkyil khor bri te 
BO_T02_D2627:270b-29	nang gi dkyil 'khor du 'khor lo rtsibs bzhi ba bris la dbul su de bzhin gshegs pa tshe dang tshogs dang gzi brjid tshad med pa gzhag pa bhr'um zhes bya bas so //	nang gi dkyil khor du khor lo rtsibs bzhi ba bri la bul su de bzhin gshegs ba tshe dang tshogs dang gzi brjid tshad med ba jog ba bhrum zhes byed ba so 
BO_T02_D2627:270b-30	spyan sngar phyag na rdo rje ste hri zhes bya ba'i snying pos gzhag go //	spyan sngar phyag na rdo rje ste hri zhes byed ba snying pos jog go 
BO_T02_D2627:271a-0	byang phyogs su khro bo ste krum @271a * //	byang phyogs su khro bo ste krum 
BO_T02_D2627:271a-1	zhes bya ba'i snying pos so //	zhes byed ba snying pos so 
BO_T02_D2627:271a-2	lho phyogs su nam mkha' snying po'i snying po ste /	lho phyogs su nam mkha snying po snying po ste 
BO_T02_D2627:271a-3	tram zhes bya ba'i snying pos so //	tram zhes byed ba snying pos so 
BO_T02_D2627:271a-4	nub phyogs su spyan ras gzigs te hri zhes bya ba'i snying pos so //	nub phyogs su spyan ras gzigs te hri zhes byed ba snying pos so 
BO_T02_D2627:271a-5	kun gyi 'od la aom pu n+ye zhes bya ba la sogs pa'i rig pa bri'o //	kun gyi d la aom pu n+ye zhes byed ba la sogs ba rig ba bri 
BO_T02_D2627:271a-6	dbang bskur ba'i bum pa lnga dang / mchod pa'i bum pa brgyad dang / tram zhes bya ba'i sngags kyi bzlas brjod byas te gzhag go //	dbang skur ba bum ba lnga dang mchod ba bum ba brgyad dang tram zhes byed ba sngags kyi bzlas rjod byed te jog go 
BO_T02_D2627:271a-7	bdug pa la sogs pa'i mchod rdzas kun la /	bdug ba la sogs ba mchod rdzas kun la 
BO_T02_D2627:271a-8	krum zhes bya ba'i bzlas pas gzhag /	krum zhes byed ba bzlas ba jog 
BO_T02_D2627:271a-9	gzhan yang mchod pa'i lha mo brgyad dang sgo ba bzhi snga ma bzhin du bri'o //	gzhan yang mchod ba lha mo brgyad dang sgo ba bzhi snga ma bzhin du bri 
BO_T02_D2627:271a-10	de nas / dgongs ka'i dus la bab pa dang // zhes bya ba ni de nas sngags mkhan bdag nyid zhugs la bde bar gshegs pa sras dang 'bangs su bcas pa'i 'khor gyis bskor te rig pa dang lhan cig spyan drang ngo //	de nas dgongs ka dus la bab ba dang zhes byed ba ni de nas sngags mkhan bdag nyid jug la bde ba gshegs ba sras dang bang su cha ba khor gyis skor te rig ba dang lhan cig spyan dren ngo 
BO_T02_D2627:271a-11	de nas bdag nyid dbang bskur te //	de nas bdag nyid dbang skur te 
BO_T02_D2627:271a-12	skyil krung bcas te 'dug la stong phrag brgyar bzlas na de bzhin gshegs pa'am rdo rje 'dzin pa'am /	skyil krung cha te dug la stong phrag brgyar bzlas na de bzhin gshegs ba rdo rje dzin ba 
BO_T02_D2627:271a-13	'phags pa spyan ras gzigs kyi dbang phyug kyang rung ste mngon sum du mthong nas 'dod pa'i mtshan ma so sor thob par 'gyur ro //	phag ba spyan ras gzigs kyi dbang phyug kyang rung ste mngon sum du mthong nas dod ba mtshan ma so sor thob ba gyur ro 
BO_T02_D2627:271a-14	ci ste mnyam par ma bzhag na yid kyis thams cad nus par 'gyur ro //	ci ste mnyam ba ma jog na yid kyis thams cad nus ba gyur ro 
BO_T02_D2627:271a-15	de nas rdo rje 'dzin ma'i phyag rgya bcings nas /	de nas rdo rje dzin ma phyag rgya ching nas 
BO_T02_D2627:271a-16	aom badzra dh'a ra /	aom badzra dha ra 
BO_T02_D2627:271a-17	ratna dh'a ra /	ratna dha ra 
BO_T02_D2627:271a-18	padma dh'a ra /	padma dha ra 
BO_T02_D2627:271a-19	bi shva dh'a ra /	bi shva dha ra 
BO_T02_D2627:271a-20	ta th'a ga ta sa ma ya ma ti kra ma tha ta th'a ga ta sa ma ya dh'a ra a'atma ko&amp; ham zhes bya ba'i nga rgyal bskyed la zhes bya ba ni sngags pa nyid zhugs la lhag chad zhi bar byas nas ting nge 'dzin gsum sngon	ta tha ga ta sa ma ya ma ti kra ma tha ta tha ga ta sa ma ya dha ra aatma ko&amp; ham zhes byed ba nga rgyal skyed la zhes byed ba ni sngags ba nyid jug la lhag chad zhi ba byed nas ting nge dzin gsum sngon 
BO_T02_D2627:271a-21	du 'gro bas sgo phye ste /	du gro ba sgo byed ste 
BO_T02_D2627:271a-22	rgyal ba sras dang bcas pa rig pa dang lhan cig spyan drang ngo //	rgyal ba sras dang cha ba rig ba dang lhan cig spyan dren ngo 
BO_T02_D2627:271a-23	de nas lcags kyu la sogs pas las bya /	de nas lcags kyu la sogs ba las byed 
BO_T02_D2627:271a-24	phyag rgya bzhis rgyas gdab /	phyag rgya bzhis rgya gdab 
BO_T02_D2627:271a-25	dbang bskur / bzlas pa dang / mchod pa dang / gtor ma dang / sbyin sreg dang gnang ba nong pa'i bar du bya'o //	dbang skur bzlas ba dang mchod ba dang thor ma dang sbyin sreg dang gnang ba nongs ba ba du byed 
BO_T02_D2627:271a-26	de nas slob ma 'jug pa'i cho gas zhugs te /	de nas slob ma jug ba cho gas jug te 
BO_T02_D2627:271a-27	bdag nyid dbang nyi shu rtsa gcig bskur nas /	bdag nyid dbang nyi shu rtsa gcig skur nas 
BO_T02_D2627:271a-28	skyil krung bcas nas 'bum bzlas na de bzhin gshegs pa la sogs pa dkyil 'khor gyi gtso bo mngon sum du mthong nas 'bras bu mchog thob po //	skyil krung cha nas bum bzlas na de bzhin gshegs ba la sogs ba dkyil khor gyi gtso bo mngon sum du mthong nas bras bu mchog thob po 
BO_T02_D2627:271b-0	bzlas brjod ma byas kyang yid kyis las thams cad byed nus bar @271b 'gyur ro //	bzlas rjod ma byed kyang yid kyis las thams cad byed nus ba gyur ro 
BO_T02_D2627:271b-1	de nas rdo rje 'dzin ma'i phyag rgya bcings nas /	de nas rdo rje dzin ma phyag rgya ching nas 
BO_T02_D2627:271b-2	rdo rje 'dzin gyi phyag rgyas 'jug pa yin no zhes bya ba'am /	rdo rje dzin gyi phyag rgya jug ba yin no zhes byed ba 
BO_T02_D2627:271b-3	rin chen 'dzin dang / padma 'dzin dang / khro bo dang de bzhin gshegs pa'i 'jug pa ni nga yin zhes nga rgyal bskyed la zhes bya ba'i don to //	rin chen dzin dang padma dzin dang khro bo dang de bzhin gshegs ba jug ba ni nga yin zhes nga rgyal skyed la zhes byed ba don to 
BO_T02_D2627:271b-4	de nas slob ma rnams gzhug par bya'o zhes bya ba la sogs pas slob ma gzhug pa la sogs pa ston te de yang rtsa ba'i rgyud du bshad pa bzhin du ye shes dbab pa'i mthar thug pa byas la 'dir me tog dor bar bya'o //	de nas slob ma rnams jug ba byed zhes byed ba la sogs ba slob ma jug ba la sogs ba ston te de yang rtsa ba brgyud du chad ba bzhin du ye shes bebs ba mthar thug ba byed la dir me tog dor ba byed 
BO_T02_D2627:271b-5	aom sarba ta th'a ga ta pra t'i tstsha ho sa ma ya stv'am /	aom sarba ta tha ga ta pra t tstsha ho sa ma ya stv 
BO_T02_D2627:271b-6	de nyid brjod la mgo la bcings gdong g-yogs dgrol //	de nyid rjod la mgo la ching gdong g-yogs grol 
BO_T02_D2627:271b-7	lha ngo bstan 'jug pa'i phyag rgya snying gar bstan /	lha ngo ston jug ba phyag rgya snying gar ston 
BO_T02_D2627:271b-8	dbang bskur bar bya ste snga ma bzhin du shar phyogs kyi sgor ba zhag la /	dbang skur ba byed ste snga ma bzhin du char phyogs kyi sgor ba zhag la 
BO_T02_D2627:271b-9	aom sarba ta th'a ga ta aa bhi shinytsa badzra dh'a tu aa dzny'a h'um bhr'um /	aom sarba ta tha ga ta aa bhi shinytsa badzra dha tu aa dznya hum bhrum 
BO_T02_D2627:271b-10	zhes bya ba dang gtso bo'i bum pas dbang bskur ro //	zhes byed ba dang gtso bo bum ba dbang skur ro 
BO_T02_D2627:271b-11	aom badzra badzra aabhi shinytsa h'um h'um /	aom badzra badzra aabhi shinytsa hum hum 
BO_T02_D2627:271b-12	zhes byas pas rdo rje 'dzin pa'i bum pas dbang bskur ro //	zhes byed ba rdo rje dzin ba bum ba dbang skur ro 
BO_T02_D2627:271b-13	aom ratna aa bhi shinytsa h'um tram /	aom ratna aa bhi shinytsa hum tram 
BO_T02_D2627:271b-14	zhes bya bas nam mkha'i snying po'i bum pas dbang bskur ro //	zhes byed ba nam mkha snying po bum ba dbang skur ro 
BO_T02_D2627:271b-15	aom padma aa bhe shinytsa h'um hr'i:/	aom padma aa bhe shinytsa hum 
BO_T02_D2627:271b-16	zhes pas spyan ras gzigs kyi bum pas dbang bskur ro //	zhes ba spyan ras gzigs kyi bum ba dbang skur ro 
BO_T02_D2627:271b-17	de nas karma aa bhi shinytsa h'um krum zhes bya ba dang khro bo'i bum pas dbang bskur ro //	de nas karma aa bhi shinytsa hum krum zhes byed ba dang khro bo bum ba dbang skur ro 
BO_T02_D2627:271b-18	dbang lhag ma nyi shus kyang dbang bskur bar bya ste /	dbang lhag ma nyi shus kyang dbang skur ba byed ste 
BO_T02_D2627:271b-19	de la dam tshig ni 'di yin no //	de la dam tshig ni di yin no 
BO_T02_D2627:271b-20	dkon mchog gsum dang byang chub kyi sems dang bla ma mi spang ngo //	dkon(d) mchog gsum dang byang chub kyi sems dang bla ma mi spong ngo 
BO_T02_D2627:271b-21	srog chags mi gsad ma byin par mi blang /	srog chags mi gsad ma byin ba mi blang 
BO_T02_D2627:271b-22	brdzun du smra bar mi bya /	brdzun du smra ba mi byed 
BO_T02_D2627:271b-23	gzhan gyi bud med la mi spyad //	gzhan gyi bud med la mi spyod 
BO_T02_D2627:271b-24	bla ma'i grib ma la mi 'gom //	bla ma grib ma la mi gom 
BO_T02_D2627:271b-25	slob dpon du yon tan can ma yin pa mi gzung /	slob dpon du yon tan can ma yin ba mi gzung 
BO_T02_D2627:271b-26	slob dpon gyi mtshan nas mi brjod /	slob dpon gyi mtshan nas mi rjod 
BO_T02_D2627:271b-27	sngags dang phyag rgya dang lha la mi smad gal te glen pas smad na nad kyis thebs nas 'chi bar 'gyur ro //	sngags dang phyag rgya dang lha la mi smad gal te glen ba smad na nad kyis thebs nas chi ba gyur ro 
BO_T02_D2627:271b-28	snying po dang lha'i grib ma dang phyag rgya dang gom bas mi 'gom /	snying po dang lha grib ma dang phyag rgya dang gom ba mi gom 
BO_T02_D2627:271b-29	dkon mchog gsum dang bstan pa la gnod pa dang bla ma la smod pa rnams ngan sngags kyis gsad par bya'o //	dkon(d) mchog gsum dang ston ba la gnod ba dang bla ma la smod ba rnams ngan sngags kyis gsad ba byed 
BO_T02_D2627:271b-30	log par lta ba dang sdig pa spyod pa dang sems can la gnod pa dang dam tshig la sdang ba rnams snying rje chen pos ngan sngags kyis gsad par bya'o //	log ba lta ba dang sdig ba spyod ba dang sems can la gnod ba dang dam tshig la sdang ba rnams snying rje chen pos ngan sngags kyis gsad ba byed 
BO_T02_D2627:272a-0	'jungs @272a * //	jungs 
BO_T02_D2627:272a-1	pa can gyi nor blangs la //	ba can gyi nor blangs la 
BO_T02_D2627:272a-2	phongs pa rnams la sbyin par bya //	phong ba rnams la sbyin ba byed 
BO_T02_D2627:272a-3	bla ma la mchod pa bya ba'i phyir dang / dam tshig bsgrub pa'i phyir dang / dkyil 'khor mchod pa'i phyir dang / dam tshig can la phan pa'i phyir dang / rgyal ba sras dang bcas pa la mchod pa'i phyir du 'jungs pa rnams kyi nor da brog go //	bla ma la mchod ba byed ba phyir dang dam tshig sgrub ba phyir dang dkyil khor mchod ba phyir dang dam tshig can la phan ba phyir dang rgyal ba sras dang cha ba la mchod ba phyir du jungs ba rnams kyi nor da brog go 
BO_T02_D2627:272a-4	sems can la phan par 'dod pas bla ma'i nor dang / srog chags kyi srog bsrung ba'i phyir brdzun du smra bar bya'o //	sems can la phan ba dod ba bla ma nor dang srog chags kyi srog bsrung ba phyir brdzun du smra ba byed 
BO_T02_D2627:272a-5	sangs rgyas mnyes par bya ba'i phyir dam tshig srung ba dang bsgrub pa'i phyir gzhan gyi bud med bsten par bya'o //	sangs rgya mnyes ba byed ba phyir dam tshig srung ba dang sgrub ba phyir gzhan gyi bud med sten ba byed 
BO_T02_D2627:272a-6	de dag kyang ji lta bu zhe na /	de dag kyang ji lta bu zhe na 
BO_T02_D2627:272a-7	rdo rje sems dpa'i rnal 'byor dang ldan pas thams cad spyad cing bsgrubs na 'grub par 'gyur te mnyes par mi 'gyur na /	rdo rje sems dpa rnal byor dang ldan ba thams cad spyod cing sgrub na grub ba gyur te mnyes ba mi gyur na 
BO_T02_D2627:272a-8	snying rje chen po dang ldan pa'i thabs kyis smos kyang ci dgos zhes bya ba'i don to //	snying rje chen po dang ldan ba thabs kyis smos kyang ci dgos zhes byed ba don to 
BO_T02_D2627:272a-9	de nas bka'i dbang bskur bar bya'o //	de nas bka dbang skur ba byed 
BO_T02_D2627:272a-10	de nas las kyi rdo rje lag tu byin la las kyi dbang bskur bar bya'o //	de nas las kyi rdo rje lag tu byin la las kyi dbang skur ba byed 
BO_T02_D2627:272a-11	dbang bskur ba ni rtsa ba'i rgyud du bstan pa bzhin du shes par bya'o //	dbang skur ba ni rtsa ba brgyud du ston ba bzhin du shes ba byed 
BO_T02_D2627:272a-12	de nas bla ma la lus dang nor dang dbyig dang 'bru dang stan dang bran dang khang pa dang rgyal po yin na rgyal srid dang bu dang bu mo dang chung ma dang ma dang sring mo dang tsha bo dang / gzhan yang ci bzhed pa thams cad rang la phan pa'i phyir bla ma la dbul lo zhes bya ba'i don to //	de nas bla ma la lus dang nor dang dbyig dang bru dang stan dang bran dang khang ba dang rgyal po yin na rgyal srid dang bu dang bu mo dang chung ma dang ma dang sring mo dang tsha bo dang gzhan yang ci bzhed ba thams cad rang la phan ba phyir bla ma la bul lo zhes byed ba don to 
BO_T02_D2627:272a-13	de nas byang chub bar du ni //	de nas byang chub ba du ni 
BO_T02_D2627:272a-14	zhes bya ba la sogs pas dngos grub ston te /	zhes byed ba la sogs ba dngos grub ston te 
BO_T02_D2627:272a-15	'di nyid du dbang dang dam tshig thob pa de nas byang chub thob pa'i bar du sangs rgyas nyid dang / byang chub sems dpa' dang 'jig rten pa'i mthu chen rnams sgrub par 'dod pas slob dpon la dngos grub rnams gsol ba gdab bo //	di nyid du dbang dang dam tshig thob ba de nas byang chub thob ba ba du sangs rgya nyid dang byang chub sems dpa dang jig rten ba mthu chen rnams sgrub ba dod ba slob dpon la dngos grub rnams gsol ba gdab bo 
BO_T02_D2627:272a-16	de nas slob ma la phan pa'i phyir slob dpon ser sna med cing sems dad pa dang ldan pa'i slob ma la dngos grub rnams sbyin par bya'o zhes bya ba sbyin no //	de nas slob ma la phan ba phyir slob dpon ser sna med cing sems dad ba dang ldan ba slob ma la dngos grub rnams sbyin ba byed zhes byed ba sbyin no 
BO_T02_D2627:272a-17	ji lta bu sbyin zhen /	ji lta bu sbyin zhen 
BO_T02_D2627:272a-18	chos rnams thams cad dngos med par //	chos rnams thams cad dngos med ba 
BO_T02_D2627:272a-19	sems kyis bsgom pa byas nas kyang //	sems kyis bsgom ba byed nas kyang 
BO_T02_D2627:272a-20	aa las zla ba'i dkyil 'khor bsam //	aa las zla ba dkyil khor bsam 
BO_T02_D2627:272a-21	rang gi sa bon de dbus su //	rang gi sa bon de dbus su 
BO_T02_D2627:272a-22	bsams nas dam tshig phyag rgya dag / bsams shing de bzhin de nyid du //	bsams nas dam tshig phyag rgya dag bsams shing de bzhin de nyid du 
BO_T02_D2627:272a-23	sgrub pa yis ni bsgyur bar bya //	sgrub ba yis ni sgyur ba byed 
BO_T02_D2627:272a-24	lha yi rnal 'byor tshul du bsgyur /	lha yi rnal byor tshul du sgyur 
BO_T02_D2627:272b-0	@272b de nas rang gi sa bon dang // phyag rgyas phyag rgya de byin brlab //	de nas rang gi sa bon dang phyag rgya phyag rgya de byin brlab 
BO_T02_D2627:272b-1	lag 'og go rims ji bzhin du //	lag g go rims ji bzhin du 
BO_T02_D2627:272b-2	sangs rgyas rnams kyis dbang bskur ro //	sangs rgya rnams kyis dbang skur ro 
BO_T02_D2627:272b-3	de nas nga rgyal bskyed nas kyang //	de nas nga rgyal skyed nas kyang 
BO_T02_D2627:272b-4	zhes bya ba gsungs te /	zhes byed ba gsungs te 
BO_T02_D2627:272b-5	chos rnams thams cad ces bya ba ni mtshan nyid 'dzin pas na chos te dngos po thams cad do //	chos rnams thams cad ces byed ba ni mtshan nyid dzin ba na chos te dngos po thams cad do 
BO_T02_D2627:272b-6	dngos po med par zhes bya ba ni rgyu dang bral bas zhes bya ba'i tha tshig go //	dngos po med ba zhes byed ba ni rgyu dang bral ba zhes byed ba tha tshig go 
BO_T02_D2627:272b-7	rgyu dang bral ba de yang rgyu yod pa las skye'am med pa las skye'am gnyi ga las skye zhe na /	rgyu dang bral ba de yang rgyu yod ba las skye med ba las skye gnyi ga las skye zhe na 
BO_T02_D2627:272b-8	ci dang por yod pa las ma yin te ngo bo nyid yongs su grub zin pa ni ma 'ongs pa'i dus gzhan du skye ba don du mi rigs so //	ci dang por yod ba las ma yin te ngo bo nyid yongs su grub zin ba ni ma ngs ba dus gzhan du skye ba don du mi rigs so 
BO_T02_D2627:272b-9	gzhan du gal te yod pa skye bar 'gyur ba ni skyes zin pa'ang skye bar 'gyur ro //	gzhan du gal te yod ba skye ba gyur ba ni skye zin ba skye ba gyur ro 
BO_T02_D2627:272b-10	med pa las kyang mi skye ste shin tu gzugs med pa'i ri bong gi rva la sogs pa dang 'dra zhing skye bar 'jug pa dang mi ldan pa'i phyir ro //	med ba las kyang mi skye ste shin tu gzugs med ba ri bong gi rva la sogs ba dang dra zhing skye ba jug ba dang mi ldan ba phyir ro 
BO_T02_D2627:272b-11	gzhan du 'di dag thams cad med par 'gyur zhing gang gi phyir dngos po'i phyogs gang yang rung ba 'ga' zhig las kyang dngos po thams cad rtag tu skye bar thal bar 'gyur bas rgyu dang 'bras bu nges pa med par 'gyur ro //	gzhan du di dag thams cad med ba gyur zhing gang gi phyir dngos po phyogs gang yang rung ba ga jig las kyang dngos po thams cad rtag tu skye ba thal ba gyur ba rgyu dang bras bu nges ba med ba gyur ro 
BO_T02_D2627:272b-12	gal te so so'i nus pa nges par mi 'gyur bar dngos po 'di rnams kyi nus pa so sor nges par gyur na ni dngos po de rnams las cung zad cig skye bar 'gyur bas khyad par med pas kyang thams cad med pa yin no zhe na /	gal te so so nus ba nges ba mi gyur ba dngos po di rnams kyi nus ba so sor nges ba gyur na ni dngos po de rnams las cung zad cig skye ba gyur ba khyad ba med ba kyang thams cad med ba yin no zhe na 
BO_T02_D2627:272b-13	de ni mi rigs te 'bras bu rnams dang 'dres pa'i gzugs rnams rkyen du gyur na ni de'i tshe de rnams kyis so sor nges pa'i 'bras bu dang 'brel par 'gyur bas 'bras bu gang zhig la nges par nus pa yin /	de ni mi rigs te bras bu rnams dang dre ba gzugs rnams rkyen du gyur na ni de tshe de rnams kyis so sor nges ba bras bu dang brel ba gyur ba bras bu gang jig la nges ba nus ba yin 
BO_T02_D2627:272b-14	de lta na nus pa nges pa med pa nyid du gnas par 'gyur ro //	de lta na nus ba nges ba med ba nyid du gnas ba gyur ro 
BO_T02_D2627:272b-15	de bas na thams cad las thams cad skye bar thal bar 'gyur bas bzlog dka' bar 'gyur ba dang yod pa dang med pa'i phyogs su smras pa'i nyes pa dang 'dres par 'gyur ro //	de ba na thams cad las thams cad skye ba thal ba gyur ba bzlog dka ba gyur ba dang yod ba dang med ba phyogs su smras ba nyes ba dang dre ba gyur ro 
BO_T02_D2627:272b-16	gnyi ga las kyang mi skye ste gcig la ngo bo nyid gnyis su 'gyur ba med de /	gnyi ga las kyang mi skye ste gcig la ngo bo nyid gnyis su gyur ba med de 
BO_T02_D2627:272b-17	gcig pa nyid dang gnyis pa nyid ni phan tshun 'gal ba'i phyir de yang /	gcig ba nyid dang gnyis ba nyid ni phan tshun gal ba phyir de yang 
BO_T02_D2627:272b-18	yod dang med pa'i don la yang //	yod dang med ba don la yang 
BO_T02_D2627:272b-19	rkyen ni rung ba ma yin te //	rkyen ni rung ba ma yin te 
BO_T02_D2627:272b-20	yod na rkyen gyis ci zhig bya //	yod na rkyen gyis ci jig byed 
BO_T02_D2627:272b-21	med na gang gi rkyen du 'gyur //	med na gang gi rkyen du gyur 
BO_T02_D2627:273a-0	gang tshe chos @273a * //	gang tshe chos 
BO_T02_D2627:273a-1	ni yod pa na //	ni yod ba na 
BO_T02_D2627:273a-2	med dang yod min mi sgrub pa //	med dang yod min mi sgrub ba 
BO_T02_D2627:273a-3	ji ltar sgrub byed rgyu zhes bya //	ji ltar sgrub byed rgyu zhes byed 
BO_T02_D2627:273a-4	de ltar yin na mi rigs so //	de ltar yin na mi rigs so 
BO_T02_D2627:273a-5	rkyen rnams so so 'dus pa las //	rkyen rnams so so du ba las 
BO_T02_D2627:273a-6	'bras bu de ni med pa nyid //	bras bu de ni med ba nyid 
BO_T02_D2627:273a-7	rkyen rnams las ni gang med pa //	rkyen rnams las ni gang med ba 
BO_T02_D2627:273a-8	de ni rkyen gyis ji ltar skyed //	de ni rkyen gyis ji ltar skyed 
BO_T02_D2627:273a-9	ci ste de ni med par yang //	ci ste de ni med ba yang 
BO_T02_D2627:273a-10	rkyen de dag las skye 'gyur na //	rkyen de dag las skye gyur na 
BO_T02_D2627:273a-11	rkyen dag las kyang 'bras bu ni //	rkyen dag las kyang bras bu ni 
BO_T02_D2627:273a-12	ci yi phyir na skye mi 'gyur //	ci yi phyir na skye mi gyur 
BO_T02_D2627:273a-13	zhes bshad pa yin no //	zhes chad ba yin no 
BO_T02_D2627:273a-14	sems kyi bsgom pa byas nas kyang //	sems kyi bsgom ba byed nas kyang 
BO_T02_D2627:273a-15	zhes bya ba ni snga ma bzhin du don bsgom zhes bya ba'i tha tshig go //	zhes byed ba ni snga ma bzhin du don bsgom zhes byed ba tha tshig go 
BO_T02_D2627:273a-16	snga ma las zla ba'i dkyil 'khor bsgom zhes bya ba ni rang gi sems nyid zla ba dang po dang gnyis par bsgom pa'o //	snga ma las zla ba dkyil khor bsgom zhes byed ba ni rang gi sems nyid zla ba dang po dang gnyis ba bsgom ba 
BO_T02_D2627:273a-17	rang gi sa bon de dbus su //	rang gi sa bon de dbus su 
BO_T02_D2627:273a-18	bsams shing dam tshig phyag rgya dag / ces bya ba ni dbus su rang gi sa bon las dam tshig gi phyag rgya bskyed par bya ba'i don to //	bsams shing dam tshig phyag rgya dag ces byed ba ni dbus su rang gi sa bon las dam tshig gi phyag rgya skyed ba byed ba don to 
BO_T02_D2627:273a-19	bsam zhing de bzhin de nyid du//	bsam zhing de bzhin de nyid 
BO_T02_D2627:273a-20	sgrub pa pos ni bsgyur bar bya //	sgrub ba pos ni sgyur ba byed 
BO_T02_D2627:273a-21	zhes bya ba ni sku gsung thugs dpag tu med pa 'dus pa'o //	zhes byed ba ni sku gsung thugs dpog tu med ba du ba 
BO_T02_D2627:273a-22	lha yi rnal 'byor tshul du bsgyur //	lha yi rnal byor tshul du sgyur 
BO_T02_D2627:273a-23	zhes bya ba ni de nyid las lha'i sku rdzogs pa'o //	zhes byed ba ni de nyid las lha sku rdzogs ba 
BO_T02_D2627:273a-24	de nas rang gi sa bon dang // phyag rgya phyag rgyas de byin brlab //	de nas rang gi sa bon dang phyag rgya phyag rgya de byin brlab 
BO_T02_D2627:273a-25	ces bya ba ni byin gyis brlab pa rang gi sa bon /	ces byed ba ni byin gyis brlab ba rang gi sa bon 
BO_T02_D2627:273a-26	aom sarba bid badzra aadhi tishtha dzny'a na sa ma ye h'um zhes bya ba dang phyag rgya gnyis bcings te /	aom sarba bid badzra aadhi tishtha dznya na sa ma ye hum zhes byed ba dang phyag rgya gnyis ching te 
BO_T02_D2627:273a-27	snying ga la sogs pa'i gnas bco brgyad du byin gyis brlab pa'o //	snying ga la sogs ba gnas chos brgyad du byin gyis brlab ba 
BO_T02_D2627:273a-28	lhag 'og go rims ji bzhin du //	lhag g go rims ji bzhin du 
BO_T02_D2627:273a-29	sangs rgyas rnams kyis dbang bskur ro //	sangs rgya rnams kyis dbang skur ro 
BO_T02_D2627:273a-30	zhes bya ba ni snying gar dkyil 'khor gzhan du sprul te zhugs nas de'i 'og tu sangs rgyas lnga'i dbu rgyan ngang /	zhes byed ba ni snying gar dkyil khor gzhan du sprul te jug nas de g tu sangs rgya lnga dbu rgyan ngang 
BO_T02_D2627:273a-31	ngar dpyangs dang / rdo rje dang / bdag po dang / ming dang / brtul zhugs sbyin no zhes bya ba'i don to //	ngar dpyong dang rdo rje dang bdag po dang ming dang brtul jug sbyin no zhes byed ba don to 
BO_T02_D2627:273a-32	de nas nga rgyal bskyed nas kyang //	de nas nga rgyal skyed nas kyang 
BO_T02_D2627:273a-33	zhes bya ba ni dam tshig dang chos dang las dang phyag rgya chen po la sogs pas rgyas btab nas zhes bya ba'i don to //	zhes byed ba ni dam tshig dang chos dang las dang phyag rgya chen po la sogs ba rgya debs nas zhes byed ba don to 
BO_T02_D2627:273a-34	kyang zhes bya ba ni mchod pa bsdu'o //	kyang zhes byed ba ni mchod ba sdud 
BO_T02_D2627:273a-35	'di skad du ston pa yin te /	di skad du ston ba yin te 
BO_T02_D2627:273b-0	rigs rnams kyi zlos pa pos khrus kyi cho ga sngon du 'gro ba las lha la sogs pa mchod de mi snang bar gyur bar byas la dang po chos thams cad rgyu dang 'bras bu'i sgo nas stong pa @273b nyid du bsgom /	rigs rnams kyi zlos ba pos khru kyi cho ga sngon du gro ba las lha la sogs ba mchod de mi snang ba gyur ba byed la dang po chos thams cad rgyu dang bras bu sgo nas stong ba nyid du bsgom 
BO_T02_D2627:273b-1	aa las zla ba'i dkyil 'khor dang / yang zla ba'i dkyil 'khor dang / sa bon las dam tshig gi phyag rgya dang de bzhin gshegs pa'i sku dang gsung dang thugs rdo rjer zhugs pa dang gzugs nyid rdzogs par byed pa dang / rdo rje'i phyag rgya gnyis bcings te sngags brjod la byin gyis brlab pa dang /	aa las zla ba dkyil khor dang yang zla ba dkyil khor dang sa bon las dam tshig gi phyag rgya dang de bzhin gshegs ba sku dang gsung dang thugs rdo rjer jug ba dang gzugs nyid rdzogs ba byed ba dang rdo rje phyag rgya gnyis ching te sngags rjod la byin gyis brlab ba dang 
BO_T02_D2627:273b-2	snying gar sprul te 'jug pa dang / dbang rnams kyis dbang bskur ba dang rgyas gdab pa dang mchod pa yang bya'o zhes bya ba'i don to //	snying gar sprul te jug ba dang dbang rnams kyis dbang skur ba dang rgya gdab ba dang mchod ba yang byed zhes byed ba don to 
BO_T02_D2627:273b-3	mkhas pa yis ni bsgrub byas na //	mkhas ba yis ni sgrub byed na 
