segmentnr	original	folio	stemmed
BO_T16_D4420b:160b-31	zhes (thaka ka la 'phel batha aika / nang pa nyid /	160b	zhes (thaka ka la phel batha aika nang ba nyid 
BO_T16_D4420b:160b-32	thak na aa nu shar ka la sogs kyis snga phyi gnyis 'phel ba/) pa'i don la /	160b	thak na aa nu char ka la sogs kyis snga phyi gnyis phel ba don la 
BO_T16_D4420b:160b-33	m'a thu ra:/ (lhag pa'i lha can /	160b	ma thu (lhag ba lha can 
BO_T16_D4420b:160b-34	'jig rten 'di /	160b	jig rten di 
BO_T16_D4420b:160b-35	thaka 'phel ba/) tha g'a yasth'a ne bhya:/	160b	thaka phel tha ga yastha ne 
BO_T16_D4420b:160b-36	gnas nas 'ongs pa la thaka'o //	160b	gnas nas ngs ba la thaka 
BO_T16_D4420b:160b-37	gnas nas 'ongs pa brjod pa la lnga pa'i mtha' la thaka (bcom brlag nas 'ongs pa/) 'gyur te /	160b	gnas nas ngs ba rjod ba la lnga ba mtha la thaka (bcom brlag nas ngs gyur te 
BO_T16_D4420b:160b-38	(thaka)...a'a pa ni kam /	160b	(thaka)...aa ba ni kam 
BO_T16_D4420b:160b-39	so&amp; sya ni b'a sa:/	160b	so&amp; sya ni ba 
BO_T16_D4420b:160b-40	de 'di'i gnas la'o //	160b	de di gnas la 
BO_T16_D4420b:160b-41	de 'di'i gnas (bcom brlag nas 'ongs pa/) brjod pa la drug pa'i mtha' la aan 'gyur te /	160b	de di gnas (bcom brlag nas ngs rjod ba la drug ba mtha la aan gyur te 
BO_T16_D4420b:160b-42	ma thu ra: ni b'a so aa sya /	160b	ma thu ra: ni ba so aa sya 
BO_T16_D4420b:160b-43	zhes pa'i don la /	160b	zhes ba don la 
BO_T16_D4420b:160b-44	m'a thu ra:/ te na proktam /	160b	ma thu te na proktam 
BO_T16_D4420b:160b-45	des rab tu gsung ba la'o //	160b	des rab tu gsung ba la 
BO_T16_D4420b:160b-46	des rab tu gsung pa'i don la gsum (rang gnas nas 'ongs/) pa'i mtha' la aan 'gyur te /	160b	des rab tu gsung ba don la gsum (rang gnas nas ba mtha la aan gyur te 
BO_T16_D4420b:160b-47	bha ga ba t'a proktam/...(bcom ldan 'das kyis rab tu gsungs pa/) zhes pa'i don la /	160b	bha ga ba ta ldan da kyis rab tu gsungs zhes ba don la 
BO_T16_D4420b:160b-48	(aan)...bh'a ga ba tam/...(bcom ldan 'das kyis rab tu gsungs ba /	160b	(aan)...bha ga ba ldan da kyis rab tu gsungs ba 
BO_T16_D4420b:160b-49	'di'i gnas bcom brlag / bcom brlag pa/) m'a na ba:/...(mi yis rab tu gsungs ba/) kri te granthe /	160b	di gnas joms brlag joms brlag ma na yis rab tu gsungs kri te granthe 
BO_T16_D4420b:161a-0	byas @161a * //	161a	byed 
BO_T16_D4420b:161a-1	pa'i gzhung la'o //	161a	ba gzhung la 
BO_T16_D4420b:161a-2	des byas pa'i gzhung gi don la gsum pa'i mtha' la aan 'gyur te /	161a	des byed ba gzhung gi don la gsum ba mtha la aan gyur te 
BO_T16_D4420b:161a-3	p'a ni ne na kri tam gra ntha:/	161a	pa ni ne na kri tam gra 
BO_T16_D4420b:161a-4	zhes pa'i don la /	161a	zhes ba don la 
BO_T16_D4420b:161a-5	(aan) p'a ni no grantha:/	161a	(aan) pa ni no 
BO_T16_D4420b:161a-6	tasye dam / de'i 'di la'o //	161a	tasye dam de di la 
BO_T16_D4420b:161a-7	de'i 'di zhes pa'i don la drug pa'i mtha' la aan 'gyur te /	161a	de di zhes ba don la drug ba mtha la aan gyur te 
BO_T16_D4420b:161a-8	au pa go ri ri /	161a	au ba go ri ri 
BO_T16_D4420b:161a-9	zhes pa'i don la /	161a	zhes ba don la 
BO_T16_D4420b:161a-10	aoo pa ga ba:/	161a	aoo ba ga 
BO_T16_D4420b:161a-11	ra th'a dyata /	161a	ra tha dyata 
BO_T16_D4420b:161a-12	ra tha las yata 'o //	161a	ra tha las yata mang 
BO_T16_D4420b:161a-13	ra tha las de'i 'di zhes pa'i don la yata 'gyur (p'a ni bas byas pa'i gzhung/) te /	161a	ra tha las de di zhes ba don la yata gyur (pa ni ba byed ba te 
BO_T16_D4420b:161a-14	ra tha sye dam /	161a	ra tha sye dam 
BO_T16_D4420b:161a-15	(p'a ni bas byas pa'i gzhung/) zhes pa'i don la /	161a	(pa ni ba byed ba zhes ba don la 
BO_T16_D4420b:161a-16	ra thyam / gr'a m'a dya kha nyoo /	161a	ra thyam gra ma dya kha nyoo 
BO_T16_D4420b:161a-17	gr'a ma las ya kha nya dag go //	161a	gra ma las ya kha nya dag go 
BO_T16_D4420b:161a-18	gr'a ma las (nye ba'i ba lang 'di/) lhag ma la ya dang kha nyad ga (nye ba'i ba lang 'di/) 'gyur te /	161a	gra ma las (nye ba ba lang lhag ma la ya dang kha nyad ga (nye ba ba lang gyur te 
BO_T16_D4420b:161a-19	gr'a me dza ta:/	161a	gra me dza 
BO_T16_D4420b:161a-20	gr'a m'a d'a ga ta:/	161a	gra ma da ga 
BO_T16_D4420b:161a-21	gr'a me bha ba:/	161a	gra me bha 
BO_T16_D4420b:161a-22	zhes pa rnams kyi don la /	161a	zhes ba rnams kyi don la 
BO_T16_D4420b:161a-23	(ya) gr'a myam /	161a	(ya) gra myam 
BO_T16_D4420b:161a-24	(shing rta 'di/) gr'a m'i na:/	161a	(shing rta gra m 
BO_T16_D4420b:161a-25	na dy'a di bhyo dhaka / na d'i la (shing rta 'di/) sogs pa rnams las dhaka 'o //	161a	na dya di bhyo dhaka na d la (shing rta sogs ba rnams las dhaka mang 
BO_T16_D4420b:161a-26	na d'i la sogs pa rnams las lhag ma ste skyes pa sogs don tshan gsum po de rnams (grong du skyes /	161a	na d la sogs ba rnams las lhag ma ste skye ba sogs don tshan gsum po de rnams (grong du skye 
BO_T16_D4420b:161a-27	grong nas 'ongs/) la dhaka (grong nyid/) 'gyur te /	161a	grong nas la dhaka (grong gyur te 
BO_T16_D4420b:161a-28	(grong ngam grong nas 'ongs sam grong du 'gro //	161a	(grong ngam grong nas ngs sam grong du gro 
BO_T16_D4420b:161a-29	banya nya 'phel don kha a'i nar bsgyur/) n'a de ya:/	161a	banya nya phel don kha a nar na de 
BO_T16_D4420b:161a-30	(chu klung du skyes sam chu klung nas 'ongs sam chu klung nyid/) y'a mu ne ya:/...(chu bo ya mya na ru skyes sam ya mu nas 'ongs sam ya mu na/) m'a he ya:/...(ma h'i ladhak/) dakshi n'a pashtsatpu ra sastyak / dakshi n'a pashts'a ta pu ras tyaka'o //	161a	(chu klung du skye sam chu klung nas ngs sam chu klung ya mu ne bo ya mya na ru skye sam ya mu nas ngs sam ya mu ma he h dakshi na pashtsatpu ra sastyak dakshi na pashtsa ta pu ras tyaka 
BO_T16_D4420b:161a-31	dakshi n'a sogs 'di rnams las lhag ma la tyaka 'gyur te /	161a	dakshi na sogs di rnams las lhag ma la tyaka gyur te 
BO_T16_D4420b:161a-32	(dhaka ka la 'phel ba dha ae ya /	161a	(dhaka ka la phel ba dha ae ya 
BO_T16_D4420b:161a-33	tyaka) dakshi n'a tya:/	161a	tyaka) dakshi na 
BO_T16_D4420b:161a-34	tyaka p'ashts'a tya:/ (dzhar las dzhar zhes ra phyis /	161a	tyaka pashtsa (dzhar las dzhar zhes ra byid 
BO_T16_D4420b:161a-35	ya mun la dhaka / tyaka)...poo rastya:/	161a	ya mun la dhaka tyaka)...poo 
BO_T16_D4420b:161a-36	d++yu br'a ga (sa nas skyes sam sa nas 'ongs sam sa gzhi/) b'a gu da ka pra t'i tso yata /	161a	d++yu bra ga (sa nas skye sam sa nas ngs sam sa ba gu da ka pra t tso yata 
BO_T16_D4420b:161a-37	dib pr'atsa aa b'a tsa au d'i tsa /	161a	dib pratsa aa ba tsa au d tsa 
BO_T16_D4420b:161a-38	pra t'itsa las yata 'o //	161a	pra ttsa las yata mang 
BO_T16_D4420b:161a-39	dip sogs 'di rnams las lhag (lho phyogs su skyes pa'am lho phyogs nas 'ongs pa'am lho phyogs pa /	161a	dip sogs di rnams las lhag (lho phyogs su skye ba lho phyogs nas ngs ba lho phyogs ba 
BO_T16_D4420b:161a-40	nub phyogs su skyes pa'i ma nub phyogs nas 'ongs sam nub phyogs pa /	161a	nub phyogs su skye ba ma nub phyogs nas ngs sam nub phyogs ba 
BO_T16_D4420b:161a-41	shar phyogs su skyes pa'am shar phyogs nas longs pa'am shar phyogs pa/) mal yata 'gyur te /	161a	char phyogs su skye ba char phyogs nas longs ba char phyogs mal yata gyur te 
BO_T16_D4420b:161a-42	(yat)...di bya:/ (mtho ris su skyes pa'am mtho ris nas 'ongs pa'am mtho ris pa /	161a	(yat)...di (mtho ris su skye ba mtho ris nas ngs ba mtho ris ba 
BO_T16_D4420b:161a-43	yat)...pr'atsya:/...(shar du skyes pa'am shar nas 'ongs pa'am shar ba /	161a	du skye ba char nas ngs ba char ba 
BO_T16_D4420b:161a-44	yat)...aa b'atsya:/...(nub tu skyes pa'am nub nas 'ongs ba'am nub pa /	161a	yat)...aa tu skye ba nub nas ngs ba nub ba 
BO_T16_D4420b:161b-0	yat)...au d'i tsya:/...(byang du skyes pa'am byang nas 'ongs pa'am byang ba/) @161b (yat)...pra t'i tsya:/	161b	yat)...au d du skye ba byang nas ngs ba byang (yat)...pra t 
BO_T16_D4420b:161b-1	aa bya y'attya pa /	161b	aa byed yattya ba 
BO_T16_D4420b:161b-2	mi zad pa las tya pa'o //	161b	mi zad ba las tya ba 
BO_T16_D4420b:161b-3	mi zad pa'i nang tshan aa ma ai ha /	161b	mi zad ba nang tshan aa ma ai ha 
BO_T16_D4420b:161b-4	kva rnams dang ta sil dang tral gyi rkyen mtha' rnams las lhag ma la tyapa 'gyur te /	161b	kva rnams dang ta sil dang tral gyi rkyen mtha rnams las lhag ma la tyapa gyur te 
BO_T16_D4420b:161b-5	aa m'a tya:/...(tyap pa dbyangs don /	161b	aa ma ba dbyangs don 
BO_T16_D4420b:161b-6	tyap)...ai ha tya:/ (tyap)...kva tya:/...(ci las skyes sam ci nas 'ongs pa'am ci /	161b	tyap)...ai ha (tyap)...kva las skye sam ci nas ngs ba ci 
BO_T16_D4420b:161b-7	tya)...bat (nub tu skyes pa'am nub nas 'ongs pa'am nub pa/) tastya:/	161b	tya)...bat (nub tu skye ba nub nas ngs ba nub 
BO_T16_D4420b:161b-8	(tyapa).. ..ta tra tya:/	161b	(tyapa).. ..ta tra 
BO_T16_D4420b:161b-9	tyapa ne:dhru pe /	161b	tyapa ne:dhru pe 
BO_T16_D4420b:161b-10	ni las brtan pa la tyapa 'o //	161b	ni las brtan ba la tyapa mang 
BO_T16_D4420b:161b-11	ni las brtan pa'i don la tyab 'gyur te /	161b	ni las brtan ba don la tyab gyur te 
BO_T16_D4420b:161b-12	ni ya tam dhru bam /	161b	ni ya tam dhru bam 
BO_T16_D4420b:161b-13	zhes pa'i (blon po'am blon po las skyes pa/) don la /	161b	zhes ba (blon po blon po las skye don la 
BO_T16_D4420b:161b-14	(tyap)...ni tyam / ('di'am 'di las skyes pa'am 'di nas 'ongs/) aee sha mo hya:shva so&amp; n+ya ta ra (de las skyes sam de nas 'ongs pa'am de la /	161b	(tyap)...ni tyam (di di las skye ba di nas aee sha mo hya:shva so&amp; n+ya ta ra (de las skye sam de nas ngs ba de la 
BO_T16_D4420b:161b-15	de las skyes sam de nas 'ongs sam de la/) sy'am /	161b	de las skye sam de nas ngs sam de sy 
BO_T16_D4420b:161b-16	aee sha mas hyas shvas las yang na'o //	161b	aee sha mas hyas shvas las yang na 
BO_T16_D4420b:161b-17	aee sha mas sogs rnams las lhag ma la (nges pa'am brtan pa/) tyap yang na 'gyur te /	161b	aee sha mas sogs rnams las lhag ma la (nges ba brtan tyap yang na gyur te 
BO_T16_D4420b:161b-18	(nges pa'am brtan pa'am mi g-yo ba /	161b	(nges ba brtan ba mi g-yo ba 
BO_T16_D4420b:161b-19	tyap)...aee sha ma styam/...('di las skyes sam 'di nas 'ongs) sam 'di /	161b	tyap)...aee sha ma las skye sam di nas ngs) sam di 
BO_T16_D4420b:161b-20	(tyap)...hyasty'am / (tyab)...shvastyam/...(rlung las skyes sam rlung nas 'ongs sam rlung/) yang na /	161b	(tyap)...hyasty las skye sam rlung nas ngs sam yang na 
BO_T16_D4420b:161b-21	aee sha masta nam /	161b	aee sha masta nam 
BO_T16_D4420b:161b-22	sogs te 'og tu 'chad do //	161b	sogs te g tu chad do 
BO_T16_D4420b:161b-23	bridhi:ya sy'a ts'a m'a distad+briddhi /	161b	bridhi:ya sya tsa ma distad+briddhi 
BO_T16_D4420b:161b-24	gang gi aatsa rnams kyi dang po 'phel ba de 'phel ba'o //	161b	gang gi aatsa rnams kyi dang po phel ba de phel ba 
BO_T16_D4420b:161b-25	rtags gang gi'ang aatsa rnams kyi dang po 'phel ba'i yi ge yod pa de la (kha sang skyes sam kha sa nga 'ongs sam kha sang/) 'phel ba'i ming can zhes ming 'dogs byed de dgos pa ni 'phel ba las tsha'o zhes sogs kyi ched de /	161b	rtags gang gi aatsa rnams kyi dang po phel ba yi ge yod ba de la (kha sang skye sam kha sa nga ngs sam kha phel ba ming can zhes ming dogs byed de dgos ba ni phel ba las tsha zhes sogs kyi ched de 
BO_T16_D4420b:161b-26	briddhatstsa:/ 'phel pa las tsha'o //	161b	phel ba las tsha 
BO_T16_D4420b:161b-27	gong du 'phel ba'i ming can zhes brda chad byas pa de las lhag ma la tsha 'gyur te /	161b	gong du phel ba ming can zhes brda chad byed ba de las lhag ma la tsha gyur te 
BO_T16_D4420b:161b-28	g'argye dza ta:/ g'argye bha ba /	161b	gargye dza gargye bha ba 
BO_T16_D4420b:161b-29	zhes pa'i don la /	161b	zhes ba don la 
BO_T16_D4420b:161b-30	g'arg'i ya:/...(garga'i bu'am garga'i bu las skyes pa/) a'a gast'i ya:/...(tsha a'i ya/) sh'a l'i ya:/	161b	garg bu garga bu las skye aa gast a sha l 
BO_T16_D4420b:161b-31	tya d'a d'i ni tsa /	161b	tya da d ni tsa 
BO_T16_D4420b:161b-32	tyad la sogs pa rnams kyang ngo //	161b	tyad la sogs ba rnams kyang ngo 
BO_T16_D4420b:161b-33	tyad la sogs pa rnams las kyang lhag ma la cha 'gyur te /	161b	tyad la sogs ba rnams las kyang lhag ma la cha gyur te 
BO_T16_D4420b:161b-34	tya d'i yam /	161b	tya d yam 
BO_T16_D4420b:161b-35	(tsha)...ta (garga'i bu las skyes ba /	161b	(tsha)...ta (garga bu las skye ba 
BO_T16_D4420b:161b-36	garga'i bu nyid /	161b	garga bu nyid 
BO_T16_D4420b:161b-37	gargya la tsha tsha a'i ya bu brgyud kyi de phan la a'ama yin pa zhes ya phyis /	161b	gargya la tsha tsha a ya bu brgyud kyi de phan la aa yin ba zhes ya byid 
BO_T16_D4420b:161b-38	ri bya'i bu'am ri bya'i bu las skyes ba /	161b	ri byed bu ri byed bu las skye ba 
BO_T16_D4420b:161b-39	ra ba ru skyes pa'am ra ba nas 'ongs pa'am rab/) d'i yam/...(de las skyes pa'am de nas 'ongs pa'am de /	161b	ra ba ru skye ba ra ba nas ngs ba d las skye ba de nas ngs ba de 
BO_T16_D4420b:161b-40	tsha)..ya d'i yam...(gang las skyes pa'am gang nas 'ongs pa'am gang /	161b	tsha)..ya d yam...(gang las skye ba gang nas ngs ba gang 
BO_T16_D4420b:162a-0	de las skyes pa'am de nas 'ongs pa'am de/) @162a * //	162a	de las skye ba de nas ngs ba 
BO_T16_D4420b:162a-1	pra tya yotta ra pa da yoshtsa /	162a	pra tya yotta ra ba da yoshtsa 
BO_T16_D4420b:162a-2	rkyen dang tshig phyi ma dag las kyang ngo //	162a	rkyen dang tshig phyi ma dag las kyang ngo 
BO_T16_D4420b:162a-3	yushmad dang aa smad gnyis kyi da bor ba'i yushma aasma dag ni rkyen pha rol dang tshig gzhan pha rol las kyang rim pa bzhin tva dang ma dag tu 'gyur te /	162a	yushmad dang aa smad gnyis kyi da bor ba yushma aasma dag ni rkyen pha rol dang tshig gzhan pha rol las kyang rim ba bzhin tva dang ma dag tu gyur te 
BO_T16_D4420b:162a-4	tva d'i ya:/ (yushmad aasmad la/) ma d'i ya:/	162a	tva d (yushmad aasmad ma d 
BO_T16_D4420b:162a-5	(bdag las skyes pa 'am bdag) / tshig phyi ma la /	162a	(bdag las skye ba mang bdag) tshig phyi ma la 
BO_T16_D4420b:162a-6	tvatpu tra:/ matpu tra:/	162a	tvatpu matpu 
BO_T16_D4420b:162a-7	bha ba tashtha ka tsha soo //	162a	bha ba tashtha ka tsha soo 
BO_T16_D4420b:162a-8	bha bat las thaka tshas dag go //	162a	bha bat las thaka tshas dag go 
BO_T16_D4420b:162a-9	bha bata las lhag ma la thaka dang tshas dag 'gyur te /	162a	bha bata las lhag ma la thaka dang tshas dag gyur te 
BO_T16_D4420b:162a-10	(tsha a'i ya) bh'a batka:/	162a	(tsha a ya) bha 
BO_T16_D4420b:162a-11	bha bata la tshas si ti tsa /	162a	bha bata la tshas si ti tsa 
BO_T16_D4420b:162a-12	sa 'gro ba (khyod las skyes pa'am khyod/) tyad la sogs pa zhes pas tsha aushma tva dang aasma ma ru 'gyur /	162a	sa gro ba (khyod las skye ba tyad la sogs ba zhes ba tsha aushma tva dang aasma ma ru gyur 
BO_T16_D4420b:162a-13	la'ang ngo // rkyen sa 'gro ba dang (khyod kyi bu /	162a	la ngo rkyen sa gro ba dang (khyod kyi bu 
BO_T16_D4420b:162a-14	bdag gi bu/) ya la sogs pa pha rol tu byung na rkyen ster yul gyi ming de la tshig ces ming 'dogs byed do /	162a	bdag gi ya la sogs ba pha rol tu byung na rkyen ster yul gyi ming de la tshig ces ming dogs byed do 
BO_T16_D4420b:162a-15	(/ khyod las skyes pa'am khyod las 'ongs pa'am khyod /	162a	khyod las skye ba khyod las ngs ba khyod 
BO_T16_D4420b:162a-16	bha bat la thaka ka 'phel ba ais aus auk ta sogs kyis thak) / dgos pa ni mtha'i dzha la rnams kyi dza sha rnams so //	162a	bha bat la thaka ka phel ba ais aus auk ta sogs kyis thak) dgos ba ni mtha dzha la rnams kyi dza sha rnams so 
BO_T16_D4420b:162a-17	zhes pas / ta dar 'gyur ba'i ched yin no //	162a	zhes ba ta dar gyur ba ched yin no 
BO_T16_D4420b:162a-18	bha pa d'i ya:/	162a	bha ba d 
BO_T16_D4420b:162a-19	ai nyashtsa / ai nya las kyang ngo //	162a	ai nyashtsa ai nya las kyang ngo 
BO_T16_D4420b:162a-20	rigs kyi don du byin pa'i ainya'i mtha' las lhag ma la aan 'gyur te /	162a	rigs kyi don du byin ba ainya mtha las lhag ma la aan gyur te 
BO_T16_D4420b:162a-21	d'akshoo bha ba:/ d'akshoo dza ta:/	162a	dakshoo bha dakshoo dza 
BO_T16_D4420b:162a-22	zhes pa'i don la /	162a	zhes ba don la 
BO_T16_D4420b:162a-23	(ainya aan) d'aksha:/ ksh'a tra:/	162a	(ainya aan) ksha 
BO_T16_D4420b:162a-24	(ainya aan/) ga h'a di bhyashtsa /	162a	(ainya ga ha di bhyashtsa 
BO_T16_D4420b:162a-25	ga ha la (bha btal tshas sa ta dar 'gyur ba'i don tsha a'i ya /	162a	ga ha la (bha btal tshas sa ta dar gyur ba don tsha a ya 
BO_T16_D4420b:162a-26	khyod las skyes sam khyod/) sogs pa rnams las kyang ngo //	162a	khyod las skye sam sogs ba rnams las kyang ngo 
BO_T16_D4420b:162a-27	ga ha la sogs pa rnams las kyang lhag ma la tsha 'gyur te /	162a	ga ha la sogs ba rnams las kyang lhag ma la tsha gyur te 
BO_T16_D4420b:162a-28	ga h'i ya:/ (mkhas pa'i rigs /	162a	ga h (mkhas ba rigs 
BO_T16_D4420b:162a-29	mkhas pa'i rigs las skyes pa /	162a	mkhas ba rigs las skye ba 
BO_T16_D4420b:162a-30	mkhas pa'i rigs las skyes pa'am mkhas pa'i rigs /	162a	mkhas ba rigs las skye ba mkhas ba rigs 
BO_T16_D4420b:162a-31	rgyal po'i rigs las skyes pa'am rgyal po'i rigs/) dza na pa ra yo:ku ka tsa /	162a	rgyal po rigs las skye ba rgyal po dza na ba ra yo:ku ka tsa 
BO_T16_D4420b:162a-32	dzan pa ra dag las ku ka'ang ngo //	162a	dzan ba ra dag las ku ka ngo 
BO_T16_D4420b:162a-33	ga ha sogs kyi nang tshan dza na dang pa ra dag las rkyen tsha (khang ba ru skyes pa'am khang pa nas 'ongs pa'am khang pa /	162a	ga ha sogs kyi nang tshan dza na dang ba ra dag las rkyen tsha (khang ba ru skye ba khang ba nas ngs ba khang ba 
BO_T16_D4420b:162a-34	tsha a'i ya/) pha rol la kuk a'a ga ma 'gyur te /	162a	tsha a pha rol la kuk aa ga ma gyur te 
BO_T16_D4420b:162a-35	dza na k'i yam /	162a	dza na k yam 
BO_T16_D4420b:162a-36	(mi'am mi las skyes pa/) pa ra k'i yam /	162a	(mi mi las skye ba ra k yam 
BO_T16_D4420b:162a-37	'grel par lung drangs pa /	162a	grel ba lung drangs ba 
BO_T16_D4420b:162a-38	de ba sya b'a /	162a	de ba sya ba 
BO_T16_D4420b:162a-39	de ba'i yang na'o //	162a	de ba yang na 
BO_T16_D4420b:162a-40	de ba las tsha pha rol la kuka a'a ga ma yang na 'gyur te /	162a	de ba las tsha pha rol la kuka aa ga ma yang na gyur te 
BO_T16_D4420b:162a-41	de ba k'i yam /	162a	de ba k yam 
BO_T16_D4420b:162a-42	(lha'am lha las skyes pa/) de b'i yam /	162a	(lha lha las skye de b yam 
BO_T16_D4420b:162a-43	yushmad sma do ra n+ya ta ra sy'am khanytsa /	162a	yushmad sma do ra n+ya ta ra sy khanytsa 
BO_T16_D4420b:162a-44	yushmad...(dza na dang bar la tsha tsha a'i ya kuka a'a ga ma ka gnas kyi don au brjod don /	162a	yushmad...(dza na dang ba la tsha tsha a ya kuka aa ga ma ka gnas kyi don au rjod don 
BO_T16_D4420b:162b-0	pha rol lam pha rol tu skyes pa'am pha rol nas 'ongs pa/) @162b aasmad dag las khanya yang na 'ang ngo //	162b	pha rol lam pha rol tu skye ba pha rol nas ngs aasmad dag las khanya yang na mang ngo 
BO_T16_D4420b:162b-1	yushmad aa smad dag las lhag ma la khanya yang na 'gyur zhing yang na aan dang 'ang gi sgras tsha yang 'gyur te /	162b	yushmad aa smad dag las lhag ma la khanya yang na gyur zhing yang na aan dang mang gi sgras tsha yang gyur te 
BO_T16_D4420b:162b-2	tasminna ni tsa yushm'a k'asm'a koo / de la aan la'ang yushm'a ka aasm'a ka dag go //	162b	tasminna ni tsa yushma kasma koo de la aan la yushma ka aasma ka dag go 
BO_T16_D4420b:162b-3	khanya dang aan pha rol la'ang yushmad dang aasmad dag ni rim pa bzhin yushm'a ka dang aasm'a ka dag tu 'gyur te /	162b	khanya dang aan pha rol la yushmad dang aasmad dag ni rim ba bzhin yushma ka dang aasma ka dag tu gyur te 
BO_T16_D4420b:162b-4	yooshm'a k'i na:/ yoo shm'a ka:/...(aan 'phel ba /	162b	yooshma k yoo shma phel ba 
BO_T16_D4420b:162b-5	tsha a'i ya)...yushma d'i ya:/	162b	tsha a ya)...yushma d 
BO_T16_D4420b:162b-6	(khanya 'phel ba kha a'ina/)...a'asm'a k'i na:/	162b	(khanya phel ba kha k 
BO_T16_D4420b:162b-7	a'asm'a ka:/.. ..(aan 'phel ba/) aasma di ya:/...(tsha a'i ya/) ta ba ka ma ma k'a be ka ba tsa ne /	162b	aasma ..(aan phel aasma di a ta ba ka ma ma ka be ka ba tsa ne 
BO_T16_D4420b:162b-8	gcig tshig la ta ba ka ma ma ka dag go //	162b	gcig tshig la ta ba ka ma ma ka dag go 
BO_T16_D4420b:162b-9	gcig tshig nyid la 'jug pa'i yushmad aasmad (khanya 'phel ba kha a'ina /	162b	gcig tshig nyid la jug ba yushmad aasmad (khanya phel ba kha ana 
BO_T16_D4420b:162b-10	khyod dam khyod las skyes pa'am khyod las 'ong ba /	162b	khyod dam khyod las skye ba khyod las ng ba 
BO_T16_D4420b:162b-11	khyod dam khyod las skyes pa'am khyod las 'ong ba /	162b	khyod dam khyod las skye ba khyod las ng ba 
BO_T16_D4420b:162b-12	bdag gam bdag las skyes pa'am bdag las 'ong ba /	162b	bdag gam bdag las skye ba bdag las ng ba 
BO_T16_D4420b:162b-13	bdag gam bdag las skyes pa'am bdag las 'ong gdab/) lhag ma'i don gyi rkyen khanya dang aan pha rol la ta ba ka dang ma ma ka dag tu 'gyur te /	162b	bdag gam bdag las skye ba bdag las ng lhag ma don gyi rkyen khanya dang aan pha rol la ta ba ka dang ma ma ka dag tu gyur te 
BO_T16_D4420b:162b-14	t'a ba k'i na:/...t'a ba ka:/...(aan 'phel ba/) m'a ma k'i na:/	162b	ta ba k ba phel ma ma k 
BO_T16_D4420b:162b-15	m'a ma ka:/...(aan 'phel ba/) ma dhy'a nma:/	162b	ma ma phel ma dhya 
BO_T16_D4420b:162b-16	ma dhya las ma'o //	162b	ma dhya las ma 
BO_T16_D4420b:162b-17	madhya las lhag ma la ma 'gyur te /	162b	madhya las lhag ma la ma gyur te 
BO_T16_D4420b:162b-18	ma dhya ma:/ a'a de shtsa /	162b	ma dhya aa de shtsa 
BO_T16_D4420b:162b-19	a'a di las kyang ngo //	162b	aa di las kyang ngo 
BO_T16_D4420b:162b-20	a'a di las kyang lhag ma lam 'gyur te /	162b	aa di las kyang lhag ma lam gyur te 
BO_T16_D4420b:162b-21	a'a di ma:/ aa dha so&amp; nta lo (khanya 'phel ba la sha a'ina /	162b	aa di aa dha so&amp; nta lo (khanya phel ba la sha ana 
BO_T16_D4420b:162b-22	khyod nyid dam khyod nyid las skyes pa /	162b	khyod nyid dam khyod nyid las skye ba 
BO_T16_D4420b:162b-23	khanya 'phel ba a'ina /	162b	khanya phel ba ana 
BO_T16_D4420b:162b-24	bdag nyid dam bdag las skyes ba/) pashtsa /	162b	bdag nyid dam bdag las skye pashtsa 
BO_T16_D4420b:162b-25	aa dhas kyi mtha' dbyi ba'ang ngo //	162b	aa dhas kyi mtha byid ba ngo 
BO_T16_D4420b:162b-26	aa dhas las lhag (dbus ma 'am dbus su skyes pa'am dbus nas 'ong ba/) ma la ma 'gyur zhing mtha' dbyi ba'ang ngo /	162b	aa dhas las lhag (dbus ma mang dbus su skye ba dbus nas ng ma la ma gyur zhing mtha byid ba ngo 
BO_T16_D4420b:162b-27	(/ dang po'am thog ma'am legs pa/) aa dha ma:/	162b	dang po thogs ma legs aa dha 
BO_T16_D4420b:162b-28	aa s'am pra ti ka / mnyam pa la aa'o //	162b	aa s pra ti ka mnyam ba la aa 
BO_T16_D4420b:162b-29	ma dhya las mnyam pa'i don la aa 'gyur te /	162b	ma dhya las mnyam ba don la aa gyur te 
BO_T16_D4420b:162b-30	ma dhya:/ k'a l'a ta thanya /	162b	ma ka la ta thanya 
BO_T16_D4420b:162b-31	dus las thanya 'o //	162b	dus las thanya mang 
BO_T16_D4420b:162b-32	dus brjod pa can la lhag ma la thanya 'gyur te /	162b	dus rjod ba can la lhag ma la thanya gyur te 
BO_T16_D4420b:162b-33	m'a si ka:/...(thanya 'phel ba ai ka) / a'ardha m'a si ka:/...(thanya 'phel ba aika) / s'ambat+sa ri ka:/...(thanya 'phel ba aika) / ni sh'a pra (ngan pa'am ngan pa las skyes pa'am tham/) do sh'a bhy'am tsa /	162b	ma si phel ba ai ka) aardha ma si phel ba aika) sbat+sa ri phel ba aika) ni sha pra (ngan ba ngan ba las skye ba do sha bhy tsa 
BO_T16_D4420b:162b-34	ni sh'a pra do sha dag las kyang ngo //	162b	ni sha pra do sha dag las kyang ngo 
BO_T16_D4420b:162b-35	ni sh'a dang pra do sha (ma dhya la aa gang gi aita la'ang ngos aa phyis su/) dag las lhag ma la thanya 'gyur te /	162b	ni sha dang pra do sha (ma dhya la aa gang gi aita la ngos aa byid dag las lhag ma la thanya gyur te 
BO_T16_D4420b:162b-36	(zla ba'am zla ba las skyes pa //	162b	(zla ba zla ba las skye ba 
BO_T16_D4420b:162b-37	zla ba phyed dam zla ba phyed nas 'ongs pa /	162b	zla ba phyed dam zla ba phyed nas ngs ba 
BO_T16_D4420b:162b-38	lo 'am lo las skyes pa /	162b	lo mang lo las skye ba 
BO_T16_D4420b:163a-0	dbus mnyam ba'am 'dra ba'am mtshungs pa/) @163a * //	163a	dbus mnyam ba dra ba mtshungs 
BO_T16_D4420b:163a-1	nee shi kam /	163a	nee chi kam 
BO_T16_D4420b:163a-2	(thanya 'phel ba tha aig) / pr'a do shi kam /	163a	(thanya phel ba tha aig) pra do chi kam 
BO_T16_D4420b:163a-3	(thanya 'phel ba aik) / shva sastutsta /	163a	(thanya phel ba aik) shva sastutsta 
BO_T16_D4420b:163a-4	shvas las tut 'ang ngo //	163a	shvas las tut mang ngo 
BO_T16_D4420b:163a-5	shvas las lhag ma la thanya 'gyur zhing tut a'a ga ma yang ster te /	163a	shvas las lhag ma la thanya gyur zhing tut aa ga ma yang ster te 
BO_T16_D4420b:163a-6	(shvas la thanya /	163a	(shvas la thanya 
BO_T16_D4420b:163a-7	tut / dv'a sogs kyis aee tsa a'a ga ma /	163a	tut dva sogs kyis aee tsa aa ga ma 
BO_T16_D4420b:163a-8	tha a'ika) / shoo basti kam /	163a	tha aka) shoo basti kam 
BO_T16_D4420b:163a-9	(rlung ngam rlung las skyes /	163a	(rlung ngam rlung las skye 
BO_T16_D4420b:163a-10	mtshan mo 'am mtshan las skyes sam mtshan las 'ongs /	163a	mtshan mo mang mtshan las skye sam mtshan las ngs 
BO_T16_D4420b:163a-11	srod dam mtshan mo'i dang po 'am srod las skyes sam srod las 'ongs/) dv'a r'a d'i n'am tsa /	163a	srod dam mtshan mo dang po mang srod las skye sam srod las dva ra d n tsa 
BO_T16_D4420b:163a-12	dv'a ra la sogs pa rnams kyi 'ang ngo //	163a	dva ra la sogs ba rnams kyi mang ngo 
BO_T16_D4420b:163a-13	dv'a ra la sogs pa rnams kyi pha rol tu rkyen 'phel ba'i rgyu mtshan can byung na rtags de dag gi dang po 'phel ba mi byed par aee tsa a'a ga ma ster ro //	163a	dva ra la sogs ba rnams kyi pha rol tu rkyen phel ba rgyu mtshan can byung na rtags de dag gi dang po phel ba mi byed ba aee tsa aa ga ma ster ro 
BO_T16_D4420b:163a-14	dv'a ra sogs ni /	163a	dva ra sogs ni 
BO_T16_D4420b:163a-15	dv'ar sva ra byalka sha shvasti sva du mri du shva su shva ta spya rnams so //	163a	dvar sva ra byalka sha shvasti sva du mri du shva su shva ta spya rnams so 
BO_T16_D4420b:163a-16	sarba tr'an tsa ta lo pashtsa /	163a	sarba tran tsa ta lo pashtsa 
BO_T16_D4420b:163a-17	rtag tu aan ste ta dbyi ba'ang ngo //	163a	rtag tu aan ste ta byid ba ngo 
BO_T16_D4420b:163a-18	he manta las lhag ma la aan rtag tu 'gyur zhing ta dbyi ba'ang ngo //	163a	he manta las lhag ma la aan rtag tu gyur zhing ta byid ba ngo 
BO_T16_D4420b:163a-19	hee ma na:/ 'grel par yang na thanya 'o zhes bshad pas /	163a	hee ma grel ba yang na thanya mang zhes chad ba 
