segmentnr	original	stemmed
BO_T13_D4312-3:278b-19	yid gzhungs dran dang stobs ldan zhing //	yid gzhungs dran dang stobs ldan zhing 
BO_T13_D4312-3:278b-20	tshe ring par yang 'gyur ba yin //	tshe ring ba yang gyur ba yin 
BO_T13_D4312-3:278b-21	zhes bya ba la ;	zhes byed ba la 
BO_T13_D4312-3:278b-22	aa ru ra rdog ma stong dang / de'i sum 'gyur gyi skyu ru ra dang bcas pa ste skyu ru ra sum stong dang / sman gyi sde tshan sna tshogs nas bshad pa'i rtsa ba lnga po lnga sbyir  srang nyis brgya lnga bcu ste /	aa ru ra rdog ma stong dang de sum gyur gyi skyu ru ra dang cha ba ste skyu ru ra sum stong dang sman gyi sde tshan sna tshogs nas chad ba rtsa ba lnga po lnga sbyir srang nyis brgya lnga chu ste 
BO_T13_D4312-3:278b-23	'di dag ni sman re re zhing bcu bcu gzhug par bya ste /	di dag ni sman re re zhing chu chu jug ba byed ste 
BO_T13_D4312-3:278b-24	de dag thams cad bsdus pa srang gis bsdus te ;	de dag thams cad sdud ba srang gis sdud te 
BO_T13_D4312-3:278b-25	de'i bcu 'gyur gyi chu'i nang du bskol la de'i khu ba bcu cha lus pa dang / de'i 'og tu aa ru ra rnam par rgyal ba dang / skyu ru ra brdungs la rus pa byung ste /	de chu gyur gyi chu nang du skol la de khu ba chu cha lus ba dang de g tu aa ru ra rnam ba rgyal ba dang skyu ru ra rdung la rus ba byung ste 
BO_T13_D4312-3:278b-26	khu ba de'i nang du shing tsha nas byi dang ga'i bar du sman sna re zhing phul re gzhug par bya'o //	khu ba de nang du shing tsha nas byi dang ga ba du sman sna re zhing bul re jug ba byed 
BO_T13_D4312-3:278b-27	de bzhin du khar dkar po srang stong chig brgya dang / de bzhin du zhun mar bre bcu gnyis dang / de bzhin du til mar bre brgyad de /	de bzhin du khar dkar po srang stong chig brgya dang de bzhin du zhun mar bre chu gnyis dang de bzhin du til mar bre brgyad de 
BO_T13_D4312-3:278b-28	de dag thams cad gcig tu bsres la /	de dag thams cad gcig tu bsres la 
BO_T13_D4312-3:278b-29	gzar bu la chags shing lde gur gyur gyi bar du bskol la thab las phab ste bsgrangs pa'i nang du sbrang rtsi srang sum brgya nyi shu gzhug par bya'o //	gzar bu la chags shing lde gur gyur gyi ba du skol la thab las bebs ste sgrong ba nang du sbrang rtsi srang sum brgya nyi shu jug ba byed 
BO_T13_D4312-3:278b-30	de nas de'i 'og tu gzar bus legs par dkrugs la de mar gyi snod du bcug cing bzhag bar bya la /	de nas de g tu gzar bud legs ba dkrug la de mar gyi snod du jug cing jog ba byed la 
BO_T13_D4312-3:278b-31	de las tshad bzhin du bza' bar bya ste /	de las tshad bzhin du bza ba byed ste 
BO_T13_D4312-3:278b-32	de'i tshad ni ji tsam zhig zos pas nang par gyi zas bza' ba'i dus la mi gnod cing bde bar 'ju nus pa de tsam du bza' bar bya'o //	de tshad ni ji tsam jig zos ba nang ba gyi zas bza ba dus la mi gnod cing bde ba ju nus ba de tsam du bza ba byed 
BO_T13_D4312-3:279a-0	sman de zhu ba'i tshe @279a * //	sman de ju ba tshe 
BO_T13_D4312-3:279a-1	na 'bras drug cu pa'i chan 'o ma dang bcas pa'i kha zas sbyin par bya'o //	na bras drug cu ba chan mang ma dang cha ba kha zas sbyin ba byed 
BO_T13_D4312-3:279a-2	bcud kyis len pa 'di ni tshangs pas bshad pa yin te /	bcud kyis len ba di ni tshangs ba chad ba yin te 
BO_T13_D4312-3:279a-3	dge zhing dpal skyed pa la sogs pa'i yon tan dang ldan no //	dge zhing dpal skyed ba la sogs ba yon tan dang ldan no 
BO_T13_D4312-3:279a-4	drang srong mkha' la gnas pa dang / byis pa dang rtse ba dang / de bzhin du dka' thub pa gzhan rnams kyis kyang bsten cing goms par byas pa yin la /	dren srong mkha la gnas ba dang byis ba dang rtse ba dang de bzhin du dka thub ba gzhan rnams kyis kyang sten cing goms ba byed ba yin la 
BO_T13_D4312-3:279a-5	de dag kyang bcud kyis len 'di lus kyi snyom pa dang / ngal ba la sogs pa spang bar 'gyur ba dang / yid gzhungs pa dang / dran pa la sogs pa dang ldan pa nas tshe shin tu ring ba la sogs pa'i yon tan dang ldan par 'gyur ba yin no //	de dag kyang bcud kyis len di lus kyi snyom ba dang ngal ba la sogs ba spong ba gyur ba dang yid gzhungs ba dang dran ba la sogs ba dang ldan ba nas tshe shin tu ring ba la sogs ba yon tan dang ldan ba gyur ba yin no 
BO_T13_D4312-3:279a-6	skyon med aa ru ra dang skyu ru ra //	skyon med aa ru ra dang skyu ru ra 
BO_T13_D4312-3:279a-7	stong dang pi pi ling ni stong dang bcas //	stong dang pi pi ling ni stong dang cha 
BO_T13_D4312-3:279a-8	rgya skyegs shing gzhon thal ba'i chu sbyar ba //	rgya skyegs shing gzhon thal ba chu sbyor ba 
BO_T13_D4312-3:279a-9	snod du bzhag ste legs par sbangs nas ni //	snod du jog ste legs ba sbong nas ni 
BO_T13_D4312-3:279a-10	slar phyung grib mar skams te phye mar byas //	slar byin grib mar skams te byed mar byed 
BO_T13_D4312-3:279a-11	kha ra dkar po bzhi cha mar dang ni //	kha ra dkar po bzhi cha mar dang ni 
BO_T13_D4312-3:279a-12	sbrang rtsi bzhi 'gyur bcas pa mar gyi ni //	sbrang rtsi bzhi gyur cha ba mar gyi ni 
BO_T13_D4312-3:279a-13	bum par bcug ste sa brkos par bzhag la //	bum ba jug ste sa rko ba jog la 
BO_T13_D4312-3:279a-14	zla ba drug lon nas ni slar phyung ste //	zla ba drug lon nas ni slar byin ste 
BO_T13_D4312-3:279a-15	snga dro'i dus su me drod ji bzhin bza' //	snga dro dus su me drod ji bzhin bza 
BO_T13_D4312-3:279a-16	rtag tu mthun pa'i zas ni bza' bar bya //	rtag tu mthun ba zas ni bza ba byed 
BO_T13_D4312-3:279a-17	de ltar ma lus zos na lo brgya 'tsho //	de ltar ma lus zos na lo brgya tsho 
BO_T13_D4312-3:279a-18	nad med pa dang skra dkar gnyer ma med //	nad med ba dang skra dkar gnyer ma med 
BO_T13_D4312-3:279a-19	lus kyi stobs 'phel rgyas par 'gyur ba dang // mchog tu dran gsal yid ni gzhungs par 'gyur //	lus kyi stobs phel rgya ba gyur ba dang mchog tu dran gsal yid ni gzhungs ba gyur 
BO_T13_D4312-3:279a-20	zhes bya ba la /	zhes byed ba la 
BO_T13_D4312-3:279a-21	aa ru ra dang skyu ru ra skyon med cing khu ba dang sman gyi nus pa la sogs pa rdzogs par gyur pa dang / de bzhin du pi pi ling stong dang bcas pa dang / de bzhin du rgya skyegs shing pa la sha zhes bya ba thal bar byas te chur gzags pa dang sbyar te /	aa ru ra dang skyu ru ra skyon med cing khu ba dang sman gyi nus ba la sogs ba rdzogs ba gyur ba dang de bzhin du pi pi ling stong dang cha ba dang de bzhin du rgya skyegs shing ba la sha zhes byed ba thal ba byed te chur(d) gzags ba dang sbyor te 
BO_T13_D4312-3:279a-22	snod du bzhag la sbangs par gyur nas slar phyung ste grib ma'i nang du skams nas phye mar byas pa dang / kha ra dkar po phye ma'i bzhi cha las /	snod du jog la sbong ba gyur nas slar byin ste grib ma nang du skams nas byed mar byed ba dang kha ra dkar po byed ma bzhi cha las 
BO_T13_D4312-3:279a-23	de bzhin du mar dang sbrang rtsi sman gyi bzhi 'gyur dang bcas pa de dag thams cad gcig tu bsdoms te mar gyi bum par bcug nas sa brkos pa'i nang du bzhag la /	de bzhin du mar dang sbrang rtsi sman gyi bzhi gyur dang cha ba de dag thams cad gcig tu sdom te mar gyi bum ba jug nas sa rko ba nang du jog la 
BO_T13_D4312-3:279a-24	zla ba drug lon pa dang / de'i 'og tu slar phyung ste snga dro'i dus su ji tsam du ran par zos la /	zla ba drug lon ba dang de g tu slar byin ste snga dro dus su ji tsam du ran ba zos la 
BO_T13_D4312-3:279a-25	de zhu ba dang rjes su mthun pa'i kha zas s'a lu'i chan la sogs pa bza' bar bya'o //	de ju ba dang rjes su mthun ba kha zas sa lu chan la sogs ba bza ba byed 
BO_T13_D4312-3:279a-26	de lta bu'i sbyor bas sman thams cad zos na /	de lta bu sbyor ba sman thams cad zos na 
BO_T13_D4312-3:279b-0	lo brgya'i @279b bar du 'tsho bar 'gyur zhing nad dang skra dkar dang gnyer ma med par 'gyur ba dang / lus kyi stobs 'phel ba la sogs par 'gyur ro //	lo brgya ba du tsho ba gyur zhing nad dang skra dkar dang gnyer ma med ba gyur ba dang lus kyi stobs phel ba la sogs ba gyur ro 
BO_T13_D4312-3:279b-1	skyon med rgya skyegs shing rlon pa //	skyon med rgya skyegs shing rlon ba 
BO_T13_D4312-3:279b-2	thor to bcad la bzhog pa yi //	thor to gcod la jog ba yi 
BO_T13_D4312-3:279b-3	sdong bu khru gnyis brkos pa'i nang //	sdong bu khru gnyis rko ba nang 
BO_T13_D4312-3:279b-4	skyu ru ra ni sar pas dgang //	skyu ru ra ni sar ba geng 
BO_T13_D4312-3:279b-5	rtsa ba'i bar du 'jag mas dkri //	rtsa ba ba du jag mas dkri 
BO_T13_D4312-3:279b-6	padma skyes pa'i 'dam gyis bsku //	padma skye ba dam gyis skud 
BO_T13_D4312-3:279b-7	de nas rlung med gnas su ni //	de nas rlung med gnas su ni 
BO_T13_D4312-3:279b-8	lci ba sar pa gtsang mas btso //	lci ba sar ba gtsang mas btso 
BO_T13_D4312-3:279b-9	tshos shing skyu ru ra sbangs nas //	tshos shing skyu ru ra sbong nas 
BO_T13_D4312-3:279b-10	sbrang rtsi mar bcas mi yis bza' //	sbrang rtsi mar cha mi yis bza 
BO_T13_D4312-3:279b-11	de rjes 'o ma mar bcas pa //	de rjes mang ma mar cha ba 
BO_T13_D4312-3:279b-12	ci 'dod par ni btung bar bya //	ci dod ba ni thung ba byed 
BO_T13_D4312-3:279b-13	de nyid kyis ni zla gcig par ;	de nyid kyis ni zla gcig ba 
BO_T13_D4312-3:279b-14	/ bsten zhing spang bar bya ba rnams //	sten zhing spong ba byed ba rnams 
BO_T13_D4312-3:279b-15	de ni 'bad de spang bar bya //	de ni bad de spong ba byed 
BO_T13_D4312-3:279b-16	chu ni grang mo lag pa yis //	chu ni grang mo lag ba yis 
BO_T13_D4312-3:279b-17	reg pa tsam yang mi bya'o //	reg ba tsam yang mi byed 
BO_T13_D4312-3:279b-18	de ltar zhag ni bcu gcig 'das //	de ltar zhag ni chu gcig da 
BO_T13_D4312-3:279b-19	skra so sen mo lhags par 'gyur //	skra so sen mo lhags ba gyur 
BO_T13_D4312-3:279b-20	de nas nyin zhag nyung zad nas //	de nas nyin zhag nyung zad nas 
BO_T13_D4312-3:279b-21	gzugs bzang bud med la phod cing //	gzugs bzang bud med la phod cing 
BO_T13_D4312-3:279b-22	stobs ni glang po dang 'drar 'gyur //	stobs ni glang po dang drar gyur 
BO_T13_D4312-3:279b-23	mchog tu yid gzhungs snying stobs dang // blo ldan lo stong 'tsho bar 'gyur //	mchog tu yid gzhungs snying stobs dang blo ldan lo stong tsho ba gyur 
BO_T13_D4312-3:279b-24	zhes bya ba la /	zhes byed ba la 
BO_T13_D4312-3:279b-25	pa la sha rul pa la sogs pa'i skyon med pa rlon pa'i thor to bcad la bzhog pa'i nang gi sdong bu khru gnyis pa brkos la /	ba la sha rul ba la sogs ba skyon med ba rlon ba thor to gcod la jog ba nang gi sdong bu khru gnyis ba rko la 
BO_T13_D4312-3:279b-26	de'i nang du skyu ru ra sar pas bkang la /	de nang du skyu ru ra sar ba geng la 
BO_T13_D4312-3:279b-27	de'i 'og tu 'jag mas rtsa ba'i bar du dkri bar bya'o //	de g tu jag mas rtsa ba ba du dkri ba byed 
BO_T13_D4312-3:279b-28	de nas padma skyes pa'i 'dam gyis bsku bar bya'o //	de nas padma skye ba dam gyis skud ba byed 
BO_T13_D4312-3:279b-29	de'i 'og tu rlung med pa'i gnas su dgon pa'i lci ba sar pa'i mes btsos la /	de g tu rlung med ba gnas su dgon ba lci ba sar ba mes btsos la 
BO_T13_D4312-3:279b-30	de nas skyu ru ra de sbrang rtsi dang mar dang bcas par bza' bar bya'o //	de nas skyu ru ra de sbrang rtsi dang mar dang cha ba bza ba byed 
BO_T13_D4312-3:279b-31	de'i 'og tu skom du 'o ma ngoms par blud par bya zhing /	de g tu skom du mang ma ngoms ba blud ba byed zhing 
BO_T13_D4312-3:279b-32	'o ma de nyid dang zla ba gcig gi bar du gnas par bya zhing /	mang ma de nyid dang zla ba gcig gi ba du gnas ba byed zhing 
BO_T13_D4312-3:279b-33	zas gzhan mi bza' bar bya ba dang / de'i bcud kyis len gyi spang bar bya ba'i spyod lam ni /	zas gzhan mi bza ba byed ba dang de bcud kyis len gyi spong ba byed ba spyod lam ni 
BO_T13_D4312-3:279b-34	'bad de spang bar bya ba dang / chu grang mo ni tha na lag pas kyang mi reg par bya'o //	bad de spong ba byed ba dang chu grang mo ni tha na lag ba kyang mi reg ba byed 
BO_T13_D4312-3:279b-35	de lta bu'i tshul gyis zhag bcu gcig 'das par gyur pa dang / skra dang so la sogs pa lhags par 'gyur ro //	de lta bu tshul gyis zhag chu gcig da ba gyur ba dang skra dang so la sogs ba lhags ba gyur ro 
BO_T13_D4312-3:279b-36	de nas nyin zhag gi dus nyung zad cig na gzugs bzang po 'byung bar 'gyur ba dang / bud med la phod pa la sogs pa'i yon tan rnams 'byung bar 'gyur ro //	de nas nyin zhag gi dus nyung zad cig na gzugs bzang po byung ba gyur ba dang bud med la phod ba la sogs ba yon tan rnams byung ba gyur ro 
BO_T13_D4312-3:279b-37	rtsa ba bcu pa ba bla dang // gla sgang thal tres dzi ba ka //	rtsa ba chu ba ba bla dang gla sgang thal tres dzi ba ka 
BO_T13_D4312-3:280a-0	@280a * // autpa la dang parni gnyis //	autpa la dang parni gnyis 
BO_T13_D4312-3:280a-1	kar ka ta sring pi pi ling //	kar ka ta sring pi pi ling 
BO_T13_D4312-3:280a-2	med sug smel ta ma la //	med sug smel ta ma la 
BO_T13_D4312-3:280a-3	'tsho byed rgun 'brum aa ga ru /	tsho byed rgun brum aa ga ru 
BO_T13_D4312-3:280a-4	ma nu zur pa ba spru pa //	ma nu zur ba ba spru ba 
BO_T13_D4312-3:280a-5	ram nye ba gnyis sle tres dang // ka ka na sa aa ru ra //	ram nye ba gnyis sle tres dang ka ka na sa aa ru ra 
BO_T13_D4312-3:280a-6	ba sha ka'i rtsa bi da ri //	ba sha ka rtsa bi da ri 
BO_T13_D4312-3:280a-7	srang re gcig tu bsres nas ni ;	srang re gcig tu bsres nas ni 
BO_T13_D4312-3:280a-8	/ skyu ru ra'i 'bru lnga brgya ni //	skyu ru ra bru lnga brgya ni 
BO_T13_D4312-3:280a-9	chu bre bcu drug nang du bskol //	chu bre chu drug nang du skol 
BO_T13_D4312-3:280a-10	de yi khu ba bzhi cha lus //	de yi khu ba bzhi cha lus 
BO_T13_D4312-3:280a-11	skyu ru ra yi rus pa bsal //	skyu ru ra yi rus ba bsal 
BO_T13_D4312-3:280a-12	mar dang til mar srang bcu gnyis //	mar dang til mar srang chu gnyis 
BO_T13_D4312-3:280a-13	nang du legs par brdos nas ni //	nang du legs ba brdos nas ni 
BO_T13_D4312-3:280a-14	kha ra dkar po srang lnga bcu //	kha ra dkar po srang lnga chu 
BO_T13_D4312-3:280a-15	btags te lde gu'i tshul du bskol //	dogs te lde gu tshul du skol 
BO_T13_D4312-3:280a-16	snum phyed kyi ni sbrang rtsi gzhug / smig rkang srang ni bzhi dag dang // pi pi ling ni srang gnyis dang // dri bzangs bzhi ni srang gcig gzhug / de las tshad tsam bza' bya zhing //	snum phyed kyi ni sbrang rtsi jug smig rkang srang ni bzhi dag dang pi pi ling ni srang gnyis dang dri bzangs bzhi ni srang gcig jug de las tshad tsam bza byed zhing 
BO_T13_D4312-3:280a-17	khang par gnas shing 'phrod zas bsten //	khang ba gnas shing phrod zas sten 
BO_T13_D4312-3:280a-18	'di ni drang srong 'pho bas bsten //	di ni dren srong pho ba sten 
BO_T13_D4312-3:280a-19	drang srong 'pho bas gang zos pas //	dren srong pho ba gang zos ba 
BO_T13_D4312-3:280a-20	rgas pas nyen par gyur pa yang //	rga ba nyen ba gyur ba yang 
BO_T13_D4312-3:280a-21	bud med kyi ni mig tu sdug / cho ga bzhin du bsten gyur na //	bud med kyi ni mig tu sdug cho ga bzhin du sten gyur na 
BO_T13_D4312-3:280a-22	lud pa dbugs mi bde rims dang // skems dang snying nad dreg nad dang // gcin dang khu chu la gnas dang // skad 'gags pa yang sel bar byed //	lud ba dbugs mi bde rims dang skem dang snying nad dreg nad dang gcin dang khu chu la gnas dang skad gag ba yang sel ba byed 
BO_T13_D4312-3:280a-23	byis pa rgan dang glo 'gram gcod //	byis ba rgan dang glo grams gcod 
BO_T13_D4312-3:280a-24	rid pa'i nyams stobs 'phel bar byed //	rid ba nyams stobs phel ba byed 
BO_T13_D4312-3:280a-25	yid gzhungs dran dang mdangs ldan dang // nad med nyid dang tshe 'phel dang // rlung ni bde bar rgyu byed cing //	yid gzhungs dran dang mdangs ldan dang nad med nyid dang tshe phel dang rlung ni bde ba rgyu byed cing 
BO_T13_D4312-3:280a-26	bud med la phod stobs dang ni //	bud med la phod stobs dang ni 
BO_T13_D4312-3:280a-27	dbang po gsal zhing me drod skyed //	dbang po gsal zhing me drod skyed 
BO_T13_D4312-3:280a-28	ces bya ba la /	ces byed ba la 
BO_T13_D4312-3:280a-29	rtsa ba bcu dang ba bla la sogs pa'i sman sna re zhing srang re gcig tu bsres pa dang / skyu ru ra'i rdog ma lnga brgya chu bre bcu drug gi nang du bskol la /	rtsa ba chu dang ba bla la sogs ba sman sna re zhing srang re gcig tu bsres ba dang skyu ru ra rdog ma lnga brgya chu bre chu drug gi nang du skol la 
BO_T13_D4312-3:280a-30	de'i khu ba bzhi cha lus pa dang / de las skyu ru ra btus te rus pa bsal la mar dang til mar srang bcu gnyis kyi nang du brngos la /	de khu ba bzhi cha lus ba dang de las skyu ru ra thu te rus ba bsal la mar dang til mar srang chu gnyis kyi nang du rngod la 
BO_T13_D4312-3:280a-31	de'i 'og tu kha ra dkar po srang lnga bcu dang bcas pa de lde gu'i sbyor bas bskol la tshos nas bsgrangs la /	de g tu kha ra dkar po srang lnga chu dang cha ba de lde gu sbyor ba skol la tshos nas sgrong la 
BO_T13_D4312-3:280a-32	sbrang rtsi snum gyi phyed de srang drug la sogs pa bcug la /	sbrang rtsi snum gyi phyed de srang drug la sogs ba jug la 
BO_T13_D4312-3:280a-33	lde gu de las tshad tsam bza' zhing /	lde gu de las tshad tsam bza zhing 
BO_T13_D4312-3:280a-34	khang par gnas te kha zas 'phrod pa bstan par bya'o //	khang ba gnas te kha zas phrod ba ston ba byed 
BO_T13_D4312-3:280a-35	'di ni drang srong 'pho bas bsten zhing zos pa zhes bya ba'i bcud kyis len yin te /	di ni dren srong pho ba sten zhing zos ba zhes byed ba bcud kyis len yin te 
BO_T13_D4312-3:280b-0	bcud @280b kyis len gang zhig zos pas de rgas 'khogs par gyur pa yang gzugs bzang zhing bud med kyi mig tu sdug par 'gyur ro //	bcud kyis len gang jig zos ba de rga khogs ba gyur ba yang gzugs bzang zhing bud med kyi mig tu sdug ba gyur ro 
BO_T13_D4312-3:280b-1	'di cho ga bzhin bsten par gyur na /	di cho ga bzhin sten ba gyur na 
BO_T13_D4312-3:280b-2	lud pa dang dbugs mi bde ba la sogs pa nas /	lud ba dang dbugs mi bde ba la sogs ba nas 
BO_T13_D4312-3:280b-3	dbang po gsal zhing me drod skyed par byed pa'i bar gyi yon tan dang ldan pa yin no //	dbang po gsal zhing me drod skyed ba byed ba ba gyi yon tan dang ldan ba yin no 
BO_T13_D4312-3:280b-4	shing mngar smig rkang pi pi ling //	shing mngar smig rkang pi pi ling 
BO_T13_D4312-3:280b-5	lce myang tsha dang bcas pa dang // lcags ni sna re gser dang ni //	lce myang tsha dang cha ba dang lcags ni sna re gser dang ni 
BO_T13_D4312-3:280b-6	shu dag sbrang rtsi zhun mar ram //	shu dag sbrang rtsi zhun mar ram 
BO_T13_D4312-3:280b-7	kha ra dkar po 'bras bu gsum //	kha ra dkar po bras bu gsum 
BO_T13_D4312-3:280b-8	lo gcig bsten na bcud len 'gyur //	lo gcig sten na bcud len gyur 
BO_T13_D4312-3:280b-9	nad kun 'joms shing dran pa dang // yid gzhungs blo ni skyed par byed //	nad kun joms shing dran ba dang yid gzhungs blo ni skyed ba byed 
BO_T13_D4312-3:280b-10	ces bya ba la /	ces byed ba la 
BO_T13_D4312-3:280b-11	shing mngar ram /	shing mngar ram 
BO_T13_D4312-3:280b-12	smig rkang ngam /	smig rkang ngam 
BO_T13_D4312-3:280b-13	pi pi ling ngam /	pi pi ling ngam 
BO_T13_D4312-3:280b-14	lce myang tsha 'am /	lce myang tsha mang 
BO_T13_D4312-3:280b-15	lcags lnga bo re re'am /	lcags lnga bo re re 
BO_T13_D4312-3:280b-16	so sor ram /	so sor ram 
BO_T13_D4312-3:280b-17	gser ram / shu dag gam /	gser ram shu dag gam 
BO_T13_D4312-3:280b-18	mar dang sbrang rtsi'am /	mar dang sbrang rtsi 
BO_T13_D4312-3:280b-19	kha ra dkar po 'bras bu gsum dang bcas pa lo gcig tu bsten na /	kha ra dkar po bras bu gsum dang cha ba lo gcig tu sten na 
BO_T13_D4312-3:280b-20	bcud kyis len du 'gyur zhing nad thams cad 'joms par byed pa yin no //	bcud kyis len du gyur zhing nad thams cad joms ba byed ba yin no 
BO_T13_D4312-3:280b-21	ma du ka parna yi khu ba'am //	ma du ka parna yi khu ba 
BO_T13_D4312-3:280b-22	shing mngar phye ma 'o mar bcas pa ni //	shing mngar byed ma mang mar cha ba ni 
BO_T13_D4312-3:280b-23	lhan cig sbyar ba me drod ji bzhin sbyin //	lhan cig sbyor ba me drod ji bzhin sbyin 
BO_T13_D4312-3:280b-24	sle tres shang ka pushpa'i me tog bcas //	sle tres shang ka pushpa me tog cha 
BO_T13_D4312-3:280b-25	lde gur sbyar ba me drod ji bzhin du //	lde gur sbyor ba me drod ji bzhin du 
BO_T13_D4312-3:280b-26	bsten na tshe ni sbyin par byed pa dang // nad 'jig stobs skyed mdog ni gsal byed cing //	sten na tshe ni sbyin ba byed ba dang nad jig stobs skyed mdog ni gsal byed cing 
BO_T13_D4312-3:280b-27	me drod skad gsal yid gzhungs skyed par byed //	me drod skad gsal yid gzhungs skyed ba byed 
BO_T13_D4312-3:280b-28	bcud kyis len gyi sbyor ba 'di dag las //	bcud kyis len gyi sbyor ba di dag las 
BO_T13_D4312-3:280b-29	shang ka pushpa'i sbyor 'di yid gzhungs mchog / ces bya ba la /	shang ka pushpa sbyor di yid gzhungs mchog ces byed ba la 
BO_T13_D4312-3:280b-30	ma du ka parni zhes bya ba bskol ba'i khu ba 'am ;	ma du ka parni zhes byed ba skol ba khu ba mang 
BO_T13_D4312-3:280b-31	shing mngar gyi phye ma'am /	shing mngar gyi byed ma 
BO_T13_D4312-3:280b-32	sle tres kyi phye ma'am /	sle tres kyi byed ma 
BO_T13_D4312-3:280b-33	shang ka pushpa'i rtsa ba'i lde gu me drod ji lta ba bzhin du bsten na bcud kyis len du 'gyur zhing /	shang ka pushpa rtsa ba lde gu me drod ji lta ba bzhin du sten na bcud kyis len du gyur zhing 
BO_T13_D4312-3:280b-34	tshe sbyin par byed pa la sogs pa yin no //	tshe sbyin ba byed ba la sogs ba yin no 
BO_T13_D4312-3:280b-35	bcud kyis len gyi sbyor ba 'di dag las shang ka pushpa'i sbyor ba ni mchog tu yang yid gzhungs par byed ba yin no //	bcud kyis len gyi sbyor ba di dag las shang ka pushpa sbyor ba ni mchog tu yang yid gzhungs ba byed ba yin no 
BO_T13_D4312-3:280b-36	spangs ma pu tse shel dang ba ya sya //	spong ma pu tse shel dang ba ya sya 
BO_T13_D4312-3:280b-37	shing mngar thal tres tsandan 'bras bu gsum //	shing mngar thal tres tsandan bras bu gsum 
BO_T13_D4312-3:280b-38	shu dag tsha ba gsum dang ser po gnyis //	shu dag tsha ba gsum dang ser po gnyis 
BO_T13_D4312-3:280b-39	pa to li'i rtsa rgyam tsha zhib tu btags //	ba to li rtsa rgyam tsha zhib tu dogs 
BO_T13_D4312-3:280b-40	mar dang 'o ma bre ni bcu drug dang // shang ka pashpu'i khu ba sum 'gyur bskol //	mar dang mang ma bre ni chu drug dang shang ka pashpu khu ba sum gyur skol 
BO_T13_D4312-3:281a-0	@281a * // blud na glen pa 'ang tshig la dbang 'gyur zhing //	blud na glen ba mang tshig la dbang gyur zhing 
BO_T13_D4312-3:281a-1	thos 'dzin spobs pa che zhing nad med 'gyur //	thos dzin spobs ba che zhing nad med gyur 
BO_T13_D4312-3:281a-2	zhes bya ba la /	zhes byed ba la 
BO_T13_D4312-3:281a-3	spangs ma la sogs pa de dag zhib tu btags la mar dang 'o ma bre bcu drug dang / shang ka pushpa'i khu ba mar gyi sum 'gyur dang bskol te blud na skyes bu blun po dag kyang tshig gsal zhing ngag la dbang ba dang /	spong ma la sogs ba de dag zhib tu dogs la mar dang mang ma bre chu drug dang shang ka pushpa khu ba mar gyi sum gyur dang skol te blud na skye bu blun po dag kyang tshig gsal zhing ngag la dbang ba dang 
BO_T13_D4312-3:281a-4	thos pa 'dzin pa dang / nad med pa nyid du 'gyur ro //	thos ba dzin ba dang nad med ba nyid du gyur ro 
BO_T13_D4312-3:281a-5	padma'i rtsa ba sdong bu dang // ge sar nang gi sa bon rnams //	padma rtsa ba sdong bu dang ge sar nang gi sa bon rnams 
BO_T13_D4312-3:281a-6	gser bcas mar dang 'o ma ni //	gser cha mar dang mang ma ni 
BO_T13_D4312-3:281a-7	bre ni bcu drug nang du bskol //	bre ni chu drug nang du skol 
BO_T13_D4312-3:281a-8	padma lnga pa'i thig le zhes //	padma lnga ba thig le zhes 
BO_T13_D4312-3:281a-9	sa steng dag du grags pa yin //	sa steng dag du grags ba yin 
BO_T13_D4312-3:281a-10	tshul bzhin bsten na skyes bu ni //	tshul bzhin sten na skye bu ni 
BO_T13_D4312-3:281a-11	nyams stobs zad pa 'phel bar byed //	nyams stobs zad ba phel ba byed 
BO_T13_D4312-3:281a-12	ces bya ba la /	ces byed ba la 
BO_T13_D4312-3:281a-13	padma'i rtsa ba la sogs pa tshul bzhin du bskol ba'i bcud kyis len ni ming padma lnga pa zhes grags pa yin te /	padma rtsa ba la sogs ba tshul bzhin du skol ba bcud kyis len ni ming padma lnga ba zhes grags ba yin te 
BO_T13_D4312-3:281a-14	de tshul bzhin du bsten na mchog tu skyes bu'i nyams stobs skyed par byed pa yin no //	de tshul bzhin du sten na mchog tu skye bu nyams stobs skyed ba byed ba yin no 
BO_T13_D4312-3:281a-15	gang zhig autpal sdong bu lo //	gang jig autpal sdong bu lo 
BO_T13_D4312-3:281a-16	rtsa ba ge sar ldan bskol ba //	rtsa ba ge sar ldan skol ba 
BO_T13_D4312-3:281a-17	autpal bzhi par grags pa yin //	autpal bzhi ba grags ba yin 
BO_T13_D4312-3:281a-18	gser dang bcas pa'i bcud len gyi //	gser dang cha ba bcud len gyi 
BO_T13_D4312-3:281a-19	sbyor ba bsten na ba lang yang //	sbyor ba sten na ba lang yang 
BO_T13_D4312-3:281a-20	yid gzhungs 'gyur na mir ci smos //	yid gzhungs gyur na mir ci smos 
BO_T13_D4312-3:281a-21	zhes bya ba la /	zhes byed ba la 
BO_T13_D4312-3:281a-22	sman mar gang autpa la'i sdong bu dang lo ma dang rtsa ba dang ldan par bskol zhing gsar dang bcas pa sbyar ba'i bcud kyis len ni autpa la bzhi pa yin te /	sman mar gang autpa la sdong bu dang lo ma dang rtsa ba dang ldan ba skol zhing gsar dang cha ba sbyor ba bcud kyis len ni autpa la bzhi ba yin te 
BO_T13_D4312-3:281a-23	de bsten na ba lang yang yid gzhungs shing blo dang ldan par 'gyur ba yin na /	de sten na ba lang yang yid gzhungs shing blo dang ldan ba gyur ba yin na 
BO_T13_D4312-3:281a-24	mir skyes nas lta smos kyang ci dgos //	mir skye nas lta smos kyang ci dgos 
BO_T13_D4312-3:281a-25	bramhi shu dag shang ka pushpa dang // rgyam tsha mang tsha ksha ra bi sha la //	bramhi shu dag shang ka pushpa dang rgyam tsha mang tsha ksha ra bi sha la 
BO_T13_D4312-3:281a-26	bramhi so bar tsa la pi pi ling //	bramhi so ba tsa la pi pi ling 
BO_T13_D4312-3:281a-27	re re nas ni gsum gsum tsam gyi tshad //	re re nas ni gsum gsum tsam gyi tshad 
BO_T13_D4312-3:281a-28	gser ni nas gnyis dug ni til 'bru tsam //	gser ni nas gnyis dug ni til bru tsam 
BO_T13_D4312-3:281a-29	zhun mar srang gcig 'di dag zhib tu sbyar //	zhun mar srang gcig di dag zhib tu sbyor 
BO_T13_D4312-3:281a-30	legs par btang ste zhu bar gyur nas ni //	legs ba gtong ste ju ba gyur nas ni 
BO_T13_D4312-3:281a-31	mar bcas kha zas lo gcig bar du bsten //	mar cha kha zas lo gcig ba du sten 
BO_T13_D4312-3:281a-32	dran dang yid gzhungs blo ni 'phel 'gyur zhing //	dran dang yid gzhungs blo ni phel gyur zhing 
BO_T13_D4312-3:281a-33	na dang rgas ba dag las 'das pa dang // snyom dang ngal dub sel byed lo brgyar 'tsho //	na dang rga ba dag las da ba dang snyom dang ngal dub sel byed lo brgyar tsho 
BO_T13_D4312-3:281a-34	dpal dang gzi brjid mdangs dang ldan par 'gyur //	dpal dang gzi brjid mdangs dang ldan ba gyur 
BO_T13_D4312-3:281a-35	khyad par du ni mdze nad sha bkra skran //	khyad ba du ni mdze nad sha bkra skran 
