segmentnr	original	folio	stemmed
BO_T02_D1377:260b-13	de nas rkyang ma dang ro ma spangs nas srog rlung zhag gcig dbu mar zhugs te dbu ma'i nang du dus kyi rlung gis mnan pas lte bar sgra la sogs pa'i yon tan lnga dang ldan pa stong ste sa 'chad par 'gyur ro //	260b	de nas rkyang ma dang ro ma spong nas srog rlung zhag gcig dbu mar jug te dbu ma nang du dus kyi rlung gis gnon ba lte ba sgra la sogs ba yon tan lnga dang ldan ba stong ste sa chad ba gyur ro 
BO_T02_D1377:260b-14	snying gar yon tan bzhi dang ldan pa'i chu yang ngo //	260b	snying gar yon tan bzhi dang ldan ba chu yang ngo 
BO_T02_D1377:260b-15	de chad par byas nas mgrin par yon tan gsum dang ldan pa'i me bcad de /	260b	de chad ba byed nas mgrin ba yon tan gsum dang ldan ba me gcod de 
BO_T02_D1377:260b-16	dpral bar yon tan gnyis dang ldan pa'i rlung btang nas /	260b	dpral ba yon tan gnyis dang ldan ba rlung gtong nas 
BO_T02_D1377:260b-17	spyi gtsug tu yon tan gcig dang ldan pa'i nam mkha' gtong ngo //	260b	spyi gtsug tu yon tan gcig dang ldan ba nam mkha gtong ngo 
BO_T02_D1377:260b-18	de ltar srog rlung gis gyen du khams gtong lugs so //	260b	de ltar srog rlung gis gyen du khams gtong lugs so 
BO_T02_D1377:260b-19	lus kyi thig le'i chos can thur sel 'og tu gtong ste /	260b	lus kyi thig le chos can thur sel g tu gtong ste 
BO_T02_D1377:260b-20	sad pa'i gnas skabs zad do //	260b	sad ba gnas skabs zad do 
BO_T02_D1377:261a-0	gsang gnas su ngag gi thig le'i chos can gtong ste rmi @261a * //	261a	gsang gnas su ngag gi thig le chos can gtong ste rmi 
BO_T02_D1377:261a-1	lam gyi gnas skabs zad do //	261a	lam gyi gnas skabs zad do 
BO_T02_D1377:261a-2	nor bus sems kyi thig le'i chos can gtong ste shin tu gnyid log pa'i gnas skabs zad do //	261a	nor bud sems kyi thig le chos can gtong ste shin tu rnyid log ba gnas skabs zad do 
BO_T02_D1377:261a-3	de ltar gyen du yang snying mgul dpral bar rdul gyi thig le rnams srog gis gtong ste lus la sogs pa 'chad do //	261a	de ltar gyen du yang snying mgul dpral ba rdul gyi thig le rnams srog gis gtong ste lus la sogs ba chad do 
BO_T02_D1377:261a-4	tha mar drug pa'i ye shes kyi khams gtong ngo //	261a	tha mar drug ba ye shes kyi khams gtong ngo 
BO_T02_D1377:261a-5	yan lag kun las sa bon 'og tu gtong ba dang / rdul gyen du 'gro ba ste bzhi pa'i gnas skabs zad do //	261a	yan lag kun las sa bon g tu gtong ba dang rdul gyen du gro ba ste bzhi ba gnas skabs zad do 
BO_T02_D1377:261a-6	de ltar mngal las skyes pa rnams 'chi'o //	261a	de ltar mngal las skye ba rnams chi 
BO_T02_D1377:261a-7	des na 'jig rten dang / 'jig rten las 'das pa bsgrub pa'i phyir lus kyi srung ba bshad de /	261a	des na jig rten dang jig rten las da ba sgrub ba phyir lus kyi srung ba chad de 
BO_T02_D1377:261a-8	lte ba snying gam gul pa dang // dpral ba spyi gtsug padma la //	261a	lte ba snying gam gul ba dang dpral ba spyi gtsug padma la 
BO_T02_D1377:261a-9	sa chu me rlung nam mkha' rnams //	261a	sa chu me rlung nam mkha rnams 
BO_T02_D1377:261a-10	sdud par rab tu rgyu ba yin //	261a	sdud ba rab tu rgyu ba yin 
BO_T02_D1377:261a-11	phyi ru 'byung dang nang du bsdu //	261a	phyi ru byung dang nang du sdud 
BO_T02_D1377:261a-12	de ni skyed pas sa la 'jug / srog gi nus pa ni sdud pas phyir 'byung la skyed pas nang du 'jug go //	261a	de ni skyed ba sa la jug srog gi nus ba ni sdud ba phyir byung la skyed ba nang du jug go 
BO_T02_D1377:261a-13	thur sel gyi nus pa yang /	261a	thur sel gyi nus ba yang 
BO_T02_D1377:261a-14	lte ba gsang gnas nor bu'i nang //	261a	lte ba gsang gnas nor bu nang 
BO_T02_D1377:261a-15	lus ngag yid ni rim gyis rgyu //	261a	lus ngag yid ni rim gyis rgyu 
BO_T02_D1377:261a-16	phyi ru 'byung dang nang rgyu la //	261a	phyi ru byung dang nang rgyu la 
BO_T02_D1377:261a-17	sdud dang skyed pa'i rang bzhin no //	261a	sdud dang skyed ba rang bzhin no 
BO_T02_D1377:261a-18	zhes dbang mdor bsdus las so //	261a	zhes dbang mdor sdud las so 
BO_T02_D1377:261a-19	de bas sangs rgyas kyi rang bzhin lus bsrung bar bya'o //	261a	de ba sangs rgya kyi rang bzhin lus bsrung ba byed 
BO_T02_D1377:261a-20	lus med na sgrub pa yang med pas zag pa med pa'i bde ba yang med do //	261a	lus med na sgrub ba yang med ba zag ba med ba bde ba yang med do 
BO_T02_D1377:261a-21	byang sems bsrung ba'i phyir rtsa'i rnal 'byor ni rkyang ma dang ro ma nas dbu mar srog rlung bsgom pa dang / thur sel dung can ma bsgom par bya'o //	261a	byang sems bsrung ba phyir rtsa rnal byor ni rkyang ma dang ro ma nas dbu mar srog rlung bsgom ba dang thur sel dung can ma bsgom ba byed 
BO_T02_D1377:261a-22	'jig rten las 'das pa bsgrub pa'i phyir stong pa la du ba la sogs pa'i lam bla ma la bslabs te sna tshogs gzugs brnyan gyi bar du bsgom par bya'o //	261a	jig rten las da ba sgrub ba phyir stong ba la du ba la sogs ba lam bla ma la bslabs te sna tshogs gzugs rnyan gyi ba du bsgom ba byed 
BO_T02_D1377:261a-23	de nas rtsa'i 'khor lo re rer srog dang thur sel la brten par bya'o //	261a	de nas rtsa khor lo re rer srog dang thur sel la rten ba byed 
BO_T02_D1377:261a-24	de nas sgra gcan ltar byang sems 'gog par bya'o //	261a	de nas sgra gcan ltar byang sems gog ba byed 
BO_T02_D1377:261a-25	srog dang thur sel sbyor nus pa'i rnal 'byor gyis lo gsum dang zla ba phyed pa gsum la phyag rgya chen po bsgrub bo //	261a	srog dang thur sel sbyor nus ba rnal byor gyis lo gsum dang zla ba phyed ba gsum la phyag rgya chen po sgrub bo 
BO_T02_D1377:261a-26	dus ma yin pa'i 'chi ba'i mtshan nyid ltar shes nas //	261a	dus ma yin ba chi ba mtshan nyid ltar shes nas 
BO_T02_D1377:261a-27	skyed dang sdud pa la gnas ba'i srog dang thur sel bkag la dbu mar sgra gcan dang dus kyi me'i nang du srog dang thur sel 'jug par bya'o //	261a	skyed dang sdud ba la gnas ba srog dang thur sel gog la dbu mar sgra gcan dang dus kyi me nang du srog dang thur sel jug ba byed 
BO_T02_D1377:261a-28	nyin zhag gcig dbu ma'i nang du rgyu bar nus na dus ma yin par 'chi ba slu bar byed do //	261a	nyin zhag gcig dbu ma nang du rgyu ba nus na dus ma yin ba chi ba slu ba byed do 
BO_T02_D1377:261a-29	de ltar ma nus na btsan thabs kyis kyang bya'o //	261a	de ltar ma nus na btsan thabs kyis kyang byed 
BO_T02_D1377:261b-0	@261b lte bar re bzhi dang gnas kyi phyi rol gyi bcu drug gis rlung skyed do //	261b	lte ba re bzhi dang gnas kyi phyi rol gyi chu drug gis rlung skyed do 
BO_T02_D1377:261b-1	'di dag khams snyoms par bya ba'i phyir dang rlung dang gzer zhi bar bya ba'i phyir thur sel bsdam par bya'o //	261b	di dag khams snyom ba byed ba phyir dang rlung dang gzer zhi ba byed ba phyir thur sel sdom ba byed 
BO_T02_D1377:261b-2	dpral bar bcu drug dang spyi gtsug tu bzhi ste nyi shus ni bad kan skyed do //	261b	dpral ba chu drug dang spyi gtsug tu bzhi ste nyi shus ni bad kan skyed do 
BO_T02_D1377:261b-3	de dag khams snyoms par bya ba'i phyir srog rlung gi rtsol bas bsdam par bya'o //	261b	de dag khams snyom ba byed ba phyir srog rlung gi rtsol ba sdom ba byed 
BO_T02_D1377:261b-4	thog mar srog rlung dang thur sel lan gsum bus la lce chung la bzhag ste /	261b	thogs mar srog rlung dang thur sel lan gsum bud la lce chung la jog ste 
BO_T02_D1377:261b-5	phyi rol gyi rlung yid kyis drangs shing bdud rtsi 'thungs pas mkhris pa zhi bar byed do //	261b	phyi rol gyi rlung yid kyis drangs shing bdud rtsi thung ba mkhris ba zhi ba byed do 
BO_T02_D1377:261b-6	snying gar brgyad dang mgul par so gnyis ni mkhris pa skyed do //	261b	snying gar brgyad dang mgul ba so gnyis ni mkhris ba skyed do 
BO_T02_D1377:261b-7	gsang gnas kyi bcu ni 'dus pa skyed do //	261b	gsang gnas kyi chu ni du ba skyed do 
BO_T02_D1377:261b-8	de dag snyoms par bya ba'i phyir srog dang thur sel bsdam par bya'o //	261b	de dag snyom ba byed ba phyir srog dang thur sel sdom ba byed 
BO_T02_D1377:261b-9	tshad pa la yang ngo //	261b	tshad ba la yang ngo 
BO_T02_D1377:261b-10	gang gi phyir srog ni lte ba nas gyen du rgyu ba dang / thur sel 'og tu rgyu ba 'gog pa des rlung la sogs pa'i skyon thams cad sel lo //	261b	gang gi phyir srog ni lte ba nas gyen du rgyu ba dang thur sel g tu rgyu ba gog ba des rlung la sogs ba skyon thams cad sel lo 
BO_T02_D1377:261b-11	bshad ba dang / gci ba sa bon gyi lam 'og tu thur sel bsdams nas zla ba dang / nyi ma dang me'i khams gyen du srog bsdams te de gnyis kha sbyar bas 'pho ba'i mes lus khyab cing dmu chu dang / mchin nad dang gzhang 'brum dang /	261b	chad ba dang gci ba sa bon gyi lam g tu thur sel sdom nas zla ba dang nyi ma dang me khams gyen du srog sdom te de gnyis kha sbyor ba pho ba mes lus khyab cing dmu chu dang mchin nad dang gzhang brum dang 
BO_T02_D1377:261b-12	dbugs mi bde ba dang glo nad dang brtan pa dang g-yo ba dang bcos ma'i dug dang mig nad dang klad gzer 'joms par byed do //	261b	dbugs mi bde ba dang glo nad dang brtan ba dang g-yo ba dang chos ma dug dang mig nad dang klad gzer joms ba byed do 
BO_T02_D1377:261b-13	brla g-yas par rkang pa g-yon pa dang / brla g-yon par rkang ba g-yas pa ste /	261b	brla g-yas ba rkang ba g-yon ba dang brla g-yon ba rkang ba g-yas ba ste 
BO_T02_D1377:261b-14	rdo rje'i skyil krung bcas pa la lag pa g-yon pa rgyab tu song bas rkang pa g-yon pa'i mthe bong dang g-yas pa'i mthe bong bzung bas dbugs bzung na rgyab kyi gzer 'joms par byed do //	261b	rdo rje skyil krung cha ba la lag ba g-yon ba rgyab tu gro ba rkang ba g-yon ba mthe bong dang g-yas ba mthe bong bzung ba dbugs bzung na rgyab kyi gzer joms ba byed do 
BO_T02_D1377:261b-15	rkang pa gnyis gyen du mgo 'og tu byas la srog 'gog pas bad kan 'joms so //	261b	rkang ba gnyis gyen du mgo g tu byed la srog gog ba bad kan joms so 
BO_T02_D1377:261b-16	gci ba dor ban srog rlung bsdams shing cung zad re stong pa goms pas chu 'gag zhi'o //	261b	gci ba dor ban srog rlung sdom shing cung zad re stong ba goms ba chu gag zhi 
BO_T02_D1377:261b-17	snga dro gdong pa ma bkrus par ming med gnyis kyis so'i phreng mnyes pas mig gnyis la bskus pa dang chu lcag brgyab pas mig nad sel lo //	261b	snga dro gdong ba ma khrud ba ming med gnyis kyis so phreng mnyes ba mig gnyis la skud ba dang chu lcag rgyag ba mig nad sel lo 
BO_T02_D1377:261b-18	gan rkyal du nyal te lag pa g-yon pas lte ba mnan nas srog rlung bzung bas ma zhu ba'i gzer ba 'joms so //	261b	gan rkyal du nyal te lag ba g-yon ba lte ba gnon nas srog rlung bzung ba ma ju ba gzer ba joms so 
BO_T02_D1377:261b-19	'bras la sogs ba byung ba'i dus su mar dang tshvar ru gtums pas bdugs na 'phel ba 'joms so //	261b	bras la sogs ba byung ba dus su mar dang tshvar ru thum ba bdug na phel ba joms so 
BO_T02_D1377:262a-0	@262a * // aarga'i 'o ma byugs pas kyang bya'o //	262a	aarga mang ma byug ba kyang byed 
BO_T02_D1377:262a-1	kanda ka ri'i me la bzhag pa'i dud pas gang ba'i sbubs so la yun ring por bdugs pas so'i srin bu dang bcas pa'i gzer 'joms so //	262a	kanda ka ri me la jog ba dud ba gang ba sbub so la yun ring por bdug ba so srin bu dang cha ba gzer joms so 
BO_T02_D1377:262a-2	du ba la sogs pa'i mtshan ma dang srog rtsol gyis ma nyams pa'i bsgrub pa la phyag rgya'i sbyor bas 'bab pa'i byang sems bde ba dam pa yang dang yang du bkag ste zla ba drug gis dkar mdze 'joms par byed do //	262a	du ba la sogs ba mtshan ma dang srog rtsol gyis ma nyams ba sgrub ba la phyag rgya sbyor ba bab ba byang sems bde ba dam ba yang dang yang du gog ste zla ba drug gis dkar mdze joms ba byed do 
BO_T02_D1377:262a-3	stobs med na sha dang chang longs spyod cing lo bcu drug ma bsten pas rlung bum pa can gyis nges par 'joms so //	262a	stobs med na sha dang chang longs spyod cing lo chu drug ma sten ba rlung bum ba can gyis nges ba joms so 
BO_T02_D1377:262a-4	lo bdun cu'i rgas pa gnyer ma dang skra dkar po dang bcas pa lo gnyis kyis so //	262a	lo bdun cu rga ba gnyer ma dang skra dkar po dang cha ba lo gnyis kyis so 
BO_T02_D1377:262a-5	de rjes lo gsum dang zla ba phyed gsum gyis phyag rgya chen po 'grub bo //	262a	de rjes lo gsum dang zla ba phyed gsum gyis phyag rgya chen po grub bo 
BO_T02_D1377:262a-6	bum pa can ni de srid du byed de ji srid snying tsha ba dang mgon ba mi 'byung ngo //	262a	bum ba can ni de srid du byed de ji srid snying tsha ba dang mgon ba mi byung ngo 
BO_T02_D1377:262a-7	de'i phyis kyang byed na srog ni brgyal ba dang ma non pas spyi gtsug gas te 'gro'o //	262a	de byid kyang byed na srog ni brgyal ba dang ma non ba spyi gtsug gas te gro 
BO_T02_D1377:262a-8	phyag rgya yang bde ba chen po bsgom pa'i don du yin gyi 'dod chags zad phyir ma yin no //	262a	phyag rgya yang bde ba chen po bsgom ba don du yin gyi dod chags zad phyir ma yin no 
BO_T02_D1377:262a-9	myos byed ni rgyal ba thams cad kyi bdag nyid phung po la sogs pa tshim par byed pa'i phyir te myos par byed pa'i phyir ma yin no //	262a	myos byed ni rgyal ba thams cad kyi bdag nyid phung po la sogs ba tshim ba byed ba phyir te myos ba byed ba phyir ma yin no 
BO_T02_D1377:262a-10	sha la sogs pa'i bza' ba ni bde ba 'phel bar byed pa'i phyir te /	262a	sha la sogs ba bza ba ni bde ba phel ba byed ba phyir te 
BO_T02_D1377:262a-11	ma zhu ba'i phyir ma yin no //	262a	ma ju ba phyir ma yin no 
BO_T02_D1377:262a-12	mtshan mo dur khrod du 'gro ba ni spyod pa sgrub pa'i phyir te rtsed mo'i phyir ma yin no //	262a	mtshan mo dur khrod du gro ba ni spyod ba sgrub ba phyir te rtsed mo phyir ma yin no 
BO_T02_D1377:262a-13	mi bskyod pa cung zad dron po pi pi ling gi phye ma dang bsres te khar bcug ste bzung ba na kha'i nang dang so'i gzer dang srin bu sel lo //	262a	mi skyod ba cung zad dron po pi pi ling gi byed ma dang bsres te khar jug ste bzung ba na kha nang dang so gzer dang srin bu sel lo 
BO_T02_D1377:262a-14	snga dro mi bskyod pa tsha ba gsum dang bsres pa sna bug tu blugs pas mgo na ba sel lo //	262a	snga dro mi skyod ba tsha ba gsum dang bsres ba sna bug tu blugs ba mgo na ba sel lo 
BO_T02_D1377:262a-15	lci ba dron mo rna bug tu blugs te bzhag na rna ba'i nad sel lo //	262a	lci ba dron mo rna bug tu blugs te jog na rna ba nad sel lo 
BO_T02_D1377:262a-16	de grang mos mig nad sel lo //	262a	de grang mos mig nad sel lo 
BO_T02_D1377:262a-17	mi bskyod pa tsha ba gsum dang bsres pa sna bug tu blugs pas 'byung po la sogs pa'i gnod pa sel lo //	262a	mi skyod ba tsha ba gsum dang bsres ba sna bug tu blugs ba byung po la sogs ba gnod ba sel lo 
BO_T02_D1377:262a-18	dug sbrul gyis zin pa la yang ngo //	262a	dug sbrul gyis zin ba la yang ngo 
BO_T02_D1377:262a-19	nang du bshad ba ni phyi rol du mu zi ste de gnyis mnyam mo //	262a	nang du chad ba ni phyi rol du mu zi ste de gnyis mnyam mo 
BO_T02_D1377:262a-20	nang du dri chu ni phyi rol du bhrim ga r'a dza'i khu ba'o //	262a	nang du dri chu ni phyi rol du bhrim ga ra dza khu ba 
BO_T02_D1377:262a-21	nang du bud med kyi zla mtshan ni phyir lhang tsher ro //	262a	nang du bud med kyi zla mtshan ni phyir lhang tsher ro 
BO_T02_D1377:262a-22	khu ba ni phyir dngul chu'o //	262a	khu ba ni phyir dngul chu 
BO_T02_D1377:262a-23	nang du sha dang rkang mar ni phyi rol du 'bras bu gsum mo //	262a	nang du sha dang rkang mar ni phyi rol du bras bu gsum mo 
BO_T02_D1377:262b-0	bshang ba cha gcig la ni bzhi cha gcig med pa'i @262b cha gcig / khrag ni cha phyed sa bon bzhi cha gcig ste thams cad phye mar btags te lci bas sbrus te lan bdun du nyi ma la bskam par bya'o //	262b	bshang ba cha gcig la ni bzhi cha gcig med ba cha gcig khrag ni cha phyed sa bon bzhi cha gcig ste thams cad byed mar dogs te lci ba sbru te lan bdun du nyi ma la skem ba byed 
BO_T02_D1377:262b-1	de nas zhag re rer srang phyed phyed mar dang sbrang rtsi bsres te zla ba drug gi bar du zos na tshe ring bar 'gyur ro //	262b	de nas zhag re rer srang phyed phyed mar dang sbrang rtsi bsres te zla ba drug gi ba du zos na tshe ring ba gyur ro 
BO_T02_D1377:262b-2	lo ma dang sgyur ba dang tsha ba dang mar nag spang bar bya ste /	262b	lo ma dang sgyur ba dang tsha ba dang mar nag spong ba byed ste 
BO_T02_D1377:262b-3	bdud rtsi lnga bsten pa'i cho ga'o //	262b	bdud rtsi lnga sten ba cho ga 
BO_T02_D1377:262b-4	dbu mar srog rlung bkug la ke sa ra dza dang bhrim ga r'a dza'i khu ba dang mnyam po'i zla mtshan sna bug tu zla ba drug blugs pas skra dkar ba dang bcas pa'i rgas pa 'joms so //	262b	dbu mar srog rlung gugs la ke sa ra dza dang bhrim ga ra dza khu ba dang mnyam po zla mtshan sna bug tu zla ba drug blugs ba skra dkar ba dang cha ba rga ba joms so 
BO_T02_D1377:262b-5	ba lang / khyi /	262b	ba lang khyi 
BO_T02_D1377:262b-6	glang po che /	262b	glang po che 
BO_T02_D1377:262b-7	rta / mi'i sha rnams sbrang chang dang sbrang gis bsres te zla ba drug tu zos na nad thams cad sel lo //	262b	rta mi sha rnams sbrang chang dang sbrang gis bsres te zla ba drug tu zos na nad thams cad sel lo 
BO_T02_D1377:262b-8	ke sar dza dang / bhrim ga r'a dza'i khu ba dngul chu dang / byang sems dkar dmar gnyis dang thams cad mnyam par srang phyed phyed lo gcig gi bar zos na rgas pa 'joms pa ste lo ma dang skyur po la sogs pa spangs nas so //	262b	ke sar dza dang bhrim ga ra dza khu ba dngul chu dang byang sems dkar dmar gnyis dang thams cad mnyam ba srang phyed phyed lo gcig gi ba zos na rga ba joms ba ste lo ma dang skyur po la sogs ba spong nas so 
BO_T02_D1377:262b-9	tshva dang bcas pa'i skyur po 'thungs pas na rlung sel lo //	262b	tshva dang cha ba skyur po thung ba na rlung sel lo 
BO_T02_D1377:262b-10	ka ra la sogs pa mngar bas ni mkhris pa sel lo //	262b	ka ra la sogs ba mngar ba ni mkhris ba sel lo 
BO_T02_D1377:262b-11	bska bas ni bad kan sel lo //	262b	bska ba ni bad kan sel lo 
BO_T02_D1377:262b-12	tsha ba gsum dang bcas pa'i khu ba yang ngo //	262b	tsha ba gsum dang cha ba khu ba yang ngo 
BO_T02_D1377:262b-13	tsha ba gsum dang bcas pa'i ra'i 'o ma 'thungs pa dang / sna bug tu blugs pas bad kan sel lo //	262b	tsha ba gsum dang cha ba ra mang ma thung ba dang sna bug tu blugs ba bad kan sel lo 
BO_T02_D1377:262b-14	ka ra dang bcas pa'i ma he'i 'o mas mkhris pa sel lo //	262b	ka ra dang cha ba ma he mang mas mkhris ba sel lo 
BO_T02_D1377:262b-15	rnga mo'i 'o ma rgyam tsha dang bcas na rlung sel lo //	262b	rnga mo mang ma rgyam tsha dang cha na rlung sel lo 
BO_T02_D1377:262b-16	ba'i 'o ma tsha ba gsum dang bcas na bad kan sel lo //	262b	ba mang ma tsha ba gsum dang cha na bad kan sel lo 
BO_T02_D1377:262b-17	ka ra dang bcas pas mkhris pa sel lo //	262b	ka ra dang cha ba mkhris ba sel lo 
BO_T02_D1377:262b-18	rgyam tsha dang bcas pas rlung sel lo //	262b	rgyam tsha dang cha ba rlung sel lo 
BO_T02_D1377:262b-19	tshad pa med pa la mar yang ngo //	262b	tshad ba med ba la mar yang ngo 
BO_T02_D1377:262b-20	dz'a ti'i lo ma de'i brgyad 'gyur chu la bskol te bzhi cha gcig cung zad dro ba khar bzhag na so'i nad dang kha nad sel lo //	262b	dza ti lo ma de brgyad gyur chu la skol te bzhi cha gcig cung zad dro ba khar jog na so nad dang kha nad sel lo 
BO_T02_D1377:262b-21	til mar gyi khu ba dang ra'i chu mnyam por bskol te til mar tsam lhag mar bzhag ste tshva dang tsha ba gsum de'i bzhi cha gcig der bsres la grang mo rna ba'i nang du bzhag ban rna ba'i nad sel lo //	262b	til mar gyi khu ba dang ra chu mnyam por skol te til mar tsam lhag mar jog ste tshva dang tsha ba gsum de bzhi cha gcig der bsres la grang mo rna ba nang du jog ban rna ba nad sel lo 
BO_T02_D1377:262b-22	ba'i mar de brgyad 'gyur 'o ma dang bskol nas n'a ga ge sar gur gum gyi phye ma dang bsres la sna bug tu blugs pas sna'i nad sel lo //	262b	ba mar de brgyad gyur mang ma dang skol nas na ga ge sar gur gum gyi byed ma dang bsres la sna bug tu blugs ba sna nad sel lo 
BO_T02_D1377:263a-0	p'a nydza kam ko li dang / lam ka li dang / aindri dang / aindra ba ru ni dang / tig ta rnams bong bu'i chus btags te byugs pas @263a * //	263a	pa nydza kam ko li dang lam ka li dang aindri dang aindra ba ru ni dang tig ta rnams bong bu chus dogs te byug ba 
BO_T02_D1377:263a-1	'bras mang po 'joms so //	263a	bras mang po joms so 
BO_T02_D1377:263a-2	'brum bu'i nad la dang po tsha ba dang rkang lag gi tshigs dang mgo bo na ba'o //	263a	brum bu nad la dang po tsha ba dang rkang lag gi tshigs dang mgo bo na ba 
BO_T02_D1377:263a-3	de shes nas bu ga med pa'i khang par rkang pa gnyis mnyam par langs te lag pa gnyis brla la thug par thur du dbyangs te ma 'gyel gyi bar du bum pa can bsgoms te tshad pa las grol ba'i bar ro //	263a	de shes nas bu ga med ba khang ba rkang ba gnyis mnyam ba ldang te lag ba gnyis brla la thug ba thur du dbyangs te ma gyel gyi ba du bum ba can sgom te tshad ba las grol ba ba ro 
BO_T02_D1377:263a-4	snying ga'i zla ba las phrem yig dkar po las byung ba sna tshogs yum mam gzugs rdo rje ma zhal gcig phyag gnyis la rdo rje /	263a	snying ga zla ba las phrem yig dkar po las byung ba sna tshogs yum mam gzugs rdo rje ma zhal gcig phyag gnyis la rdo rje 
BO_T02_D1377:263a-5	padma dang zla ba la rdo rje skyil krung du bzhugs pa /	263a	padma dang zla ba la rdo rje skyil krung du bzhugs ba 
BO_T02_D1377:263a-6	g-yon gyi thugs kar padma dkar po'i yu ba bsnams pa /	263a	g-yon gyi thugs kar padma dkar po yu ba snom ba 
BO_T02_D1377:263a-7	g-yas pa mchog sbyin can srog rtsol gyis bsgom par bya'o //	263a	g-yas ba mchog sbyin can srog rtsol gyis bsgom ba byed 
BO_T02_D1377:263a-8	sran chung btags te chu grang mo dang bsres te btung ngo //	263a	sran chung dogs te chu grang mo dang bsres te thung ngo 
BO_T02_D1377:263a-9	zhag gsum pa la 'brum pa skye ba na /	263a	zhag gsum ba la brum ba skye ba na 
BO_T02_D1377:263a-10	'brum pas shi ba'i thod pa'am gzhan bdar la mi bskyod pa bsres te btung ngo //	263a	brum ba chi ba thod ba gzhan bdar la mi skyod ba bsres te thung ngo 
BO_T02_D1377:263a-11	aom phrem bi shva m'a tree badzra kanda ki n'a sha ya n'a sha ya che ge mo sh'antim ku ru sv'a h'a /	263a	aom phrem bi shva ma tree badzra kanda ki na sha ya na sha ya che ge mo shantim ku ru sva ha 
BO_T02_D1377:263a-12	sngags 'dis yams drug dang gnod pa rnams la /	263a	sngags dis yams drug dang gnod ba rnams la 
BO_T02_D1377:263a-13	bdag dang gzhan bsrung ba'i phyir bzlas pa bya'o //	263a	bdag dang gzhan bsrung ba phyir bzlas ba byed 
BO_T02_D1377:263a-14	sman la yang lan bdun du bsngags par bya'o //	263a	sman la yang lan bdun du bsngags ba byed 
BO_T02_D1377:263a-15	'dis dpral ba snying ga mgul pa lte ba gsang gnas spyi gtsug tu thun gsum bsrung bar bya'o //	263a	dis dpral ba snying ga mgul ba lte ba gsang gnas spyi gtsug tu thun gsum bsrung ba byed 
BO_T02_D1377:263a-16	'byung bos bzung ba la tsha ba gsum dang bsres la mi bskyod pa 'thungs na zhi ba'o //	263a	byung bod bzung ba la tsha ba gsum dang bsres la mi skyod ba thung na zhi ba 
BO_T02_D1377:263a-17	da ni bcud len brjod de /	263a	da ni bcud len rjod de 
BO_T02_D1377:263a-18	gser srang gnyis sbyangs pa dang / zangs ma lcags kanti dang / lhang tsher lcags kanti /	263a	gser srang gnyis sbyong ba dang zangs ma lcags kanti dang lhang tsher lcags kanti 
BO_T02_D1377:263a-19	ksha ti de dag cha mnyam par srang gnyis mu zi kha ma bkab pa la sman de dag gi bar kun du su barna ma kshi ka'i phye ma spang gnyis blugs te me drag po la bskol te gser gnas pa'i bar du'o //	263a	ksha ti de dag cha mnyam ba srang gnyis mu zi kha ma gebs ba la sman de dag gi ba kun du su barna ma kshi ka byed ma spong gnyis blugs te me drag po la skol te gser gnas ba ba du 
BO_T02_D1377:263a-20	dngul chu srang bzhi la yung ba ma bcas pa dang so phag gi phye ma dang lhang tsher ras la lan bdun btsags la gser de dang bsres pa'i 'dag pa srang drug byas te ba'i dar ba mar med pa me drag po la bskol te ras la btsags	263a	dngul chu srang bzhi la yung ba ma cha ba dang so phag gi byed ma dang lhang tsher ras la lan bdun btsags la gser de dang bsres ba dag ba srang drug byed te ba dar ba mar med ba me drag po la skol te ras la btsags 
BO_T02_D1377:263a-21	nas tshigs ma dor te chur khu de khab len gyi snod la gser gyi 'dag pa dang bskol te srang gsum lus pa'i bar ro //	263a	nas tshigs ma dor te chur(d) khu de khab len gyi snod la gser gyi dag ba dang skol te srang gsum lus ba ba ro 
BO_T02_D1377:263a-22	de ni zla ba drug gi zhag grangs dang mnyam par bskol te /	263a	de ni zla ba drug gi zhag grangs dang mnyam ba skol te 
BO_T02_D1377:263b-0	ka ra phye ma 'dag pa srang brgyad dang / pho ba'i me drod dang cha @263b mthun par bdun nam dgu la sogs pa dang de'i drug cu cha gcig gis pho pa ris kyi phye ma dang bsres te bza' bar bya'o //	263b	ka ra byed ma dag ba srang brgyad dang pho ba me drod dang cha mthun ba bdun nam dgu la sogs ba dang de drug cu cha gcig gis pho ba ris kyi byed ma dang bsres te bza ba byed 
BO_T02_D1377:263b-1	zas gzhan spang bar bya'o //	263b	zas gzhan spong ba byed 
BO_T02_D1377:263b-2	zla ba drug gis lha'i lus dang 'dra ba'i rgas pa dang gnyer ma dang 'chi med 'grub bo //	263b	zla ba drug gis lha lus dang dra ba rga ba dang gnyer ma dang chi med grub bo 
BO_T02_D1377:263b-3	sman rdzogs pa dang ji srid 'tsho'i bar du ka ra phye ma cig bsres pa'i khur ni bza' bar bya'o //	263b	sman rdzogs ba dang ji srid tsho ba du ka ra byed ma cig bsres ba khur ni bza ba byed 
BO_T02_D1377:263b-4	da ni gser gyi phyed bsgyur brjod de /	263b	da ni gser gyi phyed sgyur rjod de 
BO_T02_D1377:263b-5	bshad ma thag pa'i sa bon dngul chu de dang mnyam por bsres te tshva dang skyur po dang tshva'i rigs gzhan yang bsnur ji srid 'dres kyi bar ro //	263b	chad ma thag ba sa bon dngul chu de dang mnyam por bsres te tshva dang skyur po dang tshva rigs gzhan yang snur ji srid dre kyi ba ro 
BO_T02_D1377:263b-6	de nas mu zi dang / lhang tsher dang / ldong ros dang / ba bla dang / zha nye dang / ka kshi dang / ka shi sha dang / dbyig dang / gser gyi btsag ste 'di dag cha mnyam par cha gnyis gong gi sman cha gcig dang gsum dngul chu dang cha mnyam pa'i nya'i mkhris pa pi dza p'u ra la sogs pa'i skyur por bsnur la de nas dngul gyi lab leb la bskus te zhag gsum gyi bar	263b	de nas mu zi dang lhang tsher dang ldong ros dang ba bla dang ja nye dang ka kshi dang ka chi sha dang dbyig dang gser gyi btsag ste di dag cha mnyam ba cha gnyis gong gi sman cha gcig dang gsum dngul chu dang cha mnyam ba nya mkhris ba pi dza pu ra la sogs ba skyur por snur la de nas dngul gyi lab leb la skud te zhag gsum gyi ba 
BO_T02_D1377:263b-7	du thab kyi 'og tu bzhag la thab kyi mes btsos bas gser du 'gyur ro //	263b	du thab kyi g tu jog la thab kyi mes btsos ba gser du gyur ro 
