segmentnr	original	stemmed
BO_T13_D4312-3:272b-37	r'a dza ko sha ta ki'i rtsa ba dang / dar ba'i tshigs ma ska ba dang sbyar bas kyang bya'o //	ra dza ko sha ta ki rtsa ba dang dar ba tshigs ma ska ba dang sbyor ba kyang byed 
BO_T13_D4312-3:272b-38	lte ba bcad pa'i dus su ni //	lte ba gcod ba dus su ni 
BO_T13_D4312-3:272b-39	dug sel ba yis brta bar bya //	dug sel ba yis rtas ba byed 
BO_T13_D4312-3:272b-40	zhes bya ba la /	zhes byed ba la 
BO_T13_D4312-3:272b-41	lte ba bcad pa'i dus su dug sel bar byed pa'i kha zas dang / sman gyis brta bar bya'o //	lte ba gcod ba dus su dug sel ba byed ba kha zas dang sman gyis rtas ba byed 
BO_T13_D4312-3:272b-42	snum chos ma lus bya ba ni //	snum chos ma lus byed ba ni 
BO_T13_D4312-3:272b-43	zhun mar nyid kyis bya ba yin //	zhun mar nyid kyis byed ba yin 
BO_T13_D4312-3:272b-44	zhes bya ba la /	zhes byed ba la 
BO_T13_D4312-3:273a-0	srin bu'i dug gi snum chos la ni kun kyang zhun mar @273a * //	srin bu dug gi snum chos la ni kun kyang zhun mar 
BO_T13_D4312-3:273a-1	gyis bya'o // til mar gyis ni rtsva sogs la //	gyis byed til mar gyis ni rtsva sogs la 
BO_T13_D4312-3:273a-2	me mched lta bur dug 'phel byed //	me mched lta bur dug phel byed 
BO_T13_D4312-3:273a-3	ces bya ba la /	ces byed ba la 
BO_T13_D4312-3:273a-4	gal te til mar gyis snum chos byas na ni /	gal te til mar gyis snum chos byed na ni 
BO_T13_D4312-3:273a-5	rtsva sngon por me mched pa ltar dug de 'phel bar 'gyur ro //	rtsva sngon por me mched ba ltar dug de phel ba gyur ro 
BO_T13_D4312-3:273a-6	be kam  ka ta ba li ka //	be kam ka ta ba li ka 
BO_T13_D4312-3:273a-7	thal tres gla sgang spri ka dang // tsandan nya lcibs so na ka / autpal rgya spos shing mngar dang // shing tsha shug pa na gu li //	thal tres gla sgang spri ka dang tsandan nya lcibs so na ka autpal rgya spros shing mngar dang shing tsha shug ba na gu li 
BO_T13_D4312-3:273a-8	po son cha'i rkang lhan cig sbyar //	po son cha rkang lhan cig sbyor 
BO_T13_D4312-3:273a-9	skyer pa gla sgang sar pa kshi //	skyer ba gla sgang sar ba kshi 
BO_T13_D4312-3:273a-10	bca' sga pi pi ling rtsa ba //	chos sga pi pi ling rtsa ba 
BO_T13_D4312-3:273a-11	pi pi ling dang tsi tra ka / ba run dang aa ga ru //	pi pi ling dang tsi tra ka ba run dang aa ga ru 
BO_T13_D4312-3:273a-12	bil ba nim pa ba ta li //	bil ba nim ba ba ta li 
BO_T13_D4312-3:273a-13	ru rta n'a ga ge sar dang // se'u lu lhan cig sbyar ba dang // bil ba tsandan autpa la //	ru rta na ga ge sar dang seu lu lhan cig sbyor ba dang bil ba tsandan autpa la 
BO_T13_D4312-3:273a-14	rgya spos bca' sga pi pi ling //	rgya spros chos sga pi pi ling 
BO_T13_D4312-3:273a-15	lcang ma nim pa ru rta dang // chu srin sder mo dzi ban ti //	lcang ma nim ba ru rta dang chu srin sder mo dzi ban ti 
BO_T13_D4312-3:273a-16	ga bra'i rtsa ba pa ta li //	ga bra rtsa ba ba ta li 
BO_T13_D4312-3:273a-17	dzi ban ti dang po son cha //	dzi ban ti dang po son cha 
BO_T13_D4312-3:273a-18	shing tsha sbyar ba de dag ni //	shing tsha sbyor ba de dag ni 
BO_T13_D4312-3:273a-19	mig sman snar blugs byug pa dang // sman chu blugs pa'i sbyor ba yis //	mig sman snar blugs byug ba dang sman chu blugs ba sbyor ba yis 
BO_T13_D4312-3:273a-20	mkhris pa bad kan rlung gyur pa'i //	mkhris ba bad kan rlung gyur ba 
BO_T13_D4312-3:273a-21	lu ta'i dug ni ji snyed pa //	lu ta dug ni ji snyed ba 
BO_T13_D4312-3:273a-22	tshul khrims la gnas ngan 'gro bzhin //	tshul khrims la gnas ngan gro bzhin 
BO_T13_D4312-3:273a-23	'di yis dug nad kun 'joms byed //	di yis dug nad kun joms byed 
BO_T13_D4312-3:273a-24	ces bya ba la /	ces byed ba la 
BO_T13_D4312-3:273a-25	be kang ka ta la sogs pa'i dug sman gyi mchog 'di ni sman gyi sde tshan gsum pos mkhris pa la sogs pa'i srin bu'i nad gsum po 'joms par byed do //	be kang ka ta la sogs ba dug sman gyi mchog di ni sman gyi sde tshan gsum pos mkhris ba la sogs ba srin bu nad gsum po joms ba byed do 
BO_T13_D4312-3:273a-26	ji ltar tshul khrims la gnas pa'i mis ngan 'gro'i tshogs zlog par byed pa dang 'dra'o //	ji ltar tshul khrims la gnas ba mis ngan gro tshogs zlog ba byed ba dang dra 
BO_T13_D4312-3:273a-27	spri ka ni sha rtsi'o //	spri ka ni sha rtsi 
BO_T13_D4312-3:273a-28	nya lcibs ni chu bal lo //	nya lcibs ni chu bal lo 
BO_T13_D4312-3:273a-29	ku li ni gandhan ku li'o //	ku li ni gandhan ku li 
BO_T13_D4312-3:273a-30	se'u lu ni sle sman ta ka'o //	seu lu ni sle sman ta ka 
BO_T13_D4312-3:273a-31	gzhan ni go bar zad do //	gzhan ni go ba zad do 
BO_T13_D4312-3:273a-32	sbyor ba tshan gsum ni be kam  ka ta nas po son cha'i rkang gi bar du sbyor ba gcig go //	sbyor ba tshan gsum ni be kam ka ta nas po son cha rkang gi ba du sbyor ba gcig go 
BO_T13_D4312-3:273a-33	gnyis pa ni skyer pa nas se'u lu'i bar ro ;	gnyis ba ni skyer ba nas seu lu ba ro 
BO_T13_D4312-3:273a-34	/ gsum pa ni bil ba nas shing tsha'i bar ro //	gsum ba ni bil ba nas shing tsha ba ro 
BO_T13_D4312-3:273a-35	seng phrom shug pa padma ge sar dang // tsandan dmar ser pri yang ku'i me tog / padma pu shel tse dang ba ya sya'i //	seng phrom shug ba padma ge sar dang tsandan dmar ser pri yang ku me tog padma pu shel tse dang ba ya sya 
BO_T13_D4312-3:273a-36	sbyor ba kun gyis ba yi dug rnams 'joms //	sbyor ba kun gyis ba yi dug rnams joms 
BO_T13_D4312-3:273a-37	zhes bya ba la /	zhes byed ba la 
BO_T13_D4312-3:273b-0	seng phrom la @273b sogs pa'i sman gyi sbyor ba ste /	seng phrom la sogs ba sman gyi sbyor ba ste 
BO_T13_D4312-3:273b-1	btung ba dang / sna sman dang / mig sman dang / bsku ba dang / sman chu blugs pa'i sbyor bas sbyar na ni ba'i dug thams cad 'joms par byed do //	thung ba dang sna sman dang mig sman dang skud ba dang sman chu blugs ba sbyor ba sbyor na ni ba dug thams cad joms ba byed do 
BO_T13_D4312-3:273b-2	yan lag brgyad pa'i snying po'i rnam par 'grel pa tshig gi don gyi zla zer zhes bya ba /	yan lag brgyad ba snying po rnam ba grel ba tshig gi don gyi zla zer zhes byed ba 
BO_T13_D4312-3:273b-3	slob dpon zla ba la dga' bas nges par sbyar ba las /	slob dpon zla ba la dga ba nges ba sbyor ba las 
BO_T13_D4312-3:273b-4	phye ma'i gnas kyi le'u sum cu rtsa bdun pa'i rnam par 'grel pa'o /	byed ma gnas kyi leu sum cu rtsa bdun ba rnam ba grel ba 
BO_T13_D4312-3:273b-5	// / de nas byi ba dang aa lang ga'i dug gso ba bshad par bya'o //	de nas byi ba dang aa lang ga dug gso ba chad ba byed 
BO_T13_D4312-3:273b-6	kha chu can dang mi brtan bu //	kha chu can dang mi brtan bu 
BO_T13_D4312-3:273b-7	rgod dang sgra can pags pa dang // rnying pa'i so dang khu byug dang // ser skya dang ni nag po dang // dmar ser khra bo dkar po dang // thi ba skra dkar byi ba dang // phus pa dang ni bra byi ste //	rgod dang sgra can pags ba dang rnying ba so dang khu byug dang ser skya dang ni nag po dang dmar ser khra bo dkar po dang thi ba skra dkar byi ba dang phus ba dang ni bra byi ste 
BO_T13_D4312-3:273b-8	byi ba'i dbye ba bco brgyad yin //	byi ba byed ba chos brgyad yin 
BO_T13_D4312-3:273b-9	zhes bya ba la /	zhes byed ba la 
BO_T13_D4312-3:273b-10	byi ba'i dbye bas ni /	byi ba byed ba ni 
BO_T13_D4312-3:273b-11	kha chu can la sogs pa'i dbye bas bstan pa grangs bco brgyad yin no //	kha chu can la sogs ba byed ba ston ba grangs chos brgyad yin no 
BO_T13_D4312-3:273b-12	gang du 'di yi khu chus phog / khu bas phog dang reg pa ni //	gang du di yi khu chus bogs khu ba bogs dang reg ba ni 
BO_T13_D4312-3:273b-13	lus kyis lus la reg pa der //	lus kyis lus la reg ba der 
BO_T13_D4312-3:273b-14	khrag la gnod cing mdog skya la //	khrag la gnod cing mdog skya la 
BO_T13_D4312-3:273b-15	thor bu rmen bu dri mnam dang // shu ba 'khor ling  yi ga 'chus //	thor bu rmen bu dri mnam dang shu ba khor ling yi ga chu 
BO_T13_D4312-3:273b-16	mgo 'khor skrang rims rab tu na //	mgo khor skrang rims rab tu na 
BO_T13_D4312-3:273b-17	nyam chung 'dar zhing lhu tshigs na //	nyam chung dar zhing lhu tshigs na 
BO_T13_D4312-3:273b-18	spu ldang dran nyams khrag 'dzag dang // yun ring du ni gnas par byed //	spu ldang dran nyams khrag dzag dang yun ring du ni gnas ba byed 
BO_T13_D4312-3:273b-19	bad kan can gyi byi ba yi //	bad kan can gyi byi ba yi 
BO_T13_D4312-3:273b-20	phru gu mang reg skom slon 'gyur //	phru gu mang reg skom slon gyur 
BO_T13_D4312-3:273b-21	zhes bya ba la /	zhes byed ba la 
BO_T13_D4312-3:273b-22	byi ba 'di dag gi khu chus lus gang la phog pa dang / yang na khu bas phog pa'i lus dang reg par gyur na der mdog skya ba la sogs pa'i nad dang / yun ring du 'brel zhing gnas par byed pa'i bar du 'gyur la /	byi ba di dag gi khu chus lus gang la bogs ba dang yang na khu ba bogs ba lus dang reg ba gyur na der mdog skya ba la sogs ba nad dang yun ring du brel zhing gnas ba byed ba ba du gyur la 
BO_T13_D4312-3:273b-23	bad kan can gyi mi byi ba'i phru gu mang pos reg na skom dad che ba dang / slon par 'gyur ro //	bad kan can gyi mi byi ba phru gu mang pos reg na skom dad che ba dang slon ba gyur ro 
BO_T13_D4312-3:273b-24	byi ba 'khrig spyod dug gso dka' //	byi ba khrig spyod dug gso dka 
BO_T13_D4312-3:273b-25	yang dang yang du ldang bar byed //	yang dang yang du ldang ba byed 
BO_T13_D4312-3:273b-26	ces bya ba la /	ces byed ba la 
BO_T13_D4312-3:273b-27	'khrig pa spyod pa'i dug gis reg pa ni shin tu gso dka' zhing /	khrig ba spyod ba dug gis reg ba ni shin tu gso dka zhing 
BO_T13_D4312-3:273b-28	de yang dang yang du ldang zhing 'khrug par byed pa yin no //	de yang dang yang du ldang zhing khrug ba byed ba yin no 
BO_T13_D4312-3:274a-0	yan @274a * //	yan 
BO_T13_D4312-3:274a-1	lag kun skrangs mdog mi sdug / rnags shing 'on la rims kyis 'debs //	lag kun skrang mdog mi sdug rnags shing n la rims kyis debs 
BO_T13_D4312-3:274a-2	mgo lci kha chu khrag 'byung zhing //	mgo lci kha chu khrag byung zhing 
BO_T13_D4312-3:274a-3	slon pa gso dka'i mtshan nyid yin //	slon ba gso dka mtshan nyid yin 
BO_T13_D4312-3:274a-4	zhes bya ba la /	zhes byed ba la 
BO_T13_D4312-3:274a-5	byi ba'i dug gsor mi rung bas zin pa'i mtshan ma ni yan lag kun skrangs pa nas /	byi ba dug gsor mi rung ba zin ba mtshan ma ni yan lag kun skrang ba nas 
BO_T13_D4312-3:274a-6	slon pa'i bar yin par shes par bya'o //	slon ba ba yin ba shes ba byed 
BO_T13_D4312-3:274a-7	phus pas zin pa de dri bro //	phus ba zin ba de dri bro 
BO_T13_D4312-3:274a-8	lgang pa skrangs shing chu mdog nyams //	lgang ba skrang shing chu mdog nyams 
BO_T13_D4312-3:274a-9	sbrang rtsi 'dra ba'i rmen bus khyab //	sbrang rtsi dra ba rmen bud khyab 
BO_T13_D4312-3:274a-10	ces bya ba la /	ces byed ba la 
BO_T13_D4312-3:274a-11	mi phus pa'i dug gis zin pa'i mtshan ma ni de'i dri bro ba nas rmen bus khyab pa'i bar yin te /	mi phus ba dug gis zin ba mtshan ma ni de dri bro ba nas rmen bud khyab ba ba yin te 
BO_T13_D4312-3:274a-12	de ni gsor mi rung bas spang bar bya'o //	de ni gsor mi rung ba spong ba byed 
BO_T13_D4312-3:274a-13	khyi'i dug bad kan shas cher 'khrugs //	khyi dug bad kan shas cher khrugs 
BO_T13_D4312-3:274a-14	'du shes rgyu ba'i rtsa mang gnas //	du shes rgyu ba rtsa mang gnas 
BO_T13_D4312-3:274a-15	gnod cing 'khrug par byed pa dang // lus zungs la ni mi bzad gnod //	gnod cing khrug ba byed ba dang lus zungs la ni mi bzad gnod 
BO_T13_D4312-3:274a-16	ces bya ba la /	ces byed ba la 
BO_T13_D4312-3:274a-17	khyi'i mche ba'i dug gis zin pa ni /	khyi mche ba dug gis zin ba ni 
BO_T13_D4312-3:274a-18	bad kan gyi nad shas cher ldang zhing 'khrugs pa dang / 'du shes rgyu ba'i rtsa mang po la gnas nas 'du shes stor cing brgyal bar byed pa dang / lus zungs rnams la lhag par gnod par byed pa yin no //	bad kan gyi nad shas cher ldang zhing khrugs ba dang du shes rgyu ba rtsa mang po la gnas nas du shes stor cing brgyal ba byed ba dang lus zungs rnams la lhag ba gnod ba byed ba yin no 
BO_T13_D4312-3:274a-19	kha chu 'dzag dang long dang 'on //	kha chu dzag dang long dang n 
BO_T13_D4312-3:274a-20	kun tu rgyug par byed pa dang // mjug ma 'gram pa phrag gong lhod //	kun tu rgyug ba byed ba dang mjug ma grams ba phrag gong lhod 
BO_T13_D4312-3:274a-21	mgo na gdong ni dud pa yin //	mgo na gdong ni dud ba yin 
BO_T13_D4312-3:274a-22	zhes bya ba la /	zhes byed ba la 
BO_T13_D4312-3:274a-23	khyi kha chu 'dzag cing long ba dang 'on pa dang / phyogs kun tu rgyug par byed pa dang / mjug ma lhod cing rang gi gnas nas bskyod pa dang / 'gram pa dang / phrag pa yang lhod pa dang / mgo na zhing tsha ba dang /	khyi kha chu dzag cing long ba dang n ba dang phyogs kun tu rgyug ba byed ba dang mjug ma lhod cing rang gi gnas nas skyod ba dang grams ba dang phrag ba yang lhod ba dang mgo na zhing tsha ba dang 
BO_T13_D4312-3:274a-24	gdong dud par byed pa ni khyi gdug pa yin no //	gdong dud ba byed ba ni khyi gdug ba yin no 
BO_T13_D4312-3:274a-25	de yi so yis zin na rma //	de yi so yis zin na rma 
BO_T13_D4312-3:274a-26	tshor ba chung zhing khrag nag 'dzag / mgo snying na zhing rims 'debs rengs //	tshor ba chung zhing khrag nag dzag mgo snying na zhing rims debs rengs 
BO_T13_D4312-3:274a-27	de rjes skom dang brgyal bar 'gyur //	de rjes skom dang brgyal ba gyur 
BO_T13_D4312-3:274a-28	zhes bya ba la /	zhes byed ba la 
BO_T13_D4312-3:274a-29	de khyi'i sos zin par gyur pa'i mi ni rma'i tshor ba chung ba dang / de bzhin du khrag nag po 'dzag pa la sogs pa yin no //	de khyi sos zin ba gyur ba mi ni rma tshor ba chung ba dang de bzhin du khrag nag po dzag ba la sogs ba yin no 
BO_T13_D4312-3:274b-0	'di yis @274b gdug cing mche ba can //	di yis gdug cing mche ba can 
BO_T13_D4312-3:274b-1	ce spyang dom dang dred dang gung //	ce spyang dom dang dred dang gung 
BO_T13_D4312-3:274b-2	stag dang spyang ki la sogs pa //	stag dang spyang ki la sogs ba 
BO_T13_D4312-3:274b-3	gzhan dag kyang ni shes par bya //	gzhan dag kyang ni shes ba byed 
BO_T13_D4312-3:274b-4	zhes bya ba la /	zhes byed ba la 
BO_T13_D4312-3:274b-5	tshul 'dis ni gcan gzan gdug cing mche ba dang ldan pa'i mche ba can ce sbyang la sogs pa gzhan dag kyang shes par bya'o //	tshul dis ni gcan gzan gdug cing mche ba dang ldan ba mche ba can ce sbyong la sogs ba gzhan dag kyang shes ba byed 
BO_T13_D4312-3:274b-6	g-ya' zhing zug la mdog mi sdug / tshor ba med gnas rims mgo 'khor //	g-ya zhing zug la mdog mi sdug tshor ba med gnas rims mgo khor 
BO_T13_D4312-3:274b-7	tsha zhing dmar lan zhing rnags //	tsha zhing dmar lan zhing rnags 
BO_T13_D4312-3:274b-8	skrang zhing rmen bu skye zug 'khums //	skrang zhing rmen bu skye zug khums 
BO_T13_D4312-3:274b-9	rma ni 'gags shing 'brum bu 'byung //	rma ni gag shing brum bu byung 
BO_T13_D4312-3:274b-10	lte ba can du zlum por 'gyur //	lte ba can du zlum por gyur 
BO_T13_D4312-3:274b-11	kun tu dug bcas mtshan ma 'di //	kun tu dug cha mtshan ma di 
BO_T13_D4312-3:274b-12	dug med de las bzlog pa yin //	dug med de las bzlog ba yin 
BO_T13_D4312-3:274b-13	zhes bya ba la /	zhes byed ba la 
BO_T13_D4312-3:274b-14	thams cad du dug dang ldan pa ni /	thams cad du dug dang ldan ba ni 
BO_T13_D4312-3:274b-15	g-ya' ba la sogs pa'i mtshan nyid dang ldan par shes par bya la /	g-ya ba la sogs ba mtshan nyid dang ldan ba shes ba byed la 
BO_T13_D4312-3:274b-16	dug med pa ni g-ya' ba la sogs pa'i mtshan nyid de dag med cing snga ma las go bzlog pa yin par shes par bya'o //	dug med ba ni g-ya ba la sogs ba mtshan nyid de dag med cing snga ma las go bzlog ba yin ba shes ba byed 
BO_T13_D4312-3:274b-17	gang gis bzung ba de'i spyod tshul //	gang gis bzung ba de spyod tshul 
BO_T13_D4312-3:274b-18	sgra sgrogs rgyu med par de'i gzugs //	sgra sgrogs rgyu med ba de gzugs 
BO_T13_D4312-3:274b-19	chu dang me long sogs mthong 'chi //	chu dang me long sogs mthong chi 
BO_T13_D4312-3:274b-20	zhes bya ba la /	zhes byed ba la 
BO_T13_D4312-3:274b-21	mi ce spyang la sogs pa dag gis bzung bar gyur pa gang yin pa de mod la de'i spyod tshul de ce spyang la sogs pa'i spyod tshul byed cing /	mi ce spyang la sogs ba dag gis bzung ba gyur ba gang yin ba de mod la de spyod tshul de ce spyang la sogs ba spyod tshul byed cing 
BO_T13_D4312-3:274b-22	de ltar mthong ba'i rgyu med par chu la sogs par de'i gzugs mthong na 'chi bar 'gyur ba yin no //	de ltar mthong ba rgyu med ba chu la sogs ba de gzugs mthong na chi ba gyur ba yin no 
BO_T13_D4312-3:274b-23	ma bzung bar yang sgra dang ni //	ma bzung ba yang sgra dang ni 
BO_T13_D4312-3:274b-24	mthong bas sngangs par byed pa ni //	mthong ba sngang ba byed ba ni 
BO_T13_D4312-3:274b-25	chu yis skrag ces bya ba ste //	chu yis skrag ces byed ba ste 
BO_T13_D4312-3:274b-26	zin pa de yang spang bar bya //	zin ba de yang spong ba byed 
BO_T13_D4312-3:274b-27	zhes bya ba la /	zhes byed ba la 
BO_T13_D4312-3:274b-28	mi gang srog chags de dag gis ma bzung du zin kyang sgra la sogs pas sngangs shing chus skrag par byed pa'i mi de ni chus skrag pa zhes bya ba'i nad kyis zin pa yin te /	mi gang srog chags de dag gis ma bzung du zin kyang sgra la sogs ba sngang shing chus skrag ba byed ba mi de ni chus skrag ba zhes byed ba nad kyis zin ba yin te 
BO_T13_D4312-3:274b-29	de yang spang bar bya'o //	de yang spong ba byed 
BO_T13_D4312-3:274b-30	byi ba'i dug gis zin ma thag / rma ni mde'u bsregs pas bsreg / yang na me long dag gis bya //	byi ba dug gis zin ma thag rma ni mdeu bsregs ba bsreg yang na me long dag gis byed 
BO_T13_D4312-3:274b-31	gzhan du lte bar mi bzod na //	gzhan du lte ba mi bzod na 
BO_T13_D4312-3:274b-32	zhes bya ba la /	zhes byed ba la 
BO_T13_D4312-3:275a-0	byi bas zin ma thag pa'i mi'i rma la @275a * //	byi ba zin ma thag ba mi rma la 
BO_T13_D4312-3:275a-1	mde'u bsregs pa 'am /	mdeu bsregs ba mang 
BO_T13_D4312-3:275a-2	yang na me long bsregs pas de bsreg par bya'o //	yang na me long bsregs ba de bsreg ba byed 
BO_T13_D4312-3:275a-3	gzhan du ma bsregs na rma'i lte ba mi bzod par na bar 'gyur ro //	gzhan du ma bsregs na rma lte ba mi bzod ba na ba gyur ro 
BO_T13_D4312-3:275a-4	bsregs nas rma las khrag dbyung zhing //	bsregs nas rma las khrag byin zhing 
BO_T13_D4312-3:275a-5	zhal zhal byas la shir sha dang // yung ba rgya spos gur gum dang // sle tres kyi ni lde gus bsku //	zhal zhal byed la shir sha dang yung ba rgya spros gur gum dang sle tres kyi ni lde gus skud 
BO_T13_D4312-3:275a-6	zhes bya ba la /	zhes byed ba la 
BO_T13_D4312-3:275a-7	sos bzung ba bsregs pa'i rma la rngabs rva la sogs pas khrag dbyung ba dang / zhal zhal byas la shi ri sha la sogs pa'i lde gus bsku bar bya'o //	sos bzung ba bsregs ba rma la rngabs rva la sogs ba khrag byin ba dang zhal zhal byed la chi ri sha la sogs ba lde gus skud ba byed 
BO_T13_D4312-3:275a-8	khyim gyi dud ba skyer pa dang // rgyam tsha dang ni btsod dag gi / lde gus byi ba'i dug sel zhing //	khyim gyi dud ba skyer ba dang rgyam tsha dang ni btsod dag gi lde gus byi ba dug sel zhing 
BO_T13_D4312-3:275a-9	lte ba 'bur ba'ang 'joms par byed //	lte ba bur ba joms ba byed 
BO_T13_D4312-3:275a-10	ces bya ba la /	ces byed ba la 
BO_T13_D4312-3:275a-11	khyim gyi dud pa la sogs pa'i sman gyi lde gus bskus na byi ba'i dug sel bar byed cing /	khyim gyi dud ba la sogs ba sman gyi lde gus skud na byi ba dug sel ba byed cing 
BO_T13_D4312-3:275a-12	de nyid kyis rma'i lte ba 'bur ba yang sel bar byed do //	de nyid kyis rma lte ba bur ba yang sel ba byed do 
BO_T13_D4312-3:275a-13	de nas skyur bas bkrus nas ni //	de nas skyur ba khrud nas ni 
BO_T13_D4312-3:275a-14	gi ri kar ni pa lin ti //	gi ri kar ni ba lin ti 
BO_T13_D4312-3:275a-15	bil ba'i rtsa ba sle tres dang // chu dang btags pa'i lde gus bsku //	bil ba rtsa ba sle tres dang chu dang dogs ba lde gus skud 
BO_T13_D4312-3:275a-16	zhes bya ba la /	zhes byed ba la 
BO_T13_D4312-3:275a-17	de'i 'og tu kan dza dang dar ba la sogs pa khu ba skyur bas bkrus la /	de g tu kan dza dang dar ba la sogs ba khu ba skyur ba khrud la 
BO_T13_D4312-3:275a-18	de'i rjes la gi ri kar ni la sogs pa chu dang btags pa'i lde gus bsku bar bya'o //	de rjes la gi ri kar ni la sogs ba chu dang dogs ba lde gus skud ba byed 
BO_T13_D4312-3:275a-19	dug dang skrang sel sman gzhan dang // yang na gtar ga myur du gdab //	dug dang skrang sel sman gzhan dang yang na gtar ga myur du gdab 
BO_T13_D4312-3:275a-20	ces bya ba la /	ces byed ba la 
BO_T13_D4312-3:275a-21	de bzhin du de la dug dang skrang pa sel ba'i sman gzhan dag gis kyang bsku ba dang / gtar ga gdab par yang bya'o //	de bzhin du de la dug dang skrang ba sel ba sman gzhan dag gis kyang skud ba dang gtar ga gdab ba yang byed 
BO_T13_D4312-3:275a-22	ni li ni bskol shi ri sha //	ni li ni skol chi ri sha 
BO_T13_D4312-3:275a-23	aang ko la yi khu bas slon //	aang ko la yi khu ba slon 
BO_T13_D4312-3:275a-24	zhes bya ba la /	zhes byed ba la 
BO_T13_D4312-3:275a-25	byi ba'i dug de la ni li ni bskol ba'i khu ba blud pa'am /	byi ba dug de la ni li ni skol ba khu ba blud ba 
BO_T13_D4312-3:275a-26	shi ri sha dang aang ko la'i khu ba blud de slon par bya'o //	chi ri sha dang aang ko la khu ba blud de slon ba byed 
BO_T13_D4312-3:275a-27	ko sha ta ki shir sha dang // dzi mu ta ka'i 'bras bu dang // po son cha ni phye mar btags //	ko sha ta ki shir sha dang dzi mu ta ka bras bu dang po son cha ni byed mar dogs 
BO_T13_D4312-3:275a-28	zho sbyar blud la dug slon gzhug / ces bya ba la /	zho sbyor blud la dug slon jug ces byed ba la 
BO_T13_D4312-3:275a-29	yang na ko sha ta ki la sogs pa'i sman bzhi'i phye ma dang zhor sbyar te blud la byi ba'i dug slon du gzhug par bya'o //	yang na ko sha ta ki la sogs ba sman bzhi byed ma dang zhor sbyor te blud la byi ba dug slon du jug ba byed 
BO_T13_D4312-3:275a-30	shu dag ru rta po son cha'am //	shu dag ru rta po son cha 
BO_T13_D4312-3:275a-31	dzi ban ti ni ba gcin btags //	dzi ban ti ni ba gcin dogs 
BO_T13_D4312-3:275b-0	cho ga snga ma bzhin blud @275b na ;	cho ga snga ma bzhin blud na 
BO_T13_D4312-3:275b-1	/ dug gi nad ni thams cad sel //	dug gi nad ni thams cad sel 
BO_T13_D4312-3:275b-2	zhes bya ba la /	zhes byed ba la 
BO_T13_D4312-3:275b-3	shu dag la sogs pa'i sman ba gcin dang btags pa'i lde gu dang snga ma bzhin du zho dang sbyar te blud na yang byi ba'i dug gi nad thams cad sel bar byed do //	shu dag la sogs ba sman ba gcin dang dogs ba lde gu dang snga ma bzhin du zho dang sbyor te blud na yang byi ba dug gi nad thams cad sel ba byed do 
BO_T13_D4312-3:275b-4	dur byid ni li ni dang ni //	dur byid ni li ni dang ni 
BO_T13_D4312-3:275b-5	'bras bu gsum gyi bkru sman bsngags //	bras bu gsum gyi khrud sman bsngags 
BO_T13_D4312-3:275b-6	zhes bya ba la /	zhes byed ba la 
BO_T13_D4312-3:275b-7	yang na dur byid la sogs pa'i bkru sman yang bsngags so //	yang na dur byid la sogs ba khrud sman yang bsngags so 
BO_T13_D4312-3:275b-8	shir sha'i snying po'i 'bras bu yis //	shir sha snying po bras bu yis 
BO_T13_D4312-3:275b-9	mgo bo'i bkru sman dag kyang phan //	mgo bo khrud sman dag kyang phan 
BO_T13_D4312-3:275b-10	zhes bya ba la /	zhes byed ba la 
BO_T13_D4312-3:275b-11	yang na shir sha'i nang gi snying po dang / de nyid kyi 'bras bu mgo bo'i bkru sman btang na yang phan no //	yang na shir sha nang gi snying po dang de nyid kyi bras bu mgo bo khrud sman gtong na yang phan no 
BO_T13_D4312-3:275b-12	ba lci'i khu ba tsha ba gsum //	ba lci khu ba tsha ba gsum 
BO_T13_D4312-3:275b-13	phye ma zhib btags lde gus phan //	byed ma zhib dogs lde gus phan 
BO_T13_D4312-3:275b-14	zhes bya ba la /	zhes byed ba la 
BO_T13_D4312-3:275b-15	yang na ba'i lci ba la sogs pa'i mig sman yang phan no //	yang na ba lci ba la sogs ba mig sman yang phan no 
BO_T13_D4312-3:275b-16	ba lang lci ba ka pid ta'i //	ba lang lci ba ka pid ta 
BO_T13_D4312-3:275b-17	phye ma sbrang rtsi'i lde gu bza' //	byed ma sbrang rtsi lde gu bza 
BO_T13_D4312-3:275b-18	zhes bya ba la /	zhes byed ba la 
BO_T13_D4312-3:275b-19	yang na ba lang gi lci ba la sogs pa'i lde gu zos na yang phan no //	yang na ba lang gi lci ba la sogs ba lde gu zos na yang phan no 
BO_T13_D4312-3:275b-20	tandu li yi rtsa ba dang // bskol ba'i mar ni blud na 'ang phan //	tandu li yi rtsa ba dang skol ba mar ni blud na mang phan 
BO_T13_D4312-3:275b-21	zhes bya ba la /	zhes byed ba la 
BO_T13_D4312-3:275b-22	yang na tandu li'i rtsa ba'i sman mar yang phan no //	yang na tandu li rtsa ba sman mar yang phan no 
BO_T13_D4312-3:275b-23	gi ri kar ni ser po gnyis //	gi ri kar ni ser po gnyis 
BO_T13_D4312-3:275b-24	shing mngar btsod dang sle tres phan //	shing mngar btsod dang sle tres phan 
BO_T13_D4312-3:275b-25	zhes bya ba la /	zhes byed ba la 
BO_T13_D4312-3:275b-26	yang na gi ri karni la sogs pa'i sman dang bskol ba'i mar blud na yang phan no //	yang na gi ri karni la sogs ba sman dang skol ba mar blud na yang phan no 
BO_T13_D4312-3:275b-27	thal tres rtsa ba mar bskol ba //	thal tres rtsa ba mar skol ba 
BO_T13_D4312-3:275b-28	ka pid ta yi rnam lnga'ang phan //	ka pid ta yi rnam lnga phan 
BO_T13_D4312-3:275b-29	zhes bya ba la /	zhes byed ba la 
BO_T13_D4312-3:275b-30	yang na thal tres zhes bya ba sha ri ba dang bskol ba'i sman mar ram /	yang na thal tres zhes byed ba sha ri ba dang skol ba sman mar ram 
BO_T13_D4312-3:275b-31	yang na ka pid ta lnga pa zhes bya ba ka pid tha'i shun pa dang / lo ma dang rtsa ba la sogs pa dang bskol ba'i mar yang phan no //	yang na ka pid ta lnga ba zhes byed ba ka pid tha shun ba dang lo ma dang rtsa ba la sogs ba dang skol ba mar yang phan no 
BO_T13_D4312-3:275b-32	sin du ba ra rgya spos dang // shi kru bil ba'i rtsa ba dang // shu dag gze ma ba spru ba //	sin du ba ra rgya spros dang chi kru bil ba rtsa ba dang shu dag gze ma ba spru ba 
BO_T13_D4312-3:275b-33	dzi mu ta dang bcas pa ste //	dzi mu ta dang cha ba ste 
BO_T13_D4312-3:275b-34	de rnams khu ba sbrang rtsir bcas //	de rnams khu ba sbrang rtsir cha 
BO_T13_D4312-3:275b-35	blud nas 'bras chan s'a lu zho //	blud nas bras chan sa lu zho 
BO_T13_D4312-3:275b-36	byin na byi ba'i dug nad sel //	byin na byi ba dug nad sel 
BO_T13_D4312-3:275b-37	zhes bya ba la /	zhes byed ba la 
BO_T13_D4312-3:275b-38	yang byi ba'i dug gis nyen pa la ni sin du ba ra la sogs pa'i khu ba sbrang rtsi dang bcas pa blud pa la sogs pa'i sbyor ba byas na yang phan no //	yang byi ba dug gis nyen ba la ni sin du ba ra la sogs ba khu ba sbrang rtsi dang cha ba blud ba la sogs ba sbyor ba byed na yang phan no 
BO_T13_D4312-3:275b-39	shar bung ga'i phye ma ni //	char bung ga byed ma ni 
BO_T13_D4312-3:275b-40	dar bar sbyar ba blud pa'ang phan //	dar ba sbyor ba blud ba phan 
BO_T13_D4312-3:275b-41	zhes bya ba la /	zhes byed ba la 
