segmentnr	original	stemmed
BO_T17_MW1PD95844_2594:2624	phyir/_khro bo'i dkyil 'khor du mngon par 'du mdzad de/_khro bo la rnam pa	bo dkyil khor du mngon ba du mdzad bo la rnam ba 
BO_T17_MW1PD95844_2594:2625	gsum ste/_de la shes rab chen po'i khro bo ni/_sgyu 'phrul rdo rje las/_yang	gsum la shes rab chen po khro bo phrul rdo rje 
BO_T17_MW1PD95844_2594:2626	dag shes rab chen po ni/_mtshhan ma 'joms phyir khro bo'i mchog_/ce'o/_/	dag shes rab chen po ma joms phyir khro bo 
BO_T17_MW1PD95844_2594:2627	ye shes chen po'i khro bo ni/_rgyas pa'i rgyud las/_rang rig ye shes rgyal po yis//	ye shes chen po khro bo ba brgyud rig ye shes rgyal po 
BO_T17_MW1PD95844_2594:2628	phyogs bcu'i khams rnams dbang bsdus nas/_/kun kyang mi dmigs dbyings su	phyogs chu khams rnams dbang sdud kyang mi dmigs dbyings su 
BO_T17_MW1PD95844_2594:2629	thim/_/thams cad khro bo'i tshhogs su 'gyur zhe'o/_/phyag rgya chen po'i khro bo ni/	cad khro bo tshhogs su gyur rgya chen po khro bo 
BO_T17_MW1PD95844_2594:2630	'og nas 'chad pa ste/_'di dag gdul bya'i ngo bo la snang yang /_rtshol bar	g nas chad ba dag gdul byed ngo bo la snang yang ba 
BO_T17_MW1PD95844_2594:2631	thal ba med do/_/ci'i phyir zhe na/_zhes bya ba ni/_gtan tshhigs kyi dri ba	thal ba med phyir zhe byed ba tshhigs kyi dri ba 
BO_T17_MW1PD95844_2594:2632	dgos pa tshhol ba ste/_gang snyam pa la/_bdag tu rmongs pa zhes bya ba la	dgos ba tshhol ba snyam ba tu rmongs ba zhes byed ba la 
BO_T17_MW1PD95844_2594:2633	sogs pa gsungs te kun tu brtags pa las byung ba'i ma rig pa las las sna	sogs ba gsungs te kun tu rtog ba las byung ba ma rig ba las las sna 
BO_T17_MW1PD95844_2594:2634	rgyud kyi rgyal po chen po dpal gsang ba'i snying po'i 'grel pa zhes bya ba	brgyud kyi rgyal po chen po dpal gsang ba snying po grel ba zhes byed ba 
BO_T17_MW1PD95844_2594:2635	tshhogs su snang ba'o/_/brtags pa la mngon par zhen pa bya ba ni/_kun	tshhogs su snang ba la mngon ba zhen ba byed ba 
BO_T17_MW1PD95844_2594:2636	brtags gnyis la zhen pa ste/_spyi'i mtshhan nyid la rang gi mtshhan du mthong ba'o/_/	rtog gnyis la zhen ba mtshhan nyid la rang gi mtshhan du mthong 
BO_T17_MW1PD95844_2594:2637	yang dag pa'i lam dang bral ba dag ni zhes bya ba/_lung man ngag gis ma zin	yang dag ba lam dang bral ba dag ni zhes byed man ngag gis ma zin 
BO_T17_MW1PD95844_2594:2638	pa'i bskyed rdzogs rnam pa gnyis kho na ste/_gang la de dag med pa'o/_/dag	ba skyed rdzogs rnam ba gnyis kho na la de dag med 
BO_T17_MW1PD95844_2594:2639	ces bya ba ni/_ngo bo ston pa ste/_sngon skal pa snga ma la byung ba'i dge slong nag	ces byed ba bo ston ba skal ba snga ma la byung ba dge slong nag 
BO_T17_MW1PD95844_2594:2640	po'o/_/de ci zhig snyam pa la/_gab pa'i gsang ba ma rtogs par zhes bya ba ni/	ci jig snyam ba ba gsang ba ma rtogs ba zhes byed ba 
BO_T17_MW1PD95844_2594:2641	rang bzhin gsang ba'i snying po'o/_/sbas pa'i gsang ba la mngon par 'chel	rang bzhin gsang ba snying ba gsang ba la mngon ba chel 
BO_T17_MW1PD95844_2594:2642	nas zhes bya ba ni/_lam gyi rgyud las byung ba'i stan 'gan la sogs pa sgra ji	nas zhes byed ba gyi brgyud las byung ba stan gan la sogs ba sgra ji 
BO_T17_MW1PD95844_2594:2643	bzhin par bzung nas rgyun du spyod pa'o/_/rgyu dang 'bras bu la rmongs pa zhes bya	bzhin ba bzung nas rgyun du spyod dang bras bu la rmongs ba zhes byed 
BO_T17_MW1PD95844_2594:2644	ba ni/_mi dge ba'i rnam par smin pa mi shes pa'o/_/srid pa'i sa bon rtshub mo	ba dge ba rnam ba smin ba mi shes ba sa bon rtshub mo 
BO_T17_MW1PD95844_2594:2645	zhes bya ba ni/_las ngan pa dang nyon mongs pa rang kho na'i bag chags rnams so//	zhes byed ba ngan ba dang nyon mongs ba rang kho na bag chags rnams 
BO_T17_MW1PD95844_2594:2646	mtshhams med pa zhes bya ba ni sdug bsngal bar mi 'chad pa'o/_/rab tu tshha ba/	mtshhams med ba zhes byed ba ni sdug sngal ba mi chad tu tshha 
BO_T17_MW1PD95844_2594:2647	zhes bya ba la sogs pa ni go sla ste brgyad ces bya ba ni/_yang sos dang /_thig	zhes byed ba la sogs ba ni go sla ste brgyad ces byed ba sos dang 
BO_T17_MW1PD95844_2594:2648	nag dang /_sdud 'joms dang /_ngu 'bod dang /_ngu 'bod chen po dang / dmyal ba chen po dang /_rab tu tshha ba dang /_mnar med pa'o/_/shin tu	nag dang joms dang bod dang bod chen po dang dmyal ba chen po dang tu tshha ba dang med tu 
BO_T17_MW1PD95844_2594:2649	grang ba brgyad ces bya ba ni/_chu bur can dang /_/chu bur rdol pa dang /_so	grang ba brgyad ces byed ba bur can dang bur rdol ba dang 
BO_T17_MW1PD95844_2594:2650	tham tham dang /_a chu chu dang /_kyi hud zer ba dang /_ud pa la ltar gas	tham tham dang chu chu dang hud zer ba dang ba la ltar gas 
BO_T17_MW1PD95844_2594:2651	pa dang /_pad+ma ltar gas pa dang /_gas pa chen po'o/_/'jig rten gyi	ba dang ltar gas ba dang ba chen rten gyi 
BO_T17_MW1PD95844_2594:2652	khams brgyud cing zhes bya ba ni/_gnas 'jig na gzhan du 'pho ba'o/_/de	khams brgyud cing zhes byed ba jig na gzhan du pho 
BO_T17_MW1PD95844_2594:2653	nas rnam par smin pa de zad pa dang /_zhes bya ba ni/_bsad pa dang / brdeg  pa dang /_rang ka ma'i 'phrin las dang /_gdug pa dang /_dam	nas rnam ba smin ba de zad ba dang byed ba ba dang brdeg ba dang ka ma phrin las dang ba dang 
BO_T17_MW1PD95844_2594:2654	tshhig can la ngan du sems pa dang /_che bas dregs pa la sogs pa ni rnam par	tshhig can la ngan du sems ba dang ba dregs ba la sogs ba ni rnam ba 
BO_T17_MW1PD95844_2594:2655	smin pa'i 'bras bu'o/_/yi dwags zhes bya ba la sogs pa ni go sla ste/_'dod	smin ba bras dwags zhes byed ba la sogs ba ni go sla 
BO_T17_MW1PD95844_2594:2656	pa'i dngos po rnams yid du mi 'ong ba zhes bya ba ni/_ci 'ang ngan skyugs su	ba dngos po rnams yid du mi ng ba zhes byed ba mang ngan skyug su 
BO_T17_MW1PD95844_2594:2657	mthong ba ste/_phyi'i sgrib pa can zhes bya'o/_/gdug cing rtshub pa'i dngos po	mthong ba sgrib ba can zhes cing rtshub ba dngos po 
BO_T17_MW1PD95844_2594:2658	zhes bya ba ni/_ci zos pa khro chu dang /_lcags tshan _du gyur pa ste/_me lce'i	zhes byed ba zos ba khro chu dang tshan _du gyur ba lce 
BO_T17_MW1PD95844_2594:2659	'khor lo can zhes bya'o/_/yod med par 'gyur zhes bya ba yang phyi'i sgrib pa can	khor lo can zhes med ba gyur zhes byed ba yang phyi sgrib ba can 
BO_T17_MW1PD95844_2594:2660	te/_bza' bar mthong nas bgrod pas med pa'o/_/lus dang yan lag dang dbang po mi mtshham pa zhes bya ba ni/_lus ri bo tsham la kha khab mig tsham pa ste/	ba mthong nas bgrod ba med dang yan lag dang dbang po mi mtshham ba zhes byed ba ri bo tsham la kha khab mig tsham ba 
BO_T17_MW1PD95844_2594:2661	nang gi sgrib pa can zhes bya'o/_/de nas lus kyi sgrib pa rtshub po'i rnam par smin	nang gi sgrib ba can zhes nas lus kyi sgrib ba rtshub po rnam ba smin 
BO_T17_MW1PD95844_2594:2662	pa zhes bya ba ni/_nor zas la brkam pa dang /_'jungs pa dang /_brnab	ba zhes byed ba zas la rkam ba dang ba dang 
BO_T17_MW1PD95844_2594:2663	sems dang /_mchod pa'i longs spyod la rngam pa dang /_gsog 'jog byas pa	sems dang ba longs spyod la rngam ba dang jog byed ba 
BO_T17_MW1PD95844_2594:2664	la sogs pa'i rnam par smin pa'o/_/sngon gyi srid pas 'tshhams sbyar nas zhes bya	la sogs ba rnam ba smin gyi srid ba tshhams sbyor nas zhes byed 
BO_T17_MW1PD95844_2594:2665	ba ni sngon khro bo dbu' dang phyag mang po dang /_'phra men ma la sogs par yid	ba ni sngon khro bo dbu dang phyag mang po dang men ma la sogs ba yid 
BO_T17_MW1PD95844_2594:2666	la byas nas las rlang po byas pa'i rgyu mthun pa'i 'bras bu'o/_/yi dwags kyi srin	la byed nas las rlang po byed ba rgyu mthun ba bras dwags kyi srin 
BO_T17_MW1PD95844_2594:2667	po chen po zhes bya ba la sogs pa ni bdud rang gi ngo bo ste go sla'o/_/nga ro dang dri dang zhes bya ba la sogs pa ni de'i las kyi sbyor ba thams cad la dgod pa'o/_/	po chen po zhes byed ba la sogs ba ni bdud rang gi ngo bo ste go ro dang dri dang zhes byed ba la sogs ba ni de las kyi sbyor ba thams cad la god 
BO_T17_MW1PD95844_2594:2668	de sngon rten pa'i stobs zhes bya ba ni/_sngon theg pa chen por sems bskyed nas	de sngon rten ba stobs zhes byed ba theg ba chen por sems skyed nas 
BO_T17_MW1PD95844_2594:2669	phyogs su spyod pa'o/_/thugs rjes 'dul bar gyur te zhes bya ba ni/_sngon spyod	phyogs su spyod rjes dul ba gyur te zhes byed ba spyod 
BO_T17_MW1PD95844_2594:2670	kyi dus bab pa'o/_/de nas de bzhin gshegs pa che ba'i rdo rje bkod pa'i sgyu	kyi dus bab nas de bzhin gshegs ba che ba rdo rje bkod ba sgyu 
BO_T17_MW1PD95844_2594:2671	'phrul dra ba zhes bya ba la sogs pa/_bdud 'dul ba'i gleng gzhi rang gi ngo bo	phrul dra ba zhes byed ba la sogs dul ba gleng gzhi rang gi ngo bo 
BO_T17_MW1PD95844_2594:2672	la don gsum ste/_cho 'phrul rmad du byung ba dang /_dkyil 'khor rmad du byung	la don gsum phrul rmad du byung ba dang khor rmad du byung 
BO_T17_MW1PD95844_2594:2673	rgyud kyi rgyal po chen po dpal gsang ba'i snying po'i 'grel pa zhes bya ba	brgyud kyi rgyal po chen po dpal gsang ba snying po grel ba zhes byed ba 
BO_T17_MW1PD95844_2594:2674	ba dang /_'phrin las rmad du byung ba'o/_/de la cho 'phrul rmad du byung ba la	ba dang las rmad du byung la cho phrul rmad du byung ba la 
BO_T17_MW1PD95844_2594:2675	don rnam pa drug las/_'di ni ting nge 'dzin gyi cho 'phrul te/_rdo rje bkod	don rnam ba drug ni ting nge dzin gyi cho phrul rje bkod 
BO_T17_MW1PD95844_2594:2676	pa zhi ba'i dkyil 'khor rnams kyis zhes bya ba'o/_/rdo rje bdag po zhes bya ba ni	ba zhi ba dkyil khor rnams kyis zhes byed rje bdag po zhes byed ba ni 
BO_T17_MW1PD95844_2594:2677	rigs kyi bdag po kun tu bzang po'o/_/khro bo'i rgyal po dkyil 'khor sprin chen	rigs kyi bdag po kun tu bzang bo rgyal po dkyil khor sprin chen 
BO_T17_MW1PD95844_2594:2678	po zhes bya ba ni/_khro ba'i dkyil 'khor thams cad kyi rtsha ba/_rigs lnga'i he	po zhes byed ba ba dkyil khor thams cad kyi rtsha lnga he 
BO_T17_MW1PD95844_2594:2679	ru ka'i yang rgyal po che mchog gi sku snang bar byed pa'i ting nge 'dzin de la de skad	ru ka yang rgyal po che mchog gi sku snang ba byed ba ting nge dzin de la de skad 
BO_T17_MW1PD95844_2594:2680	ces bya'o/_/de bzhin nyid kyi dbyings nas/_khro mo dbang phyug ma'i sku mngon	ces bzhin nyid kyi dbyings mo dbang phyug ma sku mngon 
BO_T17_MW1PD95844_2594:2681	du phyung ste zhes bya ba ni/_'di nas mar dkyil 'khor bzhi las/_che mchog	du byin ste zhes byed ba nas mar dkyil khor bzhi mchog 
BO_T17_MW1PD95844_2594:2682	longs spyod chen po'i dkyil 'khor bstan te/_a ni skye med de bzhin nyid ces	longs spyod chen po dkyil khor ston ni skye med de bzhin nyid ces 
BO_T17_MW1PD95844_2594:2683	gsungs pa'i phyir/_de bzhin nyid ni kun tu bzang mo nyid kho na ste/_de nyid	gsungs ba bzhin nyid ni kun tu bzang mo nyid kho na nyid 
BO_T17_MW1PD95844_2594:2684	khro mor snang ba'o/_/gzhan ni go sla'o/_/gnyis su med pa 'khril pa'i dgyes	khro mor snang ni go su med ba khril ba dgyes 
BO_T17_MW1PD95844_2594:2685	pas thim nas zhes bya ba ni/_la la'i gzhung gis sku nyid yongs su gyur pa'i byang	ba thim nas zhes byed ba la gzhung gis sku nyid yongs su gyur ba byang 
BO_T17_MW1PD95844_2594:2686	chub sems las khro bo spros nas phyis 'khor du snang bar yang 'chad de/_'dir	chub sems las khro bo spros nas byid khor du snang ba yang chad 
BO_T17_MW1PD95844_2594:2687	nyi zla gnyis su med pa ni thim pa zhes bya'o/_/de nyid dkyil 'khor thams cad	nyi zla gnyis su med ba ni thim ba zhes nyid dkyil khor thams cad 
BO_T17_MW1PD95844_2594:2688	kyi rgyu'i phyir/_byang chub sems kyi sprin las zhes gsungs so/_/hum hum hum zhes	kyi rgyu chub sems kyi sprin las zhes gsungs hum hum zhes 
BO_T17_MW1PD95844_2594:2689	bya ba la sogs pa ni kun brjod pa'i cho 'phrul lo/_/zhes brjod pas 'jig	byed ba la sogs ba ni kun rjod ba cho phrul rjod ba jig 
BO_T17_MW1PD95844_2594:2690	rten drug gi phyogs bcu zhes pa la sogs pa ni/_sprul pa rdzu 'phrul gyi cho 'phrul lo/_/	rten drug gi phyogs chu zhes ba la sogs ba ba rdzu phrul gyi cho phrul 
BO_T17_MW1PD95844_2594:2691	'jig rten drug gi phyogs bcu thams cad ces bya ba la sogs pa ni/_byin gyis	jig rten drug gi phyogs chu thams cad ces byed ba la sogs ba gyis 
BO_T17_MW1PD95844_2594:2692	brlabs kyi cho 'phrul lo/_/'jig rten drug gi phyogs bcu stong khams thams	brlabs kyi cho phrul rten drug gi phyogs chu stong khams thams 
BO_T17_MW1PD95844_2594:2693	cad ces bya ba la sogs pa ni/_chos kyis snang ba'i cho 'phrul lo/_/dbang che	cad ces byed ba la sogs ba kyis snang ba cho phrul che 
BO_T17_MW1PD95844_2594:2694	ba zhes bya ba ni ma ha de ba'o/_/gzi brjid che ba tshhangs pa'o/_/mthu che ba	ba zhes byed ba ni ma ha de brjid che ba tshhangs che ba 
BO_T17_MW1PD95844_2594:2695	khyab 'jug go/_/brgyal rab tu brgyal kun tu brgyal zhes bya ba la sogs pa ni/	khyab jug rab tu brgyal kun tu brgyal zhes byed ba la sogs ba 
BO_T17_MW1PD95844_2594:2696	khams 'khrugs nas lus 'gyel te/_sems myos par gyur pa'o/_/la la'i	khams khrugs nas lus gyel myos ba gyur la 
BO_T17_MW1PD95844_2594:2697	gzhung gi skabs 'dir khams gsum dur khrod kyi gzhal yas khang du brlab te	gzhung gi skabs dir khams gsum dur khrod kyi jal yas khang du brlab te 
BO_T17_MW1PD95844_2594:2698	dregs pa rnams gdan du mdzad pa ston pa'o/_/de nas bcom ldan 'das	dregs ba rnams gdan du mdzad ba ston nas joms ldan da 
BO_T17_MW1PD95844_2594:2699	dgyes pa chen po zhes bya ba la sogs pa ni/_sprul pa chen po'i dkyil 'khor ston	dgyes ba chen po zhes byed ba la sogs ba ba chen po dkyil khor ston 
BO_T17_MW1PD95844_2594:2700	to/_/dur khrod kyi bdag po dregs pa khyo shug ces bya ba ni/_ru dra pho mo'o/_/	khrod kyi bdag po dregs ba khyo shug ces byed ba dra pho 
BO_T17_MW1PD95844_2594:2701	khro bo'i dkyil 'khor sprin phung zhes bya ba ni/_dang po byang chub sems ye shes	khro bo dkyil khor sprin phung zhes byed ba po byang chub sems ye shes 
BO_T17_MW1PD95844_2594:2702	lnga'i khyad par las 'phros pa ste slar yang rigs bzhin du 'dus pa'o/_/de nas	lnga khyad ba las phro ba ste slar yang rigs bzhin du du nas 
BO_T17_MW1PD95844_2594:2703	dregs pa chen po la sogs pa gtum pa'i sems kyis zhes bya ba la sogs pa ni/	dregs ba chen po la sogs ba thum ba sems kyis zhes byed ba la sogs ba 
BO_T17_MW1PD95844_2594:2704	'phrin las rmad du byung ba la gnyis sam/_'phrin las kyi ngo bo ste/_'bru ni	phrin las rmad du byung ba la gnyis las kyi ngo bo ni 
BO_T17_MW1PD95844_2594:2705	go sla'o/_/dbu dgu phyag brgyad ces bya ba ni/_he ru ka dgu klong rngam pa'i	go dgu phyag brgyad ces byed ba ru ka dgu klong rngam ba 
BO_T17_MW1PD95844_2594:2706	zhal du gsol ba dang /_sgrol byed ging bco brgyad kyi phyag gis sgrol ba'i phyir ro//	zhal du gsol ba dang byed ging chos brgyad kyi phyag gis sgrol ba phyir 
BO_T17_MW1PD95844_2594:2707	hu~m hu~m hu~m ni sdud pa'o/_/ha ha ha ni rngam pa'i phyir ro/_/kha kha kha ni gsol ba'i	hu~m hu~m hu~m ni sdud ha ha ni rngam ba phyir kha kha ni gsol ba 
BO_T17_MW1PD95844_2594:2708	phyir ro/_/snying chung ba ni sems brtshad gcad pa'i phyir ro/_/dbang po phyung	phyir chung ba ni sems brtshad gcod ba phyir po byin 
BO_T17_MW1PD95844_2594:2709	ba ni sgo dgag pa'i phyir ro/_/nang grol drangs pa ni mngon par zhen pa dag	ba ni sgo gog ba phyir grol drangs ba ni mngon ba zhen ba dag 
BO_T17_MW1PD95844_2594:2710	par bya ba'i phyir ro/_/yan lag gcad pa ni las gcad pa'i phyir ro/_/khrag	ba byed ba phyir lag gcod ba ni las gcod ba phyir 
BO_T17_MW1PD95844_2594:2711	'thungs pa ni 'dod chags zad pa'i phyir ro/_/rus pa 'chos pa ni zhe sdang dag	thung ba ni dod chags zad ba phyir ba chos ba ni zhe sdang dag 
BO_T17_MW1PD95844_2594:2712	pa'i phyir ro/_/de nas hum hum zhes pa la sogs pa ni/_ngo bo sdud pa'i cho 'phrul	ba phyir nas hum hum zhes ba la sogs ba bo sdud ba cho phrul 
BO_T17_MW1PD95844_2594:2713	gnyis las/_sdud pa'i cho 'phrul ni/_phyogs bcu 'jig rten gyi khams nam	gnyis ba cho phrul chu jig rten gyi khams nam 
BO_T17_MW1PD95844_2594:2714	mkha' dang bcas pa yungs 'bru gcig tsham du chud par bsdus so/_/zhes bya ba	mkha dang cha ba yungs bru gcig tsham du chud ba sdud byed ba 
BO_T17_MW1PD95844_2594:2715	ni/_dregs pa rnams kyi rnam par shes pa hum du bsdus pa ste/_rgyu des chos	ba rnams kyi rnam ba shes ba hum du sdud ba des chos 
BO_T17_MW1PD95844_2594:2716	rgyud kyi rgyal po chen po dpal gsang ba'i snying po'i 'grel pa zhes bya ba	brgyud kyi rgyal po chen po dpal gsang ba snying po grel ba zhes byed ba 
BO_T17_MW1PD95844_2594:2717	thams cad sems su gcig par mthong ba'o/_/gzhan ni go sla'o/_/de nas	thams cad sems su gcig ba mthong ni go nas 
BO_T17_MW1PD95844_2594:2718	bcom ldan 'das dgyes pa chen po zhes bya ba la sogs pa ni/_yongs su rdzogs	joms ldan da dgyes ba chen po zhes byed ba la sogs ba su rdzogs 
BO_T17_MW1PD95844_2594:2719	pa'i dkyil 'khor bstan te/_'dul ba'i thabs kyis yang rigs lnga'i 'jigs	ba dkyil khor ston ba thabs kyis yang rigs lnga jigs 
BO_T17_MW1PD95844_2594:2720	byed chen por snang bar byas nas zhes bya ba ni/_che mchog gi sku nyid ma mo	byed chen por snang ba byed nas zhes byed ba mchog gi sku nyid ma mo 
BO_T17_MW1PD95844_2594:2721	rnams kyi ngo la rigs lngar snang ba ste/_gnyis kyi phyir yang zhes bya'o/_/de	rnams kyi ngo la rigs lngar snang ba kyi phyir yang zhes 
BO_T17_MW1PD95844_2594:2722	dag kun kyang dgyes pas rol pa zhes bya ba la sogs pa ni/_'khor sdud pa'i cho	dag kun kyang dgyes ba rol ba zhes byed ba la sogs ba sdud ba cho 
BO_T17_MW1PD95844_2594:2723	'phrul gyi bya ba'o/_/'bru ni go sla ba'o/_/de nas dgyes te ha zhes brjod pas/	phrul gyi byed ni go sla nas dgyes te ha zhes rjod 
BO_T17_MW1PD95844_2594:2724	zhes bya ba la sogs pa ni/_ngo mtshhar tshhogs kyi dkyil 'khor bstan to/_/	zhes byed ba la sogs ba mtshhar tshhogs kyi dkyil khor ston 
BO_T17_MW1PD95844_2594:2725	dkar mo zhes bya ba ni zhi ba'i las kyi phyir ro/_/rkun mo ni dbang gi phyir ro/_/	dkar mo zhes byed ba ni zhi ba las kyi phyir mo ni dbang gi phyir 
BO_T17_MW1PD95844_2594:2726	rmongs mo ni zhi ba'i las kyi phyir ro/_/thal byed ni drag po'i las kyi phyir ro/_/	rmongs mo ni zhi ba las kyi phyir byed ni drag po las kyi phyir 
BO_T17_MW1PD95844_2594:2727	sbos mo ni yon tan gyis rgyas pa'i phyir ro/_/gtum mo ni drag po'i phyir ro/_/	sbo mo ni yon tan gyis rgya ba phyir mo ni drag po phyir 
BO_T17_MW1PD95844_2594:2728	dme sha can ni gang yang grub pa'i phyir ro/_/ma tshhogs ma ni 'phel bar byed	dme sha can ni gang yang grub ba phyir tshhogs ma ni phel ba byed 
BO_T17_MW1PD95844_2594:2729	pa'i phyir ro/_/ngo mtshhar dang zhes bya ba ni rngam zhing dam pa'i phyir ro/_/seng	ba phyir mtshhar dang zhes byed ba ni rngam zhing dam ba phyir 
BO_T17_MW1PD95844_2594:2730	gdong ni thams cad zil gyis gnon pa'i phyir ro/_/stag gdong ni dpa'	gdong ni thams cad zil gyis gnon ba phyir gdong ni dpa 
BO_T17_MW1PD95844_2594:2731	brtul gyis las drag pa'i phyir ro/_/wa ni thabs mkhas pas phung po'i bdud	brtul gyis las drag ba phyir ni thabs mkhas ba phung po bdud 
BO_T17_MW1PD95844_2594:2732	dag pa'i phyir ro/_/khyi gdong ni lha'i bu'i bdud 'joms pa'i phyir ro/_/	dag ba phyir gdong ni lha bu bdud joms ba phyir 
BO_T17_MW1PD95844_2594:2733	gzhad gdong ni shes bya ba la thogs pa med pa'i phyir ro/_/dur bya ni 'khor ba	gzhad gdong ni shes byed ba la thogs ba med ba phyir byed ni khor ba 
BO_T17_MW1PD95844_2594:2734	dang du len pa'i phyir ro/_/lug gdong ni gdul bya phra ba yang mi 'dor ba'i	dang du len ba phyir gdong ni gdul byed phra ba yang mi dor ba 
BO_T17_MW1PD95844_2594:2735	phyir ro/_/rdo rje bsrings 'gro ma ni rta gdong ma ste 'khor ba mi gtong ba'o/_/	phyir rje bsrings gro ma ni rta gdong ma ste khor ba mi gtong 
BO_T17_MW1PD95844_2594:2736	gdong mo ni phag gi gdong pa ste 'phrin las gdong tshhugs su byed pa'i phyir ro/_/	gdong mo ni phag gi gdong ba ste phrin las gdong tshhugs su byed ba phyir 
BO_T17_MW1PD95844_2594:2737	'jig rten ma ni dred gdong ma ste thams cad bsreg par byed pa'i phyir ro/_/ro	jig rten ma ni dred gdong ma ste thams cad bsreg ba byed ba phyir 
BO_T17_MW1PD95844_2594:2738	langs ma ni spyang gdong ma ste khams gsum slar 'tshho ma zhes bya'o/_/de nas	ldang ma ni spyang gdong ma ste khams gsum slar tshho ma zhes nas 
BO_T17_MW1PD95844_2594:2739	bcom ldan 'das dgyes pa chen po zhes bya la sogs pa ni/_'phrin las kyi	joms ldan da dgyes ba chen po zhes byed la sogs ba las kyi 
BO_T17_MW1PD95844_2594:2740	'bras bu la gnyis las dregs pa rnams gnas stobs pa'o/_/bdud rtshi 'byung	bras bu la gnyis las dregs ba rnams gnas stobs rtshi byung 
BO_T17_MW1PD95844_2594:2741	ba zhes bya ba ni dri chen no/_/om badzra ma ha a mri ta zhes bya ba ni/_rdo rje bdud	ba zhes byed ba ni dri chen badzra ma ha a mri ta zhes byed ba rje bdud 
BO_T17_MW1PD95844_2594:2742	rtshi chen po ste/_gcig kyang lnga lnga dang ldan pa'o/_/ma ha gro ta zhes bya ba ni/	rtshi chen po kyang lnga lnga dang ldan ha gro ta zhes byed ba 
BO_T17_MW1PD95844_2594:2743	khro bo chen po ste 'og nas 'byung ba'i sme brtshegs so/_/e e am zhes bya ba ni/	khro bo chen po ste g nas byung ba sme brtshegs e am zhes byed ba 
BO_T17_MW1PD95844_2594:2744	lan gsum byin nas dbang bskur ba kho na'o/_/sku 'bar ba chen po'i dkyil	lan gsum byin nas dbang skur ba kho bar ba chen po dkyil 
BO_T17_MW1PD95844_2594:2745	'khor na bzhugs par mthong ngo /_/zhes bya ba ni/_bsam yas lhun gyis grub	khor na bzhugs ba mthong ngo byed ba yas lhun gyis grub 
BO_T17_MW1PD95844_2594:2746	pa'i ting nge 'dzin ltar mthong ba'o/_/so sor snang ba dus gcig tu btul bar	ba ting nge dzin ltar mthong sor snang ba dus gcig tu dul ba 
BO_T17_MW1PD95844_2594:2747	gyur to/_/zhes bya ba ni/_sprul pa rdul phran grangs med kyi/_/skad cig yud	gyur byed ba ba rdul phran grangs med cig yud 
BO_T17_MW1PD95844_2594:2748	la lhun gyis grub ces bya ba ste/_tha dad par snang bas don grub pa'o/_/de	la lhun gyis grub ces byed ba dad ba snang ba don grub 
BO_T17_MW1PD95844_2594:2749	nas de dag gi chung ma'i tshhogs rnams dang zhes bya ba la sogs pa ni 'phrin las	nas de dag gi chung ma tshhogs rnams dang zhes byed ba la sogs ba ni phrin las 
BO_T17_MW1PD95844_2594:2750	rmad du byung ba'i 'bras bu la gnyis las 'khor dam la btags te bstan pa yun	rmad du byung ba bras bu la gnyis las khor dam la dogs te ston ba yun 
BO_T17_MW1PD95844_2594:2751	du gnas par bya ba'o/_/le'u bco lnga pa dka' ba bshad pa'o//_//	du gnas ba byed chos lnga ba dka ba chad 
BO_T17_MW1PD95844_2594:2752	de nas lhag pa'i ting nge 'dzin gsung gi dkyil 'khor bstan pa'i phyir/	de nas lhag ba ting nge dzin gsung gi dkyil khor ston ba 
BO_T17_MW1PD95844_2594:2753	de nas zhes bya ba gsungs te/_dam tshhig gis grub par bya ba'i phyir/_zhes bya	de nas zhes byed ba gsungs tshhig gis grub ba byed ba byed 
BO_T17_MW1PD95844_2594:2754	ba ni/_gsung gi dam tshhig ni gsang sngags rnams so/_/ye shes rngam pa zhes	ba gi dam tshhig ni gsang sngags rnams shes rngam ba zhes 
BO_T17_MW1PD95844_2594:2755	bya ba ni shin tu rngam pa'i nga ro dang /_chas pas grags pa'o/_/om sarba ta tha	byed ba ni shin tu rngam ba nga ro dang ba grags sarba ta tha 
BO_T17_MW1PD95844_2594:2756	ga ta  ma ha shri he ru ka zhes bya ba ni nyid kyi snying po'o/_/ma ha tshan da ni gtum	ga ta ma ha shri he ru ka zhes byed ba ni nyid kyi snying ha tshan da ni thum 
BO_T17_MW1PD95844_2594:2757	po chen po'o/_/sarba du sta na sdang ba thams cad do/_/ta ka ha na ni gtogs	po chen du sta na sdang ba thams cad ka ha na ni gtogs 
BO_T17_MW1PD95844_2594:2758	rgyud kyi rgyal po chen chen po dpal gsang ba'i snying po'i 'grel pa zhes bya ba	brgyud kyi rgyal po chen chen po dpal gsang ba snying po grel ba zhes byed ba 
BO_T17_MW1PD95844_2594:2759	shig rgyob cig pa'o/_/da ha pa tsha ni tshhos shig choms shig pa'o/_/hu~m hu~m hum phat	shig rgyag cig ha ba tsha ni tshhos shig choms shig hu~m hum phat 
BO_T17_MW1PD95844_2594:2760	ces bya ba ni/_sdus la song cig pa ste/_de dag gi phyir rtsha ba las dang bcas	ces byed ba la gro cig ba dag gi phyir rtsha ba las dang cha 
BO_T17_MW1PD95844_2594:2761	pa'i sngags kho na'o/_/gzhan ni go sla'o/_/blo rnams ni ma mo rnams kyi rtsha ba'i	ba sngags kho ni go rnams ni ma mo rnams kyi rtsha ba 
BO_T17_MW1PD95844_2594:2762	snying po ste/_bskyed pa dang bzlas pa ni mi nyid kyis grub pa'i phyir/_bshad pa	snying po ba dang bzlas ba ni mi nyid kyis grub ba ba 
BO_T17_MW1PD95844_2594:2763	nyid dbral skad du gsal ba'o/_/ru lu ru lu hum b+h+yoh zhes bya ba ni/_snyan gsan	nyid dbrol skad du gsal lu ru lu hum b+h+yoh zhes byed ba gsan 
BO_T17_MW1PD95844_2594:2764	gsol ba'i sngags so/_/e ha hi a na ya zhes bya ba ni bskul ba'o/_/dzahhum bam	gsol ba sngags ha hi a na ya zhes byed ba ni skul bam 
BO_T17_MW1PD95844_2594:2765	hohzhes bya ba ni rim par spyan drangs nas nam mkha' la bzhugs pa'o/_/ram	hohzhes byed ba ni rim ba spyan drangs nas nam mkha la bzhugs 
BO_T17_MW1PD95844_2594:2766	zhes bya ba ni/_dngos su me dpung gnyis 'dre ba ste/_shes rab kyis 'byor	zhes byed ba su me dpung gnyis dre ba rab kyis byor 
BO_T17_MW1PD95844_2594:2767	ba'i phyir ro/_/om badzra kro ta sa ma ya hum zhes bya ba ni/_rig pa'i me tog dor	ba phyir badzra kro ta sa ma ya hum zhes byed ba ba me tog dor 
BO_T17_MW1PD95844_2594:2768	ba ste/_ye shes su gcig par gsal ba'o/_/om khro la khros pas zhi mdzad pa	ba shes su gcig ba gsal khro la khro ba zhi mdzad ba 
BO_T17_MW1PD95844_2594:2769	zhes bya ba la sogs pa ni/_bskul ba ste bskul ba'i sa la bzhes pa'i phyir ro/_/	zhes byed ba la sogs ba ba ste skul ba sa la bzhes ba phyir 
BO_T17_MW1PD95844_2594:2770	om badzra kro ta sa ma ya stom/_o badzra kro ta sa ma ye ho/_om badzra kro ta sa ma ya	om badzra kro ta sa ma ya badzra kro ta sa ma ye badzra kro ta sa ma ya 
BO_T17_MW1PD95844_2594:2771	phat ces bya ba ni/_dam tshhig bskul bas dgyes nas drag po'i yig 'bru mang	phat ces byed ba tshhig skul ba dgyes nas drag po yig bru mang 
BO_T17_MW1PD95844_2594:2772	pos snod dag par mdzad pa'o/_/de nas phyi'i mchod pa dbul ba'i phyir/_a	pos snod dag ba mdzad nas phyi mchod ba bul ba 
BO_T17_MW1PD95844_2594:2773	li u li ta la ta pra ti zhes bya ba ni/_bza' ba dang btung ba dang /_'bras	li u li ta la ta pra ti zhes byed ba ba dang thung ba dang 
BO_T17_MW1PD95844_2594:2774	bu rnams dang /_bca' ba sna tshhogs spros la dbul lo/_/de dag gang la snyam	bu rnams dang ba sna tshhogs spros la bul dag gang la snyam 
BO_T17_MW1PD95844_2594:2775	pa la/_dang sta zhes bya ba ni/_mche ba can te he he ru ka rnams so/_/'gu'	ba sta zhes byed ba ba can te he he ru ka rnams 
