segmentnr	original	stemmed
BO_T11_D4266:121a-43	bdag tu lta ba la 'jug phyir //	bdag tu lta ba la jug phyir 
BO_T11_D4266:121a-44	'gyur smra skad cig nyid min sogs //	gyur smra skad cig nyid min sogs 
BO_T11_D4266:121a-45	mngon sum sogs kyis gnod pa can //	mngon sum sogs kyis gnod ba can 
BO_T11_D4266:121a-46	rig bral mang du de dag gis //	rig bral mang du de dag gis 
BO_T11_D4266:121a-47	smras yin de dag kun mkhyen nyid //	smras yin de dag kun mkhyen nyid 
BO_T11_D4266:121a-48	khu ba tshva sogs mngon sum gyis //	khu ba tshva sogs mngon sum gyis 
BO_T11_D4266:121a-49	don sgrub pa la'ang 'khrul pa gang //	don sgrub ba la khrul ba gang 
BO_T11_D4266:121a-50	de dag la ni dbang 'das pa'i //	de dag la ni dbang da ba 
BO_T11_D4266:121a-51	rigs pa gsal ba ji ltar srid //	rigs ba gsal ba ji ltar srid 
BO_T11_D4266:121b-0	de ltar yin na kun mkhyen @121b nyid //	de ltar yin na kun mkhyen nyid 
BO_T11_D4266:121b-1	ma yin nyid du gsal bar rtogs //	ma yin nyid du gsal ba rtogs 
BO_T11_D4266:121b-2	log pa'i shes pa dang 'brel phyir //	log ba shes ba dang brel phyir 
BO_T11_D4266:121b-3	phyin ci log don gsal byed phyir //	phyin ci log don gsal byed phyir 
BO_T11_D4266:121b-4	rtogs pa po gzhan mtho yor la //	rtogs ba po gzhan mtho yor la 
BO_T11_D4266:121b-5	mi zhes bya bar 'khrul pa bzhin //	mi zhes byed ba khrul ba bzhin 
BO_T11_D4266:121b-6	rtag pa thams cad rnams kyis ni //	rtag ba thams cad rnams kyis ni 
BO_T11_D4266:121b-7	gtan tshigs grub pa nyid shes bya //	gtan tshigs grub ba nyid shes byed 
BO_T11_D4266:121b-8	dngos kun rnams kyi de nyid ni //	dngos kun rnams kyi de nyid ni 
BO_T11_D4266:121b-9	yang dag mkhyen pas kun mkhyen yin //	yang dag mkhyen ba kun mkhyen yin 
BO_T11_D4266:121b-10	des na ldog na the tshom can //	des na ldog na the tshom can 
BO_T11_D4266:121b-11	gtan tshigs nyid du brjod mi bya //	gtan tshigs nyid du rjod mi byed 
BO_T11_D4266:121b-12	gal te de dag 'gyur smra sogs //	gal te de dag gyur smra sogs 
BO_T11_D4266:121b-13	tshig ni dgos pa'i don yin na //	tshig ni dgos ba don yin na 
BO_T11_D4266:121b-14	dngos po rnams kyi de nyid kyi //	dngos po rnams kyi de nyid kyi 
BO_T11_D4266:121b-15	ngo bo de dag ji ltar 'dod //	ngo bo de dag ji ltar dod 
BO_T11_D4266:121b-16	gal te bdag med skad cig sogs //	gal te bdag med skad cig sogs 
BO_T11_D4266:121b-17	de lta na de kun mkhyen 'gyur //	de lta na de kun mkhyen gyur 
BO_T11_D4266:121b-18	dngos po ma lus pa de nyid //	dngos po ma lus ba de nyid 
BO_T11_D4266:121b-19	ngo bo dngos su mthong ba'i phyir //	ngo bo dngos su mthong ba phyir 
BO_T11_D4266:121b-20	de dag ma lus pa rnams ni //	de dag ma lus ba rnams ni 
BO_T11_D4266:121b-21	'dod pa gcig la gnas pa'i phyir //	dod ba gcig la gnas ba phyir 
BO_T11_D4266:121b-22	phan tshun gal ba'i don rnams ni //	phan tshun gal ba don rnams ni 
BO_T11_D4266:121b-23	nges pa'i don du smra ba min //	nges ba don du smra ba min 
BO_T11_D4266:121b-24	bstan par bya ba'i ngo bo can //	ston ba byed ba ngo bo can 
BO_T11_D4266:121b-25	dngos po kun la gnas ba ni //	dngos po kun la gnas ba ni 
BO_T11_D4266:121b-26	de nyid dngos su ma khyed pas na //	de nyid dngos su ma khyed ba na 
BO_T11_D4266:121b-27	bde bar gshegs rnams kun mkhyen yin //	bde ba gshegs rnams kun mkhyen yin 
BO_T11_D4266:121b-28	de dag de lta'i rnams can gyis //	de dag de lta rnams can gyis 
BO_T11_D4266:121b-29	ye shes bde gshegs nyid 'gyur yod //	ye shes bde gshegs nyid gyur yod 
BO_T11_D4266:121b-30	sngags dngos ye shes ldan pa'i phyir //	sngags dngos ye shes ldan ba phyir 
BO_T11_D4266:121b-31	de yi mtshan nyid de tsam yin //	de yi mtshan nyid de tsam yin 
BO_T11_D4266:121b-32	des na spyis kyang kun mkhyen ni //	des na spyis kyang kun mkhyen ni 
BO_T11_D4266:121b-33	srid par sgrub par byas pa na //	srid ba sgrub ba byed ba na 
BO_T11_D4266:121b-34	de mtshan nyid med mi 'byung phyir //	de mtshan nyid med mi byung phyir 
BO_T11_D4266:121b-35	bde bar gshegs pa nyid la gnas //	bde ba gshegs ba nyid la gnas 
BO_T11_D4266:121b-36	gang zhig 'gro kun ji bzhin du //	gang jig gro kun ji bzhin du 
BO_T11_D4266:121b-37	bdag med sogs dngos rigs pa yis //	bdag med sogs dngos rigs ba yis 
BO_T11_D4266:121b-38	khyad par ma bstan pa na yang //	khyad ba ma ston ba na yang 
BO_T11_D4266:121b-39	su zhig kun mkhyen srid pa yin //	su jig kun mkhyen srid ba yin 
BO_T11_D4266:121b-40	bdag med mngon sum du byas na //	bdag med mngon sum du byed na 
BO_T11_D4266:121b-41	skyon 'di gnas pa rnyed mi 'gyur //	skyon di gnas ba rnyed mi gyur 
BO_T11_D4266:121b-42	de dang 'gal ba nyid kyi phyir //	de dang gal ba nyid kyi phyir 
BO_T11_D4266:121b-43	mar mes mun pa lta bu'o //	mar mes mun ba lta bu 
BO_T11_D4266:121b-44	dngos su byas pa'i khyad bcas phyir //	dngos su byed ba khyad cha phyir 
BO_T11_D4266:121b-45	bag chags dang bcas skyon med 'gyur //	bag chags dang cha skyon med gyur 
BO_T11_D4266:121b-46	des na thams cad mkhyen nyid grub //	des na thams cad mkhyen nyid grub 
BO_T11_D4266:121b-47	sgrib pa thams cad las grol phyir //	sgrib ba thams cad las grol phyir 
BO_T11_D4266:121b-48	de yang bad bar gshegs la grub //	de yang bad ba gshegs la grub 
BO_T11_D4266:121b-49	thog mar bdag med nyid gsungs phyir //	thogs mar bdag med nyid gsungs phyir 
BO_T11_D4266:121b-50	de phyir mu stegs thams cad kyi //	de phyir mu stegs thams cad kyi 
BO_T11_D4266:121b-51	de bzhin gshegs pa lta na bzhugs //	de bzhin gshegs ba lta na bzhugs 
BO_T11_D4266:121b-52	tshad ma yis ni mi slu ba'i //	tshad ma yis ni mi slu ba 
BO_T11_D4266:121b-53	de nyid mthong ldan de dang ni //	de nyid mthong ldan de dang ni 
BO_T11_D4266:121b-54	'gal ba'i don ni ston byed pa //	gal ba don ni ston byed ba 
BO_T11_D4266:121b-55	gzhan dag dang ni rgyu mtshungs min //	gzhan dag dang ni rgyu mtshungs min 
BO_T11_D4266:122a-0	gang dag @122a * //	gang dag 
BO_T11_D4266:122a-1	tshad ma'i spyod yul la'ang //	tshad ma spyod yul la 
BO_T11_D4266:122a-2	tshad ma'i gnod dkrugs tshig brjod na //	tshad ma gnod dkrug tshig rjod na 
BO_T11_D4266:122a-3	de dag dbang po las 'das pa'i //	de dag dbang po las da ba 
BO_T11_D4266:122a-4	shes pa'i nus ldan ring bar 'gyur //	shes ba nus ldan ring ba gyur 
BO_T11_D4266:122a-5	'brel ba dang ni rjes mthun thabs //	brel ba dang ni rjes mthun thabs 
BO_T11_D4266:122a-6	skyes bu'i don ni rjod byed ngag / mthong ldan tshad ma gnyis kyis ni //	skye bu don ni rjod byed ngag mthong ldan tshad ma gnyis kyis ni 
BO_T11_D4266:122a-7	cung zad kyang ni gnod pa med //	cung zad kyang ni gnod ba med 
BO_T11_D4266:122a-8	sreg dang bcad dang bdar ba yis //	sreg dang gcod dang bdar ba yis 
BO_T11_D4266:122a-9	dri ma med pa'i gser bzhin du //	dri ma med ba gser bzhin du 
BO_T11_D4266:122a-10	rtogs par byed na gang zhig ni //	rtogs ba byed na gang jig ni 
BO_T11_D4266:122a-11	'gyur bar 'jug pa ma yin no //	gyur ba jug ba ma yin no 
BO_T11_D4266:122a-12	sno dang nam lus mun pa ni //	sno dang nam lus mun ba ni 
BO_T11_D4266:122a-13	spangs pas rjes mthun 'byung ba can //	spong ba rjes mthun byung ba can 
BO_T11_D4266:122a-14	sdig can rnams kyis ma rnyed pa //	sdig can rnams kyis ma rnyed ba 
BO_T11_D4266:122a-15	de bzhin gshegs gsungs rin chen yin //	de bzhin gshegs gsungs rin chen yin 
BO_T11_D4266:122a-16	des na bde bar gshegs pa nyid //	des na bde ba gshegs ba nyid 
BO_T11_D4266:122a-17	blo gros rgyas pas kun mkhyen bshad //	blo gros rgya ba kun mkhyen chad 
BO_T11_D4266:122a-18	skyes bu don gtso mkhyen pas na //	skye bu don gtso mkhyen ba na 
BO_T11_D4266:122a-19	de nyid sman pa mchog tu gsungs //	de nyid sman ba mchog tu gsungs 
BO_T11_D4266:122a-20	des na bde gshegs kun mkhyen yin //	des na bde gshegs kun mkhyen yin 
BO_T11_D4266:122a-21	ser skya min zhes tshad ma ni //	ser skya min zhes tshad ma ni 
BO_T11_D4266:122a-22	'das ma thag tu gsal bar bshad //	da ma thag tu gsal ba chad 
BO_T11_D4266:122a-23	de ni rmongs pas mtshan byas min //	de ni rmongs ba mtshan byed min 
BO_T11_D4266:122a-24	mu stegs ngan khyu mchog sogs pas //	mu stegs ngan khyu mchog sogs ba 
BO_T11_D4266:122a-25	'dod lha 'jig par mdzad pa ni //	dod lha jig ba mdzad ba ni 
BO_T11_D4266:122a-26	ji skad bshad pa'i khyad par gyis //	ji skad chad ba khyad ba gyis 
BO_T11_D4266:122a-27	khyad par bcas kyang nges par 'gyur //	khyad ba cha kyang nges ba gyur 
BO_T11_D4266:122a-28	yi ge phyi mo rig tsam gyis //	yi ge phyi mo rig tsam gyis 
BO_T11_D4266:122a-29	zos pa la sogs bde ba dang // bstan bcos kun don de nyid mkhyen //	zos ba la sogs bde ba dang ston chos kun don de nyid mkhyen 
BO_T11_D4266:122a-30	mtshungs snyam rmongs pa su zhig sems //	mtshungs snyam rmongs ba su jig sems 
BO_T11_D4266:122a-31	des na gtan tshigs gyis kyang ni //	des na gtan tshigs gyis kyang ni 
BO_T11_D4266:122a-32	gcig la kun mkhyen nyid grub na //	gcig la kun mkhyen nyid grub na 
BO_T11_D4266:122a-33	de yi gtan tshigs dngos med phyir //	de yi gtan tshigs dngos med phyir 
BO_T11_D4266:122a-34	de ni gzhan la yod ma yin //	de ni gzhan la yod ma yin 
BO_T11_D4266:122a-35	des na rgyal ba kun mkhyen du //	des na rgyal ba kun mkhyen du 
BO_T11_D4266:122a-36	bsgrub la sh'akya'i slob ma ni //	sgrub la shakya slob ma ni 
BO_T11_D4266:122a-37	khros min sun dbyung gang bstan de //	khro min sun byin gang ston de 
BO_T11_D4266:122a-38	phyogs gos sbyor nus can gyis min //	phyogs gos sbyor nus can gyis min 
BO_T11_D4266:122a-39	bde bar gshegs pa'i grub mtha' la //	bde ba gshegs ba grub mtha la 
BO_T11_D4266:122a-40	gal te 'brel grub tshad ma yis //	gal te brel grub tshad ma yis 
BO_T11_D4266:122a-41	de nyid gang zhig bstan byas pa //	de nyid gang jig ston byed ba 
BO_T11_D4266:122a-42	de bzhin gzhan 'dod la grub min //	de bzhin gzhan dod la grub min 
BO_T11_D4266:122a-43	des na de rnams kyis grub dang // sun dbyung tha dad gnas pa can //	des na de rnams kyis grub dang sun byin tha dad gnas ba can 
BO_T11_D4266:122a-44	gzugs brnyan 'byung bas ma bzung bas //	gzugs rnyan byung ba ma bzung ba 
BO_T11_D4266:122a-45	nges par byed par nus pa yin //	nges ba byed ba nus ba yin 
BO_T11_D4266:122a-46	rnam pa thams cad mkhyen nyid dang // lhan cig shes bya nyid sogs dag / dngos su'am brgyud pas 'gal ba ni //	rnam ba thams cad mkhyen nyid dang lhan cig shes byed nyid sogs dag dngos su brgyud ba gal ba ni 
BO_T11_D4266:122a-47	cung zad tsam yang yod ma yin //	cung zad tsam yang yod ma yin 
BO_T11_D4266:122b-0	shes @122b bya min nyid sogs ldan par //	shes byed min nyid sogs ldan ba 
BO_T11_D4266:122b-1	shes bya nyid sogs gnas pa yin //	shes byed nyid sogs gnas ba yin 
BO_T11_D4266:122b-2	kun mkhyen ma yin las ldog pa //	kun mkhyen ma yin las ldog ba 
BO_T11_D4266:122b-3	de yang gnas par 'dod pa yin //	de yang gnas ba dod ba yin 
BO_T11_D4266:122b-4	kun mkhyen nyid de rgyu chang bar //	kun mkhyen nyid de rgyu chang ba 
BO_T11_D4266:122b-5	sngar 'jug 'gyur ba la lar ni //	sngar jug gyur ba la lar ni 
BO_T11_D4266:122b-6	ma mthong ba ni gang gis ni //	ma mthong ba ni gang gis ni 
BO_T11_D4266:122b-7	yong sogs srid na phyis ldog 'gyur //	yong sogs srid na byid ldog gyur 
BO_T11_D4266:122b-8	rang bzhin rang rig med pas na //	rang bzhin rang rig med ba na 
BO_T11_D4266:122b-9	de ni skye bar mi 'gyur te //	de ni skye ba mi gyur te 
BO_T11_D4266:122b-10	sngar 'jug yod na 'di ltar ni //	sngar jug yod na di ltar ni 
BO_T11_D4266:122b-11	kun mkhyen 'di nyid grub par 'gyur //	kun mkhyen di nyid grub ba gyur 
BO_T11_D4266:122b-12	'gal ba bsgrub par ma byas par //	gal ba sgrub ba ma byed ba 
BO_T11_D4266:122b-13	gzhan ni ldog par rigs ma yin //	gzhan ni ldog ba rigs ma yin 
BO_T11_D4266:122b-14	de lta min na gzugs yod pas //	de lta min na gzugs yod ba 
BO_T11_D4266:122b-15	ro yang med par rtogs par 'gyur //	ro yang med ba rtogs ba gyur 
BO_T11_D4266:122b-16	des 'dir sogs pa'i sgras bsdus pa //	des dir sogs ba sgras sdud ba 
BO_T11_D4266:122b-17	phan tshun 'gal ba nyid kyi phyir //	phan tshun gal ba nyid kyi phyir 
BO_T11_D4266:122b-18	smras pa nyid la'ang ldog pa ni //	smras ba nyid la ldog ba ni 
BO_T11_D4266:122b-19	nges pa yin snyam 'ga' sems na //	nges ba yin snyam ga sems na 
BO_T11_D4266:122b-20	rnam rtog yod pas smra ba yod //	rnam rtogs yod ba smra ba yod 
BO_T11_D4266:122b-21	rtog med las ni kun mkhyen yin //	rtogs med las ni kun mkhyen yin 
BO_T11_D4266:122b-22	brjod rtog bcas kyi shes dang bcas //	rjod rtogs cha kyi shes dang cha 
BO_T11_D4266:122b-23	dngos po rtogs par mi 'gyur ro //	dngos po rtogs ba mi gyur ro 
BO_T11_D4266:122b-24	'dir yang yang dag kun mkhyen la'ang //	dir yang yang dag kun mkhyen la 
BO_T11_D4266:122b-25	smra ba nyid ni rtog pa yi //	smra ba nyid ni rtogs ba yi 
BO_T11_D4266:122b-26	rjes su byed pa yin snyam sems //	rjes su byed ba yin snyam sems 
BO_T11_D4266:122b-27	de dag gis ni smras yod na //	de dag gis ni smras yod na 
BO_T11_D4266:122b-28	skyob pa kun mkhyen 'dod min te //	skyob ba kun mkhyen dod min te 
BO_T11_D4266:122b-29	rtog bcas shes pa 'jug phyir ro //	rtogs cha shes ba jug phyir ro 
BO_T11_D4266:122b-30	rtog med skad cig de la ni //	rtogs med skad cig de la ni 
BO_T11_D4266:122b-31	smra ba nyid ni ma grub bo //	smra ba nyid ni ma grub bo 
BO_T11_D4266:122b-32	de lta yin na'ang de la ni //	de lta yin na de la ni 
BO_T11_D4266:122b-33	kun mkhyen min nyid 'thad smras min //	kun mkhyen min nyid thad smras min 
BO_T11_D4266:122b-34	thams cad mkhyen pa la ltos phyir //	thams cad mkhyen ba la ltos phyir 
BO_T11_D4266:122b-35	de ni mi slu ba ru 'gyur //	de ni mi slu ba ru gyur 
BO_T11_D4266:122b-36	gang zhig dro ba nyams myong nas //	gang jig dro ba nyams myong nas 
BO_T11_D4266:122b-37	phyis ni smra bar byed pa bzhin //	byid ni smra ba byed ba bzhin 
BO_T11_D4266:122b-38	de phyir de don nyams myong las //	de phyir de don nyams myong las 
BO_T11_D4266:122b-39	byung phyir dngos la mi slu yin //	byung phyir dngos la mi slu yin 
BO_T11_D4266:122b-40	dngos po ma lus rnam shes pa'i //	dngos po ma lus rnam shes ba 
BO_T11_D4266:122b-41	nus pa spong bar byed na yang //	nus ba spong ba byed na yang 
BO_T11_D4266:122b-42	khyed la ldog ba the tshom nyid //	khyed la ldog ba the tshom nyid 
BO_T11_D4266:122b-43	gnas skabs de bzhin thal bar 'gyur //	gnas skabs de bzhin thal ba gyur 
BO_T11_D4266:122b-44	smra bar 'jug pa'i nus pa ni //	smra ba jug ba nus ba ni 
BO_T11_D4266:122b-45	gtan tshigs nyid du 'dod na yang //	gtan tshigs nyid du dod na yang 
BO_T11_D4266:122b-46	ldog la the tshom za ba yi //	ldog la the tshom za ba yi 
BO_T11_D4266:122b-47	skyon nyid rjes su 'jug par 'gyur //	skyon nyid rjes su jug ba gyur 
BO_T11_D4266:122b-48	'khor lo bskor ba'i sbyor ba bzhin //	khor lo skor ba sbyor ba bzhin 
BO_T11_D4266:122b-49	rtog pa med kyang skyob pa ni //	rtogs ba med kyang skyob ba ni 
BO_T11_D4266:122b-50	tshogs kyi shugs kyis nus pa yis //	tshogs kyi shugs kyis nus ba yis 
BO_T11_D4266:122b-51	bstan pa gzhan dag 'jug par 'gyur //	ston ba gzhan dag jug ba gyur 
BO_T11_D4266:122b-52	da ltar blo bzang gang dag smras //	da ltar blo bzang gang dag smras 
BO_T11_D4266:122b-53	de dag la yang grub 'gyur min //	de dag la yang grub gyur min 
BO_T11_D4266:122b-54	'jig rten ba ni zhen pa can //	jig rten ba ni zhen ba can 
BO_T11_D4266:122b-55	smra nyid gang zhig 'dod pa yin //	smra nyid gang jig dod ba yin 
BO_T11_D4266:123a-0	@123a * // de la de 'dra'i gtan tshigs te //	de la de dra gtan tshigs te 
BO_T11_D4266:123a-1	ldog la the tshom za ba yin //	ldog la the tshom za ba yin 
BO_T11_D4266:123a-2	rigs ba dang bral gzhung gis ni //	rigs ba dang bral gzhung gis ni 
BO_T11_D4266:123a-3	ji ltar 'dir ni ma grub 'gyur //	ji ltar dir ni ma grub gyur 
BO_T11_D4266:123a-4	smras pa gal te smra nyid ni //	smras ba gal te smra nyid ni 
BO_T11_D4266:123a-5	rang rgyud kyis sgrub 'dod pa na //	rang brgyud kyis sgrub dod ba na 
BO_T11_D4266:123a-6	de tshe rten ni grub pa min //	de tshe rten ni grub ba min 
BO_T11_D4266:123a-7	yang na the tshom za ma grub //	yang na the tshom za ma grub 
BO_T11_D4266:123a-8	don 'dir the tshom za ba'i phyir //	don dir the tshom za ba phyir 
BO_T11_D4266:123a-9	the tshom ma grub pa nyid gnas //	the tshom ma grub ba nyid gnas 
BO_T11_D4266:123a-10	de phyir thal bar bsgrub pa ni //	de phyir thal ba sgrub ba ni 
BO_T11_D4266:123a-11	khyod kyis de 'dra ba brjod dgos //	khyod kyis de dra ba rjod dgos 
BO_T11_D4266:123a-12	de la yang ni lung tsam gyis //	de la yang ni lung tsam gyis 
BO_T11_D4266:123a-13	grub pa'i chos ni gsal byed yin //	grub ba chos ni gsal byed yin 
BO_T11_D4266:123a-14	yod par sgrub pa'i don du ni //	yod ba sgrub ba don du ni 
BO_T11_D4266:123a-15	shes byed gzhan ni tshol ba min //	shes byed gzhan ni tshol ba min 
BO_T11_D4266:123a-16	gang la de ltar gzhal bya dang // dngos po yod sogs mtshan nyid can //	gang la de ltar jal byed dang dngos po yod sogs mtshan nyid can 
BO_T11_D4266:123a-17	gtan tshigs 'joms pa'i nus med pas //	gtan tshigs joms ba nus med ba 
BO_T11_D4266:123a-18	de ni su zhig sgrub mi byed //	de ni su jig sgrub mi byed 
BO_T11_D4266:123a-19	de bzhin rig byed smra ba'i khar //	de bzhin rig byed smra ba khar 
BO_T11_D4266:123a-20	rig byed 'jig rten rigs pa 'ga' //	rig byed jig rten rigs ba ga 
BO_T11_D4266:123a-21	gnas pas sh'akya'i slob ma yi //	gnas ba shakya slob ma yi 
BO_T11_D4266:123a-22	mi zad sbrul dug shes mi sel //	mi zad sbrul dug shes mi sel 
BO_T11_D4266:123a-23	nus chung bram ze rmongs pa 'dir //	nus chung bram ze rmongs ba dir 
BO_T11_D4266:123a-24	mthong ba'i dug gis zin pas na //	mthong ba dug gis zin ba na 
BO_T11_D4266:123a-25	dbugs 'byin par yang mi nus na //	dbugs byin ba yang mi nus na 
BO_T11_D4266:123a-26	smra bar byed par ji ltar nus //	smra ba byed ba ji ltar nus 
BO_T11_D4266:123a-27	rig byed smra ba'i khar gnas pa'i //	rig byed smra ba khar gnas ba 
BO_T11_D4266:123a-28	rigs pa bzang yang ngan pa nyid //	rigs ba bzang yang ngan ba nyid 
BO_T11_D4266:123a-29	smad pa'i rten la gnas pa'i phyir //	smad ba rten la gnas ba phyir 
BO_T11_D4266:123a-30	mgul rgyan rkang pa la btags bzhin //	mgul rgyan rkang ba la dogs bzhin 
BO_T11_D4266:123a-31	de yis me la ma 'khrul nyid //	de yis me la ma khrul nyid 
BO_T11_D4266:123a-32	du ba la yang brjod pa ru //	du ba la yang rjod ba ru 
BO_T11_D4266:123a-33	nus pa min te gang gi phyir //	nus ba min te gang gi phyir 
BO_T11_D4266:123a-34	de gzhung du ba gzhan du gnas //	de gzhung du ba gzhan du gnas 
BO_T11_D4266:123a-35	dngos gcig ngo bo nyid kyi phyir //	dngos gcig ngo bo nyid kyi phyir 
BO_T11_D4266:123a-36	chu la yang ni 'jug par 'gyur //	chu la yang ni jug ba gyur 
BO_T11_D4266:123a-37	de la yang ni me yod na //	de la yang ni me yod na 
BO_T11_D4266:123a-38	log pa ci yang brten pa yin //	log ba ci yang rten ba yin 
BO_T11_D4266:123a-39	yang de yi dngos 'bras bu yi //	yang de yi dngos bras bu yi 
BO_T11_D4266:123a-40	rnam rig der cis dmigs 'gyur min //	rnam rig der cis dmigs gyur min 
BO_T11_D4266:123a-41	mi mthun mtshan nyid dngos yin pa'am //	mi mthun mtshan nyid dngos yin ba 
BO_T11_D4266:123a-42	dngos dbye de nyid can yin chug / kun mkhyen la ni ma lus ba'i //	dngos byed de nyid can yin chug kun mkhyen la ni ma lus ba 
BO_T11_D4266:123a-43	dngos po dang 'brel de nyid kyi //	dngos po dang brel de nyid kyi 
BO_T11_D4266:123a-44	goms pa'i stobs las byung ba can //	goms ba stobs las byung ba can 
BO_T11_D4266:123a-45	yid ches tshad ma gcig tu btags //	yid ches tshad ma gcig tu dogs 
BO_T11_D4266:123a-46	mig sogs rnam par shes pa min //	mig sogs rnam ba shes ba min 
BO_T11_D4266:123a-47	des na nges par mig gis ni //	des na nges ba mig gis ni 
BO_T11_D4266:123a-48	ro sogs thams cad rtogs par 'gyur //	ro sogs thams cad rtogs ba gyur 
BO_T11_D4266:123a-49	ci phyir de ltar brjod pa yin //	ci phyir de ltar rjod ba yin 
BO_T11_D4266:123a-50	gzugs sogs nyams myong bdag nyid can //	gzugs sogs nyams myong bdag nyid can 
BO_T11_D4266:123a-51	yid kyi shes pa'ang grub pa yin //	yid kyi shes ba grub ba yin 
BO_T11_D4266:123a-52	gzhan la yang ni rtsod med de //	gzhan la yang ni rtsod med de 
BO_T11_D4266:123a-53	dngos po nyid ni gsal ba ru //	dngos po nyid ni gsal ba ru 
BO_T11_D4266:123b-0	@123b gang phyir de yi dngos nyid la //	gang phyir de yi dngos nyid la 
BO_T11_D4266:123b-1	gzugs sgra sogs pa'i spyod yul can //	gzugs sgra sogs ba spyod yul can 
BO_T11_D4266:123b-2	dran pa gsal bar brjod pa yin //	dran ba gsal ba rjod ba yin 
BO_T11_D4266:123b-3	rmi lam ngan yang yid shes na //	rmi lam ngan yang yid shes na 
BO_T11_D4266:123b-4	de kun nyams myong bdag nyid can //	de kun nyams myong bdag nyid can 
BO_T11_D4266:123b-5	des na thams cad mkhyen pa la //	des na thams cad mkhyen ba la 
BO_T11_D4266:123b-6	nges byed don can yin rtog na //	nges byed don can yin rtogs na 
BO_T11_D4266:123b-7	gang gi phyir na mig gis ni //	gang gi phyir na mig gis ni 
BO_T11_D4266:123b-8	ro sogs rtogs par 'gyur ba yin //	ro sogs rtogs ba gyur ba yin 
BO_T11_D4266:123b-9	mig las byung nyid de rtog na //	mig las byung nyid de rtogs na 
BO_T11_D4266:123b-10	skyon ni 'di ltar 'gyur ba yin //	skyon ni di ltar gyur ba yin 
BO_T11_D4266:123b-11	yid las byung ba'i sems kyis ni //	yid las byung ba sems kyis ni 
BO_T11_D4266:123b-12	de ni ro sogs mkhyen pa yin //	de ni ro sogs mkhyen ba yin 
BO_T11_D4266:123b-13	gang la yang ni phul byung mthong //	gang la yang ni bul byung mthong 
BO_T11_D4266:123b-14	de yang rang don ma spangs phyir //	de yang rang don ma spong phyir 
BO_T11_D4266:123b-15	ring dang phra sogs mthong ba yin //	ring dang phra sogs mthong ba yin 
BO_T11_D4266:123b-16	gzugs la rna ba 'jug pa min //	gzugs la rna ba jug ba min 
BO_T11_D4266:123b-17	des na de lta bu sogs tshig / gzhan gyis rigs pa dang bral smras //	des na de lta bu sogs tshig gzhan gyis rigs ba dang bral smras 
BO_T11_D4266:123b-18	gang phyir drang don ma spangs pas //	gang phyir dren don ma spong ba 
BO_T11_D4266:123b-19	yid la phul byung 'dod pa yin //	yid la bul byung dod ba yin 
BO_T11_D4266:123b-20	ji ltar rigs can tshad ma yis //	ji ltar rigs can tshad ma yis 
BO_T11_D4266:123b-21	ji ltar rigs pa'i don snang bar //	ji ltar rigs ba don snang ba 
BO_T11_D4266:123b-22	da ltar 'jig rten na ni mthong //	da ltar jig rten na ni mthong 
BO_T11_D4266:123b-23	de bzhin dus gzhan dag la'ang yin //	de bzhin dus gzhan dag la yin 
BO_T11_D4266:123b-24	rnam par dag pa'i shes kun nam //	rnam ba dag ba shes kun nam 
BO_T11_D4266:123b-25	don kun spyod yul can yin te //	don kun spyod yul can yin te 
BO_T11_D4266:123b-26	'bras bu 'ga' zhig rgyu yis ni //	bras bu ga jig rgyu yis ni 
BO_T11_D4266:123b-27	byas pa'i phul byung cung zad srid //	byed ba bul byung cung zad srid 
BO_T11_D4266:123b-28	mya ngam na ni skyu ru'i shing //	mya ngam na ni skyu ru shing 
BO_T11_D4266:123b-29	'bras bu dang chung dang bcas mthong bas //	bras bu dang chung dang cha mthong ba 
BO_T11_D4266:123b-30	de dag thams cad de nyid kyi //	de dag thams cad de nyid kyi 
BO_T11_D4266:123b-31	de dngos gzhan du yang 'dug min //	de dngos gzhan du yang dug min 
BO_T11_D4266:123b-32	sbrul rnams mig gis nyan pa yin //	sbrul rnams mig gis nyan ba yin 
BO_T11_D4266:123b-33	de yang de ltar grags pa yin //	de yang de ltar grags ba yin 
BO_T11_D4266:123b-34	des na sems can las nus rnams //	des na sems can las nus rnams 
BO_T11_D4266:123b-35	sna tshogs don bcas srid pa yin //	sna tshogs don cha srid ba yin 
BO_T11_D4266:123b-36	gang las dus gsum gnas pa yi //	gang las dus gsum gnas ba yi 
BO_T11_D4266:123b-37	dngos po thams cad de bzhin du //	dngos po thams cad de bzhin du 
BO_T11_D4266:123b-38	nus pa ngas pa can du snang //	nus ba ngas ba can du snang 
BO_T11_D4266:123b-39	des ni de ltar brjod na mdzes //	des ni de ltar rjod na mdzes 
BO_T11_D4266:123b-40	ji lta'i rigs can tshad ma yis //	ji lta rigs can tshad ma yis 
BO_T11_D4266:123b-41	ji ltar rigs pa'i don snang yang //	ji ltar rigs ba don snang yang 
BO_T11_D4266:123b-42	de ltar 'jig rten na ni mthong //	de ltar jig rten na ni mthong 
BO_T11_D4266:123b-43	de bzhin dus gzhan na yang 'gyur //	de bzhin dus gzhan na yang gyur 
BO_T11_D4266:123b-44	khyod ni skye bo tsam yin pas //	khyod ni skye bo tsam yin ba 
BO_T11_D4266:123b-45	nus kun nges par ma byas phyir //	nus kun nges ba ma byed phyir 
BO_T11_D4266:123b-46	'jig rten rnams kyis nus pa ni //	jig rten rnams kyis nus ba ni 
BO_T11_D4266:123b-47	da ltar dus na'ang shes nus min //	da ltar dus na shes nus min 
BO_T11_D4266:123b-48	nus pa ma lus thams cad ni //	nus ba ma lus thams cad ni 
BO_T11_D4266:123b-49	shes na khyod rang kun mkhyen 'gyur //	shes na khyod rang kun mkhyen gyur 
BO_T11_D4266:123b-50	rnam pa gzhan du yod dogs pas //	rnam ba gzhan du yod dogs ba 
BO_T11_D4266:123b-51	rjes su dpag pas kyang grub min //	rjes su dpog ba kyang grub min 
BO_T11_D4266:123b-52	dbang 'das don shes dang ldan pas //	dbang da don shes dang ldan ba 
BO_T11_D4266:124a-0	skyes bu rnams la shes rab @124a * //	skye bu rnams la shes rab 
BO_T11_D4266:124a-1	sogs // yon tan ldan nyid dmigs 'gyur te //	sogs yon tan ldan nyid dmigs gyur te 
BO_T11_D4266:124a-2	rigs la sogs pa'i nus yod phyir //	rigs la sogs ba nus yod phyir 
BO_T11_D4266:124a-3	lta ba can sogs zhes bya ba'i //	lta ba can sogs zhes byed ba 
BO_T11_D4266:124a-4	rigs pa yod pa legs bsgoms gang //	rigs ba yod ba legs sgom gang 
BO_T11_D4266:124a-5	tshe 'di nyid la gzhan gyis sems //	tshe di nyid la gzhan gyis sems 
BO_T11_D4266:124a-6	yongs su shes par byed pa dang // tshe 'di la ni ma mthong dang / rjes su dpag pa ma thos pa //	yongs su shes ba byed ba dang tshe di la ni ma mthong dang rjes su dpog ba ma thos ba 
BO_T11_D4266:124a-7	byung dang 'byung 'gyur da ltar ba //	byung dang byung gyur da ltar ba 
BO_T11_D4266:124a-8	de kun shes 'gyur smra byed yin //	de kun shes gyur smra byed yin 
BO_T11_D4266:124a-9	sna tshogs sngags dang klu dbang po //	sna tshogs sngags dang klu dbang po 
BO_T11_D4266:124a-10	srin po gnod spyin la sogs mthus //	srin po gnod spyin la sogs mthus 
BO_T11_D4266:124a-11	'dir ni skyes bu la babs na //	dir ni skye bu la bab na 
BO_T11_D4266:124a-12	mi slu ba can gsal bar smra //	mi slu ba can gsal ba smra 
BO_T11_D4266:124a-13	'khrul pa'i yul mthong med ba na //	khrul ba yul mthong med ba na 
BO_T11_D4266:124a-14	de lta na yang 'dir gnod can //	de lta na yang dir gnod can 
BO_T11_D4266:124a-15	tshad ma cung zad yod pa min //	tshad ma cung zad yod ba min 
BO_T11_D4266:124a-16	tshad ma cung zad med pa yis //	tshad ma cung zad med ba yis 
