segmentnr	original	folio	stemmed
BO_T02_D1214:314b-0	@314b * // brda nges par gzung ba bzhugs /	314b	brda nges ba gzung ba bzhugs 
BO_T02_D1214:314b-1	# // dpal dgyes pa'i rdo rje la phyag 'tshal lo //	314b	dpal dgyes ba rdo rje la phyag tshal lo 
BO_T02_D1214:314b-2	brda nges par gzung bar bya ste /	314b	brda nges ba gzung ba byed ste 
BO_T02_D1214:314b-3	dang po sgra ji lta ba bzhin du shes par bya zhing /	314b	dang po sgra ji lta ba bzhin du shes ba byed zhing 
BO_T02_D1214:314b-4	de nas yang man dag gi rim pa bzhin du shes par bya'o //	314b	de nas yang man dag gi rim ba bzhin du shes ba byed 
BO_T02_D1214:314b-5	brda zhes bya ba ni lus dang ngag gi spyod pa'o //	314b	brda zhes byed ba ni lus dang ngag gi spyod ba 
BO_T02_D1214:314b-6	lus ni rdo rje dang padma ste /	314b	lus ni rdo rje dang padma ste 
BO_T02_D1214:314b-7	de'i spyod pa'o //	314b	de spyod ba 
BO_T02_D1214:314b-8	ngag ni yi ge ste /	314b	ngag ni yi ge ste 
BO_T02_D1214:314b-9	des mkha' gsang byin gyis brlabs pa ni /	314b	des mkha gsang byin gyis brlabs ba ni 
BO_T02_D1214:314b-10	de'i spyod pa ste ;	314b	de spyod ba ste 
BO_T02_D1214:314b-11	de lta bu'i brda shes na spun dang sring mor nges so zhes bya ba'i tha tshig go //	314b	de lta bu brda shes na spun dang sring mor nges so zhes byed ba tha tshig go 
BO_T02_D1214:314b-12	spun zhes bya ba ni dam tshig gcig pa'i skyes bu'o //	314b	spun zhes byed ba ni dam tshig gcig ba skye bu 
BO_T02_D1214:314b-13	sring mo zhes bya ba ni dam tshig gcig pa'i bud med do //	314b	sring mo zhes byed ba ni dam tshig gcig ba bud med do 
BO_T02_D1214:314b-14	yang na spun dang sring mo zhes bya ba ni dpa' bo dang rnal 'byor ma'o //	314b	yang na spun dang sring mo zhes byed ba ni dpa bo dang rnal byor ma 
BO_T02_D1214:314b-15	yang na spun dang sring mo zhes bya ba ni thabs dang shes rab bo //	314b	yang na spun dang sring mo zhes byed ba ni thabs dang shes rab bo 
BO_T02_D1214:314b-16	yang na spun dang sring mo zhes bya ba ni rdo rje dang padma ste /	314b	yang na spun dang sring mo zhes byed ba ni rdo rje dang padma ste 
BO_T02_D1214:314b-17	de shes pa ni the tshom med pa'o //	314b	de shes ba ni the tshom med ba 
BO_T02_D1214:314b-18	sor mo gcig ston pa zhes bya ba ni g-yon gyi mthe'u chung ston pa ste /	314b	sor mo gcig ston ba zhes byed ba ni g-yon gyi mtheu chung ston ba ste 
BO_T02_D1214:314b-19	zab mo'i don dang ldan rnam zhes bya ba'o //	314b	zab mo don dang ldan rnam zhes byed ba 
BO_T02_D1214:314b-20	gnyis kyis zhes bya ba ni bdag nges pa'i don dang ldan pa zhes bya ba'o //	314b	gnyis kyis zhes byed ba ni bdag nges ba don dang ldan ba zhes byed ba 
BO_T02_D1214:314b-21	g-yon pa'i zhes bya ba ni shes rab ste padma'o //	314b	g-yon ba zhes byed ba ni shes rab ste padma 
BO_T02_D1214:314b-22	mthe bo zhes bya ba ni rdo rje padma bcangs pa ste snyoms par zhugs pa'o //	314b	mthe bo zhes byed ba ni rdo rje padma chang ba ste snyom ba jug ba 
BO_T02_D1214:314b-23	bsnyun gyi zhes bya ba ni rdo rje dang padma las skyes pa'i bde ba dang ldan pa zhes bya'o //	314b	snyun gyi zhes byed ba ni rdo rje dang padma las skye ba bde ba dang ldan ba zhes byed 
BO_T02_D1214:314b-24	srin lag ces bya ba ni rdo rje ste /	314b	srin lag ces byed ba ni rdo rje ste 
BO_T02_D1214:314b-25	padma rgyas par byed pa'i phyir ro //	314b	padma rgya ba byed ba phyir ro 
BO_T02_D1214:314b-26	ster ba la zhes bya ba ni de bstan pa la'o //	314b	ster ba la zhes byed ba ni de ston ba la 
BO_T02_D1214:314b-27	mthe chung zhes bya ba ni 'og gi cha yin pa'i phyir padma ste /	314b	mthe chung zhes byed ba ni g gi cha yin ba phyir padma ste 
BO_T02_D1214:314b-28	de bstan par bya zhe'o //	314b	de ston ba byed zhe 
BO_T02_D1214:314b-29	gung mo zhes bya ba ni nyan thos la sogs pa'i mya ngan las 'das pa'i mtha' dang 'khor ba'i mtha' gnyis dang bral bar byed pa'i phyag rgya chen po'i rig pa'o //	314b	gung mo zhes byed ba ni nyan thos la sogs ba mya ngan las da ba mtha dang khor ba mtha gnyis dang bral ba byed ba phyag rgya chen po rig ba 
BO_T02_D1214:314b-30	mdzub mo zhes bya ba ni bsdebs par byed pa'i nus pa dang ldan pa'i phyir rdo rje ste /	314b	mdzub mo zhes byed ba ni sdeb ba byed ba nus ba dang ldan ba phyir rdo rje ste 
BO_T02_D1214:314b-31	de bstan par bya zhes bya ba'o //	314b	de ston ba byed zhes byed ba 
BO_T02_D1214:314b-32	srin lag ston pa la zhes bya ba ni gus pa dang ldan ma zhes bya ba'o //	314b	srin lag ston ba la zhes byed ba ni gus ba dang ldan ma zhes byed ba 
BO_T02_D1214:315a-0	mgrin @315a * //	315a	mgrin 
BO_T02_D1214:315a-1	pa rab tu bstan zhes bya ba ni gus par bgyid de /	315a	ba rab tu ston zhes byed ba ni gus ba bgyid de 
BO_T02_D1214:315a-2	mgo bo dbul lo zhes bya ba'o //	315a	mgo bo bul lo zhes byed ba 
BO_T02_D1214:315a-3	gos ni ston pa la zhes bya ba ni /	315a	gos ni ston ba la zhes byed ba ni 
BO_T02_D1214:315a-4	sgrib pa dag gam zhes bya'o //	315a	sgrib ba dag gam zhes byed 
BO_T02_D1214:315a-5	rtse gsum rab bstan bya zhes bya ba ni bdag ni sku gsung thugs dang ldan te sgrib pa dag pa'o zhes bya ba'o //	315a	rtse gsum rab ston byed zhes byed ba ni bdag ni sku gsung thugs dang ldan te sgrib ba dag ba zhes byed ba 
BO_T02_D1214:315a-6	nu ma ston pa la zhes bya ba ni byang chub sems kyi rnam pa dang ldan nam zhes bya ba'o //	315a	nu ma ston ba la zhes byed ba ni byang chub sems kyi rnam ba dang ldan nam zhes byed ba 
BO_T02_D1214:315a-7	mtshams ni zhes bya ba ni byang chub sems kyi rnam pa ste /	315a	mtshams ni zhes byed ba ni byang chub sems kyi rnam ba ste 
BO_T02_D1214:315a-8	bco lnga dang bcu bzhi pa'i dus su spyod cig ces bya ba'o //	315a	chos lnga dang chu bzhi ba dus su spyod cig ces byed ba 
BO_T02_D1214:315a-9	yang na nu ma zhes bya ba ni khu ba'i rnam pa'i lam du gyur pa'i phyir rdo rje ste /	315a	yang na nu ma zhes byed ba ni khu ba rnam ba lam du gyur ba phyir rdo rje ste 
BO_T02_D1214:315a-10	de ston pa la'o //	315a	de ston ba la 
BO_T02_D1214:315a-11	mtshams la zhes bya ba ni padma ste /	315a	mtshams la zhes byed ba ni padma ste 
BO_T02_D1214:315a-12	de 'byed pa zhes bya ba'o //	315a	de byed ba zhes byed ba 
BO_T02_D1214:315a-13	sa zhes bya ba ni dga' ba la sogs pa'i rten du gyur pa'i padma'o //	315a	sa zhes byed ba ni dga ba la sogs ba rten du gyur ba padma 
BO_T02_D1214:315a-14	ston pa la zhes bya ba ni rgyas par gyis shig ces bya ba'o //	315a	ston ba la zhes byed ba ni rgya ba gyis shig ces byed ba 
BO_T02_D1214:315a-15	kha zhes bya ba ni h'um la sogs pas byin gyis brlabs la rgyas par bya zhes bya ba'o //	315a	kha zhes byed ba ni hum la sogs ba byin gyis brlabs la rgya ba byed zhes byed ba 
BO_T02_D1214:315a-16	khro gnyer ston pa la zhes bya ba ni /	315a	khro gnyer ston ba la zhes byed ba ni 
BO_T02_D1214:315a-17	nga'i bka' nyan nam zhes bya ba'o //	315a	nga bka nyan nam zhes byed ba 
BO_T02_D1214:315a-18	gtsug phud grol bar bya zhes bya ba ni bka' nyan no zhes bya ba'o //	315a	gtsug bud grol ba byed zhes byed ba ni bka nyan no zhes byed ba 
BO_T02_D1214:315a-19	dpral bar ston pa la zhes bya ba dang / rgyab ni rab tu bstan zhes bya ba ni sgra ji bzhin pa'o //	315a	dpral ba ston ba la zhes byed ba dang rgyab ni rab tu ston zhes byed ba ni sgra ji bzhin ba 
BO_T02_D1214:315a-20	rkang mthil zhes bya ba ni padma ste yi ge pa ni padma zhes bya ba'i dang po'i yi ge yin pas ta phyis la mar shes par bya'o //	315a	rkang mthil zhes byed ba ni padma ste yi ge ba ni padma zhes byed ba dang po yi ge yin ba ta byid la mar shes ba byed 
BO_T02_D1214:315a-21	de bas na 'dab ma brgyad dang ldan pa'i padma ni rkang mthil zhes bya ba'o //	315a	de ba na dab ma brgyad dang ldan ba padma ni rkang mthil zhes byed ba 
BO_T02_D1214:315a-22	ston pa la zhes bya ba ni de dang sbyor cig ces bya ba'o //	315a	ston ba la zhes byed ba ni de dang sbyor cig ces byed ba 
BO_T02_D1214:315a-23	rdo yis rnam par rtse bar bya //	315a	rdo yis rnam ba rtse ba byed 
BO_T02_D1214:315a-24	zhes bya ba ni h'um phat dang ldan pa'i rdo rjes bskyed par bya'o zhes bya ba'o //	315a	zhes byed ba ni hum phat dang ldan ba rdo rjes skyed ba byed zhes byed ba 
BO_T02_D1214:315a-25	sa ni bcu gnyis te zhes bya ba ni tshogs kyi lam dang / sbyor ba'i lam dang / mthong ba'i lam dang / bsgom pa'i lam dang / rnam par grol ba'i lam mo //	315a	sa ni chu gnyis te zhes byed ba ni tshogs kyi lam dang sbyor ba lam dang mthong ba lam dang bsgom ba lam dang rnam ba grol ba lam mo 
BO_T02_D1214:315a-26	de bas na lam bzhir gyur pa'i dga' ba dang / mchog tu dga' ba la sogs pa ni sa bcu gnyis so //	315a	de ba na lam bzhir gyur ba dga ba dang mchog tu dga ba la sogs ba ni sa chu gnyis so 
BO_T02_D1214:315a-27	sa bcu'i dbang phyug ces bya ba ni blo dang ldan pa'i rnal 'byor pa ste /	315a	sa chu dbang phyug ces byed ba ni blo dang ldan ba rnal byor ba ste 
BO_T02_D1214:315b-0	des na dga' ba dang mchog tu dga' ba la sogs pas @315b bgrod par bya'o //	315b	des na dga ba dang mchog tu dga ba la sogs ba bgrod ba byed 
BO_T02_D1214:315b-1	yi dags zla phyed ces bya ba ni mar gyi ngo bo'i tshes brgyad dang bcu bzhi'o //	315b	yi dags zla phyed ces byed ba ni mar gyi ngo bo tshes brgyad dang chu bzhi 
BO_T02_D1214:315b-2	legs 'du ba'i zhes bya ba ni 'du ba nye ba'i 'du ba la sogs pa'i gnas su 'du ba'o //	315b	legs du ba zhes byed ba ni du ba nye ba du ba la sogs ba gnas su du ba 
BO_T02_D1214:315b-3	yang na yi dags zla phyed ces bya ba ni rdo rje nor bu'i cha ste der byang chub kyi sems kyi rnam pa 'du ba ni rnal 'byor ma 'du ba'o //	315b	yang na yi dags zla phyed ces byed ba ni rdo rje nor bu cha ste der byang chub kyi sems kyi rnam ba du ba ni rnal byor ma du ba 
BO_T02_D1214:315b-4	yang na yi dags zla phyed ces bya ba ni dga' bral gyi dga' ba ste /	315b	yang na yi dags zla phyed ces byed ba ni dga bral gyi dga ba ste 
BO_T02_D1214:315b-5	der rnal 'byor ma 'du ba zhes bya ba'o //	315b	der rnal byor ma du ba zhes byed ba 
BO_T02_D1214:315b-6	rgyal mtshan zhes bya ba ni gsal shing la btsugs pa'o //	315b	rgyal mtshan zhes byed ba ni gsal shing la btsugs ba 
BO_T02_D1214:315b-7	mtshon bsnun nyid ces bya ba ni ral gri la sogs pas brgyab pa ste ;	315b	mtshon snun nyid ces byed ba ni ral gri la sogs ba rgyag ba ste 
BO_T02_D1214:315b-8	de'i sha ni rnal 'byor pas dngos grub kyi don du bza' bar bya zhes bya ba'i tha tshig go //	315b	de sha ni rnal byor ba dngos grub kyi don du bza ba byed zhes byed ba tha tshig go 
BO_T02_D1214:315b-9	bshad par bya ba gzhan yang rgyal mtshan zhes bya ba ni mi skye ba'i sngon rol du srog khugs par gyur pa zhes bya ba'i don to //	315b	chad ba byed ba gzhan yang rgyal mtshan zhes byed ba ni mi skye ba sngon rol du srog khugs ba gyur ba zhes byed ba don to 
BO_T02_D1214:315b-10	mtshon ba snun nyid ces bya ba ni ma skyes pa'i 'og rol du nam mkha'i khams su gyur pa zhes bya ba'i tha tshig go //	315b	mtshon ba snun nyid ces byed ba ni ma skye ba g rol du nam mkha khams su gyur ba zhes byed ba tha tshig go 
BO_T02_D1214:315b-11	lan bdun pa'ang zhes bya ba ni skye ba bdun du mir skyes pa ste /	315b	lan bdun ba zhes byed ba ni skye ba bdun du mir skye ba ste 
BO_T02_D1214:315b-12	de'i sha kha na ma tho ba med pas bza' bar bya zhes bya ba'i don to //	315b	de sha kha na ma tho ba med ba bza ba byed zhes byed ba don to 
BO_T02_D1214:315b-13	bshad par bya ba gzhan yang ldan bdun pa'ang zhes bya ba ni byang chub sems dpa' ste /	315b	chad ba byed ba gzhan yang ldan bdun ba zhes byed ba ni byang chub sems dpa ste 
BO_T02_D1214:315b-14	dga' bral gyi dga' bas bsdus pa'i rang rig pa'i bde ba'i ye shes ni byang chub ste /	315b	dga bral gyi dga ba sdud ba rang rig ba bde ba ye shes ni byang chub ste 
BO_T02_D1214:315b-15	de yid la byed pa ni byang chub sems dpa'o //	315b	de yid la byed ba ni byang chub sems dpa 
BO_T02_D1214:315b-16	bza' bar bya zhes bya ba ni lhan cig skyes pa'i dngos grub kyi don du bsgom par bya zhes bya ba'i don to //	315b	bza ba byed zhes byed ba ni lhan cig skye ba dngos grub kyi don du bsgom ba byed zhes byed ba don to 
BO_T02_D1214:315b-17	ae zhes bya ba ni rnam par thar pa'i sgo gsum gyi rang bzhin du gyur pa'i phyir padma zhes bya ba'i tha tshig go //	315b	ae zhes byed ba ni rnam ba thar ba sgo gsum gyi rang bzhin du gyur ba phyir padma zhes byed ba tha tshig go 
BO_T02_D1214:315b-18	wam zhes bya ba ni rdo rje ste /	315b	wam zhes byed ba ni rdo rje ste 
BO_T02_D1214:315b-19	rigs kyi bdag po zhes bya ba'i tha tshig go //	315b	rigs kyi bdag po zhes byed ba tha tshig go 
BO_T02_D1214:315b-20	blta bar zhes bya ba ni tha mal pa'i gzugs spangs te byin gyis brlabs la zhes bya ba'i don to //	315b	lta ba zhes byed ba ni tha mal ba gzugs spong te byin gyis brlabs la zhes byed ba don to 
BO_T02_D1214:315b-21	ae zhes bya ba ni rjes su chags par bya zhes bya ba'i don to //	315b	ae zhes byed ba ni rjes su chags ba byed zhes byed ba don to 
BO_T02_D1214:315b-22	de'i phyir nyin mo zhes bya ba ni kun rdzob kyi gzugs te zla ba'i rnam pa'o //	315b	de phyir nyin mo zhes byed ba ni kun rdzob kyi gzugs te zla ba rnam ba 
BO_T02_D1214:315b-23	de ni bcom ldan 'das te thabs zhes bya ba'i tha tshig go //	315b	de ni joms ldan da te thabs zhes byed ba tha tshig go 
BO_T02_D1214:315b-24	mtshan mo zhes bya ba ni don dam pa'i ngo bo ste /	315b	mtshan mo zhes byed ba ni don dam ba ngo bo ste 
BO_T02_D1214:315b-25	bde ba'i ngo bo ste /	315b	bde ba ngo bo ste 
BO_T02_D1214:316a-0	de ni @316a * //	316a	de ni 
BO_T02_D1214:316a-1	shes rab ste mtshan ma med pa'i rig pa zhes bya ba'i don to //	316a	shes rab ste mtshan ma med ba rig ba zhes byed ba don to 
BO_T02_D1214:316a-2	gang dang gang rnams kyi sha zhes bya ba ni g-yul du mtshon gyis bsad pa'i sha'o //	316a	gang dang gang rnams kyi sha zhes byed ba ni g-yul du mtshon gyis bsad ba sha 
BO_T02_D1214:316a-3	de zos na 'brel pa de dang de dbang du gyur ces bya ba ni de'i rigs dbang du gyur pa'o //	316a	de zos na brel ba de dang de dbang du gyur ces byed ba ni de rigs dbang du gyur ba 
BO_T02_D1214:316a-4	yang na sha ni zhes bya ba ni gnyis su mngon par zhen pa'i rtogs pa'o //	316a	yang na sha ni zhes byed ba ni gnyis su mngon ba zhen ba rtogs ba 
BO_T02_D1214:316a-5	bza' zhes bya ba ni gnyis su mngon par zhen pa spangs pa'o //	316a	bza zhes byed ba ni gnyis su mngon ba zhen ba spong ba 
BO_T02_D1214:316a-6	de de'i rigs dbang du gyur ces bya ba ni gnyis su med pa'i mi dmigs pa mngon sum du gyur ces bya ba'i don to //	316a	de de rigs dbang du gyur ces byed ba ni gnyis su med ba mi dmigs ba mngon sum du gyur ces byed ba don to 
BO_T02_D1214:316a-7	bshad pa gzhan yang sha ni zhes bya ba ni bha ga'i khu ba'o //	316a	chad ba gzhan yang sha ni zhes byed ba ni bha ga khu ba 
BO_T02_D1214:316a-8	bza' zhes bya ba ni rnal 'byor pas lce yis blang zhing bdud rtsi'i ting nge 'dzin gyis blang bar bya'o zhes bya ba'i don to //	316a	bza zhes byed ba ni rnal byor ba lce yis blang zhing bdud rtsi ting nge dzin gyis blang ba byed zhes byed ba don to 
BO_T02_D1214:316a-9	de de dbang du 'gyur zhes bya ba ni rnal 'byor ma rjes su 'gyur pa'o //	316a	de de dbang du gyur zhes byed ba ni rnal byor ma rjes su gyur ba 
BO_T02_D1214:316a-10	bla chen gyi la /	316a	bla chen gyi la 
BO_T02_D1214:316a-11	lha mnga' bdag ye shes rgyal mtshan gyis 'gyur bcos pa'o//	316a	lha mnga bdag ye shes rgyal mtshan gyis gyur chos 
