segmentnr	original	stemmed
BO_T11_D4266:113a-8	gnod dang rgyu skyon bcas shes pa'am //	gnod dang rgyu skyon cha shes ba 
BO_T11_D4266:113a-9	thug pa med par bshad pa yin //	thug ba med ba chad ba yin 
BO_T11_D4266:113a-10	des na the tshom gyis log nyid //	des na the tshom gyis log nyid 
BO_T11_D4266:113a-11	'dzin par nus pa ma yin no //	dzin ba nus ba ma yin no 
BO_T11_D4266:113a-12	skye ba'i gnas skabs khon ni //	skye ba gnas skabs khon ni 
BO_T11_D4266:113a-13	'di ni tshad ma nyid du nges //	di ni tshad ma nyid du nges 
BO_T11_D4266:113a-14	'di ni tshad ma nyid du ni //	di ni tshad ma nyid du ni 
BO_T11_D4266:113a-15	rang rig pa yis nges min te //	rang rig ba yis nges min te 
BO_T11_D4266:113a-16	mi 'dod pa dang rtog med phyir //	mi dod ba dang rtogs med phyir 
BO_T11_D4266:113a-17	shes pa gzhan gyis kyang min te //	shes ba gzhan gyis kyang min te 
BO_T11_D4266:113a-18	dus der nye bar mi gnas phyir //	dus der nye ba mi gnas phyir 
BO_T11_D4266:113a-19	de yang mi gsal dngos phyir ram //	de yang mi gsal dngos phyir ram 
BO_T11_D4266:113a-20	thug med thal bar 'gyur phyir yang //	thug med thal ba gyur phyir yang 
BO_T11_D4266:113a-21	rig byed la yang gnod can gyi //	rig byed la yang gnod can gyi 
BO_T11_D4266:113a-22	tshad ma rjes dpag med nyid bstan //	tshad ma rjes dpog med nyid ston 
BO_T11_D4266:113a-23	der bshad bdag sogs gsal byas bas //	der chad bdag sogs gsal byed ba 
BO_T11_D4266:113a-24	des na tshad mar mi 'thad do //	des na tshad mar mi thad do 
BO_T11_D4266:113a-25	skyes bus byas nyid grub zin pas //	skye bud byed nyid grub zin ba 
BO_T11_D4266:113a-26	rgyu mtshan skyon dang bcas par dogs //	rgyu mtshan skyon dang cha ba dogs 
BO_T11_D4266:113a-27	me bzhin rang las nus pa ni //	me bzhin rang las nus ba ni 
BO_T11_D4266:113a-28	log pa'i shes pa la yod 'gyur //	log ba shes ba la yod gyur 
BO_T11_D4266:113a-29	de ni bskul byung shes pa yi //	de ni skul byung shes ba yi 
BO_T11_D4266:113a-30	rgyu mtshan skyon dang bcas par dogs //	rgyu mtshan skyon dang cha ba dogs 
BO_T11_D4266:113a-31	skyon mthong ba la skyon dogs pa //	skyon mthong ba la skyon dogs ba 
BO_T11_D4266:113a-32	bye brag yod par mi 'gyur ro //	bye brag yod ba mi gyur ro 
BO_T11_D4266:113a-33	de phyir rig byed la yang ni //	de phyir rig byed la yang ni 
BO_T11_D4266:113a-34	rang las tshad ma nyid rigs min //	rang las tshad ma nyid rigs min 
BO_T11_D4266:113a-35	des na nges par skyon med pas //	des na nges ba skyon med ba 
BO_T11_D4266:113a-36	byas dang bshad ba nyid 'dod kyi //	byed dang chad ba nyid dod kyi 
BO_T11_D4266:113a-37	ji lta ji ltar smra ba po //	ji lta ji ltar smra ba po 
BO_T11_D4266:113a-38	gang phyir chags sdang la sogs ldan //	gang phyir chags sdang la sogs ldan 
BO_T11_D4266:113a-39	de lta de ltar rang 'don pa //	de lta de ltar rang don ba 
BO_T11_D4266:113a-40	shin tu srung byed ma yin nam //	shin tu srung byed ma yin nam 
BO_T11_D4266:113a-41	gang las gang zhig stobs chung ba //	gang las gang jig stobs chung ba 
BO_T11_D4266:113a-42	gang las 'dod pa sngar bslabs yin //	gang las dod ba sngar bslabs yin 
BO_T11_D4266:113a-43	su yis dbyangs ni nyams byas te //	su yis dbyangs ni nyams byed te 
BO_T11_D4266:113a-44	mtshams min mtshams bcad gang gis byas //	mtshams min mtshams gcod gang gis byed 
BO_T11_D4266:113a-45	de ltar gang zhig brtson 'grus ldan //	de ltar gang jig brtson grus ldan 
BO_T11_D4266:113a-46	skyon ni tshol bar byed pa yin //	skyon ni tshol ba byed ba yin 
BO_T11_D4266:113a-47	de ni mdzes bcas rig byed ni //	de ni mdzes cha rig byed ni 
BO_T11_D4266:113a-48	skyon med ji ltar 'dod mi byed //	skyon med ji ltar dod mi byed 
BO_T11_D4266:113a-49	gzhan gyis rig byed nyams byas nas //	gzhan gyis rig byed nyams byed nas 
BO_T11_D4266:113a-50	blo gtsang rig byed 'don skyes bus //	blo gtsang rig byed don skye bud 
BO_T11_D4266:113a-51	yal bar dor nas gnas byed cing //	yal ba dor nas gnas byed cing 
BO_T11_D4266:113a-52	de dag gnod par mi byed na //	de dag gnod ba mi byed na 
BO_T11_D4266:113a-53	de tshe dus mang btang snyoms kyis //	de tshe dus mang gtong snyom kyis 
BO_T11_D4266:113a-54	rig byed nyams par gyur nas ni //	rig byed nyams ba gyur nas ni 
BO_T11_D4266:113a-55	gzugs brnyan dang ni 'dra gyur nas //	gzugs rnyan dang ni dra gyur nas 
BO_T11_D4266:113b-0	@113b rig byed gzhan nyid du ni 'gyur //	rig byed gzhan nyid du ni gyur 
BO_T11_D4266:113b-1	'dod chags zhe sdang rnams bral bas //	dod chags zhe sdang rnams bral ba 
BO_T11_D4266:113b-2	rig byed nyams pas sel byed pa //	rig byed nyams ba sel byed ba 
BO_T11_D4266:113b-3	rtag tu rig byed bsrungs ba yis //	rtag tu rig byed bsrungs ba yis 
BO_T11_D4266:113b-4	rang gi ngo bor 'dor mi byed //	rang gi ngo bor dor mi byed 
BO_T11_D4266:113b-5	'gro ba thams cad nang du yang //	gro ba thams cad nang du yang 
BO_T11_D4266:113b-6	'di 'dra ma yin par 'dod min //	di dra ma yin ba dod min 
BO_T11_D4266:113b-7	don dam rab thim chen po ni//	don dam rab thim chen po 
BO_T11_D4266:113b-8	shes par 'gyur ba min zhe na //	shes ba gyur ba min zhe na 
BO_T11_D4266:113b-9	de ltar de min gang gi phyir //	de ltar de min gang gi phyir 
BO_T11_D4266:113b-10	de ltas 'don pa mtshungs nyid 'gyur //	de ltas don ba mtshungs nyid gyur 
BO_T11_D4266:113b-11	dbang po las 'das mthong med na //	dbang po las da mthong med na 
BO_T11_D4266:113b-12	de don de nyid kyis rtogs med //	de don de nyid kyis rtogs med 
BO_T11_D4266:113b-13	skyes bu thams cad dag dang ni //	skye bu thams cad dag dang ni 
BO_T11_D4266:113b-14	de bzhin yul dus ma lus pa //	de bzhin yul dus ma lus ba 
BO_T11_D4266:113b-15	lag mthil skyu ru ra bzhin gsal //	lag mthil skyu ru ra bzhin gsal 
BO_T11_D4266:113b-16	nang gi sems la dngos su snang //	nang gi sems la dngos su snang 
BO_T11_D4266:113b-17	de ni 'dod pa'ang mtshungs nyid du //	de ni dod ba mtshungs nyid du 
BO_T11_D4266:113b-18	rtogs par nus te gzhan du na //	rtogs ba nus te gzhan du na 
BO_T11_D4266:113b-19	yul dus mi yi gnas skabs kyi //	yul dus mi yi gnas skabs kyi 
BO_T11_D4266:113b-20	dbye bas phyin log blo cis 'gyur //	byed ba phyin log blo cis gyur 
BO_T11_D4266:113b-21	rtag tu 'gro ba 'di 'dra yin //	rtag tu gro ba di dra yin 
BO_T11_D4266:113b-22	'di yang khyed la tshad ma med //	di yang khyed la tshad ma med 
BO_T11_D4266:113b-23	ma mthong tsam gyis 'jig pa yang //	ma mthong tsam gyis jig ba yang 
BO_T11_D4266:113b-24	byed pa nyid du rigs pa min //	byed ba nyid du rigs ba min 
BO_T11_D4266:113b-25	rang las tshad ma nyid phyogs la //	rang las tshad ma nyid phyogs la 
BO_T11_D4266:113b-26	rig byed rang gi don la ni //	rig byed rang gi don la ni 
BO_T11_D4266:113b-27	rang las nges par byed des na //	rang las nges ba byed des na 
BO_T11_D4266:113b-28	rang dngos la rmongs sogs mi srid //	rang dngos la rmongs sogs mi srid 
BO_T11_D4266:113b-29	de ni mi shes dang the tshom //	de ni mi shes dang the tshom 
BO_T11_D4266:113b-30	phyin ci log med go 'phang gnas //	phyin ci log med go phen gnas 
BO_T11_D4266:113b-31	gnyis skyes phru gu 'ga' zhig kyang //	gnyis skye phru gu ga jig kyang 
BO_T11_D4266:113b-32	bshad pa la ltos mi 'gyur ro //	chad ba la ltos mi gyur ro 
BO_T11_D4266:113b-33	de bzhin mi shes rtsa ba ni //	de bzhin mi shes rtsa ba ni 
BO_T11_D4266:113b-34	'di la 'jig pa mi srid do //	di la jig ba mi srid do 
BO_T11_D4266:113b-35	rdo rje bas lhag rtag pa la //	rdo rje ba lhag rtag ba la 
BO_T11_D4266:113b-36	'jig pa ci 'dra ba zhig yod //	jig ba ci dra ba jig yod 
BO_T11_D4266:113b-37	mngon gsal gzhan nyid yin zhe na //	mngon gsal gzhan nyid yin zhe na 
BO_T11_D4266:113b-38	de ni rtag pa spangs min nam //	de ni rtag ba spong min nam 
BO_T11_D4266:113b-39	de phyir 'di la bsrung ba ni //	de phyir di la bsrung ba ni 
BO_T11_D4266:113b-40	bram ze rnams ni don med byed //	bram ze rnams ni don med byed 
BO_T11_D4266:113b-41	des na dbang 'das don mthong ba //	des na dbang da don mthong ba 
BO_T11_D4266:113b-42	nang gi mun pa'i tshogs 'joms pa //	nang gi mun ba tshogs joms ba 
BO_T11_D4266:113b-43	rig byed don gyis dbye shes dang // byed pa po yang khas blang gyis //	rig byed don gyis byed shes dang byed ba po yang khas blang gyis 
BO_T11_D4266:113b-44	de kho na nyid bsdus pa'i tshig le'ur byas pa las /	de kho na nyid sdud ba tshig leur byed ba las 
BO_T11_D4266:113b-45	rang las tshad ma brtag pa ste nye shu rtsa dgu pa'o /	rang las tshad ma rtog ba ste nye shu rtsa dgu ba 
BO_T11_D4266:113b-46	// / de ltar tshad ma thams cad ni //	de ltar tshad ma thams cad ni 
BO_T11_D4266:113b-47	rang las tshad ma nyid mi gnas //	rang las tshad ma nyid mi gnas 
BO_T11_D4266:113b-48	dbang po las 'das don rig pa'i //	dbang po las da don rig ba 
BO_T11_D4266:113b-49	skyes bu grub phyir 'bad mi dgos //	skye bu grub phyir bad mi dgos 
BO_T11_D4266:113b-50	gang phyir skyes bu las kyang ni //	gang phyir skye bu las kyang ni 
BO_T11_D4266:113b-51	rig byed tshad ma nyid du gnas //	rig byed tshad ma nyid du gnas 
BO_T11_D4266:113b-52	de ni dbang 'das shes nyid ni //	de ni dbang da shes nyid ni 
BO_T11_D4266:113b-53	de las de ni tshad nyid gyur //	de las de ni tshad nyid gyur 
BO_T11_D4266:114a-0	gzhan du mi @114a * //	gzhan du mi 
BO_T11_D4266:114a-1	shes the tshom dag / phyin ci log dang rjes 'brel can //	shes the tshom dag phyin ci log dang rjes brel can 
BO_T11_D4266:114a-2	skyes bu byed po yin na 'di //	skye bu byed po yin na di 
BO_T11_D4266:114a-3	gzhan bzhin tshad mar mi 'gyur ro //	gzhan bzhin tshad mar mi gyur ro 
BO_T11_D4266:114a-4	mtho ris mchod spyin sogs 'brel ba //	mtho ris mchod spyin sogs brel ba 
BO_T11_D4266:114a-5	shes nas gang gis de bshad yin //	shes nas gang gis de chad yin 
BO_T11_D4266:114a-6	gsal bar dbang 'das shes pa can //	gsal ba dbang da shes ba can 
BO_T11_D4266:114a-7	gzhan gyis de yang khas blang dgos //	gzhan gyis de yang khas blang dgos 
BO_T11_D4266:114a-8	'dir ni chos shes nyid dgag pa //	dir ni chos shes nyid gog ba 
BO_T11_D4266:114a-9	'ba' zhig nye bar mkho ba yin //	ba jig nye ba mkho ba yin 
BO_T11_D4266:114a-10	gzhan ni thams cad shes na yang //	gzhan ni thams cad shes na yang 
BO_T11_D4266:114a-11	skyes bu gang gis gnod par 'gyur //	skye bu gang gis gnod ba gyur 
BO_T11_D4266:114a-12	thams cad kyis sgra thams cad du //	thams cad kyis sgra thams cad du 
BO_T11_D4266:114a-13	gnas skabs la ltos 'dod pa yin //	gnas skabs la ltos dod ba yin 
BO_T11_D4266:114a-14	des na skabs kyis thams cad mkhyen //	des na skabs kyis thams cad mkhyen 
BO_T11_D4266:114a-15	med na kho bo ci zhig nyams //	med na kho bo ci jig nyams 
BO_T11_D4266:114a-16	don la mi srid pa'i 'bras bu //	don la mi srid ba bras bu 
BO_T11_D4266:114a-17	cung zad sgra la'ang brtags pa yin //	cung zad sgra la rtog ba yin 
BO_T11_D4266:114a-18	der gang thams cad sgrar rtog na //	der gang thams cad sgrar rtogs na 
BO_T11_D4266:114a-19	ming tsam kun mkhyen de yin bla //	ming tsam kun mkhyen de yin bla 
BO_T11_D4266:114a-20	'on te skabs kyi cung zad ni //	n te skabs kyi cung zad ni 
BO_T11_D4266:114a-21	til mar chu dang mar sogs gang //	til mar chu dang mar sogs gang 
BO_T11_D4266:114a-22	thams cad des ni kun mkhyen na //	thams cad des ni kun mkhyen na 
BO_T11_D4266:114a-23	de ltar yin chug dgag mi bya //	de ltar yin chug gog mi byed 
BO_T11_D4266:114a-24	yang na dngos med dngos rang bzhin //	yang na dngos med dngos rang bzhin 
BO_T11_D4266:114a-25	'gro kun brjod par byas pa gang //	gro kun rjod ba byed ba gang 
BO_T11_D4266:114a-26	de mdor bsdus pas kun mkhyen pa'i //	de mdor sdud ba kun mkhyen ba 
BO_T11_D4266:114a-27	skyes bu su zhig gis ni bkag / de ltar shes bya gzhal bya nyid //	skye bu su jig gis ni gog de ltar shes byed jal byed nyid 
BO_T11_D4266:114a-28	mdor bsdus nas kyang thams cad nyid //	mdor sdud nas kyang thams cad nyid 
BO_T11_D4266:114a-29	brten nas gal te kun mkhyen na //	rten nas gal te kun mkhyen na 
BO_T11_D4266:114a-30	de spong su zhig nus pa yin //	de spong su jig nus ba yin 
BO_T11_D4266:114a-31	ji snyed dngos po gang dag gis //	ji snyed dngos po gang dag gis 
BO_T11_D4266:114a-32	thams cad nyid du nges bzung yin //	thams cad nyid du nges bzung yin 
BO_T11_D4266:114a-33	de shes pas kyang kun mkhyen na //	de shes ba kyang kun mkhyen na 
BO_T11_D4266:114a-34	de gzhung shes kun kun mkhyen 'gyur //	de gzhung shes kun kun mkhyen gyur 
BO_T11_D4266:114a-35	de bzhin tshad ma drug gis gang //	de bzhin tshad ma drug gis gang 
BO_T11_D4266:114a-36	gzhal bya drug ni rtogs par byed //	jal byed drug ni rtogs ba byed 
BO_T11_D4266:114a-37	de yang mdor bsdus par kun mkhyen //	de yang mdor sdud ba kun mkhyen 
BO_T11_D4266:114a-38	'ga' ni su zhig 'dod pa min //	ga ni su jig dod ba min 
BO_T11_D4266:114a-39	khyad par gyis ni don thams cad //	khyad ba gyis ni don thams cad 
BO_T11_D4266:114a-40	yongs su mngon sum gyis mthong ba //	yongs su mngon sum gyis mthong ba 
BO_T11_D4266:114a-41	gang zhig rtogs par byed pa de //	gang jig rtogs ba byed ba de 
BO_T11_D4266:114a-42	rtog de don med log pa yin //	rtogs de don med log ba yin 
BO_T11_D4266:114a-43	lus ni gcig pu kho na yin //	lus ni gcig pu kho na yin 
BO_T11_D4266:114a-44	rdul phran ji snyed yod rnams sam //	rdul phran ji snyed yod rnams sam 
BO_T11_D4266:114a-45	skra dang ba spu gang dag yod //	skra dang ba spu gang dag yod 
BO_T11_D4266:114a-46	de dag shes par sus nus 'os //	de dag shes ba sus nus s 
BO_T11_D4266:114a-47	ma lus yan lag dang gsal ba'i //	ma lus yan lag dang gsal ba 
BO_T11_D4266:114a-48	rgyas par shes pa sgrub byed na //	rgya ba shes ba sgrub byed na 
BO_T11_D4266:114a-49	bya rog so ni rtog pa bzhin //	byed rog so ni rtogs ba bzhin 
BO_T11_D4266:114a-50	byas kyang don med pa ru 'gyur //	byed kyang don med ba ru gyur 
BO_T11_D4266:114a-51	ji ltar mig gis dngos po ni //	ji ltar mig gis dngos po ni 
BO_T11_D4266:114b-0	kun gyis rtogs pa @114b 'bras med yin //	kun gyis rtogs ba bras med yin 
BO_T11_D4266:114b-1	thams cad mngon sum gyis mthong nyid //	thams cad mngon sum gyis mthong nyid 
BO_T11_D4266:114b-2	dam bca' de bzhin 'bras med 'gyur //	dam chos de bzhin bras med gyur 
BO_T11_D4266:114b-3	rang chos chos min tsam shes pa //	rang chos chos min tsam shes ba 
BO_T11_D4266:114b-4	sgrub dang dgag byed yod pa na //	sgrub dang gog byed yod ba na 
BO_T11_D4266:114b-5	des bstan lung ni blang bya dang // dor bya nyid ni rab bsgrub phyir //	des ston lung ni blang byed dang dor byed nyid ni rab sgrub phyir 
BO_T11_D4266:114b-6	de la 'gro kun pra ba yi //	de la gro kun pra ba yi 
BO_T11_D4266:114b-7	dbye ba mkhyen pa nyid sgrub na //	byed ba mkhyen ba nyid sgrub na 
BO_T11_D4266:114b-8	gzhung rtsod dag la rtsod pa yin //	gzhung rtsod dag la rtsod ba yin 
BO_T11_D4266:114b-9	gnas min 'jig rten nyon mongs 'gyur //	gnas min jig rten nyon mongs gyur 
BO_T11_D4266:114b-10	'jal bar byed po kun 'brel pa'i //	jal ba byed po kun brel ba 
BO_T11_D4266:114b-11	mngon sum sogs ni dgag byas phyir //	mngon sum sogs ni gog byed phyir 
BO_T11_D4266:114b-12	sdig pa dang ni bsod nams dag / lung nyid 'ba' zhig gis rtogs 'gyur //	sdig ba dang ni bsod nams dag lung nyid ba jig gis rtogs gyur 
BO_T11_D4266:114b-13	dpyod pa pa rnams kyi phyogs ni //	dpyod ba ba rnams kyi phyogs ni 
BO_T11_D4266:114b-14	de tsam nyid kyis grub na'ang slar //	de tsam nyid kyis grub na slar 
BO_T11_D4266:114b-15	kun mkhyen spong ba'i 'bad pa gang //	kun mkhyen spong ba bad ba gang 
BO_T11_D4266:114b-16	de ni shi ba gsod par zad //	de ni chi ba gsod ba zad 
BO_T11_D4266:114b-17	rtsa ba med pa nyid kyi phyir //	rtsa ba med ba nyid kyi phyir 
BO_T11_D4266:114b-18	chos nyid shes pa nyams 'gyur na //	chos nyid shes ba nyams gyur na 
BO_T11_D4266:114b-19	kun mkhyen skyes bur gang smras pa //	kun mkhyen skye bur gang smras ba 
BO_T11_D4266:114b-20	de ni phub ma rdung byed 'dra //	de ni bubs ma rdung byed dra 
BO_T11_D4266:114b-21	dngos su mngon sum gyis mthong phyir //	dngos su mngon sum gyis mthong phyir 
BO_T11_D4266:114b-22	gang la mi gtsang khu ba sogs //	gang la mi gtsang khu ba sogs 
BO_T11_D4266:114b-23	rang rig par ni thal bar 'gyur //	rang rig ba ni thal ba gyur 
BO_T11_D4266:114b-24	de ni su zhig sgrub par byed //	de ni su jig sgrub ba byed 
BO_T11_D4266:114b-25	sangs rgyas pa sogs dag gi ni //	sangs rgya ba sogs dag gi ni 
BO_T11_D4266:114b-26	rig byed nye rig byed yan lag / nying lag sogs don rtogs snang min //	rig byed nye rig byed yan lag nying lag sogs don rtogs snang min 
BO_T11_D4266:114b-27	de la kun mkhyen ji ltar yod //	de la kun mkhyen ji ltar yod 
BO_T11_D4266:114b-28	gal te rang gzhung ma bstan kyang //	gal te rang gzhung ma ston kyang 
BO_T11_D4266:114b-29	rang nyid kyis don shes 'dod na //	rang nyid kyis don shes dod na 
BO_T11_D4266:114b-30	rang gis snyan ngag rtsom pa yin //	rang gis snyan ngag rtsom ba yin 
BO_T11_D4266:114b-31	snyan ngag mkhas kun kun mkhyen 'gyur //	snyan ngag mkhas kun kun mkhyen gyur 
BO_T11_D4266:114b-32	'gal ba'i don ni ston byed can //	gal ba don ni ston byed can 
BO_T11_D4266:114b-33	kun mkhyen mang po yod pa na //	kun mkhyen mang po yod ba na 
BO_T11_D4266:114b-34	kun gyi rgyu mtshan mtshungs pa yis //	kun gyi rgyu mtshan mtshungs ba yis 
BO_T11_D4266:114b-35	gcig pur su zhig nges par 'gyur //	gcig pur su jig nges ba gyur 
BO_T11_D4266:114b-36	gal te bde gshegs kun mkhyen na //	gal te bde gshegs kun mkhyen na 
BO_T11_D4266:114b-37	ser skya min zhes tshad ma ci //	ser skya min zhes tshad ma ci 
BO_T11_D4266:114b-38	'on te gnyis ka'ang kun mkhyen na //	n te gnyis ka kun mkhyen na 
BO_T11_D4266:114b-39	de gzhung mi mthun ji ltar 'gyur //	de gzhung mi mthun ji ltar gyur 
BO_T11_D4266:114b-40	rgyal ba sangs rgyas sogs sems can //	rgyal ba sangs rgya sogs sems can 
BO_T11_D4266:114b-41	bden par smra ba thams cad kyi //	bden ba smra ba thams cad kyi 
BO_T11_D4266:114b-42	rtsi sogs phyogs re shes pa la//	rtsi sogs phyogs re shes ba 
BO_T11_D4266:114b-43	khyad par nges par gzung du med //	khyad ba nges ba gzung du med 
BO_T11_D4266:114b-44	rang phyogs dga' ba tsam gyis ni //	rang phyogs dga ba tsam gyis ni 
BO_T11_D4266:114b-45	gtan tshigs gang gis gcig la ni //	gtan tshigs gang gis gcig la ni 
BO_T11_D4266:114b-46	kun mkhyen nyid ni sgrub byed pa //	kun mkhyen nyid ni sgrub byed ba 
BO_T11_D4266:114b-47	de ni gzhan la'ang yod pa min //	de ni gzhan la yod ba min 
BO_T11_D4266:114b-48	rgyal ba kun mkhyen bsgrub pa la //	rgyal ba kun mkhyen sgrub ba la 
BO_T11_D4266:114b-49	sh'akya'i slob ma khros nas ni //	shakya slob ma khro nas ni 
BO_T11_D4266:115a-0	sun dbyung gang dag bstan pa @115a * //	sun byin gang dag ston ba 
BO_T11_D4266:115a-1	ste ; / de dag rgyal ba pa yis sbyor //	ste de dag rgyal ba ba yis sbyor 
BO_T11_D4266:115a-2	de la de rnams kyis sgrub dang // sun dbyung tha dad mi gnas pa //	de la de rnams kyis sgrub dang sun byin tha dad mi gnas ba 
BO_T11_D4266:115a-3	gzugs brnyan 'byung bas zin pa yis //	gzugs rnyan byung ba zin ba yis 
BO_T11_D4266:115a-4	ji ltar nges par byed par 'gyur //	ji ltar nges ba byed ba gyur 
BO_T11_D4266:115a-5	de ltar kun mkhyen 'dra ba dag / phan tshun 'joms par byed pa na //	de ltar kun mkhyen dra ba dag phan tshun joms ba byed ba na 
BO_T11_D4266:115a-6	kun mkhyen kun gyi cung zad lhag / rig byed smra ba pos 'joms byed //	kun mkhyen kun gyi cung zad lhag rig byed smra ba pos joms byed 
BO_T11_D4266:115a-7	ji ltar ne'u le'i so rtse yis //	ji ltar neu le so rtse yis 
BO_T11_D4266:115a-8	reg pa'i sman ni 'ga' zhig gang //	reg ba sman ni ga jig gang 
BO_T11_D4266:115a-9	rtsed mo'i phyir ni sbyar byas kyang //	rtsed mo phyir ni sbyor byed kyang 
BO_T11_D4266:115a-10	sbrul gdug thams cad sel bar byed //	sbrul gdug thams cad sel ba byed 
BO_T11_D4266:115a-11	de bzhin rig byed smra ba'i khar //	de bzhin rig byed smra ba khar 
BO_T11_D4266:115a-12	rig byed 'jig rten rigs pa 'ga' //	rig byed jig rten rigs ba ga 
BO_T11_D4266:115a-13	gnas pas ngag kyang sh'akya yi //	gnas ba ngag kyang shakya yi 
BO_T11_D4266:115a-14	slob sogs sbrul gdug shes pa sel //	slob sogs sbrul gdug shes ba sel 
BO_T11_D4266:115a-15	gang la shes bya gzhal bya nyid //	gang la shes byed jal byed nyid 
BO_T11_D4266:115a-16	dngos nyid yod nyid sogs mtshan can //	dngos nyid yod nyid sogs mtshan can 
BO_T11_D4266:115a-17	gtan tshigs 'joms byed nus yod na //	gtan tshigs joms byed nus yod na 
BO_T11_D4266:115a-18	de ni su zhig sgrub par byed //	de ni su jig sgrub ba byed 
BO_T11_D4266:115a-19	tshad ma gcig gis kun mkhyen ni //	tshad ma gcig gis kun mkhyen ni 
BO_T11_D4266:115a-20	gang gis yod par brtags pa ni //	gang gis yod ba rtog ba ni 
BO_T11_D4266:115a-21	de ni nges par mig gis ni //	de ni nges ba mig gis ni 
BO_T11_D4266:115a-22	ro sogs thams cad rtogs par 'gyur //	ro sogs thams cad rtogs ba gyur 
BO_T11_D4266:115a-23	ji lta'i rigs can tshad ma yin //	ji lta rigs can tshad ma yin 
BO_T11_D4266:115a-24	ji ltar rigs pa'i don snang ba //	ji ltar rigs ba don snang ba 
BO_T11_D4266:115a-25	da ltar 'jig rten na ni mthong //	da ltar jig rten na ni mthong 
BO_T11_D4266:115a-26	de bzhin dus gzhan na yang 'gyur //	de bzhin dus gzhan na yang gyur 
BO_T11_D4266:115a-27	shes rab yid gzhungs stobs rnams kyis ;	shes rab yid gzhungs stobs rnams kyis 
BO_T11_D4266:115a-28	/ cung zad cung zad khyad par gyis //	cung zad cung zad khyad ba gyis 
BO_T11_D4266:115a-29	phul byung can mi gang dag mthong //	bul byung can mi gang dag mthong 
BO_T11_D4266:115a-30	de dag dbang 'das mthong bas min //	de dag dbang da mthong ba min 
BO_T11_D4266:115a-31	skyes bu shes rab can yang ni //	skye bu shes rab can yang ni 
BO_T11_D4266:115a-32	phra pa'i don mthong nus yin yang //	phra ba don mthong nus yin yang 
BO_T11_D4266:115a-33	rang rig mthun pa ma spangs pas //	rang rig mthun ba ma spong ba 
BO_T11_D4266:115a-34	skyes bu gzhan las phul byung 'gyur //	skye bu gzhan las bul byung gyur 
BO_T11_D4266:115a-35	rna bas rtogs bya'i sgra rnams la //	rna ba rtogs byed sgra rnams la 
BO_T11_D4266:115a-36	ring dang phra sogs dmigs pa yis //	ring dang phra sogs dmigs ba yis 
BO_T11_D4266:115a-37	skyes bu phul byung mthong ba yin //	skye bu bul byung mthong ba yin 
BO_T11_D4266:115a-38	gzugs sogs dmigs pa ma yin no //	gzugs sogs dmigs ba ma yin no 
BO_T11_D4266:115a-39	phul byung mig ni thob pas kyang //	bul byung mig ni thob ba kyang 
BO_T11_D4266:115a-40	ring la gnas par gyur pa yi //	ring la gnas ba gyur ba yi 
BO_T11_D4266:115a-41	phra ba'i gzugs sogs gsal bar byed //	phra ba gzugs sogs gsal ba byed 
BO_T11_D4266:115a-42	sgra rtogs thos par mi 'gyur ro //	sgra rtogs thos ba mi gyur ro 
BO_T11_D4266:115a-43	de ltar bstan bcos spyod pa la //	de ltar ston chos spyod ba la 
BO_T11_D4266:115a-44	phul byung chen po snang bar 'gyur //	bul byung chen po snang ba gyur 
BO_T11_D4266:115a-45	bstan bcos gzhan gyi shes pa ni //	ston chos gzhan gyi shes ba ni 
BO_T11_D4266:115a-46	de tsam gyis ni dmigs mi 'gyur //	de tsam gyis ni dmigs mi gyur 
BO_T11_D4266:115a-47	by'a ka ra na'i sgra shes pas //	bya ka ra na sgra shes ba 
BO_T11_D4266:115a-48	legs sbyar ma sbyar sgra dag la //	legs sbyor ma sbyor sgra dag la 
BO_T11_D4266:115a-49	blo ni phul du byung gyur kyang //	blo ni bul du byung gyur kyang 
BO_T11_D4266:115b-0	rgyu skar tshes grangs @115b gza' shes min //	rgyu skar tshes grangs gza shes min 
BO_T11_D4266:115b-1	skar dpyad shes pa nyi zla yi //	skar dpyod shes ba nyi zla yi 
BO_T11_D4266:115b-2	gza' 'dzin sogs la mkhas gyur kyang //	gza dzin sogs la mkhas gyur kyang 
BO_T11_D4266:115b-3	bha wa de sogs sgra rnams kyi //	bha wa de sogs sgra rnams kyi 
BO_T11_D4266:115b-4	legs par sbyar nyid shes 'gyur min //	legs ba sbyor nyid shes gyur min 
BO_T11_D4266:115b-5	rig byed de ltar byung brjod sogs //	rig byed de ltar byung rjod sogs 
BO_T11_D4266:115b-6	shes pa phul byung ldan na yang //	shes ba bul byung ldan na yang 
BO_T11_D4266:115b-7	mtho ris lha mo sngar med na //	mtho ris lha mo sngar med na 
BO_T11_D4266:115b-8	dngos su byed par nus pa min //	dngos su byed ba nus ba min 
BO_T11_D4266:115b-9	khru bcu'i bar du nam mkha' la //	khru chu ba du nam mkha la 
BO_T11_D4266:115b-10	gang zhig mchongs nas 'gro byed gang //	gang jig mchong nas gro byed gang 
BO_T11_D4266:115b-11	de ni brgyar ni goms byas kyang //	de ni brgyar ni goms byed kyang 
BO_T11_D4266:115b-12	dpag tshad tsam mchongs 'gro nus med //	dpog tshad tsam mchong gro nus med 
BO_T11_D4266:115b-13	de'i phyir phul du byung shes pa //	de phyir bul du byung shes ba 
BO_T11_D4266:115b-14	shin tu goms par gyur pas kyang //	shin tu goms ba gyur ba kyang 
BO_T11_D4266:115b-15	cung zad kho na lhag pa ru //	cung zad kho na lhag ba ru 
BO_T11_D4266:115b-16	shes nus dbang 'das shes pa min //	shes nus dbang da shes ba min 
BO_T11_D4266:115b-17	khang dmig gcig la gnas pa yi //	khang dmig gcig la gnas ba yi 
BO_T11_D4266:115b-18	mngon sum gang zhig 'jug par 'gyur //	mngon sum gang jig jug ba gyur 
BO_T11_D4266:115b-19	de nyid du ni de mthong nus //	de nyid du ni de mthong nus 
BO_T11_D4266:115b-20	khang dmig gzhan la ma yin no //	khang dmig gzhan la ma yin no 
BO_T11_D4266:115b-21	don ni gang zhig thag ring gnas //	don ni gang jig thag ring gnas 
BO_T11_D4266:115b-22	yun ring rgya mtsho rnams dang ni //	yun ring rgya mtsho rnams dang ni 
BO_T11_D4266:115b-23	gling dang 'jig rten bar bcad gang //	gling dang jig rten ba gcod gang 
BO_T11_D4266:115b-24	'dir gnas de dag su yis mthong //	dir gnas de dag su yis mthong 
BO_T11_D4266:115b-25	na la'i rgyal dang dus 'dab rgyal //	na la rgyal dang dus dab rgyal 
BO_T11_D4266:115b-26	rta mchog cho lo'i dor shes sngon //	rta mchog cho lo dor shes sngon 
BO_T11_D4266:115b-27	shing rta zhon nas 'gro ba na //	shing rta zhon nas gro ba na 
BO_T11_D4266:115b-28	dus kyi 'dab mas tshig 'di smras //	dus kyi dab mas tshig di smras 
BO_T11_D4266:115b-29	kun gyis thams cad mi shes te //	kun gyis thams cad mi shes te 
BO_T11_D4266:115b-30	skyes bu gcig 'ga' zhig kyang ni //	skye bu gcig ga jig kyang ni 
BO_T11_D4266:115b-31	mthar thug shes pa yod pa min //	mthar thug shes ba yod ba min 
BO_T11_D4266:115b-32	ma 'ongs pa la mngon sum gyis //	ma ngs ba la mngon sum gyis 
BO_T11_D4266:115b-33	nus pa cung zad kyang ma mthong //	nus ba cung zad kyang ma mthong 
BO_T11_D4266:115b-34	rtags sogs rnams ni med pas ni //	rtags sogs rnams ni med ba ni 
BO_T11_D4266:115b-35	rjes dpag la sogs skyes mi 'gyur //	rjes dpog la sogs skye mi gyur 
BO_T11_D4266:115b-36	de phyir dbang 'das don rnams la //	de phyir dbang da don rnams la 
