segmentnr	original	stemmed
BO_T02_D2329:269b-0	@269b # // rgya gar skad du /	rgya gar skad du 
BO_T02_D2329:269b-1	manydzu shr'i kro dha s'a dha nam /	manydzu shr kro dha sa dha nam 
BO_T02_D2329:269b-2	bod skad du /	bod skad du 
BO_T02_D2329:269b-3	'jam dpal khro bor sgrub pa /	jam dpal khro bor sgrub ba 
BO_T02_D2329:269b-4	smra ba'i seng ge la phyag 'tshal lo //	smra ba seng ge la phyag tshal lo 
BO_T02_D2329:269b-5	dpal ldan khro bo gshin rje gshed //	dpal ldan khro bo gshin rje gshed 
BO_T02_D2329:269b-6	khro rgyal gtso la rab 'dud nas //	khro rgyal gtso la rab dud nas 
BO_T02_D2329:269b-7	de yi zab mo sgrub pa'i thabs //	de yi zab mo sgrub ba thabs 
BO_T02_D2329:269b-8	sgyu 'phrul dra ba'i tshul du bri //	sgyu phrul dra ba tshul du bri 
BO_T02_D2329:269b-9	de la 'jam dpal gshin rje sgrub par 'dod pa'i rnal 'byor pas dur khrod la sogs pa yid dang rjes su mthun par gnas su stan bde ba la 'dug ster rang gi snying gar nyi ma'i dkyil 'khro bsgom /	de la jam dpal gshin rje sgrub ba dod ba rnal byor ba dur khrod la sogs ba yid dang rjes su mthun ba gnas su stan bde ba la dug ster rang gi snying gar nyi ma dkyil khro bsgom 
BO_T02_D2329:269b-10	de'i dbus su h'um mthing nag rab tu 'bar ba bsgom /	de dbus su hum mthing nag rab tu bar ba bsgom 
BO_T02_D2329:269b-11	de las 'od 'phros pas bar chad thams cad srung zhing bde bar gshegs pa rnams kyi thugs dam bskur te /	de las d phro ba ba chad thams cad srung zhing bde ba gshegs ba rnams kyi thugs dam skur te 
BO_T02_D2329:269b-12	sangs rgyas dang byang chub sems dpa' thams cad mdun gyi nam mkha' la spyan drangs la /	sangs rgya dang byang chub sems dpa thams cad mdun gyi nam mkha la spyan drangs la 
BO_T02_D2329:269b-13	yan lag bdun pa bya zhing tshad med pa bzhi bsgoms te de ni sbod nams kyi tshogs bsag go //	yan lag bdun ba byed zhing tshad med ba bzhi sgom te de ni sbod nams kyi tshogs bsag go 
BO_T02_D2329:269b-14	de nas aom sarba dharm'a bh'a ba sva bh'a wa shuddho&amp; ham /	de nas aom sarba dharma bha ba sva bha wa shuddho&amp; ham 
BO_T02_D2329:269b-15	zhes pas chos thams cad nam mkha' lta bur bsgom //	zhes ba chos thams cad nam mkha lta bur bsgom 
BO_T02_D2329:270a-0	de'i ngang @270a * //	de ngang 
BO_T02_D2329:270a-1	las rang gi rig pa h'um mthing nag rab tu 'bar bar bsgom /	las rang gi rig ba hum mthing nag rab tu bar ba bsgom 
BO_T02_D2329:270a-2	de gyur pa las rdo rje khro bo h'um gis mtshan par bsam /	de gyur ba las rdo rje khro bo hum gis mtshan ba bsam 
BO_T02_D2329:270a-3	de las byung ba'i bcom ldan 'das 'jam dpal gshin rje gshed mthing nag zhal gcig pa spyan gsum pa /	de las byung ba joms ldan da jam dpal gshin rje gshed mthing nag zhal gcig ba spyan gsum ba 
BO_T02_D2329:270a-4	khro gnyer dpral bar bsdus pa /	khro gnyer dpral ba sdud ba 
BO_T02_D2329:270a-5	mche ba gtsigs shing skra gyen du brdzes pa /	mche ba gtsigs shing skra gyen du brdzes ba 
BO_T02_D2329:270a-6	phyag g-yas kyis ral gri rdo rje'i yu ba can bzung ba /	phyag g-yas kyis ral gri rdo rje yu ba can bzung ba 
BO_T02_D2329:270a-7	g-yon sdigs mdzub autpalas mtshan pa /	g-yon sdigs mdzub autpalas mtshan ba 
BO_T02_D2329:270a-8	gcer bu dur khrod kyi rgyan gyis brgyan pa /	bcer bu dur khrod kyi rgyan gyis rgyan ba 
BO_T02_D2329:270a-9	yum rdo rje phag mo dang rol zhing ye shes kyi me 'bar ba /	yum rdo rje phag mo dang rol zhing ye shes kyi me bar ba 
BO_T02_D2329:270a-10	ma he gdan du bting nas las kyi gshin rje 'dul bar bsgom /	ma he gdan du bting nas las kyi gshin rje dul ba bsgom 
BO_T02_D2329:270a-11	de'i thugs ka nas h'um las 'od 'phros pas de lta bu'i ye shes sems dpa' spyan drangs la phyag dang mchod pa dbul te /	de thugs ka nas hum las d phro ba de lta bu ye shes sems dpa spyan drangs la phyag dang mchod ba bul te 
BO_T02_D2329:270a-12	aom badzra pushpe h'um /	aom badzra pushpe hum 
BO_T02_D2329:270a-13	h'u pe h'um /	hu pe hum 
BO_T02_D2329:270a-14	d'i pe h'um /	d pe hum 
BO_T02_D2329:270a-15	gandhe h'um / ni ri te h'um /	gandhe hum ni ri te hum 
BO_T02_D2329:270a-16	nee bi dhye h'um /	nee bi dhye hum 
BO_T02_D2329:270a-17	ni bi dye h'um /	ni bi dye hum 
BO_T02_D2329:270a-18	shabda h'um // zhes mchod pa dbul gtor ma gtang ngo //	shabda hum zhes mchod ba bul thor ma gtong ngo 
BO_T02_D2329:270a-19	gtor snod mi dmigs pa las rin po che'i snod du bsam /	thor snod mi dmigs ba las rin po che snod du bsam 
BO_T02_D2329:270a-20	h'um zhes brjod pas bdud rtsir bsam ;	hum zhes rjod ba bdud rtsir bsam 
BO_T02_D2329:270a-21	'dod pa'i don la gsol ba gdab par bya'o //	dod ba don la gsol ba gdab ba byed 
BO_T02_D2329:270a-22	dza:h'um bam ho:sa dgug gzhug la sogs pa bya zhing /	dza:hum bam ho:sa gugs jug la sogs ba byed zhing 
BO_T02_D2329:270a-23	yi ge gsum gyis sku gsung thugs byin gyis brlabs /	yi ge gsum gyis sku gsung thugs byin gyis brlabs 
BO_T02_D2329:270a-24	dbang bskur / mi skyo bar du bsgom /	dbang skur mi skyo ba du bsgom 
BO_T02_D2329:270a-25	de nas bzlas pa'i sngags 'di yin te /	de nas bzlas ba sngags di yin te 
BO_T02_D2329:270a-26	a'om hr'i:shtri: bi kri t'a na na h'um h'um phat phat sv'a h'a /	am hr:shtri: bi kri ta na na hum hum phat phat sva ha 
BO_T02_D2329:270a-27	zhes nam mkha'i dkyil nas thog babs pa ltar shin tu drag par bzlas so //	zhes nam mkha dkyil nas thogs bab ba ltar shin tu drag ba bzlas so 
BO_T02_D2329:270a-28	de nas sgyu ma lta bu'i rang bzhin 'od gsal ba /	de nas sgyu ma lta bu rang bzhin d gsal ba 
BO_T02_D2329:270a-29	zung du 'jug pa //	zung du jug ba 
BO_T02_D2329:270a-30	rdo rje'i bzlas pa sems de la gtad pa'o //	rdo rje bzlas ba sems de la gtod ba 
BO_T02_D2329:270a-31	nag po thugs kyi dpal be'u nas //	nag po thugs kyi dpal beu nas 
BO_T02_D2329:270a-32	zab mo bdud rtsi'i bcud thigs pas //	zab mo bdud rtsi bcud thigs ba 
BO_T02_D2329:270a-33	skal ldan rin chen lta bu yi //	skal ldan rin chen lta bu yi 
BO_T02_D2329:270a-34	'jam dpal gshin rje grub par shog /'jam dpal khor bor sgrub pa rje btsun ka ma la sh'i las mdzad pa rdzogs so//	jam dpal gshin rje grub ba shog dpal khor bor sgrub ba rje btsun ka ma la sh las mdzad ba rdzogs 
