segmentnr	original	folio	stemmed
BO_T11_D4229:149b-13	'di'i bdag nyid ni 'jog par byed pa gzhan yin par ni rigs pa ma yin no zhes bshad zin pa yin no //	149b	di bdag nyid ni jog ba byed ba gzhan yin ba ni rigs ba ma yin no zhes chad zin ba yin no 
BO_T11_D4229:149b-14	de lta na yang gal te bde ba la sogs pa'i rang bzhin 'dzin pa'i rnam par gyur pa ni phyi rol gyis byas pa ma yin te /	149b	de lta na yang gal te bde ba la sogs ba rang bzhin dzin ba rnam ba gyur ba ni phyi rol gyis byed ba ma yin te 
BO_T11_D4229:149b-15	gzung ba'i rnam par rtog pa'i rang bzhin de nyid phyi rol gyis byas pa yin no //	149b	gzung ba rnam ba rtogs ba rang bzhin de nyid phyi rol gyis byed ba yin no 
BO_T11_D4229:149b-16	'di la tshad ma ni nyams su myong ba yin te /	149b	di la tshad ma ni nyams su myong ba yin te 
BO_T11_D4229:149b-17	gang gi phyir gzung ba'i rnam pa bde ba'am sdug bsngal bar nges pa ni 'ga' yang med kyi /	149b	gang gi phyir gzung ba rnam ba bde ba sdug sngal ba nges ba ni ga yang med kyi 
BO_T11_D4229:149b-18	'on kyang gzung ba'i rnam pa las rnam par chad pa nyid du gzung ba'i rnam pa'i 'dzin pa bdag tu 'dzin pa'i gzhi nyid bde ba dang sdug bsngal bar mthong ngo //	149b	n kyang gzung ba rnam ba las rnam ba chad ba nyid du gzung ba rnam ba dzin ba bdag tu dzin ba gzhi nyid bde ba dang sdug sngal ba mthong ngo 
BO_T11_D4229:150a-0	'di yang skabs ji lta ba bzhin du rab tu byed pa 'di nyid du 'chad par 'gyur @150a * //	150a	di yang skabs ji lta ba bzhin du rab tu byed ba di nyid du chad ba gyur 
BO_T11_D4229:150a-1	ro ; / des na ji ltar slob dpon gyis bde ba la sogs pa phyi rol gyis byas pa ma yin par dgongs nas bshad pa dang / ji ltar nyams su myong ba bzhin du 'dod pa dang mi 'dod pa ni 'dzin pa'i rnam par rtog pa yin gyi gzung ba'i rnam par rtog pa ni ma yin no //	150a	ro des na ji ltar slob dpon gyis bde ba la sogs ba phyi rol gyis byed ba ma yin ba dgongs nas chad ba dang ji ltar nyams su myong ba bzhin du dod ba dang mi dod ba ni dzin ba rnam ba rtogs ba yin gyi gzung ba rnam ba rtogs ba ni ma yin no 
BO_T11_D4229:150a-2	'dir 'dod par bya ba 'dod par bzhed pa ni ma yin te /	150a	dir dod ba byed ba dod ba bzhed ba ni ma yin te 
BO_T11_D4229:150a-3	'dod pa ni rnam par rtog pa'i bdag nyid yin pa'i phyir dang / dbang po'i shes par rtogs pa'i 'dod pa la sogs pa sems pa'i phyir te /	150a	dod ba ni rnam ba rtogs ba bdag nyid yin ba phyir dang dbang po shes ba rtogs ba dod ba la sogs ba sems ba phyir te 
BO_T11_D4229:150a-4	ji ltar dbang po ba nyid kyi bde ba zhes bya ba lta bu'o //	150a	ji ltar dbang po ba nyid kyi bde ba zhes byed ba lta bu 
BO_T11_D4229:150a-5	sim par bya ba nyams su myong ba yang dbang po'i rnam par shes par gyur pa nyid yin gyi mngon par 'dod pa ni ma yin no //	150a	sim ba byed ba nyams su myong ba yang dbang po rnam ba shes ba gyur ba nyid yin gyi mngon ba dod ba ni ma yin no 
BO_T11_D4229:150a-6	gang gi phyir dngos po tha dad pa med kyang de tha dad pa'i phyir myong ba ji lta ba bzhin tha dad par rnam par gzhag pa 'dzin pa'i rnam par gyur pa'i rang bzhin ni don dang 'dra ba ma yin gyi /	150a	gang gi phyir dngos po tha dad ba med kyang de tha dad ba phyir myong ba ji lta ba bzhin tha dad ba rnam ba jog ba dzin ba rnam ba gyur ba rang bzhin ni don dang dra ba ma yin gyi 
BO_T11_D4229:150a-7	'on kyang don dang 'dra ba ni gzung ba'i rnam pa'i rang bzhin yin pas /	150a	n kyang don dang dra ba ni gzung ba rnam ba rang bzhin yin ba 
BO_T11_D4229:150a-8	gal te de nyid dngos po tha dad pa med pa la yang tha dad pa ma 'gyur na ni don rnam par gzhag pa myong myong ba la rag las kyi dngos po la ltos pa ni ma yin par 'gyur ro //	150a	gal te de nyid dngos po tha dad ba med ba la yang tha dad ba ma gyur na ni don rnam ba jog ba myong myong ba la rag las kyi dngos po la ltos ba ni ma yin ba gyur ro 
BO_T11_D4229:150a-9	'di skad du 'dzin pa'i rnam pas bsdus pa'i 'dod pa'am mi 'dod pa dang 'dra ba dngos po ma yin du chug kyang dngos po'i rgyu can du ni 'gyur ba kho nas so //	150a	di skad du dzin ba rnam ba sdud ba dod ba mi dod ba dang dra ba dngos po ma yin du chug kyang dngos po rgyu can du ni gyur ba kho nas so 
BO_T11_D4229:150a-10	dngos po gcig las ni grang ba dang tsha ba bzhin du phan tshun 'gal ba'i rang bzhin gyi 'bras bu mi 'byung ba'i phyir ro zhes tha dad pa yin no //	150a	dngos po gcig las ni grang ba dang tsha ba bzhin du phan tshun gal ba rang bzhin gyi bras bu mi byung ba phyir ro zhes tha dad ba yin no 
BO_T11_D4229:150a-11	gang gi phyir rang rig pa ji lta ba bzhin don rnam pa bar len pa las byung ba tha dad pa 'gal ba yin gyi ;	150a	gang gi phyir rang rig ba ji lta ba bzhin don rnam ba ba len ba las byung ba tha dad ba gal ba yin gyi 
BO_T11_D4229:150a-12	lhan cig byed pa'i rgyu 'bras bu du ma byed pa ni /	150a	lhan cig byed ba rgyu bras bu du ma byed ba ni 
BO_T11_D4229:150a-13	'gal ba yod pa ma yin te /	150a	gal ba yod ba ma yin te 
BO_T11_D4229:150a-14	rnam 'grel las /	150a	rnam grel las 
BO_T11_D4229:150a-15	nyer len shes pa nang na ni //	150a	nyer len shes ba nang na ni 
BO_T11_D4229:150a-16	yod kyang sdug bsngal la sogs 'byung //	150a	yod kyang sdug sngal la sogs byung 
BO_T11_D4229:150a-17	zhes bshad do //	150a	zhes chad do 
BO_T11_D4229:150a-18	'dis ni bde ba la sogs pa ni mtshungs pa de ma thag pa'i nang du gtogs pa sngon goms pa la sogs pa'i rgyu can du brjod pa yin no //	150a	dis ni bde ba la sogs ba ni mtshungs ba de ma thag ba nang du gtogs ba sngon goms ba la sogs ba rgyu can du rjod ba yin no 
BO_T11_D4229:150a-19	de las kyang bde ba la sogs pa mtshungs pa de ma thag pa'i rkyen sngon goms pa la sogs pa sad par byed pa'i rkyen la ltos pa can rgyu tha dad pa las skye ba na lhan cig byed pa gcig la ltos pa mi 'gal lo //	150a	de las kyang bde ba la sogs ba mtshungs ba de ma thag ba rkyen sngon goms ba la sogs ba sad ba byed ba rkyen la ltos ba can rgyu tha dad ba las skye ba na lhan cig byed ba gcig la ltos ba mi gal lo 
BO_T11_D4229:150b-0	'di ltar skye ba de nyid la ma goms pa'i @150b khar ro kha mo bcug ma thag tu bzhin gyi rnam par 'gyur ba las rjes su dpag pas dbang po'i sdug bsngal bskyed par mthong la /	150b	di ltar skye ba de nyid la ma goms ba khar ro kha mo jug ma thag tu bzhin gyi rnam ba gyur ba las rjes su dpog ba dbang po sdug sngal skyed ba mthong la 
BO_T11_D4229:150b-1	phyis goms pa las bzhin gsal ba las rjes su dpag pas sdug bsngal log nas bde ba nyid byed par mthong ba yin no //	150b	byid goms ba las bzhin gsal ba las rjes su dpog ba sdug sngal log nas bde ba nyid byed ba mthong ba yin no 
BO_T11_D4229:150b-2	de bzhin du skye ba gzhan du goms pa'am /	150b	de bzhin du skye ba gzhan du goms ba 
BO_T11_D4229:150b-3	skye ba 'di la goms pa las kyang bde ba la sogs pa rgyud so so la tha dad pa skye ba na don gcig nye bar len pa'i rgyu'i lhan cig byed par 'gyur ba yin no //	150b	skye ba di la goms ba las kyang bde ba la sogs ba brgyud so so la tha dad ba skye ba na don gcig nye ba len ba rgyu lhan cig byed ba gyur ba yin no 
BO_T11_D4229:150b-4	de'i phyir bshad pa 'di nyid yin te /	150b	de phyir chad ba di nyid yin te 
BO_T11_D4229:150b-5	gang gi phyir phyi rol gyi don rtogs par byed pa mang po rnams kyis rang gi rnam pa'i dbang gis bde ba'i rgyu dang sdug bsngal gyi rgyur nges par 'gyur ba dang / don de yang ma nges pa'i phyir myong ba ji lta ba bzhin don rnam par gnas pa yin no //	150b	gang gi phyir phyi rol gyi don rtogs ba byed ba mang po rnams kyis rang gi rnam ba dbang gis bde ba rgyu dang sdug sngal gyi rgyur nges ba gyur ba dang don de yang ma nges ba phyir myong ba ji lta ba bzhin don rnam ba gnas ba yin no 
BO_T11_D4229:150b-6	'dir 'thad pa 'dis phyi rol gyi don bzlog par 'dod pa ni ma yin gyi /	150b	dir thad ba dis phyi rol gyi don bzlog ba dod ba ni ma yin gyi 
BO_T11_D4229:150b-7	'on kyang phyi rol gyi don yod kyang rang rig pa nyid 'bras bur rigs kyi don rig pa ni ma yin no //	150b	n kyang phyi rol gyi don yod kyang rang rig ba nyid bras bur rigs kyi don rig ba ni ma yin no 
BO_T11_D4229:150b-8	'di ltar phyi rol gyi don tshul la don ni gzhal bya /	150b	di ltar phyi rol gyi don tshul la don ni jal byed 
BO_T11_D4229:150b-9	gzung ba'i rnam pa tshad ma /	150b	gzung ba rnam ba tshad ma 
BO_T11_D4229:150b-10	don rig pa ni 'bras bu yin la /	150b	don rig ba ni bras bu yin la 
BO_T11_D4229:150b-11	rnam par shes par smra ba la ni bdag nyid gzhal bya /	150b	rnam ba shes ba smra ba la ni bdag nyid jal byed 
BO_T11_D4229:150b-12	'dzin pa'i rnam pa ni tshad ma /	150b	dzin ba rnam ba ni tshad ma 
BO_T11_D4229:150b-13	bdag nyid rig pa ni 'bras bu yin no //	150b	bdag nyid rig ba ni bras bu yin no 
BO_T11_D4229:150b-14	yang phyi rol gyi don gyi tshul la 'bras bu rnam par gzhag pa gnyis pa don ni gzhal bya /	150b	yang phyi rol gyi don gyi tshul la bras bu rnam ba jog ba gnyis ba don ni jal byed 
BO_T11_D4229:150b-15	gzung ba'i rnam pa tshad ma /	150b	gzung ba rnam ba tshad ma 
BO_T11_D4229:150b-16	rang rig pa ni 'bras bu'o zhes 'di na 'bras bu 'di ltar rnam par gzhag pa'i 'thad pa yin no //	150b	rang rig ba ni bras bu zhes di na bras bu di ltar rnam ba jog ba thad ba yin no 
BO_T11_D4229:150b-17	gang gi phyir rang rig pa ji lta ba bzhin don rnam par 'jog pa de'i phyir rol gyi don yod kyang 'bras bu ni rang rig pa yin no //	150b	gang gi phyir rang rig ba ji lta ba bzhin don rnam ba jog ba de phyir rol gyi don yod kyang bras bu ni rang rig ba yin no 
BO_T11_D4229:150b-18	gal te 'o na rang rig pa 'bras bu yin la de ltar na tshad ma 'dzin pa'i rnam pa yin no zhe na /	150b	gal te mang na rang rig ba bras bu yin la de ltar na tshad ma dzin ba rnam ba yin no zhe na 
BO_T11_D4229:150b-19	bshad pa / rang rig pa'i rang bzhin du gyur pa don rtogs pa 'di'i sgrub par byed pa ste /	150b	chad ba rang rig ba rang bzhin du gyur ba don rtogs ba di sgrub ba byed ba ste 
BO_T11_D4229:150b-20	tshad ma ni 'di'i yul lta bu'i rnam pa ste /	150b	tshad ma ni di yul lta bu rnam ba ste 
BO_T11_D4229:150b-21	yul gyi rnam pa nyid yin no //	150b	yul gyi rnam ba nyid yin no 
BO_T11_D4229:150b-22	'dzin pa'i rnam pa ji ltar nyams su myong ba de ltar don nyams su myong bar rnam par 'jog pa ma yin nam /	150b	dzin ba rnam ba ji ltar nyams su myong ba de ltar don nyams su myong ba rnam ba jog ba ma yin nam 
BO_T11_D4229:150b-23	des na 'dzin pa'i rnam pa nyid tshad mar rigs so zhe na /	150b	des na dzin ba rnam ba nyid tshad mar rigs so zhe na 
BO_T11_D4229:150b-24	bden te rang nyid kyi yul la 'dzin pa'i rnam pa'i rjes su 'brangs te yul rnam par 'jog na ni 'gyur ro //	150b	bden te rang nyid kyi yul la dzin ba rnam ba rjes su brang te yul rnam ba jog na ni gyur ro 
BO_T11_D4229:151a-0	@151a * // yang gang gi tsha phyi rol gyi don yul yin pa de'i tshe phyi rol gyi don khong du chud pa'i rgyu mtshan gang yin pa de nyid tshad ma yin la /	151a	yang gang gi tsha phyi rol gyi don yul yin ba de tshe phyi rol gyi don khong du chud ba rgyu mtshan gang yin ba de nyid tshad ma yin la 
BO_T11_D4229:151a-1	rgyu mtshan yang sngon po'i rnam pa yin no //	151a	rgyu mtshan yang sngon po rnam ba yin no 
BO_T11_D4229:151a-2	'di nyid bshad pa'i phyir gsungs pa ni rnam pa ji lta ba bzhin du rnam pa las ma 'das par rang rig pa 'di snang ba bsal ba'i phyir ro //	151a	di nyid chad ba phyir gsungs ba ni rnam ba ji lta ba bzhin du rnam ba las ma da ba rang rig ba di snang ba bsal ba phyir ro 
BO_T11_D4229:151a-3	'di skad brjod pa yin te /	151a	di skad rjod ba yin te 
BO_T11_D4229:151a-4	gal te sngon po'i rnam pa snang na ni de'i tshe 'dod pa'i rnam pa can gyi myong ba 'di sngon po'i yul can du brtags pa yin te /	151a	gal te sngon po rnam ba snang na ni de tshe dod ba rnam ba can gyi myong ba di sngon po yul can du rtog ba yin te 
BO_T11_D4229:151a-5	de bzhin du rnam pa gzhan la yang sbyar ro //	151a	de bzhin du rnam ba gzhan la yang sbyor ro 
BO_T11_D4229:151a-6	de'i phyir shes pa rnam pa dang bcas pa la 'dod pa la sogs pa'i rang bzhin nyams su myong ba'i gzung ba'i rnam pa'i dbang gis don gyi yul can du rnam par 'jog pa yin pa des na de nyid tshad ma yin no //	151a	de phyir shes ba rnam ba dang cha ba la dod ba la sogs ba rang bzhin nyams su myong ba gzung ba rnam ba dbang gis don gyi yul can du rnam ba jog ba yin ba des na de nyid tshad ma yin no 
BO_T11_D4229:151a-7	gal te 'o na phyi rol la rang rig pa nyid 'bras bu yin na'o na ji ltar 'bras bu rnam par gzhag par don rig par 'bras bu yin par brjod ce na /	151a	gal te mang na phyi rol la rang rig ba nyid bras bu yin na na ji ltar bras bu rnam ba jog ba don rig ba bras bu yin ba rjod ce na 
BO_T11_D4229:151a-8	bshad pa / rang rig pa yin yang 'bras bu las te /	151a	chad ba rang rig ba yin yang bras bu las te 
BO_T11_D4229:151a-9	zhen pa las 'di ni don rig pa yin par blta'o //	151a	zhen ba las di ni don rig ba yin ba lta 
BO_T11_D4229:151a-10	rig pa ni ji ltar lhag par zhen pa /	151a	rig ba ni ji ltar lhag ba zhen ba 
BO_T11_D4229:151a-11	de ltar 'bras bu brjod pa yin la /	151a	de ltar bras bu rjod ba yin la 
BO_T11_D4229:151a-12	don dang 'brel par yang zhen pa de'i phyir don rig pa nyid 'bras bu yin no //	151a	don dang brel ba yang zhen ba de phyir don rig ba nyid bras bu yin no 
BO_T11_D4229:151a-13	'o na ji ltar rang rig pa yin zhe na /	151a	mang na ji ltar rang rig ba yin zhe na 
BO_T11_D4229:151a-14	bshad pa / don gnas pa yul rnam par gzhag pa gang yin pa ni rang rig pa'i rang bzhin yin te /	151a	chad ba don gnas ba yul rnam ba jog ba gang yin ba ni rang rig ba rang bzhin yin te 
BO_T11_D4229:151a-15	don rnam par gnas pa ni myong ba'i rang bzhin yin pa'i phyir ro //	151a	don rnam ba gnas ba ni myong ba rang bzhin yin ba phyir ro 
BO_T11_D4229:151a-16	'di ltar ji ltar gzung ba'i rnam pa dkar po dang dkar po ma yin pa la sogs pa nyams su myong ba dang / de bzhin du 'dzin pa'i rnam pa bde ba dang sdug bsngal ba ci 'dra ba yang dag par rig pa de ltar sngon po'am sngon po ma yin pa bde ba la sogs pa'i rgyur rnam par 'jog cing rig pa de'i phyir don rig pa ni rang rig pa'i	151a	di ltar ji ltar gzung ba rnam ba dkar po dang dkar po ma yin ba la sogs ba nyams su myong ba dang de bzhin du dzin ba rnam ba bde ba dang sdug sngal ba ci dra ba yang dag ba rig ba de ltar sngon po sngon po ma yin ba bde ba la sogs ba rgyur rnam ba jog cing rig ba de phyir don rig ba ni rang rig ba 
BO_T11_D4229:151a-17	ngo bo yin no //	151a	ngo bo yin no 
BO_T11_D4229:151a-18	de'i phyir de ltar tha snyad kyi 'bras bu'i dbang gis rang rig pa yin yang don rig par brjod pa yin no //	151a	de phyir de ltar tha snyad kyi bras bu dbang gis rang rig ba yin yang don rig ba rjod ba yin no 
BO_T11_D4229:151a-19	de nyid kyi phyir te yul nyid tshad ma'i bya ba yin pa dang / de nyid kyi rig pa 'bras bu yin pa de'i phyir tshad ma dang 'bras bu dag yul tha dad pa yang ma yin no //	151a	de nyid kyi phyir te yul nyid tshad ma byed ba yin ba dang de nyid kyi rig ba bras bu yin ba de phyir tshad ma dang bras bu dag yul tha dad ba yang ma yin no 
BO_T11_D4229:151a-20	gal te bdag rig pa 'bras bu dang yul gzhal bya yin na ni /	151a	gal te bdag rig ba bras bu dang yul jal byed yin na ni 
BO_T11_D4229:151b-0	de'i tshe tshad ma dang @151b 'bras bu yul tha dad pa kho nar 'gyur ba na /	151b	de tshe tshad ma dang bras bu yul tha dad ba kho nar gyur ba na 
BO_T11_D4229:151b-1	da ltar ni cung zhig kyang tha dad pa yod pa ma yin no //	151b	da ltar ni cung jig kyang tha dad ba yod ba ma yin no 
BO_T11_D4229:151b-2	'o na ji ltar rang rig pa 'bras bur brjod ci na /	151b	mang na ji ltar rang rig ba bras bur rjod ci na 
BO_T11_D4229:151b-3	bshad pa / don rig pa'i rang bzhin gang zhig ces rang bzhin sems pa na ni /	151b	chad ba don rig ba rang bzhin gang jig ces rang bzhin sems ba na ni 
BO_T11_D4229:151b-4	rang nyid rig pa 'bras bur bshad de /	151b	rang nyid rig ba bras bur chad de 
BO_T11_D4229:151b-5	don rig pa ni de'i bdag nyid yin pa'i phyir te /	151b	don rig ba ni de bdag nyid yin ba phyir te 
BO_T11_D4229:151b-6	rang rig pa'i rang bzhin yin pa'i phyir ro //	151b	rang rig ba rang bzhin yin ba phyir ro 
BO_T11_D4229:151b-7	de la skabs kyi don ni 'di yin te /	151b	de la skabs kyi don ni di yin te 
BO_T11_D4229:151b-8	gzung ba'i rnam pa yongs su gcod par snang ba'i 'dzin pa'i rnam pa ni bdag nyid kyi yul can yin pa'i phyir phyi rol gyi don la tshad ma ma yin te /	151b	gzung ba rnam ba yongs su gcod ba snang ba dzin ba rnam ba ni bdag nyid kyi yul can yin ba phyir phyi rol gyi don la tshad ma ma yin te 
BO_T11_D4229:151b-9	rnam 'grel las /	151b	rnam grel las 
BO_T11_D4229:151b-10	'dzin pa'i bdag nyid ni yongs su zin kyang don gzhan ma yin pa'i phyir /	151b	dzin ba bdag nyid ni yongs su zin kyang don gzhan ma yin ba phyir 
BO_T11_D4229:151b-11	phyi rol gyi don rnams la ltos pa ma yin no zhes bshad do //	151b	phyi rol gyi don rnams la ltos ba ma yin no zhes chad do 
BO_T11_D4229:151b-12	gzung ba'i rnam pa ni phyi rol tshad ma yin te /	151b	gzung ba rnam ba ni phyi rol tshad ma yin te 
BO_T11_D4229:151b-13	de nyid ni ji ltar rigs pa de ltar don rig par 'gyur ba yin no //	151b	de nyid ni ji ltar rigs ba de ltar don rig ba gyur ba yin no 
BO_T11_D4229:151b-14	phyi rol gyi don rig pa ni gzhan la gzung ba'i rnam pa rig pa yang gzhan nyid ni ma yin te /	151b	phyi rol gyi don rig ba ni gzhan la gzung ba rnam ba rig ba yang gzhan nyid ni ma yin te 
BO_T11_D4229:151b-15	phyi rol gyi don ni rang gi ngo bos mthong ba ma yin pa'i phyir ro //	151b	phyi rol gyi don ni rang gi ngo bod mthong ba ma yin ba phyir ro 
BO_T11_D4229:151b-16	de'i phyir bdag rig pa don rig par ston pa'i gzung ba'i rnam pa de nyid don la tshad ma yin la /	151b	de phyir bdag rig ba don rig ba ston ba gzung ba rnam ba de nyid don la tshad ma yin la 
BO_T11_D4229:151b-17	rang rig pa yin yang don rig pa'i rang bzhin du lhag par zhen pa na zhen pa'i 'bras bu'i dbang gis don rig par brjod pa yin no //	151b	rang rig ba yin yang don rig ba rang bzhin du lhag ba zhen ba na zhen ba bras bu dbang gis don rig ba rjod ba yin no 
BO_T11_D4229:151b-18	des na tshad ma dang 'bras bu dag yul tha mi dad do //	151b	des na tshad ma dang bras bu dag yul tha mi dad do 
BO_T11_D4229:151b-19	gang gi phyir gzung ba'i rnam pa'i dbang gis de dang de'i rig par gnas pa des na yul tha dad pa ma yin no //	151b	gang gi phyir gzung ba rnam ba dbang gis de dang de rig ba gnas ba des na yul tha dad ba ma yin no 
BO_T11_D4229:151b-20	gal te don yod kyang rnam pa dang bcas pa'i phyogs la rang gi ngo bo nyid kyis phyi rol gyi don la snang ba ni ma yin gyi /	151b	gal te don yod kyang rnam ba dang cha ba phyogs la rang gi ngo bo nyid kyis phyi rol gyi don la snang ba ni ma yin gyi 
BO_T11_D4229:151b-21	'on kyang nyams su myong ba'i dbang gis sngon po la sogs pa mthong ba dang / bde ba la sogs pa'i rgyu nyid rnam par gnas pa yin na /	151b	n kyang nyams su myong ba dbang gis sngon po la sogs ba mthong ba dang bde ba la sogs ba rgyu nyid rnam ba gnas ba yin na 
BO_T11_D4229:151b-22	'o na ni phyi rol gyi don du smra ba rnams 'dra ba'i skyed par byed pa gzhal byar 'dod par mi 'gyur gyi /	151b	mang na ni phyi rol gyi don du smra ba rnams dra ba skyed ba byed ba jal byar dod ba mi gyur gyi 
BO_T11_D4229:151b-23	'on kyang de dang 'bras bu'am gzhan 'dra yang rung sta /	151b	n kyang de dang bras bu gzhan dra yang rung sta 
BO_T11_D4229:151b-24	'dra ba'am mi 'dra yang bla /	151b	dra ba mi dra yang bla 
BO_T11_D4229:151b-25	de ltar zhes bya ba sngon po la sogs pa gzung ba'i rnam pa dang / bde ba la sogs pa 'dzin pa'i rnam par rab tu snang ba ste /	151b	de ltar zhes byed ba sngon po la sogs ba gzung ba rnam ba dang bde ba la sogs ba dzin ba rnam ba rab tu snang ba ste 
BO_T11_D4229:151b-26	gsal ba'i shes pa'i rgyu gang gi phyir don yang yin no //	151b	gsal ba shes ba rgyu gang gi phyir don yang yin no 
BO_T11_D4229:152a-0	yin pas @152a * //	152a	yin ba 
BO_T11_D4229:152a-1	na zhes bya ba ni de'i phyir zhes bya ba'i don to //	152a	na zhes byed ba ni de phyir zhes byed ba don to 
BO_T11_D4229:152a-2	gang gi phyir don rgyu yin pa de'i phyir don de gzhal bya yin par 'dod par 'gyur ro //	152a	gang gi phyir don rgyu yin ba de phyir don de jal byed yin ba dod ba gyur ro 
BO_T11_D4229:152a-3	dgongs pa ni 'di yin te /	152a	dgongs ba ni di yin te 
BO_T11_D4229:152a-4	'dra bar nges pa ni gnyi ga mthong ba la rag las ba yin la /	152a	dra ba nges ba ni gnyi ga mthong ba la rag las ba yin la 
BO_T11_D4229:152a-5	rnam pa dang bcas pa'i phyogs la don ni sngar gang gis kyang mthong ba ma yin na /	152a	rnam ba dang cha ba phyogs la don ni sngar gang gis kyang mthong ba ma yin na 
BO_T11_D4229:152a-6	de ci 'dra bar brtag / rang nyid kyis kyang ji ltar nyams su myong ba de'i bdag nyid ma yin yang bde ba la sogs pa'i rgyu nyid du nges par 'dod pa des na 'dra ba ma yin no //	152a	de ci dra ba rtog rang nyid kyis kyang ji ltar nyams su myong ba de bdag nyid ma yin yang bde ba la sogs ba rgyu nyid du nges ba dod ba des na dra ba ma yin no 
BO_T11_D4229:152a-7	cig shos logs na gnas pas phyi rol gyi don du smra ba la yul 'di lta bu nyid yin na ha cang thal bar mthong nas slob dpon la smras pa /	152a	cig shos logs na gnas ba phyi rol gyi don du smra ba la yul di lta bu nyid yin na ha cang thal ba mthong nas slob dpon la smras ba 
BO_T11_D4229:152a-8	ji ltar rnam pa 'ga' zhig ltar te /	152a	ji ltar rnam ba ga jig ltar te 
BO_T11_D4229:152a-9	rgyu 'ga' zhig las don dngos te 'dra ba spangs nas sngon po'i rnam par snang na ji ltar don 'dzin /	152a	rgyu ga jig las don dngos te dra ba spong nas sngon po rnam ba snang na ji ltar don dzin 
BO_T11_D4229:152a-10	shes pa de las skyes pa dang de dang 'dra ba las ni don 'dzin par 'gyur ba yin na /	152a	shes ba de las skye ba dang de dang dra ba las ni don dzin ba gyur ba yin na 
BO_T11_D4229:152a-11	skyed par byed pa tsam ni yul du srid pa ma yin te /	152a	skyed ba byed ba tsam ni yul du srid ba ma yin te 
BO_T11_D4229:152a-12	ha cang thal bar 'gyur ba'i phyir ro zhe na /	152a	ha cang thal ba gyur ba phyir ro zhe na 
BO_T11_D4229:152a-13	de nyid slob dpon gyis gsungs pa /	152a	de nyid slob dpon gyis gsungs ba 
BO_T11_D4229:152a-14	ngas kyang de 'dra ba'i yul ni mi shes so //	152a	ngas kyang de dra ba yul ni mi shes so 
BO_T11_D4229:152a-15	phyi'i don du smra ba nyid la 'dri bar bya ba yin te /	152a	phyi don du smra ba nyid la bri ba byed ba yin te 
BO_T11_D4229:152a-16	gang zhig phyi'i don khas len pa de thal ba 'dir 'gyur ro //	152a	gang jig phyi don khas len ba de thal ba dir gyur ro 
BO_T11_D4229:152a-17	gang mi snang ba dang bde ba la sogs pa'i rgyur nges pa'i don dang dbang po'i yul du 'dod pa la yin gyi /	152a	gang mi snang ba dang bde ba la sogs ba rgyur nges ba don dang dbang po yul du dod ba la yin gyi 
BO_T11_D4229:152a-18	kho bo ni da ltar mi 'dod do //	152a	kho bo ni da ltar mi dod do 
BO_T11_D4229:152a-19	tshig le'ur byas par ma brjod pa'i don 'grel pa las bar skabs su tshigs su bcad pa'o //	152a	tshig leur byed ba ma rjod ba don grel ba las ba skabs su tshigs su gcod ba 
BO_T11_D4229:152a-20	gal te phyi rol gyi don med na 'o na tshad ma dang gzhal bya dang 'bras bu rnam par gzhag pa de'i kho na nyid du mi 'gyur ro snyam du bsams nas /	152a	gal te phyi rol gyi don med na mang na tshad ma dang jal byed dang bras bu rnam ba jog ba de kho na nyid du mi gyur ro snyam du bsams nas 
BO_T11_D4229:152a-21	phyi rol gyi don med na'o na zhes bya ba la sogs pa smos so //	152a	phyi rol gyi don med na na zhes byed ba la sogs ba smos so 
BO_T11_D4229:152a-22	'di la bshad zin to zhes bya ba ni /	152a	di la chad zin to zhes byed ba ni 
BO_T11_D4229:152a-23	de ltar 'khrul pas mthong 'gyur ba //	152a	de ltar khrul ba mthong gyur ba 
BO_T11_D4229:152a-24	zhes bya ba 'di'i nang du de kho na nyid las ma 'das par rnam par gzhag pa ni ma yin gyi /	152a	zhes byed ba di nang du de kho na nyid las ma da ba rnam ba jog ba ni ma yin gyi 
BO_T11_D4229:152a-25	'on kyang 'khrul pa las so zhes bya bar ro //	152a	n kyang khrul ba las so zhes byed ba ro 
BO_T11_D4229:152a-26	'di ltar yul lta bu'i rnam pa gang yin pa dang / nang du zhes bya ba bdag tu 'dzin pa'i gzhi ma yin par rnam par chad pa las bdag tu 'dzin pa'i gzhir rnam par chad pa'o //	152a	di ltar yul lta bu rnam ba gang yin ba dang nang du zhes byed ba bdag tu dzin ba gzhi ma yin ba rnam ba chad ba las bdag tu dzin ba gzhir rnam ba chad ba 
BO_T11_D4229:152a-27	'di'i nang du yongs su gcod pa ni yul gyi rnam pa 'dzin pa ste /	152a	di nang du yongs su gcod ba ni yul gyi rnam ba dzin ba ste 
BO_T11_D4229:152b-0	'dis @152b yongs su gcod pa'i phyir ro //	152b	dis yongs su gcod ba phyir ro 
BO_T11_D4229:152b-1	de ni rang rig par bya ba'i rang bzhin du skye ba nyid na de ltar mtshon par 'gyur te 'khrul pa'i phyir ro //	152b	de ni rang rig ba byed ba rang bzhin du skye ba nyid na de ltar mtshon ba gyur te khrul ba phyir ro 
BO_T11_D4229:152b-2	rang rig pa'i rang bzhin gyi shes pa de nyid ni mi bden pa'i gzung ba dang 'dzin pa'i rnam pa rang la med pa kun du ston pa skye'o zhes bya ba'i don to //	152b	rang rig ba rang bzhin gyi shes ba de nyid ni mi bden ba gzung ba dang dzin ba rnam ba rang la med ba kun du ston ba skye zhes byed ba don to 
BO_T11_D4229:152b-3	de ltar gyur pa'i bdag nyid kyi rnam par shes pa de la gzhal bya la sogs pa'i rnam par gzhag pa ni ji ltar 'khrul pas mtshon pa ltar byed pa yin no //	152b	de ltar gyur ba bdag nyid kyi rnam ba shes ba de la jal byed la sogs ba rnam ba jog ba ni ji ltar khrul ba mtshon ba ltar byed ba yin no 
BO_T11_D4229:152b-4	yongs su gcod pa 'dzin pa'i rnam pa'i bdag nyid gzung ba'i cha yongs su gcod par lhag par zhen pa ma yin nam /	152b	yongs su gcod ba dzin ba rnam ba bdag nyid gzung ba cha yongs su gcod ba lhag ba zhen ba ma yin nam 
BO_T11_D4229:152b-5	gzung ba'i cha ni nye bar bslad pa yin gyi /	152b	gzung ba cha ni nye ba bslad ba yin gyi 
BO_T11_D4229:152b-6	bdag nyid ni ma yin no //	152b	bdag nyid ni ma yin no 
BO_T11_D4229:152b-7	des na 'dzin pa'i rnam pa ni de rtogs pa'i tshad ma yin gyi /	152b	des na dzin ba rnam ba ni de rtogs ba tshad ma yin gyi 
BO_T11_D4229:152b-8	bdag nyid la ni ma yin no //	152b	bdag nyid la ni ma yin no 
BO_T11_D4229:152b-9	gang gi phyir des bdag nyid yongs su bcad par nges pa ni med kyi /	152b	gang gi phyir des bdag nyid yongs su gcod ba nges ba ni med kyi 
BO_T11_D4229:152b-10	'on kyang gzung ba'i cha nyid do //	152b	n kyang gzung ba cha nyid do 
