segmentnr	original	stemmed
BO_T17_MW1PD95844_2594:2933	nas mar mdor bstan pa ston te/_bla na med pa'i byang chub sems te/_theg	nas mar mdor ston ba ston na med ba byang chub sems 
BO_T17_MW1PD95844_2594:2934	pa chen po'i gzhung gis yi dam gyi lha'i sku phyag rgya snang stong gnyis su med pa kho na	ba chen po gzhung gis yi dam gyi lha sku phyag rgya snang stong gnyis su med ba kho na 
BO_T17_MW1PD95844_2594:2935	ste/_ngo bo nyid dang lam gong na gzhan med pa'i phyir ro/_/bla ma ni rdo rje	bo nyid dang lam gong na gzhan med ba phyir ma ni rdo rje 
BO_T17_MW1PD95844_2594:2936	slob dpon te/_de la rnam pa lnga ste/_'dren pa dang /_dam tshhig 'bogs	slob dpon la rnam ba lnga ba dang tshhig bogs 
BO_T17_MW1PD95844_2594:2937	shing dbang bskur ba dang /_nyams chag skong ba dang /_shes rgyud 'grol ba	shing dbang skur ba dang chag skong ba dang brgyud grol ba 
BO_T17_MW1PD95844_2594:2938	dang /_man ngag dang lung 'bogs pa'o/_/bkur ba ni sgo gsum zol med pa	dang ngag dang lung bogs ba ni sgo gsum zol med ba 
BO_T17_MW1PD95844_2594:2939	dang /_mnyes par rtshal 'byung ba kho na'o/_/sngags ni gsum mo/_/phyag rgya	dang ba rtshal byung ba kho ni gsum rgya 
BO_T17_MW1PD95844_2594:2940	ni bzhi'o rgyu ni brtshon pa rab 'bring dang /_gom pa che chung gis dus kyi rgyun	ni bzhi rgyu ni brtshon ba rab bring dang ba che chung gis dus kyi rgyun 
BO_T17_MW1PD95844_2594:2941	gsum dang /_skad cig ma'i rgyun du bar mi gcod pa'o/_/yang dag lam du	gsum dang cig ma rgyun du ba mi gcod dag lam du 
BO_T17_MW1PD95844_2594:2942	zhugs la byams zhes bya ba ni/_bskyed rdzogs rnam pa gsum la zhugs pa ni rdo	jug la byams zhes byed ba rdzogs rnam ba gsum la jug ba ni rdo 
BO_T17_MW1PD95844_2594:2943	rje'i spun no/_/de la nye ba dang ring ba dang 'dres pa'o/_/de dag la sgo gsum	rje spun la nye ba dang ring ba dang dre dag la sgo gsum 
BO_T17_MW1PD95844_2594:2944	gyis phan pa'i rtshal 'byin pa ni byams pa'o/_/gsang ba'i don phyir smra mi bya zhes	gyis phan ba rtshal byin ba ni byams ba don phyir smra mi byed zhes 
BO_T17_MW1PD95844_2594:2945	bya ba ni gsang ba ni bcu ste/_spyir gsang bzhi/_bar gsang bzhi/_gsang	byed ba ni gsang ba ni chu gsang gsang 
BO_T17_MW1PD95844_2594:2946	bar 'os pa dang /_gnyer gtad pa'o/_/de dag bdag gi don dang / gzhan gyi don dang /_chos kyi don dang /_grogs po'i don bzhi po kho nar	ba s ba dang gtod dag bdag gi don dang gzhan gyi don dang kyi don dang po don bzhi po kho nar 
BO_T17_MW1PD95844_2594:2947	gyur par bya ba'i phyir/_dam med pa dang /_dam nyams pa dang /_dam ma	gyur ba byed ba med ba dang nyams ba dang ma 
BO_T17_MW1PD95844_2594:2948	'dres pa dang 'dres pa dag la yang /_skabs kyis gsang ba ste/_tshhig dang spyod lam yan chod kyis sba ba kho na'o/_/'di ni rtsha ba lnga rnams te zhes bya ba ni/	dre ba dang dre ba dag la yang kyis gsang ba dang spyod lam yan chod kyis sbed ba kho ni rtsha ba lnga rnams te zhes byed ba 
BO_T17_MW1PD95844_2594:2949	lnga po de dag ni lam dang 'bras bu'i yon tan ril gyi gzhir gyur pa'i phyir ro/_/	lnga po de dag ni lam dang bras bu yon tan ril gyi gzhir gyur ba phyir 
BO_T17_MW1PD95844_2594:2950	bsgrub dang bsrung ba'i dam tshhig mchog ces bya ba ni/_gnyis ni bsgrub pa'i	sgrub dang bsrung ba dam tshhig mchog ces byed ba ni sgrub ba 
BO_T17_MW1PD95844_2594:2951	dam tshhig go/_/gsum ni bsrung ba'o/_/yan lan gi dam tshhig bstan pa'i phyir/	dam tshhig ni bsrung lan gi dam tshhig ston ba 
BO_T17_MW1PD95844_2594:2952	gti mug chags dang zhe sdang dang /_/nga rgyal phrag dog mi spang ngo zhes bya ba la	gti mug chags dang zhe sdang dang rgyal phrag dog mi spong ngo zhes byed ba la 
BO_T17_MW1PD95844_2594:2953	sogs pa gsungs te/_spyi ru yang dag pa'i dug lnga dang /_log pa'i dug lnga	sogs ba gsungs ru yang dag ba dug lnga dang ba dug lnga 
BO_T17_MW1PD95844_2594:2954	gnyis su rgyas pa'i rgyud las gsungs te/_de la log pa'i dug lnga nyid rang dang spyi'i mtshhan nyid/_gtan tshhigs kyis rang rig pa nyid du nyams su lon na sku	gnyis su rgya ba brgyud las gsungs la log ba dug lnga nyid rang dang spyi mtshhan tshhigs kyis rang rig ba nyid du nyams su lon na sku 
BO_T17_MW1PD95844_2594:2955	gsung thugs kho na las spang bya gang yang mi dmigs pa'i phyir ro/_/yang dag	gsung thugs kho na las spong byed gang yang mi dmigs ba phyir dag 
BO_T17_MW1PD95844_2594:2956	pa'i drug lnga la gnas pa ni/_theg pa chen po'i lta spyod dam tshhig ril rdzogs par	ba drug lnga la gnas ba ba chen po lta spyod dam tshhig ril rdzogs ba 
BO_T17_MW1PD95844_2594:2957	gyur pa'i phyir mi spang pa kho na'o/_/dkar rtshi dmar rtshi dri sha chen/_/dag pa'i	gyur ba phyir mi spong ba kho rtshi dmar rtshi dri sha ba 
BO_T17_MW1PD95844_2594:2958	snod bcud mi dor ro/_/zhes bya ba ni/_dam rdzas lnga po nyid/_bshad pa'i	snod bcud mi dor byed ba rdzas lnga po ba 
BO_T17_MW1PD95844_2594:2959	grub pa bzhi po dag gi phyir dang du blang ba ste/_des rtshang sme'i rtog pa sbyangs pa	grub ba bzhi po dag gi phyir dang du blang ba rtshang sme rtogs ba sbyong ba 
BO_T17_MW1PD95844_2594:2960	dang /_thun mong gi yon tan gnyis kyi 'ang phyir te/_de dag rgyun tu spyad	dang mong gi yon tan gnyis kyi mang phyir dag rgyun tu spyod 
BO_T17_MW1PD95844_2594:2961	par bya ba'o/_/yan lag bcu'i dam tshhig ste zhes bya ba ni/_rtsha ba la dag ma	ba byed lag chu dam tshhig ste zhes byed ba ba la dag ma 
BO_T17_MW1PD95844_2594:2962	rgyud kyi rgyal po chen po dpal gsang ba'i snying po'i 'grel pa zhes bya ba	brgyud kyi rgyal po chen po dpal gsang ba snying po grel ba zhes byed ba 
BO_T17_MW1PD95844_2594:2963	nyams pa las 'di dag 'byung zhing bsgrub pa'i grogs bzhir byed pa'i phyir ro/_/	nyams ba las di dag byung zhing sgrub ba grogs bzhir byed ba phyir 
BO_T17_MW1PD95844_2594:2964	ye nas dag mnyam rtogs pas spyad/_/ces bya ba ni/_dngos po thams cad	ye nas dag mnyam rtogs ba byed ba po thams cad 
BO_T17_MW1PD95844_2594:2965	dag pa gsum dang mnyam pa'i ngo bor gnas pa de dag rtogs pas spyad pa dang / rtogs par 'dod pas spyad pa ste/_/go rims bzhin du shes par bya ba'o/_/	dag ba gsum dang mnyam ba ngo bor gnas ba de dag rtogs ba spyod ba dang rtogs ba dod ba spyod ba rims bzhin du shes ba byed 
BO_T17_MW1PD95844_2594:2966	bsrung zhing bsgrub pa'i dam tshhig lnga/_/rtsha ba yin te rigs med 'gyur zhes bya ba	bsrung zhing sgrub ba dam tshhig ba yin te rigs med gyur zhes byed ba 
BO_T17_MW1PD95844_2594:2967	la sogs pa ni/_phye ba'i dam tshhig gi nges tshhig bstan pa ste/_rtsha ba lnga po	la sogs ba ba dam tshhig gi nges tshhig ston ba ba lnga po 
BO_T17_MW1PD95844_2594:2968	nyams na mi dang lha'i rigs kyang med par 'gyur na theg pa chen po'i rigs lta	nyams na mi dang lha rigs kyang med ba gyur na theg ba chen po rigs lta 
BO_T17_MW1PD95844_2594:2969	smos kyang ci dgos te/_rmang med par 'gyur ba'i phyir ro/_/mi spang ba mi	smos kyang ci dgos med ba gyur ba phyir spong ba mi 
BO_T17_MW1PD95844_2594:2970	dor lnga gnyis ni/_yan lag dam tshhig 'da' dka'o/_/zhes bya ba ni/_log	dor lnga gnyis lag dam tshhig da byed ba 
BO_T17_MW1PD95844_2594:2971	pa'i dug lnga spong ba ni nyan thos lta bur gyur pa ste/_lam nor pas lta ba'i klung	ba dug lnga spong ba ni nyan thos lta bur gyur ba nor ba lta ba klung 
BO_T17_MW1PD95844_2594:2972	las nyams so/_/yang dag pa'i dug lnga spong ba ni/_don gnyis mi 'grub ste/	las nyams dag ba dug lnga spong ba gnyis mi grub 
BO_T17_MW1PD95844_2594:2973	byin gyi rlabs med par 'gyur ro/_/dam rdzas lnga spong ba ni/_kri ya pa ltar	byin gyi rlabs med ba gyur rdzas lnga spong ba ya ba ltar 
BO_T17_MW1PD95844_2594:2974	gyur pas lta ba dang spyod pa ma 'brel te theg pa 'dir mi chud pa kho na'i phyir ro/_/	gyur ba lta ba dang spyod ba ma brel te theg ba dir mi chud ba kho na phyir 
BO_T17_MW1PD95844_2594:2975	mnyam la mnyam par sbyor ba yis/_/mnyam pa'i dam tshhig la gnas na/_/mnyam	mnyam la mnyam ba sbyor ba ba dam tshhig la gnas 
BO_T17_MW1PD95844_2594:2976	rdzogs chen po thob 'gyur bas zhes bya ba ni/_rnam grangs las rtsha ba gnyis su phye	rdzogs chen po thob gyur ba zhes byed ba grangs las rtsha ba gnyis su byed 
BO_T17_MW1PD95844_2594:2977	ba ni rtsha ba chen po mnyam pa nyid kyi dam tshhig ste/_dngos po sar gyi rang bzhin	ba ni rtsha ba chen po mnyam ba nyid kyi dam tshhig po sar gyi rang bzhin 
BO_T17_MW1PD95844_2594:2978	bden pa gsum du mnyam pa la/_shes rab dang /_ting nge 'dzin gyi sbyong ba'i	bden ba gsum du mnyam ba rab dang nge dzin gyi sbyong ba 
BO_T17_MW1PD95844_2594:2979	dus na gang yang bdag nyid chen po las mi 'da' ba ni/_mnyam pa nyid kyi dam	dus na gang yang bdag nyid chen po las mi da ba ba nyid kyi dam 
BO_T17_MW1PD95844_2594:2980	tshhig kho na'i phyir/_rgyas pa'i rgyud las dam tshhig dam tshhig ces bya ba/_gud na	tshhig kho na ba brgyud las dam tshhig dam tshhig ces byed na 
BO_T17_MW1PD95844_2594:2981	yod pa ma yin te/_rang gi lta ba dam tshhig yin zhes gsungs so/_/'di'i	yod ba ma yin gi lta ba dam tshhig yin zhes gsungs 
BO_T17_MW1PD95844_2594:2982	'bras bu ni gang yang ma spangs par kun tu bzang po dbye ba med pa'i sa non	bras bu ni gang yang ma spong ba kun tu bzang po byed ba med ba sa non 
BO_T17_MW1PD95844_2594:2983	par gyur pa kho na'o/_/'das na sangs rgyas ma yin no zhes bya ba ni/_de nyid	ba gyur ba kho na sangs rgya ma yin no zhes byed ba nyid 
BO_T17_MW1PD95844_2594:2984	nyams pa'i skyon bstan pa ste/_de bzhin gshegs pa yang 'di yi ngo bo nyid las	nyams ba skyon ston ba bzhin gshegs ba yang di yi ngo bo nyid las 
BO_T17_MW1PD95844_2594:2985	ni 'da' bas bzhugs pa'i phyir/_gang zhig bdag nyid chen pos las gzhan pa	ni da ba bzhugs ba jig bdag nyid chen pos las gzhan ba 
BO_T17_MW1PD95844_2594:2986	dang mthong ba dang spyad pa ni/_sangs rgyas kyi ngo bo las nyams pa kho na'o/_/	dang mthong ba dang spyod ba rgya kyi ngo bo las nyams ba kho 
BO_T17_MW1PD95844_2594:2987	rtsha ba nyams pa'i phyal ba dag_/gso la nye bar mi brtshon na zhes bya ba ni/_rtsha	rtsha ba nyams ba phyal ba la nye ba mi brtshon na zhes byed ba 
BO_T17_MW1PD95844_2594:2988	ba lnga po kun nyams pa ni phyal pa zhes bya'o/_/de dag kun kyang sku gsung thugs	ba lnga po kun nyams ba ni phyal ba zhes dag kun kyang sku gsung thugs 
BO_T17_MW1PD95844_2594:2989	su 'dus so/_/slob dpon dang spun la nyams na sbyor ba la sogs pas gnas su	su du dpon dang spun la nyams na sbyor ba la sogs ba gnas su 
BO_T17_MW1PD95844_2594:2990	gso'o/_/bla na med pa'i sngags dang /_phyag rgya nyams na bsgrub pa chen po	na med ba sngags dang rgya nyams na sgrub ba chen po 
BO_T17_MW1PD95844_2594:2991	lan gsum gyis bshags nas bzlas pa sogs kyis gso'o/_/gsang ba thugs kyi	lan gsum gyis chags nas bzlas ba sogs kyis ba thugs kyi 
BO_T17_MW1PD95844_2594:2992	dam tshhig nyams pa ni/_shes rab dang ting nge 'dzin gyis gso'o/_/de ltar	dam tshhig nyams ba rab dang ting nge dzin gyis ltar 
BO_T17_MW1PD95844_2594:2993	myur du mi gso ba ni/_'o ma rul pa dang 'dra bas/_dam can thams cad	myur du mi gso ba ma rul ba dang dra can thams cad 
BO_T17_MW1PD95844_2594:2994	kyis bar chad du 'gyur bas/_lung pa gcig gi chu la yang mi btung ba'i phyir/	kyis ba chad du gyur ba gcig gi chu la yang mi thung ba 
BO_T17_MW1PD95844_2594:2995	skad cig yud tsham smra ma byed/_/nyams 'gyur nyes pa brjod mi lang /_/zhes	skad cig yud tsham smra ma gyur nyes ba rjod mi lang 
BO_T17_MW1PD95844_2594:2996	gsungs so/_/rtsha ba'i dam tshhig nyams gyur na/_/bsgrub pa thams cad log	gsungs ba dam tshhig nyams gyur ba thams cad log 
BO_T17_MW1PD95844_2594:2997	par 'gyur zhes bya ba la sogs pa ni/_nyams pa'i skyon rnams bstan pa ste/_/	ba gyur zhes byed ba la sogs ba ba skyon rnams ston ba 
BO_T17_MW1PD95844_2594:2998	rtsha ba lnga po nyams na/_las ci bsags pa ril la nus mthu med cing /_bar	rtsha ba lnga po nyams ci bsags ba ril la nus mthu med cing 
BO_T17_MW1PD95844_2594:2999	chod mang bas gang yang don med par 'gyur zhing phyi mar yid du mi 'ong ba'i sdug	chod mang ba gang yang don med ba gyur zhing phyi mar yid du mi ng ba sdug 
BO_T17_MW1PD95844_2594:3000	bsngal sna tshhogs 'byung ngo /_/yan lag dam tshhig nyams 'gyur na/_/'bras bu	sngal sna tshhogs byung ngo lag dam tshhig nyams gyur bu 
BO_T17_MW1PD95844_2594:3001	med cing ngan song ltung zhes bya ba ni/_yan lag gnyis nyams na/_nyan thos	med cing ngan gro ltung zhes byed ba lag gnyis nyams thos 
BO_T17_MW1PD95844_2594:3002	dang kri ya pa ltar 'gyur bas sngags kyi gzhung gis bstan pa'i thun mong dang mchog gi 'bras bu med la/_de dag gtan tshhigs gsum dang dgos ched gsum	dang kri ya ba ltar gyur ba sngags kyi gzhung gis ston ba thun mong dang mchog gi bras bu med dag gtan tshhigs gsum dang dgos ched gsum 
BO_T17_MW1PD95844_2594:3003	rgyud kyi rgyal po chen po dpal gsang ba'i snying po'i 'grel pa zhes bya ba	brgyud kyi rgyal po chen po dpal gsang ba snying po grel ba zhes byed ba 
BO_T17_MW1PD95844_2594:3004	gyis mi spyod par log par spyod pa rnams ngan song du ltung bar 'gyur ba kho na'o/_/	gyis mi spyod ba log ba spyod ba rnams ngan gro du ltung ba gyur ba kho 
BO_T17_MW1PD95844_2594:3005	dam tshhig rnams ni rdo rje che/_/sangs rgyas kun gyi bdag nyid yin zhes bya ba ni/	dam tshhig rnams ni rdo rje rgya kun gyi bdag nyid yin zhes byed ba 
BO_T17_MW1PD95844_2594:3006	dam tshhig gi rang bzhin bstan pa ste/_rtsha ba dang yan lag rnams kyi rang bzhin	dam tshhig gi rang bzhin ston ba ba dang yan lag rnams kyi rang bzhin 
BO_T17_MW1PD95844_2594:3007	ni/_lta spyod gnyis mi phyed pa ste/_rang bzhin dang /_lam dang 'bras bu	spyod gnyis mi phyed ba bzhin dang dang bras bu 
BO_T17_MW1PD95844_2594:3008	gsum yang mi phyed pa'i phyir rdo rje zhes bya ba ste/_de dag ni dus gsum gyi	gsum yang mi phyed ba phyir rdo rje zhes byed ba dag ni dus gsum gyi 
BO_T17_MW1PD95844_2594:3009	sangs rgyas kun gyi lam dang ngo bo nyid kho na'i phyir ro/_/rtsha ba'i dam tshhig lnga la	sangs rgya kun gyi lam dang ngo bo nyid kho na phyir ba dam tshhig lnga la 
BO_T17_MW1PD95844_2594:3010	ni/_/gcig la gnyis dang bcu phrag gsum/_/yan lag dam tshhig lnga rnams la/_/	la gnyis dang chu phrag lag dam tshhig lnga rnams 
BO_T17_MW1PD95844_2594:3011	gcig la 'ang bcu phrag gnyis su dbye zhes bya ba la sogs pa ni/_rnam grangs	gcig la mang chu phrag gnyis su byed zhes byed ba la sogs ba grangs 
BO_T17_MW1PD95844_2594:3012	gnyis las rgyas par bstan pa ste/_spyir dam tshhig rgyas 'bring rnam pa tri la re re	gnyis las rgya ba ston ba dam tshhig rgya bring rnam ba tri la re re 
BO_T17_MW1PD95844_2594:3013	la yang gsum gsum ste dgur phye ba las 'bring gi 'bring sum brgya drug cur phye ba	la yang gsum gsum ste dgur byed ba las bring gi bring sum brgya drug cur byed ba 
BO_T17_MW1PD95844_2594:3014	ste/_tshhogs mang du dogs pa dang /_'phra rgyas 'byed pa las gsal bas	mang du dogs ba dang rgya byed ba las gsal ba 
BO_T17_MW1PD95844_2594:3015	'dir ma bris so/_/rgyas pa yang zur tsham bstan pa'i phyir/_dam tshhig 'di ni	dir ma bri ba yang zur tsham ston ba tshhig di ni 
BO_T17_MW1PD95844_2594:3016	smad po che zhes bya ba la sogs pa gsungs te/_theg pa chen po'i dam tshhig rnams	smad po che zhes byed ba la sogs ba gsungs ba chen po dam tshhig rnams 
BO_T17_MW1PD95844_2594:3017	ni/_'khor lo sgyur ba'i rgyal po'i khrims dang 'dra ste/_gdul bya'i dbang	lo sgyur ba rgyal po khrims dang dra byed dbang 
BO_T17_MW1PD95844_2594:3018	gis rgya chad pa 'ang med pa'i phyir ro/_/de nyid nye bar bstan pa'i phyir/_/	gis rgya chad ba mang med ba phyir nyid nye ba ston ba 
BO_T17_MW1PD95844_2594:3019	'jig rten drug gi phyogs bcu na/_/srid gsum 'gro ba ji snyed pa'i/_/rtog	jig rten drug gi phyogs chu gsum gro ba ji snyed 
BO_T17_MW1PD95844_2594:3020	'dul dam tshhig de snyed 'phro zhes gsungs te/_'dul ba ni gnyen pos 'dul	dul dam tshhig de snyed phro zhes gsungs ba ni gnyen pos dul 
BO_T17_MW1PD95844_2594:3021	ba dang /_sbyangs pas 'dul ba dang /_bsgyur bas 'dul ba dang /_dag	ba dang ba dul ba dang ba dul ba dang 
BO_T17_MW1PD95844_2594:3022	par 'dul ba dang /_ngo shes pas 'dul ba la sogs pa'o/_/de dag gi phyir	ba dul ba dang shes ba dul ba la sogs dag gi phyir 
BO_T17_MW1PD95844_2594:3023	grangs ma nges pa kho na'o/_/gzhan yang rgyal mchog kun bzang gis/_/zhes bya ba	grangs ma nges ba kho yang rgyal mchog kun bzang byed ba 
BO_T17_MW1PD95844_2594:3024	la sogs pa ni/_bsrungs pa'i yon tan bstan pa ste/_mnyam rdzogs kyi yon	la sogs ba ba yon tan ston ba rdzogs kyi yon 
BO_T17_MW1PD95844_2594:3025	tan las gzhan par gyur pa ni/_yang zhes bya ba ste/_dam tshhig bco lnga po	tan las gzhan ba gyur ba zhes byed ba tshhig chos lnga po 
BO_T17_MW1PD95844_2594:3026	mnyams pa ni/_gang du byung zhe na/_rigs kyi bdag po ni rgyal po'i mchog ste	mnyams ba du byung zhe kyi bdag po ni rgyal po mchog ste 
BO_T17_MW1PD95844_2594:3027	dngos kun tu bzang po'o/_/de'i ngo bo nyid ji ltar zhe na/_thams cad ma	dngos kun tu bzang ngo bo nyid ji ltar zhe cad ma 
BO_T17_MW1PD95844_2594:3028	lus phyag rgya'i/_/bsgrub med dam pa ma lus 'byung zhes gsungs te/_dngos	lus phyag med dam ba ma lus byung zhes gsungs 
BO_T17_MW1PD95844_2594:3029	po gnyis kyis bsdus pa ril ni sku gsung thugs kyi phyag rgyar ye nas lhun gyis grub	po gnyis kyis sdud ba ril ni sku gsung thugs kyi phyag rgyar ye nas lhun gyis grub 
BO_T17_MW1PD95844_2594:3030	pas spang ba dang blang ba med pa ni 'bras bu dam pa ste/_kun tu bzang po'i	ba spong ba dang blang ba med ba ni bras bu dam ba tu bzang po 
BO_T17_MW1PD95844_2594:3031	yon tan ril lhun gyis grub pa'o/_/de'i yon tan brjod pa las 'das pa'i	yon tan ril lhun gyis grub yon tan rjod ba las da ba 
BO_T17_MW1PD95844_2594:3032	phyir/_de la sogs pa bsam yas mchog ces gsungs so/_/rgyal ba'i rigs	la sogs ba bsam yas mchog ces gsungs ba rigs 
BO_T17_MW1PD95844_2594:3033	mchog 'dzin pa de/_/zhes bya ba la sogs pa ni/_yon tan nye ba mdor bstan	mchog dzin ba byed ba la sogs ba tan nye ba mdor ston 
BO_T17_MW1PD95844_2594:3034	pa ste/_dam tshhig 'di dag lta spyod tshhang bar sbyor ba ni/_sar chud pa'i rigs	ba tshhig di dag lta spyod tshhang ba sbyor ba chud ba rigs 
BO_T17_MW1PD95844_2594:3035	'dzin no/_/rgyun tu gnas pa ni sa la gnas pa'o/_/stobs su gyur pa ni sar	dzin tu gnas ba ni sa la gnas su gyur ba ni sar 
BO_T17_MW1PD95844_2594:3036	yongs su smin pa'i phyir ro/_/'jig rten gtsho dang 'khor gyis bkur/_/dam pa	yongs su smin ba phyir rten gtsho dang khor gyis ba 
BO_T17_MW1PD95844_2594:3037	mchog dang dam pa yis/_/sras dang spun dgongs byin gyis rlob/_/ces bya ba	mchog dang dam ba dang spun dgongs byin gyis byed ba 
BO_T17_MW1PD95844_2594:3038	ni/_bsgrub pa po de la sde brgyad g.yog dang bcas pas/_dgongs pa bsgrub	ba po de la sde brgyad g.yog dang cha ba sgrub 
BO_T17_MW1PD95844_2594:3039	pa dang /_sangs rgyas dang byang chub sems dpa' ril gyis dgongs shing byin	ba dang rgya dang byang chub sems dpa ril gyis dgongs shing byin 
BO_T17_MW1PD95844_2594:3040	gyis rlob par 'gyur ba kho na'o/_/bder gshegs nyid kyi yul la zhugs zhes bya	gyis rlob ba gyur ba kho gshegs nyid kyi yul la jug zhes byed 
BO_T17_MW1PD95844_2594:3041	ba ni/_bco lnga po de nyid de bzhin gshegs pa'i ngo bo'i phyir ro/_/'jigs	ba lnga po de nyid de bzhin gshegs ba ngo bo phyir 
BO_T17_MW1PD95844_2594:3042	med kun tu bzang por sbyor/_/zhes bya ba ni/_de phan chad ci spyad kyang ltung	med kun tu bzang por byed ba phan chad ci spyod kyang ltung 
BO_T17_MW1PD95844_2594:3043	ba'i dogs pa med de spyod yul yongs su dag pa'i phyir ro/_/ji bzhin nyid dang 'dul ba'i thabs zhes bya ba ni chos thams cad kyi ji bzhin pa de nyid mngon du	ba dogs ba med de spyod yul yongs su dag ba phyir bzhin nyid dang dul ba thabs zhes byed ba ni chos thams cad kyi ji bzhin ba de nyid mngon du 
BO_T17_MW1PD95844_2594:3044	byed pa'i dam tshhig chen po nyid dang 'dul ba'i thabs bco lnga po la sogs pa	byed ba dam tshhig chen po nyid dang dul ba thabs chos lnga po la sogs ba 
BO_T17_MW1PD95844_2594:3045	/   rgyud kyi rgyal po chen po dpal gsang ba'i snying po'i 'grel pa zhes bya ba	brgyud kyi rgyal po chen po dpal gsang ba snying po grel ba zhes byed ba 
BO_T17_MW1PD95844_2594:3046	thams cad ma brtshal bar lhun gyis grub pa'i phyir/_ji snyed sdom pa bsam yas pa//	thams cad ma brtshal ba lhun gyis grub ba snyed sdom ba bsam yas 
BO_T17_MW1PD95844_2594:3047	ma lus rnam dag lhun gyis grub ces gsungs so/_/nyams na bskang bas rdzogs	ma lus rnam dag lhun gyis grub ces gsungs na skong ba rdzogs 
BO_T17_MW1PD95844_2594:3048	pa dang /_/de la sogs pa bsam yas mchog ces bya ba ni/_spyir dam tshhig	ba dang la sogs ba bsam yas mchog ces byed ba dam tshhig 
BO_T17_MW1PD95844_2594:3049	rnams las ma log na nyams pa rnams bskangs pas kyang skongs so zhes bya'o/_/	rnams las ma log na nyams ba rnams skong ba kyang skongs so zhes 
BO_T17_MW1PD95844_2594:3050	de nas de bzhin gshegs pa nyid de bzhin gshegs pa nyid la 'dul bar gyur to	de nas de bzhin gshegs ba nyid de bzhin gshegs ba nyid la dul ba gyur to 
BO_T17_MW1PD95844_2594:3051	zhes bya ba ni/_dam tshhig gi rang bzhin gyi phyir dang /_rgyal ba nyid kyang 'di	zhes byed ba tshhig gi rang bzhin gyi phyir dang ba nyid kyang di 
BO_T17_MW1PD95844_2594:3052	dag las mi 'da' na gzhan lta ci smos zhes bya ba'i tha tshhig go //_//	dag las mi da na gzhan lta ci smos zhes byed ba tha tshhig go 
BO_T17_MW1PD95844_2594:3053	le'u bcu dgu pa mdor bshad pa'o//_//	leu chu dgu ba mdor chad 
BO_T17_MW1PD95844_2594:3054	de nas 'phrin las bstan pa'i phyir/_lhun gyis grub pa'i dam tshhig byin	de nas phrin las ston ba gyis grub ba dam tshhig byin 
BO_T17_MW1PD95844_2594:3055	gyis rlob pa zhes bya ba la sogs pa gsungs te/_byang chub sems nyid la 'phrin	gyis rlob ba zhes byed ba la sogs ba gsungs chub sems nyid la phrin 
BO_T17_MW1PD95844_2594:3056	las rnam bzhi rang bzhin gyis lhun gyis grub par gnas pa ste/_cho ga bzhi yis	las rnam bzhi rang bzhin gyis lhun gyis grub ba gnas ba ga bzhi yis 
BO_T17_MW1PD95844_2594:3057	bskul bas mngon du snang bar byed pa ni byin gyis rlob pa zhes bya'o/_/e'i	skul ba mngon du snang ba byed ba ni byin gyis rlob ba zhes 
BO_T17_MW1PD95844_2594:3058	tshhogs kyi dkyil 'khor mchog ces bya ba 'di dag kyang /_rim pa man ngag gis	tshhogs kyi dkyil khor mchog ces byed ba di dag kyang ba man ngag gis 
BO_T17_MW1PD95844_2594:3059	bsdebs te/_dang po bdud rtshi lnga 'am zas lnga la/_mtshhan ma ming du bcas	sdeb po bdud rtshi lnga mang zas lnga ma ming du cha 
BO_T17_MW1PD95844_2594:3060	par bya zhes bya  la sogs pa'i don gyis/_bsgrub bya dang 'das pa la sogs	ba byed zhes byed la sogs ba don byed dang da ba la sogs 
BO_T17_MW1PD95844_2594:3061	pa'i dam rdzas lnga 'am/_sha dang nya dang bu ram dang til dang sbrang la sogs pa	ba dam rdzas lnga dang nya dang bu ram dang til dang sbrang la sogs ba 
BO_T17_MW1PD95844_2594:3062	rnams la ling ga bcas la/_shog bu 'am gro ga la ming rus bris la glan te/	rnams la ling ga cha bu mang gro ga la ming rus bri la glan 
BO_T17_MW1PD95844_2594:3063	thod pa'i nang du gzhug go/_/de nas sngags mkhan las rnam bzhi rang gi phyogs	thod ba nang du jug nas sngags mkhan las rnam bzhi rang gi phyogs 
BO_T17_MW1PD95844_2594:3064	su kha bltas la/_e'i tshhogs kyi dkyil 'khor mchog ces bya ba la sogs pa'i	su kha lta tshhogs kyi dkyil khor mchog ces byed ba la sogs ba 
BO_T17_MW1PD95844_2594:3065	phyir/_las so so'i dkyil 'khor gsal bar bskyed de lha rnams las la nges	so so dkyil khor gsal ba skyed de lha rnams las la nges 
BO_T17_MW1PD95844_2594:3066	par btshud de/_de nas bkug nas rdo rje phur pas gdab ces bya ba la sogs	ba btshud nas gugs nas rdo rje phur ba gdab ces byed ba la sogs 
BO_T17_MW1PD95844_2594:3067	pa'i phyir/_pho nya rnams kyis bkug nas ling ga la bstims te/_phyag rgya	ba nya rnams kyis gugs nas ling ga la stim rgya 
BO_T17_MW1PD95844_2594:3068	bzhis bcings nas mngon du byas la bzhag go/_/de la rgyu dang dbyibs so so'i	bzhis ching nas mngon du byed la jog la rgyu dang dbyibs so so 
BO_T17_MW1PD95844_2594:3069	phur pa rnams rigs so so'i ki la yar byin gyis brlabs la gnas bdun la	phur ba rnams rigs so so ki la yar byin gyis brlabs la gnas bdun la 
BO_T17_MW1PD95844_2594:3070	sogs pa la btab la gzir ro/_/de nas rdul du byas la tshhogs la dbul zhes	sogs ba la debs la gzir nas rdul du byed la tshhogs la bul zhes 
BO_T17_MW1PD95844_2594:3071	bya ba'i don gyis/_bsam pa dang chas pas ral gris gtubs la/_'bar ba	byed ba don ba dang cha ba ral gris gtub ba 
BO_T17_MW1PD95844_2594:3072	gtum chen rngam pa la/_/khros pa'i yid kyis mchod sbyin bya zhes bya ba la sogs	thum chen rngam ba ba yid kyis mchod sbyin byed zhes byed ba la sogs 
BO_T17_MW1PD95844_2594:3073	pa'i don gyis/_rigs so so'i dkyil 'khor bsam yas pa mngon sum du	ba don so so dkyil khor bsam yas ba mngon sum du 
BO_T17_MW1PD95844_2594:3074	dmigs nas rtod cing zos pas dbul lo/_/de dag brlag pa dang /_'dus	dmigs nas rtod cing zos ba bul dag brlag ba dang 
BO_T17_MW1PD95844_2594:3075	pa la sogs pa'i bsam pas phye nas phul na/_mi gnod cing 'dod pa bzhin du	ba la sogs ba bsam ba byed nas bul gnod cing dod ba bzhin du 
BO_T17_MW1PD95844_2594:3076	'gyur ro/_/de dag ni lhag pa rdzas kyi sgo nas las bya ba'o/_/rdo rje lu gu rgyud	gyur dag ni lhag ba rdzas kyi sgo nas las byed rje lu gu brgyud 
BO_T17_MW1PD95844_2594:3077	kyi las bya ba ni/_bsgrub pa po yab yum rnams srin lag lu gu rgyud du sbrel pa'i	kyi las byed ba ba po yab yum rnams srin lag lu gu brgyud du sbrel ba 
BO_T17_MW1PD95844_2594:3078	dbus su ling ga bzhag la/_e ram bam ram ma ram ya ram zhes bya ba'i sngags kyis so	dbus su ling ga jog ram bam ram ma ram ya ram zhes byed ba sngags kyis so 
BO_T17_MW1PD95844_2594:3079	so'i gzhal yas khang me dpung dang bcas par bsam ste/_de'i nang du lha so	so jal yas khang me dpung dang cha ba bsam nang du lha so 
BO_T17_MW1PD95844_2594:3080	so'i dkyil 'khor du bdag nyid byin gyis brlabs la/_de nas rgyas pa las	so dkyil khor du bdag nyid byin gyis brlabs nas rgya ba las 
BO_T17_MW1PD95844_2594:3081	'byung ba ltar tshhigs su bcad pas bskul te/_stang stabs kyis sprul pa rnams	byung ba ltar tshhigs su gcod ba skul stabs kyis sprul ba rnams 
BO_T17_MW1PD95844_2594:3082	spros pas khams gsum sprugs nas bsrung ba dang phral te bkug nas ling ga la	spros ba khams gsum sprug nas bsrung ba dang phral te gugs nas ling ga la 
BO_T17_MW1PD95844_2594:3083	mngon du gnas pa la/_gnas gsum nas 'od zer byung ba la thim nas bsam	mngon du gnas ba gsum nas d zer byung ba la thim nas bsam 
BO_T17_MW1PD95844_2594:3084	pas dbang bskur nas ji ltar 'dod pa 'grub pa ste/_drag po ni sangs rgyas sku	ba dbang skur nas ji ltar dod ba grub ba po ni sangs rgya sku 
