segmentnr	original	stemmed
BO_T02_D2627:261b-11	sangs rgyas kyi mdzad pa rnams mdzad nas sngags dang 'dres pa las zhu bar gyur pa te thabs dang shes rab kyi bdag nyid las gtso bo bskyed par bya ba'i don to //	sangs rgya kyi mdzad ba rnams mdzad nas sngags dang dre ba las ju ba gyur ba te thabs dang shes rab kyi bdag nyid las gtso bo skyed ba byed ba don to 
BO_T02_D2627:261b-12	de nas bcom ldan 'das kyis tshe dpag tu med pa'i rdo rje'i 'od ces bya ba'i ting nge 'dzin la snyoms par zhugs nas zhes bya ba ni /	de nas joms ldan da kyis tshe dpog tu med ba rdo rje d ces byed ba ting nge dzin la snyom ba jug nas zhes byed ba ni 
BO_T02_D2627:261b-13	tshe dpag tu med pa'i rdo rje 'od byed pa ni me long lta bu'i ye shes te bri ba dang zad ba med pas tshe dpag tu med pa'i gzung ba dang 'dzin pa rtog pas mi phyed pas /	tshe dpog tu med ba rdo rje d byed ba ni me long lta bu ye shes te bri ba dang zad ba med ba tshe dpog tu med ba gzung ba dang dzin ba rtogs ba mi phyed ba 
BO_T02_D2627:261b-14	rdo rje'i rang bzhin gyis dag pas 'od byed pa zhes bya ba yin la /	rdo rje rang bzhin gyis dag ba d byed ba zhes byed ba yin la 
BO_T02_D2627:261b-15	de la dmigs pa'i ting nge 'dzin la yang ming de skad ces bya ste snyoms par byas pa ni de gzhan la sbyin pa'i rnam pa thugs rtse gcig tu mdzad nas zhes bya ba'i don to //	de la dmigs ba ting nge dzin la yang ming de skad ces byed ste snyom ba byed ba ni de gzhan la sbyin ba rnam ba thugs rtse gcig tu mdzad nas zhes byed ba don to 
BO_T02_D2627:262a-0	de bzhin gshegs pa thams cad kyi tshe dang ye shes dpag tu med pa zhes bya ba ni bcom ldan 'das tshe tshad med pa'i phyag rgya @262a * //	de bzhin gshegs ba thams cad kyi tshe dang ye shes dpog tu med ba zhes byed ba ni joms ldan da tshe tshad med ba phyag rgya 
BO_T02_D2627:262a-1	chen po'o // snying po'i gzungs 'di bshad do zhes bya ba 'og nas 'byung ba 'di bshad do //	chen po snying po gzungs di chad do zhes byed ba g nas byung ba di chad do 
BO_T02_D2627:262a-2	de nyid aom a'a mi ta zhes bya ba nas sv'a h'a zhes bya ba'i bar ro //	de nyid aom aa mi ta zhes byed ba nas sva ha zhes byed ba ba ro 
BO_T02_D2627:262a-3	de nas 'di bshad ma thag tu ni sems can thams cad kyi sdug bsngal rab tu zhi'o zhes bya ba snga ma bzhin no //	de nas di chad ma thag tu ni sems can thams cad kyi sdug sngal rab tu zhi zhes byed ba snga ma bzhin no 
BO_T02_D2627:262a-4	de nas yang bcom ldan 'das kyis gdon mi za bar sgrib pa thams cad rnam par 'joms pa zhes bya ba'i ting nge 'dzin la snyoms par zhugs te zhes bya ba ni the tshom med par gzung 'dzin gyi sgrib pa thams cad rnam par 'joms shing 'khrud pa	de nas yang joms ldan da kyis don mi za ba sgrib ba thams cad rnam ba joms ba zhes byed ba ting nge dzin la snyom ba jug te zhes byed ba ni the tshom med ba gzung dzin gyi sgrib ba thams cad rnam ba joms shing khrud ba 
BO_T02_D2627:262a-5	ni mnyam pa nyid kyi ye shes te /	ni mnyam ba nyid kyi ye shes te 
BO_T02_D2627:262a-6	de la dmigs pa'i ting nge 'dzin la ming de skad ces bya ba zhing gzhan la sbyin pa'i rnam pa thugs rtse gcig tu mdzad ces bya ba'i don to //	de la dmigs ba ting nge dzin la ming de skad ces byed ba zhing gzhan la sbyin ba rnam ba thugs rtse gcig tu mdzad ces byed ba don to 
BO_T02_D2627:262a-7	de bzhin gshegs pa thams cad kyis sgrib pa gcod pa zhes bya ba ni rin chen 'byung ldan no //	de bzhin gshegs ba thams cad kyis sgrib ba gcod ba zhes byed ba ni rin chen byung ldan no 
BO_T02_D2627:262a-8	snying po 'di thugs ka nas phyung ngo zhes bya ba ni 'og nas 'byung ba'i sngags te /	snying po di thugs ka nas byin ngo zhes byed ba ni g nas byung ba sngags te 
BO_T02_D2627:262a-9	de nyid aom ka ka ni zhes bya ba la sogs pa'o //	de nyid aom ka ka ni zhes byed ba la sogs ba 
BO_T02_D2627:262a-10	'di bshad ma thag tu yang thams cad de bzhin gyur to zhes bya ba ni snga ma bzhin no //	di chad ma thag tu yang thams cad de bzhin gyur to zhes byed ba ni snga ma bzhin no 
BO_T02_D2627:262a-11	de nas yang bcom ldan 'das kyis zhes bya ba la sogs pa la /	de nas yang joms ldan da kyis zhes byed ba la sogs ba la 
BO_T02_D2627:262a-12	sgrib pa thams cad dri med cing //	sgrib ba thams cad dri med cing 
BO_T02_D2627:262a-13	zhes bya ba ni gzung 'dzin gyi dri ma dang bral ba so sor rtog pa'i ye shes so //	zhes byed ba ni gzung dzin gyi dri ma dang bral ba so sor rtogs ba ye shes so 
BO_T02_D2627:262a-14	de nyid rnam par rtog pa'i rdo rje zhes pa'o //	de nyid rnam ba rtogs ba rdo rje zhes ba 
BO_T02_D2627:262a-15	de lta bu'i ting nge 'dzin la snyoms par zhugs pa ni sbyin pa'i rnam pa thugs rtse gcig tu mdzad nas zhes bya ba'i don to //	de lta bu ting nge dzin la snyom ba jug ba ni sbyin ba rnam ba thugs rtse gcig tu mdzad nas zhes byed ba don to 
BO_T02_D2627:262a-16	de bzhin gshegs pa thams cad kyis sgrib pa rnams ma lus par 'joms pa zhes bya ba ni 'od dpag tu med pa'o//	de bzhin gshegs ba thams cad kyis sgrib ba rnams ma lus ba joms ba zhes byed ba ni d dpog tu med 
BO_T02_D2627:262a-17	snying po'i gzungs 'di rang gi thugs ka nas phyung ngo zhes bya ba ni de skyed par byed pa dang lam sbyang ba'i sngags te /	snying po gzungs di rang gi thugs ka nas byin ngo zhes byed ba ni de skyed ba byed ba dang lam sbyong ba sngags te 
BO_T02_D2627:262a-18	aom ratne zhes bya ba la sogs pa'o //	aom ratne zhes byed ba la sogs ba 
BO_T02_D2627:262a-19	de nas zhes bya ba la sogs pa snga ma bzhin te phan yon no //	de nas zhes byed ba la sogs ba snga ma bzhin te phan yon no 
BO_T02_D2627:262a-20	de nas yang zhes bya ba la sogs pa la gdon mi za bar mi 'joms pa thams cad rnam par 'joms nas zhes bya ba ni bya ba nan tan gyi ye shes te /	de nas yang zhes byed ba la sogs ba la don mi za ba mi joms ba thams cad rnam ba joms nas zhes byed ba ni byed ba nan tan gyi ye shes te 
BO_T02_D2627:262a-21	sgo lnga'i rnam par shes pa la sogs pa 'joms pa'i phyir ro //	sgo lnga rnam ba shes ba la sogs ba joms ba phyir ro 
BO_T02_D2627:262a-22	ting nge 'dzin la snyoms par zhugs nas zhes bya ba ni sbyin pa'i rnam pa thugs rtse gcig tu mdzad nas so //	ting nge dzin la snyom ba jug nas zhes byed ba ni sbyin ba rnam ba thugs rtse gcig tu mdzad nas so 
BO_T02_D2627:262b-0	de nas de bzhin gshegs pa thams cad ni don yod grub @262b pa'o ;	de nas de bzhin gshegs ba thams cad ni don yod grub ba 
BO_T02_D2627:262b-1	/ snying po'i gzungs 'di zhes bya ba la sogs pa ni snga ma bzhin no /	snying po gzungs di zhes byed ba la sogs ba ni snga ma bzhin no 
BO_T02_D2627:262b-2	gsang sngags 'di zhes bya ba la sogs pas lan gsum du g-yos shing ya mtshan 'jig rten du snang bas sngags kyi che ba bstan to //	gsang sngags di zhes byed ba la sogs ba lan gsum du g-yos shing ya mtshan jig rten du snang ba sngags kyi che ba ston to 
BO_T02_D2627:262b-3	de nas bsdu zhing byin gyis brlab pa la sogs pa sngar bshad pa bzhin du shes par bya'o ;	de nas sdud zhing byin gyis brlab ba la sogs ba sngar chad ba bzhin du shes ba byed 
BO_T02_D2627:262b-4	/ de nas dkyil 'khor ni 'di yin te zhes bya ba la sogs pas slob dpon gyi las dang / slob ma gzhug pa la sogs pa'i cho ga ston to //	de nas dkyil khor ni di yin te zhes byed ba la sogs ba slob dpon gyi las dang slob ma jug ba la sogs ba cho ga ston to 
BO_T02_D2627:262b-5	de nas zhes bya ba ni rjes thogs la'o //	de nas zhes byed ba ni rjes thogs la 
BO_T02_D2627:262b-6	de yang 'dir dang por re zhig nyams dga' ba'i sa phyogs su stan la 'dug la /	de yang dir dang por re jig nyams dga ba sa phyogs su stan la dug la 
BO_T02_D2627:262b-7	lce dang lag pa byin gyis brlab pa dang rdo rje 'jigs byed nas brtsams te 'og bcing pa'i mthar thug pa dang / nam mkhar dkyil 'khor bsams la /	lce dang lag ba byin gyis brlab ba dang rdo rje jigs byed nas brtsams te g ching ba mthar thug ba dang nam mkhar dkyil khor bsams la 
BO_T02_D2627:262b-8	mchod pa rnam pa lngas mchod pa la sogs pa dang lha dang lha ma yin gyis bstod de mi snang bar gyur pa'i bar dang / stong pa nyid dang aa las zla ba dang sa bon dang dam tshig gi phyag rgya dang lha'i rnal 'byor dang byin gyis brlab pa dang dbang bskur ba dang phyag na rdo rje thugs yongs su rdzogs pa'i sbyor bas dkyil 'khor bskyed de /	mchod ba rnam ba lngas mchod ba la sogs ba dang lha dang lha ma yin gyis bstod de mi snang ba gyur ba ba dang stong ba nyid dang aa las zla ba dang sa bon dang dam tshig gi phyag rgya dang lha rnal byor dang byin gyis brlab ba dang dbang skur ba dang phyag na rdo rje thugs yongs su rdzogs ba sbyor ba dkyil khor skyed de 
BO_T02_D2627:262b-9	nam mkha'i dkyil 'khor dgug pa dang / ngan 'gro sbyong zhing dkyil 'khor du gzhug pa dang dbang bskur nas /	nam mkha dkyil khor gugs ba dang ngan gro sbyong zhing dkyil khor du jug ba dang dbang skur nas 
BO_T02_D2627:262b-10	sangs rgyas kun pas sngar sangs rgyas //	sangs rgya kun ba sngar sangs rgya 
BO_T02_D2627:262b-11	zhes bya ba la sogs pas bstod pa dang / dkyil 'khor lus la brtags ba dang bcas pa ni dang po'i sbyor ba'i ting nge 'dzin to //	zhes byed ba la sogs ba bstod ba dang dkyil khor lus la rtog ba dang cha ba ni dang po sbyor ba ting nge dzin to 
BO_T02_D2627:262b-12	de nas stong pa nyid du bsgom pa dang khang pa brtsegs ma dang 'khor lo rtsibs bzhi pa'i lte ba la babs te phyag na rdo rje nyid kyi thugs kar /	de nas stong ba nyid du bsgom ba dang khang ba brtsegs ma dang khor lo rtsibs bzhi ba lte ba la bab te phyag na rdo rje nyid kyi thugs kar 
BO_T02_D2627:262b-13	aom pu n+ye pu n+ye /	aom pu n+ye pu n+ye 
BO_T02_D2627:262b-14	ma h'a pu n+ye aa pa ri mi ta pu n+ye dzny'a na samba ro pa tsitte ka ri ni sv'a h'a /	ma ha pu n+ye aa ba ri mi ta pu n+ye dznya na samba ro ba tsitte ka ri ni sva ha 
BO_T02_D2627:262b-15	zhes bya ba bkod nas 'od zer gyis sangs rgyas kyi mdzad pa byas te gsol ba 'debs pa'i lha rnams dang bcas pa thugs ka'i zla bar zhugs pas zla ba dang bcas pa zhu nas shes rab dang thabs su gyur nas sngags de nyid gyur pa las phyag	zhes byed ba bkod nas d zer gyis sangs rgya kyi mdzad ba byed te gsol ba debs ba lha rnams dang cha ba thugs ka zla ba jug ba zla ba dang cha ba ju nas shes rab dang thabs su gyur nas sngags de nyid gyur ba las phyag 
BO_T02_D2627:262b-16	na rdo rjer gyur nas de'i thugs kyi zla ba'i aom a'a: ni ti zhes bya ba la sogs pas mi bskyod pa bskyed de /	na rdo rjer gyur nas de thugs kyi zla ba aom aa: ni ti zhes byed ba la sogs ba mi skyod ba skyed de 
BO_T02_D2627:262b-17	shar gyi rtsibs pa la gdon /	char gyi rtsibs ba la don 
BO_T02_D2627:262b-18	aom ka ka ni zhes bya ba la sogs pas lho phyogs kyi rin chen 'byung ldan gdon /	aom ka ka ni zhes byed ba la sogs ba lho phyogs kyi rin chen byung ldan don 
BO_T02_D2627:263a-0	aom ratne zhes bya ba la @263a * //	aom ratne zhes byed ba la 
BO_T02_D2627:263a-1	sogs pas nub phyogs kyi 'od dpag tu med pa gdon /	sogs ba nub phyogs kyi d dpog tu med ba don 
BO_T02_D2627:263a-2	aom aa ka ka zhes bya ba la sogs pas byang phyogs su don yod grub pa gdon /	aom aa ka ka zhes byed ba la sogs ba byang phyogs su don yod grub ba don 
BO_T02_D2627:263a-3	h'um tram hr'i aa zhes pas l'a sya la sogs pa brgyad de mtshams kyi cha la gzhag / de nas gtso bo dang tha mi dad pas bsdu /	hum tram hr aa zhes ba la sya la sogs ba brgyad de mtshams kyi cha la jog de nas gtso bo dang tha mi dad ba sdud 
BO_T02_D2627:263a-4	phyag dang ched du brjod de dbang blang lcags kyu la sogs pas las bya zhing dbang bskur te tshe bsring ba'i las la sbyar las kyi rgyal po mchog gi ting nge 'dzin no //	phyag dang ched du rjod de dbang blang lcags kyu la sogs ba las byed zhing dbang skur te tshe bsring ba las la sbyor las kyi rgyal po mchog gi ting nge dzin no 
BO_T02_D2627:263a-5	de nas bzla bar bya ba brjod cing sgo dbye ba sngon du 'gro bas bsdu /	de nas bzla ba byed ba rjod cing sgo byed ba sngon du gro ba sdud 
BO_T02_D2627:263a-6	lcags kyu la sogs pas las bya zhing mchod yon sngon du 'go bas phyag rgya bzhis rgyas btab /	lcags kyu la sogs ba las byed zhing mchod yon sngon du go ba phyag rgya bzhis rgya debs 
BO_T02_D2627:263a-7	dbang bskur mchod pa sna tshogs kyis mchod de /	dbang skur mchod ba sna tshogs kyis mchod de 
BO_T02_D2627:263a-8	lha thams cad kyi thugs ka'i zla ba la sngags bkod nas bzlas brjod bya /	lha thams cad kyi thugs ka zla ba la sngags bkod nas bzlas rjod byed 
BO_T02_D2627:263a-9	thun bzhi'i tha mar bstod pa sngon du 'gro bas mchod pa dang phyag dang dbang bskur ba dang go bgo ba dang dge ba'i rtsa pa bsngo ba dang brjod par gsol ba dang rdo rje sems ma'i phyag rgya bkrol te gshegs su gsol ba dang sprul pa dang	thun bzhi tha mar bstod ba sngon du gro ba mchod ba dang phyag dang dbang skur ba dang go bgod ba dang dge ba rtsa ba sngo ba dang rjod ba gsol ba dang rdo rje sems ma phyag rgya grol te gshegs su gsol ba dang sprul ba dang 
BO_T02_D2627:263a-10	lus la bsdu ba brtan par bya'o //	lus la sdud ba brtan ba byed 
BO_T02_D2627:263a-11	de nas langs te glegs bam bklag pa la sogs pa ci nus bya'o //	de nas ldang te glegs bam klog ba la sogs ba ci nus byed 
BO_T02_D2627:263a-12	de ltar byas pas zla ba drug gam lo gcig gam lha rnams las gnang ba thob pa dang 'bum phrag gcig gi bar du byas te sngon du bsnyen pa'i cho ga'o //	de ltar byed ba zla ba drug gam lo gcig gam lha rnams las gnang ba thob ba dang bum phrag gcig gi ba du byed te sngon du snyen ba cho ga 
BO_T02_D2627:263a-13	de nas sngar bshad pa bzhin dus gzung ba dang lhag par gnas pa'i cho ga dang / thig byin gyis brlab pa la sogs pa sngon du 'gro ba zhes bya ba'i don to //	de nas sngar chad ba bzhin dus gzung ba dang lhag ba gnas ba cho ga dang thig byin gyis brlab ba la sogs ba sngon du gro ba zhes byed ba don to 
BO_T02_D2627:263a-14	dkyil 'khor ni 'di yin te /	dkyil khor ni di yin te 
BO_T02_D2627:263a-15	gru bzhi pa la sgo bzhi pa //	gru bzhi ba la sgo bzhi ba 
BO_T02_D2627:263a-16	sgo ba bzhi dang yang dag ldan //	sgo ba bzhi dang yang dag ldan 
BO_T02_D2627:263a-17	rta babs bzhi dang ldan par bya //	rta bab bzhi dang ldan ba byed 
BO_T02_D2627:263a-18	zhes bya ba snga ma bzhin du shes par bya'o //	zhes byed ba snga ma bzhin du shes ba byed 
BO_T02_D2627:263a-19	phyi dang nang gi dkyil 'khor spyir lte bar bcas shing sgo khyud dang ldan pa /	phyi dang nang gi dkyil khor spyir lte ba cha shing sgo khyud dang ldan ba 
BO_T02_D2627:263a-20	lte ba dang ni sgo khyud ldan //	lte ba dang ni sgo khyud ldan 
BO_T02_D2627:263a-21	zhes bya'o // nang gi dkyil 'khor rtsibs bzhi'i lte ba dang bcas pa'o //	zhes byed nang gi dkyil khor rtsibs bzhi lte ba dang cha ba 
BO_T02_D2627:263a-22	de yi dbus su 'khor lo'o //	de yi dbus su khor lo 
BO_T02_D2627:263a-23	dkyil 'khor dam pa bri bya ste //	dkyil khor dam ba bri byed ste 
BO_T02_D2627:263a-24	rtsibs bzhi pa dang ldan pa la //	rtsibs bzhi ba dang ldan ba la 
BO_T02_D2627:263a-25	lte ba'i dkyil 'khor ldan par bya //	lte ba dkyil khor ldan ba byed 
BO_T02_D2627:263a-26	zhes bya ba ston to //	zhes byed ba ston to 
BO_T02_D2627:263a-27	de ru lha gang bri zhe na //	de ru lha gang bri zhe na 
BO_T02_D2627:263a-28	de yi dbus su gtso bo ni //	de yi dbus su gtso bo ni 
BO_T02_D2627:263a-29	phyag na rdo rje dril bsnams shing //	phyag na rdo rje dril snom shing 
BO_T02_D2627:263b-0	zla ba 'dra ba'i zhal @263b 'dzum bri //	zla ba dra ba zhal dzum bri 
BO_T02_D2627:263b-1	zhes bya ba la sogs pa bri ba gsungs so //	zhes byed ba la sogs ba bri ba gsungs so 
BO_T02_D2627:263b-2	dkyil 'khor gyi 'khor lo'i lte bar gtso bo rdo rje 'dzin pa zhi ba phyag na rdo rje dang dril bu bsnams shing kha dog dkar po zhal 'dzum par bri bar bya'o //	dkyil khor gyi khor lo lte ba gtso bo rdo rje dzin ba zhi ba phyag na rdo rje dang dril bu snom shing kha dog dkar po zhal dzum ba bri ba byed 
BO_T02_D2627:263b-3	'khor lo'i rtsibs bzhi la shar du mi bskyod pa /	khor lo rtsibs bzhi la char du mi skyod ba 
BO_T02_D2627:263b-4	lhor rin chen 'byung ldan ;	lhor rin chen byung ldan 
BO_T02_D2627:263b-5	nub tu 'od dpag med /	nub tu d dpog med 
BO_T02_D2627:263b-6	byang du don yod grub pa bri ste thams cad kyang 'khor los sgyur ba'i cha lugs can kha dog dkar po dbu rgyan la sogs pa'i rgyan sna tshogs kyis brgyan pa g-yas pa mchog sbyin du byed pa /	byang du don yod grub ba bri ste thams cad kyang khor los sgyur ba cha lugs can kha dog dkar po dbu rgyan la sogs ba rgyan sna tshogs kyis rgyan ba g-yas ba mchog sbyin du byed ba 
BO_T02_D2627:263b-7	g-yon mi 'jigs pa rdo rje'i skyil krung gis so //	g-yon mi jigs ba rdo rje skyil krung gis so 
BO_T02_D2627:263b-8	nang gi grva la l'a sye la sogs pa bri'o //	nang gi grva la la sye la sogs ba bri 
BO_T02_D2627:263b-9	phyi'i grva la dhuppe la sogs pa'o //	phyi grva la dhuppe la sogs ba 
BO_T02_D2627:263b-10	sgo bzhi la sgom bzhi bri ste g-yon brkyang ba dang / zlum po dang / mthun pa'i rkang thams cad kyis gnas par bri ste /	sgo bzhi la sgom bzhi bri ste g-yon rkyong ba dang zlum po dang mthun ba rkang thams cad kyis gnas ba bri ste 
BO_T02_D2627:263b-11	de nas gzhan yang bris pa ltar bar snang las 'ongs te gcig tu bsre ba dang / gdugs dang rgyal mtshan bum pa'i mchog dang gtor ma dang rta babs dang chos klog pa dang / me tog sil ma bkram pa dang bcas pa ni de nas zhes bya bas ston te /	de nas gzhan yang bri ba ltar ba snang las ngs te gcig tu bsre ba dang gdugs dang rgyal mtshan bum ba mchog dang thor ma dang rta bab dang chos klog ba dang me tog sil ma grem ba dang cha ba ni de nas zhes byed ba ston te 
BO_T02_D2627:263b-12	rnal 'byor bdag nyid zhugs zhes bya ste /	rnal byor bdag nyid jug zhes byed ste 
BO_T02_D2627:263b-13	zhugs nas lhag chad bskang ba dang sgo dbye ba sngon du 'gro bas ting nge 'dzin gsum dang ldan par gnas pas sgo dbye ba ston to //	jug nas lhag chad skong ba dang sgo byed ba sngon du gro ba ting nge dzin gsum dang ldan ba gnas ba sgo byed ba ston to 
BO_T02_D2627:263b-14	de nas bsdu zhing spyan drang ba ni sngags kyis lha rnams spyan drangs te /	de nas sdud zhing spyan dren ba ni sngags kyis lha rnams spyan drangs te 
BO_T02_D2627:263b-15	dza: h'um bam ho:bha ga b'a na badzra ae hya hi sa ma ya stvam /	dza: hum bam ho:bha ga ba na badzra ae hya hi sa ma ya stvam 
BO_T02_D2627:263b-16	de nas gtso bo byon pa dang // zhes bya ba ni /	de nas gtso bo byon ba dang zhes byed ba ni 
BO_T02_D2627:263b-17	mdor na mchod pa byas nas kyang //	mdor na mchod ba byed nas kyang 
BO_T02_D2627:263b-18	zhes bya ba ni /	zhes byed ba ni 
BO_T02_D2627:263b-19	mdor bsdun lcags kyu la sogs pas las bya zhing bgegs bsal sgo bcad pa la sogs pa snga ma bzhin du byas nas /	mdor bsdun lcags kyu la sogs ba las byed zhing bgegs bsal sgo gcod ba la sogs ba snga ma bzhin du byed nas 
BO_T02_D2627:263b-20	phyag rgya bzhis rgyas gdab dbang bskur bzlas brjod bya ba rnams ni mdor na zhes bya'o //	phyag rgya bzhis rgya gdab dbang skur bzlas rjod byed ba rnams ni mdor na zhes byed 
BO_T02_D2627:263b-21	mchod pa byas nas zhes bya ba ni /	mchod ba byed nas zhes byed ba ni 
BO_T02_D2627:263b-22	aarga mchog bstabs pa la sogs pa'i mchod pa bya'o //	aarga mchog stob ba la sogs ba mchod ba byed 
BO_T02_D2627:263b-23	kyang zhes bya ba ni gtor ma dang sbyin sreg dang gnang ba nod pa bsdu'o //	kyang zhes byed ba ni thor ma dang sbyin sreg dang gnang ba nod ba sdud 
BO_T02_D2627:263b-24	'chi bdag sbrul gyi 'jigs ldan rnams //	chi bdag sbrul gyi jigs ldan rnams 
BO_T02_D2627:263b-25	zhes bya ba la sogs pas dkyil 'khor du gzhug pa bstan to //	zhes byed ba la sogs ba dkyil khor du jug ba ston to 
BO_T02_D2627:263b-26	'chi bdag sbrul dang 'dra bas 'jigs ldan rnams gzhom pa'i phyir gzhug par bya ste /	chi bdag sbrul dang dra ba jigs ldan rnams joms ba phyir jug ba byed ste 
BO_T02_D2627:264a-0	mdor na / aom badzra sa ma ya h'um zhes bya @264a * //	mdor na aom badzra sa ma ya hum zhes byed 
BO_T02_D2627:264a-1	bas ti r'inti ri'i phyag rgya bcings la rin chen thogs te yang na phreng ba thogs te gzhug / h'um pra t'itstsha badzra h'um zhes bya bas me tog dor /	ba ti rnti ri phyag rgya ching la rin chen thogs te yang na phreng ba thogs te jug hum pra ttstsha badzra hum zhes byed ba me tog dor 
BO_T02_D2627:264a-2	badzra sa ma ya h'um zhes bya bas dam tshig sbyin /	badzra sa ma ya hum zhes byed ba dam tshig sbyin 
BO_T02_D2627:264a-3	aom badzra h'a syod gha tra ya zhes bya bas gdong g-yogs dgrol /	aom badzra ha syod gha tra ya zhes byed ba gdong g-yogs grol 
BO_T02_D2627:264a-4	aom badzra p'a shya h'um zhes bya bas dkyil 'khor bstan nas snying gar phyag rgya dgrol /	aom badzra pa shya hum zhes byed ba dkyil khor ston nas snying gar phyag rgya grol 
BO_T02_D2627:264a-5	'di'i sgrub pa'i go rims ni rtsa ba'i rgyud du bshad zin to //	di sgrub ba go rims ni rtsa ba brgyud du chad zin to 
BO_T02_D2627:264a-6	de nas zhes bya ba la sogs pas dbang bskur ba bstan to //	de nas zhes byed ba la sogs ba dbang skur ba ston to 
BO_T02_D2627:264a-7	de yang dang bor dbu rgyan dang / bum pa dang / phreng ba dang / phyag rgya dang / rdo rje dang / las kyi rdo rje dang / 'khor lo dang / thabs dang / shes rab dang / gsang ba dang / shes rab kyis dbang bskur ba rnams yin te /	de yang dang bor dbu rgyan dang bum ba dang phreng ba dang phyag rgya dang rdo rje dang las kyi rdo rje dang khor lo dang thabs dang shes rab dang gsang ba dang shes rab kyis dbang skur ba rnams yin te 
BO_T02_D2627:264a-8	'di yang rtsa ba'i rgyud du bshad pa de bzhin du shes par bya'o //	di yang rtsa ba brgyud du chad ba de bzhin du shes ba byed 
BO_T02_D2627:264a-9	de ltar dbang bskur na tshe ring ba'i rig pa 'di sbyin no zhes bya ba la sogs pas 'di nyid du dbang bskur ba dang dam tshig thob pa la dngos grub sbyin no zhes bya ba ste /	de ltar dbang skur na tshe ring ba rig ba di sbyin no zhes byed ba la sogs ba di nyid du dbang skur ba dang dam tshig thob ba la dngos grub sbyin no zhes byed ba ste 
BO_T02_D2627:264a-10	de ltar sngar bshad pa ltar bskur nas tshe ring ba thob par byed pa'i rig pa 'di slob dpon gyis slob ma la sbyin no //	de ltar sngar chad ba ltar skur nas tshe ring ba thob ba byed ba rig ba di slob dpon gyis slob ma la sbyin no 
BO_T02_D2627:264a-11	de nyid aom bh'um badzra a'a yu she h'um aa zhes bya ba'o //	de nyid aom bhum badzra aa yu she hum aa zhes byed ba 
BO_T02_D2627:264a-12	de nas sgrub pa 'di yin te zhes bya ba ni 'dis sgrub pas na bsgrub ste 'og gnas 'byung ba'i chogs so //	de nas sgrub ba di yin te zhes byed ba ni dis sgrub ba na sgrub ste g gnas byung ba chogs so 
BO_T02_D2627:264a-13	'di yin te zhes bya ba ni ston pas rtsom pa'o //	di yin te zhes byed ba ni ston ba rtsom ba 
BO_T02_D2627:264a-14	bcom ldan 'das rdo rje tshe dpag med zla ba'i 'od can zhes bya ba la sogs pas dang po bri ba dang bsnyen pa ston te bcom ldan 'das tshe dpag med kha dog dkar po rgyan kun gyis brgyan pa g-yas pa mchog sbyin dang g-yon pa mi 'jigs	joms ldan da rdo rje tshe dpog med zla ba d can zhes byed ba la sogs ba dang po bri ba dang snyen ba ston te joms ldan da tshe dpog med kha dog dkar po rgyan kun gyis rgyan ba g-yas ba mchog sbyin dang g-yon ba mi jigs 
BO_T02_D2627:264a-15	pa sbyin pa de las bdud rtsi 'dzag pa bri'o //	ba sbyin ba de las bdud rtsi dzag ba bri 
BO_T02_D2627:264a-16	de'i 'og tu rnal 'byor pa thal mo sbyar ba gdong gyen du bltas pa /	de g tu rnal byor ba thal mo sbyor ba gdong gyen du lta ba 
BO_T02_D2627:264a-17	mchod pa rnam pa lnga dang bcas pa ras la bris te spyan dbye ba'i cho ga sngar bshad pa bzhin du byas la /	mchod ba rnam ba lnga dang cha ba ras la bri te spyan byed ba cho ga sngar chad ba bzhin du byed la 
BO_T02_D2627:264a-18	de'i spyan sngar dang po'i sbyor ba'i ting nge 'dzin bsgom ste bcom ldan 'das la sems bzhin du 'bum bzlas so //	de spyan sngar dang po sbyor ba ting nge dzin bsgom ste joms ldan da la sems bzhin du bum bzlas so 
BO_T02_D2627:264a-19	de nas zla ba nya ba la zhes bya ba la sogs pas sgrub pa ston te /	de nas zla ba nya ba la zhes byed ba la sogs ba sgrub ba ston te 
BO_T02_D2627:264a-20	nya'i nub mo dkyil 'khor chen po brtsams te mchod pa byas la ba dmar ser gyi mar snod gsar bar bcug la rdo rje khu tshur g-yon pas mnan la /	nya nub mo dkyil khor chen po brtsams te mchod ba byed la ba dmar ser gyi mar snod gsar ba jug la rdo rje khu tshur g-yon ba gnon la 
BO_T02_D2627:264b-0	bcom ldan 'das srog @264b dang bcas pa lta bur sems shing mtshan thog thag bzlas brjod bya ba yin no //	joms ldan da srog dang cha ba lta bur sems shing mtshan thogs thag bzlas rjod byed ba yin no 
BO_T02_D2627:264b-1	de nas dri sna tshogs bsnams shing zhes bya ba la sogs pas mtshan ma dang dngos grub ston to //	de nas dri sna tshogs snom shing zhes byed ba la sogs ba mtshan ma dang dngos grub ston to 
BO_T02_D2627:264b-2	de nas dri dang ldan pa 'am rlangs pa 'am /	de nas dri dang ldan ba mang rlangs ba mang 
BO_T02_D2627:264b-3	du ba'am me 'am 'od zer ram me sgron nam 'od la sogs pa'i mtshan ma byung na mar me de yang mar sar pa la sogs pa rdza sa bcu gcig po gang yang rung ba la bsres te /	du ba me mang d zer ram me sgron nam d la sogs ba mtshan ma byung na mar me de yang mar sar ba la sogs ba rdza sa chu gcig po gang yang rung ba la bsres te 
BO_T02_D2627:264b-4	nang par sngar srung ba dang / khrus la sogs pas bdag nyid dkyil 'khor brtags pa'i tshul du sbyangs nas /	nang ba sngar srung ba dang khru la sogs ba bdag nyid dkyil khor rtog ba tshul du sbyong nas 
BO_T02_D2627:264b-5	lha'i rnal 'byor du byas te 'thungs sam zos na nyi ma dang zla ba yod kyi bar du tshe ring ba rdo rje dang 'dra bar 'gyur ro //	lha rnal byor du byed te thung sam zos na nyi ma dang zla ba yod kyi ba du tshe ring ba rdo rje dang dra ba gyur ro 
BO_T02_D2627:264b-6	mtshan ma tha ma byung na /	mtshan ma tha ma byung na 
BO_T02_D2627:264b-7	nad med zo mdog bde skra dkar dang gnyer ba med pa'i tshe lo brgya par 'gyur ro //	nad med zo mdog bde skra dkar dang gnyer ba med ba tshe lo brgya ba gyur ro 
BO_T02_D2627:264b-8	gzhan yang des nyungs kar la sogs pas zhi ba la sogs pa'i las 'grub par 'gyur te the tshom med do //	gzhan yang des nyungs kar la sogs ba zhi ba la sogs ba las grub ba gyur te the tshom med do 
BO_T02_D2627:264b-9	de ltar tshe tshad med pa'i dkyil 'khor bshad nas /	de ltar tshe tshad med ba dkyil khor chad nas 
BO_T02_D2627:264b-10	da ni 'jig rten pa'i lha la mos pa'i don du 'jig rten pa'i dkyil 'khor drug bstan te /	da ni jig rten ba lha la mos ba don du jig rten ba dkyil khor drug ston te 
