segmentnr	original	stemmed
BO_T02_D2627:279b-7	las kyi phyag rgya yang 'di dag yin no zhes bya ba ni thugs dam tshig snying po'i phyag rgya'o //	las kyi phyag rgya yang di dag yin no zhes byed ba ni thugs dam tshig snying po phyag rgya 
BO_T02_D2627:279b-8	'jig rten pa'i las kyi phyag rgya yang 'di dag nyid do //	jig rten ba las kyi phyag rgya yang di dag nyid do 
BO_T02_D2627:279b-9	de nyid las srin lag sbas pa ni phyag na rdo rje'i zhes pa ni rdo rje thal mo de nyid las mdzub mo'i tshigs bar ma bcag pa ste dbang bskur ba rdo rje rin chen gyi phyag rgya ste /	de nyid las srin lag sbed ba ni phyag na rdo rje zhes ba ni rdo rje thal mo de nyid las mdzub mo tshigs ba ma chag ba ste dbang skur ba rdo rje rin chen gyi phyag rgya ste 
BO_T02_D2627:279b-10	de nyid las h'um zhes bya bas tshigs bar ma bcag pa ni dbang bskur ba sbyin par byed pa ste /	de nyid las hum zhes byed ba tshigs ba ma chag ba ni dbang skur ba sbyin ba byed ba ste 
BO_T02_D2627:279b-11	nam mkha'i snying po'i phyag rgya'o //	nam mkha snying po phyag rgya 
BO_T02_D2627:279b-12	de nyid las h'um zhes bya ba ni gshibs la srin lag padma 'dra bar byas pa 'di padma 'byung ba'i chags pa'i phyag rgya'o zhes bya ba ni mdzub mo gnyis gshibs srin lag padma 'dra bar bya ba ni rnam par gsal ba'i phyag rgya'o //	de nyid las hum zhes byed ba ni gshibs la srin lag padma dra ba byed ba di padma byung ba chags ba phyag rgya zhes byed ba ni mdzub mo gnyis gshibs srin lag padma dra ba byed ba ni rnam ba gsal ba phyag rgya 
BO_T02_D2627:279b-13	mdzub mo gnyis dang srin lag gnyis bsgreng ba ni rdo rje sems dpa' ste de nyid las h'um zhes bya ba dang // hri zhes bya bas gshibs te bsgreng ba ni bcom ldan 'das rdo rje sems dpa'i phyag rgya'o //	mdzub mo gnyis dang srin lag gnyis sgreng ba ni rdo rje sems dpa ste de nyid las hum zhes byed ba dang hri zhes byed ba gshibs te sgreng ba ni joms ldan da rdo rje sems dpa phyag rgya 
BO_T02_D2627:279b-14	de nyid las padma 'dra bar byas pa ni bde ba chen po'i phyag rgya'o //	de nyid las padma dra ba byed ba ni bde ba chen po phyag rgya 
BO_T02_D2627:279b-15	de nyid las 'od zer 'phro ba'i tshul du byas pa ni kun du bzang po'i phyag rgya'o zhes bya ba ni rdo rje thal mo padma 'dra bar byas pa dang // 'od zer 'phro ba ni bde ba chen po dang kun du bzang po'i phyag rgya'o //	de nyid las d zer phro ba tshul du byed ba ni kun du bzang po phyag rgya zhes byed ba ni rdo rje thal mo padma dra ba byed ba dang d zer phro ba ni bde ba chen po dang kun du bzang po phyag rgya 
BO_T02_D2627:279b-16	de nyid nang du bkug na ni //	de nyid nang du gugs na ni 
BO_T02_D2627:279b-17	khro bo sna tshogs gzi can no //	khro bo sna tshogs gzi can no 
BO_T02_D2627:279b-18	zhes bya ba ni thal mo nang du bkug pa khro bo'i'o //	zhes byed ba ni thal mo nang du gugs ba khro bo 
BO_T02_D2627:279b-19	de nyid las shin tu bsdams pa ni rdo rje bsdams pa'o //	de nyid las shin tu sdom ba ni rdo rje sdom ba 
BO_T02_D2627:279b-20	brkyang pa ni srung ba'o //	rkyong ba ni srung ba 
BO_T02_D2627:279b-21	hri zhes bya ba'i sa bon ni gnod sbyin gyi'o zhes bya ba sor mo rnams bsdams pa rdo rje dam tshig gi phyag rgya'i rgyu dang / brkyang nas mgul du 'khyud pa srung ba'i dang // mdzub mo mche ba gnod sbyin gyi phyag rgya'o //	hri zhes byed ba sa bon ni gnod sbyin gyi zhes byed ba sor mo rnams sdom ba rdo rje dam tshig gi phyag rgya rgyu dang rkyong nas mgul du khyud ba srung ba dang mdzub mo mche ba gnod sbyin gyi phyag rgya 
BO_T02_D2627:279b-22	h'um zhes bya ba lcags kyur byas pa ni bkug pa'o //	hum zhes byed ba lcags kyur byed ba ni gugs ba 
BO_T02_D2627:279b-23	de nyid mdar byas pa ni 'dod pa'o //	de nyid mdar byed ba ni dod ba 
BO_T02_D2627:279b-24	aom dang h'um gnyis sbyar ba dgyes pa'o zhes bya ba ni mdzub mo gnyis lcags kyur byas pa rgyal po'i'o //	aom dang hum gnyis sbyor ba dgyes ba zhes byed ba ni mdzub mo gnyis lcags kyur byed ba rgyal po 
BO_T02_D2627:279b-25	mdzub mo gnyis mdar byas pa chags pa'i'o //	mdzub mo gnyis mdar byed ba chags ba 
BO_T02_D2627:280a-0	mthe bong dang @280a * //	mthe bong dang 
BO_T02_D2627:280a-1	mdzub mo gnyis se gol gtogs pa ni legs pa'i'o //	mdzub mo gnyis se gol gtogs ba ni legs ba 
BO_T02_D2627:280a-2	de nyid dkyil 'khor lta bur byas pa ni gzi brjid kyi'o //	de nyid dkyil khor lta bur byed ba ni gzi brjid kyi 
BO_T02_D2627:280a-3	de nyid nor bu 'dra bar byas pa ni rgyal mtshan gyi'o //	de nyid nor bu dra ba byed ba ni rgyal mtshan gyi 
BO_T02_D2627:280a-4	bskor na gzhag pa ste de nyid khar gzhag na dgyes shing 'dzum par mdzad pa ya mtshan no zhes bya ba rdo rje bsdams pa las 'od zer 'bar ba ltar byas pa gzi brjid kyi'o //	skor na jog ba ste de nyid khar jog na dgyes shing dzum ba mdzad ba ya mtshan no zhes byed ba rdo rje sdom ba las d zer bar ba ltar byed ba gzi brjid kyi 
BO_T02_D2627:280a-5	rdo rje bsdams pa nyid thal mor byas pa nor bu 'dra bar byas pa ni rgyal mtshan gyi'o //	rdo rje sdom ba nyid thal mor byed ba nor bu dra ba byed ba ni rgyal mtshan gyi 
BO_T02_D2627:280a-6	de nyid bskor nas kha'i phyogs su gzhag pa ni bzhad pa'i'o //	de nyid skor nas kha phyogs su jog ba ni bzhad ba 
BO_T02_D2627:280a-7	thal mo padmo bkug pa ni padmo'i'o //	thal mo padmo gugs ba ni padmo 
BO_T02_D2627:280a-8	aa zhes bya ba dang aom zhes bya ba gnyis nang du bkug pa ni ral gri'o //	aa zhes byed ba dang aom zhes byed ba gnyis nang du gugs ba ni ral gri 
BO_T02_D2627:280a-9	gcig la gcig sbyar ba ni 'khor lo'i'o //	gcig la gcig sbyor ba ni khor lo 
BO_T02_D2627:280a-10	snga ma las aom zhes bya ba gnyis khar gzhag pa ni 'byung ba ste zhes bya ba thal mo padmo dang mthe'u chung dang mthe bong bkug nas lhag ma ral gri dang thal mo sbyar ba dang / mthe bong gnyis khar gzhag pa ni go rims bzhin du chos dang rnon po dang /	snga ma las aom zhes byed ba gnyis khar jog ba ni byung ba ste zhes byed ba thal mo padmo dang mtheu chung dang mthe bong gugs nas lhag ma ral gri dang thal mo sbyor ba dang mthe bong gnyis khar jog ba ni go rims bzhin du chos dang rnon po dang 
BO_T02_D2627:280a-11	'khor lo dang smra ba'i phyag rgya'o //	khor lo dang smra ba phyag rgya 
BO_T02_D2627:280a-12	mdor na phyag rgya ni las kyi phyag rgya sbyin par byed pa'o zhes bya ba ni yon tan mdor bsdu na las thams cad sbyin par byed pa'o zhes bya ba'o //	mdor na phyag rgya ni las kyi phyag rgya sbyin ba byed ba zhes byed ba ni yon tan mdor sdud na las thams cad sbyin ba byed ba zhes byed ba 
BO_T02_D2627:280a-13	de nyid bsdus mdud sprul mgor 'gyur //	de nyid sdud mdud sprul mgor gyur 
BO_T02_D2627:280a-14	zhes bya ba ni rdo rje thal mo de nyid las mtshams gnyis bsdus la sor mo'i rtse mo bsdus nas btud de sprul mgo ltar byas pa ni klu dang chu lha'i phyag rgya'o //	zhes byed ba ni rdo rje thal mo de nyid las mtshams gnyis sdud la sor mo rtse mo sdud nas dud de sprul mgo ltar byed ba ni klu dang chu lha phyag rgya 
BO_T02_D2627:280a-15	kun du gnod sbyin mche ba 'dra //	kun du gnod sbyin mche ba dra 
BO_T02_D2627:280a-16	zhes bya ba ni mdzub mo gnyis mche ba 'dra bar byas pa ni gnod sbyin no //	zhes byed ba ni mdzub mo gnyis mche ba dra ba byed ba ni gnod sbyin no 
BO_T02_D2627:280a-17	srin po yi ni khrag 'phrog pa //	srin po yi ni khrag phrog ba 
BO_T02_D2627:280a-18	zhes bya ba khrag 'thung pa ltar byed pa srin po'i'o //	zhes byed ba khrag thung ba ltar byed ba srin po 
BO_T02_D2627:280a-19	lag pa bskor ba rlung gi ste //	lag ba skor ba rlung gi ste 
BO_T02_D2627:280a-20	dbyug to ldan pa gnod sbyin no //	dbyug to ldan ba gnod sbyin no 
BO_T02_D2627:280a-21	bum pa gzhag pa nor gyi'o //	bum ba jog ba nor gyi 
BO_T02_D2627:280a-22	zhes bya ba ni lag pa bskor ba rlung lha'i'o //	zhes byed ba ni lag ba skor ba rlung lha 
BO_T02_D2627:280a-23	dbyug to ltar byed pa ni gnod sbyin gyi'o //	dbyug to ltar byed ba ni gnod sbyin gyi 
BO_T02_D2627:280a-24	lag pa gnyis bum pa ltar byed pa ni nor lha'i'o //	lag ba gnyis bum ba ltar byed ba ni nor lha 
BO_T02_D2627:280a-25	mthe bong ne le'i rna 'drar bya //	mthe bong ne le rna drar byed 
BO_T02_D2627:280a-26	mgo bo thod pa nag po ste //	mgo bo thod ba nag po ste 
BO_T02_D2627:280a-27	bhridgi ri ti lag brkyang pa //	bhridgi ri ti lag rkyong ba 
BO_T02_D2627:280a-28	pi wang g-yon thogs dri za'o //	pi wang g-yon thogs dri za 
BO_T02_D2627:280a-29	lag gnyis 'bar ba me 'bar ba //	lag gnyis bar ba me bar ba 
BO_T02_D2627:280a-30	gung mo dbyug 'dra gshin rje yi //	gung mo dbyug dra gshin rje yi 
BO_T02_D2627:280a-31	zhes bya ba ni rdo rje thal mo nyid mthe bong gnyis rna ba dang 'dra bar bya ba ni rnam thos bu'o //	zhes byed ba ni rdo rje thal mo nyid mthe bong gnyis rna ba dang dra ba byed ba ni rnam thos bu 
BO_T02_D2627:280b-0	g-yon pa mgo thod mkhal ma'i phyogs su @280b 'jog pa ni nag po chen po'i'o //	g-yon ba mgo thod mkhal ma phyogs su jog ba ni nag po chen po 
BO_T02_D2627:280b-1	tha ma brkyang ba ni bhridgi ri ti'i'o //	tha ma rkyong ba ni bhridgi ri ti 
BO_T02_D2627:280b-2	g-yon pa pi wang thogs pa ni dri za'i'o //	g-yon ba pi wang thogs ba ni dri za 
BO_T02_D2627:280b-3	lhag ma gnyis kyi sor mo me 'dra bar byas pa ni me lha'i'o //	lhag ma gnyis kyi sor mo me dra ba byed ba ni me lha 
BO_T02_D2627:280b-4	lag pa gnyis kyi gung mo dbyug pa 'dra bar byas pa ni gshin rje'o //	lag ba gnyis kyi gung mo dbyug ba dra ba byed ba ni gshin rje 
BO_T02_D2627:280b-5	rnal 'byor khro dang dbang sbyin pa //	rnal byor khro dang dbang sbyin ba 
BO_T02_D2627:280b-6	mthe'u chung ral gri mdzub gzhag can //	mtheu chung ral gri mdzub jog can 
BO_T02_D2627:280b-7	zhes bya ba ni rdo rje thal mo las mthe'u chung gnyis ral gri ltar byas pa ni rna ba la gzhag la khro bo'i tshul du bya ba dang mdzub mo gnyis zhags pa ltar byas pa ste gzhan la dbang du byed pa sbyin pa dang bcas pa chu	zhes byed ba ni rdo rje thal mo las mtheu chung gnyis ral gri ltar byed ba ni rna ba la jog la khro bo tshul du byed ba dang mdzub mo gnyis zhags ba ltar byed ba ste gzhan la dbang du byed ba sbyin ba dang cha ba chu 
BO_T02_D2627:280b-8	lha 'khor dang bcas pa'i phyag rgya'o //	lha khor dang cha ba phyag rgya 
BO_T02_D2627:280b-9	rlung gi rgyal mtshan rang gi gdong //	rlung gi rgyal mtshan rang gi gdong 
BO_T02_D2627:280b-10	zhes bya ba ni lag pa g-yas pa'i mthe bos mdzub mo mnan /	zhes byed ba ni lag ba g-yas ba mthe bod mdzub mo gnon 
BO_T02_D2627:280b-11	sor mo lhag ma gsum pa ba dan ltar byas pa rang gi gdong du 'phyar ba ni rlung lha'i'o //	sor mo lhag ma gsum ba ba dan ltar byed ba rang gi gdong du phyor ba ni rlung lha 
BO_T02_D2627:280b-12	de la sogs pa'i phyag rgya rnams //	de la sogs ba phyag rgya rnams 
BO_T02_D2627:280b-13	lag las skyes pas skye bar 'gyur //	lag las skye ba skye ba gyur 
BO_T02_D2627:280b-14	zhes bya ba ni gong du bshad pa'i phyag rgya de la sogs pa phyag rgya sna tshogs pa rnams rgyu lag pa las skye zhing bcing bar 'gyur ro zhes bya ba yin no //	zhes byed ba ni gong du chad ba phyag rgya de la sogs ba phyag rgya sna tshogs ba rnams rgyu lag ba las skye zhing ching ba gyur ro zhes byed ba yin no 
BO_T02_D2627:280b-15	lha rnams kyi thun mong du /	lha rnams kyi thun mong du 
BO_T02_D2627:280b-16	padma'i phyag rgya bkra shis te //	padma phyag rgya bkra shis te 
BO_T02_D2627:280b-17	klu rnams zhes bya autpala //	klu rnams zhes byed autpala 
BO_T02_D2627:280b-18	de ltar so ni gnod sbyin rnams //	de ltar so ni gnod sbyin rnams 
BO_T02_D2627:280b-19	srin po rnams kyi mgo tshal pa //	srin po rnams kyi mgo tshal ba 
BO_T02_D2627:280b-20	bud med rnams kyi sor bcu bsnol //	bud med rnams kyi sor chu snol 
BO_T02_D2627:280b-21	gza' rnams kyi ni dbyug pa ste //	gza rnams kyi ni dbyug ba ste 
BO_T02_D2627:280b-22	aa rga dbul ba rgyu skar rnams //	aa rga bul ba rgyu skar rnams 
BO_T02_D2627:280b-23	de dag kun gyis sems 'grub po //	de dag kun gyis sems grub po 
BO_T02_D2627:280b-24	zhes bya ba ni 'jig rten pa'i lha thams cad kyi thun mong du thal mo padmo'i phyag rgya'o //	zhes byed ba ni jig rten ba lha thams cad kyi thun mong du thal mo padmo phyag rgya 
BO_T02_D2627:280b-25	klu rnams kyi sor mo autpala ltar byas pa'o //	klu rnams kyi sor mo autpala ltar byed ba 
BO_T02_D2627:280b-26	gnod sbyin thams cad kyi sor mo rnams so ltar byas pa'o //	gnod sbyin thams cad kyi sor mo rnams so ltar byed ba 
BO_T02_D2627:280b-27	srin po rnams kyi lag pa g-yas g-yon mgo po'i tshal ba ltar byas pa'o //	srin po rnams kyi lag ba g-yas g-yon mgo po tshal ba ltar byed ba 
BO_T02_D2627:280b-28	bud med thams cad kyi sor mo bcu bsnol ba'o //	bud med thams cad kyi sor mo chu snol ba 
BO_T02_D2627:280b-29	gza' thams cad kyi lag pa g-yas g-yon dbyug pa ltar byas pa'o //	gza thams cad kyi lag ba g-yas g-yon dbyug ba ltar byed ba 
BO_T02_D2627:280b-30	aarga dbul bltar byas pa rgyu skar thams cad kyi ste de dag ni sems bskul ba 'grub bo zhes bya ba'i don to //	aarga bul bltar byed ba rgyu skar thams cad kyi ste de dag ni sems skul ba grub bo zhes byed ba don to 
BO_T02_D2627:280b-31	mgo bo thod pa khar gzhag pa //	mgo bo thod ba khar jog ba 
BO_T02_D2627:280b-32	phyag rgya 'di ni phra men ma //	phyag rgya di ni phra men ma 
BO_T02_D2627:280b-33	mgo thod lce yi phyag rgya ni //	mgo thod lce yi phyag rgya ni 
BO_T02_D2627:280b-34	rdo rje rnal 'byor ma yir bshad //	rdo rje rnal byor ma yir chad 
BO_T02_D2627:280b-35	de dag kun gyi thun mong du //	de dag kun gyi thun mong du 
BO_T02_D2627:280b-36	phyag rgya chen po bshad par bya //	phyag rgya chen po chad ba byed 
BO_T02_D2627:280b-37	thal mo brkyang ba bshad pa ni //	thal mo rkyong ba chad ba ni 
BO_T02_D2627:280b-38	yang na thal mo padmar bya//	yang na thal mo padmar 
BO_T02_D2627:281a-0	@281a * // zhes bya ba ni mgo bo'i thod pa khar gzhag pa ltar byas pa ni phra men ma'i phyag rgya'o //	zhes byed ba ni mgo bo thod ba khar jog ba ltar byed ba ni phra men ma phyag rgya 
BO_T02_D2627:281a-1	mdzub mo dang mthe bong gnyis rtse sprad de srin lag dang mthe'u chung mig 'bras su byas pa gung mo lcer brkyang ba ni rdo rje rnal 'byor ma'i phyag rgya'o //	mdzub mo dang mthe bong gnyis rtse sprod de srin lag dang mtheu chung mig bras su byed ba gung mo lcer rkyong ba ni rdo rje rnal byor ma phyag rgya 
BO_T02_D2627:281a-2	'jig rten pa'i lha thams cad kyi thun mong du thal mo brkyang ba dang yang na padmor byas pa'o //	jig rten ba lha thams cad kyi thun mong du thal mo rkyong ba dang yang na padmor byed ba 
BO_T02_D2627:281a-3	rdo rje khu tshur bcings nas ni //	rdo rje khu tshur ching nas ni 
BO_T02_D2627:281a-4	aa zhes bya ba lu gu rgyud //	aa zhes byed ba lu gu brgyud 
BO_T02_D2627:281a-5	h'um zhes bya ba gnyis bsgreng la //	hum zhes byed ba gnyis sgreng la 
BO_T02_D2627:281a-6	phyag na rdo rje'i phyag rgya yin //	phyag na rdo rje phyag rgya yin 
BO_T02_D2627:281a-7	zhes bya ba ni rdo rje khu tshur gnyis bcings nas mkhrig ma bsnol te mthe'u chung lu gu rgyud du sbrel mdzub mo bsgreng ba ni /	zhes byed ba ni rdo rje khu tshur gnyis ching nas mkhrig ma snol te mtheu chung lu gu brgyud du sbrel mdzub mo sgreng ba ni 
BO_T02_D2627:281a-8	rdo rje 'dzin pa khro bo'o //	rdo rje dzin ba khro bo 
BO_T02_D2627:281a-9	rdo rje bsdams pa bsdams nas kyang //	rdo rje sdom ba sdom nas kyang 
BO_T02_D2627:281a-10	h'um dang aa gnyis gshibs te bsgreng //	hum dang aa gnyis gshibs te sgreng 
BO_T02_D2627:281a-11	aom zhes bya ba ngos bcar ba //	aom zhes byed ba ngos gcer ba 
BO_T02_D2627:281a-12	phyag rgya snang bar byed par dgongs //	phyag rgya snang ba byed ba dgongs 
BO_T02_D2627:281a-13	zhes bya ba ni rdo rje bsdams pa las mdzub mo dang mthe chung gnyis gshibs te bsgreng /	zhes byed ba ni rdo rje sdom ba las mdzub mo dang mthe chung gnyis gshibs te sgreng 
BO_T02_D2627:281a-14	mthe bong ngos la bcar ba ni 'jig rten gsum snang gi'o //	mthe bong ngos la gcer ba ni jig rten gsum snang gi 
BO_T02_D2627:281a-15	de la aa zhes bya ba bcings //	de la aa zhes byed ba ching 
BO_T02_D2627:281a-16	zhes bya ba ni mthe chung nang du bkug pa ni 'jig rten gsum mthar byed kyi'o //	zhes byed ba ni mthe chung nang du gugs ba ni jig rten gsum mthar byed kyi 
BO_T02_D2627:281a-17	aom zhes bya ba nang du bkug / aa zhes bya ba sngon bzhin sbyar//	aom zhes byed ba nang du gugs aa zhes byed ba sngon bzhin 
BO_T02_D2627:281a-18	aom dang aa yang 'dra bar bya //	aom dang aa yang dra ba byed 
BO_T02_D2627:281a-19	zhes bya ba mthe bong gnyis nang du gzhug mthe chung gnyis ni nang du sbyar mthe bong dang mthe'u chung gnyis 'dra bar sbyar ba ni mi g-yo mgon po'i phyag rgya'o //	zhes byed ba mthe bong gnyis nang du jug mthe chung gnyis ni nang du sbyor mthe bong dang mtheu chung gnyis dra ba sbyor ba ni mi g-yo mgon po phyag rgya 
BO_T02_D2627:281a-20	tram zhes bya ba gshibs nas ni //	tram zhes byed ba gshibs nas ni 
BO_T02_D2627:281a-21	ae dang aom gnyis lu gu rgyud //	ae dang aom gnyis lu gu brgyud 
BO_T02_D2627:281a-22	lhag ma gshibs pa'i phyag rgya 'di //	lhag ma gshibs ba phyag rgya di 
BO_T02_D2627:281a-23	bdud rtsi 'khyil par shes par bya //	bdud rtsi khyil ba shes ba byed 
BO_T02_D2627:281a-24	zhes bya ba ni gung mo gnyis gshibs te bsgreng /	zhes byed ba ni gung mo gnyis gshibs te sgreng 
BO_T02_D2627:281a-25	mthe'u chung dang mthe bong lu gu rgyud du sprel /	mtheu chung dang mthe bong lu gu brgyud du sprel 
BO_T02_D2627:281a-26	lhag ma gshibs pa bdud rtsi 'khyil pa'i'o //	lhag ma gshibs ba bdud rtsi khyil ba 
BO_T02_D2627:281a-27	tram zhes bya ba gshibs nas ni //	tram zhes byed ba gshibs nas ni 
BO_T02_D2627:281a-28	h'um zhes bya ba de bzhin no //	hum zhes byed ba de bzhin no 
BO_T02_D2627:281a-29	zhes bya ba gung mo dang mdzub mo gshibs pa ni be con sngon po'i'o //	zhes byed ba gung mo dang mdzub mo gshibs ba ni be con sngon po 
BO_T02_D2627:281a-30	de ltar h'um zhes bya ba gshibs //	de ltar hum zhes byed ba gshibs 
BO_T02_D2627:281a-31	lhag ma 'od zer 'bar bar bya //	lhag ma d zer bar ba byed 
BO_T02_D2627:281a-32	rta mgrin phyag rgya gang yin pa //	rta mgrin phyag rgya gang yin ba 
BO_T02_D2627:281a-33	de yang las rnams kun la gsungs //	de yang las rnams kun la gsungs 
BO_T02_D2627:281b-0	zhes bya ba ni mdzub mo gnyis gshibs te lhag ma 'od zer ltar byas pa @281b rta mgrin gyi phyag rgya ste las dang dngos grub thob par 'gyur ro zhes bshad pa yin no //	zhes byed ba ni mdzub mo gnyis gshibs te lhag ma d zer ltar byed ba rta mgrin gyi phyag rgya ste las dang dngos grub thob ba gyur ro zhes chad ba yin no 
BO_T02_D2627:281b-1	khro bo rnams kyi dam tshig gi phyag rgya'o //	khro bo rnams kyi dam tshig gi phyag rgya 
BO_T02_D2627:281b-2	spyan ni mig dang 'dra bar bshad //	spyan ni mig dang dra ba chad 
BO_T02_D2627:281b-3	m'a ma k'i ni rdo rjer bshad //	ma ma k ni rdo rjer chad 
BO_T02_D2627:281b-4	dkar mo padma nyid du bshad //	dkar mo padma nyid du chad 
BO_T02_D2627:281b-5	autpala ni sgrol mar dgod //	autpala ni sgrol mar god 
BO_T02_D2627:281b-6	ces bya ba ni rdo rje bsdams pa la mdzub mo dang mthe'u chung mig ltar byas pa ni sangs rgyas spyan gyi'o //	ces byed ba ni rdo rje sdom ba la mdzub mo dang mtheu chung mig ltar byed ba ni sangs rgya spyan gyi 
BO_T02_D2627:281b-7	mdzub mo rtse gug pa gung mor sbyar ba ni m'a ma k'i'o //	mdzub mo rtse gug ba gung mor sbyor ba ni ma ma k 
BO_T02_D2627:281b-8	gung mo dang srin lag padmo 'dra bar byas pa ni gos dkar mo'o //	gung mo dang srin lag padmo dra ba byed ba ni gos dkar mo 
BO_T02_D2627:281b-9	mdzub mo'i rtse mo bkug pas gung mo las dkris te /	mdzub mo rtse mo gugs ba gung mo las dkri te 
BO_T02_D2627:281b-10	mthe bong ngos la bcar ba ni sgrol ma'i autpala'o //	mthe bong ngos la gcer ba ni sgrol ma autpala 
BO_T02_D2627:281b-11	gang phyag rgya ma bshad pa thams cad ni de kho na nyid bsdus pa la sogs par shes par bya'o //	gang phyag rgya ma chad ba thams cad ni de kho na nyid sdud ba la sogs ba shes ba byed 
BO_T02_D2627:281b-12	gzhan yang rtag pa thams cad kyi lha bskyed pa dang mi mthun pa'i phyogs gzhom pa dang brdung ba'i sngags ni badzra satva h'um /	gzhan yang rtag ba thams cad kyi lha skyed ba dang mi mthun ba phyogs joms ba dang rdung ba sngags ni badzra satva hum 
BO_T02_D2627:281b-13	dzra r'a dza dza zhes bya ba la sogs pa bcu drug rdo rje sems dpa' la sogs pa'o //	dzra ra dza dza zhes byed ba la sogs ba chu drug rdo rje sems dpa la sogs ba 
BO_T02_D2627:281b-14	aom buddha lo ts'a na h'um /	aom buddha lo tsa na hum 
BO_T02_D2627:281b-15	sangs rgyas spyan gyi'o //	sangs rgya spyan gyi 
BO_T02_D2627:281b-16	badzra m'a ma k'i tr'am /	badzra ma ma k tr 
BO_T02_D2627:281b-17	m'a ma k'i'o //	ma ma k 
BO_T02_D2627:281b-18	badzra panta re de hi de hi siddha bo dhi lo kotta ri bha sv'a h'a /	badzra panta re de hi de hi siddha bo dhi lo kotta ri bha sva ha 
BO_T02_D2627:281b-19	gos dkar mo'i'o //	gos dkar mo 
BO_T02_D2627:281b-20	aom badzra t'a re tu tt'a re tu re h'um h'um h'um sva sva sva sgrol ma'i'o//	aom badzra ta re tu tta re tu re hum hum hum sva sva sva sgrol 
BO_T02_D2627:281b-21	sems dpa' bcu drug gi snying po dang sbyar ba'i sham pa ta bcu drug zhi bar brdung ba'o //	sems dpa chu drug gi snying po dang sbyor ba sham ba ta chu drug zhi ba rdung ba 
BO_T02_D2627:281b-22	de bzhin sbyar ba ghum bcu drug rgyas pa'i brdung ba'o //	de bzhin sbyor ba ghum chu drug rgya ba rdung ba 
BO_T02_D2627:281b-23	de bzhin du ho sbyar ba bcu drug dbang gi brdung ba'o //	de bzhin du ho sbyor ba chu drug dbang gi rdung ba 
BO_T02_D2627:281b-24	de bzhin kha stam sbyar ba bcu drug mngon spyod kyi brdung ba'o //	de bzhin kha stam sbyor ba chu drug mngon spyod kyi rdung ba 
BO_T02_D2627:281b-25	'dir ma gsungs pa'i sngags pa thams cad yang gzhan dag las shes par bya'o //	dir ma gsungs ba sngags ba thams cad yang gzhan dag las shes ba byed 
BO_T02_D2627:281b-26	ci'i phyir rgyud phyi ma'i bde ba chen po dang / de yang gtsug tor du gsang sngags dang phyag rgya'i khyad par gsungs she na /	ci phyir brgyud phyi ma bde ba chen po dang de yang gtsug tor du gsang sngags dang phyag rgya khyad ba gsungs she na 
BO_T02_D2627:281b-27	dkyil 'khor gyi lha thams cad de gnyis kyi nang du 'dus pa'i phyir gsungs so zhes bya ba'i don to //	dkyil khor gyi lha thams cad de gnyis kyi nang du du ba phyir gsungs so zhes byed ba don to 
BO_T02_D2627:281b-28	de ltar rgyud phyi ma bshad nas da ni rgyud phyi ma'i yang phyi ma bshad pa'i phyir 'jug par bya ste /	de ltar brgyud phyi ma chad nas da ni brgyud phyi ma yang phyi ma chad ba phyir jug ba byed ste 
BO_T02_D2627:281b-29	de yang / de nas lha rnams kun mgu nas //	de yang de nas lha rnams kun mgu nas 
BO_T02_D2627:281b-30	zhes bya ba la sogs pas ston to //	zhes byed ba la sogs ba ston to 
BO_T02_D2627:281b-31	'dir ni khro bor gsungs pa ston te /	dir ni khro bor gsungs ba ston te 
BO_T02_D2627:282a-0	de yang 'og nas khro bo'i skur 'gyur ba'i @282a * //	de yang g nas khro bo skur gyur ba 
BO_T02_D2627:282a-1	phyir ro // de nas lha rnams kun mgu nas //	phyir ro de nas lha rnams kun mgu nas 
BO_T02_D2627:282a-2	phyag na rdo rje phyag 'tshal te //	phyag na rdo rje phyag tshal te 
BO_T02_D2627:282a-3	khro bo'i dkyil 'khor bshad pa'i phyir //	khro bo dkyil khor chad ba phyir 
BO_T02_D2627:282a-4	gsol ba 'debs pa nyid du 'gyur //	gsol ba debs ba nyid du gyur 
BO_T02_D2627:282a-5	zhes bya ba ni rtsa ba'i rgyud dang phyi ma'i rgyud bshad pas lha rnams mgu nas phyag 'tshal nas khros pas khro bo spangs pa'i phyir gsol ba 'de bas pa nyid du gyur to zhes bya ba'i don to //	zhes byed ba ni rtsa ba brgyud dang phyi ma brgyud chad ba lha rnams mgu nas phyag tshal nas khro ba khro bo spong ba phyir gsol ba de ba ba nyid du gyur to zhes byed ba don to 
BO_T02_D2627:282a-6	de nas bcom ldan 'das phyag na rdo rjes rang gi sku bor te zhes bya ba ni zhi ba'i skur bor te'o //	de nas joms ldan da phyag na rdo rjes rang gi sku bor te zhes byed ba ni zhi ba skur bor te 
BO_T02_D2627:282a-7	rdo rje sems dpa'i skur zhugs nas //	rdo rje sems dpa skur jug nas 
BO_T02_D2627:282a-8	zhes bya ba ni khro bo sems dpa'i skur gyur pa'o /	zhes byed ba ni khro bo sems dpa skur gyur ba 
BO_T02_D2627:282a-9	'dis ni sbyor ba dang po'i ting nge 'dzin ston to //	dis ni sbyor ba dang po ting nge dzin ston to 
BO_T02_D2627:282a-10	gsang sngags kyi sgo'i spyad pa spyod par 'dod pa rnams kyis phyag na rdo rje'i skur bskyed la /	gsang sngags kyi sgo spyod ba spyod ba dod ba rnams kyis phyag na rdo rje skur skyed la 
BO_T02_D2627:282a-11	'og nas 'byung ba'i gsang sngags kyis khro bo'i skur bsgyur ro zhes bya ba'i don to //	g nas byung ba gsang sngags kyis khro bo skur sgyur ro zhes byed ba don to 
BO_T02_D2627:282a-12	rdo rje gnyis su med pa'i mnyam pa zhes bya bas ni sems dang sems las byung ba gnyis su med pa thugs rje chen po mtshungs pa'i khro bo'o //	rdo rje gnyis su med ba mnyam ba zhes byed ba ni sems dang sems las byung ba gnyis su med ba thugs rje chen po mtshungs ba khro bo 
BO_T02_D2627:282a-13	de la dmigs pa'i ting nge 'dzin la yang de skad ces bya ste /	de la dmigs ba ting nge dzin la yang de skad ces byed ste 
BO_T02_D2627:282a-14	de'i snyoms par zhugs pa ni mngon du mdzad pa'o //	de snyom ba jug ba ni mngon du mdzad ba 
BO_T02_D2627:282a-15	rdo rje sems dpa' khro bo zhes bya ba ni khro bo sems dpa' nyid do //	rdo rje sems dpa khro bo zhes byed ba ni khro bo sems dpa nyid do 
BO_T02_D2627:282a-16	me'i rdo rje nyi ma zhes bya ba ni khro bo lhag ma rnams te dbyer mi phyed pa'i 'od dan ldan pa'o //	me rdo rje nyi ma zhes byed ba ni khro bo lhag ma rnams te dbyer mi phyed ba d dan ldan ba 
BO_T02_D2627:282a-17	snying po 'di nyid kyi thugs ka nas byung ngo zhes bya ba ni 'og nas 'byung ba'i snying po'o //	snying po di nyid kyi thugs ka nas byung ngo zhes byed ba ni g nas byung ba snying po 
BO_T02_D2627:282a-18	de nyid kyi nges pa'i ye shes las phyung ba'o //	de nyid kyi nges ba ye shes las byin ba 
BO_T02_D2627:282a-19	de nyid aom badzra kro dha aa na l'arka ma h'a badzra /	de nyid aom badzra kro dha aa na larka ma ha badzra 
BO_T02_D2627:282a-20	badzra kro dha dra ba dra ba /	badzra kro dha dra ba dra ba 
BO_T02_D2627:282a-21	bi dra ba bi dra ba /	bi dra ba bi dra ba 
BO_T02_D2627:282a-22	sarba aa ba ya /	sarba aa ba ya 
BO_T02_D2627:282a-23	n'a sha ya n'a sha ya /	na sha ya na sha ya 
BO_T02_D2627:282a-24	ha ra ha ra phra nam h'um phat /	ha ra ha ra phra nam hum phat 
BO_T02_D2627:282a-25	khro bo rdo rje sems dpa'o //	khro bo rdo rje sems dpa 
BO_T02_D2627:282a-26	aom tree lo kya ka ri h'um phat /	aom tree lo kya ka ri hum phat 
