segmentnr	original	folio	stemmed
BO_T16_D4420b:156a-10	drang srong ma yin pa lci ba mtha' nye ldan pa las rigs la aan ainya dag ni shyang 'o //	156a	dren srong ma yin ba lci ba mtha nye ldan ba las rigs la aan ainya dag ni shyang mang 
BO_T16_D4420b:156a-11	drang srong ma yin pa brjod pa can gyi lci ba mtha' nye ldan pa las rigs kyi don gyi aan ainya dag gi mtha' ni bud med la shyang du bsgyur bar bya ste /	156a	dren srong ma yin ba rjod ba can gyi lci ba mtha nye ldan ba las rigs kyi don gyi aan ainya dag gi mtha ni bud med la shyang du sgyur ba byed ste 
BO_T16_D4420b:156a-12	nga ni yang la ts'a pa po'i don dang / sha ni shi ta la d'i sha'i don te /	156a	nga ni yang la tsa ba po don dang sha ni chi ta la d sha don te 
BO_T16_D4420b:156a-13	koo mu da gandhy'a /	156a	koo mu da gandhya 
BO_T16_D4420b:156a-14	b'a r'a hy'a /	156a	ba ra hya 
BO_T16_D4420b:156a-15	aa shva pa ty'a di bhyashtsa /	156a	aa shva ba tya di bhyashtsa 
BO_T16_D4420b:156a-16	aa shva pa ti la sogs pa rnams las kyang ngo //	156a	aa shva ba ti la sogs ba rnams las kyang ngo 
BO_T16_D4420b:156a-17	aa shva pa ti la sogs pa rnams las kyang bu brgyud la aan 'gyur te /	156a	aa shva ba ti la sogs ba rnams las kyang bu brgyud la aan gyur te 
BO_T16_D4420b:156a-18	(aan)...aa shva pa ta:/	156a	(aan)...aa shva ba 
BO_T16_D4420b:156a-19	(aan)...goo pa tam /	156a	(aan)...goo ba tam 
BO_T16_D4420b:156a-20	(aan)...g'a na pa tam /	156a	(aan)...ga na ba tam 
BO_T16_D4420b:156a-21	di tya di ty'a di tya pa tyutta ra pa d'ata nya:/	156a	di tya di tya di tya ba tyutta ra ba data 
BO_T16_D4420b:156a-22	(ku mu da'i dri ma /	156a	(ku mu da dri ma 
BO_T16_D4420b:156a-23	phag rgod ma/) di ti aa di ti a'a di dya pa ti tshig phyi ma las nya'o //	156a	phag rgod di ti aa di ti aa di dya ba ti tshig phyi ma las nya 
BO_T16_D4420b:156a-24	di ti aa di ti /	156a	di ti aa di ti 
BO_T16_D4420b:156a-25	a'a di tya rnams dang pa ti tshig phyi mar 'gyur ba las kyang bu brgyud la nya 'gyur te /	156a	aa di tya rnams dang ba ti tshig phyi mar gyur ba las kyang bu brgyud la nya gyur te 
BO_T16_D4420b:156a-26	(rta'i bdag po'i bu /	156a	(rta bdag po bu 
BO_T16_D4420b:156a-27	ba lang gi bdag po'i bu /	156a	ba lang gi bdag po bu 
BO_T16_D4420b:156a-28	tshogs bdag gi bu/) dee tya:/...(sbyin pa'i bu /	156a	tshogs bdag gi dee ba bu 
BO_T16_D4420b:156a-29	nya)...aa dee tya:/ (ma sbyin ma'i bu/) a'a dee tya:/...(kun du sbyin ma'i bu /	156a	nya)...aa dee (ma sbyin ma aa dee du sbyin ma bu 
BO_T16_D4420b:156a-30	nya)...pr'a dz'a pa tyam /	156a	nya)...pra dza ba tyam 
BO_T16_D4420b:156a-31	(nya)...see n'a pa tyam /	156a	(nya)...see na ba tyam 
BO_T16_D4420b:156a-32	'grel par lung drangs pa /	156a	grel ba lung drangs ba 
BO_T16_D4420b:156a-33	ya m'atstsa / ya ma las kyang ngo //	156a	ya matstsa ya ma las kyang ngo 
BO_T16_D4420b:156a-34	ya ma las kyang bu brgyud la nya 'gyur te /	156a	ya ma las kyang bu brgyud la nya gyur te 
BO_T16_D4420b:156a-35	y'a myam / yang 'grel par lung drangs pa /	156a	ya myam yang grel ba lung drangs ba 
BO_T16_D4420b:156a-36	de ba sya yanya (nya na 'phel ba'i don /	156a	de ba sya yanya (nya na phel ba don 
BO_T16_D4420b:156a-37	a'a di tya la nya na 'phel ba'i don hal las yam rnams kyi yam la dbyi 'os ya sngon ma phyis pa'o //	156a	aa di tya la nya na phel ba don hal las yam rnams kyi yam la byid s ya sngon ma byid ba 
BO_T16_D4420b:156a-38	skye rgu'i bdag po'i bu /	156a	skye rgu bdag po bu 
BO_T16_D4420b:156a-39	sde'i bdag po'i bu/) hoo /	156a	sde bdag po hoo 
BO_T16_D4420b:156a-40	de ba'i yanya aanya dag go //	156a	de ba yanya aanya dag go 
BO_T16_D4420b:156a-41	de ba las bu brgyud la yanya dang aanya dag 'gyur te /	156a	de ba las bu brgyud la yanya dang aanya dag gyur te 
BO_T16_D4420b:156a-42	(gshin rje'i bu /	156a	(gshin rje bu 
BO_T16_D4420b:156a-43	yanya)...dee byam/.. ..(lha'i bu /	156a	yanya)...dee ..(lha bu 
BO_T16_D4420b:156a-44	aanya)...dee ba:/ yang 'grel par lung drangs pa /	156a	aanya)...dee yang grel ba lung drangs ba 
BO_T16_D4420b:156a-45	ba hi sha:ti lo po ya na /	156a	ba hi sha:ti lo po ya na 
BO_T16_D4420b:156a-46	ba hi sha las yan ste ti dbyi'o //	156a	ba hi sha las yan ste ti byid 
BO_T16_D4420b:156b-0	ba hi sha las bu brgyud la yan 'gyur zhing ti'ang @156b dbyi ste /	156b	ba hi sha las bu brgyud la yan gyur zhing ti byid ste 
BO_T16_D4420b:156b-1	b'a hya:/ yang 'grel par lung drangs pa /	156b	ba yang grel ba lung drangs ba 
BO_T16_D4420b:156b-2	a'i ka ka / ai ka ka'o //	156b	a ka ka ai ka ka 
BO_T16_D4420b:156b-3	ba hi sha las bu brgyud la a'i ka ka 'gyur zhing ti dbyi ba 'ang ngo //	156b	ba hi sha las bu brgyud la a ka ka gyur zhing ti byid ba mang ngo 
BO_T16_D4420b:156b-4	b'a h'i ka:/...phyi'i bu /	156b	ba h bu 
BO_T16_D4420b:156b-5	aut+s'a di bhyo&amp; nya /	156b	aut+sa di bhyo&amp; nya 
BO_T16_D4420b:156b-6	aut+sa la sogs pa rnams las aanya'o //	156b	aut+sa la sogs ba rnams las aanya 
BO_T16_D4420b:156b-7	aut+sa la sogs pa rnams las bu brgyud la aanya 'gyur te /	156b	aut+sa la sogs ba rnams las bu brgyud la aanya gyur te 
BO_T16_D4420b:156b-8	(phyi'i bu 'am 'di phyi rang la'ang 'jug go //	156b	(phyi bu mang di phyi rang la jug go 
BO_T16_D4420b:156b-9	aanya)...aoot+sa:/ (aanya)...aoo da p'a na:/	156b	(aanya)...aoo da pa 
BO_T16_D4420b:156b-10	str'i pum s'a bhy'am na nya sna nyoo bha ba n'ata /	156b	str pum sa bhy na nya sna nyoo bha ba nata 
BO_T16_D4420b:156b-11	stri pum sa dag las dngos po la nanya snanya dag go /	156b	stri pum sa dag las dngos po la nanya snanya dag go 
BO_T16_D4420b:156b-12	(/ b'a hisha la a'i ka ka kra 'phel ba'i don ti phyis/) stri dang pum sa dag las dngos po brjod pa la rim pa bzhin nanya sna nya dag 'gyur te /	156b	ba hisha la a ka ka kra phel ba don ti stri dang pum sa dag las dngos po rjod ba la rim ba bzhin nanya sna nya dag gyur te 
BO_T16_D4420b:156b-13	(nanya)...stree na:/ (bud med/) poom sna:/	156b	(nanya)...stree (bud poom 
BO_T16_D4420b:156b-14	de rnams bu brgyud kyi rkyen (chu lha'i bu /	156b	de rnams bu brgyud kyi rkyen (chu lha bu 
BO_T16_D4420b:156b-15	btung ba'i chu'i bu/) rnams so //	156b	thung ba chu rnams so 
BO_T16_D4420b:156b-16	te na raktam r'a g'ata /	156b	te na raktam ra gata 
BO_T16_D4420b:156b-17	de yis btsos pa'i tshos las so //	156b	de yis btsos ba tshos las so 
BO_T16_D4420b:156b-18	ngur smrig dang gur kum lta bu de yis btsos pa'i tshos brjod pa las gsum pa'i mtha' las aan 'gyur te /	156b	ngur smrig dang gur kum lta bu de yis btsos ba tshos rjod ba las gsum ba mtha las aan gyur te 
BO_T16_D4420b:156b-19	ka sh'a ye na rakta:/	156b	ka sha ye na 
BO_T16_D4420b:156b-20	zhes pa'i don la /	156b	zhes ba don la 
BO_T16_D4420b:156b-21	(skyes ba / pum sa la sna nya 'phel ba yang dag par sbyor ba'i mtha' dbyi 'os sa sngon ma phyis pa'o/) / k'a sh'a ya:/	156b	(skyes ba pum sa la sna nya phel ba yang dag ba sbyor ba mtha byid s sa sngon ma byid ka sha 
BO_T16_D4420b:156b-22	de bzhin du /	156b	de bzhin du 
BO_T16_D4420b:156b-23	kungku me na rakta:/	156b	kungku me na 
BO_T16_D4420b:156b-24	zhes pa'i don la /	156b	zhes ba don la 
BO_T16_D4420b:156b-25	(aan)...koongku ma:/ l'a ksh'a ro tsa n'a sha ka la kardda m'a:tha ka / l'aksh'a ro tsa na sha ka la kardda ma rnams las thaka 'o //	156b	(aan)...koongku la ksha ro tsa na sha ka la kardda ma:tha ka laksha ro tsa na sha ka la kardda ma rnams las thaka mang 
BO_T16_D4420b:156b-26	l'aksh'a sogs (ngur smrig gis btsos pa/) 'di rnams las de yis btsos pa la tha ka 'gyur ta /	156b	laksha sogs (ngur smrig gis btsos di rnams las de yis btsos ba la tha ka gyur ta 
BO_T16_D4420b:156b-27	l'aksh'a (ngur smrig gis btsos pa /	156b	laksha (ngur smrig gis btsos ba 
BO_T16_D4420b:156b-28	aan na la 'phel ba /	156b	aan na la phel ba 
BO_T16_D4420b:156b-29	gur kum gyis btsos pa/) y'a rakta:/	156b	gur kum gyis btsos ya 
BO_T16_D4420b:156b-30	zhes pa'i don la /	156b	zhes ba don la 
BO_T16_D4420b:156b-31	l'akshi ka:/ (gur gum gyis btsos pa/) tshig sbyor de dang 'dra bar byas pas /	156b	lakshi (gur gum gyis btsos tshig sbyor de dang dra ba byed ba 
BO_T16_D4420b:156b-32	(thaka)...roo tsa ni ka:/	156b	(thaka)...roo tsa ni 
BO_T16_D4420b:156b-33	(thaka)...sh'a ka li kam (/thaka)...k'ardda mi kam /'grel par /	156b	(thaka)...sha ka li kam mi kam ba 
BO_T16_D4420b:156b-34	sha ka la dang / kardda ma dag las de yis btsos pa la aan yang na 'gyur ro zhes bshad pas /	156b	sha ka la dang kardda ma dag las de yis btsos ba la aan yang na gyur ro zhes chad ba 
BO_T16_D4420b:156b-35	(aan)...kardda mam / (aan) sh'a ka (rgya skyegs kyis btsos pa /	156b	(aan)...kardda mam (aan) sha ka (rgya skyegs kyis btsos ba 
BO_T16_D4420b:156b-36	l'aksh'a la tha ka ka 'phel ba'i don tha ai ka/) lam /	156b	laksha la tha ka ka phel ba don tha ai lam 
BO_T16_D4420b:156b-37	'grel bar lung drangs pa /	156b	grel ba lung drangs ba 
BO_T16_D4420b:156b-38	ni l'ata dan /	156b	ni lata dan 
BO_T16_D4420b:156b-39	ni la (gi wang gis btsos pa /	156b	ni la (gi wang gis btsos ba 
BO_T16_D4420b:156b-40	shing shun gyis btsos pa /	156b	shing shun gyis btsos ba 
BO_T16_D4420b:156b-41	'dam gyis btsos pa/) las aan 'o//	156b	dam gyis btsos las aan 
BO_T16_D4420b:156b-42	ni la las de yis btsos pa la aa na 'gyur te /	156b	ni la las de yis btsos ba la aa na gyur te 
BO_T16_D4420b:156b-43	(aa na na dbyangs don/)...ni lam/...(rams kyis btsos pa/) yang 'grel ('dam gyis btsos pa/) par lung drangs pa /	156b	(aa na na dbyangs kyis btsos yang grel (dam gyis btsos ba lung drangs ba 
BO_T16_D4420b:156b-44	pi t'atka tsa /	156b	pi tatka tsa 
BO_T16_D4420b:156b-45	pi ta las katsa'o /	156b	pi ta las katsa 
BO_T16_D4420b:156b-46	(/ shing shun gyis btsos pa/) pi ta las de yis btsos pa la katsa 'gyur te /	156b	shing shun gyis btsos pi ta las de yis btsos ba la katsa gyur te 
BO_T16_D4420b:157a-0	(ser pos btsos pa/)...pi ta kam/...(ka tsa tsa dbyangs don/) @157a * //	157a	(ser pos btsos ta tsa tsa dbyangs 
BO_T16_D4420b:157a-1	yang 'grel par lung drangs pa /	157a	yang grel ba lung drangs ba 
BO_T16_D4420b:157a-2	ha ri dra ya:aanya /	157a	ha ri dra ya:aanya 
BO_T16_D4420b:157a-3	ha ri dr'a las aa nya'o //	157a	ha ri dra las aa nya 
BO_T16_D4420b:157a-4	ha ri dr'a las de yis btsos pa la aanya 'gyur te /	157a	ha ri dra las de yis btsos ba la aanya gyur te 
BO_T16_D4420b:157a-5	h'a ri dram /	157a	ha ri dram 
BO_T16_D4420b:157a-6	na ksha tre na yukta:k'a la:/	157a	na ksha tre na yukta:ka 
BO_T16_D4420b:157a-7	rgyu skar gyi sbyor ba'i dus la'o //	157a	rgyu skar gyi sbyor ba dus la 
BO_T16_D4420b:157a-8	rgyu skar rnams dang zla ba ldan pa'i sbyor ba'i dus mtshon pa la aa na 'gyur te /	157a	rgyu skar rnams dang zla ba ldan ba sbyor ba dus mtshon ba la aa na gyur te 
BO_T16_D4420b:157a-9	bu shyi na yukta:/	157a	bu shyi na 
BO_T16_D4420b:157a-10	zhes pa'i don la /	157a	zhes ba don la 
BO_T16_D4420b:157a-11	rnam dbye yukta dang bcas pa phyis /	157a	rnam byed yukta dang cha ba byid 
BO_T16_D4420b:157a-12	aan / poo sha:/	157a	aan poo 
BO_T16_D4420b:157a-13	de la ti dha sogs kyis (lga ser gyis btsos pa /	157a	de la ti dha sogs kyis (lga ser gyis btsos ba 
BO_T16_D4420b:157a-14	aanya nya 'phel ba'i don/) d'i pa byin /	157a	aanya nya phel ba d ba byin 
BO_T16_D4420b:157a-15	poo sh'i / rtags so so'i rnam dbye dang phrad pa'i lus 'gyur tsam ma gtogs tshig sbyor de (rgyal dang 'dus pa ste rgyal gyi zla ba/) dang 'dra bar byas pas /	157a	poo sh rtags so so rnam byed dang phrad ba lus gyur tsam ma gtogs tshig sbyor de (rgyal dang du ba ste rgyal gyi zla dang dra ba byed ba 
BO_T16_D4420b:157a-16	m'a gha:/ m'a gh'i/...(mchus nya ba/) ph'algu na:/	157a	ma ma nya phalgu 
BO_T16_D4420b:157a-17	ph'algu n'i / (rgyal zla/) tsee tra:/	157a	phalgu n (rgyal tsee 
BO_T16_D4420b:157a-18	tsee tr'i/...(aan d'i pa/) bee sh'a kha:/	157a	tsee d bee sha 
BO_T16_D4420b:157a-19	bee sh'a kh'i/...(aan d'ip/) dzeeshtha:/	157a	bee sha 
BO_T16_D4420b:157a-20	(rgyal gyis nya ba ste dkar phyogs kyi tshes bco lnga/) dzishth'i /	157a	(rgyal gyis nya ba ste dkar phyogs kyi tshes chos dzishth 
BO_T16_D4420b:157a-21	a'ash'a dha:/...(aa sh'a dha la aan /	157a	aasha sha dha la aan 
BO_T16_D4420b:157a-22	d'ing)...a'a sh'a dh'i /	157a	dng)...aa sha dh 
BO_T16_D4420b:157a-23	shr'a ba na:/...(shra ba na la aan d'ip/) shr'a ba n'i/...(shr'a ba na la aan d'ipa /	157a	shra ba ba na la aan shra ba ba na la aan dpa 
BO_T16_D4420b:157a-24	ma gha aan /	157a	ma gha aan 
BO_T16_D4420b:157a-25	mchu'i zla ba /	157a	mchu zla ba 
BO_T16_D4420b:157a-26	ma gha la aan d'ip /	157a	ma gha la aan dp 
BO_T16_D4420b:157a-27	phalgu na la aan /	157a	phalgu na la aan 
BO_T16_D4420b:157a-28	dbo'i zla ba /	157a	bo zla ba 
BO_T16_D4420b:157a-29	aan d'ip / dbo yis nya ba /	157a	aan dp bo yis nya ba 
BO_T16_D4420b:157a-30	tsitral aan / nag pa'i zla ba /	157a	tsitral aan nag ba zla ba 
BO_T16_D4420b:157a-31	nag pas nya ba /	157a	nag ba nya ba 
BO_T16_D4420b:157a-32	sa ga'i zla ba /	157a	sa ga zla ba 
BO_T16_D4420b:157a-33	bi sh'a kha la aan /	157a	bi sha kha la aan 
BO_T16_D4420b:157a-34	sa gas nya ba /	157a	sa gas nya ba 
BO_T16_D4420b:157a-35	snron gyi zla ba /	157a	snron gyi zla ba 
BO_T16_D4420b:157a-36	dzeesh'a la aan/) bh'a dra ba da:/	157a	dzeesha la bha dra ba 
BO_T16_D4420b:157a-37	(snron gyis nya ba /	157a	(snron gyis nya ba 
BO_T16_D4420b:157a-38	dzeeshth'a la aan d'i pa /	157a	dzeeshtha la aan d ba 
BO_T16_D4420b:157a-39	chu stod kyi zla ba/) bh'a dra pa d'i /	157a	chu stod kyi zla bha dra ba d 
BO_T16_D4420b:157a-40	(chu stod kyis nya ba /	157a	(chu stod kyis nya ba 
BO_T16_D4420b:157a-41	gro bzhin gyi zla ba /	157a	gro bzhin gyi zla ba 
BO_T16_D4420b:157a-42	gro bzhin gyis nya ba/) a'a shvi na:/...(aa shvi ni la aan/) a'a shvi n'i/...(tha skar gyis nya ba/) k'arti ka:/...(kri ti ka aan d'ip/)...k'arti k'i /	157a	gro bzhin gyis nya aa shvi shvi ni la aa shvi skar gyis nya karti ti ka aan k 
BO_T16_D4420b:157a-43	(mgo'i zla ba/)...m'arga shi ra:/	157a	(mgo zla chi 
BO_T16_D4420b:157a-44	m'arga shi r'i /	157a	marga chi r 
BO_T16_D4420b:157a-45	drishtam s'a ma /	157a	drishtam sa ma 
BO_T16_D4420b:157a-46	mnyam par lta ba (khums stod kyi zla ba /	157a	mnyam ba lta ba (khums stod kyi zla ba 
BO_T16_D4420b:157a-47	bha dra bad la aan/) la'o //	157a	bha dra bad la la 
BO_T16_D4420b:157a-48	mnyam par lta (khrums stod kyis nya ba /	157a	mnyam ba lta (khrums stod kyis nya ba 
BO_T16_D4420b:157a-49	bha dra ba da la aan d'ip/) ba'i don la gsum pa'i mtha' (tha skar gyi zla ba/) la aanya (aa shvi ni la aan d'ipa/) 'gyur te /	157a	bha dra ba da la aan ba don la gsum ba mtha (tha skar gyi zla la aanya (aa shvi ni la aan gyur te 
BO_T16_D4420b:157a-50	(smin drug gi zla ba/) ba shishthe na drishtam /	157a	(smin drug gi zla ba shishthe na drishtam 
BO_T16_D4420b:157a-51	(smin drug gis nya ba /	157a	(smin drug gis nya ba 
BO_T16_D4420b:157a-52	mri ga shi ra la aan d'i pa /	157a	mri ga chi ra la aan d ba 
BO_T16_D4420b:157a-53	mgo yis nya pa/) zhes pa'i don la /	157a	mgo yis nya zhes ba don la 
BO_T16_D4420b:157a-54	b'a shishtha:/ pa ri bri to ra tha:/	157a	ba ba ri bri to ra 
BO_T16_D4420b:157a-55	shing rta yongs su dkris pa'o //	157a	shing rta yongs su dkri ba 
BO_T16_D4420b:157a-56	shing rta yongs su dkris pa zhes pa 'di'i don la bastra dang / tsarma la aanya 'gyur te /	157a	shing rta yongs su dkri ba zhes ba di don la bastra dang tsarma la aanya gyur te 
BO_T16_D4420b:157a-57	bastre na ba ri dram to ra tha:/...(shing rta gos kyis yongs su dkris /	157a	bastre na ba ri dram to ra rta gos kyis yongs su dkri 
BO_T16_D4420b:157a-58	gnas 'jog gis blta/) zhes pa'i don la /	157a	gnas jog gis zhes ba don la 
BO_T16_D4420b:157a-59	(gos kyis dkris/.. ..b'astra:/..aanya nya 'phel ba /	157a	(gos kyis nya phel ba 
BO_T16_D4420b:157a-60	aanya nya 'phel ba'i don /	157a	aanya nya phel ba don 
BO_T16_D4420b:157a-61	gnas 'jog gis blta/) de bzhin du /	157a	gnas jog gis de bzhin du 
BO_T16_D4420b:157a-62	ts'arma na:/...(pags pas dkris/) ta trotdhri t'm p'a tre bhya:/	157a	tsarma ba ta trotdhri tm pa tre 
BO_T16_D4420b:157b-0	@157b snod rnams la der blugs pa la'o //	157b	snod rnams la der blugs ba la 
BO_T16_D4420b:157b-1	snod rnams las snod der blugs pa la bdun pa'i mtha' la aanya 'gyur te /	157b	snod rnams las snod der blugs ba la bdun ba mtha la aanya gyur te 
BO_T16_D4420b:157b-2	sa ra be auddhri tam /	157b	sa ra be auddhri tam 
BO_T16_D4420b:157b-3	zhes pa'i don la /	157b	zhes ba don la 
BO_T16_D4420b:157b-4	s'a ra ba:/ sam skri tam bhaksh'a:/	157b	sa ra sam skri tam 
BO_T16_D4420b:157b-5	zas legs par sbyar ba rnams so //	157b	zas legs ba sbyor ba rnams so 
BO_T16_D4420b:157b-6	zas legs par sbyar ba brjod pa las bdun pa'i mtha' la aanya 'gyur te /	157b	zas legs ba sbyor ba rjod ba las bdun ba mtha la aanya gyur te 
BO_T16_D4420b:157b-7	bhr'ashtr'a:/ s'a smin poorna m'a s'i ti sam dzny'a y'am /	157b	sa smin poorna ma s ti sam dznya y 
BO_T16_D4420b:157b-8	de 'di la zla ba nya gang ba'i ming la'o //	157b	de di la zla ba nya gang ba ming la 
BO_T16_D4420b:157b-9	de 'di la zla ba nya gang ba ste (rdza phor du blugs pa/) thog mtha' (rdza phor du blugs pa /	157b	de di la zla ba nya gang ba ste (rdza phor du blugs thogs mtha (rdza phor du blugs ba 
BO_T16_D4420b:157b-10	aata nya 'phel ba/) rdzogs pa'i zla ba brjod pa la dang po dang bdun pa'i mtha' la aanya 'gyur te /	157b	aata nya phel rdzogs ba zla ba rjod ba la dang po dang bdun ba mtha la aanya gyur te 
BO_T16_D4420b:157b-11	poo sh'i poo rna m'a s'i aasmin /	157b	poo sh poo rna ma s aasmin 
BO_T16_D4420b:157b-12	zhes (aanya 'phel ba /	157b	zhes (aanya phel ba 
BO_T16_D4420b:157b-13	btsos pa/) pa'i don la /	157b	btsos ba don la 
BO_T16_D4420b:157b-14	poo sho m'a sa:/	157b	poo sho ma 
BO_T16_D4420b:157b-15	s'a sya de ba t'a /	157b	sa sya de ba ta 
BO_T16_D4420b:157b-16	de 'di'i lha nyid la'o //	157b	de di lha nyid la 
BO_T16_D4420b:157b-17	de 'di'i lha nyid du brjod pa la dang po dang / drug pa'i mtha' la aa nya la sogs par 'gyur te /	157b	de di lha nyid du rjod ba la dang po dang drug ba mtha la aa nya la sogs ba gyur te 
BO_T16_D4420b:157b-18	buddho de ba t'a ya sya /	157b	buddho de ba ta ya sya 
BO_T16_D4420b:157b-19	zhes pa'i don la /	157b	zhes ba don la 
BO_T16_D4420b:157b-20	(aanya) booddha:/ (rgyal gyis nya pa zla ba nya gang pa 'di la/) de bzhin du /	157b	(aanya) (rgyal gyis nya ba zla ba nya gang ba di de bzhin du 
BO_T16_D4420b:157b-21	tshig sbyor byas pas /	157b	tshig sbyor byed ba 
BO_T16_D4420b:157b-22	(aan)...shee ba:/ (aanya 'phel ba /	157b	(aan)...shee (aanya phel ba 
BO_T16_D4420b:157b-23	rgyal gyi zla ba /	157b	rgyal gyi zla ba 
BO_T16_D4420b:157b-24	aan)...aeendra:/ b'arha spa tyam /	157b	barha spa tyam 
BO_T16_D4420b:157b-25	ka sye ta /	157b	ka sye ta 
BO_T16_D4420b:157b-26	ka'i aita 'o //	157b	ka aita mang 
BO_T16_D4420b:157b-27	don mang po la 'jug pa'i ka'i sgra lha brjod pa can la aan 'gyur zhing ka'i mtha' aita (gang gi lha sangs rgyas/) du 'gyur te /	157b	don mang po la jug ba ka sgra lha rjod ba can la aan gyur zhing ka mtha aita (gang gi lha sangs du gyur te 
BO_T16_D4420b:157b-28	g'a yam ha (sangs rgyas pa/) bi:/	157b	ga yam ha (sangs rgya 
BO_T16_D4420b:157b-29	shu kr'atgha na /	157b	shu kratgha na 
BO_T16_D4420b:157b-30	shu kra las ghan 'o //	157b	shu kra las ghan mang 
BO_T16_D4420b:157b-31	shu kra las de 'di'i (zhib pa/) lha brjod pa la ghan (dbang po pa /	157b	shu kra las de di (zhib lha rjod ba la ghan (dbang po ba 
BO_T16_D4420b:157b-32	phung bu pa /	157b	phung bu ba 
BO_T16_D4420b:157b-33	gri hasda ti la yanya 'phel ba/) 'gyur te /	157b	gri hasda ti la yanya phel gyur te 
BO_T16_D4420b:157b-34	shu kri ya:/...(pa sangs/) so m'a dyan /	157b	shu kri so ma dyan 
BO_T16_D4420b:157b-35	so ma las ya na'o //	157b	so ma las ya na 
BO_T16_D4420b:157b-36	so ma las de 'di'i lha brjod pa la yana (skyed bu'i bdag po //	157b	so ma las de di lha rjod ba la yana (skyed bu bdag po 
BO_T16_D4420b:157b-37	ka la aan ga gir 'gyur na 'phel ba ae tsa'i aa ya sogs/) 'gyur te /	157b	ka la aan ga gir gyur na phel ba ae tsa aa ya gyur te 
BO_T16_D4420b:157b-38	soo mya:/...(so ma la yan na la 'phel ba/) p'a yvi tu pi tru sha so yat /	157b	soo ma la yan na la phel pa yvi tu pi tru sha so yat 
BO_T16_D4420b:157b-39	b'a yu ri tu pi tri au shas rnams las yata 'o /	157b	ba yu ri tu pi tri au shas rnams las yata mang 
BO_T16_D4420b:157b-40	(/ shu kra la ghan na dbyangs don gha ai ya/) b'a yu la sogs pa 'di rnams las de 'di'i lha brjod pa la yata 'gyur te /	157b	shu kra la ghan na dbyangs don gha ai ba yu la sogs ba di rnams las de di lha rjod ba la yata gyur te 
BO_T16_D4420b:157b-41	b'a ya byam /	157b	ba ya byam 
BO_T16_D4420b:157b-42	(ao aawa)...ri ta byam/...(dus pa/) au sha syam (gdung byed pa /	157b	(ao aawa)...ri ta au sha syam (gdung byed ba 
BO_T16_D4420b:157b-43	bsil ba pa'am zlab pa/) pi tri la yata /	157b	bsil ba ba zlab pi tri la yata 
BO_T16_D4420b:157b-44	r'ing ri ta:/ rit kyi r'ing 'o //	157b	rng ri rit kyi rng mang 
BO_T16_D4420b:157b-45	krita sogs kyi rkyen ma yin pa'i ya'i rkyen dang byings thams cad pa rnams dang / tsvi pha rol la rita kyi r'ing du 'gyur te nga dbyangs don no /	157b	krita sogs kyi rkyen ma yin ba ya rkyen dang byings thams cad ba rnams dang tsvi pha rol la rita kyi rng du gyur te nga dbyangs don no 
BO_T16_D4420b:157b-46	(/ yarta)...bi tryam/...(pha mes pa/) (rlung lhang /	157b	yarta)...bi mes (rlung lhang 
BO_T16_D4420b:158a-0	b'a yu dang ri tu la yat ta ta'i de'i dus au'i yon tan pha rol la wa'i mtha' can nos/) @158a * //	158a	ba yu dang ri tu la yat ta ta de dus au yon tan pha rol la wa mtha can 
BO_T16_D4420b:158a-1	aagne:dhaka / aagni las dhaka'o //	158a	aagne:dhaka aagni las dhaka 
BO_T16_D4420b:158a-2	aagni las de 'di'i lha brjod pa la dha ka 'gyur te /	158a	aagni las de di lha rjod ba la dha ka gyur te 
BO_T16_D4420b:158a-3	a'agne yam/...(mes / de ba t'a dvam dve tsa/)...lha nyid la zlas dbye la'ang ngo //	158a	aagne de ba ta dvam dve nyid la zlas byed la ngo 
BO_T16_D4420b:158a-4	de 'di'i lha brjod pa la zlas dbye'i bsdu ba'i mtha' la aanya 'gyur zhing 'ang gi sgras tshig snga phyi gnyis kyi aatsa'ang 'phel bar 'gyur te /	158a	de di lha rjod ba la zlas byed sdud ba mtha la aanya gyur zhing mang gi sgras tshig snga phyi gnyis kyi aatsa phel ba gyur te 
BO_T16_D4420b:158a-5	(aagni shtsa ma ru tashtsa/) zhes pa la rnam dbye sogs phyis /	158a	(aagni shtsa ma ru zhes ba la rnam byed sogs byid 
BO_T16_D4420b:158a-6	mdo 'dis aanya snga phyi (aagni la dhaka ka 'phel ba'i don dha ae ya gang gi aita la'ang ngos ai phyis/) gnyis ka 'phel ba /	158a	mdo dis aanya snga phyi (aagni la dhaka ka phel ba don dha ae ya gang gi aita la ngos ai gnyis ka phel ba 
BO_T16_D4420b:158a-7	a'agni m'a ru tam /	158a	aagni ma ru tam 
BO_T16_D4420b:158a-8	nendra sya pa ra sya /	158a	nendra sya ba ra sya 
BO_T16_D4420b:158a-9	aindra pha rol gyi ma yin no //	158a	aindra pha rol gyi ma yin no 
BO_T16_D4420b:158a-10	zlas dbye'i bsdu ba'i mtha' yin kyang aindra tshig (me lha dang rlung lha yang/) phyi ma yin na tshig phyi ma la 'phel ba mi byed de /	158a	zlas byed sdud ba mtha yin kyang aindra tshig (me lha dang rlung lha phyi ma yin na tshig phyi ma la phel ba mi byed de 
BO_T16_D4420b:158a-11	soo mandram / phyi ma zhes pa'i rnam bcad kyi aindra tshig snga ma yin na gnyis ka 'phel bar 'gyur te /	158a	soo mandram phyi ma zhes ba rnam gcod kyi aindra tshig snga ma yin na gnyis ka phel ba gyur te 
BO_T16_D4420b:158a-12	(me lha rlung lha ba/) aeendra g+nam /	158a	(me lha rlung lha aeendra g+nam 
BO_T16_D4420b:158a-13	d'irgh'a tstsa ba ru na sya /	158a	drgha tstsa ba ru na sya 
BO_T16_D4420b:158a-14	ring po las kyang ba ru na'i'o //	158a	ring po las kyang ba ru na 
BO_T16_D4420b:158a-15	zlas dbye'i bsdu ba'i mtha' yin kyang tshig snga ma'i mtha' aa tsa de ring po yin na de'i pha rol gyi ba ru na zhes (zla ba dbang po pa /	158a	zlas byed sdud ba mtha yin kyang tshig snga ma mtha aa tsa de ring po yin na de pha rol gyi ba ru na zhes (zla ba dbang po ba 
BO_T16_D4420b:158a-16	so ma aindra aanya/) pa la 'phel ba mi 'byung ste /	158a	so ma aindra ba la phel ba mi byung ste 
BO_T16_D4420b:158a-17	aeendr'a ba ru nam /	158a	aeendra ba ru nam 
BO_T16_D4420b:158a-18	ta sya sa m'u ha:/	158a	ta sya sa mu 
BO_T16_D4420b:158a-19	de'i tshogs (dbang po ma pa/) la'o //	158a	de tshogs (dbang po ma la 
BO_T16_D4420b:158a-20	de'i tshogs brjod pa la drug pa'i mtha' las aan la sogs pa 'gyur te /	158a	de tshogs rjod ba la drug ba mtha las aan la sogs ba gyur te 
BO_T16_D4420b:158a-21	k'a k'a n'am sa m'u ha:/	158a	ka ka n sa mu 
BO_T16_D4420b:158a-22	zhes pa'i don la /	158a	zhes ba don la 
BO_T16_D4420b:158a-23	(aan)...k'a kam / tshig sbyor de bzhin byas pas /	158a	(aan)...ka kam tshig sbyor de bzhin byed ba 
BO_T16_D4420b:158a-24	b'a na sba tyam /	158a	ba na sbed tyam 
BO_T16_D4420b:158a-25	stree nam/.. ..(bud med kyi tshogs/) poo snam/...(snanya aan /	158a	stree ..(bud med kyi poo aan 
BO_T16_D4420b:158a-26	dbang po dang rgyu lta ba/) bhiksh'a di bhyo&amp; n\/	158a	dbang po dang rgyu lta bhiksha di bhyo&amp; 
BO_T16_D4420b:158a-27	bhiksha la sogs pa rnams la aana'o //	158a	bhiksha la sogs ba rnams la aana 
BO_T16_D4420b:158a-28	bhi ksha la sogs pa rnams las de'i tshogs pa brjod pa la drug pa'i mtha' la aan 'gyur (bya rog rnams tshogs/) te /	158a	bhi ksha la sogs ba rnams las de tshogs ba rjod ba la drug ba mtha la aan gyur (bya rog rnams te 
BO_T16_D4420b:158a-29	bhiksh'a n'am sa mu ha:/	158a	bhiksha n sa mu 
BO_T16_D4420b:158a-30	(bya rog tshogs/) zhes pa'i don la /	158a	(bya rog zhes ba don la 
BO_T16_D4420b:158a-31	(yata aan / shing gi tshogs /	158a	(yata aan shing gi tshogs 
BO_T16_D4420b:158a-32	nanya aan / skyes pa'i tshogs /	158a	nanya aan skye ba tshogs 
BO_T16_D4420b:158a-33	aan)...bhee ksham / (aan)...kshe tram /	158a	aan)...bhee ksham (aan)...kshe tram 
BO_T16_D4420b:158a-34	yoo ba tam/...(ya ba til aan/) go tro kshoshtro ra bhra r'a dza r'a dza n+ya r'a dza pu tra bat+sam nu shy'a dz'adbunya /	158a	yoo ba ba til go tro kshoshtro ra bhra ra dza ra dza n+ya ra dza pu tra bat+sam nu shya dzadbunya 
BO_T16_D4420b:158a-35	rigs aukshan aushtra au ra bhra r'a dza r'a dza n+ya r'a dza pu tra bat+sa ma nu shya aa dza las bu nya'o /	158a	rigs aukshan aushtra au ra bhra ra dza ra dza n+ya ra dza pu tra bat+sa ma nu shya aa dza las bu nya 
