segmentnr	original	stemmed
BO_T02_D1550:197a-0	@197a # // rgya gar skad du /	rgya gar skad du 
BO_T02_D1550:197a-1	shr'i badzra yo gi n'i s'a dha nam /	shr badzra yo gi n sa dha nam 
BO_T02_D1550:197a-2	bod skad du /	bod skad du 
BO_T02_D1550:197a-3	dpal rdo rje rnal 'byor ma'i sgrub thabs //	dpal rdo rje rnal byor ma sgrub thabs 
BO_T02_D1550:197a-4	dpal rdo rje rnal 'byor ma la phyag 'tshal lo //	dpal rdo rje rnal byor ma la phyag tshal lo 
BO_T02_D1550:197a-5	stong nyid snying rje'i bdag nyid can //	stong nyid snying rje bdag nyid can 
BO_T02_D1550:197a-6	khams gsum pa yi ngo bo nyid //	khams gsum ba yi ngo bo nyid 
BO_T02_D1550:197a-7	bskal ba'i me ltar 'bar ba'i 'od //	bskal ba me ltar bar ba d 
BO_T02_D1550:197a-8	rdo rje rnal 'byor ma dpal 'dud //	rdo rje rnal byor ma dpal dud 
BO_T02_D1550:197a-9	bla ma brgyud pa'i rim pa ni //	bla ma brgyud ba rim ba ni 
BO_T02_D1550:197a-10	rtogs pa gcig gi spyod yul te //	rtogs ba gcig gi spyod yul te 
BO_T02_D1550:197a-11	rdo rje rnal 'byor ma'i sgrub thabs //	rdo rje rnal byor ma sgrub thabs 
BO_T02_D1550:197a-12	mdor bsdus bdag gis bshad par bya //	mdor sdud bdag gis chad ba byed 
BO_T02_D1550:197a-13	sngags pas thog mar re zhig bla ma dang sangs rgyas rnams la mngon par gus pa'i yid kyis //	sngags ba thogs mar re jig bla ma dang sangs rgya rnams la mngon ba gus ba yid kyis 
BO_T02_D1550:197a-14	byang chub kyi sems brtan por bzung ste /	byang chub kyi sems brtan por bzung ste 
BO_T02_D1550:197a-15	dbang bskur ba yang dag par thob nas /	dbang skur ba yang dag ba thob nas 
BO_T02_D1550:197a-16	chos thams cad ngo bo nyid kyis 'od gsal ba'i rang bzhin yin yang /	chos thams cad ngo bo nyid kyis d gsal ba rang bzhin yin yang 
BO_T02_D1550:197b-0	rang dang gzhan gyi don phun sum @197b tshogs pa la mngon du phyogs par bya ste /	rang dang gzhan gyi don phun sum tshogs ba la mngon du phyogs ba byed ste 
BO_T02_D1550:197b-1	dur khrod la sogs pa yid dang rjes su mthun pa'i dben pa'i gnas su stan 'jam po la rnal 'byor gyi rol pas rab tu bsngags pa'i gnas su bltas te 'dug par bya'o //	dur khrod la sogs ba yid dang rjes su mthun ba dben ba gnas su stan jam po la rnal byor gyi rol ba rab tu bsngags ba gnas su lta te dug ba byed 
BO_T02_D1550:197b-2	de'i rjes la lus dang ngag dang sems yongs su dag par bya ba ni /	de rjes la lus dang ngag dang sems yongs su dag ba byed ba ni 
BO_T02_D1550:197b-3	rgun 'brum mam bu ram shing ngam /	rgun brum mam bu ram shing ngam 
BO_T02_D1550:197b-4	'bras las byas pa'i btung ba bzang po ji ltar rnyed pa'i dam tshig lnga dang ldan par byas la mchod sbyin gyi snod du bzhag ste /	bras las byed ba thung ba bzang po ji ltar rnyed ba dam tshig lnga dang ldan ba byed la mchod sbyin gyi snod du jog ste 
BO_T02_D1550:197b-5	yi ge gsum gyi sngags kyis mngon par bsngags nas /	yi ge gsum gyi sngags kyis mngon ba bsngags nas 
BO_T02_D1550:197b-6	chu de nyid kyis lag pa g-yon pa nas brtsams nas yan lag dang nying lag thams cad sngags kyi chus khrus bya zhing /	chu de nyid kyis lag ba g-yon ba nas brtsams nas yan lag dang nying lag thams cad sngags kyi chus khru byed zhing 
BO_T02_D1550:197b-7	de nyid kyis mchod pa'i rdzas kyang bsang gtor bya ba'o //	de nyid kyis mchod ba rdzas kyang bsang thor byed ba 
BO_T02_D1550:197b-8	de'i rjes la /	de rjes la 
BO_T02_D1550:197b-9	aom bam hom yom hrim mom hrem hri h'um h'um phat phat /	aom bam hom yom hrim mom hrem hri hum hum phat phat 
BO_T02_D1550:197b-10	ces bya ba'i sngags kyi yi ges lag pa g-yon pa'i sor mo rnams la sbyar te /	ces byed ba sngags kyi yi ges lag ba g-yon ba sor mo rnams la sbyor te 
BO_T02_D1550:197b-11	dag pa gsum brjod par bya'o //	dag ba gsum rjod ba byed 
BO_T02_D1550:197b-12	aom sva bh'a ba shuddha: sarbba dharm'a: sva bh'a ba shuddho&amp; ham /	aom sva bha ba shuddha: sarbba dharma: sva bha ba shuddho&amp; ham 
BO_T02_D1550:197b-13	aom badzra shuddha: sarba dharm'a badzra shuddho&amp; ham//	aom badzra shuddha: sarba dharma badzra shuddho&amp; 
BO_T02_D1550:197b-14	aom yo ga shuddha: sarba dharm'a yo ga shuddho&amp; ham /	aom yo ga shuddha: sarba dharma yo ga shuddho&amp; ham 
BO_T02_D1550:197b-15	de nas rang gi lus khams gsum po rnam par dag pa'i gzhal yas khang du brtags te /	de nas rang gi lus khams gsum po rnam ba dag ba jal yas khang du rtog te 
BO_T02_D1550:197b-16	skad cig tsam gyis lte ba'i skyil 'khor du rdo rje rnal 'byor ma phyag gnyis na gri gug dang thod pa bsnams pa /	skad cig tsam gyis lte ba skyil khor du rdo rje rnal byor ma phyag gnyis na gri gug dang thod ba snom ba 
BO_T02_D1550:197b-17	skra grol ba thur du 'phyang ba /	skra grol ba thur du phyang ba 
BO_T02_D1550:197b-18	gcer bu spyan gsum pa /	bcer bu spyan gsum ba 
BO_T02_D1550:197b-19	gzugs dang lang tsho phun sum tshogs pa /	gzugs dang lang tsho phun sum tshogs ba 
BO_T02_D1550:197b-20	phyag rgya lnga yis rnam par brgyan //	phyag rgya lnga yis rnam ba rgyan 
BO_T02_D1550:197b-21	sangs rgyas lnga yi dbu rgyan can //	sangs rgya lnga yi dbu rgyan can 
BO_T02_D1550:197b-22	zla ba nyi ma me dkyil du //	zla ba nyi ma me dkyil du 
BO_T02_D1550:197b-23	skyil krung phyed pas gnon mdzad cing //	skyil krung phyed ba gnon mdzad cing 
BO_T02_D1550:197b-24	dza ba sindhu ra dang mtshungs //	dza ba sindhu ra dang mtshungs 
BO_T02_D1550:197b-25	de lta'i gzugs can lha mo ni //	de lta gzugs can lha mo ni 
BO_T02_D1550:197b-26	rnal 'byor pa yis rtag tu bsgom //	rnal byor ba yis rtag tu bsgom 
BO_T02_D1550:197b-27	de yi g-yas ni phag gdong ste //	de yi g-yas ni phag gdong ste 
BO_T02_D1550:197b-28	de bzhin g-yon pa khro mo nyid //	de bzhin g-yon ba khro mo nyid 
BO_T02_D1550:197b-29	kun rdzob don dam rang bzhin gyis //	kun rdzob don dam rang bzhin gyis 
BO_T02_D1550:197b-30	zhal gnyis su ni rab tu grags //	zhal gnyis su ni rab tu grags 
BO_T02_D1550:197b-31	bla ma'i man ngag lam gyis ni //	bla ma man ngag lam gyis ni 
BO_T02_D1550:197b-32	rim pa rgyas par rtogs par bya //	rim ba rgya ba rtogs ba byed 
BO_T02_D1550:197b-33	de yi padma'i nang du ni //	de yi padma nang du ni 
BO_T02_D1550:197b-34	don kun sgrub byed 'khor lo bsgom //	don kun sgrub byed khor lo bsgom 
BO_T02_D1550:197b-35	rim pa gsum gyis mtshan nas su //	rim ba gsum gyis mtshan nas su 
BO_T02_D1550:197b-36	kha dog dmar po'i 'od zer can //	kha dog dmar po d zer can 
BO_T02_D1550:197b-37	sngags kyi yi ges yongs rdzogs nas //	sngags kyi yi ges yongs rdzogs nas 
BO_T02_D1550:197b-38	rdza mkhan 'khor lo bzhin du 'khor //	rdza mkhan khor lo bzhin du khor 
BO_T02_D1550:197b-39	srin po'i zhal ni cung zhig bsdam //	srin po zhal ni cung jig sdom 
BO_T02_D1550:197b-40	rab tu 'bar ba'i rnam par bsgom //	rab tu bar ba rnam ba bsgom 
BO_T02_D1550:198a-0	phag gdod gyen du @198a * //	phag gdod gyen du 
BO_T02_D1550:198a-1	nye bar blta //	nye ba lta 
BO_T02_D1550:198a-2	g-yung drung 'khyil ba myur du 'khor //	g-yung drung khyil ba myur du khor 
BO_T02_D1550:198a-3	phyag rgya gnyis po'i rnal 'byor gyis //	phyag rgya gnyis po rnal byor gyis 
BO_T02_D1550:198a-4	khams gsum po yang 'grub par 'gyur //	khams gsum po yang grub ba gyur 
BO_T02_D1550:198a-5	rnal 'byor bdag nyid skad cig gis //	rnal byor bdag nyid skad cig gis 
BO_T02_D1550:198a-6	'grub 'gyur rnal 'byor pas gzhan min //	grub gyur rnal byor ba gzhan min 
BO_T02_D1550:198a-7	de nas gzhan yang bshad bya ba //	de nas gzhan yang chad byed ba 
BO_T02_D1550:198a-8	sngags btu ba yi cho ga mchog / gru gsum dkyil 'khor nyams dga' ba //	sngags thu ba yi cho ga mchog gru gsum dkyil khor nyams dga ba 
BO_T02_D1550:198a-9	rdo rje rol pa las byung ba'i //	rdo rje rol ba las byung ba 
BO_T02_D1550:198a-10	chos kyi 'byung gnas zhes bshad pa //	chos kyi byung gnas zhes chad ba 
BO_T02_D1550:198a-11	btsun mo'i bha ga nyid kyang de //	btsun mo bha ga nyid kyang de 
BO_T02_D1550:198a-12	a'a lo k'a li'i dbye bas der //	aa lo ka li byed ba der 
BO_T02_D1550:198a-13	sde tshan brgyad kyi rim pa ni //	sde tshan brgyad kyi rim ba ni 
BO_T02_D1550:198a-14	gzugs me mda' dang thub pa dang // bu ga drag po 'dod pa nyid //	gzugs me mda dang thub ba dang bu ga drag po dod ba nyid 
BO_T02_D1550:198a-15	'khor lo rnams ni rim bzhin du //	khor lo rnams ni rim bzhin du 
BO_T02_D1550:198a-16	man ngag gis ni dgod par bya //	man ngag gis ni god ba byed 
BO_T02_D1550:198a-17	dang por aa nas brtsams nas su //	dang por aa nas brtsams nas su 
BO_T02_D1550:198a-18	yi ge ha yi mthar thug par //	yi ge ha yi mthar thug ba 
BO_T02_D1550:198a-19	bskor ba'i tshul gyi sbyor ba yis //	skor ba tshul gyi sbyor ba yis 
BO_T02_D1550:198a-20	bde mchog rgya mtsho gsung bzhin bri //	bde mchog rgya mtsho gsung bzhin bri 
BO_T02_D1550:198a-21	dva yi thog ma sum 'gyur bya //	dva yi thogs ma sum gyur byed 
BO_T02_D1550:198a-22	thig le n'a ngas rnam par brgyan //	thig le na ngas rnam ba rgyan 
BO_T02_D1550:198a-23	bha thog tsha thog yi ge nyid //	bha thogs tsha thogs yi ge nyid 
BO_T02_D1550:198a-24	ta yig thog mas mgo bor brgyan //	ta yig thogs mas mgo bor rgyan 
BO_T02_D1550:198a-25	tsa sa'i bar nas gzung byas te //	tsa sa ba nas gzung byed te 
BO_T02_D1550:198a-26	ta yig 'og ma 'og tu sbyor //	ta yig g ma g tu sbyor 
BO_T02_D1550:198a-27	sha thog sha thog 'brel ba ni //	sha thogs sha thogs brel ba ni 
BO_T02_D1550:198a-28	de bzhin sbyor bar shes par bya //	de bzhin sbyor ba shes ba byed 
BO_T02_D1550:198a-29	li yi mgo gyur yi ge la //	li yi mgo gyur yi ge la 
BO_T02_D1550:198a-30	nya yi 'og nas gnas pas brgyan //	nya yi g nas gnas ba rgyan 
BO_T02_D1550:198a-31	pa thog ta yig 'og mar ldan //	ba thogs ta yig g mar ldan 
BO_T02_D1550:198a-32	pha thog tha yig 'og mas bcings //	pha thogs tha yig g mas ching 
BO_T02_D1550:198a-33	ha ta'i bar gnas yi ge la //	ha ta ba gnas yi ge la 
BO_T02_D1550:198a-34	na yig thog na gnas pas brgyan //	na yig thogs na gnas ba rgyan 
BO_T02_D1550:198a-35	sha yi 'og na gnas pas gzung //	sha yi g na gnas ba gzung 
BO_T02_D1550:198a-36	bha 'og gi stan na 'og sbyar //	bha g gi stan na g sbyor 
BO_T02_D1550:198a-37	ha yi steng gnas yi ge nyid //	ha yi steng gnas yi ge nyid 
BO_T02_D1550:198a-38	ra yig gong ma nyis brtsegs ldan //	ra yig gong ma nyis brtsegs ldan 
BO_T02_D1550:198a-39	ta yig gong ma sbyar bya ste //	ta yig gong ma sbyor byed ste 
BO_T02_D1550:198a-40	mgo bo ru ni yongs su grags //	mgo bo ru ni yongs su grags 
BO_T02_D1550:198a-41	pha yi thog na gnas pa la //	pha yi thogs na gnas ba la 
BO_T02_D1550:198a-42	tha yig thog na gnas pas brgyan //	tha yig thogs na gnas ba rgyan 
BO_T02_D1550:198a-43	nya thog na thog gis brgyan pa //	nya thogs na thogs gis rgyan ba 
BO_T02_D1550:198a-44	man ngag bzhin du shes par bya //	man ngag bzhin du shes ba byed 
BO_T02_D1550:198a-45	tsa sa'i bar na gnas pa blang //	tsa sa ba na gnas ba blang 
BO_T02_D1550:198a-46	bha 'og gi stan na 'og sbyar //	bha g gi stan na g sbyor 
BO_T02_D1550:198a-47	de bzhin tsha yi gong ma zung //	de bzhin tsha yi gong ma zung 
BO_T02_D1550:198a-48	de bzhin ta yi steng mas brgyan //	de bzhin ta yi steng mas rgyan 
BO_T02_D1550:198a-49	tha yi steng mas na 'og brgyan //	tha yi steng mas na g rgyan 
BO_T02_D1550:198a-50	pha yi 'og gnas yi ge blang //	pha yi g gnas yi ge blang 
BO_T02_D1550:198a-51	dha ba bar gnas yi ge blang //	dha ba ba gnas yi ge blang 
BO_T02_D1550:198a-52	tha yi 'og mas brgyan pha nyid //	tha yi g mas rgyan pha nyid 
BO_T02_D1550:198a-53	yi ge nya la'i bar gnas pa //	yi ge nya la ba gnas ba 
BO_T02_D1550:198a-54	na yi gong mas brgyan par bya //	na yi gong mas rgyan ba byed 
BO_T02_D1550:198a-55	sa'i bar gnas yi ge la /	sa ba gnas yi ge la 
BO_T02_D1550:198a-56	r'i yi 'og ma gdangs par bya //	r yi g ma gdang ba byed 
BO_T02_D1550:198a-57	thig le n'a da mnyam ldan pa //	thig le na da mnyam ldan ba 
BO_T02_D1550:198b-0	gsum @198b 'gyur du ni dbye ba nyid //	gsum gyur du ni byed ba nyid 
BO_T02_D1550:198b-1	na 'og ra yi 'og ma ni //	na g ra yi g ma ni 
BO_T02_D1550:198b-2	snga ma bzhin du sum 'gyur bya //	snga ma bzhin du sum gyur byed 
BO_T02_D1550:198b-3	sha 'og sha yi mgo mas brgyan //	sha g sha yi mgo mas rgyan 
BO_T02_D1550:198b-4	nya yi 'og na gnas pa sbyar //	nya yi g na gnas ba sbyor 
BO_T02_D1550:198b-5	ma wa bar na gnas pa gzung //	ma wa ba na gnas ba gzung 
BO_T02_D1550:198b-6	dzha yig gdong mas rnam par brgyan //	dzha yig gdong mas rnam ba rgyan 
BO_T02_D1550:198b-7	bla ma'i man ngag lam gyis ni //	bla ma man ngag lam gyis ni 
BO_T02_D1550:198b-8	sngags btu ba ni shes par bya //	sngags thu ba ni shes ba byed 
BO_T02_D1550:198b-9	glegs bam klog pa'i sngags pa yis //	glegs bam klog ba sngags ba yis 
BO_T02_D1550:198b-10	ji lta'i rim pa spangs pa yis //	ji lta rim ba spong ba yis 
BO_T02_D1550:198b-11	gang des bskal ba bye bar byas //	gang des bskal ba bye ba byed 
BO_T02_D1550:198b-12	dngos grub go 'phang mi thob pa //	dngos grub go phen mi thob ba 
BO_T02_D1550:198b-13	gzhan yang rab tu bshad bya ba //	gzhan yang rab tu chad byed ba 
BO_T02_D1550:198b-14	rdo rje can gyi mchod pa ni //	rdo rje can gyi mchod ba ni 
BO_T02_D1550:198b-15	tshes bcu'i dus su khyad par du //	tshes chu dus su khyad ba du 
BO_T02_D1550:198b-16	mchod pa lnga dang ldan gyur cing //	mchod ba lnga dang ldan gyur cing 
BO_T02_D1550:198b-17	bza' ston de bzhin btung ba dang // phyi dang gsang bar bcas par ldan //	bza ston de bzhin thung ba dang phyi dang gsang ba cha ba ldan 
BO_T02_D1550:198b-18	snod ni dri med sbyangs pa ru //	snod ni dri med sbyong ba ru 
BO_T02_D1550:198b-19	gur kum la sogs sbyar bar bya //	gur kum la sogs sbyor ba byed 
BO_T02_D1550:198b-20	chu bzang po dang ldan pa la //	chu bzang po dang ldan ba la 
BO_T02_D1550:198b-21	sindhu ra'i phye ma btsags //	sindhu ra byed ma btsags 
BO_T02_D1550:198b-22	gser gyi smyu gu'i sbyor ba yis //	gser gyi smyu gu sbyor ba yis 
BO_T02_D1550:198b-23	blo dang ldan pas ae dbyibs bris //	blo dang ldan ba ae dbyibs bri 
BO_T02_D1550:198b-24	dbus su sngags kyi rgyal po ni //	dbus su sngags kyi rgyal po ni 
BO_T02_D1550:198b-25	rim pa bzhin du bri bar bya //	rim ba bzhin du bri ba byed 
BO_T02_D1550:198b-26	g-yung drung 'khyil ba'i phyag rgya ni //	g-yung drung khyil ba phyag rgya ni 
BO_T02_D1550:198b-27	dge ba'i 'khor lo'i logs la dgod //	dge ba khor lo logs la god 
BO_T02_D1550:198b-28	me tog rnam pa sna tshogs nyid //	me tog rnam ba sna tshogs nyid 
BO_T02_D1550:198b-29	chu las skyes dang thang las skyes //	chu las skye dang thang las skye 
BO_T02_D1550:198b-30	mar me ts'a ru dam tshig che //	mar me tsa ru dam tshig che 
BO_T02_D1550:198b-31	de bzhin gzhon nu ma yang mchod //	de bzhin gzhon nu ma yang mchod 
BO_T02_D1550:198b-32	mchod pa'i khyad par 'di dag ni //	mchod ba khyad ba di dag ni 
BO_T02_D1550:198b-33	nges pa nyid du bya ba yin //	nges ba nyid du byed ba yin 
BO_T02_D1550:198b-34	skra grol gcer bur byas nas ni //	skra grol bcer bur byed nas ni 
BO_T02_D1550:198b-35	sdar bshad phyogs bcu bltas nas kyang //	sdar chad phyogs chu lta nas kyang 
BO_T02_D1550:198b-36	shin tu gsang bar bya ba nyid //	shin tu gsang ba byed ba nyid 
BO_T02_D1550:198b-37	mchod pa'i dus su mnyam par gzhag //	mchod ba dus su mnyam ba jog 
BO_T02_D1550:198b-38	ma gsang bgegs ni skye 'gyur te //	ma gsang bgegs ni skye gyur te 
BO_T02_D1550:198b-39	dngos grub de bzhin nyams par 'gyur //	dngos grub de bzhin nyams ba gyur 
BO_T02_D1550:198b-40	dam tshig nyams par gyur pa na //	dam tshig nyams ba gyur ba na 
BO_T02_D1550:198b-41	nad rnams sna tshogs 'byung bar 'gyur //	nad rnams sna tshogs byung ba gyur 
BO_T02_D1550:198b-42	srog ni gtong bar gyur pa yis //	srog ni gtong ba gyur ba yis 
BO_T02_D1550:198b-43	'chi ba'i dus la bab kyang bla'i //	chi ba dus la bab kyang bla 
BO_T02_D1550:198b-44	gal te dngos grub mchog 'dod na //	gal te dngos grub mchog dod na 
BO_T02_D1550:198b-45	dam tshig rtag tu bsrung bar bya //	dam tshig rtag tu bsrung ba byed 
BO_T02_D1550:198b-46	khams gsum brtan dang g-yo ba yis //	khams gsum brtan dang g-yo ba yis 
BO_T02_D1550:198b-47	'gro ba thams cad g-yon nas 'byung //	gro ba thams cad g-yon nas byung 
BO_T02_D1550:198b-48	g-yon pa sngon du bskyod bya ste ;	g-yon ba sngon du skyod byed ste 
BO_T02_D1550:198b-49	/ rnal 'byor rtag tu g-yon pas spyad //	rnal byor rtag tu g-yon ba spyod 
BO_T02_D1550:198b-50	mchod pa lag pa g-yon pas ta //	mchod ba lag ba g-yon ba ta 
BO_T02_D1550:198b-51	bza' btung g-yon pas bya ba nyid //	bza thung g-yon ba byed ba nyid 
BO_T02_D1550:198b-52	rigs lnga la ni kun spyod pa //	rigs lnga la ni kun spyod ba 
BO_T02_D1550:198b-53	rigs gcig tu ni brtag par bya //	rigs gcig tu ni rtog ba byed 
BO_T02_D1550:198b-54	bza' dang bza' min de bzhin btung //	bza dang bza min de bzhin thung 
BO_T02_D1550:198b-55	sme gtsang ngo tsha rnam par spangs //	sme gtsang ngo tsha rnam ba spong 
BO_T02_D1550:199a-0	rtog pa kun las nges par @199a * //	rtogs ba kun las nges ba 
BO_T02_D1550:199a-1	grol ; / rtsod pa thams cad rnam par spangs //	grol rtsod ba thams cad rnam ba spong 
BO_T02_D1550:199a-2	mkha' 'gro ma yi dra ba sdom //	mkha gro ma yi dra ba sdom 
BO_T02_D1550:199a-3	dpa' bo seng ge bzhin du spyod //	dpa bo seng ge bzhin du spyod 
BO_T02_D1550:199a-4	sngags ni rnal 'byor ma'i rang bzhin //	sngags ni rnal byor ma rang bzhin 
BO_T02_D1550:199a-5	rnal 'byor ma ni sngags kyi gzugs //	rnal byor ma ni sngags kyi gzugs 
BO_T02_D1550:199a-6	gal te go 'phang mchog 'dod na //	gal te go phen mchog dod na 
BO_T02_D1550:199a-7	de dag tha dad par mi bya //	de dag tha dad ba mi byed 
BO_T02_D1550:199a-8	mi yis gang dang gang bsgom pa //	mi yis gang dang gang bsgom ba 
BO_T02_D1550:199a-9	yid dang yang dag ldan byas nas //	yid dang yang dag ldan byed nas 
BO_T02_D1550:199a-10	des na de yi bdag nyid 'gyur //	des na de yi bdag nyid gyur 
BO_T02_D1550:199a-11	sna tshogs nor bu ji bzhin no //	sna tshogs nor bu ji bzhin no 
BO_T02_D1550:199a-12	sems dang rjes mthun rnal 'byor gyis //	sems dang rjes mthun rnal byor gyis 
BO_T02_D1550:199a-13	gang zhig shin tu goms byed na //	gang jig shin tu goms byed na 
BO_T02_D1550:199a-14	mi gang bsod nams dman pa yang //	mi gang bsod nams dman ba yang 
BO_T02_D1550:199a-15	de ni grub 'gyur the tshom med //	de ni grub gyur the tshom med 
BO_T02_D1550:199a-16	bla ma sangs rgyas bla ma chos //	bla ma sangs rgya bla ma chos 
BO_T02_D1550:199a-17	de bzhin bal ma dge 'dun te //	de bzhin bal ma dge dun te 
BO_T02_D1550:199a-18	bla ma dpal ldan rdo rje can //	bla ma dpal ldan rdo rje can 
BO_T02_D1550:199a-19	'dir ni bla ma bla med pa'o //	dir ni bla ma bla med ba 
BO_T02_D1550:199a-20	sangs rgyas 'bras bu 'dod pa yin //	sangs rgya bras bu dod ba yin 
BO_T02_D1550:199a-21	de phyir bla ma bsnyen bkur bya //	de phyir bla ma snyen bkur byed 
BO_T02_D1550:199a-22	dpal dang ldan pa'i rub tu sngags pa'i gnas au rgyan nas byung ba'i dgongs pa bla na med pa dpa' rdo rje rnal 'byor ma'i gsang chen rna ba nas rna ba ru zhal nas zhal du brgyud pa'i rim pa rdzogs so /	dpal dang ldan ba rub tu sngags ba gnas au rgyan nas byung ba dgongs ba bla na med ba dpa rdo rje rnal byor ma gsang chen rna ba nas rna ba ru zhal nas zhal du brgyud ba rim ba rdzogs so 
BO_T02_D1550:199a-23	// / rgya gar gyi mkhan po bsod nams 'byung gnas bzang po'i zhal snga nas dang / bod kyi lo ts'a ba rma ban chos 'bar gyis bsgyur ba'o//	rgya gar gyi mkhan po bsod nams byung gnas bzang po zhal snga nas dang bod kyi lo tsa ba rma ban chos bar gyis sgyur 
