segmentnr	original	folio	stemmed
BO_T11_D4229:166a-25	dper na rgyu gzhan yod kyang mig gi rnam par shes pa res 'ga' 'gyur ba las mig rjes su dpog la /	166a	dper na rgyu gzhan yod kyang mig gi rnam ba shes ba res ga gyur ba las mig rjes su dpog la 
BO_T11_D4229:166b-0	@166b de bzhin du nus pa'i rgyu gzhan dbang po dang yid kyi rnam par shes pa'i mtshan nyid yod kyang 'bras bu rtsig pa la sogs par snang ba'i rnam par shes pa med pa'i phyir rjes su dpog la rgyu gzhan gang yin pa de yang phyi rol gyi	166b	de bzhin du nus ba rgyu gzhan dbang po dang yid kyi rnam ba shes ba mtshan nyid yod kyang bras bu rtsig ba la sogs ba snang ba rnam ba shes ba med ba phyir rjes su dpog la rgyu gzhan gang yin ba de yang phyi rol gyi 
BO_T11_D4229:166b-1	don yin par 'gyur ro //	166b	don yin ba gyur ro 
BO_T11_D4229:166b-2	gal te rtsod pa 'dir rnam par shes par smra 'ba' zhig nye bar len pa ste bag chags yongs su smin pa de nyid ni khyad par yin te /	166b	gal te rtsod ba dir rnam ba shes ba smra ba jig nye ba len ba ste bag chags yongs su smin ba de nyid ni khyad ba yin te 
BO_T11_D4229:166b-3	phyi rol gyi lhan cig byed pa'i rkyen gzhan las khyad par du gyur pa de med pas 'bras bu ldog pa ste /	166b	phyi rol gyi lhan cig byed ba rkyen gzhan las khyad ba du gyur ba de med ba bras bu ldog ba ste 
BO_T11_D4229:166b-4	med par mi smra na ni /	166b	med ba mi smra na ni 
BO_T11_D4229:166b-5	ldog pa'i sgo nas 'gyur ro //	166b	ldog ba sgo nas gyur ro 
BO_T11_D4229:166b-6	gal te rig par smra ba de yang kho bo dag la smra ba na rang gi phyogs la tshad ma dang cig shos ji ltar smra ci zhig byed pa na zhe na /	166b	gal te rig ba smra ba de yang kho bo dag la smra ba na rang gi phyogs la tshad ma dang cig shos ji ltar smra ci jig byed ba na zhe na 
BO_T11_D4229:166b-7	smras pa shes pa thams cad kyi yul bzlog pa na'o //	166b	smras ba shes ba thams cad kyi yul bzlog ba na 
BO_T11_D4229:166b-8	de ltar byed pas tshad ma dang cig shos rnam par gzhag par ji ltar 'gyur zhe na smras pa /	166b	de ltar byed ba tshad ma dang cig shos rnam ba jog ba ji ltar gyur zhe na smras ba 
BO_T11_D4229:166b-9	bslad pa dang cig shos te /	166b	bslad ba dang cig shos te 
BO_T11_D4229:166b-10	tshad ma dang tshad ma ma yin pa de nyid ni de dag dang 'brel pa yin la /	166b	tshad ma dang tshad ma ma yin ba de nyid ni de dag dang brel ba yin la 
BO_T11_D4229:166b-11	gang zhig thams cad bslad par smra ba des ji ltar bslad pa dang ma bslad pa dang 'brel pa tshad ma dang cig shos rnam par 'jog te /	166b	gang jig thams cad bslad ba smra ba des ji ltar bslad ba dang ma bslad ba dang brel ba tshad ma dang cig shos rnam ba jog te 
BO_T11_D4229:166b-12	mi bzhag pa nyid do //	166b	mi jog ba nyid do 
BO_T11_D4229:166b-13	gtan tshigs smras pa /	166b	gtan tshigs smras ba 
BO_T11_D4229:166b-14	shes pa thams cad nye bar bslad par chad par med pa'i phyir zhe na /	166b	shes ba thams cad nye ba bslad ba chad ba med ba phyir zhe na 
BO_T11_D4229:166b-15	slob dpon gyis de la yang rnam par gzhag pa bstan pa'i phyir smras pa /	166b	slob dpon gyis de la yang rnam ba jog ba ston ba phyir smras ba 
BO_T11_D4229:166b-16	nye bar bslad pa'i ma rig pa'i bag chags de 'tshams sbyor ba med pa ni rjes su mi sbyor ba ste /	166b	nye ba bslad ba ma rig ba bag chags de tshams sbyor ba med ba ni rjes su mi sbyor ba ste 
BO_T11_D4229:166b-17	rjes su mthun pa'i 'bras bu byed pa med ba'o //	166b	rjes su mthun ba bras bu byed ba med ba 
BO_T11_D4229:166b-18	de nyid ni skyon te skyon des na shes pa des bcug pa'i tha snyad la yid brtan med pa ste /	166b	de nyid ni skyon te skyon des na shes ba des jug ba tha snyad la yid brtan med ba ste 
BO_T11_D4229:166b-19	yid ches pa byar med par mthong bas rtogs pa gcig ni tshad ma ma yin par brjod do //	166b	yid ches ba byar med ba mthong ba rtogs ba gcig ni tshad ma ma yin ba rjod do 
BO_T11_D4229:166b-20	gal te don dam pa'i rig pa tha snyad thams cad la yid brtan pa med pa ma yin nam zhe na /	166b	gal te don dam ba rig ba tha snyad thams cad la yid brtan ba med ba ma yin nam zhe na 
BO_T11_D4229:166b-21	bden te / mi mkhas pas kyang ste tha snyad gang zhig byis pas kyang yid brtan du med pa des na tshad ma ma yin par rnam par 'jog go //	166b	bden te mi mkhas ba kyang ste tha snyad gang jig byis ba kyang yid brtan du med ba des na tshad ma ma yin ba rnam ba jog go 
BO_T11_D4229:166b-22	mtshams sbyor ba med pa'i bag chags des ni sngon por snang ba'i blo 'ba' zhig bskyed de /	166b	mtshams sbyor ba med ba bag chags des ni sngon por snang ba blo ba jig skyed de 
BO_T11_D4229:166b-23	de'i don byed par snang ba rnam par rig pas bag chags rgyas par mi byed do //	166b	de don byed ba snang ba rnam ba rig ba bag chags rgya ba mi byed do 
BO_T11_D4229:166b-24	des na sngon por snang ba'i shes pa 'ba' zhig skyed kyi /	166b	des na sngon por snang ba shes ba ba jig skyed kyi 
BO_T11_D4229:166b-25	snang ba de'i bsgrub par bya ba'i don du snang ba'i shes pa ni skyed pa ma yin no //	166b	snang ba de sgrub ba byed ba don du snang ba shes ba ni skyed ba ma yin no 
BO_T11_D4229:167a-0	yang dag pa'i chu'i 'bras bu ni dus ji srid par gos dang lus bangs pa'i gnas skabs dang / de bzhin du dus dang lus la ltos @167a * //	167a	yang dag ba chu bras bu ni dus ji srid ba gos dang lus bang ba gnas skabs dang de bzhin du dus dang lus la ltos 
BO_T11_D4229:167a-1	nas dus ji srid khyab kyi bar du grang ba'i rig pa'i gnas skabs dang / lus rgyas pa dang / lci ba'i gnas skabs kyi mtshan nyid rang bzhin yongs su 'gyur ba yin na /	167a	nas dus ji srid khyab kyi ba du grang ba rig ba gnas skabs dang lus rgya ba dang lci ba gnas skabs kyi mtshan nyid rang bzhin yongs su gyur ba yin na 
BO_T11_D4229:167a-2	de'i gnas skabs su ni bden pa'i chu dang 'brel pa'i don bya ba 'di dag gi rang gi ngo bor 'dzin pa'i rnam par shes pa ma skyed pa des na /	167a	de gnas skabs su ni bden ba chu dang brel ba don byed ba di dag gi rang gi ngo bor dzin ba rnam ba shes ba ma skyed ba des na 
BO_T11_D4229:167a-3	chur snang ba'i rnam par shes pa slu ba yin te /	167a	chur(d) snang ba rnam ba shes ba slu ba yin te 
BO_T11_D4229:167a-4	des na tshad ma ma yin no //	167a	des na tshad ma ma yin no 
BO_T11_D4229:167a-5	yang rnam par shes par gzhan 'khor ba ji srid par zhes bya bas ngas rgyas kyi go 'phang thob kyi bar du mthong ba'i don gyi 'bras bur snang ba'i shes pa'i chogs mi 'bral bar rjes su 'brel pa gang yin pa de ni tshad mar brjod do zhes	167a	yang rnam ba shes ba gzhan khor ba ji srid ba zhes byed ba ngas rgya kyi go phen thob kyi ba du mthong ba don gyi bras bur snang ba shes ba chogs mi bral ba rjes su brel ba gang yin ba de ni tshad mar rjod do zhes 
BO_T11_D4229:167a-6	'brel to // ci'i phyir 'bras bu'i shes pa dang mi 'bul zhe na /	167a	brel to ci phyir bras bu shes ba dang mi bul zhe na 
BO_T11_D4229:167a-7	bag chags brtan pa'i phyir ro //	167a	bag chags brtan ba phyir ro 
BO_T11_D4229:167a-8	chur snang ba'i shes pa'i bag chags ni chur snang ba'i shes pa skyed par byed cing /	167a	chur(d) snang ba shes ba bag chags ni chur(d) snang ba shes ba skyed ba byed cing 
BO_T11_D4229:167a-9	chu'i bsgrub par bya bar snang ba'i shes pa'i bag chags kyang rgyas par byed do //	167a	chu sgrub ba byed ba snang ba shes ba bag chags kyang rgya ba byed do 
BO_T11_D4229:167a-10	des na bag chags de las chur snang ba'i shes pa dang / bag chags yongs su smin pa dang ldan pa'i chu'i 'bras bu snang ba'i shes pa rim gyis skye ba'i phyi mi 'bral bar rjes su 'jug pa yin no //	167a	des na bag chags de las chur(d) snang ba shes ba dang bag chags yongs su smin ba dang ldan ba chu bras bu snang ba shes ba rim gyis skye ba phyi mi bral ba rjes su jug ba yin no 
BO_T11_D4229:167a-11	yang dper na phyi rol gyi don smra ba la yid kyi rnam par shes pa nyid las yid kyi rnam par shes pa 'ga' zhig skyes pa ni /	167a	yang dper na phyi rol gyi don smra ba la yid kyi rnam ba shes ba nyid las yid kyi rnam ba shes ba ga jig skye ba ni 
BO_T11_D4229:167a-12	'gag pa'i rnam par shes pa'i rgyud las bag chags gzhag pa de dus mthar phyin pas yongs su smin par byas pa na yang snga ma dang 'dra ba'i rnam par shes pa skyed par byed pa de bzhin du /	167a	gag ba rnam ba shes ba brgyud las bag chags jog ba de dus mthar phyin ba yongs su smin ba byed ba na yang snga ma dang dra ba rnam ba shes ba skyed ba byed ba de bzhin du 
BO_T11_D4229:167a-13	rnam par shes par smra ba las yang yin pas pha rol po'i nyes pa'i skabs yod pa ma yin no //	167a	rnam ba shes ba smra ba las yang yin ba pha rol po nyes ba skabs yod ba ma yin no 
BO_T11_D4229:167a-14	gal te thams cad mkhyen pa'i mkhyen pa la ltos na /	167a	gal te thams cad mkhyen ba mkhyen ba la ltos na 
BO_T11_D4229:167a-15	shes pa 'di thams cad slu ba yin pa de ltar na yang 'khor ba 'di na thar pa'i snga rol du byis pa'i skye bos byas pa'i tha snyad gang yin pa de la mi slu ba de la ltos nas tshad ma yin gyi /	167a	shes ba di thams cad slu ba yin ba de ltar na yang khor ba di na thar ba snga rol du byis ba skye bod byed ba tha snyad gang yin ba de la mi slu ba de la ltos nas tshad ma yin gyi 
BO_T11_D4229:167a-16	sangs rgyas pa nyid kyi gnas skabs la ltos pa ni ma yin no //	167a	sangs rgya ba nyid kyi gnas skabs la ltos ba ni ma yin no 
BO_T11_D4229:167a-17	don dam pa'i tshul la ltos nas mi slu ba gang yin pa de tshad mar brjod pa yin gyi /	167a	don dam ba tshul la ltos nas mi slu ba gang yin ba de tshad mar rjod ba yin gyi 
BO_T11_D4229:167a-18	tha snyad la ltos pas ni ma yin pa yin nam zhe na /	167a	tha snyad la ltos ba ni ma yin ba yin nam zhe na 
BO_T11_D4229:167a-19	'di ni tha snyad kyi dgos pa can tha snyad kyi 'bras bu can /	167a	di ni tha snyad kyi dgos ba can tha snyad kyi bras bu can 
BO_T11_D4229:167a-20	kun tu tha snyad pa'i tshad ma'i rang bzhin te /	167a	kun tu tha snyad ba tshad ma rang bzhin te 
BO_T11_D4229:167a-21	mtshan nyid brjod pa yin no //	167a	mtshan nyid rjod ba yin no 
BO_T11_D4229:167b-0	des na kun du tha snyad pa'i yul can nyid tshad ma dang chad ma ma yin pa @167b yin no //	167b	des na kun du tha snyad ba yul can nyid tshad ma dang chad ma ma yin ba yin no 
BO_T11_D4229:167b-1	don dam pa la 'jug pa'i don du tshad ma'i mtshan nyid bshad pa yin gyi /	167b	don dam ba la jug ba don du tshad ma mtshan nyid chad ba yin gyi 
BO_T11_D4229:167b-2	mi bden pa'i yul can ni ma yin pa ma yin nam /	167b	mi bden ba yul can ni ma yin ba ma yin nam 
BO_T11_D4229:167b-3	'di ltar bdag dang gzhan mi bden pa'i rang bzhin spangs pa dang / bden pa'i rang bzhin thob par bya ba'i phyir mkhas pa rtsol par rig pa yin no zhe na /	167b	di ltar bdag dang gzhan mi bden ba rang bzhin spong ba dang bden ba rang bzhin thob ba byed ba phyir mkhas ba rtsol ba rig ba yin no zhe na 
BO_T11_D4229:167b-4	'di la yang zhes smos te /	167b	di la yang zhes smos te 
BO_T11_D4229:167b-5	gal te tha snyad la rab tu sbyor ba'i shes pa 'di la yang 'jig rten rmongs par ma gyur na ni don dam pa'i shes pa 'ba' zhig gi mtshan nyid bshad par rigs pa yin na /	167b	gal te tha snyad la rab tu sbyor ba shes ba di la yang jig rten rmongs ba ma gyur na ni don dam ba shes ba ba jig gi mtshan nyid chad ba rigs ba yin na 
BO_T11_D4229:167b-6	gang gi tshe 'di la yang gzhan dag bdag nyid rmongs shing /	167b	gang gi tshe di la yang gzhan dag bdag nyid rmongs shing 
BO_T11_D4229:167b-7	gzhan yang rmongs par byed pa de'i tshe de dag don dam pa'i tshul la 'jug pa'i skabs ga la yod /	167b	gzhan yang rmongs ba byed ba de tshe de dag don dam ba tshul la jug ba skabs ga la yod 
BO_T11_D4229:167b-8	don dam pa'i tshul la 'jug par bya ba kho na'i phyir kun du tha snyad pa'i shes pa bshad pa yin no //	167b	don dam ba tshul la jug ba byed ba kho na phyir kun du tha snyad ba shes ba chad ba yin no 
BO_T11_D4229:167b-9	bsams pa las byung ba zhes bya ba ni tshul 'dis kyang skye bo don dam pa'i tshul la gzhug par nus pa yin no zhes ston pa yin no //	167b	bsams ba las byung ba zhes byed ba ni tshul dis kyang skye bo don dam ba tshul la jug ba nus ba yin no zhes ston ba yin no 
BO_T11_D4229:167b-10	'di la kun du tha snyad pa'i tshad ma'i de kho na bshad na rigs pa'i tshul de nyid kyis don sems pa la zhugs pa na /	167b	di la kun du tha snyad ba tshad ma de kho na chad na rigs ba tshul de nyid kyis don sems ba la jug ba na 
BO_T11_D4229:167b-11	de'i rgyu las byung ba'i shes rab khyad par du 'phags pa'i don snang ba'i blo goms par byas /	167b	de rgyu las byung ba shes rab khyad ba du phag ba don snang ba blo goms ba byed 
BO_T11_D4229:167b-12	'dris par byas pas rnam par 'khrul pas dben zhing bral ba dri ma med pa yongs su dag pa'i phyir phyogs pas na ldog pa ste don dam par las phyir ldog pa'o//	167b	dris ba byed ba rnam ba khrul ba dben zhing bral ba dri ma med ba yongs su dag ba phyir phyogs ba na ldog ba ste don dam ba las phyir ldog 
BO_T11_D4229:167b-13	de la ldog pa ni ldog pa med pa ste /	167b	de la ldog ba ni ldog ba med ba ste 
BO_T11_D4229:167b-14	phyir mi ldog pa'i zhes bya ba'i don to //	167b	phyir mi ldog ba zhes byed ba don to 
BO_T11_D4229:167b-15	yang na ldog pa ni skyon yin la /	167b	yang na ldog ba ni skyon yin la 
BO_T11_D4229:167b-16	'khor bar slar ldog pa yang skyon yin no //	167b	khor ba slar ldog ba yang skyon yin no 
BO_T11_D4229:167b-17	de gang la med pa de ni ldog pa med pa'o //	167b	de gang la med ba de ni ldog ba med ba 
BO_T11_D4229:167b-18	don dam par ni de kho na nyid kyi yul lam dgongs pa dam pa'o //	167b	don dam ba ni de kho na nyid kyi yul lam dgongs ba dam ba 
BO_T11_D4229:167b-19	de la rab tu sbyor ba ni don dam pa'o //	167b	de la rab tu sbyor ba ni don dam ba 
BO_T11_D4229:167b-20	mngon du byed pa ni skyed pa'o //	167b	mngon du byed ba ni skyed ba 
BO_T11_D4229:167b-21	bsam pa ni 'di yin te /	167b	bsam ba ni di yin te 
BO_T11_D4229:167b-22	don dam pa'i tshad ma yang rgyu med par ni ma yin la /	167b	don dam ba tshad ma yang rgyu med ba ni ma yin la 
BO_T11_D4229:167b-23	rgyu yang goms pa las gzhan ma yin no //	167b	rgyu yang goms ba las gzhan ma yin no 
BO_T11_D4229:167b-24	goms pa'i yul yang kun du tha snyad pa'i tshad mas dpyad pa'i don yin pa de'i phyir kun du tha snyad pa'i tshad ma de yang dag par rtogs pa ni don dam pa pa'i shes pa'i rgyur 'gyur ro ;	167b	goms ba yul yang kun du tha snyad ba tshad mas dpyod ba don yin ba de phyir kun du tha snyad ba tshad ma de yang dag ba rtogs ba ni don dam ba ba shes ba rgyur gyur ro 
BO_T11_D4229:167b-25	/ de nas de'i yul can gyi 'bad pa ni don dam pa'i yul can nyid do //	167b	de nas de yul can gyi bad ba ni don dam ba yul can nyid do 
BO_T11_D4229:167b-26	log pa'i shes pas yul du byas pa'i dngos po rtag pa la sogs pa'i rnam pa bsgoms pa ni don dam pa'i shes pa'i rgyur mi 'gyur la /	167b	log ba shes ba yul du byed ba dngos po rtag ba la sogs ba rnam ba sgom ba ni don dam ba shes ba rgyur mi gyur la 
BO_T11_D4229:167b-27	mi rtag pa la sogs pa'i rnam pa bsgoms na ni 'gyur ba nyid yin pa des na /	167b	mi rtag ba la sogs ba rnam ba sgom na ni gyur ba nyid yin ba des na 
BO_T11_D4229:168a-0	skye bo de las rmongs @168a * //	168a	skye bo de las rmongs 
BO_T11_D4229:168a-1	pa bzlog nas don dam pa pa'i shes pa la 'jug par bya ba yin te /	168a	ba bzlog nas don dam ba ba shes ba la jug ba byed ba yin te 
BO_T11_D4229:168a-2	rmongs pa 'di'i yul ni rags pa yin pa'i phyir ro //	168a	rmongs ba di yul ni rags ba yin ba phyir ro 
BO_T11_D4229:168a-3	don dam pa thob pa yang rmongs pa 'di log pa sngon du 'gro ba can yin pa'i phyir 'di nyid la 'bad par rigs so //	168a	don dam ba thob ba yang rmongs ba di log ba sngon du gro ba can yin ba phyir di nyid la bad ba rigs so 
BO_T11_D4229:168a-4	de phyir yang dag yang dag min //	168a	de phyir yang dag yang dag min 
BO_T11_D4229:168a-5	zhes bya ba la sogs pas rnam par nges pa 'dir ni ji ltar kun du tha snyad pa'i shes pa'i rim gyis /	168a	zhes byed ba la sogs ba rnam ba nges ba dir ni ji ltar kun du tha snyad ba shes ba rim gyis 
BO_T11_D4229:168a-6	don dam pa pa'i shes pa de'i tshe ste /	168a	don dam ba ba shes ba de tshe ste 
BO_T11_D4229:168a-7	bag tsam zhig bstan pa yin la /	168a	bag tsam jig ston ba yin la 
BO_T11_D4229:168a-8	de ci 'dra ba'i tshad ma yin pa de'i yang cha tsam zhig bstan pa yin te /	168a	de ci dra ba tshad ma yin ba de yang cha tsam jig ston ba yin te 
BO_T11_D4229:168a-9	de ni mngon sum gyi rang bzhin gyi tshad ma yin no //	168a	de ni mngon sum gyi rang bzhin gyi tshad ma yin no 
BO_T11_D4229:168a-10	gal te don dam pa'i shes pa de ni gzung ba dang ; 'dzin pa'i rnam pa dang bral ba'am /	168a	gal te don dam ba shes ba de ni gzung ba dang dzin ba rnam ba dang bral ba 
BO_T11_D4229:168a-11	don thams cad kyang 'dzin pa yin yang bla ste /	168a	don thams cad kyang dzin ba yin yang bla ste 
BO_T11_D4229:168a-12	gnyi ga ltar na yang de ni mngon sum nyid yin no //	168a	gnyi ga ltar na yang de ni mngon sum nyid yin no 
BO_T11_D4229:168a-13	tshad ma rnam par nges pa'i 'grel bshad /	168a	tshad ma rnam ba nges ba grel chad 
BO_T11_D4229:168a-14	slob dpon chos mchog gis sbyar ba las le'u dang po'o /	168a	slob dpon chos mchog gis sbyor ba las leu dang po 
BO_T11_D4229:168a-15	// / stong phrag bzhi dang gsum dang bzhi //	168a	stong phrag bzhi dang gsum dang bzhi 
BO_T11_D4229:168a-16	brgya phrag lnga dang drug dang gsum //	168a	brgya phrag lnga dang drug dang gsum 
BO_T11_D4229:168a-17	nyi shu gnyis dang sum cu ste //	168a	nyi shu gnyis dang sum cu ste 
BO_T11_D4229:168a-18	de ni gnyis drug gsum bcas so //	168a	de ni gnyis drug gsum cha so 
BO_T11_D4229:168a-19	le'u dang po 'di la tshigs su bcad pa bzhi stong lnga brgya nyi shu rtsa gnyis yod do /	168a	leu dang po di la tshigs su gcod ba bzhi stong lnga brgya nyi shu rtsa gnyis yod do 
BO_T11_D4229:168a-20	// / mngon sum dang rjes su dpag pa'i bye brag gis tshad ma gnyis su bstan pa las log par rtogs pa rnam pa bzhi bsal ba'i sgo nas mngon sum bshad zin nas /	168a	mngon sum dang rjes su dpog ba bye brag gis tshad ma gnyis su ston ba las log ba rtogs ba rnam ba bzhi bsal ba sgo nas mngon sum chad zin nas 
BO_T11_D4229:168a-21	ji ltar bstan pa bzhin du skabs su so //	168a	ji ltar ston ba bzhin du skabs su so 
BO_T11_D4229:168a-22	ji ltar shes pa'i mtshan nyid kyi mngon sum bzhi char la rtogs pa bsal ba'i don du /	168a	ji ltar shes ba mtshan nyid kyi mngon sum bzhi char la rtogs ba bsal ba don du 
BO_T11_D4229:168a-23	rjes dpag rnams gnyis zhes gsungs so //	168a	rjes dpog rnams gnyis zhes gsungs so 
BO_T11_D4229:168a-24	ji ltar shes pa'i mtshan nyid kyi mngon sum bzhi char la yang mtshan nyid thun mong ba gcig yod pa de bzhin du /	168a	ji ltar shes ba mtshan nyid kyi mngon sum bzhi char la yang mtshan nyid thun mong ba gcig yod ba de bzhin du 
BO_T11_D4229:168a-25	rjes su dpag pa rnam pa gnyis la ni mtshan nyid gcig yod pa ma yin te /	168a	rjes su dpog ba rnam ba gnyis la ni mtshan nyid gcig yod ba ma yin te 
BO_T11_D4229:168a-26	rang bzhin shin tu tha dad pa'i phyir ro //	168a	rang bzhin shin tu tha dad ba phyir ro 
BO_T11_D4229:168a-27	de la gcig ni shes pa yin la /	168a	de la gcig ni shes ba yin la 
BO_T11_D4229:168a-28	gzhan ni brjod pa yin no //	168a	gzhan ni rjod ba yin no 
BO_T11_D4229:168a-29	rnam pa'i dbye ba brjod na ni rnam pa'i mtshan nyid tha dad par bstan par nus pa yin no //	168a	rnam ba byed ba rjod na ni rnam ba mtshan nyid tha dad ba ston ba nus ba yin no 
BO_T11_D4229:168a-30	de nyid kyi phyir 'dir mtshan nyid tsam bstan na /	168a	de nyid kyi phyir dir mtshan nyid tsam ston na 
BO_T11_D4229:168a-31	khyad par gyi mtshan nyid gcig gam du mar 'gyur ba yin te /	168a	khyad ba gyi mtshan nyid gcig gam du mar gyur ba yin te 
BO_T11_D4229:168a-32	de'i grangs bstan pas ci zhig bya zhes gang brtsad pa de spangs pa yin no //	168a	de grangs ston ba ci jig byed zhes gang brtsad ba de spong ba yin no 
BO_T11_D4229:168a-33	'di ltar gsal ba'i khyad par nye bar bstan pa med par ni gsal ba so sor nges pa'i mtshan nyid bstan par mi nus so //	168a	di ltar gsal ba khyad ba nye ba ston ba med ba ni gsal ba so sor nges ba mtshan nyid ston ba mi nus so 
BO_T11_D4229:168b-0	des na gsal ba'i @168b dbye ba ni bstan par bya ba nyid do //	168b	des na gsal ba byed ba ni ston ba byed ba nyid do 
BO_T11_D4229:168b-1	rnam pa'i dbye ba yang gsal ba'i dbye ba nyid yin pa des na /	168b	rnam ba byed ba yang gsal ba byed ba nyid yin ba des na 
BO_T11_D4229:168b-2	rnam pa'i dbye ba brjod pa ni mtshan nyid rtogs par bya ba'i don kho na yin no //	168b	rnam ba byed ba rjod ba ni mtshan nyid rtogs ba byed ba don kho na yin no 
BO_T11_D4229:168b-3	'di rang gi ched yin pas na rang gi don la /	168b	di rang gi ched yin ba na rang gi don la 
BO_T11_D4229:168b-4	gzhan gyi ched du yin pas na gzhan gyi don to //	168b	gzhan gyi ched du yin ba na gzhan gyi don to 
BO_T11_D4229:168b-5	rang la dogs pa dang gzhan la dgos pa'o //	168b	rang la dogs ba dang gzhan la dgos ba 
BO_T11_D4229:168b-6	rjes su dpag pa gang zhig rgyur gyur pas rang rtogs par 'gyur ba de ni rang gi don te shes pa yin no //	168b	rjes su dpog ba gang jig rgyur gyur ba rang rtogs ba gyur ba de ni rang gi don te shes ba yin no 
BO_T11_D4229:168b-7	gal te rtogs pa ni shes pa nyid yin pa de lta na yang gcig nyid la yang bya ba dang byed pa las tha dad par bstan pa yin te /	168b	gal te rtogs ba ni shes ba nyid yin ba de lta na yang gcig nyid la yang byed ba dang byed ba las tha dad ba ston ba yin te 
BO_T11_D4229:168b-8	des na rjes su dpag pa ni byed pa yin la /	168b	des na rjes su dpog ba ni byed ba yin la 
BO_T11_D4229:168b-9	khong du chud pa'i rang bzhin 'bras bu'i gnas skabs ni rtogs pa yin no //	168b	khong du chud ba rang bzhin bras bu gnas skabs ni rtogs ba yin no 
BO_T11_D4229:168b-10	gal te skyes bu la nges pa'i tshul gsum pa'i rtags yod pa ma yin gyi /	168b	gal te skye bu la nges ba tshul gsum ba rtags yod ba ma yin gyi 
BO_T11_D4229:168b-11	de las skyes pa'i shes pa yang med la /	168b	de las skye ba shes ba yang med la 
BO_T11_D4229:168b-12	tshul gsum pa'i rtags brjod pa yang med pa yin te /	168b	tshul gsum ba rtags rjod ba yang med ba yin te 
BO_T11_D4229:168b-13	des na rjes su dpag pa gang zhig bdag nyid kyi yin la /	168b	des na rjes su dpog ba gang jig bdag nyid kyi yin la 
BO_T11_D4229:168b-14	gzhan gyi ma yin pa'am /	168b	gzhan gyi ma yin ba 
BO_T11_D4229:168b-15	gzhan gyi yin la bdag nyid kyi ma yin pa de yod dam ci gang /	168b	gzhan gyi yin la bdag nyid kyi ma yin ba de yod dam ci gang 
BO_T11_D4229:168b-16	'di ltar sgras kyang res 'ga' smra ba po 'di rtogs par byed pa yin la /	168b	di ltar sgras kyang res ga smra ba po di rtogs ba byed ba yin la 
BO_T11_D4229:168b-17	res 'ga'i tshe ni gzhan la sgras rtogs par bya ba yin no //	168b	res ga tshe ni gzhan la sgras rtogs ba byed ba yin no 
BO_T11_D4229:168b-18	de las kyang ci srid du sgra yang gzhan don yin par ma nges pa ma yin nam zhes dgos pa la /	168b	de las kyang ci srid du sgra yang gzhan don yin ba ma nges ba ma yin nam zhes dgos ba la 
BO_T11_D4229:168b-19	bshad pa shes pa dang brjod pa'i go rims bzhin du rang bzhin gang dag yin pa de dag gi ngo bo de rgyur gyur pa'i las /	168b	chad ba shes ba dang rjod ba go rims bzhin du rang bzhin gang dag yin ba de dag gi ngo bo de rgyur gyur ba las 
BO_T11_D4229:168b-20	gzhan de pha rol dang gzhan ma yin pa de nyid te /	168b	gzhan de pha rol dang gzhan ma yin ba de nyid te 
BO_T11_D4229:168b-21	gzhan dag gzhan ma yin pa de dag gi rtogs pa'i rgyu rgyu mtshan ni rjes su dpag pa de dag ma yin no //	168b	gzhan dag gzhan ma yin ba de dag gi rtogs ba rgyu rgyu mtshan ni rjes su dpog ba de dag ma yin no 
BO_T11_D4229:168b-22	des na don 'di yin te /	168b	des na don di yin te 
BO_T11_D4229:168b-23	tshul gsum pa'i rtags las skyes pa'i shes pa gang gi rgyud la skyes pa de ni de'i don de nyid de /	168b	tshul gsum ba rtags las skye ba shes ba gang gi brgyud la skye ba de ni de don de nyid de 
BO_T11_D4229:168b-24	des na gzhan rtogs pa ma yin pa'i phyir ro //	168b	des na gzhan rtogs ba ma yin ba phyir ro 
BO_T11_D4229:168b-25	de'i phyir rang bzhin don du brjod pa yin gyi gang la ltos nas rang gi don du brjod par 'gyur ba shes pa 'ga' yang skyes bu 'ga' la nges pa yod pa ni ma yin no //	168b	de phyir rang bzhin don du rjod ba yin gyi gang la ltos nas rang gi don du rjod ba gyur ba shes ba ga yang skye bu ga la nges ba yod ba ni ma yin no 
BO_T11_D4229:168b-26	de bzhin du brjod pa'i rang bzhin gyi rjes su dpag pa skyes bu la nges pa yod pa ma yin pa de lta na yang gzhan gyi don nyid yin no //	168b	de bzhin du rjod ba rang bzhin gyi rjes su dpog ba skye bu la nges ba yod ba ma yin ba de lta na yang gzhan gyi don nyid yin no 
BO_T11_D4229:168b-27	'di ltar gang zhig gang gi dbang du byas nas 'jug pa de ni don yin par brjod do //	168b	di ltar gang jig gang gi dbang du byed nas jug ba de ni don yin ba rjod do 
BO_T11_D4229:168b-28	sgra ni gzhan gyi dbang du byas nas sbyor ba yin gyi /	168b	sgra ni gzhan gyi dbang du byed nas sbyor ba yin gyi 
BO_T11_D4229:168b-29	bdag nyid kyi ni ma yin gyi /	168b	bdag nyid kyi ni ma yin gyi 
BO_T11_D4229:169a-0	des na sgra gzhan gyi don du ma nges pa ma yin @169a * //	169a	des na sgra gzhan gyi don du ma nges ba ma yin 
BO_T11_D4229:169a-1	no ; / gang gi phyir sbyor ba po mngon par 'dod pa'i yul gyi don la sbyor bar byed pa gzhan nyid yin pa'i phyir ro //	169a	no gang gi phyir sbyor ba po mngon ba dod ba yul gyi don la sbyor ba byed ba gzhan nyid yin ba phyir ro 
BO_T11_D4229:169a-2	gal te sgra gzhan gyi don yin pa de lta na yang rjes su dpag pa yin pa nyid kyis rang gi don las sgra la logs shig tu brjod pa smra bar ni mi rigs te /	169a	gal te sgra gzhan gyi don yin ba de lta na yang rjes su dpog ba yin ba nyid kyis rang gi don las sgra la logs shig tu rjod ba smra ba ni mi rigs te 
BO_T11_D4229:169a-3	khyad par med pa'i phyir ro //	169a	khyad ba med ba phyir ro 
BO_T11_D4229:169a-4	de la dgos pa'i mtshan nyid kyi khyad par yod grang na /	169a	de la dgos ba mtshan nyid kyi khyad ba yod grang na 
BO_T11_D4229:169a-5	de la gnag zhig brjod par bya ba'i rtags des bsgrub par bya ba'i de nyid sgra'i don kyang yin pa'i phyir yul khyad par yod pa ma yin no //	169a	de la gnag jig rjod ba byed ba rtags des sgrub ba byed ba de nyid sgra don kyang yin ba phyir yul khyad ba yod ba ma yin no 
BO_T11_D4229:169a-6	'di la rang gi ngo bor 'gyur ba'i mtshan nyid kyang cung zad yod pa ma yin no //	169a	di la rang gi ngo bor gyur ba mtshan nyid kyang cung zad yod ba ma yin no 
