segmentnr	original	stemmed
BO_T11_D4266:118b-12	rang bzhin rnams ni 'gal ba can //	rang bzhin rnams ni gal ba can 
BO_T11_D4266:118b-13	blo gcig gis rtogs ma mthong ste //	blo gcig gis rtogs ma mthong ste 
BO_T11_D4266:118b-14	tha dang blo rnams la lar bcas //	tha dang blo rnams la lar cha 
BO_T11_D4266:118b-15	rnam dbye ma byas pa'i ngo bos //	rnam byed ma byed ba ngo bod 
BO_T11_D4266:118b-16	dngos po kun ni gang gis rtogs //	dngos po kun ni gang gis rtogs 
BO_T11_D4266:118b-17	dngos po kun gyi rang mtshan nyid //	dngos po kun gyi rang mtshan nyid 
BO_T11_D4266:118b-18	de yis rtogs par mi 'gyur ro //	de yis rtogs ba mi gyur ro 
BO_T11_D4266:118b-19	spyi yi ngo bo rtogs byed po //	spyi yi ngo bo rtogs byed po 
BO_T11_D4266:118b-20	kun mkhyen yin pa des ci dgos //	kun mkhyen yin ba des ci dgos 
BO_T11_D4266:118b-21	rnam pa gzhan ni rtogs pa yis //	rnam ba gzhan ni rtogs ba yis 
BO_T11_D4266:118b-22	dngos po rtogs par mi 'gyur te ;	dngos po rtogs ba mi gyur te 
BO_T11_D4266:118b-23	/ rnam pa gcig bcas rnam shes de //	rnam ba gcig cha rnam shes de 
BO_T11_D4266:118b-24	yang dag ma yin log ma yin //	yang dag ma yin log ma yin 
BO_T11_D4266:118b-25	yang dag yin na mthong gnod 'di //	yang dag yin na mthong gnod di 
BO_T11_D4266:118b-26	thams cad gnyis med thal bar 'gyur //	thams cad gnyis med thal ba gyur 
BO_T11_D4266:118b-27	des kyang kun mkhyen slob ma dang // chos dang chos min des bstan par //	des kyang kun mkhyen slob ma dang chos dang chos min des ston ba 
BO_T11_D4266:118b-28	mi mthun tha dad dngos nyid kyi //	mi mthun tha dad dngos nyid kyi 
BO_T11_D4266:118b-29	rang bzhin nges bzung ma byas phyir //	rang bzhin nges bzung ma byed phyir 
BO_T11_D4266:118b-30	gcig rtogs log nyid yin pa na //	gcig rtogs log nyid yin ba na 
BO_T11_D4266:118b-31	kun mkhyen 'khrul pa thob par 'gyur //	kun mkhyen khrul ba thob ba gyur 
BO_T11_D4266:118b-32	de tshe de yi tshig dad pa //	de tshe de yi tshig dad ba 
BO_T11_D4266:118b-33	rigs min nyon sogs dag bzhin no //	rigs min nyon sogs dag bzhin no 
BO_T11_D4266:118b-34	gal te 'jig rten las 'das pa //	gal te jig rten las da ba 
BO_T11_D4266:118b-35	ting 'dzin las byung ye shes kyis //	ting dzin las byung ye shes kyis 
BO_T11_D4266:118b-36	rgyu bcas las bcas 'bras gang mkhyen //	rgyu cha las cha bras gang mkhyen 
BO_T11_D4266:118b-37	de ni thams cad mkhyen 'dod na //	de ni thams cad mkhyen dod na 
BO_T11_D4266:118b-38	mngon sum rjes dpag sgra las byung //	mngon sum rjes dpog sgra las byung 
BO_T11_D4266:118b-39	don gyis go dang dngos med pa'i //	don gyis go dang dngos med ba 
BO_T11_D4266:118b-40	tshad ma 'di ni sgrub byed na //	tshad ma di ni sgrub byed na 
BO_T11_D4266:118b-41	med pas de 'dra yod ma yin //	med ba de dra yod ma yin 
BO_T11_D4266:118b-42	rim gyis sam ni cig car gyis //	rim gyis sam ni cig car gyis 
BO_T11_D4266:118b-43	ji ltar 'bras med rjes dpag yin //	ji ltar bras med rjes dpog yin 
BO_T11_D4266:118b-44	nus pa yang ni yod min te //	nus ba yang ni yod min te 
BO_T11_D4266:118b-45	yang na thams cad nus ldan nyid //	yang na thams cad nus ldan nyid 
BO_T11_D4266:118b-46	kun gyis thams cad rtog pa na //	kun gyis thams cad rtogs ba na 
BO_T11_D4266:118b-47	zhing zhes nus dang ldan pa rnams //	zhing zhes nus dang ldan ba rnams 
BO_T11_D4266:118b-48	thabs dang bral ba nyid kyi phyir //	thabs dang bral ba nyid kyi phyir 
BO_T11_D4266:118b-49	de dag gas ni kun shes min //	de dag gas ni kun shes min 
BO_T11_D4266:118b-50	thun mong ma yin thabs rnyed pa //	thun mong ma yin thabs rnyed ba 
BO_T11_D4266:118b-51	skyes kun ma lus mtshan nyid can //	skye kun ma lus mtshan nyid can 
BO_T11_D4266:119a-0	@119a * // de la kun mkhyen gcig 'ga' zhig / zhes bya de ni tshad med can //	de la kun mkhyen gcig ga jig zhes byed de ni tshad med can 
BO_T11_D4266:119a-1	gang tshe 'di ltar kun mkhyen ni //	gang tshe di ltar kun mkhyen ni 
BO_T11_D4266:119a-2	'ga' zhig 'thad pa ma yin te //	ga jig thad ba ma yin te 
BO_T11_D4266:119a-3	de tshe chos rtogs pa yi rgyu //	de tshe chos rtogs ba yi rgyu 
BO_T11_D4266:119a-4	skyes bus byas pa'i tshig ma yin //	skye bud byed ba tshig ma yin 
BO_T11_D4266:119a-5	de ltar thos pa la sogs pa'i //	de ltar thos ba la sogs ba 
BO_T11_D4266:119a-6	dpyod ba pa rnams rang rang gis //	dpyod ba ba rnams rang rang gis 
BO_T11_D4266:119a-7	thos pa 'dod pas 'di ltar gnas //	thos ba dod ba di ltar gnas 
BO_T11_D4266:119a-8	rig byed rnams la rgyas pa ru //	rig byed rnams la rgya ba ru 
BO_T11_D4266:119a-9	skyes bus byas pa bsgrubs zin to //	skye bud byed ba sgrub zin to 
BO_T11_D4266:119a-10	de phyir dbang 'das don rnams ni //	de phyir dbang da don rnams ni 
BO_T11_D4266:119a-11	dngos su gzigs pa kho na yin //	dngos su gzigs ba kho na yin 
BO_T11_D4266:119a-12	rtag pa'i tshig ni 'ga' zhig gis //	rtag ba tshig ni ga jig gis 
BO_T11_D4266:119a-13	mthong min mi srid pa yi phyir //	mthong min mi srid ba yi phyir 
BO_T11_D4266:119a-14	rtag pa'i tshig gi nus pa ni //	rtag ba tshig gi nus ba ni 
BO_T11_D4266:119a-15	rang dang gzhan las kyang med de //	rang dang gzhan las kyang med de 
BO_T11_D4266:119a-16	rang gi don shes skyed pa la //	rang gi don shes skyed ba la 
BO_T11_D4266:119a-17	rim dang cig car 'gal phyir ro //	rim dang cig car gal phyir ro 
BO_T11_D4266:119a-18	de phyir mtho ris mchod spyin sogs //	de phyir mtho ris mchod spyin sogs 
BO_T11_D4266:119a-19	rang nyid kyis shes nas bsal byas //	rang nyid kyis shes nas bsal byed 
BO_T11_D4266:119a-20	khyed la rig byed byed po yang //	khyed la rig byed byed po yang 
BO_T11_D4266:119a-21	de 'dra dbang 'das don mthong yod //	de dra dbang da don mthong yod 
BO_T11_D4266:119a-22	skyes bu'i don gyis gtso mkhyen ba'am //	skye bu don gyis gtso mkhyen ba 
BO_T11_D4266:119a-23	chos thams thams cad mkhyen pa nyid //	chos thams thams cad mkhyen ba nyid 
BO_T11_D4266:119a-24	de ni khas len ma yin na //	de ni khas len ma yin na 
BO_T11_D4266:119a-25	gzhan du rig byed tshad mi 'gyur //	gzhan du rig byed tshad mi gyur 
BO_T11_D4266:119a-26	des na don gyis grub pa yi //	des na don gyis grub ba yi 
BO_T11_D4266:119a-27	khyod kyis chos mkhyen khas blangs pas//	khyod kyis chos mkhyen khas blangs 
BO_T11_D4266:119a-28	khyed kyis rgyas par byas pa yi //	khyed kyis rgya ba byed ba yi 
BO_T11_D4266:119a-29	dgag pa de la gnod par 'gyur //	gog ba de la gnod ba gyur 
BO_T11_D4266:119a-30	gzhan yang skra dang ba spu gang //	gzhan yang skra dang ba spu gang 
BO_T11_D4266:119a-31	de dag shes pa sus nus 'os //	de dag shes ba sus nus s 
BO_T11_D4266:119a-32	de ni rgyu med kho na ru //	de ni rgyu med kho na ru 
BO_T11_D4266:119a-33	rgyal po'i bkag dang 'dra bar smras //	rgyal po gog dang dra ba smras 
BO_T11_D4266:119a-34	gang phyir 'ga' yi mi g-yo ba'i //	gang phyir ga yi mi g-yo ba 
BO_T11_D4266:119a-35	dri med ye shes mar me yis //	dri med ye shes mar me yis 
BO_T11_D4266:119a-36	dngos po ma lus gsal byed pa //	dngos po ma lus gsal byed ba 
BO_T11_D4266:119a-37	de la gnod can smras ma yin //	de la gnod can smras ma yin 
BO_T11_D4266:119a-38	mi snang ba tsam gyis kyang ni //	mi snang ba tsam gyis kyang ni 
BO_T11_D4266:119a-39	de med par ni 'byung min te //	de med ba ni byung min te 
BO_T11_D4266:119a-40	dngos po rnams kyi dmigs pa ni //	dngos po rnams kyi dmigs ba ni 
BO_T11_D4266:119a-41	rgyu dang khyab byed med pa na //	rgyu dang khyab byed med ba na 
BO_T11_D4266:119a-42	rgyu ldan khyab par bya bdag /'dir ni ldog par rigs pa yin //	rgyu ldan khyab ba byed bdag ni ldog ba rigs ba yin 
BO_T11_D4266:119a-43	de las byung de bdag nyid phyir //	de las byung de bdag nyid phyir 
BO_T11_D4266:119a-44	me dang shing ni med pa na //	me dang shing ni med ba na 
BO_T11_D4266:119a-45	du ba aa mra la sogs bzhin //	du ba aa mra la sogs bzhin 
BO_T11_D4266:119a-46	de lta min na rgyu med dang // tha dad nyid du thal bar 'gyur //	de lta min na rgyu med dang tha dad nyid du thal ba gyur 
BO_T11_D4266:119a-47	gal te don rnams ma lus la //	gal te don rnams ma lus la 
BO_T11_D4266:119a-48	rang gi dmigs pa'i rgyu dang ni //	rang gi dmigs ba rgyu dang ni 
BO_T11_D4266:119a-49	khyab byed nyid du khyod kyis ni //	khyab byed nyid du khyod kyis ni 
BO_T11_D4266:119a-50	tshad ma 'ga' las nges byas na //	tshad ma ga las nges byed na 
BO_T11_D4266:119b-0	de yi tshe khyed @119b 'bad med par //	de yi tshe khyed bad med ba 
BO_T11_D4266:119b-1	don kun shes par grub pa yin //	don kun shes ba grub ba yin 
BO_T11_D4266:119b-2	des na khyed rang kun mkhyen pas //	des na khyed rang kun mkhyen ba 
BO_T11_D4266:119b-3	bdag nyid rang la ci phyir sdang // de nyid kyi phyir khyed la ni //	bdag nyid rang la ci phyir sdang de nyid kyi phyir khyed la ni 
BO_T11_D4266:119b-4	kun mkhyen 'di ni snang mi 'gyur //	kun mkhyen di ni snang mi gyur 
BO_T11_D4266:119b-5	des snang gyur na khyod rang ni //	des snang gyur na khyod rang ni 
BO_T11_D4266:119b-6	'bad ba med bar kun mkhyen 'gyur //	bad ba med ba kun mkhyen gyur 
BO_T11_D4266:119b-7	gal te khyod la'ang don kun gyi //	gal te khyod la don kun gyi 
BO_T11_D4266:119b-8	yul can shes pa yong pa na //	yul can shes ba yong ba na 
BO_T11_D4266:119b-9	de tshe don kun yul can gyi //	de tshe don kun yul can gyi 
BO_T11_D4266:119b-10	shes pa khyed la snang bar 'gyur //	shes ba khyed la snang ba gyur 
BO_T11_D4266:119b-11	gang khyod don kun yul shes med //	gang khyod don kun yul shes med 
BO_T11_D4266:119b-12	de la de ni ji ltar snang //	de la de ni ji ltar snang 
BO_T11_D4266:119b-13	des rgyu khyab byed bdag nyid kyi //	des rgyu khyab byed bdag nyid kyi 
BO_T11_D4266:119b-14	rang bzhin mi snang ngo bo'i phyir //	rang bzhin mi snang ngo bo phyir 
BO_T11_D4266:119b-15	khyed kyis ma mthong khyad par 'di //	khyed kyis ma mthong khyad ba di 
BO_T11_D4266:119b-16	kun mkhyen pa ni mi grub po //	kun mkhyen ba ni mi grub po 
BO_T11_D4266:119b-17	mi mthong rnam gsum can 'di yang //	mi mthong rnam gsum can di yang 
BO_T11_D4266:119b-18	sna tshogs ngo bor 'jug 'gyur te //	sna tshogs ngo bor jug gyur te 
BO_T11_D4266:119b-19	de dang de 'gal la sogs pa //	de dang de gal la sogs ba 
BO_T11_D4266:119b-20	mi rtogs rtogs dbye'i sbyor sgo nas //	mi rtogs rtogs byed sbyor sgo nas 
BO_T11_D4266:119b-21	kun mkhyen med par bsgrubs pa la //	kun mkhyen med ba sgrub ba la 
BO_T11_D4266:119b-22	rtsa ba'i dbye bas ngo bo can //	rtsa ba byed ba ngo bo can 
BO_T11_D4266:119b-23	mi dmigs 'di ni nus bral bar//	mi dmigs di ni nus bral 
BO_T11_D4266:119b-24	bsgrubs na gzhan dga' 'bad byed sel //	sgrub na gzhan dga bad byed sel 
BO_T11_D4266:119b-25	rgyu dang 'bras nyid khyab bya dang // khyab byed nyid dang 'gal ba nyid //	rgyu dang bras nyid khyab byed dang khyab byed nyid dang gal ba nyid 
BO_T11_D4266:119b-26	snang nyid yin na grub 'gyur te //	snang nyid yin na grub gyur te 
BO_T11_D4266:119b-27	gang yang bdag nyid khyab pa can //	gang yang bdag nyid khyab ba can 
BO_T11_D4266:119b-28	khyed la kun mkhyen mi snang bas //	khyed la kun mkhyen mi snang ba 
BO_T11_D4266:119b-29	des na mi dmigs de dag rnams //	des na mi dmigs de dag rnams 
BO_T11_D4266:119b-30	de spong bar ni byed nus min//	de spong ba ni byed nus 
BO_T11_D4266:119b-31	dgag pa'i yan lag gzhan yang med //	gog ba yan lag gzhan yang med 
BO_T11_D4266:119b-32	gal te ma mthong tsam gyis ni //	gal te ma mthong tsam gyis ni 
BO_T11_D4266:119b-33	kun mkhyen 'gog par byed yin na //	kun mkhyen gog ba byed yin na 
BO_T11_D4266:119b-34	de tshe khyed kyis mar me bskor //	de tshe khyed kyis mar me skor 
BO_T11_D4266:119b-35	byas la sogs kyang bkag par 'gyur //	byed la sogs kyang gog ba gyur 
BO_T11_D4266:119b-36	bu zhes bya ba'i 'bras mthong phyir //	bu zhes byed ba bras mthong phyir 
BO_T11_D4266:119b-37	de rgyu yod par rtogs she na //	de rgyu yod ba rtogs she na 
BO_T11_D4266:119b-38	de med kyang ni 'bras bu de //	de med kyang ni bras bu de 
BO_T11_D4266:119b-39	'ga' zhig la snang ma yin nam //	ga jig la snang ma yin nam 
BO_T11_D4266:119b-40	gal te gzhan gyis dmigs pas na //	gal te gzhan gyis dmigs ba na 
BO_T11_D4266:119b-41	de ni med par rtogs pa min //	de ni med ba rtogs ba min 
BO_T11_D4266:119b-42	khyed la gzhan gyi dmigs de ni //	khyed la gzhan gyi dmigs de ni 
BO_T11_D4266:119b-43	yul can ji ltar grub min nam //	yul can ji ltar grub min nam 
BO_T11_D4266:119b-44	nyer bstan phyir na de bzhin du //	nyer ston phyir na de bzhin du 
BO_T11_D4266:119b-45	'di la kun mkhyen la cis med //	di la kun mkhyen la cis med 
BO_T11_D4266:119b-46	rang gis smras pa 'di yang ni //	rang gis smras ba di yang ni 
BO_T11_D4266:119b-47	'dir ni ci yi phyir ma mthong //	dir ni ci yi phyir ma mthong 
BO_T11_D4266:119b-48	skyes bu rnams kyang rtag tu ni //	skye bu rnams kyang rtag tu ni 
BO_T11_D4266:119b-49	phal cher brdzun ni smra ba yin //	phal cher brdzun ni smra ba yin 
BO_T11_D4266:119b-50	ji ltar da ltar yid ches med //	ji ltar da ltar yid ches med 
BO_T11_D4266:119b-51	de ltar 'das don smras la'ang yin //	de ltar da don smras la yin 
BO_T11_D4266:119b-52	nyer bstan pa'am 'dir tshad ma //	nyer ston ba dir tshad ma 
BO_T11_D4266:119b-53	nyid min yin mod de lta na'ang //	nyid min yin mod de lta na 
BO_T11_D4266:120a-0	khyed kyis kun mkhyen ma @120a * //	khyed kyis kun mkhyen ma 
BO_T11_D4266:120a-1	dmigs zhes // nges pa 'di ni gang las skyes //	dmigs zhes nges ba di ni gang las skye 
BO_T11_D4266:120a-2	sems can bdag nyid ma mthong na //	sems can bdag nyid ma mthong na 
BO_T11_D4266:120a-3	de lta bu yi nges 'byung 'gyur //	de lta bu yi nges byung gyur 
BO_T11_D4266:120a-4	de dag mthong na khyod dang ni //	de dag mthong na khyod dang ni 
BO_T11_D4266:120a-5	kun mkhyen 'gyur bar bstan zin to //	kun mkhyen gyur ba ston zin to 
BO_T11_D4266:120a-6	de lta min na the tshom ni //	de lta min na the tshom ni 
BO_T11_D4266:120a-7	dmigs pa la yang yod bzhin rigs //	dmigs ba la yang yod bzhin rigs 
BO_T11_D4266:120a-8	'ga' zhig kun mkhyen yin pas na //	ga jig kun mkhyen yin ba na 
BO_T11_D4266:120a-9	rang bdag nyid kyis bdag nyid ni //	rang bdag nyid kyis bdag nyid ni 
BO_T11_D4266:120a-10	rig par 'gyur gyi dogs yin te //	rig ba gyur gyi dogs yin te 
BO_T11_D4266:120a-11	de ni bdag gsal mthong ba yin //	de ni bdag gsal mthong ba yin 
BO_T11_D4266:120a-12	de yang de ltar dogs pa na //	de yang de ltar dogs ba na 
BO_T11_D4266:120a-13	kun gyis ma mthong nges pa med //	kun gyis ma mthong nges ba med 
BO_T11_D4266:120a-14	'di ltar thams cad sgra yis ni //	di ltar thams cad sgra yis ni 
BO_T11_D4266:120a-15	srog chags thams cad 'dod pa yin //	srog chags thams cad dod ba yin 
BO_T11_D4266:120a-16	de yang kun la phyi nang med //	de yang kun la phyi nang med 
BO_T11_D4266:120a-17	des na ma mthong nges pa med //	des na ma mthong nges ba med 
BO_T11_D4266:120a-18	de gcig yongs su spong bas na //	de gcig yongs su spong ba na 
BO_T11_D4266:120a-19	'dir ni 'brel pa 'ga' zhig yod //	dir ni brel ba ga jig yod 
BO_T11_D4266:120a-20	gzhan gyis yongs su mi shes phyir //	gzhan gyis yongs su mi shes phyir 
BO_T11_D4266:120a-21	rang gi chags sogs ldog mi 'gyur //	rang gi chags sogs ldog mi gyur 
BO_T11_D4266:120a-22	tshu rol mthong ba 'ga' zhig kyang //	tshu rol mthong ba ga jig kyang 
BO_T11_D4266:120a-23	rjes su dpag pas rtogs par 'gyur //	rjes su dpog ba rtogs ba gyur 
BO_T11_D4266:120a-24	res 'ga' kho na 'ga' zhig gi / blo rnams la lar khyad bcas yin //	res ga kho na ga jig gi blo rnams la lar khyad cha yin 
BO_T11_D4266:120a-25	'di ltar rig byed la sogs la //	di ltar rig byed la sogs la 
BO_T11_D4266:120a-26	skad cig nyid sogs sgrub pa ni //	skad cig nyid sogs sgrub ba ni 
BO_T11_D4266:120a-27	sngar ni gsal bar bstan zin kyang //	sngar ni gsal ba ston zin kyang 
BO_T11_D4266:120a-28	rmongs pa rnams kyis nyer mtshon min //	rmongs ba rnams kyis nyer mtshon min 
BO_T11_D4266:120a-29	de ltar dgos pa 'di la ni //	de ltar dgos ba di la ni 
BO_T11_D4266:120a-30	tshad ma med pa'ang des mi 'gyur //	tshad ma med ba des mi gyur 
BO_T11_D4266:120a-31	gang la gnyis skyes dgos med par //	gang la gnyis skye dgos med ba 
BO_T11_D4266:120a-32	kun mkhyen med nyid du rtogs yin //	kun mkhyen med nyid du rtogs yin 
BO_T11_D4266:120a-33	rjes su dpag pa med na yang //	rjes su dpog ba med na yang 
BO_T11_D4266:120a-34	de yis kun mkhyen med des min //	de yis kun mkhyen med des min 
BO_T11_D4266:120a-35	du sogs 'bras bu mi rtsol ba'i //	du sogs bras bu mi rtsol ba 
BO_T11_D4266:120a-36	me sogs yod nyid la bzhin no //	me sogs yod nyid la bzhin no 
BO_T11_D4266:120a-37	res 'ga' dmigs pa'i don la ni //	res ga dmigs ba don la ni 
BO_T11_D4266:120a-38	the tshom rigs pa ma yin nam //	the tshom rigs ba ma yin nam 
BO_T11_D4266:120a-39	mthe yor bzhin du 'di ltar ni //	mthe yor bzhin du di ltar ni 
BO_T11_D4266:120a-40	de ni gnyis ka'i char brten yin //	de ni gnyis ka char rten yin 
BO_T11_D4266:120a-41	gang phyir res 'ga' mtho yor min //	gang phyir res ga mtho yor min 
BO_T11_D4266:120a-42	mthong na de la brten pa yi //	mthong na de la rten ba yi 
BO_T11_D4266:120a-43	the tshom der ni rigs pa yin //	the tshom der ni rigs ba yin 
BO_T11_D4266:120a-44	kun mkhyen de ltar mthong ma yin //	kun mkhyen de ltar mthong ma yin 
BO_T11_D4266:120a-45	rnam pa 'di nyid kho na yis //	rnam ba di nyid kho na yis 
BO_T11_D4266:120a-46	ma yi me skor la sogs pa //	ma yi me skor la sogs ba 
BO_T11_D4266:120a-47	the tshom med pas med pa ru //	the tshom med ba med ba ru 
BO_T11_D4266:120a-48	bla ldan khyed la thal min nam //	bla ldan khyed la thal min nam 
BO_T11_D4266:120a-49	dngos po rnams ni yod med du //	dngos po rnams ni yod med du 
BO_T11_D4266:120a-50	tshad ma nges par ldog pa'i phyir //	tshad ma nges ba ldog ba phyir 
BO_T11_D4266:120a-51	kho bos tshad ma med na yang //	kho bod tshad ma med na yang 
BO_T11_D4266:120a-52	'dir ni the tshom yod par smras //	dir ni the tshom yod ba smras 
BO_T11_D4266:120b-0	mig sogs rnams @120b ni nyams pa ni //	mig sogs rnams ni nyams ba ni 
BO_T11_D4266:120b-1	dngos yod kyang ni tshad mi 'jug / de rnams ma nyams pa nyid kyang //	dngos yod kyang ni tshad mi jug de rnams ma nyams ba nyid kyang 
BO_T11_D4266:120b-2	dngos po med phyir bum sogs bzhin //	dngos po med phyir bum sogs bzhin 
BO_T11_D4266:120b-3	des na mi dmigs 'ba' zhig ni //	des na mi dmigs ba jig ni 
BO_T11_D4266:120b-4	rnam pa gnyis su snang ba'i phyir //	rnam ba gnyis su snang ba phyir 
BO_T11_D4266:120b-5	des na tshad ma med na yang //	des na tshad ma med na yang 
BO_T11_D4266:120b-6	kun mkhyen the tshom 'gyur ba'i mchog / de ni yod kyang gzhan rtog bzhin //	kun mkhyen the tshom gyur ba mchog de ni yod kyang gzhan rtogs bzhin 
BO_T11_D4266:120b-7	rmongs pas dngos su mthong ma yin //	rmongs ba dngos su mthong ma yin 
BO_T11_D4266:120b-8	lcags gong dang ni mdag ma yi //	lcags gong dang ni mdag ma yi 
BO_T11_D4266:120b-9	me bzhin 'bras bu mi skyed do //	me bzhin bras bu mi skyed do 
BO_T11_D4266:120b-10	gzhan rtogs las byung chags pa bzhin //	gzhan rtogs las byung chags ba bzhin 
BO_T11_D4266:120b-11	de yi 'bras bu la ltos min //	de yi bras bu la ltos min 
BO_T11_D4266:120b-12	'bras bu snang yang de dang ni //	bras bu snang yang de dang ni 
BO_T11_D4266:120b-13	'di la rjes 'gro rtogs pa min //	di la rjes gro rtogs ba min 
BO_T11_D4266:120b-14	gang phyir rmongs pa'i blo mthong la //	gang phyir rmongs ba blo mthong la 
BO_T11_D4266:120b-15	rtag tu mkhyen kun snang mi 'gyur //	rtag tu mkhyen kun snang mi gyur 
BO_T11_D4266:120b-16	de'i phyir rjes su dpag pa des //	de phyir rjes su dpog ba des 
BO_T11_D4266:120b-17	med par 'grub par mi 'gyur ro //	med ba grub ba mi gyur ro 
BO_T11_D4266:120b-18	tshad ma'i dngos po'i rgyu dang ni //	tshad ma dngos po rgyu dang ni 
BO_T11_D4266:120b-19	khyab byed nyid ni min par bshad //	khyab byed nyid ni min ba chad 
BO_T11_D4266:120b-20	de log na ni de yod par //	de log na ni de yod ba 
BO_T11_D4266:120b-21	mthong yin des na the tshom bshad //	mthong yin des na the tshom chad 
BO_T11_D4266:120b-22	de phyir kun mkhyen yod pa ru //	de phyir kun mkhyen yod ba ru 
BO_T11_D4266:120b-23	gnod pa can gyi tshad ma ni //	gnod ba can gyi tshad ma ni 
BO_T11_D4266:120b-24	cung zad yod min 'di'i sgrub byed //	cung zad yod min di sgrub byed 
BO_T11_D4266:120b-25	rgyas par mngon par 'chad par 'gyur //	rgya ba mngon ba chad ba gyur 
BO_T11_D4266:120b-26	ma lus don ni yongs shes pas //	ma lus don ni yongs shes ba 
BO_T11_D4266:120b-27	sgrub pa 'bras bu med yin yang //	sgrub ba bras bu med yin yang 
BO_T11_D4266:120b-28	blo bzangs bde gshegs pa rnams ni //	blo bzangs bde gshegs ba rnams ni 
BO_T11_D4266:120b-29	sems 'dis 'bad par byed pa yin //	sems dis bad ba byed ba yin 
BO_T11_D4266:120b-30	mtho ris thar pa thob byed pa'i //	mtho ris thar ba thob byed ba 
BO_T11_D4266:120b-31	rgyu ni dngos su khyed 'ba' zhig / yod par rtogs te 'on kyang ni //	rgyu ni dngos su khyed ba jig yod ba rtogs te n kyang ni 
BO_T11_D4266:120b-32	thams cad mkhyen pa rtogs par 'gyur //	thams cad mkhyen ba rtogs ba gyur 
BO_T11_D4266:120b-33	des kyang gnod pa med pas na //	des kyang gnod ba med ba na 
BO_T11_D4266:120b-34	sgrub pa gsal bar yod pa ni //	sgrub ba gsal ba yod ba ni 
BO_T11_D4266:120b-35	ci phyir thams cad mkhyen pa la //	ci phyir thams cad mkhyen ba la 
BO_T11_D4266:120b-36	rmongs pa'i blo can log rtogs byed //	rmongs ba blo can log rtogs byed 
BO_T11_D4266:120b-37	'di la sgrub byed med na yang //	di la sgrub byed med na yang 
BO_T11_D4266:120b-38	gnod byed nges par ma byas par //	gnod byed nges ba ma byed ba 
BO_T11_D4266:120b-39	the tshom 'gyur te de dag la //	the tshom gyur te de dag la 
BO_T11_D4266:120b-40	des 'di'i rgyu mtshan ga las byung //	des di rgyu mtshan ga las byung 
BO_T11_D4266:120b-41	bskul ba kho nas byung ba sogs //	skul ba kho nas byung ba sogs 
BO_T11_D4266:120b-42	rtogs par nus te gzhan gyis min //	rtogs ba nus te gzhan gyis min 
BO_T11_D4266:120b-43	gzhan ni med par nges pa na //	gzhan ni med ba nges ba na 
BO_T11_D4266:120b-44	de ltar nges 'di rigs pa yin //	de ltar nges di rigs ba yin 
BO_T11_D4266:120b-45	skyes bu'i don kun mkhyen pa yi //	skye bu don kun mkhyen ba yi 
BO_T11_D4266:120b-46	don kun mkhyen pa rab bsgrub phyir //	don kun mkhyen ba rab sgrub phyir 
BO_T11_D4266:120b-47	tshad ma de la sngar bstan zin //	tshad ma de la sngar ston zin 
BO_T11_D4266:120b-48	phyi nas gzhan ni 'chad par 'gyur //	phyi nas gzhan ni chad ba gyur 
BO_T11_D4266:120b-49	des na 'gro kun phra ba yi //	des na gro kun phra ba yi 
BO_T11_D4266:120b-50	dbye ba mkhyen pa nyid sgrub na //	byed ba mkhyen ba nyid sgrub na 
BO_T11_D4266:121a-0	gzhung rtsod dag la @121a * //	gzhung rtsod dag la 
BO_T11_D4266:121a-1	brtson pa yis //	brtson ba yis 
BO_T11_D4266:121a-2	gnas min 'jig rten nyon mongs min //	gnas min jig rten nyon mongs min 
BO_T11_D4266:121a-3	'jal bar byed pa kun 'brel ba'i //	jal ba byed ba kun brel ba 
BO_T11_D4266:121a-4	mngon sum sogs ni ma bkag phyir //	mngon sum sogs ni ma gog phyir 
BO_T11_D4266:121a-5	sdig pa dang ni bsod nams dag / lung tsam 'ba' zhig gis rtogs min //	sdig ba dang ni bsod nams dag lung tsam ba jig gis rtogs min 
BO_T11_D4266:121a-6	dpyod ba pa rnams kyi phyogs ni //	dpyod ba ba rnams kyi phyogs ni 
BO_T11_D4266:121a-7	de tsam gyis mi grub kyang bla //	de tsam gyis mi grub kyang bla 
BO_T11_D4266:121a-8	kun mkhyen spong ba'i 'bad pa gang //	kun mkhyen spong ba bad ba gang 
BO_T11_D4266:121a-9	de ni gzhan dag rmongs pas byas //	de ni gzhan dag rmongs ba byed 
BO_T11_D4266:121a-10	rtsa ba ma chad ba nyid phyir //	rtsa ba ma chad ba nyid phyir 
BO_T11_D4266:121a-11	chos nyid mkhyen pa nyams pa min //	chos nyid mkhyen ba nyams ba min 
BO_T11_D4266:121a-12	kun mkhyen skyes bur gang gis smras //	kun mkhyen skye bur gang gis smras 
BO_T11_D4266:121a-13	de dag gis blo'i khyad par bstan //	de dag gis blo khyad ba ston 
BO_T11_D4266:121a-14	lce yi dbang po dang 'brel pa'i //	lce yi dbang po dang brel ba 
BO_T11_D4266:121a-15	chang sogs mi gtsang ro sogs rnams //	chang sogs mi gtsang ro sogs rnams 
BO_T11_D4266:121a-16	gal te de dag de bstar na //	gal te de dag de bstar na 
BO_T11_D4266:121a-17	de lta na de smad bar 'gyur //	de lta na de smad ba gyur 
BO_T11_D4266:121a-18	yang dag don bsgoms las byung ba //	yang dag don sgom las byung ba 
BO_T11_D4266:121a-19	yid kyi rnam par shes pa yis //	yid kyi rnam ba shes ba yis 
BO_T11_D4266:121a-20	smad par gyur kyang kun rdzob tu //	smad ba gyur kyang kun rdzob tu 
BO_T11_D4266:121a-21	ma phrad nyid dang rig par 'gyur //	ma phrad nyid dang rig ba gyur 
BO_T11_D4266:121a-22	gang phyir skyob pa yi ni gsung //	gang phyir skyob ba yi ni gsung 
BO_T11_D4266:121a-23	rig byed sogs kyis bstan pa'i don //	rig byed sogs kyis ston ba don 
BO_T11_D4266:121a-24	ston par byed phyir snang min te //	ston ba byed phyir snang min te 
BO_T11_D4266:121a-25	des na de nyid kun mkhyen du //	des na de nyid kun mkhyen du 
BO_T11_D4266:121a-26	srid yin mu stegs ma lus dang // thun mong ma yin gnas pa na //	srid yin mu stegs ma lus dang thun mong ma yin gnas ba na 
BO_T11_D4266:121a-27	tshad mas gnod pa'i bdag sogs ni //	tshad mas gnod ba bdag sogs ni 
BO_T11_D4266:121a-28	rig byed brdzun par bstan pa yin //	rig byed brdzun ba ston ba yin 
BO_T11_D4266:121a-29	gzhan gyis shes min zhi ba'i sgo //	gzhan gyis shes min zhi ba sgo 
BO_T11_D4266:121a-30	lta ba ngan pa 'jig byed pa //	lta ba ngan ba jig byed ba 
BO_T11_D4266:121a-31	gdul bya rnams la phan pa'i phyir //	gdul byed rnams la phan ba phyir 
BO_T11_D4266:121a-32	bdag med de yis gsal bar gsungs //	bdag med de yis gsal ba gsungs 
BO_T11_D4266:121a-33	'khor ba pas ni ma goms pa //	khor ba ba ni ma goms ba 
BO_T11_D4266:121a-34	shes na phung khrol kun ldog med //	shes na phung khrol kun ldog med 
BO_T11_D4266:121a-35	de goms pa dang ldan rnams la //	de goms ba dang ldan rnams la 
BO_T11_D4266:121a-36	yon tan rin chen 'byung gnas mchog / de 'dra mchog gyur de nyid ni ;	yon tan rin chen byung gnas mchog de dra mchog gyur de nyid ni 
BO_T11_D4266:121a-37	/ gal te snyan ngag mkhan shes na //	gal te snyan ngag mkhan shes na 
BO_T11_D4266:121a-38	skyes bu'i don gyi gtso shes pas //	skye bu don gyi gtso shes ba 
BO_T11_D4266:121a-39	su zhig kun mkhyen du 'dod min //	su jig kun mkhyen du dod min 
BO_T11_D4266:121a-40	bstod ris la sogs rnams la ni //	bstod ris la sogs rnams la ni 
BO_T11_D4266:121a-41	bdag med ye shes de 'dra ba //	bdag med ye shes de dra ba 
BO_T11_D4266:121a-42	yod min mu stegs thams cad ni //	yod min mu stegs thams cad ni 
