segmentnr	original	folio	stemmed
BO_T11_D4229:158a-13	dags par snang ba rnam par rtog pas sprul pa yang rigs pa ma yin te /	158a	dags ba snang ba rnam ba rtogs ba sprul ba yang rigs ba ma yin te 
BO_T11_D4229:158a-14	gsal bar snang ba'i phyir dang / rnam par rtog pa rnams ni gsal bar snang ba ma yin pa'i phyir ro //	158a	gsal ba snang ba phyir dang rnam ba rtogs ba rnams ni gsal ba snang ba ma yin ba phyir ro 
BO_T11_D4229:158a-15	ji ltar smig rgyu dag la chur rnam par rtog pa gsal bar snang ba de bzhin du rags par rnam par rtog pa yang yin no zhes ni brjod par mi nus te /	158a	ji ltar smig rgyu dag la chur(d) rnam ba rtogs ba gsal ba snang ba de bzhin du rags ba rnam ba rtogs ba yang yin no zhes ni rjod ba mi nus te 
BO_T11_D4229:158a-16	gang gi phyir smig rgyu'i rang gi mtshan nyid 'dzin pa'i rnam par shes pa dang dus gcig tu 'jug pa'i chu'i rnam par rtog pa snang ba dang rnam par brtag pa dag gcig tu byed pa'i phyir gsal bar snang bar nges par 'gyur na /	158a	gang gi phyir smig rgyu rang gi mtshan nyid dzin ba rnam ba shes ba dang dus gcig tu jug ba chu rnam ba rtogs ba snang ba dang rnam ba rtog ba dag gcig tu byed ba phyir gsal ba snang ba nges ba gyur na 
BO_T11_D4229:158b-0	'dir ni gang zhig dang lhan cig rgyu ba las rags pa'i rnam par rtog pa @158b gsal bar snang bar rtogs par 'gyur ba rags pa nyams su myong ba gsal bar snang ba ni 'ga' yang yod pa ma yin no //	158b	dir ni gang jig dang lhan cig rgyu ba las rags ba rnam ba rtogs ba gsal ba snang ba rtogs ba gyur ba rags ba nyams su myong ba gsal ba snang ba ni ga yang yod ba ma yin no 
BO_T11_D4229:158b-1	gzhan yang rnam par rtog pa'i rnam par shes pa yang bdag nyid kyi rang bzhin gang yin pa de kho na nyams su myong bar 'gyur ba yin na /	158b	gzhan yang rnam ba rtogs ba rnam ba shes ba yang bdag nyid kyi rang bzhin gang yin ba de kho na nyams su myong ba gyur ba yin na 
BO_T11_D4229:158b-2	de la ni rags pa yod pa ma yin te /	158b	de la ni rags ba yod ba ma yin te 
BO_T11_D4229:158b-3	de'i phyir snang bar mi 'gyur ro //	158b	de phyir snang ba mi gyur ro 
BO_T11_D4229:158b-4	rnam par rtog pa'i rnam par shes pa ni rang gi bdag nyid don med pa la don du lhag par zhen nas 'jug pa yin no zhe na /	158b	rnam ba rtogs ba rnam ba shes ba ni rang gi bdag nyid don med ba la don du lhag ba zhen nas jug ba yin no zhe na 
BO_T11_D4229:158b-5	don med pa ston pa ni nges par brtags pa na med pa gsal bar byed pa nyid du gnas pa yin te /	158b	don med ba ston ba ni nges ba rtog ba na med ba gsal ba byed ba nyid du gnas ba yin te 
BO_T11_D4229:158b-6	gang gi phyir don med pa gsal ba na bdag nyid gsal bar byed pa'am /	158b	gang gi phyir don med ba gsal ba na bdag nyid gsal ba byed ba 
BO_T11_D4229:158b-7	gzhan gsal bar byed par 'gyur te /	158b	gzhan gsal ba byed ba gyur te 
BO_T11_D4229:158b-8	rnam pa gzhan ni mi srid pa'i phyir ro //	158b	rnam ba gzhan ni mi srid ba phyir ro 
BO_T11_D4229:158b-9	re zhig bdag nyid ni gsal bar byed pa ma yin te /	158b	re jig bdag nyid ni gsal ba byed ba ma yin te 
BO_T11_D4229:158b-10	rnam par shes pa nyid gsal ba'i rang bzhin yin pa'i phyir dang / don med pa ni dngos po ma yin pa'i yang phyir ro //	158b	rnam ba shes ba nyid gsal ba rang bzhin yin ba phyir dang don med ba ni dngos po ma yin ba yang phyir ro 
BO_T11_D4229:158b-11	gzhan gyis gsal bar byed na yang de gsal bar byed pa ni shes pa'i bdag nyid de nyid mi bden pa gsal bar byed par skyes pa yin no //	158b	gzhan gyis gsal ba byed na yang de gsal ba byed ba ni shes ba bdag nyid de nyid mi bden ba gsal ba byed ba skye ba yin no 
BO_T11_D4229:158b-12	'di snyam du ma rig pa'i dbang gis de ltar gsal ba yin no snyam na /	158b	di snyam du ma rig ba dbang gis de ltar gsal ba yin no snyam na 
BO_T11_D4229:158b-13	gal te ma rig pa de dngos po med pa yin na dngos po med pas dngos po med pa gsal bar byed do zhes bya ba'i tshig gi tshul 'di cir yang mi rung ngo //	158b	gal te ma rig ba de dngos po med ba yin na dngos po med ba dngos po med ba gsal ba byed do zhes byed ba tshig gi tshul di cir yang mi rung ngo 
BO_T11_D4229:158b-14	ci ste dngos po yin pa de lta na yang de ni rnam par shes pa'i rang bzhin nyid yin na de las kyang dngos po med pa ji ltar gsal te /	158b	ci ste dngos po yin ba de lta na yang de ni rnam ba shes ba rang bzhin nyid yin na de las kyang dngos po med ba ji ltar gsal te 
BO_T11_D4229:158b-15	dngos po dang dngos po med pa dag la ni 'brel pa 'ga' yang yod pa ma yin no //	158b	dngos po dang dngos po med ba dag la ni brel ba ga yang yod ba ma yin no 
BO_T11_D4229:158b-16	de'i phyir ma rig pa'i nus pa dang ldan pa'i shes pa mi bden pa'i rang bzhin gsal ba'i byed pa yin pa'i phyir ma rig pa'i dbang gis gsal ba yin no zhes brjod pa la ni kha na ma tho ba yong pa ma yin no //	158b	de phyir ma rig ba nus ba dang ldan ba shes ba mi bden ba rang bzhin gsal ba byed ba yin ba phyir ma rig ba dbang gis gsal ba yin no zhes rjod ba la ni kha na ma tho ba yong ba ma yin no 
BO_T11_D4229:158b-17	de'i phyir de ltar don med par 'dzin pa'i shes pa thams cad mi bden pa gsal bar byed pa'i ma rig pa'i bdag nyid du blta bar bya'o //	158b	de phyir de ltar don med ba dzin ba shes ba thams cad mi bden ba gsal ba byed ba ma rig ba bdag nyid du lta ba byed 
BO_T11_D4229:158b-18	thams cad du gal te snang ba gang yin pa de thams cad yod pa yin na tshangs pas kyang shes pa 'ba' zhig kyang 'khrul par brtag par mi nus so //	158b	thams cad du gal te snang ba gang yin ba de thams cad yod ba yin na tshangs ba kyang shes ba ba jig kyang khrul ba rtog ba mi nus so 
BO_T11_D4229:158b-19	ci ste mi bden pa yang yod na ni brgya byin gyis kyang /	158b	ci ste mi bden ba yang yod na ni brgya byin gyis kyang 
BO_T11_D4229:158b-20	shes pa mi bden pa gsal bar byed pa'i nus pa bsnyon par mi nus so //	158b	shes ba mi bden ba gsal ba byed ba nus ba snyon ba mi nus so 
BO_T11_D4229:159a-0	'dod du @159a * //	159a	dod du 
BO_T11_D4229:159a-1	zin kyang nyams su myong ba thams cad bden pa yin par ni sus kyang gzhag par nus pa ma yin pa'i phyir shes pa'i mi bden pa gsal ba'i nus pa las 'da' bar bya ba ma yin no //	159a	zin kyang nyams su myong ba thams cad bden ba yin ba ni sus kyang jog ba nus ba ma yin ba phyir shes ba mi bden ba gsal ba nus ba las da ba byed ba ma yin no 
BO_T11_D4229:159a-2	mi bden pa'i rang bzhin nyid ma rig pa'i dbang gis ston par byed pa'i bden pa ni ma yin te /	159a	mi bden ba rang bzhin nyid ma rig ba dbang gis ston ba byed ba bden ba ni ma yin te 
BO_T11_D4229:159a-3	bden pa dang lhan cig 'brel pa nges pa med pa'i phyir ro //	159a	bden ba dang lhan cig brel ba nges ba med ba phyir ro 
BO_T11_D4229:159a-4	nyams su myong ba nges pa'i rang bzhin mi slu ba ni spang bar nus pa ma yin te /	159a	nyams su myong ba nges ba rang bzhin mi slu ba ni spong ba nus ba ma yin te 
BO_T11_D4229:159a-5	de ni khas blang bar bya ba yin pa'i phyir ro //	159a	de ni khas blang ba byed ba yin ba phyir ro 
BO_T11_D4229:159a-6	yang gang nyams su myong yang gnod par byed pa mthong ba'i phyir slu ba de ni spang bar bya ba yin te /	159a	yang gang nyams su myong yang gnod ba byed ba mthong ba phyir slu ba de ni spong ba byed ba yin te 
BO_T11_D4229:159a-7	dper na zla ba gnyis kyi rang bzhin lta bu'o //	159a	dper na zla ba gnyis kyi rang bzhin lta bu 
BO_T11_D4229:159a-8	gnod par byed pa med pa'i phyir 'khrul pa mi 'grub bo zhes gang 'chad par 'gyur ro //	159a	gnod ba byed ba med ba phyir khrul ba mi grub bo zhes gang chad ba gyur ro 
BO_T11_D4229:159a-9	de bzhin du rnam 'grel las kyang /	159a	de bzhin du rnam grel las kyang 
BO_T11_D4229:159a-10	gnod byed rig pa dam pa ni //	159a	gnod byed rig ba dam ba ni 
BO_T11_D4229:159a-11	med na nyams myong yang bya min //	159a	med na nyams myong yang byed min 
BO_T11_D4229:159a-12	zhes so // dga' ba la sogs pa'i rang bzhin yang dag par rig pa ni spang par bya ba ma yin te /	159a	zhes so dga ba la sogs ba rang bzhin yang dag ba rig ba ni spong ba byed ba ma yin te 
BO_T11_D4229:159a-13	gnod par byed pa med pa'i phyir ro //	159a	gnod ba byed ba med ba phyir ro 
BO_T11_D4229:159a-14	des na gcig ma yin no zhes bya bar gnas so //	159a	des na gcig ma yin no zhes byed ba gnas so 
BO_T11_D4229:159a-15	de nyid kyi phyir 'khrul pa'i shes pa dper brjod do //	159a	de nyid kyi phyir khrul ba shes ba dper rjod do 
BO_T11_D4229:159a-16	gzhan du na sngon po dang sngon po'i rang bzhin dag lhan cig dmigs pas nges pa na tha dad pa yod pa ma yin gyi /	159a	gzhan du na sngon po dang sngon po rang bzhin dag lhan cig dmigs ba nges ba na tha dad ba yod ba ma yin gyi 
BO_T11_D4229:159a-17	'on kyang gcig nyid yin pa de bzhin du /	159a	n kyang gcig nyid yin ba de bzhin du 
BO_T11_D4229:159a-18	sngon po dang de'i blo dag kyang zhes bya ba nyid brjod par bya bar 'gyur ro //	159a	sngon po dang de blo dag kyang zhes byed ba nyid rjod ba byed ba gyur ro 
BO_T11_D4229:159a-19	sngon po dang 'brel pa'i rang bzhin gang yin pa de ni nyams su myong ba las don gzhan pa ste /	159a	sngon po dang brel ba rang bzhin gang yin ba de ni nyams su myong ba las don gzhan ba ste 
BO_T11_D4229:159a-20	gzhan du gyur pa nyid ma yin no //	159a	gzhan du gyur ba nyid ma yin no 
BO_T11_D4229:159a-21	gtan tshigs kyi don sbyor bar byed pa ni de dag lhan cig pa nyid du dmigs pa nges pa'i phyir zla ba gnyis la sogs pa bzhin no //	159a	gtan tshigs kyi don sbyor ba byed ba ni de dag lhan cig ba nyid du dmigs ba nges ba phyir zla ba gnyis la sogs ba bzhin no 
BO_T11_D4229:159a-22	ji ltar 'khrul pa'i shes pa gcig la snang ba'i zla ba gnyis dag lhan cig pa nyid du nges par dmigs pa'i phyir phan tshun dang shes pa las tha dad pa yod pa ma yin pa de bzhin du 'di dag la yang blta bar bya'o //	159a	ji ltar khrul ba shes ba gcig la snang ba zla ba gnyis dag lhan cig ba nyid du nges ba dmigs ba phyir phan tshun dang shes ba las tha dad ba yod ba ma yin ba de bzhin du di dag la yang lta ba byed 
BO_T11_D4229:159a-23	gtan tshigs kyi don rang nyid ston par byed pa ni 'di dag las zhes bya ba yin te /	159a	gtan tshigs kyi don rang nyid ston ba byed ba ni di dag las zhes byed ba yin te 
BO_T11_D4229:159a-24	shes pa dang shes bya 'di dag las shes pa'am shes bya'i rnam pa ste /	159a	shes ba dang shes byed di dag las shes ba shes byed rnam ba ste 
BO_T11_D4229:159a-25	rang bzhin gcig ma dmigs na gzhan te gnyis pa dmigs pa med do //	159a	rang bzhin gcig ma dmigs na gzhan te gnyis ba dmigs ba med do 
BO_T11_D4229:159a-26	des na 'di ni nges pa'i don du bstan pa ma yin te /	159a	des na di ni nges ba don du ston ba ma yin te 
BO_T11_D4229:159b-0	shes bya dmigs @159b pa ni shes pa dmigs pa'i bdag nyid can nyid yin gyi gzhan du ma yin la /	159b	shes byed dmigs ba ni shes ba dmigs ba bdag nyid can nyid yin gyi gzhan du ma yin la 
BO_T11_D4229:159b-1	shes pa dmigs pa yang shes bya dmigs pa'i bdag nyid yin no zhes gzhan du gyur pa nyid bzlog pa yin no //	159b	shes ba dmigs ba yang shes byed dmigs ba bdag nyid yin no zhes gzhan du gyur ba nyid bzlog ba yin no 
BO_T11_D4229:159b-2	gar dang gyad la lta ba la sogs pa rnams la gang shes bya dmigs par mi 'gyur ba'i shes pa ni 'ga' yang yod pa ma yin no //	159b	gar dang gyad la lta ba la sogs ba rnams la gang shes byed dmigs ba mi gyur ba shes ba ni ga yang yod ba ma yin no 
BO_T11_D4229:159b-3	de bas na shes bya mi dmigs pa'am /	159b	de ba na shes byed mi dmigs ba 
BO_T11_D4229:159b-4	shes pa mi dmigs par shes bya dmigs pa ni 'ga' yang yod pa ma yin no zhes rnam pa gzhan nyid 'gog pa yin gyi /	159b	shes ba mi dmigs ba shes byed dmigs ba ni ga yang yod ba ma yin no zhes rnam ba gzhan nyid gog ba yin gyi 
BO_T11_D4229:159b-5	dmigs pa thams cad la tha dad pa nyid 'gog pa ni ma yin no //	159b	dmigs ba thams cad la tha dad ba nyid gog ba ni ma yin no 
BO_T11_D4229:159b-6	gang yang bcom ldan 'das kyis shes bya dang thugs la lhan cig dmigs pa nges pa yod kyang /	159b	gang yang joms ldan da kyis shes byed dang thugs la lhan cig dmigs ba nges ba yod kyang 
BO_T11_D4229:159b-7	tha dad pa med pa ni ma yin no zhes smras pa de ni mi rigs te /	159b	tha dad ba med ba ni ma yin no zhes smras ba de ni mi rigs te 
BO_T11_D4229:159b-8	gang gi phyir de la ni lhan cig dmigs pa nges pa nyid med de /	159b	gang gi phyir de la ni lhan cig dmigs ba nges ba nyid med de 
BO_T11_D4229:159b-9	tha dad pa nyid du rgyud gzhan gyis rang gi sems dmigs pa'i phyir ro //	159b	tha dad ba nyid du brgyud gzhan gyis rang gi sems dmigs ba phyir ro 
BO_T11_D4229:159b-10	de nyid kyi phyir sems dang sems las byung bas kyang 'khrul par 'gyur ba ma yin te /	159b	de nyid kyi phyir sems dang sems las byung ba kyang khrul ba gyur ba ma yin te 
BO_T11_D4229:159b-11	de dag rnams kyang so sor bdag nyid yang dag par rig pa'i phyir ro //	159b	de dag rnams kyang so sor bdag nyid yang dag ba rig ba phyir ro 
BO_T11_D4229:159b-12	gang zhig gcig dmigs pa na cig shos mi dmigs pa gang yin pa de dag la ni 'khrul pa yod pa ma yin no //	159b	gang jig gcig dmigs ba na cig shos mi dmigs ba gang yin ba de dag la ni khrul ba yod ba ma yin no 
BO_T11_D4229:159b-13	de bzhin gshegs pa'i thugs dmigs pa nyid ni shes bya dmigs pa ma yin gyi /	159b	de bzhin gshegs ba thugs dmigs ba nyid ni shes byed dmigs ba ma yin gyi 
BO_T11_D4229:159b-14	'on kyang gzhan yang yod pa yin no //	159b	n kyang gzhan yang yod ba yin no 
BO_T11_D4229:159b-15	gcig gis sam gcig ces bya ba'i phyogs ni khas ma blangs pa'i phyir /	159b	gcig gis sam gcig ces byed ba phyogs ni khas ma blangs ba phyir 
BO_T11_D4229:159b-16	de la brjod pa'i skyon mi srid pa nyid do //	159b	de la rjod ba skyon mi srid ba nyid do 
BO_T11_D4229:159b-17	rang bzhin tha dad pa ste /	159b	rang bzhin tha dad ba ste 
BO_T11_D4229:159b-18	rang bzhin phan tshun dben pa la ni nges par lhan cig tu 'dzin pa 'di 'thad pa ma yin te /	159b	rang bzhin phan tshun dben ba la ni nges ba lhan cig tu dzin ba di thad ba ma yin te 
BO_T11_D4229:159b-19	'brel pa nyid du gyur pa'i rgyu mtshan de med pa'i phyir ro //	159b	brel ba nyid du gyur ba rgyu mtshan de med ba phyir ro 
BO_T11_D4229:159b-20	'di skad du brjod pa yin te /	159b	di skad du rjod ba yin te 
BO_T11_D4229:159b-21	phan tshun 'brel pa med par ni tha dad pa dag lhan cig dmigs pa nges pa ma yin la /	159b	phan tshun brel ba med ba ni tha dad ba dag lhan cig dmigs ba nges ba ma yin la 
BO_T11_D4229:159b-22	de yang re zhig ni bdag nyid kyi rgyu mtshan can du ni rang nyid mi 'dod do //	159b	de yang re jig ni bdag nyid kyi rgyu mtshan can du ni rang nyid mi dod do 
BO_T11_D4229:159b-23	de las byung ba yang me dang du bdag bzhin du lhan cig dmigs par ma nges so //	159b	de las byung ba yang me dang du bdag bzhin du lhan cig dmigs ba ma nges so 
BO_T11_D4229:159b-24	yul dang yul can gyi mtshan nyid kyang rnam pa dang bcas pa'i phyogs la ni bkag zin to //	159b	yul dang yul can gyi mtshan nyid kyang rnam ba dang cha ba phyogs la ni gog zin to 
BO_T11_D4229:159b-25	rnam pa med pa'i phyogs la yang khyad par med pa'i shes pa 'ba' zhig nyams su myong ba na khyad par dang ldan par bstan par mi nus so //	159b	rnam ba med ba phyogs la yang khyad ba med ba shes ba ba jig nyams su myong ba na khyad ba dang ldan ba ston ba mi nus so 
BO_T11_D4229:160a-0	yul yang shes pa dmigs pa las tha dad par @160a * //	160a	yul yang shes ba dmigs ba las tha dad ba 
BO_T11_D4229:160a-1	dmigs pa ma yin la /	160a	dmigs ba ma yin la 
BO_T11_D4229:160a-2	shes pa dmigs pa de la yang khyad par yod pa ma yin no //	160a	shes ba dmigs ba de la yang khyad ba yod ba ma yin no 
BO_T11_D4229:160a-3	'dzin pa'i rnam pa nyams su myong ba grub pa ni zlog pa ma yin gyi /	160a	dzin ba rnam ba nyams su myong ba grub ba ni zlog ba ma yin gyi 
BO_T11_D4229:160a-4	'ba' zhig po de la yul so so las khyad par yod pa ma yin la /	160a	ba jig po de la yul so so las khyad ba yod ba ma yin la 
BO_T11_D4229:160a-5	ma dmigs pa'i khyad par yang khyad par du rnam par 'jog pa'i rgyu ma yin no zhes bshad zin to //	160a	ma dmigs ba khyad ba yang khyad ba du rnam ba jog ba rgyu ma yin no zhes chad zin to 
BO_T11_D4229:160a-6	des na mngon sum yang dag par rig pa la ni khyad par yod pa ma yin te /	160a	des na mngon sum yang dag ba rig ba la ni khyad ba yod ba ma yin te 
BO_T11_D4229:160a-7	khyad par gyi tha snyad ni nyams su myong bar gyur pa'i don la brten pa yin no zhes gang smras pa de bsal ba yin te /	160a	khyad ba gyi tha snyad ni nyams su myong ba gyur ba don la rten ba yin no zhes gang smras ba de bsal ba yin te 
BO_T11_D4229:160a-8	gang gi phyir don nyams su myong bar grub na ni rnam par shes pa'i khyad par gyi tha snyad nyams su myong bar gyur pa la brten par gyur na de nyid ma grub pa'i phyir ro //	160a	gang gi phyir don nyams su myong ba grub na ni rnam ba shes ba khyad ba gyi tha snyad nyams su myong ba gyur ba la rten ba gyur na de nyid ma grub ba phyir ro 
BO_T11_D4229:160a-9	'di dag ji ltar snang ba bzhin du brtags pa'i tha dad pa ni kho na nyid ma yin no zhes brjod pa yin no //	160a	di dag ji ltar snang ba bzhin du rtog ba tha dad ba ni kho na nyid ma yin no zhes rjod ba yin no 
BO_T11_D4229:160a-10	des na brtags pa'i tha dad pa'i rgyu mtshan can lhan cig pa'i sgra sbyar ba'i phyir 'gal ba ci yod /	160a	des na rtog ba tha dad ba rgyu mtshan can lhan cig ba sgra sbyor ba phyir gal ba ci yod 
BO_T11_D4229:160a-11	da ni 'brel pa gzhan bsal ba na 'brel pa med par lhan cig dmigs pa nges pa gang yin pa zhes de ltar gtan tshigs khyad par du byas kyang ma grub pa ma yin pa'am /	160a	da ni brel ba gzhan bsal ba na brel ba med ba lhan cig dmigs ba nges ba gang yin ba zhes de ltar gtan tshigs khyad ba du byed kyang ma grub ba ma yin ba 
BO_T11_D4229:160a-12	yang na gzungs dang snang ba dag 'khrul pa'i yul nyid du mi gnas pa'i phyir khyad par 'dod pa ma yin te ;	160a	yang na gzungs dang snang ba dag khrul ba yul nyid du mi gnas ba phyir khyad ba dod ba ma yin te 
BO_T11_D4229:160a-13	de dag gnas na ni khyad par la ltos par 'gyur ro //	160a	de dag gnas na ni khyad ba la ltos ba gyur ro 
BO_T11_D4229:160a-14	des na khyad par med pa gtan tshigs yin no //	160a	des na khyad ba med ba gtan tshigs yin no 
BO_T11_D4229:160a-15	gzugs dang snang ba dag gis 'khrul par dogs pa la /	160a	gzugs dang snang ba dag gis khrul ba dogs ba la 
BO_T11_D4229:160a-16	bshad pa / gzugs dang snang ba dag la ni de'i shes pa skyed par rung ba gang yin pa de thob pa'i mtshan nyid dam /	160a	chad ba gzugs dang snang ba dag la ni de shes ba skyed ba rung ba gang yin ba de thob ba mtshan nyid dam 
BO_T11_D4229:160a-17	ngo bo gang yin pa'o //	160a	ngo bo gang yin ba 
BO_T11_D4229:160a-18	gang gi phyir gzugs kyis shes pa skye bar rung ba nyid ni snang ba las thob pa'i phyir snang ba dang 'brel pa yin no //	160a	gang gi phyir gzugs kyis shes ba skye ba rung ba nyid ni snang ba las thob ba phyir snang ba dang brel ba yin no 
BO_T11_D4229:160a-19	dbang po rung ba bskyed pa'i mtshan nyid kyi 'brel pa yod pa yin te /	160a	dbang po rung ba skyed ba mtshan nyid kyi brel ba yod ba yin te 
BO_T11_D4229:160a-20	yul la shes pa skyed par rung ba nyid snang ba las thob pa de'i phyir dbang po nyid rang gi yul gyi shes pa skyed par byed pa snang ba dang 'brel pa yin no //	160a	yul la shes ba skyed ba rung ba nyid snang ba las thob ba de phyir dbang po nyid rang gi yul gyi shes ba skyed ba byed ba snang ba dang brel ba yin no 
BO_T11_D4229:160a-21	de'i phyir gzugs ni snang ba dang lhan cig tu dmigs pa nges pa yin no //	160a	de phyir gzugs ni snang ba dang lhan cig tu dmigs ba nges ba yin no 
BO_T11_D4229:160a-22	gtan tshigs bshad pa 'bras bu gzugs sam /	160a	gtan tshigs chad ba bras bu gzugs sam 
BO_T11_D4229:160a-23	smig rgyu snang ba 'khrul pa med pa'i phyir ro //	160a	smig rgyu snang ba khrul ba med ba phyir ro 
BO_T11_D4229:160b-0	'bras bu rgyu'i rjes su 'gro ba yod kyang me dang du ba dag la @160b lhan cig dmigs pa nges pa 'khrul par mthong ba ma yin nam zhe na /	160b	bras bu rgyu rjes su gro ba yod kyang me dang du ba dag la lhan cig dmigs ba nges ba khrul ba mthong ba ma yin nam zhe na 
BO_T11_D4229:160b-1	gzugs dang lhan cig gzung ba'i snang ba ni gdon mi za bar gzung bar bya ba yin gyi /	160b	gzugs dang lhan cig gzung ba snang ba ni don mi za ba gzung ba byed ba yin gyi 
BO_T11_D4229:160b-2	me dang du ba dag ni gdon mi za bar gzung bar bya ba ma yin no //	160b	me dang du ba dag ni don mi za ba gzung ba byed ba ma yin no 
BO_T11_D4229:160b-3	ci'i phyir zhe na /	160b	ci phyir zhe na 
BO_T11_D4229:160b-4	snang ba bar chad med pas zhes gsungs te /	160b	snang ba ba chad med ba zhes gsungs te 
BO_T11_D4229:160b-5	gzugs kyi shes pa skyed par rung ba ni bar du chod cing bar mtshams med pa'i snang ba med par mi 'gyur ba yin te /	160b	gzugs kyi shes ba skyed ba rung ba ni ba du chod cing ba mtshams med ba snang ba med ba mi gyur ba yin te 
BO_T11_D4229:160b-6	'di ltar bum pa ni snang ba mang po'i bar du zhugs par skye ba nyid yin na /	160b	di ltar bum ba ni snang ba mang po ba du jug ba skye ba nyid yin na 
BO_T11_D4229:160b-7	snang bas shes pa skyed par rung ba skyed pa yin te /	160b	snang ba shes ba skyed ba rung ba skyed ba yin te 
BO_T11_D4229:160b-8	snang bas khyab pa'i gzugs nyid mthong ba'i phyir ro //	160b	snang ba khyab ba gzugs nyid mthong ba phyir ro 
BO_T11_D4229:160b-9	gal te mig gis gzung bar bya ba'i rang bzhin ma yin na ni snang ba bar chad med pa nyid yin yang lhan cig spyod pa'i reg pa la sogs pa ltar gzung bar mi 'gyur na /	160b	gal te mig gis gzung ba byed ba rang bzhin ma yin na ni snang ba ba chad med ba nyid yin yang lhan cig spyod ba reg ba la sogs ba ltar gzung ba mi gyur na 
BO_T11_D4229:160b-10	gzung ba'i mtshan nyid kyi rang bzhin yin pa des na gzugs dang lhan cig gdon mi za bar gzung bar bya ba yin no ;	160b	gzung ba mtshan nyid kyi rang bzhin yin ba des na gzugs dang lhan cig don mi za ba gzung ba byed ba yin no 
BO_T11_D4229:160b-11	/ dmigs pa'i spyod yul du gyur pa dag las gcig 'dzin par nges par byed pa'i rgyu ni 'ga' yang yod pa ma yin no //	160b	dmigs ba spyod yul du gyur ba dag las gcig dzin ba nges ba byed ba rgyu ni ga yang yod ba ma yin no 
BO_T11_D4229:160b-12	de nyid kyi phyir dus mtshungs pa'i gzugs dang snang ba dag kho na gsal bar bya ba dang gsal bar byed pa'i dngos po yin no //	160b	de nyid kyi phyir dus mtshungs ba gzugs dang snang ba dag kho na gsal ba byed ba dang gsal ba byed ba dngos po yin no 
BO_T11_D4229:160b-13	de yang snang ba gzugs kyi rgyu las gzhan du 'thad pa ma yin pa de'i phyir rgyu'i dngos po rgyu mtshan du 'dod pa yin gyi /	160b	de yang snang ba gzugs kyi rgyu las gzhan du thad ba ma yin ba de phyir rgyu dngos po rgyu mtshan du dod ba yin gyi 
BO_T11_D4229:160b-14	rgyu dngos po nyid ni gsal bar byed pa'i ngo bo ma yin no //	160b	rgyu dngos po nyid ni gsal ba byed ba ngo bo ma yin no 
BO_T11_D4229:160b-15	de bzhin du gzugs kyi yul na gnas pa nyid kyi snang ba ni mig dang rang gi rgyun skyed par byed pa /	160b	de bzhin du gzugs kyi yul na gnas ba nyid kyi snang ba ni mig dang rang gi rgyun skyed ba byed ba 
BO_T11_D4229:160b-16	de las kyang gzugs snang ba dang bar chad med pa de'i phyir snang ba dang yul lhan cig tu mthong ba nyid do //	160b	de las kyang gzugs snang ba dang ba chad med ba de phyir snang ba dang yul lhan cig tu mthong ba nyid do 
BO_T11_D4229:160b-17	snang ba'i rang bzhin du gyur pa nyid kyi me ni du ba'i skyed par byed pa ma yin pa des de dag la lhan cig dmigs pa nges pa med pa yin no //	160b	snang ba rang bzhin du gyur ba nyid kyi me ni du ba skyed ba byed ba ma yin ba des de dag la lhan cig dmigs ba nges ba med ba yin no 
BO_T11_D4229:160b-18	de ltar na yang gzugs dang snang ba dag ni shes pa gcig gi yul gyi dngos po la phan tshun 'brel pa yin gyi ;	160b	de ltar na yang gzugs dang snang ba dag ni shes ba gcig gi yul gyi dngos po la phan tshun brel ba yin gyi 
BO_T11_D4229:160b-19	shes pa dang shes bya dag ni de lta ma yin no //	160b	shes ba dang shes byed dag ni de lta ma yin no 
BO_T11_D4229:160b-20	yang na gzugs dang snang ba dag la ni lhan cig dmigs pa nges pa yod pa ma yin te /	160b	yang na gzugs dang snang ba dag la ni lhan cig dmigs ba nges ba yod ba ma yin te 
BO_T11_D4229:161a-0	gzugs dang bral ba'i snang ba 'ba' zhig kyang mthong ba'i phyir dang / snang ba med pa'i gzugs kyang byi ba la sogs pa'i srog chags kyi bye brag 'ga' @161a * //	161a	gzugs dang bral ba snang ba ba jig kyang mthong ba phyir dang snang ba med ba gzugs kyang byi ba la sogs ba srog chags kyi bye brag ga 
BO_T11_D4229:161a-1	zhig gis mthong pa'i phyir ro //	161a	jig gis mthong ba phyir ro 
BO_T11_D4229:161a-2	sngon bo'i dam ba dang rig pa dag ni lhan cig dmigs pa nges pa nyid do //	161a	sngon bo dam ba dang rig ba dag ni lhan cig dmigs ba nges ba nyid do 
BO_T11_D4229:161a-3	rang bzhin tha dad pa ste bral ba la ni de rigs pa ma yin te /	161a	rang bzhin tha dad ba ste bral ba la ni de rigs ba ma yin te 
BO_T11_D4229:161a-4	sngon po dang ser po dag bzhin no //	161a	sngon po dang ser po dag bzhin no 
BO_T11_D4229:161a-5	gang gi phyir de dag ni phan tshun tha dad pa dang 'brel pa yang 'ga' yang med de /	161a	gang gi phyir de dag ni phan tshun tha dad ba dang brel ba yang ga yang med de 
BO_T11_D4229:161a-6	des na lhan cig dmigs pa nges pa ma yin no //	161a	des na lhan cig dmigs ba nges ba ma yin no 
BO_T11_D4229:161a-7	shes pa dang shes bya dmigs pa gcig nyid do zhes ji ltar brjod de /	161a	shes ba dang shes byed dmigs ba gcig nyid do zhes ji ltar rjod de 
BO_T11_D4229:161a-8	gang gi phyir yul ni sngar dmigs te shes pa'i rgyu yin pas de ni sngar nye ba'i phyir ro //	161a	gang gi phyir yul ni sngar dmigs te shes ba rgyu yin ba de ni sngar nye ba phyir ro 
BO_T11_D4229:161a-9	de'i 'bras bu shes pa ni phyis nye ba yin la /	161a	de bras bu shes ba ni byid nye ba yin la 
BO_T11_D4229:161a-10	nye ba de'i 'bras bur gyur pa'i 'dzin pa'i gzhan skye pa des na ;	161a	nye ba de bras bur gyur ba dzin ba gzhan skye ba des na 
BO_T11_D4229:161a-11	yul gyi shes pa ni rang gi 'bras bu'i dus na dmigs la /	161a	yul gyi shes ba ni rang gi bras bu dus na dmigs la 
BO_T11_D4229:161a-12	yul ni rang gi 'bras bu shes pa'i dus na yin no //	161a	yul ni rang gi bras bu shes ba dus na yin no 
BO_T11_D4229:161a-13	dus tha dad na yang myong ba tha dad par nges par 'gyur te /	161a	dus tha dad na yang myong ba tha dad ba nges ba gyur te 
BO_T11_D4229:161a-14	dus tha dad pa yang dngos po tha dad pa'i rgyu mtshan yin pa'i phyir ro //	161a	dus tha dad ba yang dngos po tha dad ba rgyu mtshan yin ba phyir ro 
