segmentnr	original	stemmed
BO_T13_D4312-3:286b-35	til mar la sogs pa gang yang rung ba'i cha gsum dang btung ba de nyi tshe sbyar la /	til mar la sogs ba gang yang rung ba cha gsum dang thung ba de nyi tshe sbyor la 
BO_T13_D4312-3:286b-36	tshad dang ldan par byas te /	tshad dang ldan ba byed te 
BO_T13_D4312-3:286b-37	'o ma la sogs pa gang yang rung ba dang / nad gzhi ji lta ba la blud par bya ba'am /	mang ma la sogs ba gang yang rung ba dang nad gzhi ji lta ba la blud ba byed ba 
BO_T13_D4312-3:286b-38	yang sgog skya'i khu ba 'ba' zhig blud pa la sogs pas kyang mid pa'i sbubs dag bar byed do //	yang sgog skya khu ba ba jig blud ba la sogs ba kyang mid ba sbub dag ba byed do 
BO_T13_D4312-3:287a-0	rgyun du blugs pa'i dugs @287a * //	rgyun du blugs ba dugs 
BO_T13_D4312-3:287a-1	byas na // na zhing zug pa dag la phan //	byed na na zhing zug ba dag la phan 
BO_T13_D4312-3:287a-2	zhes bya ba la /	zhes byed ba la 
BO_T13_D4312-3:287a-3	sgog skya rang gi khu ba rgyun du blugs pa'i dugs byas na na zhing zug pa la sogs pa'i nad sel bar byed do //	sgog skya rang gi khu ba rgyun du blugs ba dugs byed na na zhing zug ba la sogs ba nad sel ba byed do 
BO_T13_D4312-3:287a-4	skyug cing brgyal ba'i nad la ni //	skyug cing brgyal ba nad la ni 
BO_T13_D4312-3:287a-5	'phral du chu grang dag kyang blud //	phral du chu grang dag kyang blud 
BO_T13_D4312-3:287a-6	ces bya ba la /	ces byed ba la 
BO_T13_D4312-3:287a-7	skyug pa la sogs pa la ni 'phral du chu grang la sogs pa blud par bya'o //	skyug ba la sogs ba la ni phral du chu grang la sogs ba blud ba byed 
BO_T13_D4312-3:287a-8	ngal ba med cing lus kyi ni //	ngal ba med cing lus kyi ni 
BO_T13_D4312-3:287a-9	gzi mdangs brtan pas lhag ma sbyin //	gzi mdangs brtan ba lhag ma sbyin 
BO_T13_D4312-3:287a-10	zhes bya ba la /	zhes byed ba la 
BO_T13_D4312-3:287a-11	ngal ba la sogs pa la ni sgog skya btsir ba'i lhag ma sbyin par bya'o //	ngal ba la sogs ba la ni sgog skya btsir ba lhag ma sbyin ba byed 
BO_T13_D4312-3:287a-12	tsha ba bsal bar bya ba'i phyir //	tsha ba bsal ba byed ba phyir 
BO_T13_D4312-3:287a-13	shin tu bsil bas bsku bya zhing //	shin tu bsil ba skud byed zhing 
BO_T13_D4312-3:287a-14	mu tig ga bur phreng ba can //	mu tig ga bur phreng ba can 
BO_T13_D4312-3:287a-15	chu thigs phre'u bsten par bya //	chu thigs phreu sten ba byed 
BO_T13_D4312-3:287a-16	zhes bya ba la /	zhes byed ba la 
BO_T13_D4312-3:287a-17	lus tsha ba bsal ba'i phyir ni sgog skya'i khu ba bsil sman la sogs pa'i chu dang bcas pa blud par bya'o //	lus tsha ba bsal ba phyir ni sgog skya khu ba bsil sman la sogs ba chu dang cha ba blud ba byed 
BO_T13_D4312-3:287a-18	'di yi tshad chen phul gang ste //	di yi tshad chen bul gang ste 
BO_T13_D4312-3:287a-19	nyi tshe la ni de yi phyed //	nyi tshe la ni de yi phyed 
BO_T13_D4312-3:287a-20	ces bya ba la /	ces byed ba la 
BO_T13_D4312-3:287a-21	sgog skya 'di'i khu ba'i tshad chen po ni phul gang ste /	sgog skya di khu ba tshad chen po ni bul gang ste 
BO_T13_D4312-3:287a-22	srang brgyad yin la /	srang brgyad yin la 
BO_T13_D4312-3:287a-23	sman gyi sbyor ba gzhan med pa ni srang bzhi ste bsten par bya'o //	sman gyi sbyor ba gzhan med ba ni srang bzhi ste sten ba byed 
BO_T13_D4312-3:287a-24	sgog skya srang gcig btags pa ni //	sgog skya srang gcig dogs ba ni 
BO_T13_D4312-3:287a-25	zas dang bcas pa'ang bsten par bya //	zas dang cha ba sten ba byed 
BO_T13_D4312-3:287a-26	zhes bya ba la /	zhes byed ba la 
BO_T13_D4312-3:287a-27	sgog skya btags pa srang gcig zas dang bcas pa bsten par bya la /	sgog skya dogs ba srang gcig zas dang cha ba sten ba byed la 
BO_T13_D4312-3:287a-28	'ang zhes bya ba'i sgras ni zas med par yang bsten pa'i don to //	mang zhes byed ba sgras ni zas med ba yang sten ba don to 
BO_T13_D4312-3:287a-29	zhu nas s'a lu rnying pa'i chan //	ju nas sa lu rnying ba chan 
BO_T13_D4312-3:287a-30	dung dang kun da ltar dkar ba //	dung dang kun da ltar dkar ba 
BO_T13_D4312-3:287a-31	yu sha 'o ma skam sa yi //	yu sha mang ma skam sa yi 
BO_T13_D4312-3:287a-32	sha khu dang ni lhan cig bza' //	sha khu dang ni lhan cig bza 
BO_T13_D4312-3:287a-33	zhes bya ba la /	zhes byed ba la 
BO_T13_D4312-3:287a-34	sman de zhu nas 'bras s'a lu rnying pa'i chan la sogs pa bza' bar bya'o //	sman de ju nas bras sa lu rnying ba chan la sogs ba bza ba byed 
BO_T13_D4312-3:287a-35	skom par gyur na chang dang ni //	skom ba gyur na chang dang ni 
BO_T13_D4312-3:287a-36	chur sbyar ba ni blud par bya //	chur(d) sbyor ba ni blud ba byed 
BO_T13_D4312-3:287a-37	chang mi btung na rang skyur ram //	chang mi thung na rang skyur ram 
BO_T13_D4312-3:287a-38	rgun 'bru'i chu ni blud par bya //	rgun bru chu ni blud ba byed 
BO_T13_D4312-3:287a-39	zhes bya ba la /	zhes byed ba la 
BO_T13_D4312-3:287a-40	gal te gnas skabs der skom par gyur na /	gal te gnas skabs der skom ba gyur na 
BO_T13_D4312-3:287a-41	chang chur sbyar ba btung bar bya la /	chang chur(d) sbyor ba thung ba byed la 
BO_T13_D4312-3:287a-42	chang spangs pa yin na ni rgun 'bru'i chu 'am rang skyur blud par bya'o //	chang spong ba yin na ni rgun bru chu mang rang skyur blud ba byed 
BO_T13_D4312-3:287a-43	de yi lde gu mar dang bcas //	de yi lde gu mar dang cha 
BO_T13_D4312-3:287a-44	mar ni snod du gzar bus dkrug / zhag bcu gzhag gam de bzhin du //	mar ni snod du gzar bud dkrug zhag chu jog gam de bzhin du 
BO_T13_D4312-3:287a-45	zhag dang mnyam sbyar spyad par bya //	zhag dang mnyam sbyor spyod ba byed 
BO_T13_D4312-3:287a-46	zhes bya ba la /	zhes byed ba la 
BO_T13_D4312-3:287a-47	sgog skya de'i lde gu mar dang bcas pa ji skad smos pa'i sbyor bas spyad par bya'o //	sgog skya de lde gu mar dang cha ba ji skad smos ba sbyor ba spyod ba byed 
BO_T13_D4312-3:287b-0	sgog skya shun pa bshus @287b pa'i snying po ni //	sgog skya shun ba bshus ba snying po ni 
BO_T13_D4312-3:287b-1	sreg sha dag gam bza' ba sna tshogs sam //	sreg sha dag gam bza ba sna tshogs sam 
BO_T13_D4312-3:287b-2	sha gtubs pa'am mar dang tshar bcas bza' //	sha gtub ba mar dang tshar cha bza 
BO_T13_D4312-3:287b-3	kha zas nyung ba ci 'dod spyad par bya //	kha zas nyung ba ci dod spyod ba byed 
BO_T13_D4312-3:287b-4	zhes bya ba la /	zhes byed ba la 
BO_T13_D4312-3:287b-5	yang sgog skya shun pa bshus pa de sreg sha la sogs pa gang yang rung ba dang lhan cig bza' zhing 'dod par longs spyad par bya'o //	yang sgog skya shun ba bshus ba de sreg sha la sogs ba gang yang rung ba dang lhan cig bza zhing dod ba longs spyod ba byed 
BO_T13_D4312-3:287b-6	khrag dang mkhris pa'i nad ni ma gtogs pa //	khrag dang mkhris ba nad ni ma gtogs ba 
BO_T13_D4312-3:287b-7	nad gzhi ma lus ldan par 'gyur ba 'am //	nad gzhi ma lus ldan ba gyur ba mang 
BO_T13_D4312-3:287b-8	rlung nad nyi tshe dang ni ldan gyur la //	rlung nad nyi tshe dang ni ldan gyur la 
BO_T13_D4312-3:287b-9	sgog pa las lhag sman gzhan yod ma yin //	sgog ba las lhag sman gzhan yod ma yin 
BO_T13_D4312-3:287b-10	zhes bya ba la /	zhes byed ba la 
BO_T13_D4312-3:287b-11	khrag dang mkhris pa med pa'i rlung nad dam //	khrag dang mkhris ba med ba rlung nad dam 
BO_T13_D4312-3:287b-12	yang na rlung nad 'ba' zhig la ni sman gyi mchog sgog skya 'ba' zhig yin no //	yang na rlung nad ba jig la ni sman gyi mchog sgog skya ba jig yin no 
BO_T13_D4312-3:287b-13	chu dang bu ram 'o ma sred //	chu dang bu ram mang ma sred 
BO_T13_D4312-3:287b-14	sha chang skyur la mi dga' zhing //	sha chang skyur la mi dga zhing 
BO_T13_D4312-3:287b-15	ma zhu ba ni spong mi nus //	ma ju ba ni spong mi nus 
BO_T13_D4312-3:287b-16	sgog skya nges par gnod pa skyed //	sgog skya nges ba gnod ba skyed 
BO_T13_D4312-3:287b-17	ces bya ba la /	ces byed ba la 
BO_T13_D4312-3:287b-18	mi chu dang bu ram la sred par gyur cing sha dang chang dang skyur la ni sred pa med par gyur pa dag ma zhu ba'i nad sel zhing spong bar mi nus pa dag la ni sgog skya nges par gnod pa skyed par 'gyur ro //	mi chu dang bu ram la sred ba gyur cing sha dang chang dang skyur la ni sred ba med ba gyur ba dag ma ju ba nad sel zhing spong ba mi nus ba dag la ni sgog skya nges ba gnod ba skyed ba gyur ro 
BO_T13_D4312-3:287b-19	mkhris pa ldang ba'i 'jigs pa yi //	mkhris ba ldang ba jigs ba yi 
BO_T13_D4312-3:287b-20	tha mar bkru sman 'jam po gtang //	tha mar khrud sman jam po gtong 
BO_T13_D4312-3:287b-21	de ltar bcud len yon tan ni //	de ltar bcud len yon tan ni 
BO_T13_D4312-3:287b-22	yongs su rdzogs pa thob par 'gyur //	yongs su rdzogs ba thob ba gyur 
BO_T13_D4312-3:287b-23	zhes bya ba la /	zhes byed ba la 
BO_T13_D4312-3:287b-24	sgog skya bsten pa dag gis mkhris pa'i nad ldang bar dogs na /	sgog skya sten ba dag gis mkhris ba nad ldang ba dogs na 
BO_T13_D4312-3:287b-25	sman btang ba'i tha mar bkru sman gtang bar bya ste /	sman gtong ba tha mar khrud sman gtong ba byed ste 
BO_T13_D4312-3:287b-26	des ni bcud kyis len gyi yon tan rdzogs pa kho nar 'gyur ro //	des ni bcud kyis len gyi yon tan rdzogs ba kho nar gyur ro 
BO_T13_D4312-3:287b-27	so ga'i tsha bas gdungs drags las //	so ga tsha ba gdung drag las 
BO_T13_D4312-3:287b-28	rgya skyegs khu ba ltar 'dzag gang //	rgya skyegs khu ba ltar dzag gang 
BO_T13_D4312-3:287b-29	gser sogs 'byung khungs drug gi bcud //	gser sogs byung khungs drug gi bcud 
BO_T13_D4312-3:287b-30	de ni brag zhun zhes byar bshad //	de ni brag zhun zhes byar chad 
BO_T13_D4312-3:287b-31	ces bya ba la /	ces byed ba la 
BO_T13_D4312-3:287b-32	so ga'i dus su brag nyi ma tsha bas gdungs pa las gser la sogs pa 'byung khungs kyi khams drug gi bcud rgya skyegs kyi khu ba zhu ba ltar 'dzag par gyur pa gang yin pa de ni ming brag zhun zhes bya'o //	so ga dus su brag nyi ma tsha ba gdung ba las gser la sogs ba byung khungs kyi khams drug gi bcud rgya skyegs kyi khu ba ju ba ltar dzag ba gyur ba gang yin ba de ni ming brag zhun zhes byed 
BO_T13_D4312-3:287b-33	de ni kun kyang kha zhing tsha //	de ni kun kyang kha zhing tsha 
BO_T13_D4312-3:287b-34	shas cher me drod zhu rjes tsha //	shas cher me drod ju rjes tsha 
BO_T13_D4312-3:287b-35	gcod par byed de de la ni //	gcod ba byed de de la ni 
BO_T13_D4312-3:287b-36	lcags las byung ba rab tu bsngags //	lcags las byung ba rab tu bsngags 
BO_T13_D4312-3:287b-37	zhes bya ba la /	zhes byed ba la 
BO_T13_D4312-3:287b-38	brag zhun de thams cad kyang ro ni kha la nus pa ni shin tu dro ba ma yin la zhu rjes ni tsha ba dang gcod par byed pa yin te /	brag zhun de thams cad kyang ro ni kha la nus ba ni shin tu dro ba ma yin la ju rjes ni tsha ba dang gcod ba byed ba yin te 
BO_T13_D4312-3:288a-0	de dag la lcags kyi @288a * //	de dag la lcags kyi 
BO_T13_D4312-3:288a-1	khams las byung ba ni shin tu yang bsngags pa yin no //	khams las byung ba ni shin tu yang bsngags ba yin no 
BO_T13_D4312-3:288a-2	ba gcin dri bro gnag pa dang // gu gul 'dra zhing gseg ma med //	ba gcin dri bro gnag ba dang gu gul dra zhing gseg ma med 
BO_T13_D4312-3:288a-3	sbyin bag snum zhing skyur ba dang // bska zhing 'jam la lci ba yi //	sbyin bag snum zhing skyur ba dang bska zhing jam la lci ba yi 
BO_T13_D4312-3:288a-4	brag zhun de ni mchog yin no //	brag zhun de ni mchog yin no 
BO_T13_D4312-3:288a-5	zhes bya ba la /	zhes byed ba la 
BO_T13_D4312-3:288a-6	brag zhun gang dri ni ba gcin dang 'dra la /	brag zhun gang dri ni ba gcin dang dra la 
BO_T13_D4312-3:288a-7	kha dog ni gnag pa mtshan nyid gu gul 'dra zhing rdo phye'i gseg ma med pa mnyes na spyin bag tu 'dug cing snum pa ro skyur zhing bska ba rang bzhin 'jam zhing lci bas de ni brag zhun kyi dam pa yin no //	kha dog ni gnag ba mtshan nyid gu gul dra zhing rdo byed gseg ma med ba mnyes na spyin bag tu dug cing snum ba ro skyur zhing bska ba rang bzhin jam zhing lci ba de ni brag zhun kyi dam ba yin no 
BO_T13_D4312-3:288a-8	nad dang nad pa rjes mthun par //	nad dang nad ba rjes mthun ba 
BO_T13_D4312-3:288a-9	sman dang brag zhun cha mnyam byas //	sman dang brag zhun cha mnyam byed 
BO_T13_D4312-3:288a-10	lcags kyi snod du sbyar bar bya //	lcags kyi snod du sbyor ba byed 
BO_T13_D4312-3:288a-11	zhes bya ba la /	zhes byed ba la 
BO_T13_D4312-3:288a-12	brag zhun de nad pa dang nad pa'i goms pa'i tshul gang dag yin pa shes par byas la lcags kyi snod du sbyar bar bya'o //	brag zhun de nad ba dang nad ba goms ba tshul gang dag yin ba shes ba byed la lcags kyi snod du sbyor ba byed 
BO_T13_D4312-3:288a-13	dang por chu ni nyi tshes bkru //	dang por chu ni nyi tshes khrud 
BO_T13_D4312-3:288a-14	de 'og bskams la bskol dang bsre //	de g skem la skol dang bsre 
BO_T13_D4312-3:288a-15	zhes bya ba la /	zhes byed ba la 
BO_T13_D4312-3:288a-16	brag zhun de dang por ni chu 'ba' zhig gis bkrus la /	brag zhun de dang por ni chu ba jig gis khrud la 
BO_T13_D4312-3:288a-17	de'i 'og tu bskams te bskol ba dang bsre bar bya'o //	de g tu skem te skol ba dang bsre ba byed 
BO_T13_D4312-3:288a-18	brag zhun sman dang mnyam byas la //	brag zhun sman dang mnyam byed la 
BO_T13_D4312-3:288a-19	brgyad cha'i nang du bskol bar bya //	brgyad cha nang du skol ba byed 
BO_T13_D4312-3:288a-20	zhes bya ba la /	zhes byed ba la 
BO_T13_D4312-3:288a-21	bsres pa'i brag zhun gyi 'phrod kyi sman dang brag zhun cha mnyam par byas la chu de'i brgyad 'gyur gyi nang du bskol bar bya'o //	bsres ba brag zhun gyi phrod kyi sman dang brag zhun cha mnyam ba byed la chu de brgyad gyur gyi nang du skol ba byed 
BO_T13_D4312-3:288a-22	de la gal te brag zhun srang gcig dang sbyar na de'i 'phrod kyi sman yang srang gcig la sbyar la de chu brgyad 'gyur dang bskol bar bya'o //	de la gal te brag zhun srang gcig dang sbyor na de phrod kyi sman yang srang gcig la sbyor la de chu brgyad gyur dang skol ba byed 
BO_T13_D4312-3:288a-23	khu ba brgyad cha lus btsags pa //	khu ba brgyad cha lus btsags ba 
BO_T13_D4312-3:288a-24	dro 'jam nang du brag zhun gzhug / ces bya ba la /	dro jam nang du brag zhun jug ces byed ba la 
BO_T13_D4312-3:288a-25	khu ba bskol ba de brgyad cha lus pa dang btsags pa dro 'jam tsam gyi nang du brag zhun gzhug par bya'o //	khu ba skol ba de brgyad cha lus ba dang btsags ba dro jam tsam gyi nang du brag zhun jug ba byed 
BO_T13_D4312-3:288a-26	de dang 'dres gyur bskams nas ni //	de dang dre gyur skem nas ni 
BO_T13_D4312-3:288a-27	sman chu'i nang du slar yang gzhug / ces bya ba la /	sman chu nang du slar yang jug ces byed ba la 
BO_T13_D4312-3:288a-28	brag zhun 'dres par gyur te de bskams nas slar yang gzhug par bya'o //	brag zhun dre ba gyur te de skem nas slar yang jug ba byed 
BO_T13_D4312-3:288a-29	de ltar rang rang sman 'phrod ni //	de ltar rang rang sman phrod ni 
BO_T13_D4312-3:288a-30	bskol ba'i khu bar lan bdun spangs //	skol ba khu ba lan bdun spong 
BO_T13_D4312-3:288a-31	zhes bya ba la /	zhes byed ba la 
BO_T13_D4312-3:288a-32	tshul de ltar rang gi sman 'phrod pa'i khu ba dang lan bdun gyi bar du spangs shing bsre bar bya'o //	tshul de ltar rang gi sman phrod ba khu ba dang lan bdun gyi ba du spong shing bsre ba byed 
BO_T13_D4312-3:288a-33	de nas tig ta'i sman mar gyis //	de nas tig ta sman mar gyis 
BO_T13_D4312-3:288a-34	snum chos byas nas sbyar byas te //	snum chos byed nas sbyor byed te 
BO_T13_D4312-3:288b-0	'bras bu gsum gyi khu ba dang // @288b shing mngar pa to la'i khu ba //	bras bu gsum gyi khu ba dang shing mngar ba to la khu ba 
BO_T13_D4312-3:288b-1	brag zhun dag ni re re yang //	brag zhun dag ni re re yang 
BO_T13_D4312-3:288b-2	zhag gsum bar du blud par bya //	zhag gsum ba du blud ba byed 
BO_T13_D4312-3:288b-3	zhes bya ba la /	zhes byed ba la 
BO_T13_D4312-3:288b-4	de nas de ltar snum chos byas pa'i mi de la tig ta'i sman mar zhag gsum gyi bar du sbyin par bya'o //	de nas de ltar snum chos byed ba mi de la tig ta sman mar zhag gsum gyi ba du sbyin ba byed 
BO_T13_D4312-3:288b-5	de bzhin du brag zhun dang / 'bras bu gsum gyi khu ba dang / shing mngar gyi khu ba dang / pa to la'i khu ba zhag gsum gyi bar du blud par bya'o //	de bzhin du brag zhun dang bras bu gsum gyi khu ba dang shing mngar gyi khu ba dang ba to la khu ba zhag gsum gyi ba du blud ba byed 
BO_T13_D4312-3:288b-6	de nas de la sbyor ba ni //	de nas de la sbyor ba ni 
BO_T13_D4312-3:288b-7	dus dang sbyar te blud par bya //	dus dang sbyor te blud ba byed 
BO_T13_D4312-3:288b-8	zhes bya ba la /	zhes byed ba la 
BO_T13_D4312-3:288b-9	de nas mi de la 'tshams shing 'os pa'i sbyor ba dus dang sbyar te sman bas blud par bya'o //	de nas mi de la tshams shing s ba sbyor ba dus dang sbyor te sman ba blud ba byed 
BO_T13_D4312-3:288b-10	de ltar brag zhun mi rnams la ;	de ltar brag zhun mi rnams la 
BO_T13_D4312-3:288b-11	shin tu phan par byed pa yin //	shin tu phan ba byed ba yin 
BO_T13_D4312-3:288b-12	yon tan ma lus skyed byed cing //	yon tan ma lus skyed byed cing 
BO_T13_D4312-3:288b-13	'phral du gnod par mi byed do //	phral du gnod ba mi byed do 
BO_T13_D4312-3:288b-14	zhes bya ba la /	zhes byed ba la 
BO_T13_D4312-3:288b-15	tshul de ltar brag zhun bsten zhing goms par byed pa dag ni shin tu phan par byed pa yin la /	tshul de ltar brag zhun sten zhing goms ba byed ba dag ni shin tu phan ba byed ba yin la 
BO_T13_D4312-3:288b-16	de bzhin du bcud kyis len gyi yon tan ma lus pa yang skyed par byed la /	de bzhin du bcud kyis len gyi yon tan ma lus ba yang skyed ba byed la 
BO_T13_D4312-3:288b-17	'phral du de'i mod la gnod pa yang skyed par mi byed pa yin no //	phral du de mod la gnod ba yang skyed ba mi byed ba yin no 
BO_T13_D4312-3:288b-18	zhag bdun phrag gcig phrag gsum dang // phrag bdun zho gnyis srang phyed gcig / dman dang bar ma chen po yi //	zhag bdun phrag gcig phrag gsum dang phrag bdun zho gnyis srang phyed gcig dman dang ba ma chen po yi 
BO_T13_D4312-3:288b-19	brag zhun go rims bzhin du sbyar //	brag zhun go rims bzhin du sbyor 
BO_T13_D4312-3:288b-20	zhes bya ba la /	zhes byed ba la 
BO_T13_D4312-3:288b-21	brag zhun zhag bdun phrag gcig dang / tshad zho gnyis ni dman pa'i tshad yin no //	brag zhun zhag bdun phrag gcig dang tshad zho gnyis ni dman ba tshad yin no 
BO_T13_D4312-3:288b-22	zhag bdun phrag bdun dang srang gcig ni phyed tshad yin no //	zhag bdun phrag bdun dang srang gcig ni phyed tshad yin no 
BO_T13_D4312-3:288b-23	lus ni shin tu sbyangs byas la //	lus ni shin tu sbyong byed la 
BO_T13_D4312-3:288b-24	brag zhun sbyangs pa gtang bar bya //	brag zhun sbyong ba gtong ba byed 
BO_T13_D4312-3:288b-25	zangs dang lcags dang dngul dang gser //	zangs dang lcags dang dngul dang gser 
BO_T13_D4312-3:288b-26	kun dang yang na re rer sbyar //	kun dang yang na re rer sbyor 
BO_T13_D4312-3:288b-27	'o ma dang ni lhan cig gtang //	mang ma dang ni lhan cig gtong 
BO_T13_D4312-3:288b-28	bcud len 'bras bu myur du 'grub //	bcud len bras bu myur du grub 
BO_T13_D4312-3:288b-29	ces bya ba la /	ces byed ba la 
BO_T13_D4312-3:288b-30	brag zhun ni lus shin tu sbyangs par gyur pa la brag zhun legs par sbyangs shing btul ba gtang bar bya la /	brag zhun ni lus shin tu sbyong ba gyur ba la brag zhun legs ba sbyong shing dul ba gtong ba byed la 
BO_T13_D4312-3:288b-31	de bzhin du zangs la sogs pa sna re 'am /	de bzhin du zangs la sogs ba sna re mang 
BO_T13_D4312-3:288b-32	kun dang yang sbyar bar bya zhing 'o ma dang lhan cig btang na bcud kyis len gyi 'bras bu gang dag yin pa 'grub par 'gyur ro //	kun dang yang sbyor ba byed zhing mang ma dang lhan cig gtong na bcud kyis len gyi bras bu gang dag yin ba grub ba gyur ro 
BO_T13_D4312-3:288b-33	rgya sran mon sne'u dme ru dang // phug ron sha ni rtag tu spang //	rgya sran mon sneu dme ru dang bugs ron sha ni rtag tu spong 
BO_T13_D4312-3:288b-34	zhes bya ba la /	zhes byed ba la 
BO_T13_D4312-3:288b-35	brag zhun gyi sbyor ba bsten pa'i dus su rgya sran la sogs pa rtag tu spang bar bya'o //	brag zhun gyi sbyor ba sten ba dus su rgya sran la sogs ba rtag tu spong ba byed 
BO_T13_D4312-3:288b-36	gang zhig brag zhun gyis ni mngon sum du //	gang jig brag zhun gyis ni mngon sum du 
BO_T13_D4312-3:289a-0	@289a * // ma bsal nad ni sa steng yod ma yin //	ma bsal nad ni sa steng yod ma yin 
BO_T13_D4312-3:289a-1	dus su cho ga bzhin du bsten gyur na //	dus su cho ga bzhin du sten gyur na 
BO_T13_D4312-3:289a-2	nad med nyams stobs rgya chen skyed par byed //	nad med nyams stobs rgya chen skyed ba byed 
BO_T13_D4312-3:289a-3	ces bya ba la /	ces byed ba la 
BO_T13_D4312-3:289a-4	mi yul sa steng 'di na brag zhun gyi sman gyis mngon du ma bcom pa'i nad ni yod pa ma yin la /	mi yul sa steng di na brag zhun gyi sman gyis mngon du ma joms ba nad ni yod ba ma yin la 
BO_T13_D4312-3:289a-5	de bzhin du de'i cho ga bzhin du bsten na nad med pa la sogs pa'i yon tan skyed par byed do //	de bzhin du de cho ga bzhin du sten na nad med ba la sogs ba yon tan skyed ba byed do 
BO_T13_D4312-3:289a-6	khang par gnas pa'i khom ldan can //	khang ba gnas ba khom ldan can 
BO_T13_D4312-3:289a-7	phun sum tshogs dang ldan la phan //	phun sum tshogs dang ldan la phan 
BO_T13_D4312-3:289a-8	de las gzhan du de rnams la //	de las gzhan du de rnams la 
BO_T13_D4312-3:289a-9	nyi ma rlung gi tshe na bsten //	nyi ma rlung gi tshe na sten 
BO_T13_D4312-3:289a-10	zhes bya ba la /	zhes byed ba la 
BO_T13_D4312-3:289a-11	khang par gnas pa la sogs pa khom ldan yod cing 'khor dang yo byad phun sum tshogs pa dang ldan pa la ni phan par gyur pa yin la /	khang ba gnas ba la sogs ba khom ldan yod cing khor dang yo byad phun sum tshogs ba dang ldan ba la ni phan ba gyur ba yin la 
BO_T13_D4312-3:289a-12	de las gzhan pa ste /	de las gzhan ba ste 
BO_T13_D4312-3:289a-13	khang par gnas pa la sogs pa'i khom ldan med pa la ni nyi ma dang rlung la gnas pa'i tshul gyis bsten na phan par 'gyur ro //	khang ba gnas ba la sogs ba khom ldan med ba la ni nyi ma dang rlung la gnas ba tshul gyis sten na phan ba gyur ro 
BO_T13_D4312-3:289a-14	rlung dang nyi tshan bcas sbyor ba //	rlung dang nyi tshan cha sbyor ba 
BO_T13_D4312-3:289a-15	bde ba'i longs spyod med na yang //	bde ba longs spyod med na yang 
BO_T13_D4312-3:289a-16	gang zhig lus la mi gnod pa //	gang jig lus la mi gnod ba 
BO_T13_D4312-3:289a-17	mchog tu de ni bshad par bya //	mchog tu de ni chad ba byed 
BO_T13_D4312-3:289a-18	zhes bya ba la /	zhes byed ba la 
BO_T13_D4312-3:289a-19	da ni rlung dang nyi tshan dang bcas par yang bsten du rung ba'i sbyor ba bde ba'i longs spyod las nyams su zin kyang lus la gnod par mi 'gyur ba'i spyor ba'i mchog de bshad par bya'o //	da ni rlung dang nyi tshan dang cha ba yang sten du rung ba sbyor ba bde ba longs spyod las nyams su zin kyang lus la gnod ba mi gyur ba spyor ba mchog de chad ba byed 
BO_T13_D4312-3:289a-20	chu grang 'o ma sbrang rtsi dang // mar ni re re gnyis gnyis dang // gsum mam yang na thams cad dang // zas sngar 'thungs na rgas sra byed //	chu grang mang ma sbrang rtsi dang mar ni re re gnyis gnyis dang gsum mam yang na thams cad dang zas sngar thung na rga sra byed 
BO_T13_D4312-3:289a-21	ces bya ba la /	ces byed ba la 
BO_T13_D4312-3:289a-22	chu grang la sogs pa re re 'am /	chu grang la sogs ba re re mang 
BO_T13_D4312-3:289a-23	gnyis gnyis sam /	gnyis gnyis sam 
BO_T13_D4312-3:289a-24	gsum mam / bzhi char kun zas kyi sngar 'thungs na yang rgas sra bar byed do //	gsum mam bzhi char kun zas kyi sngar thung na yang rga sra ba byed do 
BO_T13_D4312-3:289a-25	bu ram sbrang rtsi bca' sga dang // pi pi ling ngam rgyam tsha dang // aa ru ra ni gnyis gnyis dag / rtag zos bdo zhing lo brgyar 'tsho //	bu ram sbrang rtsi chos sga dang pi pi ling ngam rgyam tsha dang aa ru ra ni gnyis gnyis dag rtag zos bdo zhing lo brgyar tsho 
BO_T13_D4312-3:289a-26	zhes bya ba la /	zhes byed ba la 
BO_T13_D4312-3:289a-27	bu ram la sogs pa gang yang rung ba dang / aa ru ra gnyis gnyis rtag tu zos na yang mi de lo brgya'i bar du 'tsho bar 'gyur ro //	bu ram la sogs ba gang yang rung ba dang aa ru ra gnyis gnyis rtag tu zos na yang mi de lo brgya ba du tsho ba gyur ro 
BO_T13_D4312-3:289a-28	aa ru ra ni mar nang bsros //	aa ru ra ni mar nang bsros 
BO_T13_D4312-3:289a-29	bza' zhing mar de 'thungs na ni //	bza zhing mar de thung na ni 
BO_T13_D4312-3:289a-30	rgas sra lus ni yun ring gnas //	rga sra lus ni yun ring gnas 
BO_T13_D4312-3:289a-31	stobs ni 'phel bar byed 'gyur te //	stobs ni phel ba byed gyur te 
BO_T13_D4312-3:289a-32	ji ltar dam pa byas gzo ba //	ji ltar dam ba byed gzo ba 
BO_T13_D4312-3:289b-0	lan cig phan gdags ji lta @289b bzhin //	lan cig phan dogs ji lta bzhin 
BO_T13_D4312-3:289b-1	zhes bya ba la /	zhes byed ba la 
BO_T13_D4312-3:289b-2	aa ru ra mar gyi nang du bsros te bza' ba dang bsros pa'i mar de 'thungs par gyur na lus rgas sra ba la sogs par 'gyur ro //	aa ru ra mar gyi nang du bsros te bza ba dang bsros ba mar de thung ba gyur na lus rga sra ba la sogs ba gyur ro 
BO_T13_D4312-3:289b-3	ji ltar byas ba gzo ba'i mi la phan btags na de'i mi brjed par sems la 'jog pa dang 'dra'o //	ji ltar byed ba gzo ba mi la phan dogs na de mi brjed ba sems la jog ba dang dra 
BO_T13_D4312-3:289b-4	skyu ru ra'i khu sbrang rtsi dang // kha ra mar dang lde gur byas //	skyu ru ra khu sbrang rtsi dang kha ra mar dang lde gur byed 
BO_T13_D4312-3:289b-5	bsten zhing 'phrod pa za ba'i mi //	sten zhing phrod ba za ba mi 
BO_T13_D4312-3:289b-6	rga ba'i gnod pa 'jig 'gyur te //	rga ba gnod ba jig gyur te 
BO_T13_D4312-3:289b-7	nyes bsrung bstan bcos rgya chen mtshungs //	nyes bsrung ston chos rgya chen mtshungs 
BO_T13_D4312-3:289b-8	zhes bya ba la /	zhes byed ba la 
BO_T13_D4312-3:289b-9	skyu ru ra'i khu ba dang sbrang rtsi dang mar dang kha ra lde gur byas pa zos shing kha zas 'phrod pa la bsten pa'i mi rgas pa'i gnod pa gang yin pa de 'jig par 'gyur te /	skyu ru ra khu ba dang sbrang rtsi dang mar dang kha ra lde gur byed ba zos shing kha zas phrod ba la sten ba mi rga ba gnod ba gang yin ba de jig ba gyur te 
BO_T13_D4312-3:289b-10	ji ltar bstan bcos rgya chen po legs par bzung nas brjed du mi rung bar 'gyur ba dang mtshungs so //	ji ltar ston chos rgya chen po legs ba bzung nas brjed du mi rung ba gyur ba dang mtshungs so 
BO_T13_D4312-3:289b-11	skyu ru ra dang byi dang ga / aa sa na yi snying po phye //	skyu ru ra dang byi dang ga aa sa na yi snying po byed 
BO_T13_D4312-3:289b-12	lcags phye til mar sbrang rtsi yi //	lcags byed til mar sbrang rtsi yi 
BO_T13_D4312-3:289b-13	mar bcas lde gu bsten na ni //	mar cha lde gu sten na ni 
BO_T13_D4312-3:289b-14	na tshod mdzes pa ma nyams 'gyur //	na tshod mdzes ba ma nyams gyur 
BO_T13_D4312-3:289b-15	zhes bya ba la /	zhes byed ba la 
